original_poem,translated_poem,src_lang,tgt_lang
"84
 E jà no porto da ìnclita Ulisseia,(*)
Cum alvoroço nobre e cum desejo
(Onde o licor mistura e branca areia
Co salgado Neptuno o doce Tejo)
As naus prestes estão; e não refreia
Temor nenhum o juvenile despejo,
Porque a gente marìtima e a de Marte
Estão pera seguir-me a toda a parte.
 …
 88
 « A gente da cidade, aquele dia,
(Uns por amigos, outros por parentes,
Outros por ver sòmente) concorria,
Saüdosos na vista e descontentes.
E nòs, co a virtuosa companhia
De mil Religiosos diligentes,
Em procissão solene, a Deus orando,
Pera os batéis viemos caminhando.
 89
 « Em tão longo caminho e duvidoso
Por perdidos as gentes nos julgavam,
As mulheres cum choro piadoso,
Os homens com suspiros que arrancavam.
Mães, Esposas, Irmãs, que o temeroso
Amor mais desconfia, acrecentavam
A desesperação e frio medo
De já nos não tornar a ver tão cedo.
 90
 « Qual vai dizendo: — « Ó filho, a quem eu tinha
Só para refrigério e doce amparo
Desta cansada já velhice minha,
Que em choro acabará, penoso e amaro,
Por que me deixas, mísera e mesquinha?
Por que de mim te vás, ó filho caro,
A fazer o funéreo enterramento,
Onde sejas de peixes mantimento! » —
 91
 « Qual em cabelo: — « Ó doce e amado esposo,
Sem quem não quis Amor que viver possa,
Por que is aventurar ao mar iroso
Essa vida que é minha e não é vossa?
Como por um caminho duvidoso,
Vos esquece a afeição tão doce nossa?
Nosso amor, nosso vão contentamento,
Quereis que com as velas leve o vento?»
 92
 « Nestas e outras palavras que diziam,
De amor e de piedosa humanidade,
Os velhos e os meninos as seguiam,
Em quem menos esforço põe a idade.
Os montes de mais perto respondiam,
Quasi movidos de alta piedade;
A branca areia as lágrimas banhavam,
Que em multidão com elas se igualavam.
 93
 « Nós outros, sem a vista alevantarmos
Nem a mãe, nem a esposa, neste estado,
Por nos não magoarmos, ou mudarmos
Do propósito firme começado,
Determinei de assim nos embarcarmos,
Sem o despedimento costumado,
Que, posto que é de amor usança boa,
A quem se aparta, ou fica, mais magoa.
 94 (O Velho do Restelo)
 « Mas um velho, d'aspeito venerando,
Que ficava nas praias, entre a gente,
Postos em nós os olhos, meneando
Três vezes a cabeça, descontente,
A voz pesada um pouco alevantando,
Que nós no mar ouvimos claramente,
Cum saber só de experiências feito,
Tais palavras tirou do experto peito:
 95
 — « Ó glória de mandar, ó vã cobiça
Desta vaidade a quem chamamos Fama!
Ó fraudulento gosto, que se atiça
Cũa aura popular, que honra se chama!
Que castigo tamanho e que justiça
Fazes no peito vão que muito te ama!
Que mortes, que perigos, que tormentas,
Que crueldades neles experimentas!
 96
 — « Dura inquietação d'alma e da vida
Fonte de desamparos e adultérios,
Sagaz consumidora conhecida
De fazendas, de reinos e de impérios !
Chamam-te ilustre, chamam-te subida,
Sendo dina de infames vitupérios;
Chamam-te Fama e Glória soberana,
Nomes com quem se o povo néscio engana!
 97
 — « A que novos desastres determinas
De levar estes Reinos e esta gente?
Que perigos, que mortes lhe destinas,
Debaixo dalgum nome preminente?
Que promessas de reinos e de minas
D'ouro, que lhe farás tão fàcilmente?
Que famas lhe prometerás? Que histórias?
Que triunfos ? Que palmas ? Que vitórias?
 98
 — « Mas, ó tu, geração daquele insano
Cujo pecado e desobediência,
Não sòmente do reino soberano
Te pôs neste desterro e triste ausência,
Mas inda doutro estado mais que humano,
Da quieta e da simpres inocência,
Idade d'ouro, tanto te privou,
Que na de ferro e d'armas te deitou:
 99
 — « Já que nesta gostosa vaïdade
Tanto enlevas a leve fantasia,
Já que à bruta crueza e feridade
Puseste nome, esforço e valentia,
Já que prezas em tanta quantidade
O desprezo da vida, que devia
De ser sempre estimada, pois que já
Temeu tanto perdê-la Quem a dá:
 100
 — « Não tens junto contigo o Ismaelita,
Com quem sempre terás guerras sobejas?
Não segue ele do Arábio a lei maldita,
Se tu pela de Cristo só pelejas?
Não tem cidades mil, terra infinita,
Se terras e riqueza mais desejas?
Não é ele por armas esforçado,
Se queres por vitórias ser louvado?
 101
 — « Deixas criar às portas o inimigo,
Por ires buscar outro de tão longe,
Por quem se despovoe o Reino antigo,
Se enfraqueça e se vá deitando a longe;
Buscas o incerto e incógnito perigo
Por que a Fama te exalte e te lisonge
Chamando-te senhor, com larga cópia,
Da Índia, Pérsia, Arábia e de Etiópia?
 102
 — « Oh, maldito o primeiro que no mundo,
Nas ondas velas pôs em seco lenho!
Dino da eterna pena do profundo,
Se é justa a justa lei que sigo e tenho!
Nunca juízo algum, alto e profundo,
Nem cítara sonora ou vivo engenho
Te dê por isso fama nem memória,
Mas contigo se acabe o nome e glória!
 103
 — « Trouxe o filho de Jápeto do Céu
O fogo que ajuntou ao peito humano,
Fogo que o mundo em armas acendeu,
Em mortes, em desonras (grande engano !).
Quanto melhor nos fora, Prometeu,
E quanto para o mundo menos dano,
Que a tua estátua ilustre não tivera
Fogo de altos desejos, que a movera!
 104
 — « Não cometera o moço miserando
O carro alto do pai, nem o ar vazio
O grande arquitector co filho, dando
Um, nome ao mar, e o outro, fama ao rio.
Nenhum cometimento alto e nefando
Por fogo, ferro, água, calma e frio,
Deixa intentado a humana geração.
Mísera sorte! Estranha condição! »","84
 Et déjà dans le port de la célèbre Ulisseia (*)
Avec un noble tumulte et plein d’espoirs
(Quand les eaux de paille du doux Tage mêlent
Ensemble le sel de Neptune et le sable blanc)
On apprête les navires, et sans crainte aucune
Rien ne vient la réfréner la juvénile ardeur,
Car, tous en toutes parts, les gens de Mer
Et les gens de Mars étaient prêts à me suivre.
 …
 88
 « Les habitants de la ville, en ce jour-là,
(Les uns, avec leurs amis ou leurs parents,
Les autres simplement pour voir) accouraient
Avec des airs de nostalgie et d’affliction
Et nous, dans la compagnie vénérable
D’un millier de religieux fort zélés
En procession solennelle et priant Dieu,
Nous nous en allâmes vers les canots.
 89
 « A voir la route si longue et si périlleuse
Les gens nous tenaient déjà pour perdus
Les femmes apitoyées étaient en pleurs,
Les hommes exhalaient de bruyants soupirs
Mères, épouses, filles dont le craintif
Amour renforce les doutes joignaient
Au désespoir, la froide peur de ne plus
Nous voir revenir avant longtemps.
 90
 « Celle-ci disait : – « Ô fils, toi que j’aime tant
Seule consolation et doux appui
Contre la vieillesse qui déjà me fatigue,
Et s’achèvera dans les pleurs, amère et désolée,
Pourquoi me laisses-tu, misérable et pauvre ?
Pourquoi loin de moi vouloir, ô fils chéri,
T’en aller chercher une funèbre sépulture,
Et servir de nourriture aux poissons ! » –
 91
 « Celle-là, nu-tête: – « Ô doux et tendre époux,
Sans qui Amour ne souhaite que je puisse vivre
Pourquoi sur l’ire de la mer aventurer
Cette vie qui est la mienne et non la vôtre,
Comment par un chemin aussi hasardeux
Oubliez-vous notre si douce affection ?
Notre amour, notre vain bonheur, voulez-vous
Qu’il soit emporté dans ces voiles par le vent ? » –
 92
 Ces paroles et d’autres qui disent
L’amour et la piété des hommes,
Les jeunes et les vieux les reprenaient,,
Avec moins de force en raison de leur âge,
Les monts alentours leurs répondaient,
Presque émus par une haute pitié ;
Le sable blanc était baigné de larmes,
Qui de grains les égalaient en nombre.
 93
 Nous autres, sans que nous levions les yeux
Sur une mère ou une épouse, étions en tel état
De ne pas nous troubler, ou d’affaiblir
Les desseins de notre ferme engagement,
Que je décidais de nous embarquer aussitôt,
En écourtant les adieux accoutumés qui,
Bien que du bon usage de l’amour, apporte
A qui part ou reste, plus qu’il n’en faut de chagrins.
 94 (Le Vieux du Restelo)
 Mais un vieillard d’aspect vénérable,
Qui était sur la grève au milieu des gens,
Fixant ses yeux sur nous, se mit à secouer
La tête par trois fois, mécontent, et haussa
D’un ton grave sa voix, tel que nous pûmes
L’entendre clairement depuis la mer ;
Avec un savoir que seule l’expérience donne
Il tirait de son cœur d’habiles paroles :
 95
 – Ô gloire de commander, ô vaine convoitise
De cette chimère que nous appelons Renommée !
Ô plaisir frauduleux, qui s’attise au brûlot
Des faveurs populaires, quel orgueil est-ce là !
Qu’un très grand et très juste châtiment frappe
Le cœur empli de vanités de celui qui t’aime tant !
Quelles morts, quels périls, quels tourments,
Quelles cruautés ne pourrais-tu essayer sur eux !
 96
 – « Rude inquiétude de l’âme et de la vie,
Source d’abandons et cause d’adultères,
Adroite consommation à bon escient
De batailles, de règnes et d’empires !
On t’appelle célébrité, on t’appelle grandeur,
Quand tu n’es digne que d’infâmes reproches ;
On t’appelle Renommée et Gloire souveraine,
Noms par lesquels est trompé le peuple ignorant !
 97
 – « Vers quels nouveaux désastres es-tu prêt
A conduire ce peuple et ce Royaume
A quels périls, à quelles morts les destines-tu,
Rebaptisés de quelque nom retentissant ?
Quelles promesses de royaumes et de mines
D’or, avec tant de facilités, leur feras-tu ?
Quelles renommées promises ? Quelles histoires ?
Quels triomphes ? Quelles palmes ? Quelles victoires ?
 98
 – « Mais, ô toi, génération de cet insensé
Dont les insubordinations et les péchés,
Du royaume souverain, non seulement
T’ont mis dans cette nue et triste relégation,
Mais encore d’un autre état plus qu’humain
Fait de quiète et de simple innocence,
Âge d’or, dont tant privé, ils t’ont sorti
Pour te jeter dans celui du fer et des armes :
 99
 – « Puisque de cette vanité délectable
Ta frivole imagination s’enivre autant ;
Puisqu’à la cruauté brutale et féroce
Tu as donné le nom d’effort et courage ;
Puisque tu uses en aussi grande quantité
Du mépris de la vie, elle, qui devrait
Toujours être estimée ; n’a-t-il point tremblé
A l’idée de la perdre ? Celui qui la donne :
 100
 – « N’y a-t-il pas auprès de toi l’Ismaélite
De qui toujours tu subiras les guerres ?
Ne suit-il pas de l’Arabe la loi maudite,
Quand tu ne combats que pour le Christ ?
N’a-t-il pas mille cités, des terres infinies,
Si ton désir est plus de terres, et de richesses ?
N’est-il pas homme preux pour les armes,
Si tu recherches la louange des victoires ?
 101
 – « Tu laisses les ennemis crier aux portes,
Et tu pars en débusquer d’autres, si loin
Que notre vieux Royaume va se dépeupler,
S’affaiblir et à la longue se disperser…
Tu cherches l’incertain et le péril inconnu
Pour que la Renommée te flatte et te grise
T’appelant seigneur, et grande figure,
D’Arabie, de l’Inde, de Perse et d’Ethiopie
 102
 – « Ah, que soit maudit le premier au monde
Qui mit en mer une voile sur un bois sec !
Il est digne de la peine éternelle des Enfers,
Si est juste, respectée et suivie, la juste loi !
Nul jugement, de quelque force ou profondeur
Que ce soit, nulle cithare sonore ou vif esprit,
Ne te donnera pour cela renommée immémoriale,
Mais avec toi viendra prendre fin et nom et gloire !
 103
 – « Il rapporta, le fils de Japet, le feu
Du Ciel qui s’accorde au cœur humain,
Feu que le monde en armes recouvre
De morts, d’outrages (grande méprise !).
Qu’il eut été meilleur pour nous, Prométhée,
Et d’autant moins dommageable pour le monde,
Que ton illustre statue, à qui tu apportas le feu,
N’eut été façonnée par de si puissantes passions !
 104
 – « Le malheureux enfant ne se fut pas risqué
Sur le char du Soleil, ni le grand architecte
Avec son fils, dans l’air vide, donnant à la mer
L’un, son nom, et au fleuve l’autre, sa gloire.
Il n’est pas d’entreprise exécrable et forte,
Dans laquelle – feu, fer, eau, chaleur et froid –
Ne se laisserait embarquer l’humaine génération.
Misérable destin ! Etrange condition ! »",pt_XX,fr_XX
"o que é que eu vou fazer agora
se o teu sol não brilhar por mim
num céu de estrelas multicoloridas
existe uma que eu não colori
 forte, sorte na vida, filhos feitos de amor
todo verbo que é forte
se conjuga no tempo
perto, longe o que for
 você não sai da minha cabeça
e minha mente voa
você não sai, não sai, não sai, não sai...
 entre o céu e o firmamento
não há ressentimento
cada um ocupando o seu lugar
não sai não, não sai, não sai, não sai, não sai...
 o que é que eu vou fazer agora
se o teu sol não brilhar por mim
num céu de estrelas multicoloridas
existe uma que eu não colori
 forte, sorte na vida, filhos feitos de amor
todo verbo que é forte
se conjuga no tempo
perto, longe o que for
 você não sai da minha cabeça
e minha mente voa
você não sai, não sai, não sai, não sai...
 entre o céu e o firmamento
existe mais coisas do que julga
o nosso próprio pensar
que vagam pelo tempo
e aquele sentimento de amor eterno
 entre o céu e o firmamento
existem mais coisas do que julga
o nosso próprio entendimento
que vagam como o vento
com aquele juramento de amor eterno","qu'est-ce que je vais faire maintenant
Si ton soleil ne brille plus pour moi
dans un ciel d'étoiles multicolores
il en existe une que je n'ai pas colorée
 forte, chance dans la vie, des enfants faits d'amour
tout verbe qui est fort
se conjugue au temps
proche, lointain, quel qu'il soit
 tu ne sors pas de ma tête
et mon esprit vole
tu ne sors pas, ne sors pas, ne sors pas, ne sors pas...
 Entre le ciel et le firmament
Il n'y a pas de ressentiments
Chacun occupe sa place
Ne pars pas non, ne pars pas, ne pars pas, ne pars pas, ne pars pas..
 qu'est-ce que je vais faire maintenant
Si ton soleil ne brille plus pour moi
dans un ciel d'étoiles multicolores
il en existe une que je n'ai pas colorée
 forte, chance dans la vie, des enfants faits d'amour
tout verbe qui est fort
se conjugue au temps
proche, lointain, quel qu'il soit
 tu ne sors pas de ma tête
et mon esprit vole
tu ne sors pas, ne sors pas, ne sors pas, ne sors pas...
 entre le ciel et le firmament
il existe plus de choses que celles qui jugent
notre propre pensée
qui errent à travers le temps
et ce sentiment d'amour éternel
 entre le ciel et le firmament
il existe plus de choses que celles qui jugent
notre propre entendement
qui errent comme le vent
avec ce serment d'amour éternel",pt_XX,fr_XX
"Amor igual ao teu
Eu nunca mais terei
Amor que eu nunca vi igual
Que eu nunca mais verei
 Amor que não se pede
Amor que não se mede
Que não se repete
Amor que não se pede
Amor que não se mede
Que não se repete
 Você vai chegar em casa
Eu quero abrir a porta
Aonde você mora
Aonde você foi morar
Aonde foi
 Não quero estar de fora
Aonde esta você
Eu tive que ir embora
 Mesmo querendo ficar
Agora eu sei
Eu sei que eu fui embora
Agora eu quero você
De volta pra mim
 Amor igual ao teu
Eu nunca mais terei
 Amor que eu nunca vi igual
Que eu nunca mais verei
 Amor que não se pede
Amor que não se mede
Que não se repete
Amor que não se pede
Amor que não se mede
Que não se repete
Amor igual ao teu
Eu nunca mais terei
 Amor que eu nunca vi igual
Que eu nunca mais verei","Un amour pareil au tien
Je n'en aurai jamais plus
Un amour dont je n'ai jamais vu le même
Que je ne verrai plus jamais
 Un amour qui ne se demande pas
Un amour qui ne se mesure pas
Qui ne se répète pas (2x)
 Un amour pareil au tien
Je n'en aurai jamais plus
Un amour dont je n'ai jamais vu le même
Que je ne verrai plus jamais
 Un amour qui ne se demande pas
Un amour qui ne se mesure pas
Qui ne se répète pas
Un amour ...
 Tu vas arriver à la maison
Je veux ouvrir la porte
Où habites-tu ?
Où es-tu allée habiter
Où es-tu allée ?
 Je ne veux pas rester en dehors
Où es-tu ?
J'ai dû partir
Même si je voulais rester
Maintenant je sais
Je sais que je suis parti
Maintenant je veux que tu reviennes avec moi
 Un amour pareil au tien
Je n'en aurai jamais plus
Un amour dont je n'ai jamais vu le même
Que je ne verrai plus jamais
 Un amour qui ne se demande pas
Un amour qui ne se mesure pas
Qui ne se répète pas (2x)
 Un amour pareil au tien
Je n'en aurai jamais plus
Un amour dont je n'ai jamais vu le même
Que je ne verrai plus jamais
 Un amour qui ne se demande pas
Un amour qui ne se mesure pas
Qui ne se répète pas
 Tu vas arriver à la maison
Je veux ouvrir la porte
Où habites-tu ?
Où es-tu allée habiter
Où es-tu allée ?
 Je ne veux pas rester en dehors
Où es-tu ?
J'ai dû partir
Même si je voulais rester
Maintenant je sais
Je sais que je suis parti
Maintenant je veux que tu reviennes avec moi
 Un amour pareil au tien
Je n'en aurai jamais plus
Un amour dont je n'ai jamais vu le même
Que je ne verrai plus jamais",pt_XX,fr_XX
"Eu sei que ela nunca mais apareceu
Na minha vida minha
Minha mente
Novamente
Eu sei que o que ficou
Não desapareceu
A minha vida
Muda
Sempre
Lentamente
Como a lua,
Que dá voltas pelo céu
E mexe,
Tanto com o presente
Quanto o ausente
Eu sei, eu sei, eu sei, eu sei
Eu sei, eu sei, eu sei,
Não sou vidente
Mas sei o rumo
Do seu coração
 Permita
Que o amor
Invada sua casa,
Coração
Que o amor
Invada sua casa,
Coração
Que o amor
Invada sua casa,
Saia, não vaia,
Não caia na navalha
Que corta a tua carne
E sangra tudo o que você precisa
Descobrir","Je sais qu'elle n'est plus jamais apparue
Dans ma vie
Dans mon esprit
Une autre fois
Je sais que ce qui est resté
N'a pas disparu
Ma vie
Change
Toujours
Lentement
Comme la lune,
Qui fait des tours dans le ciel
Et bouge,
Aussi bien pour les présents
Que pour les absents
Je sais, je sais, je sais, je sais
Je sais, je sais, je sais,
Je ne suis pas voyant
Mais je connais le chemin
De ton cœur
 Permets
Que l'amour
Envahisse ta maison,
Mon cœur
Que l'amour
Envahisse ta maison,
Mon cœur
Que l'amour
Envahisse ta maison,
Sors, ne me hue pas
Ne tombe pas sur la lame
Qui coupe ta viande
Et saigne tout ce que tu as besoin
De découvrir",pt_XX,fr_XX
"Ouve, só se ouve ouvir
O rio só se ouve quem
De longe lá de onde vem
O rio daqui se ouve bem
De dentro ecoa a água
Que deságua no azul vazio
 Serpente, serpenteia o rio
Percorre corre em minha veia
A correnteza o coração bombeia
O rio navega e lava
O pensamento leva
O corpo todo como um navio
 Um rio que não tem beira
Por um fio abismo cachoeira
Onde deságua se não tem mar
E não tem margem só o olho d'água
Brota espelho molha o azul do céu
 Ouve, só se ouve ouvir
O rio só se ouve quem
De longe lá de onde vem
O rio daqui se ouve bem
De dentro ecoa a água
Que deságua no azul vazio
 Serpente, serpenteia o rio
Percorre corre em minha veia
A correnteza o coração bombeia
O rio navega e lava
O pensamento leva
O corpo todo como um navio
 Um rio que não tem beira
Por um fio abismo cachoeira
Onde deságua se não tem mar
E não tem margem só o olho d'água
Brota espelho molha o azul do céu
 O olho d'água
Brota espelho molha o azul do céu","Ecoute, on n'entend seulement en écoutant
N'entend la rivière que celui qui
Vient de loin
On entend bien la rivière d'ici
L'écho interne de l'eau
Qui se jette dans le bleu vide
 Comme un serpent la rivière serpente
Elle parcourt et coule dans mes veines
Le cœur pompe le courant
La rivière navigue et lave
La pensée emporte
Tout mon corps comme un navire
 Un fleuve qui n'a pas de côte,
Comme le fil d'une cascade dans l'abîme
Se déverse s'il n'y a pas de mer
Et il n'a pas de rive, seule dans la mare
Pousse un miroir qui mouille le bleu du ciel
 Ecoute, on n'entend seulement en écoutant
N'entend la rivière que celui qui
Vient de loin
On entend bien la rivière d'ici
L'écho interne de l'eau
Qui se jette dans le bleu vide
 Comme un serpent la rivière serpente
Elle parcourt et coule dans mes veines
Le cœur pompe le courant
La rivière navigue et lave
La pensée emporte
Tout mon corps comme un navire
 Un fleuve qui n'a pas de côte,
Comme le fil d'une cascade dans l'abîme
Se déverse s'il n'y a pas de mer
Et il n'a pas de rive, seule dans la mare
Pousse un miroir qui mouille le bleu du ciel
 Dans la mare
Pousse un miroir qui mouille le bleu du ciel",pt_XX,fr_XX
"Para melhor a gente compreender
O que feriu sem parar e te levou
Nenhum lugar e nada para falar
O que ficou de nós dois
Não faz sentido
 Procurei
Não pensar
Me tranquei, sem querer
Num lugar que nem sei
Solidão
É distante demais
Uma nova manhã
E nem sei
Quando virá
Mas virá
 Era melhor a gente não conhecer
O que passou a chamar felicidade
Nenhum lugar e nada para falar
Do que ficou de nós dois
Pela cidade
 Procurei
Não pensar
Me tranquei, sem querer
Num lugar que nem sei
Solidão
É distante demais
Uma nova manhã
E nem sei
Quando virá
Mas virá
 Já não tem mais jeito
Perdi a razão
Tudo novo corpo livre e sem sono
É como o silêncio
Que veio morar
Nesse quarto
Corpo livre e sem sono","Pour qu'on comprenne mieux
Ce qui t'a blessée sans arrêt et t'a emportée
Nulle part et rien à dire
Ce qui est resté de nous deux
N'a pas de sens
 J'ai cherché
A ne pas penser
Je me suis enfermé, sans le vouloir
Dans un lieu que je ne connais pas
La solitude
Est trop distante
Un nouveau matin
Je ne sais même pas
Quand il viendra
Mais il viendra
 Il aurait mieux valu qu'on ne connaisse pas
Ce qui s'est passé, qu'on appelle le bonheur
Nulle part et rien à dire
De ce qui est resté de nous deux
Dans cette ville
 J'ai cherché
A ne pas penser
Je me suis enfermé, sans le vouloir
Dans un lieu que je ne connais pas
La solitude
Est trop distante
Un nouveau matin
Je ne sais même pas
Quand il viendra
Mais il viendra
 Il n'y a déjà plus rien à faire
J'ai perdu la raison
Tout est neuf, le corps libre et sans sommeil
C'est comme le silence
Qui est venu habiter
Dans cette pièce
Le corps libre et sans sommeil",pt_XX,fr_XX
"Um dia vivi a ilusão de que ser homem bastaria
Que o mundo masculino tudo me daria
Do que eu quisesse ter
 Que nada, minha porção mulher que até então se resguardara
É a porção melhor que trago em mim agora
É o que me faz viver
 Quem dera pudesse todo homem compreender, ó mãe, quem dera
Ser o verão no apogeu da primavera
E só por ela ser
 Quem sabe o super-homem venha nos restituir a glória
Mudando como um Deus o curso da história
Por causa da mulher
 Quem sabe o super-homem venha nos restituir a glória
Mudando como um deus o curso da história
Por causa da mulher","Un jour j'ai vécu l'illusion de croire qu'être un homme suffirait
Que le monde masculin me donnerait tout
Ce que j'avais envie d'avoir
 Que nenni, ma portion femme qui jusqu'alors se préservait
Est la meilleure part que je porte en moi maintenant
C'est ce qui me fait vivre
 Si seulement tout homme pouvait comprendre, ô mère,
Si seulement
Etre l'été à l'apogée du printemps
Et n'exister que pour elle
 Qui sait si le surhomme viendra nous restituer la gloire
Changeant comme un Dieu le cours de l'histoire
A cause de la femme
 Qui sait si le surhomme viendra nous restituer la gloire
Changeant comme un Dieu le cours de l'histoire
A cause de la femme",pt_XX,fr_XX
"Um dia preciso ir
Na casa da solidão
Só pra saber
Se o que sofri
Dá pra beber
Outra paixão
 Em mim
O amor se fez
Do jeito
Que se inventou
Toda razão
Perde o seu fim
Se um coração
For o juiz
Vai redimir
O medo de amar
 Saudade
Enquanto
O amor ferir
E o pranto
A dor sarar
Não digo não
Nem dou o sim
Deixo
O meu coração
Chorar por mim","Un jour il faudra que j'aille
Dans la maison de la solitude
Juste pour savoir
Si ce que j'ai souffert
Convient pour boire
Une autre passion
 En moi
L'amour s'est fait
De la manière
Qu'il s'est inventé
Toute raison
Perd son but
Si le cœur
Est juge
Il va racheter
La peur d'aimer
 Nostalgie
Tandis que
L'amour blesse
Et que le deuil
Guérit la douleur
Je ne dis pas non
Je ne donne pas non plus le oui
Je laisse
Mon cœur
Pleurer pour moi",pt_XX,fr_XX
"Só uma coisa me entristece
O beijo de amor que não roubei
A jura secreta que não fiz
A briga de amor que eu não causei
 Nada do que posso me alucina
Tanto quanto o que não fiz
Nada do que quero me suprime
De que por não saber ainda não quis
 Só uma palavra me devora
Aquela que meu coração não diz
Só o que me cega e o que me faz infeliz
É o brilho do olhar que não sofri","Juste une parole m'attriste
Le baiser d'amour que je n'ai pas volé
Le vœu secret que je n'ai pas fait
La querelle d'amour que je n'ai pas provoquée
 Rien de ce que je peux ne m'hallucine
Tout autant ce que je n'ai pas pas fait
Rien de ce que je veux ne me supprime
De ce que je ne savais pas encore et que je n'ai pas voulu
 Juste une parole me dévore
Celle que mon cœur n'a pas dite
La seule chose qui m'aveugle, qui me rend malheureux
C'est la lueur de ton regard que n'ai pas affrontée",pt_XX,fr_XX
"Quanto tempo temos antes de voltarem aquelas ondas
Que vieram como gotas em silêncio tão furioso;
Derrubando homens entre outros animais,
Devastando a sede desses matagais;
Devorando árvores, pensamentos seguindo
A linha do que foi escrito pelo mesmo lábio tão furioso.
E se teu amigo vento não te procurar
É porque multidões ele foi arrastar.","Combien de temps avons-nous avant que ne reviennent ces vagues
Qui sont venus comme des goutes dans un silence si furieux;
Renversant les hommes parmi d'autres animaux,
Dévastant la soif de ces fourrés;
Dévorant les arbres, les pensées qui suivent
La ligne de ce qui a été écrit par la même lèvre si furieux.
Et si ton ami le vent ne te cherche pas
C'est parce qu'il en a traîné des foules.",pt_XX,fr_XX
