original_poem,translated_poem,src_lang,tgt_lang
"A cada vez estás mais distante
E não dizes o porquê
No silêncio do instante
Sinto que te estou a perder
 Um do outro
A pouco e pouco
Só nos estamos a afastar
Mas eu sinto que o amor nos quer falar
 Volta, pra sentir que a vida ainda nos faz sorrir
Volta, pra sentir que o melhor ainda está pra vir
 Esse teu olhar ausente
Parece querer dizer
Que há um mundo tão diferente
Que tu não me deixas ver
 Um do outro
A pouco e pouco
Só nos estamos a afastar
Mas eu sinto que o amor nos quer falar
 Volta, pra sentir que a vida ainda nos faz sorrir
Volta, pra sentir que o melhor ainda está pra vir","Tu es de plus en plus distante
Et tu ne dis pas pourquoi.
En ce moment de silence
Je sens que je suis en train de te perdre.
 L'un de l'autre,
Peu à peu,
Nous sommes en train de nous éloigner,
Mais je sens que l'amour veut nous parler.
 Reviens pour sentir que la vie nous fait encore sourire.
Reviens pour sentir que le meilleur est encore à venir.
 Ton regard absent,
Semble vouloir dire
Qu'il existe un monde tant différent
Que tu ne me laisse pas voir.
 L'un de l'autre,
Peu à peu,
Nous sommes en train de nous éloigner,
Mais je sens que l'amour veut nous parler.
 Reviens pour sentir que la vie nous fait encore sourire.
Reviens pour sentir que le meilleur est encore à venir.",pt_XX,fr_XX
"Dizem que puseram um homem na lua:
Não acredites.
E que tivessem?
O que buscam no minério dos astros?
Quanto tocam do Universo
É sempre o mesmo nada
Perante o Universo.
 «Um pequeno passo para mim, um grande passo para a humanidade».
Chegaram à lua.
A única coisa que mudou foi isto:
Pode morrer-se mais alto.","Ils disent avoir posé un homme sur la lune :
Je n'y crois pas.
Et qu'y gagneraient-ils ?
Que cherchent-ils dans le minerai des étoiles ?
Ce qu'ils atteignent de l'Univers
C'est toujours le même néant
Au regard de l'Univers.
 « Un petit pas pour moi, un grand pas pour l'humanité ».
Ils sont arrivés sur la lune.
La seule chose qui a changé est la suivante :
On peut mourir plus haut.",pt_XX,fr_XX
"Sabe, quanto tempo não te vejo!...
Cada vez você distante,
Mas eu gosto de você,
Por que?
 Sabe, eu pensei que fosse fácil
Esquecer seu jeito frágil
De se dar sem receber;
Só você...
 Só você que me ilumina,
Meu pequeno talismã!
Como é doce essa rotina
De te amar toda manhã!
 Nos momentos mais difíceis
Você é o meu divã.
Nosso amor não tem segredos,
Sabe tudo de nós dois
E joga fora nossos medos.
 Vai, saudade diz pra ela,
Diz pra ela aparecer.
Vai, saudade, vê se troca
A minha solidão por ela
Pra valer o meu viver!...
 Só você que me ilumina,
Meu pequeno talismã!
Como é doce essa rotina
De te amar toda manhã!
 Nos momentos mais difíceis
Você é o meu divã.
Nosso amor não tem segredos,
Sabe tudo de nós dois
E joga fora nossos medos.
 Vai, saudade diz pra ela,
Diz pra ela aparecer.
Vai, saudade, vê se troca
A minha solidão por ela
Pra valer o meu viver!...","Tu sais, ça fait longtemps je ne t'ai pas vue ! ...
Chaque fois tu es distante de moi,
Mais moi, je t'aime,
Pourquoi est-ce ainsi ?
 Tu sais, je pensais que c'était facile
D'oublier ta manière fragile
De te donner sans recevoir.
Il n'y a que toi comme ça...
 Toi seule, qui rayonne pour moi,
Tu es mon petit talisman !
Comme c'est doux, cette routine
De t'aimer tous les matins !
 Dans les moments plus difficiles,
Tu es mon divan.
Notre amour n'a pas de secrêts,
Tu sais tout sur nous deux
Et tu abandonnes nos craintes.
 Viens, nostalgie, dis-lui,
Dis-lui qu'elle apparaisse.
Viens, nostalgie... tu vois , tu changes
Ma solitude pour elle,
Pour que ça vaille ma vie ! ...
 Toi seule, qui rayonne pour moi,
Tu es mon petit talisman !
Comme c'est doux, cette routine
De t'aimer tous les matins !
 Dans les moments plus difficiles,
Tu es mon divan.
Notre amour n'a pas de secrêts,
Tu sais tout sur nous deux
Et tu abandonnes nos craintes.
 Viens, nostalgie, dis-lui,
Dis-lui qu'elle apparaisse.
Viens, nostalgie... tu vois, tu changes
Ma solitude pour elle,
Pour que ça vaille ma vie ! ...",pt_XX,fr_XX
"Não precisa mudar
Vou me adaptar ao seu jeito
Seus costumes, seus defeitos T
Seus ciúmes, suas caras, pra que mudá-las?
 Não precisa mudar
Vou saber fazer o seu jogo
Saber tudo do seu gosto
Sem deixar nenhuma mágoa, sem cobrar nada
 Se eu sei que no final tudo fica bem
A gente se ajeita na cama pequena l
Te faço poema, te cubro de amor
 (Refrão) (Chorus)
Então você adormece
Meu coração enobrece
E a gente sempre se esquece
De tudo que passou
 Não precisa mudar
Vou me adaptar ao seu jeito
Seus costumes, seus defeitos
Seus ciúmes, suas caras, pra que mudá-las?
 Não precisa mudar
Vou saber fazer o seu jogo
Deixar tudo do seu gosto
Sem guardar nenhuma mágoa, sem cobrar nada
 Se eu sei que no final tudo fica bem I
A gente se ajeita na cama pequena W
Te faço poema, te cubro de amor er
 (Refrão) (Chorus)
Então você adormece
Meu coração enobrece
E a gente sempre se esquece
De tudo que passou","Il n'y a pas besoin que tu changes.
Je vais m'adapter à ta façon de vivre,
Tes habitudes, tes défauts,
Tes jalousies, tes (différents) visages, pourquoi les changer?
 Il n'y a pas besoin que tu changes.
Je saurai jouer ton jeu,
Je saurai tout sur tes goûts,
Sans te faire de la peine, sans rien te demander.
 Si je sais que finalement tout va bien
Nous nous arangerons (entre nous) sur le petit lit,
Je te réciterai un poème, je te couvrirai d'amour.
 (Refrain) (chœur)
Alors tu t'endors,
Mon cœur s'ennobli
Et nous oublions toujours
Tout ce qui s'est passé.
 Il n'y a pas besoin que tu changes.
Je vais m'adapter à ta façon de vivre,
Tes habitudes, tes défauts,
Tes jalousies, tes (différents) visages, pourquoi les changer?
 Il n'y a pas besoin que tu changes.
Je saurai jouer ton jeu,
Je saurai tout sur tes goûts,
Sans te faire de la peine, sans rien te demander.
 Si je sais que finalement tout va bien
Nous nous arangerons (entre nous) sur le petit lit,
Je te réciterai un poème, je te couvrirai d'amour.
 (Refrain) (chœur)
Alors tu t'endors,
Mon cœur s'ennobli
Et nous oublions toujours
Tout ce qui s'est passé.",pt_XX,fr_XX
"Enquanto minha emoção me faz sonhar,
minha razão me causa insônia.
Enquanto minha emoçao me faz sorrir,
minha razão me faz chorar.
Enquanto minha emoção me enlouquece,
minha razão me deixa lúcido.
Enquanto minha emoção me cega,
minha razão me faz enxergar.
Enquanto minha emoção me faz perder o ar,
minha razão me faz respirar.
Enquanto minha emoção me faz gritar,
minha razão me deixa em silêncio.
Enquanto na minha emoção eu me perco,
na minha razão eu me encontro.
Enquanto minha emoção me faz continuar,
minha razão me faz desistir.
Enquanto minha emoção me faz morrer,
minha razão me faz viver.
Enquanto minha emoção me faz esquecer,
minha razão me faz lembrar.
Enquanto minha emoção me faz sofrer por amor,
minha razão me faz amar ou a ser indiferente.","Alors que mes émotions me font rêver,
la raison me perd dans l'insomnie.
Alors que mes émotions me font sourire,
la raison me fait pleurer.
Alors que mes émotions me portent à la folie,
la raison me rend lucide.
Alors que mes émotions m'aveuglent,
la raison me fait apercevoir.
Alors que mes émotions me font perdre le souffle,
la raison me donne de l'air.
Alors que mes émotions me font crier,
la raison me rend silencieux.
Alors que je me perds dans mes émotions,
je me trouve dans la raison.
Alors que mes émotions me font avancer,
la raison me fait renoncer.
Alors que mes émotions me font mourir,
la raison me fait vivre.
Alors que mes émotions me font oublier,
la raison me rappelle aux souvenirs.
Alors que mes émotions me font souffrir d'amour,
la raison me laisse indifférent à l'être ou à l'amour.",pt_XX,fr_XX
"Eu estou sozinha
Mesmo junto a ti
E tu sempre triste
E eu já sei porque
 Sei que vais dizer-me
Que não és feliz
Eu já estou sabendo
Que tu vais me deixar
 Eu, que não vivo um minuto sem te ver
Creia. Minha vida se resume em te querer
Sou tua, sou tua
E nada poderá separar-te um dia de mim
 Volte aqui, escuta-me
Eu te amo tanto
Te imploro
Fique aqui bem junto de mim
 Eu, que não vivo um minuto sem te ver
Creia. Minha vida se resume em te querer
Sou tua, sou tua
Eu, que não vivo um minuto sem te ver
Creia. Minha vida se resume em te querer
Sou tua, sou tua, sou tua","Je suis seule
Même avec toi
Tu es toujours triste
Et je sais pourquoi.
 Je sais que tu vas me dire
Que ce n'est pas facile.
Moi, je sais déjà
Que tu vas me laisser.
 Moi, qui ne vis pas une minute sans te voir,
Je crois que ma vie se résume en ton amour.
Je suis à toi, je suis à toi,
Et rien ne pourra te séparer un jour de moi.
 Reviens ici, écoute-moi,
Moi, je t'aime tant,
Je t'implore,
Reste ici, bien près de moi.
 Moi, qui ne vis pas une minute sans te voir,
Je crois que ma vie se résume en ton amour.
Je suis à toi, je suis à toi,
Moi, qui ne vis pas une minute sans te voir,
Je crois que ma vie se résume en ton amour.
Je suis à toi, je suis à toi...",pt_XX,fr_XX
"As pernas alongam-se na dança,
São sombrias, misteriosas como vielas
Onde são gatos.
Dois corpos são um corpo,
O langor, a graça, o desejo,
Mas não sendo carne,
Ou não mais do que as mãos,
Trágicas por conduzirem o destino,
Não mais do que este roçagar,
Esta pele aflante e lábios entreabertos
De que só o tango conhece o segredo,
Para que a tristeza se apague
Sendo dançada.","Les jambes s'allongent dans la danse,
Sombres, et mystérieuses comme les ruelles
Où sont des chats.
Deux corps font un seul corps,
En langueurs, et grâce et désir,
Mais ne sont point chair,
Ou pas plus que les mains
Tragiques, d'avoir ainsi conduit la destinée,
Pas plus que cet effleurement du sol,
Cette peau à bout de souffle, lèvres entrouvertes
Dont le tango seul a le secret,
Et par lequel la tristesse s'éteint
D'avoir été dansé.",pt_XX,fr_XX
"Diga, meu amor
Se anda um pouco triste como eu
Diga o que ficou
Da história que a gente viveu
 Eu caí e tudo agora lembra você
E viver sem a gente
Não dá mais porque sei que sou seu
 Diga por que se foi
E quantas vezes se sentiu sozinho, longe
Diga o que pensou
Pra vir buscar agora o que vivemos antes
 Eu caí
E vi nascer uma força que nem sei de onde
Pra seguir
E suportar a falta desse amor
 Diga o que te fez sentir saudade
Bote um ponto final
Cole de uma vez nossas metades
Juntos e shallow now
 In the shallow, shallow
In the shallow, shallow
In the shallow, shallow
Juntos e shallow now","Dis, mon amour,
Si tu te sens un peu triste, comme moi
Dis qu'est-ce qui est resté
De l'histoire qu'on a vécue
 Je suis tombée et tout maintenant te rappelle à moi
Et je ne peux plus vivre sans nous
Car je sais que c'est moi
 Dis pourquoi tu es parti
Et combien de fois tu t'es senti seul, loin
Dis ce que tu as pensé
Pour venir chercher maintenant ce qu'on a vécu avant
 Je suis tombée
Et j'ai vu naître une force venue de je ne sais où
Pour continuer
Et supporter le manque de cet amour
 Dis qu'est-ce qui t'a rendu nostalgique
Lance un pont final
Colle une fois pour toutes nos moitiés
Ensemble et shallow now
 In the shallow, shallow
In the shallow, shallow
In the shallow, shallow
Ensemble et shallow now",pt_XX,fr_XX
"A morte esvazia
todos os recantos:
gritar teu nome, agora,
seria gritar no vácuo,
o grito gutural dos mudos.
O certo é que não vejas,
nem percebas,
tudo que, por ora,
vai acontecendo.
 Em uma curta estação
— o tempo humano é tão breve —
as pessoas gravitaram,
em torno do teu corpo,
um pouco do calor e da poesia.
Um pouco do teu humor
e de tua generosidade.
 Mas grudados à nossa própria sorte,
ao peso específico que nos cega,
somos uma vasta escuridão,
sólidas esferas de egoísmo
umas às outras se chocando.","La mort dégarnit
tous les recoins:
crier ton nom, maintenant,
serait pousser dans le vide,
le cri guttural des muets.
il est certain que tu n'as pas vu,
ni perçu,
tout ce qui, pour l'heure,
allait advenir.
 En cette courte saison
– le temps humain est si bref –
des personnes ont fait graviter
autour de ton corps,
un peu de chaleur et de poésie.
Un peu de ton humeur
et de ta générosité.
 Mais accrochés à notre propre destin,
au poids spécifique qui nous aveugle,
nous sommes une vaste obscurité,
de solides sphères d’égoïsme
qui s’entrechoquent l'une contre l'autre.",pt_XX,fr_XX
"No solo calcinado da infância,
crescem as mais estranhas liturgias.
Cavamos a terra com as mãos,
da infância pouco encontramos.
 Descobrimos na superficie aparente,
o ouro do sorriso, as brincadeiras,
os alforjes do avô, dentes de leite,
luz verde de pirilampos no escuro.
 Mas como compor sua própria Ilíada?
ou escrever em novíssimos alfabetos?
Ah, mar povoado de tantos enigmas
quem ousará decifrar-te algum dia?
 E se procurasse nalgum espelho,
a mesma face alegre que perdi,
eu quase nada ali encontraria:
apenas outra espécie de exílio.","Sur le sol calciné de l'enfance,
grandissent les plus étranges liturgies.
D'avoir creusé la terre avec nos mains,
nous n'avons trouvé que peu d'enfance.
 Nous n'avons découvert en surface,
que l'or apparent d'un sourire, les jeux,
la besace de grand-père, les dents de lait,
les lueurs vertes des lucioles dans le noir.
 Mais comment composer sa propre Iliade ?
comment écrire de nouveaux alphabets ?
Ah, mer peuplée de tant d'énigmes
qui osera un jour te déchiffrer ?
 Et si je devais chercher dans un miroir,
le même visage heureux que j'ai perdu,
Je n'y trouverais presque rien :
Une autre sorte d'exil, seulement.",pt_XX,fr_XX
"Não pensar nas mazelas dessa vida.
Deixar que a alma clara navegasse,
calma, as velas brancas enfunadas,
em vastos, muito largos horizontes.
Nostalgia de dias limpos, de praias,
também de mal-esquecidas infâncias.
Solto no ar o corpo dançaria,
vivo e acima, em harmonia,
na bela harmonia dos tendões.
 O corpo se esquece quando dança,
inventando outro corpo, diferente,
unindo emoção e movimento.
E junto desse corpo outra fala,
esta mais alegre e transparente,
porque vinda mais de dentro.
E junto dessa fala a sintonia,
um olhar mais brando sobre as coisas,
um calor de alma sem segredos.","Ne pense pas aux maux de la vie.
Laisse ton âme claire naviguer,
calme, et toutes voiles blanches au dehors,
par les grands, les très vastes horizons.
Nostalgie des jours lumineux, des plages,
et des enfances mal oubliées. Aussi
Libre dans l'air, le corps va danser,
vivant à la cime, en harmonie,
avec la belle harmonie des nerfs.
 Le corps lorsqu'il danse, oublie
et s'invente un autre corps, différent,
qui unit émotion et mouvement.
Et à côté de ce corps un autre parle,
plus joyeux et plus transparent,
car venant du plus intérieur.
Et à ce discours se joint une syntonie,
un regard plus tendre sur les choses,
la chaleur d'une âme sans secrets.",pt_XX,fr_XX
". . . . . . . . A M. de Sá-Carneiro
. . . . . . . . e ao Rui Bacelo
 Foi sempre o menino exemplar.
Nunca foi além do seu nome,
Nunca correu atrás da luz
Quando ela, com as pombas,
Deixava a sua janela.
 Foi sempre o menino exemplar —
Nunca amou mas temeu os vimes
E respeitava ciosamente os muros.
Foi feliz?
Foi sempre o menino exemplar.",". . . . . . . . M. de Sá-Carneiro
. . . . . . . . et à Rui Bacelo
 Il fut toujours un garçon exemplaire.
Jamais il n'alla au-delà de son nom,
Jamais il ne courut après la lumière.
Lorsque avec les colombes, elle
quitta sa fenêtre.
 Il fut toujours un garçon exemplaire —
Jamais il n'aima mais il craignit les verges
Et eut le respect scrupuleux des murs.
Fut-il heureux ?
Il fut toujours un garçon exemplaire.",pt_XX,fr_XX
"Cemitério de Ayuruoca:
túmulo esquecido de minha mãe,
onde deixei umas flores amarelas.
À distância de apenas um braço,
o túmulo recente da tia Geni.
Tia Geni de coração enorme,
e voz aborrecida.
Tão aborrecida
que minha mãe usava-a
como pílula para dormir,
nas vezes que a visitava.
No ritmo da conversa
entrava num sono profundo.
O sono perfeito que procurara,
aflita, sem lugar, a semana interia.
 Foi com alguma surpresa
que percebi, sob meus pés,
as duas, ali, juntas, deitadas,
minha mãe e minha tia,
as duas dormindo o sono
do qual ninguém acorda,
e que alguns dizem eterno.
Pois que eterna é também essa visita,
que nunca, e nunca, mais se acaba.","Cimetière d'Ayuruoca :
le tombeau oublié de ma mère,
où j'ai laissé des fleurs jaunes.
À peine à la distance d'un bras,
La tombe récente de tante Geni.
Ma tante Geni au grand cœur,
et à la voix soporifique.
Si soporifique
que ma mère l'utilisait
comme pilule pour dormir,
à chaque fois qu'elle lui rendait visite.
Bercée par le rythme de la conversation
elle entrait dans un sommeil profond.
Sommeil parfait qu'elle avait cherché,
affligée, sans le trouver, une semaine entière.
 Ce fut avec une certaine surprise
que je les aperçues, sous mes pieds,
toute les deux, gisantes, ici, côte à côte,
ma mère et ma tante,
toute les deux, endormies du sommeil
dont personne ne se réveille,
et que certains disent éternel.
Car elle est éternelle aussi bien, cette visite
qui jamais, et jamais plus, ne prendra fin.",pt_XX,fr_XX
"Desse lugar não há caminho em que se venha.
E, no entanto, eu a vejo ali,
junto às flores secas do jardim,
há tanto tempo abandonado.
 Mas vejo uma mulher imóvel,
como se dentro de um quadro,
sendo a moldura o canteiro,
ou meu pobre olhar amargurado.
 Os pés estão quase suspensos,
e o corpo se fez de fino pólen.
Ainda posso enxergar a face,
que, apesar de tudo, me sorri.
 Vinda de onde não se vem,
permanece sentada no jardim.
Tenho receio de assustá-la,
com qualquer ruído ou movimento.
 Não posso, sequer, me aproximar.
Devo olhá-la de longe, cuidadoso,
sem dizer uma única, só palavra,
sempre calado e sempre distante.
 E penso quando irá embora,
se poderá voltar outro dia,
dessa ausência de muitos anos,
e dessa vasta e lenta agonia.","Il n'y a pas de chemins pour venir en ce lieu.
Et pourtant, je la vois là-bas,
au milieu des fleurs desséchées du jardin,
depuis si longtemps abandonné.
 Mais je vois une femme immobile,
se tenant à l'intérieur d'un tableau,
dont l'ossature serait le parterre,
ou l'amertume de mon pauvre regard.
 Ses pieds sont presque en suspension,
et son corps composé d'un fin pollen.
Je peux encore appréhender le visage,
qui, malgré tout, me sourit.
 Venant d'où personne ne vient,
Elle demeure assise dans le jardin.
J'ai peur de l'effrayer
par quelque bruit ou mouvement.
 Je ne peux même pas m'approcher.
Je dois la regarder de loin, avec prudence,
sans dire un mot, une seule parole
toujours silencieux et toujours distant.
 Et je pense alors, bien qu'elle aura disparu,
– si nous pourrons revenir un autre jour,
à ces nombreuses années d'absence,
et à cette vaste et lente agonie.",pt_XX,fr_XX
"Porto Seguro,
onde – dizem –,
tudo teria começado.
Praia de Apuã – ali aportamos.
Noite de lua cheia.
Minha filha disse:
– Pai, vamos apagar a lua?
E fomos.
No istmo de Coroa Vermelha,
a lua se pega com a mão.
Mas não a apagamos.
Nessa luz amarela e triste,
com índios pataxós fumando,
o corpo também flutua.
Os pés fundos na areia
são pegadas de dinossauros,
sonhos sáurios de ovos,
desde o princípio do mundo.
Porque o mar ali tudo fecunda,
com seu sal e espuma.
O ambiente marinho doura
as ideias e as confeitam
como fazem os caramujos
em sagrados volteios
e na bela arquitetura
de uma concha vã
onde torcendo o som
e verberando em silêncio
guardam o rumor primitivo
esse misterioso rumor
do princípio da vida
de onde todos viemos.
E para onde voltaremos.","Porto Seguro,
où – disent-ils,
tout aurait commencé.
Plage d'Apuã – nous y débarquons.
Nuit de pleine lune.
Ma fille a dit :
- Papa, et si nous allions moucher la lune ?
Nous y sommes allés.
Sur l'isthme de la Couronne Vermeille,
La lune s'attrapait à la main,
mais nous ne l'avons pas gommée.
Dans cette lumière jaune et triste,
où viennent fumer les Indiens Pataxó,
le corps aussi fluctue.
Les pieds enfoncés dans le sable
sont des empreintes de dinosaures,
songes sauriens des œufs
depuis le commencement du monde.
Parce que la mer y est féconde,
avec son sel et son écume.
L'ambiance marine couvre d'ors
les idées et les enrobent
comme le font les escargots
en volutes sacrées
dans la belle architecture
d'une coquille vide
où le son se tord
et se réverbère en silence,
gardienne de la rumeur primitive,
cette rumeur mystérieuse
au principe de la vie
d'où nous venons tous.
Et vers laquelle nous retournerons.",pt_XX,fr_XX
"Coitado, se acha muito macho
Sou eu que te esculacho
Te faço de capacho
 Se acha o bicho nem era tudo aquilo que contava pros amigos
Eu sempre te defino,
Desanimador, prepotente e arrogante
 Não serve pra amante talvez nem pra ficante
E não se esqueça que no final de tudo quem vive de putaria,
Leva a fama de chifrudo
 Antes de eu me esquecer
Só para você saber,
Todos, todos que provaram são melhores que você (2x)
 Ó o pente, ó o pente, ó o pente ó o pente
Defendendo a mulherada e dando sequência no pente
 Ó o pente, ó o pente, ó o pente ó o pente
Naiara Azevedo dando sequência no pente
 Traição é traição, romance é romance
Amor é amor e com você foi só um lance (2x)
 Ó o pente, ó o pente, ó o pente, ó o pente, ó o pente, ó o pente
Naiara Azevedo dando sequência no pente
 Ó o pente, ó o pente, ó o pente, ó o pente, ó o pente, ó o pente
Defendendo a mulherada e dando sequência no pente
 Coitado se acha muito macho
Sou eu que te esculacho
Te faço de capacho
 Se acha o bicho nem era tudo aquilo que contava pros amigos
Eu sempre te defino,
Desanimador, prepotente e arrogante
 Não serve pra amante talvez nem pra ficante
E não se esqueça que no final de tudo quem vivi de putaria,
Leva a fama de chifrudo
 Antes de eu me esquecer
Só para você
Saber todos,
Todos que provaram são melhores que você (2x)
 Traição é traição, romance é romance
Amor é amor e com você foi só um lance (2x)
 Ó o pente, ó o pente
Naiara Azevedo dando sequência no pente
 Ó o pente, ó o pente, ó o pente, ó o pente, ó o pente, ó o pente
Defendendo a mulherada e dando sequência no pente.","Le pauvre, il pense qu'il est le meilleur
C'est moi qui te casse
Je te fait de paillason
 Tu te prend pour un grand, tu n'est même pas ce que tu raconte a tes amis
Je te définis toujours,
Décourageant, prépotent et arrogant
 Ne sert pas comme amant et peut être même pas comme ami sexuel
Et n'oublie pas qu'à la fin de tout, qui vit de la 'puterie',
Devient connu pour avoir été trompé
 Avant que j'oublie
Juste pour que tu saches,
Tous, tous ceux qui en ont gouté sont mieux que toi (2x)
 Oh le peigne, oh le peigne, oh le peigne oh le peigne
À la défense des femmes et donnant suite au peigne
 Oh le peigne, oh le peigne, oh le peigne oh le peigne
Naiara Azevedo donnant suite au peigne
 Trahison c'est trahison, romance c'est romance
Amour c'est amour et avec toi c'était just un truc (2x)
 Oh le peigne, oh le peigne, oh le peigne oh le peigne
Naiara Azevedo donnant suite au peigne
 Oh le peigne, oh le peigne, oh le peigne oh le peigne
À la défense des femmes et donnant suite au peigne
 Le pauvre, il pense qu'il est le meilleur
C'est moi qui te casse
Je te fait de paillason
 Tu te prend pour un grand, tu n'est même pas ce que tu raconte a tes amis
Je te définis toujours,
Décourageant, prépotent et arrogant
 Ne sert pas comme amant et peut être même pas comme ami sexuel
Et n'oublie pas qu'à la fin de tout, qui vit de la 'puterie',
Devient connu pour avoir été trompé
 Avant que j'oublie
Juste pour que tu saches,
Tous, tous ceux qui en ont gouté sont mieux que toi (2x)
 Trahison c'est trahison, romance c'est romance
Amour c'est amour et avec toi c'était just un truc (2x)
 Oh le peigne, oh le peigne, oh le peigne oh le peigne
Naiara Azevedo donnant suite au peigne
 Oh le peigne, oh le peigne, oh le peigne oh le peigne
À la défense des femmes et donnant suite au peigne",pt_XX,fr_XX
"Quando eu canto, que se cuide quem não for meu irmão
O meu canto, punhalada, não conhece o perdão
 Quando eu rio
Quando eu rio, rio seco, como é seco o sertão
Meu sorriso é uma fenda escavada no chão
Quando eu choro
 Quando eu choro é uma enchente surpreendendo o verão
É o inverno, de repente, inundando o sertão
Quando eu amo
 Quando eu amo, eu devoro todo meu coração
Eu odeio, eu adoro, numa mesma oração
Quando eu canto
 Mamy, não quero seguir definhando sol a sol
Me leva daqui, eu quero partir requebrando um rock'n roll
Nem quero saber como se dança o baião
Eu quero ligar, eu quero um lugar
No sol de Ipanema, cinema e televisão","Quand je chante, ils font mieux de faire attention ceux que ne sont pas mes frères
Mon chant, coup de poignard, ne connais pas le pardon
 Quand je ris
Quand je ris, rivière sèche, comme est sec le 'sertão'
Mon sourire est une fente creusée sur le sol
Quand je pleure
 Quand je pleure c'est une inondation surprenant l'été
C'est l'hiver, tout d'un coup, inondant le 'sertão'
Quand j'aime
 Quand j'aime, je dévore tout mon coeur
Je déteste, j'adore, dans une même prière
Quand je chante
 Mamy, je ne veux pas suivre à dépérir de soleil à soleil
M'emporte d'ici, je veux partir en dansant le rock'n roll
Je ne veux pas savoir comment on danse le 'baião'
Je veux connecter, je veux un endroit
Au soleil d'Ipanema, cinéma et télévision",pt_XX,fr_XX
