original_poem,translated_poem,src_lang,tgt_lang
"Vontade de fazer
uma coisa grande
de futuro imenso:
plantar um pé
de jacarandá
um baobá
e deixá-lo aí
para beijar 
a cumeeira
dos séculos,
zombar de tudo
que é breve
e que, como nós,
se consome 
no atrito das
horas, na
vertigem
incontrolável
das coisas miúdas.","Volonté de faire
une grande chose
d'un futur immense :
planter un pied
de jaracanda
un baobab
et le laisser là
pour embrasser
le point culminant
des siècles,
se moquer de tout
ce qui est bref
et qui, comme nous,
se consume
dans la friction des
heures dans
le vertige
incontrôlable
des choses menues.",pt_XX,fr_XX
"Eu dei te a minha vida
Minhas noites meus dias
Por te amar entreguei te tudo
E era por ti que eu vivia
mesmo até os meus sonhos
era a dois que eu sonhava
qualquer hora qualquer segundo
por te querer também te dava
demais, eu dei me demais
e no momento em que
não tenho nada dizes que te vais
 E agora como é que eu vivo
se já não sei viver sem ti
só me resta chorar aqui sozinho
e depois esperar o fim
e agora como é que eu vivo
se já não sei viver por mim
sei apenas a cor do meu destino
que é morrer aqui sem ti
sem ti, sem ti
 Eu dei te a minha vida
e até o que não tinha
por te amar entreguei te tudo
e era por ti que eu vivia
mesmo até nos meus passos
eu por ti caminhava
qualquer lado mais profundo
do meu ser não te negava
demais, eu dei me demais
e no momento em que
não tenho nada dizes que te vais
 E agora como é que eu vivo
se já não sei viver sem ti
só me resta chorar aqui sozinho
e depois esperar o fim
e agora como é que eu vivo
se já não sei viver por mim
sei apenas a cor do meu destino
que é morrer aqui sem ti
sem ti, sem ti
 E agora como é que eu vivo
se já não sei viver sem ti
só me resta chorar aqui sozinho
e depois esperar o fim
e agora como é que eu vivo
se já não sei viver por mim
sei apenas a cor do meu destino
que é morrer aqui sem ti
sem ti, sem ti","Je t'ai donné ma vie,
Mes nuits, mes jours.
Pour t'aimer, je t'ai tout offert
Et c'était pour toi que je vivais.
Même dans mes rêves,
C'était à nous deux que je rêvais.
Toutes mes heures, toutes mes secondes,
Je te les donnais aussi pour t'aimer.
Trop, je me donnais trop.
Et au moment où
Je ne me reste plus rien, tu me dis que tu t'en vas.
 Et maintenant comment vais-je vivre?
Si je ne sais déjà plus vivre sans toi.
Il ne me reste plus qu'à pleurer seul, ici
Et puis attendre la fin.
Et maintenant comment vais-je vivre?
Si je ne sais déjà plus vivre pour moi.
Je connais à peine la suite de mon destin
Qui est de mourir ici sans toi,
Sans toi, sans toi.
 Je t'ai donné ma vie,
Mes nuits, mes jours.
Pour t'aimer, je t'ai tout offert
Et c'était pour toi que je vivais.
Même dans mes rêves,
C'était à nous deux que je rêvais.
Toutes mes heures, toutes mes secondes,
Je te les donnais aussi pour t'aimer.
Trop, je me donnais trop.
Et au moment où
Je ne me reste plus rien, tu me dis que tu t'en vas.
 Et maintenant comment vais-je vivre?
Si je ne sais déjà plus vivre sans toi.
Il ne me reste plus qu'à pleurer seul, ici
Et puis attendre la fin.
Et maintenant comment vais-je vivre?
Si je ne sais déjà plus vivre pour moi.
Je connais à peine la suite de mon destin
Qui est de mourir ici sans toi,
Sans toi, sans toi.
 Et maintenant comment vais-je vivre?
Si je ne sais déjà plus vivre sans toi.
Il ne me reste plus qu'à pleurer seul, ici
Et puis attendre la fin.
Et maintenant comment vais-je vivre?
Si je ne sais déjà plus vivre pour moi.
Je connais à peine la suite de mon destin
Qui est de mourir ici sans toi,
Sans toi, sans toi.",pt_XX,fr_XX
"anatomia de coisas
 desnudar
o pássaro de vidro
e ver em seu lado
oculto
o outro lado
de seu vulto
 dissecar
vozes
sombras descalças
e perquirir
a substância
escassa que principia
na polpa
branca do dia
 flagrar a ânsia
do relógio
e a cadência
dessa máquina
humana
 fotografar
a permanência
da chama
 anatomia do gesto
 dobrar a esquina
de mim mesmo
olhar pra trás
e ainda
enxergar
o resto de
meu gesto
tonto","anatomie des choses
 dénuder
l'oiseau de verre
et voir en son côté
caché
l'autre côté
de sa silhouette
 disséquer
des voix
des ombres pieds nus
et s'enquérir
de la maigre
substance qui débute
dans la pulpe
blanche du jour
 attraper l'envie
de l'horloge
et la cadence
de cette machine
humaine
 photographier
la permanence
de la flamme
 anatomie du geste
 tourner à l'angle
de moi-même
regarder en arrière
et percevoir
encore
la trace de
mon geste
étourdi",pt_XX,fr_XX
"Nossa velha amizade nasceu
De uma luz que acendeu
Aos olhos de abril
Com cuidado e espanto eu te olhei
No entanto você sorriu
 Concedendo-me a graça de ver
Talhado em você a nobreza de frente
O amor se desnudando
No meio de tanta gente
 Um doce descascado pra mim
Eu guardo pro fim
Pra comer demorado
Uma grande amizade é assim
Dois homens apaixonados
 E sentir a alegria de ver
A mão do prazer acenando pra gente
O amor crescendo enfim
Como capim pros meus dentes","Notre vieille amitié est née
D'une lumière qui s'est allumée
aux yeux d'Avril
avec attention et étonnement je t'ai regardé
quoi qu'il en soit tu as souri
 En m' accordant la grâce de voir
taillée en toi la véritable noblesse
l'amour se dévoilant
Au milieu de tant de gens
 Un dessert décortiqué pour moi
je le garde pour la fin
pour le déguster lentement
une grande amitié c'est comme ça
Deux hommes passionnés
 Et sentir la joie de voir
les gens nous saluant de la main avec plaisir
L'amour grandissant enfin
comme un brin d'herbe à dents",pt_XX,fr_XX
"Te querer
Viver mais pra ser exato
Te seguir
E poder chegar
Onde tudo é só meu
 Te encontrar
Dar a cara pro teu beijo
Correr atrás de ti
Feito cigano, cigano, cigano
Me jogar sem medir
 Viajar
Entre pernas e delícias
Conhecer pra notícias dar
Devassar sua vida
 Resistir
Ao que pode o pensamento
Saber chegar no seu melhor
Momento, momento, momento
 Pra ficar e ficar
Juntos, dentro, horas
Tudo ali às claras
Deixar crescer
Até romper
 A manhã
Como o mar está sereno
Olha lá
As gaivotas já
Vão deixar suas ilhas
Veja o sol
É demais essa cidade
A gente vai ter um dia de calor
 Juntos, dentro, horas
Tudo ali às claras
Deixar crescer
Até romper
 A manhã
Como o mar está sereno
Olha lá
As gaivotas já
Vão deixar suas ilhas
Veja o sol
É demais essa cidade
A gente vai ter um dia de calor","Et vouloir
Vivre plus pour être exact
Te suivre
Et pouvoir arriver
là où tout m'appartient
Te rencontrer
Face à face pour t'embrasser
Courir après toi , tu es gitane, gitane, gitane
Joue de moi sans mesure
voyager
entre jambes et plaisirs
Connaître la notice d'emploi pour
dévaster ta vie
Résister
à ce à quoi on peut penser
Savoir donner le meilleur
un moment, un moment, un moment
pour rester et rester
 Ensemble en quelques heures
Tout est à l'air libre
Laisser grandir jusqu'à la rupture
Le matin comme la mer est calme
regarde là
Les mouettes vont déjà quitter leurs îles
vois le soleil
C'en est trop de cette ville !
On va avoir une journée chaude ..",pt_XX,fr_XX
"Naquele instante
Em que o dia cai
E o sol finge brilhar
Pra noite
Todos os pássaros
Buscam um canto pra sonhar
E todo desejo é maior, hum!... ..
Quer me torturar, hein?
O que mais eu quero
É saber se me quer ou não
O que desejar, tem
O mais sincero
Tudo em mim é você
Veja bem, hum!...
Naquele instante
Em que o dia cai
E o sol finge brilhar
Pra noite
Tudo é tão raro
Quanto é inviável
Ter que se achar na vida
Amando só.","A cet instant
alors que le jour tombe
et que le soleil prétend encore briller
à la nuit
tous les oiseaux
cherchent un coin pour rêver
et chaque désir est primordial, hum !...
Tu veux me torturer, hein ?
Ce que je veux en plus
C'est savoir si tu me veux ou non
Tout ce que tu veux, tu l' as
Plus sincèrement
Tu es tout pour moi
tu le vois bien, hum! ...
A cet instant
alors que le jour tombe
et que le soleil prétend encore briller
à la nuit
Tout est si rare
Dans quelle mesure est-ce invivable
Pour se retrouver dans la vie
il faut juste de l'amour .",pt_XX,fr_XX
"Esse matagal sem fim
Essa estrada, esse rio seco
Essa dor que mora em mim
Não descansa e nem dorme cedo
O retrato da minha vida
É amar em segredo
Não quer saber de mim
E eu vivendo da tua vida
Deus no céu e você aqui
A esperança é quem me abriga
Esses campos não tardam em florir
Já se espera uma boa colheita
E tudo parece seguir
Fazendo a vida tão direita
Mas e você o que faz
Que não repara no chão
Por onde tem que passar
E pisa em meu coração?
O teu beijo em meu destino T
Era tudo o que eu queria
Ser teu homem, teu menino
O ser amado de todo dia.","Ce maquis sans fin
Cette route, cette rivière asséchée
Cette douleur qui vit en moi
ne s'arrête pas et ne s'endort pas tôt
Le portrait de ma vie
est d'aimer en secret
Tu ne veux rien savoir de moi
Et moi vivant de ta vie
Dieu dans le ciel et toi ici
C'est l'espoir qui m'abrite
Ces champs ne vont pas tarder à fleurir
Une bonne récolte est déjà attendue
Et tout semble suivre
Rendant la vie si droite
Mais et toi comment ça se fait
que tu ne répares pas le chemin
Par ou il faut passer
et que tu piétines mon coeur ?
Ton baiser est mon destin
C' était tout ce que je voulais
Etre ton homme, ton copain
être aimé chaque jour.",pt_XX,fr_XX
"Sei que tens perguntado
Como estou depois de ti
Se estou preso ao passado
Se encontrei alguém e sou feliz
Mas ninguém pode dizer-te o que eu sinto
Só eu sei o que passei e sofri
 Refrão:
 Desde que eu te perdi
Eu perdi minha vida
Sou metade de mim
Num deserto fiquei
Desde que eu te perdi
Não encontrei saída
O princípio do fim
Foi o que eu encontrei
Desde que eu te perdi
 Queria tanto dizer-te
E contar-te como estou
Mas é melhor esconder-te
E sofrer sozinho a minha dor
E ficar na solidão em silêncio
Para deixar seres mais feliz do que eu sou
 Refrão:
 Desde que eu te perdi
Eu perdi minha vida
Sou metade de mim
Num deserto fiquei
Desde que eu te perdi
Não encontrei saída
O princípio do fim
Foi o que eu encontrei
Desde que eu te perdi","Je sais que tu as demandé
Comment je vais depuis ton départ,
Si je suis bloqué dans le passé,
Si j'ai rencontré quelqu'un et si je suis heureux.
Mais personne ne peut te dire ce que je sens.
Moi seul peux savoir ce que j'ai supporté et souffert.
 Refrain:
 Depuis que je t'ai perdue,
J'ai perdu ma vie.
Je ne suis plus que la moitié de moi,
Je suis resté dans un desert.
Depuis que je t'ai perdue,
Je n'ai pas trouvé d'issue.
Le début de la fin,
Voila ce que j'ai trouvé
Depuis que je t'ai perdue.
 Je voudrais tant te dire
Et te raconter comment je suis.
Mais c'est mieux de le cacher
Et de souffrir seul de ma douleur
Et rester dans la solitude en silence
Pour rester plus heureux que je ne suis.
 Refrain:
 Depuis que je t'ai perdue,
J'ai perdu ma vie.
Je ne suis plus que la moitié de moi,
Je suis resté dans un desert.
Depuis que je t'ai perdue,
Je n'ai pas trouvé d'issue
Au début de la fin.
Voila ce que j'ai trouvé
Depuis que je t'ai perdue.",pt_XX,fr_XX
"[Verso 1: Camané]
Vou cantar como quem despe
Cantar como quem cospe
Como alcanço a mão na queda
Como mordo o pão da fome
 Vou cantar como quem serve
Cantar como quem sofre
Como sorvo o ar da fresta
Como murmuro o teu nome
 Vou cantar como quem perde
Cantar como quem sabe
Como peço o céu na sede
Cantar como quem arde
 [Refrão: Camané]
Eu ofereço a minha voz
Flor que se dá
Estranha e bela
Como a do maracujá
 Eu ofereço a minha voz
Flor que se dá
Estranha e bela
Como a do maracujá
 Eu ofereço a minha voz
Flor que se dá
Estranha e bela
Como a do maracujá
 Estranha e bela
Como a do maracujá
 Estranha e bela
Estranha e bela","[Couplet 1: Camané]
Je vais chanter comme on se déshabille
Chanter comme on crache
Comme je tends la main dans la chute
Comme je mords dans le pain de faim
 Je vais chanter comme on sert
Chanter comme on souffre
Comme j'avale l'air de la fissure
Comme je murmure ton nom
 Je vais chanter comme on perd
Chanter comme on sait
Comme je supplique le ciel de soif
Chanter comme on brûle
 [Refrain: Camané]
J'offre ma voix
Fleur qui se donne
Étrange et belle
Comme celle du maracuja
 J'offre ma voix
Fleur qui se donne
Étrange et belle
Comme celle du maracuja
 J'offre ma voix
Fleur qui se donne
Étrange et belle
Comme celle du maracuja
 Étrange et belle
Comme celle du maracuja
 Étrange et belle
Étrange et belle",pt_XX,fr_XX
"Quando a tua voz
Entrou na minha casa
Abri as janelas
Abri as minhas asas
O vento soprou para nós
Levou-nos a todo lado
Soltei as veias
Esqueci todo o meu fado
 Vivemos os dois um conto de fadas
Deixa para depois
As tristezas e as mágoas
Vamos viver, amor
Ao sabor deste vento
Deixa para depois
O choro e o lamento
 Quando a tua voz
Saiu da minha casa
Fechei as janelas
Fechei as minhas asas
O vento não sopra mais
E a tristeza mora ao lado
Apaguei a vela
E lembrei-me deste fado
 Disse-me numa voz
Dá tempo ao tempo
Deixa no coração entrar o esquecimento
Disse-me que o céu não é sempre cinzento
Vai, volta a voar
Nas asas de outro vento","Quand ta voix
Est entrée chez moi
J'ai ouvert les fenêtres
J'ai déployé mes ailes
Le vent a soufflé pour nous
Il nous a emportés partout
J'ai sorti mes veines
J'ai oublié tout mon fado
 Nous vivons tous les deux un conte de fée
Laisse pour plus tard
Les tristesses et les peines
Nous allons vivre, mon amour
La goûte de ce vent
Laisse pour plus tard
Les pleurs et les regrets
 Quand ta voix
Est partie de chez moi
J'ai fermé les fenêtres
J'ai replié mes ailes
Le vent ne souffle plus
Et la tristesse s'est installée
J'ai éteint la bougie
Et je me suis rappelé ce fado
 Je me suis dit
Donne le temps au temps
Laisse l'oubli entrer dans le coeur
Je me suis dit que le ciel n'est pas toujours gris
Va, vole à nouveau
Sur les ailes d'un autre vent",pt_XX,fr_XX
"digo que foi o vento:
inundou meus olhos
de sal
 (esse vento do mar
você sabe...)
 mas é mentira:
não são lágrimas
de sal
é a pungência do azul","Je dis que c'était le vent :
il a inondé mes yeux
de sel
 (ce vent de mer
tu sais bien...)
 mais ce serait mentir :
ce ne sont pas des larmes
de sel
c'est le poignant du bleu",pt_XX,fr_XX
"As coisas não têm culpa.
São apenas testemunhas
de nossas comédias.
 As coisas não abraçam causas.
É inútil acusá-las
de qualquer inclinação,
lealdade ou felonia.
 Substantivos neutros,
são apenas coisas:
este botão descosturado de tua blusa
este chinelo ao pé da cama
um folha de papel em branco 
- e nenhum drama.
 As coisas não guardam segredos
nem remorsos.
Assistem caladas
e resistem
vestidas de cal e silêncio.
 As coisas não têm quereres
nem poderes.
 Mas, desassombradas, 
exibem sempre
o semblante estoico da pedra.
 Nisso as coisas são todas iguais
 — todas indiferentes.","Les choses ne sont pas responsables.
Elles ne sont que les témoins
de nos comédies.
 Les choses n'embrassent pas de causes.
Inutile de les accuser
d'un quelconque penchant,
de loyauté ou de félonie.
 Neutres, substantivement,
elles sont à peine des choses :
ce bouton décousu de ton chemisier
cette pantoufle au pied du lit
blanche, une feuille de papier
– et il n'y a pas de drame.
 Les choses ne gardent aucun secret,
n'ont pas de remords.
Elles sont là, discrètes
qui résistent,
vêtues de chaux, et de silence.
 Les choses n'ont pas de volonté
ni de pouvoirs.
 Mais, sans aucune ombre,
elles affichent toujours
l'aspect stoïque de la pierre.
 En cela, toutes les choses sont égales
 – toutes indifférentes.",pt_XX,fr_XX
"Antes de Babel,
todos os tradutores estavam no desemprego.
 Antes de Babel,
a indústria dos dicionários estava falida.
 Antes de Babel,
não havia Cervantes, nem Goethe, nem Alliance Française.
 Antes de Babel,
a tradução simultânea estava entregue a papagaios.
 Antes de Babel,
não havia: «Tens muito jeito para línguas.»
 Antes de Babel,
até a serpente assobiava na língua de Eva.
 Depois de Babel,
é que ninguém se entende.
 Depois de Babel,
só o que os olhos dizem é o mesmo em todas as línguas.","Avant Babel,
tous les traducteurs étaient au chômage.
 Avant Babel,
l'industrie des dictionnaires étaient en faillite.
 Avant Babel,
Pas de Cervantès, ni de Goethe, ni d'Alliance Française.
 Avant Babel,
la traduction simultanée était confiée aux perroquets.
 Avant Babel,
il n'y avait pas de « tu as un don pour les langues »
 Avant Babel,
jusqu'au serpent qui sifflait dans la langue d’Ève.
 Depuis Babel,
plus personne ne se comprend.
 Depuis Babel,
seul ce que les yeux disent est le même dans toutes les langues.",pt_XX,fr_XX
"Encontrei o segredo, a chave de vidro
das palavras que escrevo, e tenho medo.
Talvez nos campos imensos onde o lírio floresce,
na margem de rio que abriga, de manhã cedo,
os teus pés de ninfa, num engano de idade,
me tenhas visto à sombra de um rochedo,
e se os teus lábios, entreabertos num torpor
de romã, me tocaram num sonho bêbedo,
deles só lembro, imprecisos, fluxos
de incêndio numa hipótese de amor.","J'ai trouvé le secret, la clé de verre
des mots que j'écris, et j'ai peur.
Dans les champs immenses où fleurit le lis,
sur les bords de la rivière où, tôt le matin, vont
tes pieds de nymphe, par une tromperie de l'âge,
il se peut qu'à l'ombre d'un rocher, tu m'aies vu
et si tes lèvres, entrouvertes dans une torpeur
de grenade, m'ont touché, en un songe d'ivresse,
je n'ai d'elles, imprécises, que le souvenir des coulées
de feu d'une hypothèse d'amour.",pt_XX,fr_XX
"Lembra daquele lugar, daquela janela
O céu tava estrelado
E a lua a nossa espera tão bela
 Lembra de todos os planos que a gente fazia
E daquele arrepio
Que você escondia, eu via
 Lembra daquela novela que a gente via junto?
Lembro de tudo!
Quantas noites mal dormidas
Consertando as nossas brigas, eu lembro
 Nossos defeitos, os desencontros
Não é novidade, tudo faz parte
Mas eu confesso, faria de novo
Eu arriscaria, minha vida pra te amar outra vez
 Lembra daquela novela que a gente via junto?
Lembro de tudo!
Quantas noites mal dormidas
Consertando as nossas brigas, eu lembro
 Nossos defeitos, os desencontros
Não é novidade, tudo faz parte
Mas eu confesso, faria de novo
Eu arriscaria, minha vida pra te amar outra vez
 Nossos defeitos, os desencontros
Não é novidade, tudo faz parte
Mas eu confesso, faria de novo
Eu arriscaria, minha vida pra te amar outra vez
Eu arriscaria, minha vida pra te amar","Tu te souviens de cet endroit, de cette fenêtre?
Le ciel était étoilé
Et la lune qui nous attendait était si belle.
 Souviens-toi de tous les projets que nous faisions
Et de ce frisson
Que tu cachais, je l'ai vu.
 Te souviens-tu de ce film que nous avions vu ensemble?
Je me souviens de tout!
Que de nuits blanches
Où nous remettions d'accord après nos disputes, je me souviens.
 Nos défauts, les divergences de vues,
C'est pas nouveau, tout fait partie (de la vie)
Mais, je l'avoue, je le referais
Je risquerais ma vie pour t'aimer de nouveau.",pt_XX,fr_XX
"cavalos burros
jumentos
na rua:
é dia de feira
 no paralelepípedo
a pata do quadrúpede
acende uma centelha","chevaux mulets
bardeaux
dans la rue :
c'est jour de foire
 sur les parallélépipèdes
les pattes d'un quadrupède
allument des étincelles",pt_XX,fr_XX
"Entra, fecha a porta
E me abraça dizendo
Amor, tô de volta
 Entra, não me importa
O que fez da tua vida
Depois da partida
Só prometa não me deixar
De novo...
 Entro e te abraço
Vou te enchendo de beijos
Matando desejo
 Entro e me tranco
De uma vez no seu peito
Eu não tinha direito
Ah, foi bobeira eu te deixar
 Me diga que voltou,
Não deu pra me esquecer
Você se enganou
Tentando se envolver com ela
Mas não sentiu amor por ela
 Foi crise de paixão
Eu sempre amei você
Detalhe que jamais
Deixei de te querer
Perdoa
Eu não senti amor por ela
Eu nunca te troquei por ela
 Deixa eu voltar
Entra (entro), fecha a porta (fecho)
E me abraça dizendo
Amor, tô de volta
 Entro e me tranco
De uma vez no seu peito
Eu não tinha direito
Ah, foi bobeira eu te deixar
 Me diga que voltou,
Não deu pra me esquecer
Você se enganou
Tentando se envolver com ela
Mas não sentiu amor por ela
 Vou me explicar, vou me explicar
 Foi crise de paixão
Eu sempre amei você
Detalhe que jamais
Deixei de te querer
Perdoa
Eu não senti amor por ela
E retorno a dizer
Eu nunca te troquei por ela","Il entre, ferme la porte
Et m'embrasse en disant:
Mon amour, je suis de retour.
 Entre, peu importe
Ce que tu as fait de ta vie
Après ton départ.
Promets-moi seulement de ne pas me laisser
De nouveau...
 Je suis entré et je t'ai embrassé.
Je vais t'emplir de baisers
En étouffant le désir.
 Je suis entré et je me suis jeté
d'un coup sur sa poitrine.
Mais je n'avais pas le droit.
Ah, J'ai été bête de te quitter.
 Il me dit qu'il revenait,
Car il ne pouvait pas m'oublier.
Tu t'es trompé
En essayant de s'engager avec elle
Mais il n'a pas senti d'amour pour elle.
 Ce fut une crise de passion
Je t'ai toujours aimé.
Je t'explique que jamais
Je n'ai cessé de t'aimer.
Pardon,
Je n'ai pas senti d'amour pour elle
Et jamais je ne t'ai pas échangé pour elle.
 Laisse-moi revenir.
Il entre, ferme la porte
Et m'embrasse en disant:
Mon amour, je suis de retour.
 Je suis entré et j'ai sauté
d'un coup sur sa poitrine.
Mais je n'avais pas le droit.
Ah, J'ai été bête de te quitter.
 Il me dit qu'il revenait,
Car il ne pouvait pas m'oublier.
Tu t'es trompé
En essayant de s'engager avec elle
Mais il n'a pas senti d'amour pour elle.
 Je vais m'expliquer, je vais m'expliquer.
 Ce fut une crise de passion
Je t'ai toujours aimé.
Je t'explique que jamais
Je n'ai cessé de t'aimer.
Pardon,
Je n'ai pas senti d'amour pour elle
Et je te dis encore que
Jamais je ne t'ai pas échangé pour elle.",pt_XX,fr_XX
"Nem todos os que construíram as catedrais viram
o mesmo. Uns, ergueram torres e pináculos, à luz do sol,
e chegaram ao céu; outros, metidos nas criptas,
pintaram infernos à luz de velas, deixando no chão
o lugar para os mais anónimos dos mortos. Os
que chegaram ao cimo, receberam o olhar divino e
viram o júbilo das madrugadas primaveris; os
que ficaram no fundo, arrancando à humidade das paredes
o gesto alucinado dos demónios, trocaram
obscenidades e doenças. No entanto, a catedral
é única; e quem a visita, apreciando a totalidade que, dizem,
nasceu de uma visão do absoluto, não pensa
em pormenores. Que importa os que trabalharam
na sombra, perdendo a luz dos olhos com o minucioso
desenho arrancando à treva, se o que hoje se vê
é esse contorno em que a pedra trabalha o céu? Assim,
conclui-se, é da desigualdade que nasce
a harmonia; e é a desordem humana que faz brotar,
do nada, tudo o que admiramos.","De tous ceux qui construisirent les cathédrales, d'aucuns ne virent
le même. Certains, érigèrent des tours et des flèches à la lumière
du soleil et parvinrent au ciel ; d'autres dans les cryptes
peignirent des enfers à la lumière des torches, laissant au sol
un lieu idéal pour les plus anonymes des morts. Ceux
qui atteignirent la cime, furent touché par le regard divin et
jubilèrent au son de madrigaux printaniers ; ceux
qui se trouvaient dans le fond, extirpant à l'humidité des parois
le geste halluciné des démons, échangèrent
obscénités et maladies. Cependant, une cathédrale
est unique; et quiconque la visite, en appréciant la totalité qui, dit-on,
est née d'une vision de l'absolu, n'en perçoit pas
les détails. Que lui importe ceux qui travaillèrent dans l'ombre,
en perdant la lumière de leurs yeux comme ils traçaient
leur minutieux dessins dans les ténèbres, si ce qu'il voit
aujourd'hui est ce contour dans lequel la pierre travaille le ciel ?
Il s’ensuit que c’est de l’inégalité que naît l’harmonie;
et du désordre humain que jaillit de nulle part,
tout ce que nous admirons.",pt_XX,fr_XX
