original_poem,translated_poem,src_lang,tgt_lang,translated_by_TA,topic
"o mostrengo
o mostrengo que está no fim do mar
na noite de breu ergueu-se a voar
à roda da nau voou três vezes
voou três vezes a chiar
e disse: quem é que ousou entrar
nas minhas cavernas que não desvendo
meus tectos negros do fim do mundo?
e o homem do leme disse
tremendo:
el-rei d. joão segundo!
de quem são as velas onde me roço?
de quem as quilhas que vejo e ouço?
disse o mostrengo
e rodou três vezes
três vezes rodou imundo e grosso.
quem vem poder o que só eu posso
que moro onde nunca ninguém me visse
e escorro os medos do mar sem fundo?
e o homem do leme tremeu
e disse:
el-rei d. joão segundo!
três vezes do leme as mãos ergueu
três vezes ao leme as reprendeu
e disse no fim de tremer três vezes:
aqui ao leme sou mais do que eu:
sou um povo que quer o mar que é teu
e mais que o mostrengo
que me a alma teme
e roda nas trevas do fim do mundo
manda a vontade
que me ata ao leme
d' el-rei d. joão segundo!","l 'horrible monstre
le monstre qui est au bout de l’océan
une nuit de brai se mit à voler
autour du navire il vola trois fois
trois fois il vola en hurlant
et il dit: qui a osé entrer
dans mes cavernes que je ne dévoile pas
mes toits noirs du bout du monde?
et l’homme du gouvernail a dit
en tremblant:
le roi jean le second
a qui sont ces voiles que je frôle
a qui les quilles que je vois et entends?
a dit le monstre
et il tourna trois fois
trois fois il tourna
hideux et gras.
qui a le pouvoir qui n’est qu’à moi
moi qui habite où personne ne me voit
et je distille les peurs de la mer sans fond
et l’homme du gouvernail trembla
et dit:
le roi jean le second!
trois fois du gouvernail les mains il leva
trois fois sur le gouvernail il les remit
et enfin tremblant trois fois il dit
ici au gouvernail je suis plus que moi
je suis un peuple qui veut la mer qui est à toi
et plus que le monstre que mon âme craint
et qui tourne dans les ténèbres du bout du monde
commande la volonté qui m’attache au gouvernail
qui est celle du roi jean le second",pt_XX,fr_XX,"Le monstre
Le monstre qui est au bout de la mer
Dans la nuit noire, il s'est envolé
Autour du navire, il a volé trois fois
Il a volé trois fois en grondant
Et il a dit : Qui a osé entrer
Dans mes cavernes que je ne dévoile pas
Mes toits noirs de la fin du monde ?
Et l'homme du gouvernail a dit
Tremblant :
Roi d. jean deuxième !
De qui sont les voiles que je frôle ?
De qui les quilles que je vois et j'entends ?
Le monstre a dit
Et il a tourné trois fois
Il a tourné trois fois immonde et épais.
Qui peut faire ce que moi seul peux faire
Que je demeure où personne ne m'a jamais vu
Et que je coule les peurs de la mer sans fond ?
Et l'homme du gouvernail a tremblé
Et il a dit :
Roi d. jean deuxième !
Trois fois de gouvernail les mains a soulevé
Trois fois au gouvernail les a reprises
Et il a dit à la fin de trembler trois fois :
Ici au gouvernail, je suis plus que moi :
Je suis un peuple qui veut la mer qui est la tienne
Et plus que le monstre
Qui me fait peur à l'âme
Et tourne dans les ténèbres de la fin du monde
S'accomplit la volonté
Qui m'attache au gouvernail
Du roi d. jean deuxième !",-1
"fragmento de tempo
enquanto lá fora estoura
o sol do meio-dia
entre as paredes antigas
o tempo desfia sombrio
e lentamente
o seu rosário de horas.
o tempo descansa a cabeça
sobre almofadas de cetim branco
ou de veludo bordado.
o tempo sorri nos móveis enfeitados
com paninhos de organdi
debruados com perlé dourado.
há os tempos que se escondem
nas gavetas misteriosas e secretas
os que cochilam em poltronas de palhinha
vigiados por retratos redondos na parede.
tempos que se diluem na frágil linha
traçada entre o passado e o presente
que vivem nos sonhos
e dormem nas lembranças
enquanto lá fora estoura
o sol do meio-dia.","fragment du temps
alors qu’éclate dehors
le soleil de midi
entre les vieux murs
le temps egrène obscur et lentement
son chapelet des heures.
le temps repose sa tête
sur des coussins de satin blanc
ou de velours brodé.
le temps sourit dans le mobilier garni
de napperons organdi
ourlés de perlé doré.
il y a les temps qui se cachent
dans des tiroirs mystérieux et secrets
ceux qui sommeillent dans des fauteuils paillés
surveillés par les portraits ronds du mur.
les temps qui se diluent dans la ligne fragile
tracée entre le passé et le présent
qui vivent dans les rêves
et dorment dans les pensées
alors qu’éclate dehors
le soleil de midi.",pt_XX,fr_XX,"Fragment de temps
alors qu'au-dehors éclate
le soleil du midi
entre les murs anciens
le temps défile sombre
et lentement
son chapelet d'heures.
le temps repose sa tête
sur des coussins de satin blanc
ou de velours brodé.
le temps sourit dans les meubles ornés
de petits napperons en organdi
doublés de perlé doré.
il y a des temps qui se cachent
dans les tiroirs mystérieux et secrets
ceux qui piquent un somme dans des fauteuils de paille
surveillés par des portraits ronds au mur.
des temps qui se dissipent dans la fragile ligne
tracée entre passé et présent
qui vivent dans les rêves
et dorment dans les souvenirs
alors qu'au-dehors éclate
le soleil du midi.",0
"mar português
ó mar salgado, quanto do teu sal
são lágrimas de portugal!
por te cruzarmos, quantas mães choraram,
quantos filhos em vão rezaram!
quantas noivas ficaram por casar
para que fosses nosso, ó mar!
valeu a pena? tudo vale a pena
se a alma não é pequena.
quem quer passar além do bojador
tem que passar além da dor.
deus ao mar o perigo e o abismo deu,
mas nele é que espelhou o céu.","mer du portugal
oh mer salée, dans ton sel
combien de larmes du portugal!
parce nous t’avons sillonnée, combien de mères ont pleuré,
combien d’enfants ont en vain prié!
combien de fiancées n’ont pu se marier
pour que tu sois à nous, oh mer!
cela a-t-il valu la peine? tout vaut la peine
si l’esprit n’est pas mesquin.
qui veut aller au-delà du bojador
doit dépasser la douleur.
c’est à la mer que dieu a donné le péril et l’abîme,
mais c’est sur elle qu’il fait resplendir le ciel.",pt_XX,fr_XX,"mer portugais

ô mer salé, combien de ton sel
sont des larmes du portugal !
pour te traverser, combien de mères ont pleuré,
combien d'enfants ont prié en vain !
combien de vierges sont restées sans mari
pour que tu sois le nôtre, ô mer !
en valait-il la peine ? tout vaut la peine
si l'âme n'est pas petite.
qui veut passer au-delà du cap bojador
doit passer au-delà de la douleur.
dieu a donné au mer le danger et l'abîme,
mais c'est en lui qu'il a reflété le ciel.",0
"antes que seja tarde
amigo,
tu que choras uma angústia qualquer
e falas de coisas mansas como o luar
e paradas
como as águas de um lago adormecido,
acorda!
deixa de vez
as margens do regato solitário
onde te miras
como se fosses a tua namorada
abandona o jardim sem flores
desse país inventado
onde tu és o único habitante
deixa os desejos sem rumo
e esse ar de renúncia
às coisas do mundo.
acorda, amigo,
liberta-te dessa paz podre de milagre
que existe
apenas na tua imaginação
abre os olhos e olha,
abre os braços e luta!
amigo,
antes da morte vir
nasce de vez para a vida.","avant qu’il ne soit trop tard
mon ami,
toi qui pleures sur une quelconque angoisse
et qui parles de choses douces comme le clair de lune
et immobiles
comme les eaux d’un lac endormi,
réveille-toi!
laisse une fois pour toutes
les rives du ruisseau solitaire
où tu te contemples
comme si tu étais ta propre fiancée.
abandonne le jardin sans fleurs
de ce pays inventé
où tu est le seul habitant.
laisse les désirs sans orientation
de bateau à la dérive
et cet air de qui renonce
à toutes les choses du monde.
réveille-toi mon ami
libère-toi de cette paix pourrie
qui n’existe
que dans ton imagination.
ouvre les yeux et regarde,
ouvre les bras e lutte!
mon ami,
avant que la mort arrive
renaît pour toujours à la vie.",pt_XX,fr_XX,"Avant qu'il ne soit trop tard
ami,
toi qui pleures une quelconque angoisse
et parles de choses douces comme la lune
et immobiles
comme les eaux d'un lac endormi,
réveille-toi !
laisse pour toujours
les bords du ruisseau solitaire
où tu te contemples
comme si tu étais ta propre petite amie
quitte le jardin sans fleurs
de ce pays inventé
où tu es l'unique habitant
laisse les désirs sans direction
et cet air de renoncement
aux choses du monde.
réveille-toi, ami,
échappe-toi à cette paix pourrie de miracle
qui n'existe
qu'en ton imagination
ouvre les yeux et regarde,
ouvre les bras et lutte !
ami,
avant que la mort ne vienne
renaissances pour la vie.",-1
"o teu retrato
deus fez a noite com o teu olhar,
deus fez as ondas com os teus cabelos;
com a tua coragem fez castelos
que pôs, como defesa, à beira-mar.
com um sorriso teu, fez o luar
(que é sorriso de noite, ao viandante)
e eu que andava pelo mundo, errante,
já não ando perdido em alto-mar!
do céu de portugal fez a tua alma!
e ao ver-te sempre assim, tão pura e calma,
da minha noite, eu fiz a claridade!
ó meu anjo de luz e de esperança,
será em ti afinal que descansa
o triste fim da minha mocidade!","ton portrait
dieu a fait la nuit avec ton regard,
dieu a fait les vagues avec tes cheveux;
avec ton courage il a fait des châteaux
qu’il a posé, en défense, au bord de la mer.
avec un de tes sourires, il a fait le clair de lune
(qui est un sourire de nuit, pour le voyageur)
et moi qui parcourais le monde, en errant,
je ne me retrouve plus perdu en haute mer!
avec le ciel du portugal il a fait ton âme
et en te voyant toujours ainsi, si pure et calme,
de ma nuit, j’en ai fait la clarté!
oh mon ange de lumière et d’espoir,
serait-ce en toi que, en fin de compte, repose
la triste fin de ma jeunesse!",pt_XX,fr_XX,"votre portrait

dieu a fait la nuit avec ton regard,
dieu a fait les vagues avec tes cheveux ;
avec ta bravoure il a fait des châteaux
qu'il a mis, comme défense, à la bord de mer.
avec un sourire à toi, il a fait le clair de lune
(qu'est sourire de nuit, au voyageur)
et moi qui errais par le monde, errant,
je ne vagabonde plus en pleine mer !
du ciel du portugal il a fait ton âme !
et en te voyant toujours ainsi, si pure et calme,
de ma nuit, j'ai fait la clarté !
ô mon ange de lumière et d'espoir,
sera-t-il en toi finalement que je repose
le triste déclin de ma jeunesse ?",0
"se tu viesses ver-me...
se tu viesses ver-me hoje à tardinha,
a essa hora dos mágicos cansaços,
quando a noite de manso se avizinha,
e me prendesses toda nos teus braços...
quando me lembra: esse sabor que tinha
a tua boca... o eco dos teus passos....
o teu riso de fonte... os teus abraços...
os teus beijos... a tua mão na minha...
se tu viesses quando, linda e louca,
traça as linhas dulcíssimas dum beijo
e é de seda vermelha e canta e ri
e é como um cravo ao sol a minha boca...
quando os olhos se me cerram de desejo...
e os meus braços se estendem para ti...","si tu venais me voir...
si tu venais me voir aujourd'hui le soir,
á l'heure des fatigues magiques,
quand la nuit tout doucement s'approche,
et si tu me serrais dans tes bras...
lorsque je me rapelle: cette saveur qu'avait
ta bouche... l'écho de tes pas...
ton rire de source... tes étreintes...
tes baisers... et ta main dans la mienne...
si tu venais quand, belle et folle,
dessinant les lignes très douces d'un baiser
de soie vermeille, en chantant et en riant
ma bouche est comme un oeillet au soleil...
lorsque mes yeux se ferment de désir ...
et mes bras se tendent vers toi...",pt_XX,fr_XX,"si tu venais me voir...
si tu venais me voir ce soir au crépuscule,
à cette heure des magiques lassitudes,
lorsque la nuit doucement se rapproche,
et que tu m'envelopperais dans tes bras...
lorsque m'en souvient : cette saveur qui avait
ta bouche... l'écho de tes pas...
ton rire de source... tes bras enlacés...
tes baisers... ta main dans la mienne...
si tu venais lorsque, belle et folle,
je trace les lignes douces d'un baiser
et que ma bouche est comme un tissu de soie rouge
et chante et rit
et est comme un lys au soleil...
lorsque mes yeux se ferment de désir...
et que mes bras se tendent vers toi...",0
"amar
eu quero amar, amar perdidamente!
amar só por amar: aqui... além...
mais este e aquele, o outro e toda a gente...
amar! amar! e não amar ninguém!
recordar? esquecer? indiferente!
prender ou desprender? é mal? é bem?
quem disser que se pode amar alguém
durante a vida inteira é porque mente!
há uma primavera em cada vida:
é preciso cantá-la assim florida,
pois se deus nos deu voz, foi pra cantar!
e se um dia hei-de ser pó, cinza e nada
que seja a minha noite uma alvorada,
que me saiba perder ... pra me encontrar..","aimer
je veux aimer, aimer éperdument!
aimer juste pour aimer: ici... lá-bas...
et celui-ci e celui-là, l’autre et tout le monde...
aimer! aimer! et n’aimer personne!
me rappeler? oublier? indifférente!
m’attacher ou delaisser? est-ce mal? est-ce bien?
si quelqu’un dit qu’on peut aimer quelqu’un
pendant toute une vie c’est qu’il ment!
il y a un printemps en chaque vie:
il faut la chanter ainsi fleurie,
car si dieu nous a donné la voix, c’est pour chanter!
et si un jour je serai poussière, cendre et plus rien
que ma nuit soit une aurore,
que je sache me perdre ... pour me retrouver...",pt_XX,fr_XX,"aimer
je veux aimer, aimer follement !
aimer pour aimer: ici... là-bas...
cet un, l'autre, celui-là et toute la gente...
aimer! aimer! et ne pas aimer personne !
se souvenir ? oublier ? indifférent !
capturer ou libérer ? est-ce mal ? est-ce bien ?
qui dit qu'on peut aimer une personne
pendant toute la vie ment !
il y a un printemps dans chaque vie :
il faut chanter cette vie en fleur,
car si dieu nous a donné la voix, c'est pour chanter !
et si un jour je vais être poussière, cendre et rien
que ma nuit soit un matin,
que je sache me perdre... pour me retrouver...",2
"as duas flores
são duas flores unidas
são duas rosas nascidas
talvez do mesmo arrebol,
vivendo,no mesmo galho,
da mesma gota de orvalho,
do mesmo raio de sol.
unidas, bem como as penas
das duas asas pequenas
de um passarinho do céu...
como um casal de rolinhas,
como a tribo de andorinhas
da tarde no frouxo véu.
unidas, bem como os prantos,
que em parelha descem tantos
das profundezas do olhar...
como o suspiro e o desgosto,
como as covinhas do rosto,
como as estrelas do mar.
unidas... ai quem pudera
numa eterna primavera
viver, qual vive esta flor.
juntar as rosas da vida
na rama verde e florida,
na verde rama do amor!","les deux fleurs
ce sont deux fleurs unies
ce sont deux roses nées
peut-être du même rougeoyant
sur la même branche, vivant,
de la même goutte de rosée,
du même rayon de soleil.
unies, aussi comme les plumes
des deux petites ailes
d’un oiseau du ciel...
comme un couple de tourterelles
comme la tribu d’hirondelles
du soir dans le voile relâché.
unies, aussi comme les sanglots,
qui par paires descendent tant
des profondeurs du regard....
comme le soupir et le chagrin,
comme les petits creux des joues,
comme les étoiles de mer.
unies... heureux celui qui pourrait
dans un éternel printemps
vivre, comme cette fleur.
assembler les roses de la vie
sur le feuillage vert et fleuri
le vert feuillage de l’amour!",pt_XX,fr_XX,"Les deux fleurs
Ces deux fleurs sont unies
C'est deux roses nées
Talvez du même aube,
Vivant, sur le même rameau,
De la même goutte de rosée,
Du même rayon de soleil.
Unies, comme les plumes
Des deux petites ailes
D'un oiseau du ciel...
Comme un couple de colombeaux,
Comme la tribu des hirondelles
Du soir dans le léger voile.
Unies, comme les pleurs,
Qui descendent en pareil
Des profondeurs du regard...
Comme le soupir et le chagrin,
Comme les fossettes du visage,
Comme les étoiles de la mer.
Unies... ah qui pourrait
Dans un éternel printemps
Vivre, comme vit cette fleur.
Joindre les roses de la vie
Dans la branche verte et fleurie,
Dans la verte branche de l'amour !",0
"ditoso seja aquele que somente
ditoso seja aquele que somente
se queixa de amorosas esquivanças;
pois por elas não perde as esperanças
de poder nalgum tempo ser contente.
ditoso seja quem, estando ausente,
não sente mais que a pena das lembranças,
porque, inda mais que se tema de mudanças,
menos se teme a dor quando se sente.
ditoso seja, enfim, qualquer estado,
onde enganos, desprezos e isenção
trazem o coração atormentado.
mas triste de quem se sente magoado
de erros em que não pode haver perdão,
sem ficar na alma a mágoa do pecado.","bienheureux soit celui qui seulement
bienheureux soit celui qui seulement
ne se plaint que d’amoureuses irrévérences;
car pour elles il ne perdra les espérances
de pouvoir un jour être content.
bienheureux celui qui, en étant absent,
ne ressent que la peine des souvenirs,
car même si l’on craint les changements,
on craindra moins la douleur lorsqu’on la ressent
bienheureuse soit, enfin, toute situation,
où tromperies, dédains, et exemption
conserveront un coeur tourmenté.
mais malheureux est celui qui se sent offensé
par des erreurs où il ne peut y avoir de pardon
sans qu’en l’âme il ne reste l’angoisse du pêché.",pt_XX,fr_XX,"Heureux soit celui qui ne se plaint
que d'amourables évasions ;
car pour elles il ne perd pas l'espoir
d'être un jour quelque peu content.
Heureux soit celui qui, étant absent,
ne ressent que le poids des souvenirs,
car, même s'il craint encore des changements,
la douleur est moins crainte lorsqu'elle est sentie.
Heureux soit, enfin, tout état,
où des erreurs, des mépris et l'absence
tourmentent le cœur de leurs tourments.
Mais triste est celui qui est blessé
d'erreurs sans pardon possible,
sans que la douleur du péché reste en l'âme.",2
"por receio de quem espia
cheio de inveja a roer
não veio naquele dia,
p'ra assim traída não ser
p'la luz que no rosto esplende,
p'las jóias a tilintar,
e pelo perfume do âmbar
a que o corpo lhe rescende:
é que ao rosto, com o manto,
tapá-lo ainda poderia,
e as jóias, entretanto,
facilmente as tiraria
mas a fragrância do encanto
para ocultá-la, que faria?","par crainte de celui qui guette
plein de l’envie qui ronge
ce jour-là elle n'est pas venue,
pour ne pas être trahie
par le resplendissement de son visage,
par le tintement des bijoux,
et par le parfum de l'ambre
que de son corps s’exhale :
c’est que le visage, avec le voile,
elle pourrait encore le cacher,
et les bijoux, entretemps,
elle pourrait facilement les retirer,
mais la fragrance de la beauté,
comment pourrait-elle l’occulter?",pt_XX,fr_XX,"Par peur de celui qui espionne
Gnawi d'envie à ronger
Il n'est pas venu ce jour-là,
Pour ne pas être trahi(e)
Par la lumière qui scintille,
Par les bijoux à tintinnabuler,
Et par la fragrance d'ambre
Qui parfume son corps :
Car sur le visage, avec le manteau,
Il pourrait encore le cacher,
Et les bijoux, néanmoins,
Il pourrait facilement les retirer
Mais la fragrance du charme
Pour la dissimuler, qu'allons-nous faire ?",1
"viagem
aparelhei o barco da ilusão
e reforcei a fé de marinheiro.
era longe o meu sonho, e traiçoeiro
o mar...
(só nos é concedida
esta vida
que temos;
e é nela que é preciso
procurar
o velho paraíso
que perdemos).
prestes, larguei a vela
e disse adeus ao cais, à paz tolhida.
desmedida,
a revolta imensidão
transforma dia a dia a embarcação
numa errante e alada sepultura...
mas corto as ondas sem desanimar.
em qualquer aventura,
o que importa é partir, não é chegar.","voyage
j’ai appareillé le bateau de l’illusion
et la foi de marin j’ai renforcée.
il était loin mon rêve, et sournois
l’océan ...
(seule nous est donnée
cette vie
que nous avons;
et c’est là que nous devons
rechercher
le vieux paradis
que nous avons perdu).
rapidement, j’ai laché la voile
et dis adieu au quai, à la paix ankylosée.
démesurée,
l’immensité en révolte
transforme tous les jours le bateau
en une tombe errante et ailée...
mais je fends les vagues sans me décourager.
dans toute aventure,
ce qui importe c’est de partir, ce n’est pas d’arriver.",pt_XX,fr_XX,"Voyage
j'ai équipé le bateau de l'illusion
et renforcé la foi de marin.
mon rêve était loin, et traître
la mer...
(seule la vie
que nous avons
nous est accordée ;
et c'est en elle qu'il faut
chercher
le vieux paradis
perdu).
résolu, j'ai hissé la voile
et dit adieu au quai, à la paix limitée.
démesurée,
la révolte immensité
transforme, jour après jour, l'embarcation
en une errante et ailée sépulture...
mais je fendis les vagues sans me décourager.
dans toute aventure,
ce qui compte c'est de partir, pas d'arriver.",-1
"noivado
vês, querida, o horizonte ardendo em chamas?
além desses outeiros
vai descambando o sol, e à terra envia
os raios derradeiros;
a tarde, como noiva que enrubesce,
traz no rosto um véu mole e transparente;
no fundo azul a estrela do poente
já tímida aparece.
como um bafo suavíssimo da noite,
vem sussurrando o vento,
as árvores agita e imprime às folhas
o beijo sonolento.
a flor ajeita o cálix: cedo espera
o orvalho, e entanto exala o doce aroma;
do leito do oriente a noite assoma;
como uma sombra austera.
vem tu, agora, ó filha de meus sonhos,
vem, minha flor querida;
vem contemplar o céu, página santa
que amor a ler convida;
da tua solidão rompe as cadeias;
desce do teu sombrio e mudo asilo;
encontrarás aqui o amor tranqüilo...
que esperas? que receias?
olha o templo de deus, pomposo e grande;
lá do horizonte oposto
a lua, como lâmpada, já surge
a alumiar teu rosto;
os círios vão arder no altar sagrado,
estrelinhas do céu que um anjo acende;
olha como de bálsamos rescende
a c'roa do noivado.
irão buscar-te em meio do caminho
as minhas esperanças;
e voltarão contigo, entrelaçadas
nas tuas longas tranças;
no entanto eu preparei teu leito à sombra
do limoeiro em flor; colhi contente
folhas com que alastrei o solo ardente
de verde e mole alfombra.
pelas ondas do tempo arrebatados,
até à morte iremos,
soltos ao longo do baixel da vida
os esquecidos remos.
firmes, entre o fragor da tempestade,
gozaremos o bem que amor encerra,
passaremos assim do sol da terra
ao sol da eternidade.","fiançailles
tu vois, ma chérie, brûler l'horizon en flammes?
au-delà de ces collines
le soleil s’abaisse et à la terre envoie
les rayons ultimes;
le soir, tel une mariée qui s’empourpre,
il porte sur le visage un voile doux et transparent;
sur fond bleu l’étoile du couchant
déjà timide apparaît.
comme un tendre souffle de la nuit,
vient le vent en chuchotant,
il agite les arbres et influe aux feuilles
le baiser somnolent.
la fleur ajuste le calice: elle attend de bonne heure
la rosée, et pendant ce temps elle exhale le doux arôme;
du lit de l’orient la nuit se prône;
comme une ombre austère.
viens toi, maintenant, ô fille de mes rêves,
viens, ma chère fleur;
viens contempler le ciel, page sacrée
qui invite à lire l’amour;
de ta solitude romp les chaînes;
descend de ton sombre et muet asile;
tu trouveras ici l'amour tranquille ...
qu’ attends-tu? de quoi as-tu peur?
regarde le temple de dieu, majestueux et grand;
dans l’autre extrémité de l’horizon
la lune, telle une lampe, surgit
et illumine ton visage;
les bougies brûleront sur l'autel sacré,
petites étoiles célestes qu’un ange allume;
regarde comme de baumes elle est parfumée
la couronne des fiançailles.
elles iront te chercher à mi-chemin
mes esperances;
et reviendront avec toi, entrelacées
dans tes longues tresses;
cependant, j’ai préparé ton lit à l'ombre
du citronnier en fleur; j’ai ramassé content
des feuilles que j’ai répandues sur le sol ardent
en un tapis vert et mou.
par les vagues du temps extasiés,
jusqu’à la mort nous irons ;
dénoués de la barque de la vie
les rames oubliés.
fermes, parmi le bruit de la tempête,
nous profiterons du bien que l’amour enferme,
nous passerons ainsi du soleil de la terre
au soleil de l'éternité.",pt_XX,fr_XX,"Noivado
Voy, chérie, l'horizon rougeoyant de flammes ?
Au-delà de ces collines,
Le soleil s'en va et envoie à la terre
Les derniers rayons ;
Le soir, comme une mariée qui rougit,
Amène sur son visage
Un voile mou et transparent ;
Dans le fond bleu, l'étoile du couchant
Apparaît déjà, timide.
Comme une haleine suave du soir,
Vient souffler le vent,
Agite les arbres et imprime aux feuilles
Un baiser somnolent.
La fleur ajuste son calice : elle attend bientôt
La rosée, et exhale en attendant
Un doux parfum ; du lit de l'orient
La nuit surgit, comme une ombre austère.
Viens, maintenant, ô fille de mes rêves,
Viens, ma fleur chérie ;
Viens contempler le ciel, page sainte
Que l'amour invite à lire ;
Débarrasse-toi de tes chaînes solitaires ;
Descends de ton sombre et muet asile ;
Tu trouveras ici l'amour tranquille...
Que attends-tu ? Que crains-tu ?
Regarde le temple de dieu, imposant et grand ;
De l'horizon opposé
La lune, comme une lampe, surgit déjà
Pour éclairer ton visage ;
Les cierges vont brûler sur l'autel sacré,
Étoiles du ciel qu'un ange allume ;
Regarde comme elle exhale des baumes
La couronne de l'engagement.
Mes espérances vont te chercher au milieu du chemin ;
Elles reviendront avec toi, entrelacées
Dans tes longues tresses ;
Pourtant, j'ai préparé ton lit à l'ombre
De la lime en fleur ; content, j'ai cueilli
Des feuilles avec lesquelles j'ai tapissé le sol ardent
De vert et de douce moquette.
Portés par les vagues du temps,
Jusqu'à la mort nous irons,
Les rames oubliées du bateau de la vie
Sont abandonnées.
Forts, au milieu du bruit de la tempête,
Nous jouirons du bien que l'amour renferme,
Nous passerons ainsi du soleil de la terre
Au soleil de l'éternité.",0
