original_poem,translated_poem,src_lang,tgt_lang,translated_by_TA,topic
"feiticeira
de que noite demorada
ou de que breve manhã
vieste tu, feiticeira
de nuvens deslumbrada
de que sonho feito mar
ou de que mar não sonhado
vieste tu, feiticeira
aninhar-te ao meu lado
de que fogo renascido
ou de que lume apagado
vieste tu, feiticeira
segredar-me ao ouvido
de que fontes de que águas
de que chão de que horizonte
de que neves de que fráguas
de que sedes de que montes
de que norte de que lida
de que desertos de morte
vieste tu feiticeira
inundar-me de vida.(...)","magicienne
de quelle longue nuit
ou de quel bref matin
es-tu venue, magicienne
des nuages ​​éblouie
de quel rêve fait de mer
ou de quelle mer non rêvée
es-tu venue, magicienne
te blottir à mes côtés
de quel feu qui renaît
ou de quelle flamme éteinte
es-tu venue, magicienne
à mon oreille chuchoter
de quelles sources de quelles eaux
de quel sol de quel horizon
de quelles neiges de quelles fournaises
de quels désirs de quelles montagnes
avec quel nord de quelle magie
de quels déserts de mort
es-tu venue, magicienne
pour m'inonder de vie.(...)",pt_XX,fr_XX,"Sorcière
De quelle nuit prolongée
Ou de quel matin léger
Es-tu venue, sorcière
Enveloppée de nuages
De quel rêve devenu mer
Ou de quelle mer jamais rêvée
Es-tu venue, sorcière
Pour venir me tenir compagnie
De quel feu renaissant
Ou de quelle flamme éteinte
Es-tu venue, sorcière
Chuchoter à mon oreille
De quel source de quel eau
De quel sol de quel horizon
De quel neige de quel rocher
De quel soif de quel mont
De quel nord de quel labeur
De quel désert de mort
Es-tu venue sorcière
Pour m'inonder de vie.(...)",0
"soneto à liberdade
primeiro tu virás, depois a tarde
com terras, mares, algas, vento, peixes.
trarás, no ventre, a marca das idades
e a inquietude dos pássaros libertos.
virás para o enorme do silêncio
— flor boiando na órbita das águas —
tu não verás o fúnebre das horas
nem o canto final do sol poente.
primeiro tu virás, depois a tarde
sem desejos e amor. virás sozinha
como o nome saudade. virás única.
eu não terei a posse do teu corpo
nem me batizarei na tua essência,
mas tu virás primeiro e eu morro livre.","sonnet à la liberté
tu viendras d'abord, puis l'après-midi
avec des terres, des mers, des algues, du vent, des poissons.
tu apporteras, dans ton ventre, la marque des âges
et l'inquiétude des oiseaux libérés.
tu viendras vers l'énorme silence
— telle une fleur qui flotte dans l'orbite des eaux —
tu ne verras pas le funèbre des heures
ni le dernier chant du soleil couchant.
tu viendras d'abord, puis l'après-midi
sans désirs et sans amour. tu viendras seule
comme le nom nostalgie. tu viendras seule.
je n'aurai pas la possession de ton corps
ni je ne me baptiserai dans ton essence,
mais tu viendras d'abord et je mourrai libre",pt_XX,fr_XX,"Sonnet à la liberté
Premièrement tu viendras, puis l'après-midi
Avec des terres, des mers, des algues, du vent, des poissons.
Tu apporteras, dans ton ventre, la marque des âges
Et l'agitation des oiseaux libérés.
Tu viendras pour le silence immense
— Fleur flottant dans l'orbite des eaux —
Tu ne verras pas le funèbre des heures
Ni le chant final du soleil couchant.
Premièrement tu viendras, puis l'après-midi
Sans désirs ni amour. Tu viendras seule
Comme le nom 'souvenir'. Tu viendras unique.
Je n'aurai pas la possession de ton corps
Ni ne me baptiserai dans ta substance,
Mais tu viendras en premier et je meurs libre.",0
"terra
quando a minha saudade os olhos cerra,
na grata evocação de um sonho errante,
recordo, enternecido, a minha terra,
vendo-a mais linda quanto mais distante.
ao longe, um panorama se descerra
sob o límpido céu, ao sol radiante:
entre os rios, as árvores e a serra,
branqueja a casaria de amarante.
lembro os sítios bucólicos... a ponte
no manso riacho, onde brinquei menino,
curvado sobre a gruta, a ouvir a fonte...
a igreja... e ouço, meu deus! a voz do sino,
como a repercutir no amplo horizonte
o repique augural do meu destino!","terra
lorsque mes yeux se ferment de nostalgie,
dans l'évocation reconnaissante d'un rêve égaré,
je me rappelle, avec amour, de ma contrée,
plus distante je la vois plus je la trouve jolie.
au loin, un décor s'éclaircit
sous le ciel limpide, sous un soleil éblouissant:
entre les fleuves, les arbres et la montagne,
amarante montre ses maisons blanchies.
je me souviens des lieux bucoliques... le pont
sur le ruisseau paisible, où enfant je jouais,
courbé sur la grotte, à écouter la source...
l'église... mon dieu! la voix du clocher que j'entends,
semble répandre dans le vaste horizon
la répercussion augural de mon destin!",pt_XX,fr_XX,"terre

lorsque ma nostalgie ferme mes yeux,
dans la chère évocation d'un rêve errant,
je me souviens, attendri, de ma terre,
la voyant plus belle à mesure qu'elle s'éloigne.
au loin, un panorama s'ouvre
sous le ciel limpide, au soleil radieux :
entre les rivières, les arbres et la montagne,
la blanche habitation d'Amarante brille.
je me rappelle les lieux bucoliques... le pont
sur la douce rivière, où j'ai joué enfant,
penché sur la grotte, à écouter la source...
l'église... et j'entends, ô mon dieu ! la voix du cloche,
comme à résonner dans l'ample horizon
le carillon augural de mon destin !",0
"vinte vezes a lua prateada
inteira o rosto seu mostrado havia,
quando um terrível mal, que então sofria,
me tornou para sempre desgraçada.
de ver o céu e o sol sendo privada,
cresceu a par comigo a mágoa ímpia;
desde a infância a mortal melancolia
se viu em meu semblante debuxada.
sensível coração deu-me a natura,
e a fortuna, cruel sempre comigo,
me negou toda a sorte de ventura;
nem sequer um prazer breve consigo:
só para terminar minha amargura
me aguarda o triste, sepulcral jazigo.","vingt fois la lune d'argent
intière son visage avait montré,
quand un mal terrible, dont alors je souffrais,
m'a rendue pour toujours affligeante.
de voir que du ciel et du soleil j'en étais privée,
une impie affliction en moi a grandi;
dès l'enfance la mortelle mélancolie
s'est vue sur mon visage esquissée.
un cœur sensible m'a donné la nature,
et la fortune, avec moi toujours cruelle,
m'a refusé toute chance de bonheur;
pas même un bref plaisir je ressens:
pour mettre fin à ma triste amertume
seul le lugubre tombeau sepulcral m'attend.",pt_XX,fr_XX,"vingt fois la lune argentée
entière son visage était découvert,
lorsqu'un mal terrible, que j'ai alors souffert,
m'a rendue pour toujours malheureuse.
d'être privée de voir le ciel et le soleil,
la douleur impie a grandi avec moi;
depuis mon enfance, une mélancolie mortelle
a été dessinée sur mon visage.
la nature m'a donné un cœur sensible,
et le sort, cruel toujours avec moi,
m'a refusé toute sorte de bonheur;
ni même un plaisir éphémère avec moi :
seulement pour terminer ma douleur
m'attend le triste, sépulcral tombeau.",0
"junto do mar, que erguia gravemente
a trágica voz rouca, enquanto o vento
passava como o voo do pensamento
que busca e hesita, inquieto e intermitente,
junto do mar sentei-me tristemente,
olhando o céu pesado e nevoento,
e interroguei, cismando, esse lamento
que saía das coisas, vagamente…
que inquieto desejo vos tortura,
seres elementares, força obscura?
em volta de que ideia gravitais?
mas na imensa extensão, onde se esconde
o inconsciente imortal, só me responde
um bramido, um queixume, e nada mais…","au bord de la mer, qui élevait gravement
sa voix tragique et rauque, tandis que le vent
passait comme un envol de la pensée
qui cherche et hésite, inquiet et intermittent,
au bord de la mer je me suis assis tristement,
tout en regardant le ciel lourd et brumeux,
et j'ai interrogé, rêveur, cette complainte
qui sortait des choses, vaguement...
quel désir anxieux te torture,
êtres élémentaires, force obscure ?
autour de quelle idée gravitez-vous ?
mais dans l'immense extension, où se cache
l'inconscient immortel, seul me répond
un rugissement, une lamentation, et rien de plus…",pt_XX,fr_XX,"à côté de la mer, qui élevait solennellement
sa voix tragique et rauque, tandis que le vent
passait comme le vol de la pensée
qui cherche et hésite, inquiète et intermittente,
j'ai pris place tristement à côté de la mer,
regardant le ciel lourd et brumeux,
et j'ai interrogué, réfléchissant, ce lament
qui s'échappait des choses, vaguement...
Quel inquiet désir vous tourmente,
êtres élémentaires, force obscure ?
autour de quelle idée gravitez-vous ?
mais dans l'immense étendue, où se cache
l'inconscient immortel, ne me répond que
un rugissement, une plainte, et rien d'autre...",-1
"senhora do mar
ante vós me tendes caída
quem vem tirar meia da vida e da paz
desta mesa, desta casa perdidas
amor que é de ti
senhora do mar
ante vós minha alma está vazia
quem vem chamar a si o que é meu
oh mar alto, trás p'ra mim...
amor meu sem fim
ai negras águas
ondas de mágoas
gelaram o meu fogo no olhar
(senhora do mar)
ele não torna a navegar
e ninguém vos vê chorar
senhora do mar
quem vem tirar meia da vida e da paz
desta mesa, desta casa perdidas
amor que é de ti
ai negras águas
ondas de mágoas
gelaram o meu fogo no olhar
(senhora do mar)
vida sem sal, rezas em vão
deixai seu coração
bater junto a mim
ai negras águas
ondas de mágoas
gelaram o meu fogo no olhar
(senhora do mar)
ele não torna a navegar
e ninguém vos vê chorar
senhora do mar","notre dame de la mer
devant vous me voici prosternée
qui vient prendre la moitié de la vie et de la paix
de cette table, de cette maison, perdues?
mon amour où es-tu?
notre dame de la mer
devant vous mon âme est vide
qui vient chercher ce qui m’appartient?
oh océan profond rends moi mon amour sans fin
ah les eaux noires, les vagues de chagrin,
qui ont gelé le feu de mon regard (notre dame de la mer)
il n’ira plus naviguer (il n’ira plus naviguer)
et personne ne vous voit pleurer
notre dame de la mer
qui vient prendre la moitié de la vie et de la paix
de cette table, de cette maison, perdues?
mon amour où es-tu?
ah les eaux noires, les vagues de chagrin,
qui ont gelé le feu de mon regard (notre dame de la mer)
blessures salées, vaines prières (vaines prières)
laissez son cœur (laissez son cœur)
battre près de moi! (battre près de moi!)
ah les eaux noires, les vagues de chagrin,
qui ont gelé le feu de mon regard (notre dame de la mer)
il n’ira plus naviguer (il n’ira plus naviguer)
et personne ne vous voit pleurer
notre dame de la mer",pt_XX,fr_XX,"Dame de la mer
Devant toi je suis tombée
Qui va prendre moitié de la vie et de la paix
De cette table, de cette maison perdues
Amour qui est à toi
Dame de la mer
Devant toi mon âme est vide
Qui va appeler à soi ce qui est à moi
Oh grand océan, ramène-m'en...
Mon amour sans fin
Ah eaux noires
Vagues de peines
Ils ont gelé mon feu dans le regard
(Dame de la mer)
Il ne retourne plus naviguer
Et personne ne te voit pleurer
Dame de la mer
Qui va prendre moitié de la vie et de la paix
De cette table, de cette maison perdues
Amour qui est à toi
Ah eaux noires
Vagues de peines
Ils ont gelé mon feu dans le regard
(Dame de la mer)
Vie sans sel, prières en vain
Laissez son cœur battre
À côté de moi
Ah eaux noires
Vagues de peines
Ils ont gelé mon feu dans le regard
(Dame de la mer)
Il ne retourne plus naviguer
Et personne ne te voit pleurer
Dame de la mer",0
"quanto invejo da pastora
o viver simples e bom!
mas a mim negou o fado,
não quis tivesse esse dom.
aquela no verde prado
seu rebanho vê pastar,
a natureza contempla,
que a deixa seus bens gozar.
enquanto do sol ardente
deixa passar o calor,
cheirosas flores enrama
para dar ao seu amor.
não fazem sua fortuna
vãs ilusões grandeza;
nem sofre cruéis motejos
seu tratar com singeleza.
cantando à borda do rio,
que banha alegre morada,
seus projetos executa
sem que seja censurada.
isenta de austeras leis,
pensa, ri, brinca se quer.
ignorando rigorismos
é feliz, onde estiver.
pelos céus abençoados
vê seus dias, seus prazeres,
desempenhando mimosa
seus mais sagrados deveres.
sua glória, em ser querida
e querer, funda somente.
carinhosa tem carinhos,
e vive assim bem contente.
ai de mim! a quem a sorte
de tão altos bens privou,
ditosos dias ainda
comigo não compartilhou","combien j'envie à la bergère
sa vie simples et heureuse !
mais à moi le destin a nié,
il n'a pas voulu m'attribuer don.
celle qui dans le vert pré
son troupeau voit paître,
elle contemple la nature,
qui lui laisse de ses biens profiter.
alors que le soleil brulant
laisse asser la chaleur,
elle attache les fleurs parfumées
qu'à son amour elle irá donner.
elle ne trouve pas le bonheur
dans les vaines illusions de grandeur;
ni elle souffre de cruelles moqueries
pour son aspect de simplicité .
elle chante au bord de la rivière,
qui baigne son heureuse demeure,
seus projets elle execute
sans être sans cesse critiquée.
libre de lois austères,
elle pense, rit, joue si c'est son vouloir.
ignorant les intransigeances
elle est heureuse, où qu'elle soit.
par la volonté des cieux bénis
elle voit ses jours, ses plaisirs,
tout en accomplissant gentiment
ses devoirs les plus sacrés.
sa gloire, d'être aimée
et le vouloir, n'a que ce fondement.
affectueuse elle a des calins,
et elle vit ainsi contente.
pauvre de moi! a qui le sort
a privé de si nobles acquis,
avec moi les jours si fortunés
il ne les a pas encore partagés",pt_XX,fr_XX,"Jealous je suis de la bergère
de sa vie simple et bonne !
Mais le sort m'a délaissée,
n'a pas voulu que j'en jouisse.
Elle sur le vert prado
voit paître son troupeau,
contemple la nature
qui lui permet de jouir de ses biens.
Alors que le soleil ardent
laisse passer sa chaleur,
elle enfile des fleurs parfumées
pour offrir à son amour.
Elle ne fait pas sa fortune
avec de vaines illusions de grandeur ;
ni ne subit des moqueries cruelles
par son traitement simple.
Chantant à la bord du ruisseau,
qui mouille une maison joyeuse,
elle mène à bien ses projets
sans être blâmée.
Elle est exempte de lois sévères,
pense, rit, joue si elle le veut.
Ignorant les rigidités
elle est heureuse, peu importe où elle est.
Ses jours, ses plaisirs sont bénis par les cieux
elle remplit avec grâce
ses plus saints devoirs.
Sa gloire, à être aimée
et à aimer, repose uniquement là.
Elle a des tendresses et les reçoit,
et elle vit ainsi très contente.
Hélas ! moi, à qui le sort
a privé de ces grands biens,
des jours heureux n'ont pas encore
partagé ma compagnie.",0
"mal de amor
toda pena de amor, por mais que doa,
no próprio amor encontra recompensa.
as lágrimas que causa a indiferença,
seca-as depressa uma palavra boa.
a mão que fere, o ferro que agrilhoa,
obstáculos não são que amor não vença.
amor transforma em luz a treva densa.
por um sorriso amor tudo perdoa.
ai de quem muito amar não sendo amado,
e depois de sofrer tanta amargura,
pela mão que o feriu não for curado.
noutra parte há de em vão buscar ventura,
fica-lhe o coração despedaçado,
que o mal de amor só nesse amor tem cura.","le mal d'amour
chaque chagrin d'amour, même si cela meurtrit,
dans l'amour lui-même il trouve sa récompense.
les larmes qui ont pour cause l'indifférence,
un bon mot très vite les en guérit.
la main qui blesse, le fer qui enchaîne,
il n'y a pas d'obstacles que l'amour ne puisse vaincre.
l'amour transforme en lumière l'obscurité dense.
pour un sourire l'amour tout pardonne.
malheur à celui qui aime tant sans être aimé,
et qui après avoir souffert toute l'amertume,
par la main qui l'a blessé n'en est pas guéri.
ailleurs il irá en vain chercher le bonheur,
le coeur brisé il lui resterá,
car le mal d'amour seulement dans cette amour trouve la cure.",pt_XX,fr_XX,"mal de l'amour
toute peine d'amour, aussi douloureuse qu'elle soit,
trouve sa récompense dans l'amour même.
les larmes que cause l'indifférence,
sèchent vite avec un mot aimable.
la main qui frappe, le fer qui entrave,
ne sont pas des obstacles pour l'amour.
l'amour transforme en lumière l'obscurité.
pour un sourire, l'amour pardonne tout.
malheur à celui qui aime sans être aimé,
et après avoir souffert tant de douleur,
si sa main blessée ne lui est pas pansée.
ailleurs il cherchera vainement du bonheur,
il lui reste le cœur brisé,
car le mal de l'amour n'a guérison qu'en cet amour.",-1
"ninguém contempla as coisas admirado,
dir-se-á que tudo é simples e vulgar…
e se olho a terra, a flor, o céu doirado,
que infinda comoção me faz sonhar!
é tudo para mim extraordinário!
uma pedra é fantástica! alto monte
terra viva a sangrar, como um calvário
e branco espectro, ao luar, a minha fonte!
é tudo luz e voz! tudo me fala!
ouço lamúrias de almas no arvoredo,
quando a tarde, tão lívida, se cala,
porque adivinha a noite e lhe tem medo…
não posso abrir os olhos sem abrir
meu coração à dor e à alegria.
cada coisa nos sabe transmitir
uma estranha e quimérica harmonia!
é bem certo que tu, meu coração,
participas de toda a natureza.
tens montanhas na tua solidão
e crepúsculos negros de tristeza!
as coisas que me cercam silenciosas,
são almas a chorar que me procuram.
quantas vagas palavras misteriosas
neste ar que aspiro, trémulas, murmuram!
vozes de encanto vêm aos meus ouvidos,
beijam meus olhos sombras de mistério.
sinto que perco às vezes os sentidos
e que vou a flutuar num rio aéreo…","personne ne contemple les choses avec admiration,
on dirait que tout est simple et vulgaire..
et si je regarde la terre, la fleur, le ciel doré,
quelle émotion infinie me fait rêver!
tout cela est pour moi extraordinaire!
une pierre c'est fantastique! haute colline
la terre vivante qui saigne, comme un calvaire
et spectre blanc, ma fontaine, au clair de la lune!
tout n'est que lumière et voix, qui me parlent!
j'entends les plaintes des âmes dans les arbres,
lorsque le soir, si pâle, se tait,
pris de peur, en présageant l'obscurité...
je ne peux pas ouvrir les yeux sans ouvrir
mon coeur à la douleur et à la joie.
toutes les choses savent nous transmettre
une étrange et chimérique harmonie!
il est bien certain, que toi mon coeur,
tu fais partie de toute la nature.
tu as des montagnes dans ta solitude
et des crépuscules noirs de la tristesse!
les choses qui m'entourent sont silencieuses,
ce sont des âmes qui me cherchent en pleurant.
combien de mots vagues et mystérieux
dans l'air que je respire,tremblantes,elles murmurent!
des voix viennent à mes oreilles,
elles embrassent mes yeux ombres de mystère.
il me semble que parfois je perds mes sens
et que je flotte sur un fleuve aérien...",pt_XX,fr_XX,"personne ne contemple les choses admiré,
on dirait que tout est simple et vulgaire...
et si je contemple la terre, la fleur, le ciel doré,
qu'infine émotion me fait rêver !
c'est tout pour moi extraordinaire !
une pierre est fantastique ! haut mont
terre vive à saigner, comme un calvaire
et blanc spectre, à la lune, ma source !
c'est tout lumière et voix ! tout me parle !
j'entends des lamentations d'âmes dans l'arbre,
lorsque le soir, si livide, se tait,
parce qu'il devine la nuit et en a peur...
je ne peux ouvrir mes yeux sans ouvrir
mon cœur à la douleur et à la joie.
chaque chose nous transmet une étrange
et chimérique harmonie !
il est bien vrai que toi, mon cœur,
tu participes à toute la nature.
tu as des montagnes dans ta solitude
et crépuscules noirs de tristesse !
les choses qui m'encerclent silencieuses,
sont des âmes à pleurer qui me cherchent.
combien de vagues mots mystérieux
dans cet air que j'aspire, frêles, murmurent !
des voix de charme viennent à mes oreilles,
des ombres de mystère caressent mes yeux.
je sens que j'oublie parfois mes sens
et que je vais à flotter dans un fleuve aérien...",-1
"poema
os gritos perderam-se sem encontrar eco.
os punhos cerrados e os ódios calados,
dividiram os homens,
que não se reconheceram mais.....
mas as lágrimas cavaram sulcos fundos
nos olhos vazios de esperança,
e os sulcos não se apagaram....","poème
les cris se perdirent sans trouver d'écho.
les poings serrés et les haines étouffées,
ont divisé les hommes,
qui ne se reconnaissaient plus.....
mais les larmes ont creusé des sillons profonds
dans les yeux vides d'espoir,
et les sillons n'ont pas été effacés....",pt_XX,fr_XX,"poème
les cris se sont perdus sans trouver écho.
les poings serrés et les haines silencieuses,
ont divisé les hommes,
qui ne se sont plus reconnus....
mais les larmes ont creusé des sillons profonds
dans les yeux vides d'espoir,
et les sillons ne se sont pas effacés....",0
"a queda do império
perguntei ao vento
onde foi encontrar
mago sopro encanto
nau da vela em cruz
foi nas ondas do mar
do mundo inteiro
terras da perdição
parco império mil almas
por pau de canela e mazagão
pata de negreiro
tira e foge à morte
que a sorte é de quem
a terra amou
e no peito guardou
cheiro da mata eterna
laranja luanda
sempre em flor.","la chute de l’empire
j’ai demandé au vent
où avait-il trouvé
la magie souffle enchantement
vaisseau à la voile en croix
c’était sur les vagues de la mer
du monde entier
terres de perdition
modeste empire mille âmes
pour bâton de cannelle et mazagan
patte de négrier
prend et fuit la mort
car la chance est de qui
la terre a aimé
et dans le cœur a gardé
l'odeur de forêt éternelle
l'orange luanda
toujours en fleur.",pt_XX,fr_XX,"La chute de l'empire
j'ai demandé au vent
où il avait trouvé
le souffle magique, enchanté
navire à voile en croix
c'était dans les vagues de la mer
du monde entier
terres de perte
pauvre empire, mille âmes
pour le gousse de cannelle et mazagão
patte du négrier
il tire et s'échappe de la mort
car le sort est de celui
qui a aimé la terre
et qui l'a gardée au cœur
parfum de la forêt éternelle
orange, luanda
toujours en fleur.",-1
"fanatismo
minh’alma, de sonhar-te, anda perdida
meus olhos andam cegos de te ver !
não és sequer a razão do meu viver,
pois que tu és já toda a minha vida !
não vejo nada assim enlouquecida ...
passo no mundo, meu amor, a ler
no misterioso livro do teu ser
a mesma história tantas vezes lida !
tudo no mundo é frágil, tudo passa ...
quando me dizem isto, toda a graça
duma boca divina fala em mim !
e, olhos postos em ti, digo de rastros :
ah ! podem voar mundos, morrer astros,
que tu és como deus : princípio e fim ! ...","fanatisme
mon âme, de tant rêver de toi, erre perdue
mes yeux deviennet aveugles de te voir !
tu n'es pourtant pas ma raison de vivre,
car tu es déjà toute ma vie !
je ne vois plus rien ainsi tombée en folie ...
je passe par le monde, mon amour, en lisant
dans le mystérieux livre de ton être
la même histoire tant de fois relue !
tout dans le monde est fragile, tout passe ...
quand on me dit cela, toute la grâce
d'une bouche divine parle en moi !
et, les yeux posés sur toi, je dis prosternée :
ah ! les mondes peuvent s'envoler, mourir les astres,
car tu es comme dieu : le commencement et la fin ! ...",pt_XX,fr_XX,"fanatisme
mon âme, de t'imaginer, est perdue
mes yeux sont aveugles de te voir !
tu n'es même pas la raison de mon vivre,
car tu es déjà toute ma vie !
je ne vois rien, folle de passion ...
je traverse le monde, mon amour, à lire
dans le mystérieux livre de ton être
la même histoire tant de fois lue !
tout dans le monde est fragile, tout passe ...
quand on me dit cela, toute la grâce
d'une bouche divine parle en moi !
et, yeux posés sur toi, je dis à voix basse :
ah ! que des mondes s'envolent, des étoiles meurent,
que tu es comme dieu : commencement et fin ! ...",-1
