original_poem,translated_poem,src_lang,tgt_lang,translated_by_TA,bleu_score,meteor_score,bertscore,bartscore
"queria que me acompanhasses
vida fora
como uma vela
que me descobrisse o mundo
mas situo-me no lado incerto
onde bate o vento
e só te posso ensinar
nomes de árvores
cujo fruto se colhe numa próxima estação
por onde as comboios estendem
silvos aflitos","i’d like you to go with me
i’d like you to go with me
through life
like a sail
that would discover for me the world
but i’m on the uncertain side
where the wind pounds
and i can only teach you
the names of trees
whose fruit will be plucked in another season
where the trains scatter
anguished whistles",pt_XX,en_XX,"i wanted you to walk with me outside life like a goddess who would discover the world for me, but i’m standing on the uncertain side where the wind blows, and I can only teach you the names of trees whose fruit is harvested at a nearby station where the trains",0.36075893356708744,0.621672109839968,0.8912784457206726,0.7903094
"o espanto
o que se passa em mim é um prodígio.
um sim que se dilata
até perder o sentido
longe, como o balão
fugido da criança.
um sim, transgredido,
arremetido
à estupidez do ouvido,
da razão.
um sim que quando explode me diz não
com delicadeza.","amazement
what’s happening inside me is a wonder.
a yes that spreads itself
until its path is lost
far off, like the fleeing
balloon of a child.
a yes of trespass,
hurled against
the stupidity of my hearing,
of my reason.
a yes which as it bursts says no to me,
with civil sensitivity.",pt_XX,en_XX,"the wonder what happens to me is a prophecy. a yes that dilates until it loses its far-flung sense, like the escaped balloon of a child. a yes, transgressed, bowed to the foolishness of the ear, of reason. a yes that when it explodes, tells me not with tenderness.",0.22955635941098765,0.5013201094249384,0.887503445148468,0.8717514
"poeta
quando a primeira lágrima aflorou
nos meus olhos, divina claridade
a minha pátria aldeia alumiou
duma luz triste, que era já saudade.
humildes, pobres cousas, como eu sou
dor acesa na vossa escuridade. . .
sou, em futuro, o tempo que passou;
em mim, o antigo tempo é nova idade.
sou fraga da montanha, névoa astral,
quimérica figura matinal,
imagem de alma em terra modelada.
sou o homem de si mesmo fugitivo;
fantasma a delirar, mistério vivo,
a loucura de deus, o sonho e o nada.","poet
when the first tear welled up
in my eyes, divine clarity
lit up my village homeland
with the sad light of longing.
how i glow, poor humble things,
as sorrow in your darkness. . .
i am, in the future, time past.
in me, old times are new ages.
i’m a mountain cliff, an astral
mist, a figment in the morning,
the earthen image of a soul.
i’m man fleeing from himself,
a raving phantom, a living mystery,
god’s delirium, dreams, nothingness.",pt_XX,en_XX,"poet when the first tear floated in my eyes, divine clarity my home village awoke from a sad light that was already saddened. humble, poor things, like me, i’m acrid pain in your darkness. . . i’m, in the future, the time that passed; in me, the old time is a new age. i’m mountain’s weasel, astral nerve, quimical morning figure, image of soul in a forged earth. i’m the man fleeing for himself; ghost lurking, living mystery, god’s madness, dream and nothingness.",0.29059018484584975,0.6157972096900959,0.892903745174408,0.9320884
"roteiro
fui a delft, à procura de cerâmica.
fui à cerâmica, à procura de delft.
nos mapas, não vinham nem delft
nem a cerâmica.
os mapas, porém, tinham tudo
de delft,
e tinham tudo de cerâmica:
as cores,
as linhas, as fronteiras.
pus os mapas na parede.
também pus delft na parede.
e fiquei com uma cerâmica de delft.","itinerary
i went to delft, looking for ceramics.
i went to ceramics, looking for delft.
on the maps, neither delft nor
ceramics appeared.
the maps, however, had everything
delft had.
and everything that ceramics had:
the colors,
the lines, the borders.
i put the maps on the wall.
i also put delft on the wall,
and ended up with ceramics from delft.",pt_XX,en_XX,"mapping i went to delft, looking for ceramics. i went to delft, looking for ceramics. the maps didn't show either delft or ceramics. the maps, however, had all of delft, and they had all of ceramics: the colors, the lines, the borders. i put the maps on the wall. i also put delft on the wall. and i stayed with a delft ceramic.",0.5777781465686194,0.742381562099872,0.9023857712745667,0.8700433
"autopsicografia
o poeta é um fingidor.
finge tão completamente
que chega a fingir que é dor
a dor que deveras sente.
e os que lêem o que escreve,
na dor lida sentem bem,
não as duas que ele teve,
mas só a que eles não têm.
e assim nas calhas da roda
gira, a entreter a razão,
esse comboio de corda
que se chama o coração.","autopsychography
the poet is a faker
who’s so good at his act
he even fakes the pain
of pain he feels in fact.
and those who read his words
will feel in his writing
neither of the pains he has
but just the one they’re missing.
and so around its track
this thing called the heart winds,
a little clockwork train
to entertain our minds.",pt_XX,en_XX,"autopsycography the poet is a liar. he lies so completely he lies that he lies that it is pain the pain you ought to feel. and those who read what he writes, in the clear pain they feel well, not the two he had, but only the one they don't. and so in the loops of the round wheel, he penetrates reason, that rope called the heart.",0.13933044664436123,0.4257959207491324,0.8658778071403503,0.86249155
"elegia final
trabalhei quanto pude a minha dor
– negro bloco marmóreo que me pesa
e me inunda de gélido suor.
impus ao bruto mármore a beleza.
minhas lágrimas de água amargurada
suavizaram-lhe a trágica dureza.
e, ao ver a minha angústia alevantada
numa estátua perfeita, ao sol bendito,
toquei-lhe! estava inerte e congelada!
choro dentro de mim! soluço e grito!
sou neste livro palidez, quebranto.
a dor tão viva no meu ser aflito
é como cinza morta neste canto.","final elegy
i sculpted as best i could my sorrow:
a black marble block that weighs on me
and bathes me in an icy sweat.
i imposed beauty on that rough stone.
the bitter water of my tears
softened its tragic rigidity.
and when i saw my anguish raised
into a perfect statue in the blessed sun,
i touched it! it was frozen and inert!
i inwardly weep! i sob and shout!
in this book i’m pallor and grief.
the sorrow that lives in my troubled self
is so much dead ash in my song.",pt_XX,en_XX,"elegia final i worked as hard as i could my pain — black marble block that weighs on me and fills me with iced sweat. i imposed beauty on the rough marble. my tears of bitter water softened the tragic hardness. and, seeing my rage unburdened in a perfect state, in the blessed sun, i touched it! it was inert and frozen! i cry inside me! i weep and scream! i’m in this broken, tender book. the pain so vivid in my afflicted self is like dead sand in this corner.",0.28885687390944575,0.5769024364065685,0.904495894908905,0.9311253
"amanhã vou comprar umas calças vermelhas
porque não tenho rigorosamente nada a perder:
contei, um a um, todos os degraus
sei quantas voltas dei à chave,
sublinhei as frases importantes,
aparei os cedros,
fechei em código toda a escrita.
amanhã comprarei calças vermelhas
fixarei o calendário agrícola
afiarei as facas
ensaiarei um número
abrirei o livro na mesma página
descobrirei alguma pista.","tomorrow i’ll buy some red trousers
tomorrow i’ll buy some red trousers
since i have absolutely nothing to lose:
i counted, one by one, all the stairs,
i know how many times i turned the key,
i underlined the important phrases,
i pruned the cedars,
i shut all my writing inside a code.
tomorrow i’ll buy some red trousers
i’ll set up the farming schedule
i’ll sharpen the knives
i’ll rehearse an act
i’ll open the book to the same page
i’ll discover a clue.",pt_XX,en_XX,"tomorrow i'm going to buy a pair of red pants because i don't have exactly anything to lose: i've counted, one by one, all the degrays i know how many times i left the key, i highlighted the important sentences, the cedars appeared, i typed in all the writing. tomorrow i'm going to buy a pair of red pants i'm going to fix the agricultural calendar i'm going to cut out the knives i'm going to check a number i'm going to open the book on the same page i'm going to find some clue.",0.2296581924518357,0.5215509391543529,0.8928420543670654,0.9166219
"da minha janela
mar alto! ondas quebradas e vencidas
num soluçar aflito e murmurado...
vôo de gaivotas, leve, imaculado,
como neves nos píncaros nascidas!
sol! ave a tombar, asas já feridas,
batendo ainda num arfar pausado...
ó meu doce poente torturado
rezo-te em mim, chorando, mãos erguidas!
meu verso de samain cheio de graça,
’inda não és clarão já és luar
como branco lilás que se desfaça!
amor! teu coração trago-o no peito...
pulsa dentro de mim como este mar
num beijo eterno, assim, nunca desfeito!...","from my window
high sea! vanquished waves
breaking with whispered, troubled sighs…
immaculate, weightless flight of gulls,
like snows appearing on the hilltops!
sun! a bird falling, still flapping
its wounded wings while gasping for breath…
to you, sweet tortured sunset, i lift
my hands in inward prayer, weeping!
o my charming verse of samain,
not yet daylight, already you’re moonlight,
like a white lilac whose flowers wither!
love! i carry your heart in my breast…
it pounds within me like this sea
in an endless, never withering kiss!...",pt_XX,en_XX,"from my window high sea! waves broken and broken in a soothing and murmuring solitude... a wave of gaivotas, light, immaculate, like snow in the springs! sun! bird’s wing, already wounded wings, still banging in a paused wings... to my tortured sweet heart break you into me, crying, stiff hands! my cheek of sameen full of grace, yet you’re not clarion anymore you’re red like white lilac that breaks! love! your heart breaks in my chest... it pulses in me like this sea in an eternal kiss, thus, never broken!...",0.15943599846843856,0.5348304351099066,0.8658161163330078,0.94800156
"extrema-unção
uma breve, amável mágoa à
flor dos olhos, um distante desapontamento,
morrias como se pedisses desculpa
por nos fazeres perder tempo.
tinhas pressa mas não o mostravas,
receavas que não estivéssemos preparados,
e, suspenso sobre nós, esperavas
que disséssemos tudo, que fizéssemos o apropriado.
morrer não é motivo de orgulho,
mas estavas cansado de mais para te justificares.
ainda por cima no mês de julho,
com as férias marcadas, ausentes os familiares.
tínhamos levado as crianças de casa,
feito os telefonemas, escolhido os dizeres.
o quarto fora arrumado, a cama mudada
com roupa lavada. só faltava morreres.","extreme unction
a brief and affable sorrow
surfacing in the eyes, a distant disappointment,
you died as if gently begging pardon
for making us lose time.
you were in a rush but didn’t show it,
you feared that we were not prepared,
and, hovering above us, you waited
for us to say it all, and do what needed to be done.
dying is no reason to be proud,
but you were too exhausted to explain yourself.
and worst of all, it was july,
vacations set, relatives already gone.
we had taken the children away,
made our phone calls, chosen our words.
the room was now in order, the bed remade
with freshly laundered sheets. nothing missing, but your death.",pt_XX,en_XX,"extreme unification a brief, kind pity in the flower of your eyes, a distant disappointment, you died as if you were apologizing for wasting time on us. you were pressing but you didn’t show it, you were afraid we weren’t ready, and, suspended over us, you were waiting for us to say everything, to do what was right. dying isn’t a cause of pride, but you were tired of more to justify. still up in the month of July, with the holidays set aside, the family missing. we had taken the children home, made the phone calls, chosen the speakers. the room was out of order, the bed was changed with washed clothes. we just needed to die.",0.27528833296063027,0.4905999039804469,0.8923866152763367,0.91479504
"o rei de ítaca
a civilização em que estamos é tão errada que
nela o pensamento se desligou da mão
ulisses rei de ítaca carpinteirou seu barco
e gabava-se também de saber conduzir
num campo a direito o sulco do arado","the king of ithaca
our civilization is so out of kilter that
thought has separated itself from the hand
ulysses king of ithaca carpentered his boat
and also boasted of his ability
to plough a straight furrow in the field",pt_XX,en_XX,the king of mikeaca the civilization we live in is so wrong that in its mind the king of mikeaca leaped out of his hand streets the king of mikeaca carved out his boat and boasted he also knew how to drive the right,0.08085681082844315,0.3821426566097063,0.8624891638755798,0.8660736
"a cabeça em ambulância
há feridas cíclicas há violentos voos
dentro de câmaras de ar curvas
feridas que se pensam de noite
e rebentam pela manhã
ou que de noite se abrem
e pela manhã são pensadas
com todos os pensamentos
que os órgãos são hábeis
em inventar como pensos
ligaduras capacetes
sacramentos
com que se prende a cabeça
quando ela se nos afasta
quando ela nos pressente
em síncope ou desnudamento
ou num erro mais espaçoso
ou numa letra mais muda
ou na sala de tortura
na sala escura, de infância.","head in an ambulance
there are cyclical wounds furious flights
inside rounded air sacs
wounds that are thought of at night
and break out in the morning
or that open up at night
and in the morning are thought of
along with the other thoughts
our organs are adept
at inventing like bandages
compresses helmets
sacraments
for securing the head
when it breaks away from us
when it’s able to sense us
in a syncope or naked exposure
or in a more spacious error
or in a quieter letter
or in the torture chamber
in the dark chamber, of childhood.",pt_XX,en_XX,"the head in the ambulance there are cyclical wounds there are violent flights inside curved wounded air cameras that think at night and burst in the morning or that at night open and think in the morning with all the thoughts that the organs are capable of inventing like thoughts capsized cords sacraments that hold the head when it flies away from us when it presses us in synopsis or nakedness or in a spaceier error or in a different letter or in the torture room in the dark, childhood room.",0.25495426065388815,0.5899079748517483,0.8717144131660461,0.87345874
"a infancia da herberto helder
no princípio era a ilha
embora se diga
o espírito de deus
abraçava as águas
nesse tempo
estendia-me na terra
para olhar as estrelas
e não pensava
que esses corpos de fogo
pudessem ser perigosos
nesse tempo
marcava a latitude das estrelas
ordenando berlindes
sobre a erva
não sabia que todo o poema
é um tumulto
que pode abalar
a ordem do universo agora
acredito
eu era quase um anjo
e escrevia relatórios
precisos
acerca do silêncio
nesse tempo
ainda era possível
encontrar deus
pelos baldios
isto foi antes
de aprender a álgebra","the childhood of herberto helder
in the beginning was the island
although it’s said
that the spirit of god
hugged the waters
in those days
i’d lie down on the ground
to look at the stars
without ever thinking
that those bodies of fire
might be dangerous
in those days
i plotted the stars’ coordinates
by lining up marbles
on the grass
i didn’t know that every poem
is a tumult
that can upset
the order of the universe now
i believe
i was almost an angel
and wrote rigorous
reports
about silence
in those days
it was still possible
to find god
in the wastes
that was before
i learned algebra",pt_XX,en_XX,the childhood of the clear herb in the beginning it was the island though it’s fair to say the spirit of god embraced the waters at that time i lay on earth to look at the stars and didn’t think that those bodies of fire could be dangerous at that time marking the latitude of the stars ordering shelves over the grass i didn’t know that all the poems are a tombstone that can shake the order of the universe now i believe i was almost an angel and wrote precise reports about silence at that time it was still possible to find god through the bushes this was before i learned algebra,0.4028151575250997,0.6400274395472475,0.8713158369064331,0.8024585
"tornozelos
foi na verdade a sede que me tirou
da estrada. num café de província,
cadeiras de napa cor de laranja
bordavam um balcão quase vazio.
numa esquina, para poder falar
olhos nos olhos, sentava-se um casal
adolescente. na testa dele – que
era dos dois o mais bonito – bailava
sozinha uma pérola de suor, sinal
de que haveria coisas difíceis para
dizer. mas, vendo bem, os tornozelos
dela eram tão finos que não iam
aguentar aquela confissão. bebi
correndo a minha água gelada para
não atrapalhar o choro dela; e, antes
de sair, dei comigo a pensar que nem
me importaria muito de ser traída, se
pudesse ter outra vez aquela idade.","ankles
in the end it was thirst that got me
off the street. into a café, serendipitous,
orange nappa chairs
bordering an almost-empty bar.
a teenage couple crowded
in a corner so they could speak
face-to-face. the boy – the more
attractive of the two – had a drop
of sweat dancing down his brow, a sign
that a difficult discussion lay
ahead. but then again, her ankles
were so weak that surely they couldn’t
withstand any type of confession. i gulped
my ice water so as not to disturb
her crying; and, before leaving, found
myself thinking that i wouldn’t
even mind being cheated on, if
i could be that age again.",pt_XX,en_XX,"turntables was really the seat that took me off the road. in a provincial café, orange-coloured kettle chairs lined an almost empty bench. in a corner, in order to speak eye-to-eye, a teenager’s couple sat. on his head — which was the most beautiful of the two — a pearl of sweat was bathing itself, a sign that there would be difficult things to say. but, if you look at it, her turntables were so thin that they wouldn’t tolerate that confinement. i drank running through my frozen water so as not to constrict her tears; and before leaving, I found myself thinking that I wouldn’t care much to be treated, if I could have that age again.",0.19718889699053718,0.5222979785019375,0.864507257938385,0.85767496
