original_poem,translated_poem,src_lang,tgt_lang,translated_by_TA,bleu_score,meteor_score,bertscore,bartscore
"o silêncio incompleto
que silêncio incompleto entre tantos rumores!
agora, e só agora, eles tentam dizer-nos
que amaram e esqueceram, e sempre ficaram longe
da verdade final. o amor é uma dívida
irresgatável contraída na escuridão
e só morte libera os pagadores relapsos.
tudo terminará num oceano de sombras.
os mortos também acabam, após tantas lágrimas
e missas cantadas e anúncios nos jornais.
nascemos para nos evaporar, após ter sido
a água que cobre a rampa do estaleiro.
nascemos para dizer o nosso nome ao vento.
nossos corpos rastejaram até a entrada da gruta.
mas onde estavam as almas naquele instrante
de êxtase e servidão? estavam escondidas
como os morcegos, dormiam plácidas como as placentas.","incomplete silence
what an incomplete silence among so many sounds!
now, and only now, they are trying to tell us
that they loved and they forgot, and always remained far
from any final truth. love is an unredeemable
debt contracted in the dark
and only death can free the debtors from default.
everything will reach its end in an ocean of shadows.
the dead also cease, after so many tears,
and masses sung and notices in the daily newspapers.
we are born to evaporate, after having been
water lapping at the boatyard launching ramp.
we are born to say our name to the wind.
our bodies crawled to the entrance of the cave.
but where were our souls at that moment
of ecstasy and bondage? they were hidden
like bats, sleeping, as placid as placentas.",pt_XX,en_XX,"the incomplete silence the incomplete silence between so many rumours! now, and only now, they try to tell us they loved and forgot, and always stayed away from the final truth. love is an irrevocable debt against the darkness and only death frees the relapsed payers. everything will end in an ocean of shadows. the dead too end, after so many tears and missed calls and ads in the newspapers. we’re born to evaporate, after being the water covering the pilgrim’s cliff. we’re born to tell our name to the wind. our bodies crawled to the entrance of the cave. but where were the souls in that strange ecstasy and servitude? they were hidden like bats, they slept flat like bats.",0.412367386705018,0.6543870837808808,0.908336877822876,0.934811
"para a educação sentimental
tantas vezes se vive de uma arrebatada
noção dos contrastes mais fortes entre o bem e o
mal, entre a grandeza e a abjecção, entre as rápidas
peripécias de um heroísmo ansioso e o destino inexorável,
que o melodrama é da nossa mais funda natureza,
nostálgica, obscuramente nostálgica do coração radical,
do que vai à desfilada nos sonhos contraditórios,
do que engendra imagens capciosas e julga viver em liberdade,
mas é só imprudente e explosivo, mas esbarra
nas malhas deste mundo, nos imprevistos
da traição e da morte, ou tem de renunciar perante os rasgos
mais sublimes. a paixão dilacera bruscamente as personagens
apegadas à felicidade, os obstáculos
também têm protagonistas, ajustes de contas, cruéis fulgores,
perseguições, e nos casos desvairados de amor não há saída.
desse falhanço insuportável nasce o melodrama,
lírico, incontido, entre golfadas de espiral vertiginosa
com o sangue e a memória, com o que não tem remédio e a música trágica,
em que alguém vai morrer, alguém se perde alucinado,
e alguém se salva e porventura alguém escreve
a história e alguém lhe junta a música
para as emoções serem mais opressivas e talvez mais devoradoras
e mais fáceis, e alguém tem o desejo disso, um estremecimento
de arrepio e vulgaridade, um ávido prazer inconfessado.","sentimental education
we often live according to a rash
notion of stark contrasts between good
and evil, greatness and wretchedness, the swift deeds
of an avid heroism and the inexorable march of destiny,
melodrama being part of our deepest nature,
obscurely but stubbornly nostalgic for the radical heart,
which races at top speed in contradictory dreams,
which engenders seductive images and thinks it lives in freedom,
but it’s merely reckless and explosive, it stumbles
into the world’s snares, into unexpected
treachery and death, or it must renounce in the face of the most
sublime flashes. passion rudely lacerates people
attached to happiness. the obstacles we meet
also have protagonists, scores to settle, cruel splendors,
feverish pursuits. and in desperate cases of love there’s no way out.
from that unbearable failure is born lyrical, unbridled
melodrama, amid whirling, dizzying spurts
of blood and memory, of dashed hopes and tragic music,
in which someone dies, someone goes mad,
and someone is saved, and maybe someone writes down
the story, and someone else adds music
for the emotions to be more oppressive and perhaps more consuming
and facile, and someone desires this, it makes someone feel a shiver
of tingling banality, a voracious and unconfessed thrill.",pt_XX,en_XX,"for sentimental education so often it lives out of an overwhelming notion of the strongest contrasts between good and evil, between grandeur and rejection, between the quick deaths of anxious heroism and the inevitable destiny, that melodrama is from our deepest nature, nostalgic, obscurely nostalgic of the radical heart, from what goes on to plunge into contradictory dreams, from what engenders captivating images and tries to live in freedom, but is only reckless and explosive, but escapes the evils of this world, the unforeseens of betrayal and death, or has to give up before the most sublime faces. passion abruptly dissolves the characters eager for happiness, the obstacles too have protagonists, adjustments of numbers, cruel dawns, pursuits, and in cases of broken love there is no way out. from this intolerable failure the melodrama, lyrical, unfamiliar, rises up between waves of spirals vertiginous with blood and memory, with which there is no remedy and tragic music, in which someone dies, someone loses the hallucination, and someone saves, and perhaps someone writes the story and someone joins the music to make the emotions more oppressive and perhaps more delicious and easier, and someone has the longing for that, a stiffness of bitterness and vulgarity, a bold unconfessed pleasure.",0.22686408761112756,0.5187976921645263,0.8703286051750183,0.94823205
"oxfordshire
quero o bem, e quero o mal, e afinal não quero nada.
estou mal deitado sobre a direita, e mal deitado sobre a esquerda
e mal deitado sobre a consciência de existir.
estou universalmente mal, metafisicamente mal,
mas o pior é que me dói a cabeça.
isso é mais grave que a significação do universo.
uma vez, ao pé de oxford, num passeio campestre,
vi erguer-se, de uma curva da estrada, na distância próxima
a torre-velha de uma igreja acima de casas da aldeia ou vila.
ficou-me fotográfico esse incidente nulo
como uma dobra transversal escangalhando o vinco das calças.
agora vem a propósito…
da estrada eu previa espiritualidade a essa torre de igreja
que era a fé de todas as eras, e a eficaz caridade.
da vila, quando lá cheguei, a torre da igreja era a torre da igreja,
e, ainda por cima, estava ali.
é-se feliz na austrália, desde que lá se não vá.","oxfordshire
i want the good, i want the bad, and in the end i want nothing.
i toss in bed, uncomfortable on my right side, on my left side,
and on my consciousness of existing.
i’m universally uncomfortable, metaphysically uncomfortable,
but what’s even worse is my headache.
that’s more serious than the meaning of the universe.
once, while walking in the country around oxford,
i saw up ahead, beyond a bend in the road,
a church steeple towering above the houses of a hamlet or village.
the photographic image of that non-event has remained with me
like a horizontal wrinkle marring a trouser’s crease.
today it seems relevant...
from the road i associated that steeple with spirituality,
the faith of all ages, and practical charity.
when i arrived at the village, the steeple was a steeple
and, what’s more, there it was.
you can be happy in australia, as long as you don’t go there.",pt_XX,en_XX,"oxfordshire i want good, i want evil, and it turns out i don’t want anything. i’m badly laid on the right, and badly laid on the left and badly laid on the consciousness of existence. i’m universally wrong, metaphysically wrong, but worst of all, it hurts my head. it’s more serious than the meaning of the universe. once, on a sidewalk near oxford, on a campfire, i saw myself erect from a curve of the road, near the old church tower above the village or village’s houses. it became photographic to me that the incident was as cloudy as a cross-section slitting my pants. now let’s see... from the road i prescribed spirituality to that church tower that was the faith of all the ages, and effective charity. from the village, when i got there, the church tower was the church tower, and, still above, i was there. i’m happy in australlia, as long as you don’t go there.",0.2554366278473259,0.511508819918789,0.8894566297531128,0.9291326
"num jardim adornado de verdura
a que esmaltam por cima várias flores,
entrou um dia a deusa dos amores,
com a deusa da caça e da espessura.
diana tomou logo ũa rosa pura,
vénus um roxo lírio, dos milhores;
mas excediam muito às outras flores
as violas, na graça e fermosura.
perguntam a cupido, que ali estava,
qual daquelas três flores tomaria,
por mais suave, pura e mais fermosa?
sorrindose, o minino lhe tornava:
todas fermosas são, mas eu queria
viol’antes que lírio, nem que rosa.","to a garden luxuriously verdant . . .
to a garden luxuriously verdant
and enamelled with countless flowers,
there came one day the two goddesses
of love, and of dense forests and hunting.
then diana plucked a perfect rose
and venus the best of the red lilies,
but exceeding by far all the other flowers
in beauty and grace were the violas.
they asked cupid, who was standing near,
which of the blooms, in his opinion,
was sweetest, purest and most lovely?
the youngster answered with a grin:
— all three are gorgeous, but i much prefer
viola-tion to mere rose and lily.",pt_XX,en_XX,"in a garden adorned with vegetable trees overlaid by various flowers, one day the goddess of loves entered, with the goddess of hunting and thickness. diana soon took a purple rose hat, came a lily rock, from the millers; but the other flowers far outweigh the virgins, in their grace and beauty. they ask the cupid, who was there, which of those three flowers would she take, softer, purer and more beautiful? she smiled, the minino made her look: they’re all beautiful, but I wanted violins that lily, not that rose.",0.07447769536159005,0.36279414737392834,0.8618801832199097,0.9024205
"branco e vermelho
a dor, forte e imprevista,
ferindo-me, imprevista,
de branca e de imprevista
foi um deslumbramento,
que me endoidou a vista,
fez-me perder a vista,
fez-me fugir a vista,
num doce esvaimento.
como um deserto imenso,
branco deserto imenso,
resplandecente e imenso,
fez-se em redor de mim.
todo o meu ser suspenso,
não sinto já, não penso,
pairo na luz, suspenso…
que delícia sem fim!
na inundação da luz
banhando os céus a flux,
no êxtase da luz,
vejo passar, desfila
(seus pobres corpos nus
que a distancia reduz,
amesquinha e reduz
no fundo da pupila)
na areia imensa e plana,
ao longe, a caravana
sem fim, a caravana
na linha do horizonte,
da enorme dor humana,
da insigne dor humana...
a inútil dor humana!
marcha, curvada a fronte.
até o chão, curvados,
exaustos e curvados,
vão um a um, curvados,
os seus magros perfis;
escravos condenados,
no poente recortados,
em negro recortados,
magros, mesquinhos, vis.
a cada golpe tremem
os que de medo tremem,
e as pálpebras me tremem
quando o açoite vibra.
estala! e apenas gemem,
pavidamente gemem,
a cada golpe gemem,
que os desequilibra.
sob o açoite caem,
a cada golpe caem,
erguem-se logo. caem,
soergue-os o terror...
até que enfim desmaiem,
por uma vez desmaiem!
ei-los que enfim se esvaem
vencida, enfim, a dor...
e ali fiquem serenos,
de costas e serenos...
beije-os a luz, serenos,
nas amplas frontes calmas
ó céus claros e amenos,
doces jardins amenos,
onde se sofre menos,
onde dormem as almas!
a dor, deserto imenso,
branco deserto imenso,
resplandecente e imenso,
foi um deslumbramento.
todo o meu ser suspenso,
não sinto já, não penso,
pairo na luz, suspenso
num doce esvaimento.
ó morte, vem depressa,
acorda, vem depressa,
acode-me depressa,
vem-me enxugar o suor,
que o estertor começa.
é cumprir a promessa.
já o sonho começa...
tudo vermelho em flor...","white and crimson
the sharp and sudden pain
that stings me all of sudden,
appeared as a sudden flash,
of dazzling, dizzying white,
deranging what i saw,
costing me my vision,
causing all in view to flee,
in a gentle fading away.
it surrounded me
like a vast desert,
a vast, white desert,
vast and resplendent.
my whole being suspended,
i do not feel, i do not think,
i hover, suspended in the light....
what endless pleasure!
in the flood of light
bathing every corner of sky,
in the ecstasy of light,
i watch an endless caravan.
poor naked bodies,
reduced in the distance,
reduced and diminished
in the depths of my pupils!
on the vast plain of sand
on the distant horizon
looms the unending caravan
of immense human suffering,
eminent human suffering,
useless human suffering —
advancing with bowed heads!
bowed to the ground,
bowed and exhausted,
bowed in a single file,
march their thin figures.
condemned slaves
outlined in the sunset,
outlines of black silhouettes:
thin, wretched and vile.
those who tremble out of fear
tremble at every blow,
and i feel my eyelids tremble
whenever the whip snaps.
crack! they only moan,
drawn and pale they moan,
moan with every crack
that knocks them down.
under the whip they fall,
with every stroke they fall,
rise back up, then fall,
still struggle up, in fear,
until at last they pass out,
finally they’ve passed out!
look at them, now fainted,
their pain now defeated…
may they lie there, peaceful,
on their backs and peaceful,
and may the light caress
their broad and peaceful brows,
o clear and calm skies,
sweet calm gardens,
where the suffering is less,
where souls can rest!
the pain, a vast desert,
a vast, white desert,
vast and resplendent,
appeared as a sudden flash.
my whole being suspended,
i do not feel, i do not think,
i hover in the light, suspended
in a gentle fading away.
come swiftly, o death,
awake and come swiftly,
come swiftly to my aid,
come and wipe my sweat,
for the agony has begun.
it’s time to fulfill your promise.
soon the dream commences…
all a blossoming in crimson…",pt_XX,en_XX,"white and red the pain, strong and unpredictable, hurting me, unpredictable, of white and unpredictable, the pain, strong and unpredictable, hurting me, unpredictable, of white and unpredictable, was a gloom, which darkened my sight, made me lose my sight, made me flee my sight, in a sweet swelling. like a vast, white, vast, luminous and immense desert, the pain, strong and unpredictable, burned me, unpredictable, of white and unpredictable, it was a gloom, which darkened my sight, made me lose my sight, in a sweet swelling. like a vast, white, vast, luminous and immense desert, the pain, strong and unpredictable, burned me, darkened my eyes, white and red the pain, strong and unpredictable, hurting me, unpredictable, of white and unpredictable, was a gloom, which darkened my sight, made me lose my sight, in a sweet swelling. like a vast, white, vast, luminous and immense desert, it burned all around me. all my suspended being, all my suspended being, all my suspended being, all my suspended being, all my suspended being, all my suspended being, all my suspended being, all my suspended being, all my suspended being,",0.026602374116092575,0.1803584584348555,0.7829751968383789,0.8237469
"deus absconditus
deus é para vós um sonho incompreensível,
atrás da janela simulada
em que vos esconde o céu.
expostos ao seu olhar de rapina,
dele vos ausentastes como quem dorme
entre ramos que se movem numa lembrança de vento.
dependurado na vida dos santos,
evacuado foi do espaço que habitais.
vacila na ostensão própria de um rosto.
deus do avesso de todas as coisas,
uma paciência do tamanho da vossa idade,
passeia às cegas sobre o hades, embalado
num tentar difuso, numa ânsia de marcar fronteiras,
peito chato de quem tossiu o universo
e as estrelas recolhe no punho, às mãos-cheias.
deus-despojo-de-si-mesmo, pela tarde:
chaga aberta à fúria das bestas proscritas
e ao registo de fumo das chaminés.","deus absconditus
god is for you an inscrutable dream
behind the simulated window
in which you’ve hidden the sky.
exposed to his predatory stare,
you’ve withdrawn from him like creatures that sleep
among branches that shake, remembering the wind.
hanging from the lives of saints,
he was evicted from the space you inhabit.
he even wavers in the face he shows.
god the flip side of all things,
a patience exactly equal to your age,
blindly ranges over hades, swaying
in his hazy groping, anxious to stake out territory,
his chest sunken from having coughed out the universe
and his hands grabbing stars by the fistful.
god-the-dregs-of-himself, at day’s end:
a wound opened by the fury of lawless beasts
and the dampers of belching chimneys.",pt_XX,en_XX,"gods hidden gods is for you an incomprehensible dream, behind the simulated window in which the sky hides you. exposed to its captured gaze, from which you lingered like someone who sleeps among branches that move in a reminder of the wind. confined to the life of saints, it was evacuated from the space you dwell in. vacillates in the very stench of a face. gods of the dawn of all things, a patience the size of your own age, passed to the blind on the hail, packed in a distorted attempt, in an craving to mark boundaries, the lustful belly of someone who squeezed the universe and the stars collected in his throat, in his cheekful hands. gods departing from themselves in the afternoon: a throat open to the fury of the forbidden beasts and to the smoke of the chamberlains.",0.16215691969933474,0.4483960916890213,0.8567661643028259,0.9208072
"os milagres acontecem
a horas incertas
e nunca estou em casa
quando o carteiro passa.
hoje, abriu a primeira flor
e eu disse é um sinal.
olho em volta: estou só
trago esta sombra comigo.","miracles happen
miracles happen
at odd hours
and i’m never at home
when the postman comes by.
today the first flower blossomed
and i said it’s a sign.
i look around: i’m alone
i carry this shadow.",pt_XX,en_XX,"miracles happen at the wrong time and i'm never home when the clerk passes. today, she opened the first flower and i said it's a sign. look around: i'm just carrying this shadow with me.",0.20518322359345256,0.5852050548402481,0.9010640382766724,0.8426212
"a viagem de alexandre à índia
andaste de um ao outro lado da terra na vida interminável,
tiveste degredos, piedosos cíumes, a fé desvanescida,
amantes paradas na lavoura, roubando-te o rosto amado.
viste vestígios de que foste a sombra de ninguém,
olhos sem pudor, do reflexo dos ferros no tropel,
franjas do domínio pueril de alexandre, olhando gaugamela.
partiste num porto de transição para o levante,
com vazios para trás, todo o tempo a poder ver,
e ao primeiro inverno, pelos cardeais das suas cinzas,
começaste a travessia que não termina, a história que não acaba.
soubeste porque se vislumbra, em lágrimas, o pinheiro da juventude,
o nome quebrado num turvo ar medido sem corda,
e a maresia do vento de feição no segundo inverno.
em troca perseguiste o que rege o homem fortuito,
segredando em palácios de mármore que são apenas pedras,
dos fracassos a que jamais alguém ajoelhara.
ao terceiro inverno descobriste o hemisfério, e ao quarto,
sem ideia de guerra ou ordem para mudar o reino,
escolheste adornar os aquedutos sob o manto dos regatos,
sentado, na brisa no tanque, ao febril entardecer.
de quem te aproximaste, no seu trajecto interminado,
sem lugar senão o que esfria na mente recortada,
naquilo que se ramifica, tornando-se na própria teia,
contigo propagou o dever de passar em toda a parte.
e quando veio o quinto inverno, e o sexto, suturaste o sangue,
trouxeste a pele à curva dos rios, acolheste o que de resto se desmorona,
e pudeste enfim, na crença dos migradores furtivos, entender que
tudo se perde noutro lugar ainda, e após esse ainda noutro
e que ao fim de cada manhã noutra manhã
tudo é incerto, tão conforme o dente-de-leão no meio de searas,
tão emudecido como a veia exausta dos não sepultados.
na mansarda onde vagueia o dia e a noite
o vento responde, cortando o centeio e o calcário, e a vela
que brilha na luz de estrelas veladas, já desaparecidas,
pisadas, mudas, engolidas aos pés do sétimo inverno,
arpoa o coração e a ruína — os meridianos despem-se, voam
em vinte e cinco anos que há pouco se beijavam, e seja dito ou não dito
o prazer que inflige um pico de tormentos
por lábios que só as mulheres conhecem
no moinho das águas da morte em varanasi,
sacode a chama de quanto vale, dura e canta
o princípio e o fim do teu poder na terra.","alexandres`s travel to india
you wandered an interminable life across the earth,
suffered exile, piteous jealousy, futile faith,
labour-arrested lovers plundering your beloved’s face.
you saw traces of having been no one’s shadow,
impudent eyes, the reflection of iron on the rampage,
hints of alexander’s puerile dominance, contemplating gaugamela.
you set off from a transient port towards the levant,
leaving emptiness behind, seeing all of time,
and in the first winter, by the cardinals of its ashes,
you started the endless crossing, the incessant history.
you knew, because the pine tree of youth can be glimpsed through tears,
of the shattered name in a cloudy mood measured without ropes,
and of the favourable sea breeze in the second winter.
in exchange you pursued that which rules the fortuitous man,
whispering in marble palaces that are but stones,
failures to which no one had ever knelt.
by the third winter you discovered the hemisphere, and by the fourth,
non intent on war or order to change the kingdom,
you chose to adorn aqueducts with the mantle of streams,
sitting by the pool breeze, in the evening´s lingering fever.
whomever you approached, in their indefinite path,
without a place except that which fades inside a patchy mind,
in that which branches out and becomes the very web,
has spread with you the duty to pass through everywhere.
and by the fifth winter, and the sixth, you stitched up the blood,
brought the skin on to the river bends, welcomed that which falls apart,
and were at last capable, with the belief of a stealthy migrant, of understanding
that all is lost yet in another place, and after this in yet another
and that by the end of each morning in another morning
all is uncertain, just like a dandelion in a field of wheat,
as muted as the exhausted vein of the unburied.
in the attic where night and day roam
the wind replies, cutting the chalk and the rye, and the candle,
shimmering in the light of the veiled stars already gone,
trodden, voiceless, swallowed up by the seventh winter,
spears the heart and the ruin — the meridians undress, fly away
in twenty five years that were just kissing yesterday, and be it told or untold
the pleasure that brings a peak of torment, inflicted
by lips that only women know
in the turmoil of varanasi´s death waters,
tests the flame of the merit, endurance and song of
the beginning and the end of your power on earth.",pt_XX,en_XX,"the journey of xlegander to India you walked from one side of the earth to the other in an endless life, you had gritty, merciful moonlights, vanished faith, lovers resting in the vault, robbing your beloved face. you saw traces of being the shadow of no one, eyes without power, of the reflection of iron on the throttle, clear of the domain pueril xlegander, gazing at her. you set out in a port of transition for the rising, with vaults behind, all the time you could see, and in the first winter, through the hearts of her beard, you began the journey that does not end, the story that does not end. you knew why it glows, in tears, the pearl of youth, the name broken in a twisted, cordless air, and the whirl of the fierce wind in the second winter. in return you pursued what rules the fortuneless man, hiding in marble palaces that are only stones, the fractures that no one ever scratches. in the third winter you discovered the hemisphere, and in the fourth, with no idea of war or order to change the kingdom, you chose to adorn the ruins beneath the mantle of the rivers, sitting, in the breeze in the tank, in the icy fog. who you approached, in its endless journey, with no place but what freezes in the shrouded mind, what branches, becoming its own bed, spread with you the duty to pass everywhere. and when the fifth winter came, and the sixth, you sucked your blood, brought your skin to the river’s curve, grasped what’s left to rot, and you could firmly believe in the stubborn migrators, understand that everything is lost in another place, and after that in another, and that at the end of every morning everything is uncertain, just as the leaning tooth in the midst of evenings, so utterly utterly as the veil of the unsealed. in the mantle where day and night wandered, the wind answers",0.20356813766128706,0.33091747501469726,0.8693932890892029,0.9569132
