original_poem,translated_poem,src_lang,tgt_lang,translated_by_TA,topic
"qu’est ce que tu m’as dit encore, en me quittant:
que’l on ne s’aimait plus? …mais si, mais si, on s’aime!
tu as pleure? tu seras donc toujours la meme?
mais puisque je te dis qu’on s’aime! tu m’entends?
sois donc plus simple! il faut toujours que tu compliques
les choses! dis-toi donc qu à notre epoque, enfin,
cela devient par trop poncif et ridicule,
sous pretexte qu’on est des amants un peu fins,
d’ecrire amour et coeur avec des majuscules.
nous employons des mots qui servent a rien,
et qui sont tres génants..et dangereux! on pose!
on dit: mon coeur , notre coeur… on y tient.
je te jure que’l on s’en passerait tres bien,
et que ce la simplifierait beaucoup les choses.
il n y a pas nos coeurs: il y a toi et moi, oui, toi et moi,
qui n’avons rien d’extraordinaire.
mais on se grise avec des mots, on s’exagere
l’importance de tout, et puis on s’aperçoit
que la realite n’est pas a la hauteur…
je t’en supplie, laissons mon coeur, laissons ton coeur!
soyons nous!… eh! bien, oui, c’est vrai, quand on se voit,
on n’est plus tres troublé.. c’est moins bien qu’autrefois.
tu ne t’affoles pas.. moi non plus. eh bien, quoi?
il n y a là rien de bien tragique. nous sommes
un peu calmés? mais c’est tout naturel, cela.
c’est l’habitude. on est habitué. voilà.
si nous nous retrouvons sans passion, en somme,
chaq un de nous s’ennuie quand l’autre n’est plus là.
on se croit malheureux, on n’a de gout à rien,
on se sent seul … eh ! bien, mais c’est deja tres bien!","que foi que você disse, há pouco, ao despedir-se?
que nós não nos gostamos mais?… gostamos, sim!
você chorou? por que você há de ser assim?…
mas se eu digo que sim! não ouviu o que eu disse?…
seja mais simples, mais humana! não complique
as coisas! hoje em dia, entenda bem, já são
ridículas demais essas preocupações
de se escrever, sob pretexto de ser “chic”,
com maiúsculas só, amor e coração.
usamos expressões inúteis, expressões
que atrapalham até… nós dizemos: o meu,
o nosso coração… e fazemos questão.
se a gente não tivesse essa preocupação,
simplificava muito as coisas, compreendeu?
não existe o que é nosso: existe eu e você.
sim, um eu e um você sem nada de especial.
a gente embriaga-se de frases afinal,
e vive exagerando tudo, para quê?
se a realidade nunca alcança uma ilusão…
por favor, deixe o seu, deixe o meu coração!
vamos ser nós, só nós!… sim, é verdade, agora,
quando a gente se vê, já não é como outrora,
não se embaraça mais… mas é assim mesmo… o quê?
mas não há nada, aí, de trágico! você
e eu estamos mais calmos só. é natural.
é o hábito. nós já nos habituamos. e,
se é sem paixão que nós nos vemos, cada qual,
quando o outro não está, sente-se mal, tão mal,
e aborrece-se, e sofre muito, e fica tão
desgraçado… mas isto é alguma coisa, então!",fr_XX,pt_XX,"O que é que me disseste outra vez, ao me deixar:
que já não nos amávamos? ...mas sim, mas sim, amamo-nos!
Choraste? Serás então sempre a mesma?
Mas se te digo que nos amamos! Ouves-me?
Sê mais simples então! É sempre necessário que compliques
as coisas! Diz a ti mesma que na nossa época, afinal,
torna-se excessivamente banal e ridículo,
sob pretexto de sermos amantes um pouco refinados,
escrever amor e coração com maiúsculas.
Usamos palavras que não servem para nada,
e que são muito embaraçosas... e perigosas! Posamos!
Dizemos: meu coração, nosso coração... importamo-nos.
Juro-te que nos passaríamos muito bem sem eles,
e que simplificaria muito as coisas.
Não há os nossos corações: há tu e eu, sim, tu e eu,
que não somos nada de extraordinário.
Mas embriagamo-nos com palavras, exageramos
a importância de tudo, e depois percebemos
que a realidade não está à altura...
Peço-te, deixemos o meu coração, deixemos o teu coração!
Sejamos nós!... Pois bem, sim, é verdade, quando nos vemos,
já não ficamos muito perturbados... é menos bom do que antigamente.
Tu não te afliges... eu também não. Pois bem, e então?
Não há nada de muito trágico nisso. Somos
um pouco acalmados? Mas é tudo muito natural, isso.
É o hábito. Estamos habituados. É isso.
Se nos reencontramos sem paixão, afinal,
cada um de nós aborrece-se quando o outro não está.
Pensamos que somos infelizes, não temos gosto em nada,
sentimo-nos sós... Pois bem, mas já é muito bom!",1
"au fond, vois-tu, mon erreur,
ma grande folie,
c’est d’avoir charge ton coeur
de tout le poids de ma vie.
le jours où l’on s’est aimé,
j’ai cru qu’en ce coeur offert
j’allais pouvoir enfermer
tout mon univers.
c’est de cette erreur profonde
que maintenant nous souffrons.
on ne fait pas tenir le monde
derrière un front.
ton coeur est tendre et sincère,
ardent et soumis.
mais, tout seul, pouvait-il faire
que je me passe de ma mère
et de me amis?","afinal, meu gesto doido,
meu erro, querida,
foi ter posto em você
todo o peso da minha vida.
ao começar este amor
num coração tão diverso do meu
pensei poder pôr
todo o meu universo.
e é desse erro tão profundo
que vamos sofrendo então.
não se pode pôr um mundo
sobre um coração.
o seu coração é sincero,
ardente comigo
mas, só, será suficiente
para afastar-me dos parentes
e dos meus amigos?",fr_XX,pt_XX,"No fundo, vês tu, meu erro,
minha grande loucura,
foi ter carregado teu coração
com todo o peso da minha vida.
O dia em que nos amamos,
acreditei que neste coração oferecido
poderia aprisionar
todo o meu universo.
É por este profundo erro
que agora sofremos.
Não se pode conter o mundo
atrás de uma fronte.
Teu coração é terno e sincero,
ardente e submisso.
Mas, sozinho, poderia ele fazer
com que eu dispensasse minha mãe
e meus amigos?",1
"ne soyons pas trop exigeants:
le bonheur n’est pas accessible
à toutes les sortes de gens.
il faudrait être moins sensible,
ou bien avoir beaucoup d’argent…
ne demandons pas l’impossible.
nous devons nous trouver contents
d’être les êtres que nous sommes:
des amoureux intermittents
qui sont fous l’un de l’autre en somme
de temps en temps.
c’est déja beaucoup d’être deux,
deux côte à cote sur la terre,
qui peuvent souffrir entre eux
et vivre sans trop se taire.
et si l’on est plus exigeant,
si l’on se sent en y songeant
l’âme encor trop célibataire,
c’est qu’on a mauvais caractère…
ou qu’on est trop intelligent.","não sejamos muito exigentes:
nem sempre a sorte é acessível
a todo mundo, a toda a gente.
ela é só dos menos sensíveis,
ou dos ricos, naturalmente…
não desejemos o impossível.
devemos estar contentes
de ser quem somos:
simplesmente namorados intermitentes
loucamente se namorando
de vez em quando.
é já uma grande cousa a gente
ser dois, à parte, entre os mortais,
dois que se bastam mutuamente
e não se aborrecem demais.
e somos mais exigentes,
se às vezes a alma ainda se sente
solteira e triste, isso é explicável:
temos um gênio insuportável…
ou somos muito inteligentes.",fr_XX,pt_XX,"Não sejamos muito exigentes:
a felicidade não é acessível
a todos os tipos de pessoas.
Seria necessário ser menos sensível,
ou ter muito dinheiro...
não exijamos o impossível.
Devemos nos sentir contentes
por ser os seres que somos:
amantes intermitentes
que são loucos um pelo outro,
de vez em quando.
Já é muito ser dois,
dois lado a lado na terra,
que podem sofrer juntos
e viver sem se calar muito.
E se formos mais exigentes,
se nos sentimos ao pensar nisso
ainda muito solitários,
é porque temos um mau caráter...
ou somos muito inteligentes.",1
"on aime d’abord par hasard,
par jeu, par curiosité,
pour avoir dans um regard
lu des possibilites.
et puis comme au fond soi-même
on s’aime beaucoup,
se quelqu’un vous aime, on l’aime
par conformité de goût.
on se rend grâce, on s’invite
à partager ses moindres maux.
on prend l’habitude, vite,
d’échanger de petits mots.
quand on a longtemps dit les mêmes,
on les redit sans y penser.
et alors, mon dieu, l’on aime
parce qu’on a commencé.","a gente começa a amar,
por simples curiosidade,
por ter lido num olhar
certa possibilidade.
e como, no fundo, a gente
se quer muito bem,
ama quem ama somente
pelo gosto igual que tem.
pelo amor de amar começa
a repartir dor por dor.
e se habitua depressa,
a trocar frases de amor.
e, sem pensar, vai falando,
de novo as que já falou.
e então continua amando
só porque já começou.",fr_XX,pt_XX,"Amar-se-á, primeiramente, por acaso,
por brincadeira, por curiosidade,
por ter, num olhar, encontrado
possibilidades.
E depois, como no fundo de si mesmo,
se gosta muito,
se alguém nos ama, o ama-se
por afinidade de gostos.
Agradece-se um ao outro, convida-se
a partilhar os menores males.
Adquire-se rapidamente o hábito
de trocar pequenas palavras.
Quando se diz por muito tempo as mesmas coisas,
repetem-se sem pensar.
E então, meu Deus, ama-se
porque se começou.",1
"ah! je vous aime! je vous aime!
vous entendez? je suis fou de vous. je suis fou…
je dis des moi, toujours lês mêmes…
mais je vous aime! je vous aime! …
je vous aime, comprenez-vous?
vous riez? j’ai l’air stupide?
mais comment faire alors pour que tu saches bien,
pour que tu sentes bien? ce qu’on dit, c’est si vide!
je cherche, je cherche un moyen…
ce n’est pas vrai que les baisers peuvent suffire.
quelque chose m’étouffe, ici, comme un sanglot.
j’ai besoin d’exprimer, d’expliquer, de traduire.
on ne sent tout à fait que ce qu’on a su dire.
on vit plus ou moins à travers des mots.
j’ai besoin de mots, d’analyses.
il faut, il faut que je te dise…
il faut que tu saches… mais quoi!
si je savais trouver des choses de poète,
en dirais-je plus – résponds-moi –
que lorsque je te tiens ainsi, petite tête,
et que cent fois et mille fois
je te répète éperdument et te répète:
toi! toi! toi! toi!","eu gosto, gosto de você
compreende?
eu tenho por você uma doidice…
falo, falo, nem sei o que
mas gosto, gosto de você
você ouviu bem isso que eu disse? …
você ri? eu pareço um louco?
mas, que fazer para explicar isso direito,
para que você sinta? …
o que eu digo é tão oco!
eu procuro, procuro um jeito…
não é exato que o beijo só pode bastar.
qualquer cousa que me afoga, entre soluço e ais.
é preciso exprimir, traduzir, explicar…
ninguém sente senão o que soube falar.
vive-se de palavras, nada mais.
mas é preciso que eu consiga
essas palavras e que eu diga,
e você saiba… mas, o que?
se eu soubesse falar
como um poeta que sente,
diria eu mais do que
quando tomo entre as mãos
essa cabeça linda
e cem mil vezes, loucamente,
digo e repito
e torno a repetir ainda:
você! você! você! você!",fr_XX,pt_XX,"ah! eu te amo! eu te amo!
Você entende? Estou louco por você. Estou louco...
Digo as mesmas coisas, sempre...
Mas eu te amo! Eu te amo! ...
Eu te amo, você entende?
Você está rindo? Pareço idiota?
Mas como fazer então para que você saiba bem,
Para que você sinta bem? O que se diz, é tão vazio!
Estou procurando, procurando um jeito...
Não é verdade que beijos possam bastar.
Algo me sufoca aqui, como um soluço.
Preciso expressar, explicar, traduzir.
Sente-se completamente apenas o que se soube dizer.
Vivemos mais ou menos através das palavras.
Preciso de palavras, de análises.
É preciso, é preciso que eu te diga...
É preciso que você saiba... mas o quê!
Se eu soubesse encontrar coisas de poeta,
Diria mais - me responda -
Do que quando te seguro assim, pequena cabeça,
E cem vezes e mil vezes
Te repito loucamente e te repito:
Você! Você! Você! Você!",1
"je sais bien qu’irritable, exigeant et morose,
insatisfait, jaloux, malheureux pour un mot,
je te cherche souvent des querelles sans cause
si je t’aime si mal, c’est que je t’aime trop.
je te poursuis. je te tourmente. je te gronde…
tu serais plus heureuse, et mieux aimée aussi,
si tu n’étais pour moi tout ce qui compte au monde,
et si ce pauvre amour n’était mon seul souci.","eu bem sei que, ciumento, exigente, impulsivo, irritado,
infeliz por cousas tão banais,
eu vivo a provocar discussões sem motivo…
mas eu amo tão mal porque eu amo demais.
e atormento você, e persigo…
você havia de ser melhor amada e mais feliz também,
se não fosse você a minha única alegria,
e se este amor não fosse o meu único bem.",fr_XX,pt_XX,"Eu sei que sou irritável, exigente e mal-humorado,
insatisfeito, ciumento, infeliz por um simples motivo,
muitas vezes te provoco brigas sem razão,
se te amo tão mal, é porque te amo demais.
Eu te persigo. Eu te atormento. Eu te repreendo...
tu serias mais feliz, e também mais amada,
se não fosses para mim tudo o que importa no mundo,
e se este pobre amor não fosse minha única preocupação.",1
"tu m’as dit: “je pense à toi
tout lê jour.”
mais tu penses moins à moi
que a l’amour.
tu m’as dit: “mes yeux mouillés
qui ne peuvent t’oublier
restent longtemps éveillés
lorsque je me couche.”
mais ton coeur est moins grisé
qu’amusé.
tu penses plus au baiser
qu’à la bouche.
tu ne te tourmentes point.
tu sais, sans chercher plus loin,
que nos joies sont bien les nôtres…
mais l’amour est un besoin.
m’aimerais-tu beaucoup moins
si j’étais un autre?","você diz: “eu penso apenas em você
todo o dia.”
mas pensa em mim muito menos
que no amor.
e diz: “meus olhos magoados
que vivem só de desejo
passam horas acordados
quando me deito.”
mas sua alma é mais satisfeita
do que louca.
você pensa mais no beijo
que na boca.
você não se inquieta
tem certeza de que este bem
é somente seu e meu.
mas o amor é uma necessidade.
você gostaria mesmo menos de mim, muito menos
se eu não fosse eu?",fr_XX,pt_XX,"Tu me disseste: ""Penso em ti
todos os dias.""
Mas pensas menos em mim
do que no amor.
Tu me disseste: ""Meus olhos úmidos
que não podem te esquecer
ficam muito tempo acordados
quando me deito.""
Mas teu coração está menos entristecido
do que entretido.
Pensas mais no beijo
do que na boca.
Não te atormentas.
Sabes, sem procurar mais longe,
que nossas alegrias são realmente nossas...
mas o amor é uma necessidade.
Amar-me-ias muito menos
se eu fosse outro?",1
"et pourtant, nous pouvions ne jamais nous connaitre!
mon amour, imaginez-vous
tout ce que le sort dut permettre
pour qu’on soit là, qu’on s’aime, et pour que ce soit nous?
tu dis: “nous étions nés l’un pour l’autre.” mais pense
à ce qu’il dut falloir de chances, de concours,
de causes, de coïncidences,
pour réaliser ça, simplement, notre amour!
songe qu’avant d’unir nos têtes vagabondes,
nous avons vécu seuls, separes, égarés,
et que c’est long, le temps, et que c’est grand, le monde,
et que nous aurions pu ne pas nous rencontrer.
as-tu jamais pense, ma jolie aventure,
aux dangers que courut notre pauvre bonheur
quand l’um vers l’autre, au fond de l’infinie nature,
mystérieusement gravitaient nos deux coeurs?
sais-tu que cette course était bien incertaine
qui vers un soir nous conduisait,
et qu’un caprice, une migraine,
pouvaient nous écarter l’un de l’autre à jamais?
je ne t’ai jamais dit cette chose inouïe:
lorsque je t’aperçus pour la première fois,
je ne vis pás d’abord que tu étais jolie.
je pris à peine garde à toi.
ton amie m’occupait bien plus, avec son rire.
c’est tard, très tard, que nos regards se sont croisés.
songe, nous aurions pu ne pas savoir y lire,
et toi ne pas comprendre, et moi ne pas oser.
où serions-nous oe soir si, ce soir-là, ta mère
t’avait reprise um peu plus tôt?
et si tu n’avais pas rougi, sous les lumières,
quand voulus t’aider à mettre ton manteau?
car souviens-toi, ce furent là toutes les causes.
un retard, um empêchement,
et rien n’aurait été du cher enivrement,
de l’exquise métamorphose!
notre amour aurait pu ne jamais advenir!
tu pourrais aujourd hui n’être pas dans ma vie!…
mon petit coeur, mon coeur, ma petite chérie,
je pense à cette maladie
dont vous avez failli mourir…","podíamos jamais nos conhecer talvez!
meu amor, imagine, pois,
tudo isso que a sorte nos fez
para estarmos aqui, para sermos nós dois!
nós fomos feitos um para o outro – diz você.
mas pense no que foi preciso se interpor
de coincidências, para que
pudesse haver apenas isto: o nosso amor!
que antes de unir nosso destino vagabundo,
vivemos longe um do outro, e sós, separados,
e que é tão longo o tempo, e que é tão grande o mundo,
e a gente era capaz de não se ter encontrado.
você nunca pensou, meu romance bonito,
e que este amor correu de risco e indecisões
quando, ao encontro um do outro, em torno do infinito,
gravitaram à toa os nossos corações?
você não sabe então que era incerta essa estrada
que conduziu nossos ideais,
e que um capricho, um quase nada
podia não ter nos juntado nunca mais?
nunca lhe confessei esta coisa esquisita:
quando visitei você pela primeira vez,
a princípio nem vi que você era bonita…
não reparei quase em você.
sua amiga me atraiu muito mais, com seu sorriso.
foi só muito depois que cruzamos o olhar…
nós podíamos não ter lido nada disso:
e você, não compreender, e eu, nem sequer ousar.
que seria de nós se, aquela noite, alguém
viesse buscar você antes?
ou se, entre luzes, você não corasse também
quando eu quis ajudar a pôr o seu manteau?…
pois foram essas razões, lembra-se ainda?
um atraso, um impedimento,
e nada existiria deste encantamento,
desta metamorfose linda!
nunca aconteceria o amor que aconteceu!
você não estaria agora em minha vida!…
meu coração, meu coração, minha querida,
penso naquela doença
que você quase morreu…",fr_XX,pt_XX,"e no entanto, poderíamos nunca ter nos conhecido!
meu amor, imagine
tudo o que o destino teve que permitir
para que estivéssemos aqui, nos amando, e para que fossemos nós?
Tu dizes: ""nascemos um para o outro"". Mas pense
em toda a sorte de chances, eventos,
causas, coincidências,
para que isso se tornasse real, simplesmente, nosso amor!
Pense que antes de unirmos nossas mentes errantes,
vivíamos sozinhos, separados, perdidos,
e que o tempo é longo, e o mundo é grande,
e poderíamos não ter nos encontrado.
Já pensaste, minha bela aventura,
nos perigos que nossa pobre felicidade enfrentou
quando um em direção ao outro, no fundo da natureza infinita,
nossos dois corações misteriosamente gravitavam?
Sabias que essa corrida era tão incerta
que nos conduzia a uma noite,
e que um capricho, uma enxaqueca,
poderiam nos separar para sempre?
Nunca te disse essa coisa incrível:
quando te vi pela primeira vez,
nem notei que eras bonita.
Apenas reparei em ti.
Sua amiga me distraía muito mais, com seu riso.
Foi tarde, muito tarde, que nossos olhares se cruzaram.
Pensa, poderíamos não ter sabido ler neles,
e tu não ter compreendido, e eu não ter ousado.
Onde estaríamos naquela noite se, naquela noite, tua mãe
te tivesse levado um pouco mais cedo?
E se tu não tivesses corado, sob as luzes,
quando quis te ajudar a colocar teu casaco?
Pois lembra-te, essas foram todas as causas.
Um atraso, um impedimento,
e nada teria acontecido desse querido encantamento,
desse êxtase exquisito!
Nosso amor poderia nunca ter acontecido!
Tu poderias hoje não estar na minha vida!...
Meu pequeno coração, meu coração, minha pequena querida,
penso nessa doença
da qual quase morreste...",1
"tu demandes pourquoi je reste sans rien dire ?
c’est que voici le grand moment,
l’heure des yeux et du sourire,
le soir, et que ce soir je t’aime infiniment !
serre-moi contre toi. j’ai besoin de caresses.
si tu savais tout ce qui monte en moi, ce soir,
d’ambition, d’orgueil, de désir, de tendresse, et de bonté !…
mais non, tu ne peux pas savoir !…
baisse un peu l’abat-jour, veux-tu ? nous serons mieux.
c’est dans l’ombre que les coeurs causent,
et l’on voit beaucoup mieux les yeux
quand on voit un peu moins les choses.
ce soir je t’aime trop pour te parler d’amour.
serre-moi contre ta poitrine!
je voudrais que ce soit mon tour d’être celui que l’on câline…
baisse encore un peu l’abat-jour.
là. ne parlons plus. soyons sages.
et ne bougeons pas. c’est si bon
tes mains tièdes sur mon visage!…
mais qu’est-ce encor ? que nous veut-on?
ah! c’est le café qu’on apporte!
eh bien, posez ça là, voyons!
faites vite!… et fermez la porte!
qu’est-ce que je te disais donc?
nous prenons ce café… maintenant? tu préfères?
c’est vrai : toi, tu l’aimes très chaud.
veux-tu que je te serve? attends! laisse-moi faire.
il est fort, aujourd’hui. du sucre? un seul morceau?
c’est assez? veux-tu que je goûte?
là! voici votre tasse, amour…
mais qu’il fait sombre. on n’y voit goutte.
lève donc un peu l’abat-jour.","você pergunta porque eu fico sem falar…
porque este é o grande instante em que
existe o beijo e existe o olhar
porque é noite… e esta noite eu gosto de você!
chegue-se bem a mim. eu preciso de beijos.
ah! se você soubesse o que há, esta noite, em mim
de orgulhos, ambições, ternuras e desejos!…
mas, não, você não sabe, e é bem melhor assim…
abaixe um pouco mais o “abat-jour”! está bem…
é na sombra que o coração fala e repousa:
tanto mais os olhos veem,
quanto menos se veem as coisas …
hoje eu amo demais para falar de amor.
venha aqui bem perto! eu queria
ser hoje, seja como for,
aquele que se acaricia…
abaixe ainda mais o “abat-jour”.
vamos ficar sem dizer nada.
eu quero sentir bem o gosto
das suas mãos sobre o meu rosto!…
mas quem está aí? ah! a criada
que traz o café… não podia deixar aí mesmo? não importa!
pode ir-se embora!… e feche a porta!…
mas o que é mesmo que eu dizia?
quer… agora o café? se você preferir…
já sei: você gosta bem quente.
espere um pouco! eu mesmo é que quero servir.
está tão forte!… assim? mais açúcar? somente?
não quer então que eu prove por
você?… aqui está, minha adorada…
mas que escuro! não se enxerga nada…
levante um pouco esse “abat-jour”.",fr_XX,pt_XX,"Por que fico em silêncio, perguntas?
É porque este é o grande momento,
a hora dos olhos e do sorriso,
a noite, e esta noite te amo infinitamente!
Aperta-me contra ti. Preciso de carícias.
Se soubesses tudo o que se eleva em mim, esta noite,
de ambição, orgulho, desejo, ternura e bondade!...
Mas não, não podes saber!...
Baixa um pouco a persiana, queres? Estaremos melhor.
É na sombra que os corações conversam,
e vemos muito melhor os olhos
quando vemos um pouco menos as coisas.
Esta noite amo-te demais para falar de amor.
Aperta-me contra o teu peito!
Gostaria que fosse a minha vez de ser acariciado...
Baixa um pouco mais a persiana.
Aqui. Não falemos mais. Sejamos sábios.
E não nos mexamos. É tão bom
as tuas mãos mornas no meu rosto!...
Mas o que é isto? O que querem de nós?
Ah! É o café que trazem!
Bem, coloquem-no ali, vejam!
Depressa!... e fechem a porta!
O que estava a dizer então?
Tomamos este café... agora? Preferes?
É verdade: tu gostas muito quente.
Queres que te sirva? Espera! Deixa-me fazer.
Está forte hoje. Açúcar? Um só pedaço?
Basta? Queres que prove?
Aqui está! Aqui está a tua chávena, amor...
Mas que escuro está. Não se vê nada.
Levanta um pouco a persiana.",1
"je fais souvent ce rêve étrange et pénétrant
d’une femme inconnue, et que j’aime, et qui m’aime,
et qui n’est, chaque fois, ni tout à fait la même
ni tout à fait une autre, et m’aime et me comprend.
car elle me comprend, et mon coeur transparent
pour elle seule, hélas! cesse d’être un problème
pour elle seule, et les moiteurs de mon front blême,
elle seule les sait rafraîchir, en pleurant.
est-elle brune, blonde ou rousse? je l’ignore.
son nom? je me souviens qu’il est doux et sonore,
comme ceux des aimés que la vie exila.
son regard est pareil au regard des statues,
et, pour sa voix, lointaine, et calme, et grave, elle a
l’inflexion des voix chères qui se sont tues.","muitas vezes, o sonho estranho me surpreende
de uma ignota mulher que eu amo e que me adora,
e que a mesma não é, certamente, a toda hora,
não sendo outra, porém, e me ama e me compreende.
todo o meu coração deixo que ela o desvende.
ela somente o faz transparente e o avigora,
e se eu sofro, se a dor minha fronte descora,
ela é o consolo ideal que sobre mim se estende.
é ela trigueira, ou loira, ou ruiva? – eu o ignoro.
seu nome? apenas sei que ele é doce e sonoro
como o de quem se amou e da vida fugiu.
seu olhar, como o olhar de uma estátua, é sem alma,
e tem na sua voz, grave, longínqua e calma,
a inflexão de uma voz cara que se extingiu.",fr_XX,pt_XX,"Eu frequentemente tenho este sonho estranho e penetrante
de uma mulher desconhecida, que eu amo, e que me ama,
e que não é, a cada vez, nem completamente a mesma
nem completamente outra, e me ama e me compreende.
pois ela me compreende, e meu coração transparente
para ela sozinha, ai de mim! deixa de ser um problema
para ela sozinha, e as umidades de minha testa pálida,
somente ela sabe refrescar, chorando.
Será ela morena, loira ou ruiva? eu ignoro.
Seu nome? Lembro-me de que é doce e sonoro,
como aqueles dos amados que a vida exilou.
Seu olhar é semelhante ao olhar das estátuas,
e, para sua voz, distante, e calma, e grave, ela tem
a inflexão das vozes queridas que se calaram.",1
