original_poem,translated_poem,src_lang,tgt_lang,translated_by_TA,topic
"prélude …
donnons nous l’envie,
l’ envie de nous découvrir,
de nous désirer, de nous donner enfin.
ouvrons nous le cœur avant de commencer.
soyons l’envie de l’autre, dans l’écoute et dans les mots.
quoi de plus beau, de plus excitant, q‘un baiser accompagné d’une âme bien aimée ?
quoi de plus vibrant, de plus désiré, q’un câlin sorti de la fusion de nos âmes entrelacées ?
puis, sans crainte, sans aucune réticence, nos cœurs couronnés, nous âmes avides, nos corps suivent en symbiose … l’union parfaite, un seul corps, donnant ainsi à tout jamais, l’envie de suivre à deux, dans une alliance harmonieuse, pour une vie pleine d’amour.
cela serait un rêve, d’une maturité remplie d’ardeur…
heureux celui qu’arrive la garder auprès de soi, pour satisfaire tous ses désirs :
des mots et de l’écoute,
des regards et de la présence,
des baisers et encore des baisers,
et des sourires et des larmes.
l’important c’est d’être ensemble, ne se quitter, que pour mourir… et peut-être, qu’au-delà, se retrouver, si dieu le veut …","preludio …
demo-nos o desejo,
o desejo de nos descobrir, de nos desejar,
de nos dar-mos enfim.
abramo-nos o coração antes de começar.
sejamos o desejo do outro na escuta e nas palavras.
que existe de mais belo, de mais excitante,
que um beijo acompanhado de uma alma querida?
que existe de mais vibrante, de mais desejado,
que um carinho saido da fusão, de nossas almas entrelaçadas ?
depois sem mêdo, sem nenhuma reticencia, nossos corações coroados, nossas almas avidas,
nossos corpos seguem, em simbiose … a união perfeita, un so corpo, dando assim, para sempre, o desejo de seguir a dois numa aliança harmoniosa,
para uma vida cheia de amor.
isto seria um sonho, de uma maturidade repleta de ardor …
feliz aquele que consegue guarda-la junto a si para satisfazer todos seus desejos :
de palavras, de escuta,
de olhares e de presença,
de beijos e mais beijos,
e de sorrisos e de lágrimas.
o importante é estar juntos, se separar, so para morrer …
e talvez que, no além, se reencontrar, si deus quiser…",fr_XX,pt_XX,"prelúdio...
deixemo-nos levar,
levar-nos a descobrir,
a desejar-nos, a finalmente nos dar.
abramos o coração antes de começar.
sejamos a vontade um do outro, na escuta e nas palavras.
o que há de mais belo, de mais excitante, do que um beijo acompanhado de uma alma amada?
o que há de mais vibrante, de mais desejado, do que um abraço surgido da fusão de nossas almas entrelaçadas?
então, sem medo, sem qualquer reticência, nossos corações coroados, nossas almas ávidas, nossos corpos seguem em simbiose... a união perfeita, um só corpo, dando assim para sempre, a vontade de seguir a dois, em uma aliança harmoniosa, para uma vida cheia de amor.
isso seria um sonho, de uma maturidade repleta de ardor...
feliz aquele que consegue mantê-lo consigo, para satisfazer todos os seus desejos:
de palavras e escuta,
de olhares e presença,
de beijos e mais beijos,
e de sorrisos e lágrimas.
o importante é estar juntos, não se separar, senão para morrer... e talvez, além disso, reencontrar-se, se Deus assim o quiser...",1
"passion, amour, sexe …
homme, que faites-vous?
vos paroles viriles, fébriles, attisées,
poussant les portes d’un rêve oublié,
dans l’âme d’une femme douée,
que le monde semble agripper…
homme, que voulez-vous ?
sentir votre verge danser dans ses entrailles,
voir son corps frémissant et attisé,
jusqu’à ce que votre désir igné,
hurle sa chanson charnelle ?
et voir s’envoler de nouveau,
la passion pour un désir fougueux,
qui part vous laissant le vide,
jusqu’à ce qu’une autre flamme la suscite de nouveau ?
ou voulez-vous, homme…
la serrer contre votre cœur,
l’aimer et sentir bonheur,
chaque soir, chaque matin,
et encore saluer dieu
pour chaque jour de vie en vous !?","paixão, amor, sexo ..
homem, que estas fazendo ?
tuas palavras viris, febris, instigadas, forçando as portas de um sonho esquecido,
na alma de uma mulher dotada,
que o mundo parece agarrar…
homem, que estas querendo ?
sentir tua haste dançar em seu ventre,
ver seu corpo tremer de excitação,
até que teu desejo ígneo,
brade sua canção ?
e ver partir de novo,
a paixão por um desejo fogoso,
que parte te deixando o vazio,
até que outra chama, a desperte de novo ?
ou queres, homem…
aperta-la contra seu coração,
amá-la e sentir felicidade,
toda manhã, toda noite
e ainda saudar deus
por cada dia de vida em vós ?!!!",fr_XX,pt_XX,"paixão, amor, sexo…
homem, o que você faz?
suas palavras viris, febris, incendiadas,
empurrando as portas de um sonho esquecido,
na alma de uma mulher talentosa,
que o mundo parece agarrar…
homem, o que você deseja?
sentir seu falo dançar em suas entranhas,
ver seu corpo tremendo e incendiado,
até que seu desejo ígneo,
grite sua canção carnal?
e ver voar de novo,
a paixão por um desejo ardente,
que parte deixando-o vazio,
até que outra chama o reacenda?
ou você deseja, homem…
abraçá-la contra seu coração,
amá-la e sentir felicidade,
cada noite, cada manhã,
e ainda saudar Deus
por cada dia de vida em você!?",1
"cœur déchiré
pourquoi l’avoir dérobé, si tu ne désirais pas le garder ?
et ainsi avec tant d’ardeur, à leurer même le cupidon ?
oh voleur ! tôt ou tard je te le reprendrai,
et aussi brutalement comme tu me l’as fait à moi.
en arrivant comme un angelot,
en partant comme un voleur,
et comme si le monde,
ne tournait qu’autour de toi.
ce jour arrivera et toi,
ne te moqueras plus de moi, de ma naïveté.
et tu éprouveras comme moi aujourd’hui,
l’abandon, la déchirure, un mal être bien défini.
et l’amour, de retour dans mon ego,
je le détiendrai si calme, si serein,
dans mon être plein de vie,
pour un autre bien choisi.","coração rasgado
porque tê-lo roubado, se não desejava guarda-lo ?
e com tanto ardor, enganando até o cupido ?
oh ladro ! cedo ou tarde eu o pegarei de volta,
assim tão brutalmente como o fez comigo.
chegando como um anjinho,
partindo como um ladrão,
et como se o mundo,
so girasse ao seu redor.
este dia chegará e voce,
nao rirá mais de mim, de minha inocencia.
e provará como eu atualmente,
o abandono, o rasgão, um mal estar bem definido.
e o amor, de volta ao meu ego,
eu o guardarei tão calmo, tão sereno
no meu ser cheio de vida,
para um outro bem escolhido.",fr_XX,pt_XX,"coração partido
por que o roubaste, se não querias mantê-lo?
e assim, com tanta paixão, enganando até Cupido?
oh ladrão! cedo ou tarde vou retomá-lo,
e tão brutalmente como fizeste comigo.
chegando como um anjinho,
partindo como um ladrão,
e como se o mundo
girasse apenas em torno de ti.
esse dia chegará e tu,
não mais zombarás de mim, da minha ingenuidade.
e sentirás como eu hoje,
o abandono, a dilaceração, um mal-estar bem definido.
e o amor, de volta ao meu ego,
eu o segurarei tão calmo, tão sereno,
em meu ser cheio de vida,
para outro escolhido com sabedoria.",1
"moment de nostalgie.
oh sentiment profond,
qui pénètre la poitrine et insiste à y rester.
cette chose poignante qui révèle le vide,
paralyse le regard le remplissant de tristesse.
oh, sentiment qui creuse,
qui jette dans le vide,
tout être aimable sans aucune pitié.
obligée je suis de te laisser la place,
si tu insistes à m’y habiter.
voilà, une lueur s’impose !
me dévoile, me secoue, t’arrachant de moi.
je partais fragile, naïve et inerte,
contente je suis de m’être séparée de toi.","momento de nostalgia
oh sentimento profond,
que penetra no peito
e insiste em ali ficar,
esta coisa pungente que revela o vazio,
paralisa o olhar lhe enchendo de tristesa.
oh, sentimento que perfura, que joga no vazio todo ser amável,
sem nenhuma piedade.
obrigada eu sou de me deixar partir,
se tu persistes em dentro morar …
eis que uma luz se impõe,
me desvela, me sacode,
te arrancando de mim.
eu partia frágil, inocente e inerte,
contente estou de ter me separado de ti.",fr_XX,pt_XX,"momento de nostalgia.
oh, sentimento profundo,
que penetra o peito e insiste em permanecer.
essa coisa tocante que revela o vazio,
paralisa o olhar, enchendo-o de tristeza.
oh, sentimento que escava,
que joga no vazio,
todo ser amável sem piedade alguma.
sou obrigada a te dar espaço,
se insistes em habitar em mim.
aqui está, uma luz se impõe!
me revela, me sacode, te arrancando de mim.
partia frágil, ingênua e inerte,
feliz estou por ter me separado de ti.",1
"il paraît que j’ai un beau sourire,
que mes yeux pétillent,
que mon regard fascine,
il est vrai que j’aime la vie.
il paraît que mes mots sont forts,
que suis douce et tendre,
que j’inspire le bonheur,
il est vrai que les envies me supportent.
si mon sourire est beau,
si mes yeux pétillent,
si mon regard fascine,
je ne vois que votre âme.
si mes mots sont forts,
si je suis douce et tendre,
si j’inspire le bonheur,
je ne vois que votre cœur.
où est le mal, je ne le vois pas,
si je ne vois que le bien !
ou est la critique, je ne le fais pas,
si je ne sais pas juger !
je me laisse bercer,
je suis le rythme.
je me laisse guider,
j’ai confiance en vous.
je glisse …
dans l’intelligence du cœur,
dans la beauté de l’âme,
dans la façon élégante,
dont les choses sont faites.
et …
puisse moi ne pas me tromper,
puissent les anges m’accompagner.","parece que tenho um belo sorriso,
que meus olhos faíscam,
que meu olhar facina,
é verdade que eu amo a vida.
parece que minhas palavras são fortes,
que sou serena e carinhosa,
que inspiro a felicidade,
é verdade que os desejos me suportam.
se meu sorriso é bonito,
se meus olhos faíscam,
se meu olhar facina,
é que so vejo sua alma.
se minhas palavras são fortes,
se sou serena e carinhosa,
se inspiro a felicidade,
é que so vejo seu coração.
onde esta o mal, eu não o vejo,
se eu so vejo o bem !
onde esta a crítica, eu não a faço,
se eu não sei julgar !
eu me deixo balançar,
eu sigo o ritmo,
eu me deixo guiar,
tenho confiança em voce.
eu desliso …
na inteligência do coração,
na beleza da alma,
na maneira elegante,
com a qual as coisas são feitas.
e …
possa eu não me enganar.
possam os anjos me acompanhar.",fr_XX,pt_XX,"Parece que tenho um lindo sorriso,
que meus olhos brilham,
que meu olhar fascina,
é verdade que eu amo a vida.
Parece que minhas palavras são fortes,
que sou doce e terna,
que inspiro felicidade,
é verdade que os desejos me apoiam.
Se meu sorriso é bonito,
se meus olhos brilham,
se meu olhar fascina,
só vejo sua alma.
Se minhas palavras são fortes,
se sou doce e terna,
se inspiro felicidade,
só vejo seu coração.
Onde está o mal, eu não vejo,
se vejo só o bem!
Onde está a crítica, eu não faço,
se não sei julgar!
Deixo-me embalar,
sigo o ritmo.
Deixo-me guiar,
confio em você.
Deslizo...
na inteligência do coração,
na beleza da alma,
na maneira elegante,
como as coisas são feitas.
E...
que eu não me engane,
que os anjos me acompanhem.",1
"mariage harmonieux
je te vois, face à moi,
robuste, éminente, svelte, imposante,
de jour comme de nuit.
tu imposes, t’attires tous les regards,
d’ici et d’ailleurs.
et tu les troubles …
tu les émeus, tu les émerveilles.
moi, stupéfiée par ta grandeur,
je te vois majestueuse, monumentale,
impressionnante, élégante et … modeste.
bientôt 25 ans …
avec toi je suis.
et aujourd’hui spécialement,
une pensée pour le christ …
mon âme se rend compte,
la moitié de ma vie …
une moitié avec le christ,
une moitié avec toi.
le christ … comme toi,
svelte et imposant, majestueux là haut,
ainsi ce qu’il voit et ce qu’il essaye d’embrasser.
un témoin et complice,
de mes années passées là bas.
et toi …
un témoin et complice,
de mes années vécues ici.
a te regarder, encore et encore,
a te ressentir encore et encore,
a nouveau le sentiment,
que de toi, je ne peux pas m’en séparer.
je suis soumise,
depuis déjà très longtemps,
de ta façon élégante et discrète,
de ton regard mature et intelligent,
et de ta bonté et beauté remarquables.
je me décide alors … et je demande,
qu’on se les marie les deux :
le christ du corcovado et la tour eifel,
vu qu’en fusion vous êtes depuis très longtemps…
depuis que le christ du corcovado,
m’ait appris la marseillaise … j’avais 10 ans.","casamento harmonioso
eu te vejo, face à mim,
robusta, eminente, esbelta, imposante,
tanto de dia como de noite.
voce impõe, voce atrai todos os olhares,
dos daqui e dos de fora.
e voce os perturba …
voce os comove, voce os deixa maravilhados.
eu, estupefata pela sua grandeza,
eu te vejo majestosa, monumental,
impressionante, elegante e … modesta.
brevemente 25 anos …
com voce, eu estou.
e hoje especialmente,
um pensamento para o cristo …
minha alma percebe,
a metade de minha vida …
uma metade com o o cristo,
uma metade com voce.
o cristo … como voce,
esbelto e imponente, majestosa lá em cima,
também o que ele vê e o que ele tenta abraçar.
um testemunho e cúmplice,
de meus anos passados lá.
e você …
um testemunho e cúmplice,
de meus anos vividos aqui.
a lhe olhar, mais e mais,
a lhe ressentir mais e mais,
de novo o sentimento,
que de você, não posso me separar.
sou submissa,
ja ha muito tempo,
de sua maneira elegante e discreta,
de seu olhar maturo e inteligente,
e de sua bondade e beleza notáveis.
eu me decido então … e eu peço,
que se lhes casem os dois :
o cristo do corcovado e a torre eifel,
visto que em fusão voces estão ja ha muito, tempo …
desde quando o cristo do corcovado,
me ensinara la marseillaise … eu tinha 10 anos.",fr_XX,pt_XX,"casamento harmonioso
te vejo, diante de mim,
robusta, eminente, esguia, imponente,
de dia e de noite.
tu impões, atrais todos os olhares,
daqui e de longe.
e os perturbas...
os emocionas, os maravilhas.
eu, atônita diante de tua grandeza,
te vejo majestosa, monumental,
impressionante, elegante e... modesta.
quase 25 anos...
contigo estou.
e hoje especialmente,
um pensamento para o cristo...
minha alma percebe,
a metade da minha vida...
uma metade com o cristo,
uma metade contigo.
o cristo... como tu,
esguio e imponente, majestoso lá em cima,
assim o que ele vê e tenta abraçar.
uma testemunha e cúmplice,
dos meus anos passados lá embaixo.
e tu...
uma testemunha e cúmplice,
dos meus anos vividos aqui.
a te olhar, de novo e de novo,
a te sentir de novo e de novo,
de novo o sentimento,
que contigo, não posso me separar.
estou submetida,
há muito tempo já,
à tua forma elegante e discreta,
ao teu olhar maduro e inteligente,
e à tua bondade e beleza notáveis.
então decido... e peço,
que os dois se casem:
o cristo redentor e a torre eiffel,
visto que em fusão vocês estão há muito tempo...
desde que o cristo redentor,
me ensinou o hino nacional... eu tinha 10 anos.",1
"ma petite brune
une lumière dans mon cœur,
a installé le bonheur,
quand la porte s’est ouverte
et ton visage j’ai vu.
et mes yeux dans les tiens,
ne demandaient que toi.
toi ma petite brune,
qui j’ai aimé dés les premiers instants.
t’es restée en moi,
toi ma petite brune,
t’es la plus belle,
t’es le plus beau cadeau qu’est arrivé dans ma vie.","minha moreninha
uma luz no coração,
instalou a felicidade,
quando a porta se abriu
e sua face eu vi.
e meus olhos nos seus,
so pediam voce.
voce minha moreninha,
que eu amei desde o primeiro instante.
voce ficou em mim,
voce minha moreninha,
voce é a mais bela,
voce é o presente,
o mais bonito que aconteceu na minha vida.",fr_XX,pt_XX,"minha pequena morena
uma luz no meu coração,
instalou a felicidade,
quando a porta se abriu
e vi seu rosto.
e meus olhos nos seus,
só pediam por você.
você, minha pequena morena,
que amei desde os primeiros instantes.
você permaneceu em mim,
você, minha pequena morena,
é a mais linda,
é o presente mais bonito que chegou em minha vida.",1
"les femmes et les hommespourquoi sur le chemin,
les hommes et les femmes y passent,
se entrelacent et tentent de construire un jardin,
et finissent pour y planter des souffrances ?
les femmes et les hommes en souffrent. ils se blessent, pleurent, subissent. ils sont tendus, malheureux, sombres. puis un jour déchirés ils se quittent.
les femmes et les hommes espèrent,
tous les jours le bonheur.
souvent l’attente est pérenne
et la solitude envahie leur cœur.
leurs émotions souvent meurtris
ils se replient dans un monde vide,
bordant une vie fade et triste,
ils se demandent si le bonheur exiiste.
mieux vaut vivre dans la certitude,
qu’un grand homme,
qu’une grande femme,
les attendent dans l’esprit de dieu.","as mulheres e os homensporque no caminho,
mulheres e homens ali passam,
se entrelaçam et tentam construir um jardim,
et acabam por plantar sofrimentos ?
as mulheres e os homens sofrem. eles se machucam, se aturam, choram. eles são tensos, infelizes, tristes, e um dia, dilacerados, eles se separam.
as mulheres e os homens esperam, todos os dias, a felicidade. muitas vezes a espera é eterna, e uma imensa solidão os invade.
suas emoções quase sempre feridas,
eles se fecham num mundo vazio,
tocando uma vida triste e sombria,
eles se perguntam se a felicidade existe.
melhor viver na certeza
que um grande homem,
que uma grande mulher,
lhes esperam no seio de deus.",fr_XX,pt_XX,"As mulheres e os homens
Por que no caminho,
os homens e as mulheres passam,
se entrelaçam e tentam construir um jardim,
e acabam plantando sofrimentos?
As mulheres e os homens sofrem. Eles se machucam, choram, sofrem. Eles estão tensos, infelizes, sombrios. E então, um dia, rasgados, se separam.
As mulheres e os homens esperam,
todos os dias, a felicidade.
Muitas vezes a espera é eterna
e a solidão invade seus corações.
Suas emoções muitas vezes machucadas
os fazem se retrair em um mundo vazio,
beirando uma vida sem graça e triste,
eles se perguntam se a felicidade existe.
É melhor viver na certeza,
de que um grande homem,
de que uma grande mulher,
os aguardam no espírito de Deus.",1
"t’es vraiment amoureux ?
alors, t’es pris par un sentiment féroce …
comme un aimant,
il t’attire, inlassablement, vers ton bien aimé.
il envahit ton être, tu deviens radieux et envoûté.
il t’emmène dans un tourbillon de désirs.
désirs de l’autre, de le toucher,
du contact de son corps contre le tien,
et quel plaisir de sentir sa respiration …
l’importance de sa présence,
c’est la fleur assoiffée qui boit,
c’est l’enfant perdu qui retrouve sa mère,
c’est le poisson que tu remets dans l’eau,
c’est l’oiseau dans son premier envol,
c’est ton premier regard devant l’océan,
et le sans-abri, à qui tu donnes une maison …
que c’est bon de l’avoir à tes côtés …
de pouvoir poser tes regards en admiration sur les siens,
de pouvoir le caresser pour exprimer ta tendresse,
de lui sourire et d’en recevoir à ton tour,
de pouvoir lui parler et entendre sa voix,
et de l’embrasser et lui dire : je t’aime…","estás realmente apaixonado ?
então, estás tomado por un sentimento feroz …
como um imã,
ele te atrai, incançavelmente, para teu bem amado.
ele invade teu ser, tu te tornas radioso e cativo.
ele te leva num turbilhão de desejos.
desejos do outro, de tocá-lo,
do contato de seu corpo contra o teu,
e que prazer de sentir sua respiração …
a importancia de sua presença …
é a flor sediada que bebe,
é a criança perdida que reencontra sua mãe,
é o peixe que tu recolocas na água,
é o pássaro no seu primeiro vôo,
é teu primeiro olhar diante do oceano,
e é o sem- abrigo, à quem tu daste uma casa …
como é bom tê-lo ao teu lado …
de poder cruzar olhares de admiração,
de poder acariciá-lo para exprimir teu afeto,
de lhe sorrir et de receber o seu,
de poder lhe falar e escutar sua voz,
e de lhe abraçar et lhe dizer : eu te amo.",fr_XX,pt_XX,"Estás realmente apaixonado?
Então, estás dominado por um sentimento feroz...
como um ímã,
ele te atrai, incansavelmente, para o teu amado.
Ele invade o teu ser, tornando-te radiante e encantado.
Ele te leva a um turbilhão de desejos.
Desejos pelo outro, de tocar nele,
do contato do seu corpo contra o teu,
e que prazer sentir a sua respiração...
A importância da sua presença,
é a flor sedenta que bebe,
é a criança perdida que reencontra a mãe,
é o peixe que devolves à água,
é o pássaro no seu primeiro voo,
é o teu primeiro olhar diante do oceano,
e o sem-abrigo a quem dás uma casa...
Que bom tê-lo ao teu lado...
poder admirar os seus olhos com admiração,
poder acariciá-lo para expressar a tua ternura,
sorrir para ele e receber um sorriso em troca,
poder falar com ele e ouvir a sua voz,
e beijá-lo e dizer-lhe: eu te amo...",1
"t’as perdu ton amour ?
alors, t’es pris par un sentiment féroce …
c’est comme un boa qui t’avale en entier,
et tu perds tous tes moyens.
perdre son amour c’est …
se sentir complètement seul.
c’est la fleur privée de l’eau,
c’est l’enfant qu’a perdu sa mère,
c’est le poisson que tu retires de l’eau,
c’est l’oiseau que tu empêches de s’en voler,
c’est ton regard aveuglé devant l’océan,
et le sans-abri qui ne trouve pas où s’abriter…
perdre son amour c’est …
c’est une atroce souffrance perdue dans la solitude,
c’est le désespoir de ne plus pouvoir le toucher,
de ne plus pouvoir le voir.
c’est la douleur, la révolte qui crie : « pourquoi ? »
c’est l’esprit constamment tourné vers lui,
c’est croiser les gens et ne voir personne,
c’est entrer dans un tunnel silencieux,
et ce sont des larmes dans tes yeux sans lumière…","perdeste teu amor ?
então, estas tomado por um sentimento feroz …
é como uma jibóia que te engole inteirinho,
et tu perdes todos teus poderes.
perder seu amor é …
se sentir completamente sozinho.
é a flor com falta de água,
é a criança que perdera sua mãe,
é o peixe que tu retiras da água,
é o pássaro que tu impedes de voar,
é o teu olhar cego face ao oceano,
e é o sem-abrigo que não achou onde se abrigar …
perder seu amor é …
um sofrer feroz perdido na solidão,
é o desespero de não mais poder lhe tocar,
não mais poder lhe ver.
é a dor, a revolta que grita : « porque? «
é o espírito constantemente voltado para ele,
é cruzar gente e não ver ninguem,
é entrar num túnel silencioso,
e são lágrimas nos teus olhos sem luz …",fr_XX,pt_XX,"Perdeste o teu amor?
Então, estás preso por um sentimento feroz...
É como uma serpente que te engole por inteiro,
e perdes todas as tuas forças.
Perder o teu amor é...
sentir-se completamente sozinho.
É a flor privada de água,
é a criança que perdeu a mãe,
é o peixe que tiras da água,
é o pássaro que impedes de voar,
é o teu olhar cego diante do oceano,
e o sem-teto que não encontra onde se abrigar...
Perder o teu amor é...
uma atroz dor perdida na solidão,
é o desespero de não poder mais tocá-lo,
de não poder mais vê-lo.
É a dor, a revolta que grita: ""porquê?""
é a mente constantemente voltada para ele,
é cruzar as pessoas e não ver ninguém,
é entrar num túnel silencioso,
e são lágrimas nos teus olhos sem luz...",1
"je te voulais auprès de moi …
mais je ne savais pas où te trouver,
je voulais t’appeler,
mais je ne savais pas en quelle direction,
je voulais de ton amour,
mais je ne savais pas qu’il existait.
combien de fois dans mes rêves,
je t’ai emmené auprès de moi …
je rêvais de toi, sans t’avoir jamais vu.
je rêvais de ton êtr sans t’avoir jamais rencontré.
je t’ emmenais déjà auprès de moi …
je sentais ta chaleur sans que je sache que c’était la tienne.
je sentais ta vibration sans que je sache que c’était toi.
je sentais tes baisers sans que je sache que c’étaient tes lèvres.
aujourd’hui, t’es rentré dans mon âme,
comme une brise câline et ardente,
m’apportant paix et sérénité.
je te respire, je te sens, je te vis profondément.
reste auprès de moi …","eu ja te queria perto de mim …
mas não sabia onde te encontrar,
eu queria te chamar,
mas não sabia em qual direção,
eu queria do teu amor,
mas não sabia que ele existia.
quantas vezes nos meus sonhos,
eu te levei junto a mim …
eu sonhava contigo, sem nunca ter te visto.
eu sonhava com teu ser, sem nunca ter te encontrado.
eu ja te levava junto a mim …
eu sentia teu calor, sem que eu soubesse que era o teu.
eu sentia tua vibração, sem que eu soubesse que eras tu.
eu sentia teus beijos, sem que eu soubesse que eram teus lábios.
hoje, tu entraste na minha alma,
como uma brisa meiga e cálida,
me trazendo paz e serenidade.
eu te respiro, te sinto, te vivo profundamente.
ficas comigo …",fr_XX,pt_XX,"Eu queria você ao meu lado…
mas não sabia onde te encontrar,
eu queria te chamar,
mas não sabia em que direção,
eu queria o seu amor,
mas não sabia que ele existia.
Quantas vezes nos meus sonhos,
te levei ao meu lado…
eu sonhava com você, sem nunca ter te visto.
eu sonhava com o seu ser, sem nunca ter te conhecido.
eu já te levava ao meu lado…
sentia o seu calor sem saber que era o seu.
sentia a sua vibração sem saber que era você.
sentia os seus beijos sem saber que eram seus lábios.
hoje, você entrou na minha alma,
como uma brisa carinhosa e ardente,
me trazendo paz e serenidade.
eu te respiro, te sinto, te vivo profundamente.
fica ao meu lado…",1
