original_poem,translated_poem,src_lang,tgt_lang,translated_by_TA,topic
"vie de femme …
les sentiments passent en premier.
ils sont absorbés et préservés.
si banalisés … exterminés.
si entretenus … sauvegardés.
si sauvegardés, elle est séduite.
si exterminés, l’autre est vite oublié.
et le poisson prend le large …
pour nager dans d’autres rives,
a l’encontre d’une âme pure,
telle que la sienne.
la solitude corrompt l’âme.
le téméraire loyal qui passe par là,
chanceux ou don juan,
c’est qu’il est arrivé …
sur le bon endroit au bon moment.","vida de mulher …
os sentimentos passam em primeiro.
eles são absorvidos e preservados.
si banalizados … exterminados.
si alimentados… salvados.
si salvados, ela é seduzida.
si exterminados, o outro é rápido esquecido.
e o peixe cai em alto mar …
para nadar em outras margens,
ao encontro de uma alma pura,
tal como a sua.
a solidão corrompe a alma.
o temerário leal que ali passa,
felizardo ou don juan,
é que ele chegou …
no bom lugar no momento certo.",fr_XX,pt_XX,"vida de mulher...
os sentimentos vêm em primeiro lugar.
eles são absorvidos e preservados.
se banalizados... exterminados.
se cultivados... preservados.
se preservados, ela é seduzida.
se exterminados, o outro é rapidamente esquecido.
e o peixe parte para longe...
para nadar em outras margens,
indo contra uma alma pura,
como a sua.
a solidão corrompe a alma.
o audacioso leal que passa por ali,
sortudo ou don juan,
é porque ele chegou...
no lugar certo, na hora certa.",1
"vie de femme …
les sentiments passent en premier.
ils sont absorbés et préservés.
si banalisés … exterminés.
si entretenus … sauvegardés.
si sauvegardés, elle est séduite.
si exterminés, l’autre est vite oublié.
et le poisson prend le large …
pour nager dans d’autres rives,
a l’encontre d’une âme pure,
telle que la sienne.
la solitude corrompt l’âme.
le téméraire loyal qui passe par là,
chanceux ou don juan,
c’est qu’il est arrivé …
sur le bon endroit au bon moment.","vida de mulher …
os sentimentos passam em primeiro.
eles são absorvidos e preservados.
si banalizados … exterminados.
si alimentados… salvados.
si salvados, ela é seduzida.
si exterminados, o outro é rápido esquecido.
e o peixe cai em alto mar …
para nadar em outras margens,
ao encontro de uma alma pura,
tal como a sua.
a solidão corrompe a alma.
o temerário leal que ali passa,
felizardo ou don juan,
é que ele chegou …
no bom lugar no momento certo.",fr_XX,pt_XX,"vida de mulher…
os sentimentos vêm em primeiro lugar.
eles são absorvidos e preservados.
se banalizados… exterminados.
se nutridos… salvaguardados.
se salvaguardados, ela é seduzida.
se exterminados, o outro é rapidamente esquecido.
e o peixe se afasta…
para nadar em outras margens,
em direção a uma alma pura,
como a sua.
a solidão corrompe a alma.
o corajoso leal que passa por ali,
sortudo ou don juan,
é porque ele chegou…
no lugar certo, na hora certa.",1
"un soir d’été …
je t’ai vu un soir d’été,
t’étais là, élégant et svelte,
j’ai vu le ciel, j’ai vu tes mirettes,
tout en bleu j’ai vu le tableau.
je t’ai vu, je me suis stoppée,
pour t’observer en peu.
une sensation j’ai éprouvée,
une anxiété avec ardeur.
j’ai eu peur parce que mon corps,
jusqu’alors soumis à moi,
s’abandonnerait au tien aussi en cœur,
si tu le désirais ainsi comme moi.
le soleil brulait en nous,
en tête à tête nous étions,
sur ton visage j’ai vu la bonté,
et dans ton âme j’ai vu la beauté.
les moments que nous avons passé,
avec calme et spontanéité,
sans effort et en toute simplicité,
toi et moi nous avons aimé …
dans un silence plein de tendresse,
nos âmes nues et entrelacées,
hébergée dans tes bras j’entendais ton cœur,
le mien complice a accéléré sa marche.
avec volupté et sensualité, entre caresses et baisers,
nos entrailles ont proclamé le plaisir frémissant…
dehors la pluie tombait, comme si pour arroser,
la beauté de ces moments.","uma tarde de verão …
eu lhe vi numa tarde de verão,
voce estava ali, elegante e esbelto,
eu vi o céu, eu vi seus olhos,
todo azul eu vi o quadro.
eu lhe vi, eu parei,
para lhe observar un pouco.
uma sensação eu senti,
uma ansiedade com ardor.
eu tive medo porque meu corpo,
até então submisso à mim,
se abandonaria ao seu, tambem em coração,
se voce o desejasse assim como eu.
eu senti o sol que queimava em nós,
e frente à frente nós estávamos,
no seu rosto eu vi a bondade,
e a beleza da sua alma.
os momentos que juntos passamos,
com calma e espontâneidade,
com carinho e com simplicidade,
voce e eu, nós amamos …
num silencio cheio de emoção,
nossas almas nuas e entrelaçadas,
acolhida nos seus braços seu coração eu escutava ,
o meu cúmplice acelerou sua cançao.
entre carinhos e beijos,com sensualidade e volúpcia,
nossas entranhas proclamaram o prazer frêmito …
la fora a chuva caía, como se para arrozar,
a beleza destes momentos.",fr_XX,pt_XX,"Numa noite de verão...
te vi numa noite de verão,
estavas lá, elegante e esbelto,
vi o céu, vi teus olhos brilhantes,
todo em azul vi o quadro.
te vi, parei para te observar,
uma sensação eu senti,
uma ansiedade com ardor.
tive medo porque meu corpo,
até então submisso a mim,
se entregaria ao teu também em coração,
se assim desejasses como eu.
o sol queimava em nós,
cara a cara estávamos,
em teu rosto vi a bondade,
e em tua alma vi a beleza.
os momentos que passamos,
com calma e espontaneidade,
sem esforço e com simplicidade,
tu e eu nos amamos...
num silêncio cheio de ternura,
nossas almas nuas e entrelaçadas,
abrigo em teus braços, ouvia teu coração,
o meu cúmplice acelerava seu ritmo.
com volúpia e sensualidade, entre carícias e beijos,
nossas entranhas proclamavam o prazer arrebatador...
 lá fora a chuva caía, como se para regar,
a beleza desses momentos.",1
"que veux-tu quand tu seras grand ?
trouver l’amour …
que veux tu faire avec l’amour ?
le chérir …
que veux tu comme amour ?
le vrai …
quel nom lui donnerais-tu ?
sincérité …
comment le souhaites-tu ?
constant …
que demanderais-tu à cet amour ?
fidélité …
combien de temps le garderais-tu ?
pour toujours …
où l’emmènerais tu ?
dans mon coeur …
que serais-tu pour lui ?
l’amour …
il en est déjà un !?
non ! il est la moitié d’un amour","que queres quando serás grande ?
encontrar o amor …
que queres fazer com o amor ?
amá-lo …
que queres como amor ?
o verdadeiro …
qual nome o darias tu ?
sinceridade …
como o desejas tu ?
constante …
que pedirias tu a este amor ?
fidelidade …
quanto tempo o guardarias tu ?
para sempre …
onde o levarias tu ?
no meu coração …
que serias tu para ele ?
o amor …
ele ja é um !?
nao ! ele é a metade de um amor …",fr_XX,pt_XX,"O que queres quando fores grande?
Encontrar o amor…
O que queres fazer com o amor?
Cuidar dele…
Que tipo de amor desejas?
O verdadeiro…
Que nome lhe darias?
Sinceridade…
Como o desejas?
Constante…
O que pedirias a esse amor?
Fidelidade…
Por quanto tempo o guardarias?
Para sempre…
Onde o levarias?
No meu coração…
O que serias para ele?
O amor…
Já há um amor?
Não! Ele é metade de um amor.",1
"toi, yeux verts, visage brun
si un jour ton visage m’a perturbé à jamais,
et si pendant mon parcours ton regard m’a suivi,
il ne m’est resté que nostalgie dans les allées de ma vie …
si les rides
ont changé ton visage,
et si même de moi
tu ne te souviens plus,
j’aurai toujours mon être
pour me perdre
dans ton regard…
si un jour la vie
me permet de rêver,
et si dans mon rêve toi,
tu m’apparaît pour moi,
j’aurai mon âme, pour t’embrasser !
si sur terre je n’ai plus l’espoir,
de sentir de nouveau cet envoûtement,
malheureuse, je suis morte dans le monde pour ne plus y espérer…
mais toi, yeux verts, visage brun,
pourvu que tu sois heureux, avec une belle et gentille fleur,
entouré d’un beau jardin, sous l’amour de dieu …","voce, olhos verdes, rosto moreno
se um dia seu rosto me pertubou para sempre,
e se durante meu percurso seu olhar me seguiu,
so me restou nostalgia nas alas da minha vida…
se as rugas mudaram seu rosto,
e se até mesmo de mim voce não mais se lembrar,
terei sempre meu sêr para me perder nos seus olhos…
se um dia a vida me permitir de sonhar,
e se no meu sonho seu rosto me aparecer,
eu terei minha alma para enfim lhe abraçar !
se na terra, eu não tenho mais esperança,
de sentir de novo este encantamento,
infeliz, estou morta no mundo para não mais esperar…
mas voce, olhos verdes, rosto moreno,
oxala esteja feliz, com uma bela e gentil flôr,
meio a um belo jardim, sob o amor de deus.",fr_XX,pt_XX,"tu, olhos verdes, rosto moreno
se um dia teu rosto me perturbou para sempre,
e se durante minha jornada teu olhar me seguiu,
restou-me apenas nostalgia nos caminhos da minha vida…
se as rugas
mudaram teu rosto,
e se até de mim
não te lembras mais,
sempre terei meu ser
para me perder
em teu olhar…
se um dia a vida
me permitir sonhar,
e se em meu sonho tu,
apareceres para mim,
tive minha alma, para te abraçar!
se na terra não tenho mais esperança,
de sentir novamente esse encantamento,
infeliz, morri no mundo para não mais esperar…
mas tu, olhos verdes, rosto moreno,
que sejas feliz, com uma bela e gentil flor,
cercado por um belo jardim, sob o amor de Deus…",1
"tais-toi
je t’aime … mon amour, ma chérie.
tais-toi, ne répètes plus jamais ça,
tais-toi, tu ne sais pas ce que tu dis.
les mots qui caressent,
viennent en fusion avec dieu.
je ne veux pas de tes mots,
qu’ arrivent avec tes ténèbres,
de ton esprit sans paix,
qui débat contre ton corps.
les mots sortis de ta bouche,
ne guérissent pas ta blessure,
te rendent encore plus jaloux,
de ceux qu’ont connu l’amour.
je t’aime … mon amour, ma chérie.
tais-toi, tu ne sais pas ce qu’est l’amour,
tais-toi, tu ne sais pas ce que tu fais.
si seulement, t’ avais connu musset,
tu saurais, que tu n’as pas encore vécu.
que ta vie, n’est pas sommeil,
elle est seulement … un cauchemar.","cala-te
eu te amo … meu amor, minha querida.
cala-te, nao repitas nunca mais isso,
cala-te, tu nao sabes o que dises.
as palavras que acariciam,
vêm em fusao com deus.
nao quero tuas palavras,
que chegam com tuas trevas,
de teu espirito sem paz,
que debate contra teu corpo.
as palavras saidas de tua boca,
não curam tua cicatriz,
te tornam ainda mais ciumento,
daqueles que conheceram o amor.
eu te amo … meu amor, minha querida.
cala-te, tu nao sabes o que é o amor,
cala-te, tu nao sabes o que fazes.
si pelo menos, tu tivesses conhecido musset,
tu saberias que ainda nao viveu.
que tua vida nao é sono,
ela é somente … um pesadelo.",fr_XX,pt_XX,"Cala-te
Eu te amo ... meu amor, minha querida.
Cala-te, não repitas isso nunca mais,
Cala-te, não sabes o que dizes.
As palavras que acariciam,
vêm em fusão com Deus.
Não quero as tuas palavras,
que chegam com as tuas trevas,
do teu espírito sem paz,
que luta contra o teu corpo.
As palavras que saem da tua boca,
não curam a tua ferida,
fazem-te ainda mais ciumento,
daqueles que conheceram o amor.
Eu te amo ... meu amor, minha querida.
Cala-te, não sabes o que é o amor,
Cala-te, não sabes o que fazes.
Se ao menos tivesses conhecido Musset,
saberias que ainda não viveste.
Que a tua vida não é sono,
é apenas ... um pesadelo.",1
"ta différence …
où es tu, que fais tu, comment vas-tu ?
et le temps qui passe et cette bataille éternelle,
« ta différence » fait ton arrogance et ta peur.
la peur qui t’enferme dans ta coquille,
« ta différence » qui t’isole dans ton monde.
et la solitude nous corrompt et nous ronge les âmes.
et ton esprit se souvenant encore du mien,
s’adosse sur mon âme et la rends nostalgique et fragile.
et mon esprit se souvenant encore du tien,
s’adosse sur ton âme et la rends nostalgique et fragile.
je le sais … ton berceau différent du mien,
je le sais … ton être enchainé à la profondeur de ta créature.
et tes envies dans ton esprit confus, tourbillonnant dans ton cœur…
et la peur … incrustée en toi te rendant craintif et indécis.
ton âme je l’ai percée …
si seulement ton coeur me serait ouvert,
le temps serait à nous,
« ta différence » serait la mienne,
et nous serions heureux …","sua diferença …
onde está você, que faz você, como vai você ?
e o tempo que passa et esta batalha eterna,
« sua diferença » faz sua arrogância e seu mêdo.
o mêdo que te encarcera no seu caracol,
« sua diferença » que te isola no seu mundo.
e a solidão nos corrompe et nos rói as almas.
e seu espírito se lembrando aínda do meu,
se encosta na minha alma e a torna nostálgica e frágil.
e meu espírito se lembrando aínda do seu,
se encosta na sua alma e a torna nostálgica e frágil.
eu sei … seu berço diferente do meu,
eu sei … seu ser prisoneiro na profundeza de sua criação.
e seus desejos no seu espírito confuso, turbilhonando no seu coração …
e o mêdo … encrustado em voce lhe tornando receioso e indeciso.
sua alma eu a penetrei …
se seu coração tivesse se abrido,
o tempo sería nosso,
sua diferença seria minha,
e nós seríamos felizes …",fr_XX,pt_XX,"A tua diferença...
Onde estás, o que fazes, como estás?
E o tempo que passa e essa batalha eterna,
""A tua diferença"" faz a tua arrogância e o teu medo.
O medo que te aprisiona na tua concha,
""A tua diferença"" que te isola no teu mundo.
E a solidão nos corrompe e nos roí as almas.
E o teu espírito ainda se lembrando do meu,
se apoia na minha alma e a torna nostálgica e frágil.
E o meu espírito ainda se lembrando do teu,
se apoia na tua alma e a torna nostálgica e frágil.
Eu sei... o teu berço diferente do meu,
Eu sei... o teu ser acorrentado à profundidade da tua criatura.
E os teus desejos na tua mente confusa, tumultuando no teu coração...
E o medo... incrustado em ti, tornando-te temeroso e indeciso.
A tua alma eu a perfurei...
Se ao menos o teu coração se abrisse a mim,
o tempo seria nosso,
""A tua diferença"" seria a minha,
e seríamos felizes...",1
