original_poem,translated_poem,src_lang,tgt_lang,translated_by_TA,topic
"la rue assourdissante autour de moi hurlait.
longue, mince, en grand deuil, douleur majestueuse,
une femme passa, d’une main fastueuse
soulevant, balançant le feston et l’ourlet;
agile et noble, avec sa jambe de statue.
moi, je buvais, crispé comme un extravagant,
dans son œil, ciel livide où germe l’ouragan,
la douceur qui fascine et le plaisir qui tue.
un éclair... puis la nuit! — fugitive beauté
dont le regard m’a fait soudainement renaître,
ne te verrai-je plus que dans l’éternité?
ailleurs, bien loin d’ici! trop tard! jamais peut-être!
car j’ignore où tu fuis, tu ne sais où je vais,
o toi que j’eusse aimée, ô toi qui le savais!","a rua em torno era um frenético alarido.
toda de luto, alta e sutil, dor majestosa,
uma mulher passou, com sua mão suntuosa
erguendo e sacudindo a barra do vestido.
pernas de estátua, era-lhe a imagem nobre e fina.
qual bizarro basbaque, afoito eu lhe bebia
no olhar, céu lívido onde aflora a ventania,
a doçura que envolve e o prazer que assassina.
que luz... e a noite após! — efêmera beldade
cujos olhos me fazem nascer outra vez,
não mais hei de te ver senão na eternidade?
longe daqui! tarde demais! nunca talvez!
pois de ti já me fui, de mim tu já fugiste,
tu que eu teria amado, ó tu que bem o viste!",fr_XX,pt_XX,"A rua ensurdecida ao meu redor gritava.
longa, esguia, em grande luto, majestosa dor,
uma mulher passou, com uma mão suntuosa
levantando, balançando a franja e a bainha;
ágil e nobre, com sua perna de estátua.
eu bebia, tenso como um extravagante,
em seu olho, céu lívido onde brota o furacão,
a doçura que fascina e o prazer que mata.
um relâmpago... depois a noite! - beleza fugaz
cujo olhar me fez renascer de repente,
não te verei mais senão na eternidade?
longe, bem longe daqui! tarde demais! talvez nunca!
pois eu não sei para onde foges, tu não sabes para onde vou,
ó tu que eu teria amado, ó tu que sabias!",1
"voici le soir charmant, ami du criminel;
il vient comme un complice, à pas de loup; le ciel
se ferme lentement comme une grande alcôve,
et l’homme impatient se change en bête fauve.
o soir, aimable soir, désiré par celui
dont les bras, sans mentir, peuvent dire: aujourd’hui
nous avons travaillé! — c’est le soir qui soulage
les esprits que dévore une douleur sauvage,
le savant obstiné dont le front s’alourdit,
et l’ouvrier courbé qui regagne son lit.
cependant des démons malsains dans l’atmosphère
s’éveillent lourdement, comme des gens d’affaire,
et cognent en volant les volets et l’auvent.
a travers les lueurs que tourmente le vent
la prostitution s’allume dans les rues;
comme une fourmilière elle ouvre ses issues;
partout elle se fraye un occulte chemin,
ainsi que l’ennemi qui tente un coup de main;
elle remue au sein de la cité de fange
comme un ver qui dérobe à l’homme ce qu’il mange.
on entend çà et là les cuisines siffler,
les théâtres glapir, les orchestres ronfler;
les tables d’hôte, dont le jeu fait les délices,
s’emplissent de catins et d’escrocs, leurs complices","eis a noite sutil, amiga do assassino;
ela vem como um cúmplice, a passo lupino;
qual grande alcova o céu se fecha lentamente,
e em besta fera torna-se o homem impaciente.
ó noite, amável noite, almejada por quem
cujas mãos, sem mentir, podem dizer: amém,
galgamos nosso pão! — é a noite que alivia
as almas que uma dor selvagem suplicia,
o sábio cuja fronte pesa sem proveito,
e o recurvo operário que regressa ao leito.
entretanto, demônios insepultos no ócio
acordam do estupor, como homens de negócio,
e estremecem a voar o postigo e a janela.
através dos clarões que o vendaval flagela
o meretrício brilha ao longo das calçadas;
qual formigueiro ele franqueia mil entradas;
por toda parte engendra uma invisível trilha,
assim como inimigo apronta uma armadilha;
pela cidade imunda e hostil se movimenta
como um verme que ao homem furta o que o sustenta.
ouvem-se aqui e ali as cozinhas a chiar,
os teatros a ganir, as orquestras a ecoar;
sobre as roletas em que o jogo encena farsas,
curvam-se escroques e rameiras, seus comparsas",fr_XX,pt_XX,"Aqui está a tradução do poema para o português:

Aqui está a encantadora noite, amiga do criminoso;
ela vem como cúmplice, sorrateiramente; o céu
se fecha lentamente como um grande alcova,
e o homem impaciente se transforma em fera.
Ó noite, querida noite, desejada por aquele
cujos braços, sem mentir, podem dizer: hoje
trabalhamos! - é a noite que alivia
as mentes devoradas por uma dor selvagem,
o estudioso obstinado cuja testa se torna pesada,
e o trabalhador curvado que retorna à sua cama.
Entretanto, demônios maléficos no ar
acordam pesadamente, como homens de negócios,
e batem nas janelas e toldos voando.
Através das luzes sacudidas pelo vento,
a prostituição se acende nas ruas;
como um formigueiro, ela abre suas saídas;
em todos os lugares, ela abre um caminho oculto,
como um inimigo que planeja um ataque;
ela se agita no seio da cidade lamacenta
como um verme que rouba do homem o que ele come.
Ouve-se aqui e ali as cozinhas assobiar,
os teatros uivar, as orquestras ressoar;
os restaurantes, cujo jogo é o deleite,
se enchem de prostitutas e vigaristas, seus cúmplices.",1
"et les voleurs, qui n’ont ni trêve ni merci,
vont bientôt commencer leur travail, eux aussi,
et forcer doucement les portes et les caisses
pour vivre quelques jours et vêtir leurs maîtresses.
recueille-toi, mon âme, en ce grave moment,
et ferme ton oreille à ce rugissement.
c’est l’heure où les douleurs des malades s’aigrissent!
la sombre nuit les prend à la gorge; ils finissent
leur destinée et vont vers le gouffre commun;
l’hôpital se remplit de leurs soupirs. — plus d’un
ne viendra plus chercher la soupe parfumée,
au coin du feu, le soir, auprès d’une âme aimée.
encore la plupart n’ont-ils jamais connu
la douceur du foyer et n’ont jamais vécu!","e os ladrões, que perdão ou trégua alguma têm
começam cedo a trabalhar, eles também,
forçando docemente o trinco e a fechadura
para que a vida não lhes seja assim tão dura.
recolhe-te, minha alma, neste grave instante,
e tapa teus ouvidos a este som uivante.
é o momento em que as dores dos doentes culminam!
a noite escura os estrangula; eles terminam
seus destinos no horror de um abismo comum;
seus suspiros inundam o hospital; mais de um
não mais virá buscar a sopa perfumada,
junto ao fogão, à tarde, ao pé da bem-amada.
e entre eles muitos há que nunca conheceram
a doçura do lar e que jamais viveram!",fr_XX,pt_XX,"e os ladrões, que não têm trégua nem piedade,
em breve começarão seu trabalho também,
e suavemente forçarão as portas e os cofres
para viver alguns dias e vestir suas amantes.
recolhe-te, minha alma, neste momento sério,
e fecha teus ouvidos a este rugido.
é a hora em que as dores dos doentes se intensificam!
a noite sombria os sufoca; eles finalizam
seu destino e vão em direção ao abismo comum;
o hospital se enche de seus suspiros. — mais de um
não virá mais buscar a sopa perfumada,
junto à lareira, à noite, ao lado de uma alma amada.
ainda a maioria deles nunca conheceu
a doçura do lar e nunca viveu!",1
"bizarre déité, brune comme les nuits,
au parfum mélangé de musc et de havane,
oeuvre de quelque obi, le faust de la savane,
sorcière au flanc d’ébène, enfant des noirs minuits,
je préfère au constance, à l’opium, au nuits,
l’élixir de ta bouche où l’amour se pavane;
quand vers toi mes désirs partent en caravane,
tes yeux sont la citerne où boivent mes ennuis.
par ces deux grands yeux noirs, soupiraux de ton âme,
ô démon sans pitié! verse-moi moins de flamme;
je ne suis pas le styx pour t’embrasser neuf fois,
hélas! et je ne puis, mégère libertine,
pour briser ton courage et te mettre aux abois,
dans l’enfer de ton lit devenir proserpine!","bizarra divindade, escura como as noites,
em mesclado perfume de almíscar e havana,
obra de algum obi, o fausto da savana,
ventre de ébano, bruxa em negras meias-noites,
eu prefiro ao constance, ao ópio ou ao nuits,
o elixir dessa boca onde o amor se engalana;
quando a ti meus desejos vão em caravana,
teus olhos, a cisterna onde eu bebo aos açoites.
por estes grandes olhos negros em fervor
por ti, demo sem pena! a mim, menos calor;
não sou o estige a nove vezes te abraçar,
e aí! eu sem poder, megera libertina,
para quebrar teu brio e então te encurralar,
no inferno de teu leito a virar proserpina!",fr_XX,pt_XX,"bizarra divindade, morena como as noites,
com um perfume misto de almíscar e tabaco,
obra de algum obi, o fausto da savana,
feiticeira de flanco de ébano, filha das negras meia-noites,
prefiro à constância, ao ópio, às noites,
o elixir da tua boca onde o amor desfila;
quando para ti partem em caravana os meus desejos,
os teus olhos são a cisterna onde bebem as minhas tristezas.
por esses dois grandes olhos negros, respiradouros da tua alma,
ó demônio sem piedade! derrama menos chamas sobre mim;
não sou o estige para te beijar nove vezes,
ai! e não posso, bruxa libertina,
para quebrar a tua coragem e te deixar sem saída,
no inferno da tua cama tornar-me prosérpina!",1
"la rue assourdissante autour de moi hurlait.
longue, mince, en grand deuil, douleur majestueuse,
une femme passa, d’une main fastueuse
soulevant, balançant le feston et l’ourlet;
agile et noble, avec sa jambe de statue.
moi, je buvais, crispé comme un extravagant,
dans son oeil, ciel livide où germe l’ouragan,
la douceur qui fascine et le plaisir qui tue.
un éclair… puis la nuit! — fugitive beauté
dont le regard m’a fait soudainement renaître,
ne te verrai-je plus que dans l’éternité?
ailleurs, bien loin d’ici! trop tard! jamais peut-être!
car j’ignore où tu fuis, tu ne sais où je vais,
ô toi que j’eusse aimée, ô toi qui le savais!","a rua, em torno, era ensurdecedora vaia.
toda de luto, alta e sutil, dor majestosa,
uma mulher passou, com sua mão vaidosa
erguendo e balançando a barra alva da saia;
pernas de estátua, era fidalga, ágil e fina.
eu bebia, como um basbaque extravagante,
no tempestuoso céu do seu olhar distante,
a doçura que encanta e o prazer que assassina.
brilho… e a noite depois! – fugitiva beldade
de um olhar que me fez nascer segunda vez,
não mais te hei de rever senão na eternidade?
longe daqui! tarde demais! nunca talvez!
pois não sabes de mim, não sei que fim levaste,
tu que eu teria amado, ó tu que o adivinhaste!",fr_XX,pt_XX,"A rua ensurdecedora ao meu redor gritava.
Longa, magra, em grande luto, dor majestosa,
uma mulher passou, com uma mão pomposa
levantando, balançando a franja e a bainha;
ágil e nobre, com sua perna de estátua.
Eu bebia, tenso como um extravagante,
em seu olhar, céu lívido onde brota o furacão,
a doçura que fascina e o prazer que mata.
Um relâmpago... depois a noite! - fugaz beleza
cujo olhar me fez renascer de repente,
não te verei mais senão na eternidade?
em outro lugar, bem longe daqui! tarde demais! talvez nunca!
pois eu não sei para onde foges, tu não sabes para onde vou,
ó tu que eu teria amado, ó tu que sabias!",1
"un soir, l’âme du vin chantait dans les bouteilles:
«homme, vers toi je pousse, ô cher déshérité,
sous ma prison de verre et mes cires vermeilles,
un chant plein de lumière et de fraternité!
je sais combien il faut, sur la colline en flamme,
de peine, de sueur et de soleil cuisant
pour engendrer ma vie et pour me donner l’âme;
mais je ne serai point ingrat ni malfaisant,
car j’éprouve une joie immense quand je tombe
dans le gosier d’un homme usé par ses travaux,
et sa chaude poitrine est une douce tombe
où je me plais bien mieux que dans mes froids caveaux.
entends-tu retentir les refrains des dimanches
et l’espoir qui gazouille en mon sein palpitant?
les coudes sur la table et retroussant tes manches,
tu me glorifieras et tu seras content;
j’allumerai les yeux de ta femme ravie;
à ton fils je rendrai sa force et ses couleurs
et serai pour ce frêle athlète de la vie
l’huile qui raffermit les muscles des lutteurs.
en toi je tomberai, végétale ambroisie,
grain précieux jeté par l’éternel semeur,
pour que de notre amour naisse la poésie
qui jaillira vers dieu comme une rare fleur!»","a alma do vinho assim cantava nas garrafas:
“homem, ó deserdado amigo, eu te compus,
nesta prisão de vidro e lacre em que me abafas,
um cântico em que há só fraternidade e luz!
bem sei quanto custou, na colina incendida,
de causticante sol, de suor e de labor,
para fazer minha alma e engendrar minha vida;
mas eu não hei de ser ingrato e corruptor,
porque eu sinto um prazer imenso quando baixo
à goela do homem que já trabalhou demais,
e seu peito abrasante é doce tumba que acho
mais propícia ao prazer que as adegas glaciais.
não ouves retirar a domingueira toada
e esperanças chalrar em meu seio, febris?
cotovelos na mesa a manga arregaçada;
tu me hás de bendizer e tu serás feliz:
hei de acender-te o olhar da esposa embevecida;
a teu filho farei voltar a força e a cor
e serei para tão tenro atleta da vida
como o óleo e os tendões enrija ao lutador.
sobre ti tombarei, vegetal ambrosia,
grão precioso que lança o eterno semeador,
para que enfim do nosso amor nasça a poesia
que até deus subirá como uma rara flor!”",fr_XX,pt_XX,"Uma noite, a alma do vin cantava nas garrafas:
""homem, para ti eu me inclino, ó querido deserdado,
sob minha prisão de vidro e meus círios vermelhos,
uma canção cheia de luz e fraternidade!
Eu sei o quanto é preciso, na colina em chamas,
de dor, suor e sol escaldante
para gerar minha vida e me dar alma;
mas não serei ingrato nem maléfico,
pois experimento uma alegria imensa quando caio
na garganta de um homem cansado por seus trabalhos,
e seu peito quente é uma doce tumba
onde me sinto muito melhor do que em meus túmulos frios.
Ouves ressoar os refrães dos domingos
e a esperança que gorjeia em meu peito palpitante?
Com os cotovelos na mesa e arregaçando as mangas,
tu me glorificarás e ficarás contente;
acenderei os olhos de tua esposa encantada;
a teu filho devolverei sua força e suas cores
e serei para esse frágil atleta da vida
o óleo que fortalece os músculos dos lutadores.
Em ti cairei, ambrosia vegetal,
precioso grão lançado pelo semeador eterno,
para que de nosso amor nasça a poesia
que jorrará para Deus como uma rara flor!""",1
"sonnet
vous avez, compagnon dont le cœur est poète,
passé dans quelque bourg tout paré, tout vermeil,
quand le ciel et la terre ont un bel air de fête,
un dimanche éclairé par un joyeux soleil;
quand le clocher s’agite et qu’il chante à tue-tête,
et tient dès le matin le village en éveil,
quand tous pour entonner l’office qui s’apprête,
s’en vont, jeunes et vieux, en pimpant appareil;
lors, s’élevant au fond de votre âme mondaine,
des sons d’orgue mourant et de cloche lointaine
vous ont-ils pas tiré malgré vous un soupir?
cette dévotion des champs, joyeuse et franche,
ne vous a-t-elle pas, triste et doux souvenir,
rappelé qu’autrefois vous aimiez le dimanche?","soneto
haveis, querida irmã, cuja alma é de poetisa,
visto uma aldeia de vermelho e toda em gozo,
quando em júbilo o céu à terra se harmoniza,
num domingo banhado por um sol radioso?
quando ergue o campanário a sua voz possante,
e a cidade mantém desde cedo acordada,
quando moços e velhos, em traje elegante,
se apressam para a missa que será rezada,
e em vosso espirito mundano ganha altura
o som de um órgão e de um sino na lonjura,
não exalastes um suspiro involuntário?
tal devoção do campo, estrídula e sincera,
não terá ela – triste e doce relicário –
lembrando que o domingo tanto amor vos dera?",fr_XX,pt_XX,"soneto
tu, companheiro cujo coração é poeta,
passaste por alguma cidade toda enfeitada, toda vermelha,
quando o céu e a terra têm um ar festivo,
um domingo iluminado por um alegre sol;
quando o campanário se agita e canta a plenos pulmões,
e mantém a aldeia desperta desde a manhã,
quando todos, jovens e velhos, se vestem elegantemente
para entoar o ofício que se prepara;
então, elevando-se no fundo da tua alma mundana,
os sons do órgão moribundo e do sino distante
não provocaram em ti, apesar de tudo, um suspiro?
essa devoção do campo, alegre e sincera,
não te fez, com doce melancolia,
lembrar que outrora amavas o domingo?",1
"l’amour est plus fort que la mort disiez-vous
mais la vie est plus forte que l’amour et
l’indifférente plus forte que la vie – la vie
mienne ou tienne et nôtre en quelque manière
est ensemble la seule séquence de
métamorphoses
(le néoténique se mue en héros à sexe
plus tard en ventru chauve pourrissant comme
un dieu)
et bains-douches au lhété tons les mois
deuils laqués, renaissances frêles, amnèses
et un vieillard muet en nous depois longtemps
survit sans douleur au charnier des enfants","o amor é mais forte que a morte vocês diziam
mas a vida é mais forte que o amor e
a indiferente mais forte que a vida — a vida
minha ou sua e nossa de alguma maneira
é em conjunto a única seqüência de
metamorfoses
(o neotênico converte-se em herói sexuado
depois no barrigudo careca que apodrece como
um deus)
e banhos-duchas no letes todos os meses
lutos laqueados, renascimentos frágeis,
amnésias
e um velho mudo dentro de nós há tanto
tempo
sobrevive sem dor ao ossuário das crianças",fr_XX,pt_XX,"O amor é mais forte do que a morte você dizia
mas a vida é mais forte que o amor e
a indiferença mais forte que a vida - a vida
minha ou tua e nossa de alguma forma
é juntas a única sequência de
metamorfoses
(o neotênico se transforma em herói com idade
mais tarde em barrigudo careca apodrecendo como
um deus)
e banhos de chuveiro em lhété todos os meses
lutos laqueados, renascimentos frágeis, amnésias
e um velho mudo em nós por muito tempo
sobrevive sem dor ao matadouro das crianças",1
"elancés ils s’enlacent, l’amour et la comparaison!
l’amour compare la comparaison qui aime louer
avec des anaphores
……….et la lyre saphique tisse
……….l’incomparable beauté des bords
……….à contre-jour d’une éclipse de l’être
(or m’éloignant en barque de l’île-hôtel
—aube que tu saluais à la fenêtre d’udaïpur —
nous n ’étions pas sortis du conte
mais protégés, édifiés même
par une constante de propp plus belle
que les trophées photoscopiques)
…………………………………..ce sera
toujours trop tôt toujours trop tard
donc c’est maintenant….. ………..le
trop tardif et trop prématuré adieu","lançados se entrelaçam o amor e a comparação!
o amor compara a comparação que ama elogiar
com anáforas
……..e a lira sáfica tece
……..a incomparável beleza das bordas
……..à contraluz de um eclipse do ser
(ora, afastando-me de barca da ilha-hotel
— aurora que você saudava à janela de udaipur —
— não tínhamos saído do conto
mas estávamos protegidos, edificados até
por uma constante de propp mais bela
do que os troféus fotoscópicos)
………………………………………….. …..será
sempre cedo demais sempre tarde demais
portanto, é agora …………………… ……. …o
tardio demais e demasiado prematuro adeus",fr_XX,pt_XX,"Em francês, eles se abraçam, o amor e a comparação!
O amor compara a comparação que ama louvar
com anáforas
……….e a lira safica tece
……….a incomparável beleza das margens
……….em contraluz de um eclipse do ser
(ou me afastando de barco da ilha-hotel
— alvorada que você saudava na janela de Udaipur —
nós não tínhamos saído do conto
mas protegidos, até mesmo edificados
por uma constante de propp mais bela
que os troféus fotoscópicos)
…………………………………..será
sempre muito cedo sempre muito tarde
então é agora….. ………..o
adeus tardio e prematuro demais",1
"si notre vie est moins qu’une journée
en l’éternel, si l’an qui fait le tour
chasse nos jours sans espoir de retour,
si périssable est toute chose née,
.
que songes-tu, mon âme emprisonnée?
pourquoi te plaît l’obscur de notre jour,
si pour voler en un plus clair séjour,
tu as au dos l’aile bien empanée?
.
là, est le bien que tout esprit désire,
là, le repos où tout le monde aspire,
là, est l’amour, là, le plaisir encore.
.
là, ô mon âme au plus haut ciel guidée!
tu y pourras reconnaître l’idée
de la beauté, qu’en ce monde j’adore.","se nossa vida é menos do que um dia
na eternidade e o tempo em disparada
nos corre os dias e os reduz a nada,
pois quando nasce é coisa fugidia,
.
no que meditas e por que te agrada,
minh`alma, o breu desta prisão sombria
quando o teu dorso alado propicia
que ascendeu à mais lúcida morada?
.
dispõe-se lá de amor e de prazer,
da paz pela qual todo o mundo anseia,
do bem quer todo espirito requer.
.
é lá que poderia, minh`alma, no alto
do céu, reconhecer a própria idéia
da beleza que eu neste mundo exalto.",fr_XX,pt_XX,"se a nossa vida é menos que um dia
no eterno, se o ano que circunda
afugenta nossos dias sem esperança de retorno,
se perecível é tudo o que nasce,
.
o que pensas, minha alma aprisionada?
por que te agrada a escuridão do nosso dia,
se para voar a um lugar mais claro,
tu tens asas bem emplumadas nas costas?
.
lá, está o bem que todo espírito deseja,
lá, o descanso que todos aspiram,
lá está o amor, lá, o prazer ainda.
.
lá, ó minha alma guiada ao mais alto céu!
lá poderás reconhecer a ideia
da beleza, que neste mundo adoro.",1
"j’ai voulu tout aimer, et je suis malheureux,
car j’ai de mes tourments multiplié les causes;
d’innombrables liens frêles et douloureux
dans l’univers entier vont de mon âme aux choses.
.
tout m’attire à la fois et d’un attrait pareil:
le vrai par ses lueurs, l’inconnu par ses voiles;
un trait d’or frémissant joint mon cœur au soleil,
et de longs fils soyeux l’unissent aux étoiles.
.
la cadence m’enchaîne à l’air mélodieux,
la douceur du velours aux roses que je touche;
d’un sourire j’ai fait la chaîne de mes yeux,
et j’ai fait d’un baiser la chaîne de ma bouche.
.
ma vie est suspendue à ces fragiles nœuds,
et je suis le captif des mille êtres que j’aime:
au moindre ébranlement qu’un souffle cause en eux
je sens un peu de moi s’arracher de moi-même.","querendo a tudo amar, trago a alma dolorida,
porque multipliquei a causa dos tormentos…
frágeis laços, grilhões inúmeros, cruentos,
prendem meu coração às coisas desta vida.
.
tudo a um tempo me atrai e enlaça-me igualmente:
por seu brilho, a verdade e seus véus, o mistério;
minha alma se une ao sol num raio de ouro, etéreo,
e em mil fios de seda a cada estrela ardente…
.
a cadência me prende à ária que triste evoca;
seduz-me a veludez da rosa entre os abrolhos:
eu de um sorriso fiz o grilhão dos meus olhos
e fiz também de um beijo a cadeia da boca!
.
assim cativo sou dos seres que adoro, a esmo…
suspenso é meu viver nesta rede que o enlaça…
e quando o menor sopro entre aqueles perpassa,
sinto um pouco de mim se arrancar de mim mesmo.",fr_XX,pt_XX,"Eu quis amar tudo, e sou infeliz,
pois multipliquei as causas dos meus tormentos;
inúmeros laços frágeis e dolorosos
ligam minha alma às coisas por todo o universo.

Tudo me atrai de uma vez com um encanto igual:
o verdadeiro com suas luzes, o desconhecido com seus véus;
um fio de ouro tremeluzente une meu coração ao sol,
e longos fios sedosos o ligam às estrelas.

A cadência me prende à melodia do ar,
a suavidade do veludo às rosas que toco;
de um sorriso fiz a corrente dos meus olhos,
e de um beijo fiz a corrente da minha boca.

Minha vida está suspensa por esses nós frágeis,
e sou o prisioneiro dos mil seres que amo:
a menor vibração que um sopro causa neles
sinto um pouco de mim se desprender de mim mesmo.",1
