original_poem,translated_poem,translated_by_TA,src_lang,tgt_lang,topic
"vous êtes invités
la journée s’avance masquée
la sensation, la plus forte et la plus subtile
de l’aujourd’hui
la nuit
on y voit nus les rouages
l’encombrement du temps
on fait eau, on va droit
sur l’iceberg.
et la journée s’avance masquée
sur des rails trop étroits. décidément
elle ne fait pas son âge, ce qui ne veut pas dire
qu’elle est plus vieille. s’il suffisait de tendre
une petite glace en direction de la lumière trop forte
pour y lire à l’envers – quoi ? pas la vérité
tout de même. simplement le kilo de tomates
pèse un peu plus ou un peu moins. la rumeur
de la ville tend la perche de minute en minute
à la journée dans son chorus qui paraît frêle
par des riffs de cuivres huilés. l’arrangement
sent la sueur et le big band en smokings pathétiques
imite un orchestre classique. – si si, cette cotte de mailles
vous va, je vous jure, à ravir. – je ne dis pas
qu’elle jure, mais si on danse ? votre voisin de table
trouve la musique pas assez actuelle, il lit
les magazines. – alors dans trois ans tu n’aimeras
plus ce que tu aimes aujourd’hui. – non
ce n’est pas si simple. j’aime, dit le voisin, ce qui me donne
la sensation, la plus forte et la plus subtile,
comme un parfum traverse la salle sur des talons
aiguilles, de l’aujourd’hui. plus tard
quand je ferai sauter le bouchon je sais
(et ce savoir ajoute une tuile à mon plaisir
un peu vert pour l’instant) qu’elle sera là
millésimée. – je vois. ce genre de chose ne m’arrive
jamais, j’en ai peur, ou par la grâce de créatures
désespérément vaporeuses. l’eau qui bout juste
avant son ascension dans la cafetière, le soleil
quand il s’épand sur la moquette d’une propreté douteuse
la fourchette qui tintant contre l’étain
d’une boîte d’abats pour le chat le rend dingue.
par exemple. et cela, vous voyez, n’a pas grand-chose à voir
avec la culture. je ne lis plus. en tout cas
plus dans l’espoir de me sentir – comment ? sentir
tout court. il y a des gens qui mettent leurs polaroïds
au freezer ; ils vieillissent mal, c’est notoire, mais
ne prenez pas pour un désir de retarder l’effacement
celui de couleurs irréelles. iceberg, aurores boréales.
le temps ne coule incolore qu’à température
ambiante. dès que l’atmosphère coagule
ça pue l’huile de cuisson. le lave-vaisselle a fait
de fines croûtes étranges comme des fragments de météore
avec des restes plus humains. il y a des jours
comme ça. pour celui-ci ce sera tout
d’accord ? d’ailleurs la lumière soudain baisse
dans le bar, signal du changement de tarif
et l’heure d’été, une belle arnaque, blanchit
le larcin du soir en taxant le sommeil du matin.
– bonne nuit, dors bien mon amour. – si c’est un ordre
sache que je vais me mutiner. le capitaine est à fond de cale.
dans cette mélasse une chatte ne retrouverait pas ses petits
et le port de départ ni celui vers quoi nous voguons
n’est en vue. hier m’a posé un lapin. demain
demain (autant en emporte le vent)
est un autre jour. la nuit, quelle violence
inouïe, tu ne trouves pas ? tu dors.
non qu’elle évoque la mort, la solitude hantée
des enfants – ces pensées peupleraient l’insomnie –
mais on y voit nus les rouages de la veille.
sur le pont l’océan tout entier se change
en salle des machines et dans chaque tour de garde
la discontinuité amorphe des heures soumet
le mousse à la torture. s’il avait su ! pas une angoisse
intéressante, une à la heidegger, comme dit
cet ami qui ne dort plus : un bazar, un medley sadique
des plus mauvaises chansons sur radio nostalgie,
l’encombrement du temps. comprends-tu que l’on ait
bien envie de te réveiller, mon amour, de secouer
tes épaules pour te montrer ce qui se passe d’affreux ?
– qu’est-ce qu’il y a ? – on fait eau, on va droit
sur l’iceberg, et non, il n’y a rien à l’horizon, c’est bien
ce qui affole. le titanic, selon certaines sources,
n’aurait jamais coulé mais un autre navire
presque identique auquel des armateurs véreux
auraient donné son nom, comptant sur un naufrage sans morts
pour encaisser la prime. le titanic – le vrai –
mouillerait encore dans une rade paisible
on ne sait où. il existe une carte postale
montrant un paquebot à demi englouti – le cabiria
ou bien le caribbean – et cette légende en gras :
« vous êtes invités. » il s’agissait de l’inauguration
d’un restaurant. longtemps j’ai cherché à qui l’envoyer,
une femme certainement. j’avoue que je m’identifie
assez à ce bateau débaptisé privé de son big band
qui a coulé, coule encore dans nos têtes et
n’a pas coulé. surtout le soir : le soir
est si sentimental. j’ai toujours cette carte.
tu l’as gagnée à la sueur de ton sommeil.","you are invited
the day advances masked
the strongest subtlest feeling
of the day
the night
lays its mechanisms bare
the burden of time
water’s coming in, we’re heading straight
for the iceberg.
so the day advances masked
on very narrow rails. oh no,
it doesn’t look its age, which doesn’t mean
it’s older. were it enough to hold
a mirror to the overbearing light
to read back to front across it – what? not the truth
all the same. just that the kilo of tomatoes
weighs a bit more or a bit less. the hum
of the town directs the boom from one minute to the next
following the day’s chorus, frail-sounding
through riffs of oiled brass. the rendition
smells of sweat and the big band in ragged tails
mocks a classical orchestra. – no, no, that coat of mail
couldn’t suit you better, i swear. – i’m not saying
it clashes, but what if we dance? the man next to you
doesn’t find the music modern enough, he’s a magazine
reader. – so in three years you’ll no longer love
the things you love today. – no
it’s not that simple. i like, says your neighbor, things that give me
the strongest subtlest feeling
like a perfume crossing the room on stiletto
heels, of the day. later
when i pop the cork i know
(and this adds spice to my pleasure
a bit bland as yet) that it’ll be there
vintage. – i see. that sort of thing never happens
to me i’m afraid, or only thanks to desperately
vaporous creatures. water that boils just
before rising in the coffee pot, the sun
when it spills over the stained carpet
the fork clinking against the pewter
of a plate of scraps for the cat drives him nuts.
for example. and that, you see, doesn’t have much to do
with culture. i no longer read. well
no longer hoping to feel – what? to feel
quite simply. some people put their polaroids
in the freezer; they age badly, that’s obvious, but
don’t mistake the desire to postpone effacement
for that of unreal colours. iceberg, aurora borealis.
time only flows colorless at room
temperature. as soon as the atmosphere coagulates
it stinks of cooking oil. the dishwasher has made
thin scales as strange as fragments of meteorite
with more human remains. there are days
like that. that’ll be enough for this one
ok? anyway the light is falling suddenly
in the bar, signalling a change of tariff
and daylight saving time, what a con, launders
evenings loot by taxing morning sleep.
– good night, sleep well my love. – if that’s an order
rest assured i’ll mutiny. the captain’s at the back of the hold.
a cat couldn’t find her kittens in this murk
and neither the port we left nor the one we’re heading for
is visible. yesterday stood me up. tomorrow
tomorrow (gone with the wind)
is another day. night-time, what unexpected
violence, don’t you think? you’re sleeping.
not that it evokes death, the haunted solitude
of children – these thoughts will populate insomnia –
but it lays yesterdays mechanisms bare
on the deck the whole ocean transforms itself
into a machine room and at each lookout post
the amorphous discontinuity of hours tortures
the ships boy. if only he’d known! not an interesting
angst, heidegger-style, as
that sleep-deprived friend says: a shambles, a sadistic medley
of the worst songs on golden oldies am,
the burden of time. do you see that someone
longs to wake you, my love, to grasp
your shoulders to show you the dreadful things going on?
– what is it? – there’s water coming in, we’re heading straight
for the iceberg, and no, there’s nothing on the horizon, that’s just
the horror of it. some say the titanic
never sank, but another
almost identical ship, that its corrupt owner
sold its name, counting on a shipwreck with no dead
to cash in on the insurance. the titanic – the real one –
would still be anchored in some peaceful harbour
no-one knows where. a postcard exists
showing a half-sunk steamship – the cabiria
or perhaps the carribbean – with this caption in bold:
‘you are invited.’ it had something to do with the inauguration
of a restaurant. i wondered who to send it to for ages,
definitely a woman. i admit that i feel quite an affinity
with this renamed boat stripped of its big band
that sank, sinks still in our minds and
never sank. most often in the evening: evenings
are so sentimental. i still have that card.
you’ve earned it through the toil of your sleep.","you are invited
the day advances masked
feeling, the strongest and the most subtle
of today
at night
the tracks are bare
time constraints
watering, going straight
on the iceberg.
and the day advances masked
on too narrow tracks. decidedly
it does not make its age, which does not mean
if it was sufficient to stretch
a small ice in the direction of too much light
to read it backwards – what? not the truth
still. just the kilo of tomatoes
a little more or a little less. the rumour
of the city tends the perch minute by minute
to the day in his chorus that seems frightening
by rubber riffs. the arrangement
feels sweat and big band in pathetic smoking
imites a classical orchestra. – if if, this ballet
You’re going to be delighted, I think. – I’m not saying
that she judges, but if we dance? your neighbor at the table
finds the music not current enough, he reads
magazines. – then in three years you won’t like
more than what you like today. – no
it’s not that simple. I like, says the neighbor, what gives me
the feeling, the strongest and the most subtle,
as a perfume passes through the room on heels
needles, of today. later
when I'm going to jump the plug I know
(and this knowledge adds a twist to my pleasure
a little green for now) that she will be there
this kind of thing doesn’t happen to me.
never, I am afraid of it, or by the grace of creatures
desperately vaporous. water that just runs out
before his ascension into the cafeteria, the sun
when it spreads over the carpet of suspicious cleanliness
the range that tints against tin
of a box of cuts for the cat makes him sick.
for example. and this, you see, has not much to see
with culture. I don't read anymore. anyway
more in the hope of feeling – how? feeling
shortly. there are people who put their polaroids
to freeze; they age badly, it is well known, but
do not take as a desire to delay the disposal
iceberg, boreal aurores.
time flows colourlessly only at temperature
as soon as the atmosphere coagulates
it could wash the cooking oil.
fine strange crusts such as weather fragments
with more human remains. some days ago
like this. for this one it will be all
agree? in fact the light suddenly drops
in the bar, sign of change of tariff
and the summer time, a beautiful arctic, whitening
the larvae in the evening by taxing the morning sleep.
– good night, sleep well my love. – if it is an order
I know I'm going to move. The captain's in deep trouble.
in this mess a cat would not find its little
and the port of departure or destination
is not in sight. yesterday put me a rabbit. tomorrow
tomorrow (especially when the wind blows)
is another day. at night, what violence
Inouie, you don't find? you're dying.
not that it refers to death, haunted loneliness
children – these thoughts would fuel insomnia –
but you can see the tracks of the day before.
on the bridge the whole ocean is changing
in the machine room and in each guard tower
the amorphous discontinuity of the hours submitted
the foam to torture. if he had known! no anguish
interesting, one to the heidegger, as said
this friend who no longer sleeps: a bazaar, a sacred medley
the worst songs on nostalgic radio,
the burden of time. do you understand that there has been
wanting to wake you up, my love, to cry
your shoulders to show you what is going on?
– what is there? – we make water, we go right
on the iceberg, and no, there’s nothing on the horizon, it’s fine
titanium, according to some sources,
would never have landed but another ship
almost identical to that of true shipowners
alleged to have given his name, based on a deadly sinking
for the premium. titanic – the real –
would still float in a quiet creek
unknown where. there is a postcard
showing a half-engulfed package – the cabiria
or the caribbean – and this fat legend:
""You are invited."" it was the opening
I’ve been looking for a long time to send him,
a woman certainly. I admit that I identify
enough to this boat named private of its big band
that has fallen, is still falling in our heads and
did not sink. especially in the evening: in the evening
is so sentimental. I always have this card.
you have earned it by the sweat of your sleep.",fr_XX,en_XX,0
"ne coupez pas
c’est beau
de ne pas savoir d’où viennent les choses
les enchaînements secrets
sont plus fins
il est des intrigues
au milieu desquelles on oublie
le début, n’attend plus la fin
quelques instants encore
tout peut tout pénétrer.
ça commence comme ça, au milieu
d’une conversation : le marché a déjà fleuri
sur la place brûlant
l’étape des bourgeons
et pour appeler cette ville
venise il a fallu bien camoufler
l’infrastructure, placer
savamment des branchages
mikado sur la fosse d’orchestre.
les marchandises acheminées
par des convois sans phares
silencieusement la nuit
rivalisent avec la nature.
remboursez ! cependant c’est beau
de ne pas savoir d’où viennent les choses
ni les enfants et quand les ethnologues
se prennent pour des missionnaires
du planning familial
de pouffer avec les sauvages.
les enchaînements secrets
sont plus fins. si tu les saisis, les soulèves
par le cou comme les serpents
venimeux, les baguettes
enchevêtrées, beaucoup de phrases
sont compatibles. leur gueule
sous la pression des doigts s’ouvre incroyablement
si nécessaire, un autre tube
s’encastre et toute la plomberie
s’installe avec des joints liquides.
qu’est-ce qui donne ce matin
aux accidents bien ponctués
du marché, du café, du retour à la chambre noire
la cohésion d’un film? pas la musique
plaquée si redondante qui est la honte
du cinéma. une prosodie plutôt
improvisée qui fait aussi retour
sur soi nonchalamment. impossible de l’arracher
à son prétexte, elle va polluer
l’air, seul reste le film
sur les murs et la peau. brasse coulée :
un maillon entre deux mouvements
entre deux eaux caché. c’est comme ça
que cela commence, en cours de route. c’est plutôt ça
que je dis. – mais on n’y comprend rien
mon pauvre ami. – bon. il est des intrigues
au milieu desquelles on oublie
le début, n’attend plus la fin : les gangsters en cavale
se mettent en position de sumotori de papier
sur une estrade en carton mais c’est un simple cercle
tracé dans le sable de la plage. alors
des acolytes frappent le sol de leurs paumes :
eux ils s’ébranlent toujours figés, la bobine accélère
les spectateurs sur leur siège tremblent
jusqu’à ce que l’un d’eux transgresse
la ligne. du grand art. que peux-tu faire
de mieux aujourd’hui que d’élever
à la grandeur naturelle d’un jeu sa copie miniature ?
de minuscules fragments s’étirent
le véhicule qui nous dépanne tient par des élastiques.
cela eut lieu sans queue ni tête
au milieu du chemin
de notre mort. l’explorateur tardif
en pleine descente de l’orénoque ou l’amazone
est pris de fièvre, il voit paralysé glisser
un interminable serpent, l’embouchure lui paraît
aussi lointaine que la source. ou
assis au milieu d’un tronc d’arbre, tiens
il note que c’est un crocodile.
de telles choses arrivent dans la vie : à mi-course
dans la zone indécise où pour quelques instants encore
tout peut tout pénétrer – du moins veut-on le croire.
d’anonymes bienfaiteurs assurent la soudure
remplissent les cases vides des étals mais il faut
espérer que la nuit venue les godemichés s’adapteront
sur le harnais universel. c’est comme ça
que cela commence, comme ça
que je l’entends pourvu qu’un chef
ne s’avise pas de tapoter le pupitre de sa baguette
et que l’on n’arrête aucune date.","don’t cut the line
it’s wonderful
not to know where things come from
hidden sequences
are finer
there are intrigues
in the midst of which you forget
the beginning, no longer anticipate the end
for another moment or so
everything is penetrable.
it begins like that, in the middle
of a conversation: the market has already blossomed
in the burning hot square
the budding phase
and to call this town
venice it was necessary to camouflage
the infrastructure, to place
forks knowingly
spillikins over the orchestra pit.
the merchandise brought in
by convoys without headlights
silently at night
rivals nature.
give us our money back! yet it’s wonderful
not to know where things come from
not even children and when ethnologists
pose as missionaries
of family planning
to laugh with the savages.
hidden sequences
are finer. if you grasp them, lift them
by the neck like poisonous
snakes, sticks
entwined, many sentences
are compatible. their jaws
open so wide beneath the pressure of your fingers
if necessary, another tube
slots in and all the plumbing
gets going with liquid joints.
what is it that gives this morning
with its well-punctuated accidents
of the market, the café, the return to the dark-room
the cohesion of a film? not the music
stuck on top, redundant, the shame
of cinema. no, a prosody, improvised
perhaps which doubles back
on itself nonchalantly. impossible to tear it away
from its pretext, it will pollute
the air, the film alone remaining
on walls and skin. molded brass:
a link between two movements
hidden between two currents. that’s how
it begins, when the journey’s underway. that’s pretty much
what i mean. – but it makes no sense
my poor friend. – fine. there are intrigues
in the midst of which you forget
the beginning, no longer anticipate the end: gangsters on the run
place themselves like paper sumo wrestlers
on a cardboard platform but it’s just a circle
traced in the sand on the beach. so
their associates beat the ground with the flats of their hands:
they fall still rigid, the reel turns faster
the spectators tremble in their seats
until one of them crosses
the line. fine art. what could you do
today that would be better than to raise
the miniature to the real size of the game?
miniscule fragments stretch themselves out
the breakdown vehicle here to save us is held together with rubber bands.
that happened for no reason at all
on our journey
towards death. the tardy explorer
in mid descent of the orinoco or the amazon
develops a fever, paralysed he watches the sliding
of an interminable snake, the mouth seems
as distant as the source. or
sitting in the middle of a tree trunk, look
he remarks that it’s a crocodile.
such things happen in life: halfway through
in the ambiguous zone where for another moment or so
everything remains amorphous, penetrable – or so you would like to believe.
anonymous well-wishers make sure ends meet
fill the stalls’ empty boxes but we must
hope that when night comes the dildos will adapt
to the universal harness. that’s how
it begins, that’s how
i understand it provided that no conductor
decides to tap the rostrum with his stick
and that no date is fixed.","do not cut
it’s beautiful
not knowing where things came from
secret chains
are more efficient
it is intrigues
in the midst of which we forget
the beginning, no longer awaits the end
a few more seconds
everything can come in.
it starts like this, in the middle
The market has already blossomed
on the burning site
the bud stage
and to call this city
venise it had to be well hidden
the infrastructure, place
well-connected
mikado on the orchestra pit.
goods shipped
by convoys without lights
silently at night
competition with nature.
Refund! however it is beautiful
not knowing where things came from
or children and when ethnologists
take themselves as missionaries
family planning
to fight with the wild.
secret chains
if you seize them, raise them
by the neck like serpents
venim, gloves
wrapped, many phrases
are compatible. their guerrilla
under pressure of fingers opens incredibly
if necessary, another tube
and all plumbing
is installed with liquid joints.
what gives this morning
well-targeted accidents
market, coffee, return to the black room
the cohesion of a film? not the music
complained so redundant that it is a shame
of cinema. a rather prosodic
improvised which also returns
on himself nonchalamment. impossible to pull it
under its pretext, it will pollute
air, only the film remains
on walls and skin. curved brace:
a link between two movements
between two hidden waters. it’s like this
that it starts, along the way. it’s rather that
that I say. – but there’s nothing in it
my poor friend. – well. it’s intrigues
in the midst of which we forget
the beginning, no longer awaits the end: the gangsters in cavalry
put in position paper sumotori
on a cardboard raft but it’s a simple circle
traced in the sand of the beach. then
acolytes hit the ground with their paws:
they they always bounce fast, the bobine accelerates
spectators on their seats tremble
until one of them exceeds
the line. of great art. what can you do
more today than to raise
to the natural size of a game its miniature copy?
of tiny fragments stretching
the vehicle that drives us is held by elastics.
this took place without a tail or a head
in the middle of the road
of our death. the late explorer
on the rise of the orinoco or amazone
is caught with fever, he sees paralyzed glide
a boundless snake, the opening seems to him
as far away as the source. or
seated in the middle of a tree trunk, hold
he notes that it is a crocodile.
such things happen in life: at midway
in the uncertain area where for a few more moments
Everything can come in – at least you want to believe it.
of beneficial anonymous names to ensure welding
fill in the blanks of the etals, but it is necessary to
hope that the next night the buggers will adapt
on the universal harness. it’s like this
that it starts, like this
that I understand, provided that a Chief
don’t try to turn off the button of his hat
and that no date is set.",fr_XX,en_XX,0
