original_poem,translated_poem,translated_by_TA,src_lang,tgt_lang,topic
"le paquebot
le paquebot monta au cinquième étage et cria:
tut! tut! tut!
la lune ne répondit pas
le paquebot monta au sixième étage et cria:
tut! tut! tut!
la lune ne répondit pas
le paquebot monta au neuvième étage et cria:
tut! tut! tut!
la lune ne répondit pas
les paquebots ne vont pas dans les étages
les paquebots vont sur les mers et les océans
ils vont sur les mers et crient
tut! tut! tut!
tut! tut! tut!
tut! tut! tut!
et la lune ne leur répond pas","the steamliner
the steamliner climbed to the fifth floor and cried:
toot! toot! toot!
the moon did not reply
the steamliner climbed to the sixth floor and cried:
toot! toot! toot!
the moon did not reply
the steamliner climbed to the ninth floor and cried:
toot! toot! toot!
the moon did not reply
steamliners do not sail from floor to floor
steamliners sail the seas and the oceans
they go on seas and they cry
toot! toot! toot!
toot! toot! toot!
toot! toot! toot!
and the moon does not reply","package
the boat mounts on the fifth floor and creates:
tut! tut! tut!
the moon did not respond
the boat mounts on the sixth floor and creates:
tut! tut! tut!
the moon did not respond
the boat mounts on the ninth floor and creates:
tut! tut! tut!
the moon did not respond
packages do not go to the floors
ships go to the seas and oceans
they go to the seas and cry
tut! tut! tut!
tut! tut! tut!
tut! tut! tut!
and the moon does not answer them",fr_XX,en_XX,0
"talavéra
vanguélis se montrait dans la posture abjecte
d’une bête abattue aux jambes grand-ouvertes
(cependant le bateau avançait mornement
par la force de son mouvement permanent)
vanguélis étendu avec sa peau suante
sur sa couche attendait que dans son antre j’entre
homéros m’y avait poussé avec sarcasme
mais je détestais cette dérision de l’âme
la peau de vanguélis était nue excepté
un caleçon couvrant sa sexualité
(cependant le bateau continuait mornement
à fendre l’océan sans perdre aucun moment
par son hélice attachée au bout de sa caisse
il remuait la flache et avançait sans cesse)
je reculai pour ne plus voir la dérision
de ce que j’aime aussi pour la simple raison
que la chaleur était ce jour-là suffocante
et dégoûtait de se coller à d’autre viande
(cependant le bateau mornement labourait
l’eau marine montrant son immense marais)
je reculai hors de la vue de ce pauvre homme
qui s’ennuyait à mort sur cette mer énorme
et je rentrai dans ma cabine où m’attendait
l’immensité de la solitude où j’étais
(cependant le bateau continuait mornement
à fendre l’océan sans perdre aucun moment)","talavéra
vanguelis sat in the abject posture
of a worn-out animal with his legs splayed out
(meanwhile the ship advanced glumly through the ocean
by the force of its constant motion)
vanguelis lying with his sweaty skin
on his bed waited for me to enter his den
homeros had sarcastically pushed me there
but i detested this mockery of the soul
vanguelis’ skin was naked except for boxer shorts
which covered up his sexual parts
(meanwhile the ship continued glumly through the ocean
without diminishing its motion
by its propeller attached to the end of its enhanced
hull it moved the water and steadily advanced)
i drew back to avoid seeing any more derision
of what i love also for the simple reason
that the heat was suffocating that day
and put me off sticking to other flesh
(meanwhile the ship glumly ploughed on steadily
through the enormous watery swell of sea)
i withdrew out of sight of that poor guy
who was bored to death on that huge sea
and i went back into my cabin where i was face to face
with the immensity of the solitude of that place
(meanwhile the ship continued glumly through the ocean
without diminishing its forward motion)","talavéra
vanguélis appeared in the abject posture
of a beast slaughtered with large open legs
(whenever the vessel was drifting
by the force of its permanent motion)
extended vangelis with its dry skin
on his couch expected that in his trunk I entered
homeros had put me there with sarcasm
but I detested this delusion of the soul
the skin of vangelis was naked except
a cover-up covering his sexuality
(when the boat continued to sink
to float the ocean without losing any time
by its propeller attached to the end of its body
he wiped the bottle and kept moving)
I retreated to no longer see the derivation
of what I also like for the simple reason
that the heat was that day suffocating
and liked to stick to other meat
(when the vessel was sinking
marine water showing its immense marshes)
I retreated from the sight of this poor man
who was bored to die on this huge sea
and I went back to my cabin where I was waiting
the immensity of the loneliness where I was
(when the boat continued to sink
to float the ocean without losing any time)",fr_XX,en_XX,0
"éden, deux, trois émoi
i
le cheval a mangé la rose voici le prince
il est ébouriffé il a dû attraper du grand vent comme un arbre et des plumes au passage
montre-moi ta banlieue dit-il et je l’emmène
voir à même le bitume d’une rue pittoresque
quatre pieds de carottes levés dans le trottoir
et maintenant allons poursuivre notre fête
sur le chemin de fer français à cette heure-ci c’est un départ en bleu
nous nous rendons à pinces dessous le fil à linge où ma jupe frissonna il était une fois
(dans la brise de praha et puis de cordoba j’attendais son retour
je semais un éden béton un jardin pour mieux lui faire la cour)
alors le bouchon part visant le petit train des mains du bien-aimé et je suis très touchée
ii
(autrefois à un adieu d’amis je déchire mon vêtement de pluie en plongeant d’un mur des tuileries dans une profondeur grise de cyprès une nuit et je fais sur mes chaussures un bruit presque mélodieux puis j’escalade) je continue sous les étoiles
iii
une file indienne d’ivoiriens traverse avec chacun sur la tête un colis
(un colis beau colis brocoli)
la cour où la bourrache a levé d’un parpaing creux
(pour ses yeux c’est fête juste pour ses yeux)
je veux dire quelque chose de moi à lui et bouleversement
cette phrase de fourmis noires avec ses pousses de chou vertes ou bleues qui se balancent c’est immense aphro-paradisiaque
il n’aura pas besoin de chausser ses lunettes pour lire mon amour
iv
à quatre heures du matin sous la lune il sort
en costume d’adam mon amant va respirer la rose
la rose éclose dans la cour grise
à quatre heures nu sous la lune la ville aurait pu le voir avec la rose
alors j’ai grimpé à son cou
comme un lierre comme trémière
la rose.","eden, two, three and churned-up me
i
the horse has eaten the rose here is the prince
his hair is all on end he must have run into a gale like a tree and feathers as he passed
show me your neighbourhood he said and i take him by the hand
and show him right up close the tarmac of a colourful street
four carrot-tops growing in the pavement
and now let’s carry our party on
to french rail there’s a blue train leaving now
we hoof it on our pegs under the clothes-line where upon a time
my skirt once shivered (in the breeze of praha then of cordoba i awaited his return
sowing a concrete eden a garden the better to woo him with)
then the cork pops out at the little train from the hands of my beloved and i’m deeply touched
ii
(back then at a friends’ farewell i tore my mac as i plunged from a tuileries wall into a deep grey pit of cypresses one night and did it on my shoes with an almost melodious sound then i started to climb) i go on under the stars
iii
a single file of men from the ivory coast each one with a box on his head
(lovely broccoli in broxes)
the yard where the borage grew in a breeze-block’s hollow
(a party for his eyes for his eyes only)
i want to tell him something of myself and arsy-versy
this black ant sentence with its shoots of cabbage green or blue and waving is
an aphroparadisiac and huge
he won’t need to put his glasses on to read my love
iv
at four in the morning under the moon he goes
in his adam suit my lover goes to smell the rose
the rose that’s opened in the courtyard’s grey
four in the morning naked under the moon the whole of the city could have seen him with his rose
then i climbed to his neck
like ivy holly
hock and rose.","eden, two, three emoi
i
the horse ate the rose here's the prince
he was buried he had to catch the big wind like a tree and the rains at the passage
show me your neighbourhood says he and I bring him
see the bitumen of a picturesque street
four feet of carrots removed in the sidewalk
and now we're going to continue our celebration
on the French railway at this time it is a blue departure
we're going downstairs to the rope where my jacket was once
(in the break of praha and then cordoba I waited for his return
I used to be an eden concrete garden to better make him the court)
then the button goes to the little train of the loved one's hands and I'm very touched
ii
(sometimes at a friend’s farewell I cut off my rain suit by climbing from a tuileries wall in a grey cypress depth one night and I make a near-melody noise on my shoes then I climb) I continue under the stars
iii
an Indian line of Ivorians crossing with each on their heads a package
(a nice broccoli package)
the court where the bird had climbed from a hollow parpaing
(for his eyes it’s a feast just for his eyes)
I want to say something about myself to him and change
This phrase of black fur with its balanced green or blue chou shoots is immensely aphro-paradisic
he won’t need to pull out his glasses to read my love
iv
at four o'clock in the morning under the moon he leaves
in Adam costume my sweetheart will breathe the rose
the rose blooms in the grey court
at four o'clock naked under the moon the city could have seen it with the rose
then I climbed up to his neck
as a cord as a treasure
the rose.",fr_XX,en_XX,0
"l’armoire est vide pas de morts pas de pain
à glace en date de naissance d’aïeule sombre
comme un immense couffin quoi va partir
là-dedans si la galère flambe.
l’ivre bateau que ça devient l’armoire rappelée si soudain jusqu’à la mer bleue rouge noire loin –
draps dépliés toutes voiles hissées
les fantômes bernés de l’histoire –
tu penches, la vie
vers quel infini quel oubli.
la mite a mangé le mouton
allons
si l’or vaut moins que le charbon
scions scions !
l’arrière tante s’est jetée sous un train par amour
le cœur que j’ignore d’elle
n’arrange à l’intérieur les affaires personnelles
à ta vie atavisme tata
sur le quai les métros et l’rer à moi.
mobilier défermé a perdu son mouchoir
ses miettes de biscuit lu ses cols roulés troués ses foulards ses fichus
corniche quelle proue si l’on si juche émue
il n’y a plus d’oiseau pour siffler dans ce bois.
chavire en mémoire courte chêne massif lourde armoire
étagères chositude
penderie hébétude
miroir exactitude
dans sa plus jolie robe elle danse elle a seize ans.
c’était il y a longtemps qu’un ange passe maintenant
(le meuble de mariée servit à faire du feu sitôt feue tata claire
fouie sans corsets ni yeux).","the wardrobe’s bare no skeletons no bread
the wardrobe’s bare no skeletons no bread
passed down from my dark ancestor a mirror dating from her birth
like a giant moses basket right about to leave
inside if the whole crap ship goes up in sudden flames.
what a drunken boat the wardrobe is if suddenly recalled to the blue red black sea far away –
unfolded sheets all sails unfurled
and history’s hoodwinked ghosts –
you lean out, life
towards what infinite and what forgetfulness.
the moths have eaten the sheep’s wool
oh come on
if gold’s worth less than coal
let’s saw it saw it down!
my great-great-auntie threw herself under a train for love
the heart i never knew of her
can’t straighten out inside the personal affairs
of your existence at a visit atavistic auntie
on the station platform or the tube the rer for me.
the unsealed furniture has lost its handkerchief
its biscuit crumbs all read its roll-necks full of holes its lousy fichus scarves
a ledge what prow if you’re all washed up and perch there awed
not a single bird is left to whistle in this wood.
she’s sinking the heavy wardrobe made of short memory and solid oak
her shelves and thinginess
her rail paralysis
her mirror exactness
in her prettiest dress she’s dancing she’s sixteen.
it was long ago an angel passing now
(the bridal wardrobe sent to make a blaze as soon as my late aunt claire
buried without corsets and eyes.)","the armory is empty no dead no bread
ice on date of birth of dark-eyed egg
as an immense coffin what's going to come out
from there if the hell burns.
the iron boat that it becomes the armoire recalled so suddenly to the blue red black sea far away –
drapes draped all rows lifted
The ghosts of history –
you look, life
to what infinite what forgotten.
the mite ate the sheep
will
if gold is less than coal
Thank you very much!
back aunt fell in love with a train
the heart I don’t know about her
does not arrange in-house personal affairs
to your life atavism tata
on the dock the subway and give it to me.
locked furniture lost its mower
his biscuits read his round collars found his gloves his fichus
""What does it prove if you are so emotionally moved?""
there are no more birds to swallow in this wood.
short memory chavire massif oak heavy armour
columns
hexagonal pendulum
mirror accuracy
in her most beautiful dress she dances she's sixteen years old.
it was a long time ago that an angel passes now
(the bride's furniture used to make the fire immediately tata light
No corsets, no eyes).",fr_XX,en_XX,0
"lune
au pays de nuit constante,
ciel est un drap noir
et monde un lit.
ou lit est un monde.
drap noir est tiré par-dessus.
sommeil de jour
plus linge de lumière.
lune est loin.
étoiles sont loin.
obscurité rime avec antiquité.
et poussière noire.
plus ornement blanc.
d’où l’incendie pâle.
des apprentis changent de pays.
ils vont au pays où soleil
apparaît et disparaît.
horizon est l’étage.
ascenseur porte soleil
jusqu’à lui.
soleil allume le plateau.
horizon est un plateau
où montent des volumes
d’encre notamment.
au pays de jour antique,
la nuit dépend d’un arbre.
l’arbre solide.
chêne est source de lumière
dans le noir.
source est une sphère dans l’arbre.
elle brille comme courbe ronde.
lune est un soleil d’argent
dans l’arbre monde?
elle a un gris d’argent.
elle étonne les apprentis.
un rêve blanc.
fixée au chêne pour trois écus?
lumière inventée
dans un pays de nuit?
il y a un plein d’huile de pierre
en elle?
lampe ronde est claire.
qui est lampiste
ou responsable de lumière?
un apprenti met un drap noir
sur la lune.
ils emportent lune
au pays de la nuit officielle.
il y a un chêne au pays noir.
sève est sang blanc.
lampe nouvelle fait une liesse
nouvelle.
elle argente la campagne sombre.
et baigne les chambres.
d’où des rondes dans les clairières.
lune a son plein d’huile régulier.
+ un nettoyage hebdomadaire.
pour un feu argenté.
un feu gris intense.
chaque apprenti emporte dans la tombe
un quart de lune.
éclat de la sphère diminue peu à peu.
noir antique revient.
l’usage des lanternes aussi,
après le choc nocturne.
drap nocturne est l’habit du pays.
lune est sous la terre.
elle éclaire un enfer?
elle cause une liesse au pays de rien?
et la clandestinité de corps longs?
il y a une lumière sous la terre?
non.
un gris lance l’intense mélancolie
dans des corps d’oubli.
soleil est loin.
le gris a ses fêtes de mélancolie
dont le bruit
atteint le ciel.
vie souterraine est de la terre intense.
jungle où les branches coupent
bandes de lumière passionnantes.
des bandes grises ont une froideur
qui ouvre des yeux.
elles lancent
la vie dessous.
des corps sont debout.
calme de terre domine parfois.
mélancolie est tendue.
lune doit tendre la terre d’en haut.
on l’attache au ciel.
elle éclaire au loin de l’eau.
mélancolie est préférée en haut.
alors, elle descend.
d’après ‘la lune’","moon
in the country of constant night
sky is a black sheet
and world a bed.
or bed is a world.
black sheet laid over it.
day slumber
with linen of light.
moon is far.
stars are far.
darkness rhymes with pastness.
and black dust.
with white ornament.
the pale fire comes from there.
apprentices change countries.
they go to the country where sun
appears and disappears.
horizon is the shelf.
lift brings sun
up to it.
sun lights up the plateau.
horizon is a plateau
where volumes go up
of ink especially.
in the land of ancient day,
night hangs from a tree.
the solid tree.
oak is source of light
in the dark.
spring is a sphere in the tree.
it shines like a rounded curve.
is moon a silver sun
in the tree world?
it is silver-grey.
astonishes the ‘prentices.
a white dream.
fixed to the oak for three ha’pennies?
light invented
in a country of night?
there’s a full jar of oil
within it?
round lamp is bright.
who is lamplighter
or responsible for light?
an apprentice puts a black sheet
over the moon.
they carry moon off
to the land of official night.
there’s an oak-tree in the black country.
sap is white blood.
new light gives a new
cheeriness.
it silvers the gloomy countryside.
it bathes the bedrooms.
so there are dances in the clearings.
moon is filled with its regular oil.
+ a weekly clean-out.
to get a silver fire.
an intense grey fire.
each apprentice takes to his tomb
a quarter moon.
sphere’s brilliance fades bit by bit.
ancient black returns.
use of lanterns, too,
after the shock of night.
night sheet is the costume of the country.
moon is underground.
does it light up a hell?
cause rejoicing in the land of nothingness?
and hiding for long bodies?
is there a light under the earth?
no.
a grey starts intense melancholy
in the body of oblivion.
sun is far.
grey has its feasts of melancholy
whose noise
reaches the sky.
underground life is of the intense earth.
jungle where branches cut
exhilarating strips of light.
grey strips have a coldness
that opens the eyes.
they throw
life over it.
bodies are upright.
earth calm sometimes dominant.
melancholy is extended.
moon must hold the earth from above.
they attach it to the sky.
it lights the distant water.
melancholy is preferred up above.
so it comes down.
after ‘the moon’","moon
in the country of constant nightfall,
the sky is a black cloak
and world a bed.
or bed is a world.
black drape is pulled over.
daytime sleep
more light cloth.
The moon is far away.
stars are far away.
obscurity rhymes with antiquity.
and black dust.
more white ornament.
where the fire lights up.
apprentices from different countries.
they go to a country where the sun shines
appears and disappears.
horizon is the floor.
sunny elevator
to him.
The sun lights up the plateau.
horizon is a plateau
where volumes are increasing
of ink, in particular.
in the country of ancient times,
the night depends on a tree.
the solid tree.
oak is a source of light
in the dark.
source is a sphere in the tree.
it shines like a round curve.
moon is a silver sun
in the tree of the world?
she has a grey silver.
it surprises apprentices.
a white dream.
for three ECUs on oak?
invented light
in a country at night?
there is a full of stone oil
in it?
the round lamp is bright.
who is a lamp manufacturer
or responsible for light?
an apprentice wears a black cloak
on the moon.
they take the moon
in the country of the official night.
There is a oak in the black country.
sap is white blood.
new lamp makes a rope
new.
it pays for the dark campaign.
and rents the rooms.
from which rounds in the clearing.
moon is full of regular oil.
+ weekly cleaning.
for a silver lamp.
an intense grey light.
each apprentice brings into the tomb
a quarter of a moon.
sphere shade decreases gradually.
black antique returns.
the use of lanterns as well,
after the night shock.
night gown is the country’s habit.
moon is underground.
it lights up a hell?
it causes a bond to the country of nothing?
and the clandestinity of long bodies?
is there light under the earth?
no.
a grey triggers the level of melancholy
in the bodies of the forgotten.
The sun is far away.
the grey has its melancholy feasts
including noise
reaches the sky.
underground life is of the intense earth.
jungle where branches are cut
passionate bands of light.
grey bands have a cooler
which opens your eyes.
they launch
life below.
bodies are standing.
peace of the earth sometimes dominates.
Melancoli is tended.
The moon must bend the earth from above.
it is attached to the sky.
it lights away from the water.
Melancoli is preferred at the top.
then she goes down.
‘the moon’",fr_XX,en_XX,0
"sdf
les vieux, les grands enfants de la ville, rampent à plat ventre,
ils entrent dans leur maison de carton, sur les trottoirs,
et grouillent dans les recoins,
comme s’ils voulaient déjà se faire une place sous la terre.
ils se traînent sur une bouche de canalisation embuée
(c’est ainsi qu’ils renforcent leurs liens avec les profondeurs),
comme des poules géantes
qui couvent leurs fleurs, la moisissure.
les grands, les vieux enfants de la ville, rampent à plat ventre
et crachent dans le whitman de la rue
comme dans une soupe.
le dieu des canalisations les enveloppe
soigneusement dans un nuage, comme des anges.","no fixed address
the aged, the grown-up city children, crawl on their stomachs,
they enter their houses of cardboard, on the pavements,
and grub about in the corners,
as if already preparing their place underground.
they hang out on a blocked drainage exit
(which is how they strengthen their links with the depths),
like giant chickens
brooding over their flowers, putridity.
the grown-up, aged children of the city, crawl on their stomachs
and spit into the whitman of the street
as if into a soup.
the god of drainage systems envelops them
carefully in a cloud, like angels.","sdf
Old people, the city's oldest children, crawling on flat belly,
they enter their cardboard houses, on the sidewalks,
and creep in the crevices,
as if they already wanted to make a place underground.
they slip onto an embossed channel mouth
(in this way they strengthen their links with the depths),
as giant chickens
that cover their flowers, the moisture.
the big, old kids of the city, ramping on flat belly
and crammed into the street whitman
as in a soup.
the god of canals envelopes
carefully in a cloud, like angels.",fr_XX,en_XX,0
