original_poem,translated_poem,src_lang,tgt_lang,translated_by_TA,topic
"o fio de um cabelo
abandono a casa o horto o lugar à mesa
o casaco de que gostava, sobre o leito dobrado
esta verdade quase banal
que toda a vida fui
não abro a porta quando batem
(às vezes batiam só por engano)
não avalio o balanço das certezas
o que separa uma forma da outra
sempre me escapou
ontem começava a clarear
o ar frio que vinha dos campos
julguei-o de passagem e afinal
era um segredo que meu corpo
de uma vez por todas contava
ao meu corpo
mas quando tombei sobre a terra
perdido como o fio de um cabelo
(aqueles que primeiro caem
da cabeça de um rapaz
e por não serem notados
são mais perdidos ainda)
estavas junto de mim
lançaste ao fogo cidades
afogaste os exércitos
no vermelho mar da sua ira
hipotecaste terras tão preciosas
para estares junto de mim","a strand of hair
i abandon house and garden my place at the table
my favorite jacket, folded on the bed
this almost banal truth
that was me all my life
i don’t open the door when people knock
(sometimes they knocked by mistake)
i don’t tally up certainties
what separates one form from another
has always escaped me
yesterday the chilly air from the fields
began to be clearer
i thought it was just passing and it turned out
to be a secret that my body
was telling my body
once and for all
but when i fell to the ground
like a strand of hair
(one of those that fall early
from the head of a young man
and since no one notices
they’re all the more lost)
you were at my side
you set fire to cities
you drowned armies
in the red sea of your rage
you mortgaged precious lands
to be at my side",pt_XX,en_XX,"the thread of a hair
I abandon house garden place at the table
the coat I liked folded on the bed
this almost trivial truth
that all my life I've been
I don't open the door when they knock
(sometimes they knocked by mistake)
I don't evaluate the balance of certainties
what separates one form from another
has always eluded me
yesterday the light began to break
the cold air coming from the fields
I thought it was fleeting but in fact
it was a secret my body
told me once and for all
when I fell upon the earth
lost like the thread of a hair
(those that first fall
from a youth's head
and because they're unnoticed
are even more lost)
you were with me
you cast cities into fire
you drowned armies
in the red sea of their wrath
you mortgaged lands so precious
to be with me",4
"a lavadeira no tanque
bate roupa em pedra bem.
canta porque canta, e é triste
porque canta porque existe;
por isso é alegre também.
ora se eu alguma vez
pudesse fazer nos versos
o que a essa roupa ela fez,
eu perderia talvez
os meus destinos diversos.
há uma grande unidade
em, sem pensar nem razão,
e até cantando a metade,
bater roupa em realidade...
quem me lava o coração?","the washwoman beats the laundry
the washwoman beats the laundry
against the stone in the tank.
she sings because she sings and is sad
for she sings because she exists:
thus she is also happy.
if i could do in verses
what she does with laundry,
perhaps i would lose
my surfeit of fates.
ah, the tremendous unity
of beating laundry in reality,
singing songs in whole or in part
without any thought or reason!
but who will wash my heart?",pt_XX,en_XX,"The washerwoman by the trough
beats her clothes on stone so tough.
She sings for singing, and it's sad
as she sings because she's had;
and thus she finds joy in the deed.
Oh, if I could in my verse
do what she does to her clothes immerse,
I might lose my varied course,
and to unity return.
There's a grand unity,
in doing without a reason why,
and even while singing half,
beating clothes on that same shelf...
Who will cleanse my heart, my soul?",4
"que exíguo impulso se move e não esquecemos?
em que dádiva de chão dançamos com as mães cantantes,
onde estão as verdadeiras lágrimas, que as não vemos?
após anos de retiro, lumes brandos, luz de círios,
decorrido que foi o langor de sons pela geada, que
bem remanesce no contorno puído de cidades
– que graça confessamos ter decididamente tocado?
viemos de longe, de patíbulos que ninguém contará,
evocando pontos brumosos e vagas escolhas,
a custo apartados da dor de uma época a outra sobrepondo-se,
para ver enfim esquivas as mansardas donde partimos
– ainda a maioria sorria nos terreiros, tantos anos –
e perceber que o caminho se faz lançando mão
ao que dele continuamente resvala, inaudível – apagando-se.
o tempo vai sendo abolido, é o tempo da chama sobre a água,
e fomos amiúde derivando do maior para o mais justo,
imersos no ruído de fundo de uma escadaria,
pouco a pouco premindo a vida ao tamanho último,
a essa porção da biografia toda a vez mais nítida,
na qual só um recolhimento, tal a subir-se um vão de escada,
é a raiz do que em favor de nós fizemos,
a alegria que emana após o cativeiro.","what tiny, quivering impulse do we never quite forget?
what tiny, quivering impulse do we never quite forget?
on what exalted ground do we dance with the singing mothers?
where are the real tears that we don’t see?
after years of retreat, low fires, candlelight,
after the torpor of sounds covered by frost
and lingering in the fraying contours of cities
– what grace do we confess to having truly touched?
coming from afar, from gallows no one will ever tell,
with hazy junctures and choices written in our faces,
caught between the pain of one age and the next,
we come to see that the hovels we set out from
– where for years most people still smiled in the yards –
are all but lost and that we make our path by putting our hand
to what continually slips away, fading without a sound.
time is being abolished, it’s the time of fire over water,
and we’ve repeatedly moved from the universal to the exact,
immersed in the background noise of a staircase,
gradually compressing life to that ultimate size,
that portion of our ever more accurate biography
in which a simple withdrawal, like climbing a set of stairs,
is the essence of what we did in our own favor,
the happiness emerging in the wake of our captivity.",pt_XX,en_XX,"what scant impulse moves us, which we never forget?
on what gift of ground do we dance with the singing mothers,
where are the true tears we cannot see?
after years of retreat, soft lights, candles' glow,
since the languor of sounds by frost has passed,
what remains in the worn outline of cities
— what grace do we acknowledge having touched decidedly?
we come from afar, from gallows no one will recount,
evoking foggy dots and vague choices,
hardly parted from the pain of epochs overlying each other,
to finally see elusive the attics from which we departed
— even then the majority smiled in the courtyards, so many years —
and realize that the path is made by seizing
what continuously slips away, inaudible — fading.
time is being abolished, it is the time of flame on water,
and we often drifted from the greater to the more just,
immersed in the background noise of a staircase,
little by little pressing life to its last size,
to this portion of biography increasingly clear,
in which only a withdrawal, like ascending a stairwell,
is the root of what we did in our favor,
the joy that emanates after captivity.",4
"dizeis afinal – no que é um claro discurso, companheiro,
e chegada a hora de revelar nossos receios, e talvez mentir,
a hora em que acaso de ti me despeço, em que de
novo fruis, da colina, o largo frio do fim que se aproxima,
não sem antes lembrares ainda como o sol baqueava na erva
espezinhada, por onde em grupos, sob os plátanos, já
na voz cabia a tremura que vinha de ceira rente aos cabelos –
“que só nos convirá em sorte acenar, acenar sempre, e sem remorso,
pois que é no que perdido foi que fomos deixando que se viva.”
por que ousaremos então mentir, gentil companheiro?
valerá o esforço em simular, a nossos pobres seguidores,
que nas saudações mais não estamos do que a compensar o nosso medo?
mentiremos sim, mas por razões distintas, algumas as referiste,
outras mercê de não nos vermos vacilar numa partida mais.
justamente, tal o faz o cheiro acre das primeiras chuvas sobre o verão,
crescemos de alma em alma que em nós passa e cauciona
a linha que da vida fomos consentindo que se faça.
e no fim, que pode ser o desta hora em que me chamas, no
largo frio de outro ano aproximando-se, outra hora no alto da colina,
cabe-nos, do que prestámos, ser restituídos na lembrança.","finally you say – in what’s obviously a discourse, my friend
finally you say – in what’s obviously a discourse, my friend,
uttered at the hour of revealing our fears, and perhaps lying,
the hour when i happen to be saying farewell and you can
once more enjoy, on the hill, the vast cold of the approaching end,
not without first remembering how the sun struck the trampled
grass where in groups, under the plane trees, we could feel
in our voices the shiver from ceira that blew through our hair –
“all we can do is wave farewell, wave always and without regret,
since it’s through what we lose that we let life go on living.”
so why will we dare to lie, gentle friend?
what’s the use of pretending, to those who will follow us,
that our salutations are but a way to compensate our fear?
we will lie, yes, but for different reasons, some that you mentioned,
others born of our loathing to vacillate in another departure.
like summer under the acrid smell of the first rains,
we grow with changes occurring in our soul, securing
the line we’ve allowed our life to trace.
and in the end, perhaps in this hour when you call me, or in the
vast cold of another year approaching, another hour on top of the hill,
we’ll have – for all we’ve given – our recompense in memory.",pt_XX,en_XX,"you say at last – in clear speech, my friend,
and when the time to reveal our fears comes, and perhaps to lie,
the time when I bid you a chance farewell, when you once more
enjoy the wide coldness of the hill at the encroaching end,
but not before reminding how the sun drooped on the trampled grass
where in groups, beneath the plane trees, already
voices trembled, as from a chill close to the hair –
""that only waving will serve us, always waving, without regret,
since it's in what was lost that we've been letting life be lived.""
why then should we dare to lie, gentle friend?
is the effort worthwhile in pretending, to our poor followers,
that in our greetings we're but compensating for our fear?
we'll lie indeed, but for different reasons, some you've mentioned,
others by not showing weakness in our parting.
just as the sharp scent of first rains on summer
grows within soul by soul that passes and confirms
the line that we've allowed life to draw.
and in the end, which may be this hour you call, in
the wide cold of another year approaching, another time on the hill's height,
it falls to us, from what we've given, to be returned in memory.",4
"elegia
o futuro não o guardamos em casa, perde-se
disperso entre a meia-noite e a folhagem. nu,
exposto como uma província além da trincheira
das janelas, fala-nos do ouro puído destes dias,
desse sentido ganho nas coisas que se perdem,
salivando a passagem das horas, sustendo
contra a dor o dreno das nossas vidas.
lembramos os pequenos oráculos da infância,
os sonhos que são memórias já na sua escura
torre do tombo, ao intimarmos, no sossego
povoado, a evasiva alma do passado. buscamos
no ontem uma recompensa, sabendo que não
há outro homem para o homem deste lugar,
sangue mais limpo correndo pela carne
de quem nasce, a sua genuína morte pastoral.
eis chegado o tempo da ceifa, dos presságios
de longe trazidos no rumor das trompas outonais.
as palavras, os trémulos ramos das palavras,
pressentem o espírito da revelação em cada coisa.
assim choramos a festa última dos instantes,
dias de uma neblina fiel cobrem-nos os passos,
obscurecendo essas mãos que gostariam de subir
ao céu como escadas. se conhecesse a linguagem
fácil do tributo cantaria a queda adivinhada
a tempo de o poema terminar na forma de uma elegia.","elegy
our homes don’t lodge the future. it gets lost
among the trees and midnight. naked
like a sprawling province past the trench
of windows, it speaks of today’s tarnished
gold and of the meaning won in things lost,
which, chewing on time’s passage, hold up
against grief the conduit of our lives.
we remember childhood’s tiny oracles,
the dreams filed away in memory’s dark
archives, when in the buzzing silence
we plumb the past’s evasive soul. we seek
in yesterday a compensation, knowing
there’s no other man for the man of this place,
no cleaner blood flowing in the flesh
of the just born, his true pastoral death.
it’s time for the harvest, for the far-off
portents heralded by autumn’s trumpets.
words, the trembling branches of words,
sense the spirit of revelation in each thing.
we weep the final feast of these moments,
days of a faithful fog cover our steps,
veiling these hands that long to climb
to heaven like stairs. if i knew the simple
language of tribute, i’d sing the foreseeable fall
in time for the poem to end as an elegy.",pt_XX,en_XX,"elegy
the future we don't keep at home, it's lost
scattered 'twixt midnight and the foliage. bare,
exposed like a province beyond the trench
of windows, it speaks of the faded gold of these days,
of meaning gained in things that are lost,
slathering the passage of hours, bracing
against the pain the drain of our lives.
we remember the small oracles of childhood,
the dreams that are memories already in their dark
tower of tombs, as we intimate, in the populated tranquility,
the elusive soul of the past. we seek
in yesterday a reward, knowing there's no
other man for the man of this place,
purer blood running through the flesh
of those born, their genuine pastoral death.
now is the time of the harvest, of omens
brought from afar in the rustling of autumnal horns.
the words, the trembling branches of words,
they sense the spirit of revelation in each thing.
thus we weep the last festival of moments,
days of faithful mist cover our steps,
darkening those hands that would climb to the sky
like ladders. if i knew the easy language
of tribute, i'd sing the foreseen fall
in time for the poem to end in the form of an elegy.",4
"missa de aniversário
há um ano que os teus gestos andam
ausentes da nossa freguesia
tu que eras deste campos
onde de novo a seara amadurece
donde és hoje?
que nome novo tens?
haverá mais singular fim de semana
do que um sábado assim que nunca mais tem fim?
que ocupação é agora a tua
que tens todo o tempo livre à tua frente?
que passos te levarão atrás
do arrulhar da pomba em nossos céus?
que te acontece que não mais fizeste anos
embora a mesa posta continue à tua espera
e lá fora na estrada as amoreiras tenham outra vez florido?
era esta a voz dele assim é que falava
dizem agora as giestas desta
sua terra
que o viram passar nos caminhos da infância
junto ao primeiro voo das perdizes
já só na gravata te levamos morto àqueles caminhos
onde deixaste a marca dos teus pés
apenas na gravata. a tua morte
deixou de nos vestir completamente
no verão em que partiste bem me lembro
pensei coisas profundas
é de novo verão. cada vez tens menos lugar
neste canto de nós donde anualmente
te havemos piedosamente de desenterrar
até à morte da morte","anniversary mass
it’s been one year since your steps
last walked in our parish
where do you who belonged to these fields
whose wheat is again turning ripe
belong now?
what’s your new name?
can there be a more unusual weekend
than a saturday like this one that never ends?
how do you fill your time
now that all the time ahead of you is free?
what sort of steps might take you
behind the cooing of a dove in our skies?
why have you never again had a birthday
even though the table is set and waiting for you
and the mulberry trees along the road are in bloom again?
that’s what his voice was like that’s how he talked
says the yellow-flowered broom that grows here
and that saw him walk on the pathways of childhood
next to his first flight of partridges
now only in our neckties do we take you who are dead
to those paths where you left the mark of your feet
only in our neckties. your death
has stopped dressing us up completely
the summer you departed i clearly remember
thinking profound things
it’s summer again. you have ever less place
in this corner of us where every year
we will piously unearth you
until the death of your death",pt_XX,en_XX,"Anniversary Mass

It's been a year since your gestures have wandered
Absent from our parish
You who were of these fields
Where the grain ripens anew
Where have you gone?
What new name do you bear?
Is there a more singular weekend
Than a Saturday that never ends?
What occupation is now yours
With all the free time before you?
What steps will guide you back
To the coo of the dove in our skies?
What befell you that you no longer age
Though the set table still awaits you
And beyond, on the road, the mulberries bloom once more?
This was his voice, thus he spoke
The broom plants of this
His land now say
Who saw him pass through the paths of childhood
Near the first flight of partridges
We carry you dead only in the necktie to those paths
Where you left the imprint of your feet
Just in the necktie, your death
No longer clothes us entirely
In the summer you departed I well remember
I thought profound things
It's summer once more. You occupy less space
In this corner of us from where annually
We devoutly exhume you
Until the death of death",4
"a mão no arado
feliz aquele que administra sabiamente
a tristeza e aprende a reparti-la pelos dias
podem passar os meses e os anos nunca lhe faltará
oh! como é triste envelhecer à porta
entretecer nas mãos um coração tardio
oh! como é triste arriscar em humanos regressos
o equilíbrio azul das extremas manhãs do verão
ao longo do mar transbordante de nós
no demorado adeus da nossa condição
é triste no jardim a solidão do sol
vê-lo desde o rumor e as casas da cidade
até uma vaga promessa de rio
e a pequenina vida que se concede às unhas
mais triste é termos de nascer e morrer
e haver árvores ao fim da rua
é triste ir pela vida como quem
regressa e entrar humildemente por engano pela morte dentro
é triste no outono concluir
que era o verão a única estação
passou o solidário vento e não o conhecemos
e não soubemos ir até ao fundo da verdura
como rios que sabem onde encontrar o mar
e com que pontes com que ruas com que gentes com que montes conviver
através de palavras de uma água para sempre dita
mas o mais triste é recordar os gestos de amanhã
triste é comprar castanhas depois da tourada
entre o fumo e o domingo na tarde de novembro
e ter como futuro o asfalto e muita gente
e atrás a vida sem nenhuma infância
revendo tudo isto algum tempo depois
a tarde morre pelos dias fora
é muito triste andar por entre deus ausente
mas, ó poeta, administra a tristeza sabiamente","hand to the plow
happy the man who manages sadness wisely
and learns to divide it among the days
though months and years pass it will never leave him
how sad it is to grow old on the doorstep
while weaving in our hands a belated heart
how sad to risk against human returns
the blue equilibrium of summer’s sheer mornings
by the ocean that overflows with us
in the long farewell of our condition
it is sad to see in the garden the sun’s solitude
reaching from the city’s houses and din
to a distant hint of river
and the meager life meted out to us
it is sadder to have to be born and to die
and to have trees at the end of the street
it is sad to go through life as if
returning and to enter humbly into death by mistake
it is sad in autumn to conclude that summer
was the only season
the wind passed by in solidarity and we didn’t see it
and we didn’t know to go to the green depths
like rivers that know where to find the sea
and know which bridges which streets which people which hills to talk with
through the words of a forever uttered water
but what’s saddest is to remember tomorrow’s acts
it is sad to buy chestnuts after the bullfight
between sunday and the smoke on a november afternoon
and to have asphalt and many people for your future
and behind you a life with no childhood
looking back at all of this some time later
day by day the afternoon dies
it is very sad to walk among god and be absent
but manage, poet, your sadness wisely",pt_XX,en_XX,"hand upon the plow
blessed is he who wisely manages
tragedy and learns to spread it through the days
though months and years may pass, he'll never be without
oh, how sad to age at the threshold
weaving in hand a heart too late
oh, how sad to risk in human returns
the blue balance of extreme summer mornings
along the overflowing sea of us
in the prolonged farewell of our condition
it's sad in the garden the solitude of the sun
to see it from the murmur and the city houses
to a vague promise of a river
and the tiny life conceded to the nails
sadder yet to be born and to die
with trees standing at the end of the street
it's sad to tread life as one
to mistakenly enter humbly into death
it's sad in autumn to conclude
that summer was the only season
the supportive wind has passed and we did not know it
and we did not go deep into the verdure
like rivers that know where to find the sea
and with which bridges streets people and mountains to coexist
through words of water forever spoken
but the saddest is to recall the gestures of tomorrow
sad to buy chestnuts after the bullfight
amidst the smoke and Sunday in the November afternoon
and to have as future the asphalt and many people
and behind life without childhood
reviewing all this some time later
the afternoon dies through the days
it's very sad to wander amidst absent god
but, oh poet, wisely manage the sadness",4
"e tudo era possível
na minha juventude antes de ter saído
da casa de meus pais disposto a viajar
eu conhecia já o rebentar do mar
das páginas dos livros que já tinha lido
chegava o mês de maio era tudo florido
o rolo das manhãs punha-se a circular
e era só ouvir o sonhador falar
da vida como se ela houvesse acontecido
e tudo se passava numa outra vida
e havia para as coisas sempre uma saída
quando foi isso? eu próprio não o sei dizer
só sei que tinha o poder duma criança
entre as coisas e mim havia vizinhança
e tudo era possível era só querer","and everything was possible
when i was still young before i left home
ready to travel around in the world
i already knew about the waves’ breaking
from the pages of all the books i’d read
when may rolled around everything was flowers
the morning turtledove flew here flew there
and to hear the dreamer just speak of life
was like it having actually happened
everything took place in another life
and there was always a way out when needed
when was all this? not even i can say
i know only that i had a child’s power
all things were close to me and everything
was possible i only had to want it",pt_XX,en_XX,"and everything was possible
in my youth before i'd left
the home of my parents ready to travel
i already knew the sea's breaking
from the pages of books i had read
may came round, all was blooming
the morning roll began to turn
and it was only to listen to the dreamer speak
of life as if it had already occurred
and everything happened in another life
and there was always an exit for things
when was this? i can't say myself
i only know that i had the power of a child
between things and me there was closeness
and everything was possible, it was only to wish",4
