original_poem,translated_poem,src_lang,tgt_lang,translated_by_TA,topic
"uma forma de me despedir
há o mar há a mulher
quer um quer o outro me chegam em acessíveis baías
abertas talvez no adro amplo das tardes dos domingos
oiço chamar mas não de uma forma qualquer
chamar mas de uma certa maneira
talvez um apelo ou uma presença ou um sofrimento
ora eu que no fundo
apesar das muitas palavras vindas nas muitas páginas dos dicionários
bem vistas as coisas disponho somente de duas palavras
desde a primeira manhã do mundo
para nomear só duas coisas
apenas preciso de as atribuir
não sei se gosto mais do mar
se gosto mais da mulher
sei que gosto do mar sei que gosto da mulher
e quando digo o mar a mulher
não digo mar ou mulher só por dizer
ao dizer o mar a mulher
há penso eu um certo tom na minha voz sinto um certo travo na boca
que mostram que mais que palavras usadas para falar
dizer como eu digo a mulher o mar
mar mulher assim ditos
são uma maneira talvez de gostar
e a consciência de que se gosta
e um prazer em o dizer
um gosto afinal em gostar
enfim o mar a mulher
pode num dos casos ser a/mar a mulher
mera forma talvez de uniformizar o artigo
definido do singular
há ondas no mar
o mar rebenta em ondas espraiadas nos compridos cabelos da mulher
que ela faz ondular melhor de tarde em tarde
no mês de setembro nas marés vivas
o melhor da mulher talvez o olhar
é para mim o mar da mulher
e à mulher que um só dia encontro na vida
de passagem um simples momento num sítio qualquer
talvez a muitos quilómetros do mar
mas mulher que não mais consigo esquecer
mesmo imerso na dor ou submerso em cuidados
a essa mulher qualquer
eu chamo mulher do mar
nos fins de setembro quando eu partir
de uma cidade seja ela qual for
quando eu pressentir que alguém morre
que alguma coisa fica para sempre nos dias
e ou nuns olhos ou numa água
num pouco de água ou em muita água
onda do mar lágrima ou brilho do olhar
eu recear seriamente vir-me a submergir
direi alto ou baixo conforme puder
com a boca toda ou já a custar-me a engolir
as palavras mar ou mulher
com certo vagar e cada vez mais devagar
mulher mar
depois quase já só a pensar
o mar a mulher
não sei mas será
talvez mais que outra coisa qualquer
uma forma de me despedir","my way of saying farewell
there’s ocean there’s woman
and both of them reach me in amiable bays
opening up for example in the churchyard of sunday afternoons
i hear them call but not just any old way
they call in a particular manner
perhaps as a petition or a presence or a suffering
the fact is that basically
and despite all the words in all the pages of dictionaries
i really only have since the world’s first morning
two words at my disposal
to name just two things
whatever two i choose
i’m not sure which i like more
whether ocean or woman
i know i like ocean i know i like woman
and when i say ocean when i say woman
i don’t say ocean or woman just to say it
when i say ocean when i say woman
there’s a certain tone in my voice a certain taste in my mouth
which seem to me to clearly show that ocean and woman
as i say ocean as i say woman
pronounced ocean pronounced woman
are not just words used for speaking
but are perhaps a way of liking
and the awareness of liking
and a pleasure in saying so
a liking of the fact of liking
woman-ocean is after all
close to womb-emotion
if we forget the letters
and obey the sense of sound
there are waves in the ocean
the ocean breaks in waves that spread in the woman’s long hair
and she makes it wave better now and then
in the month of september when the tide is highest
probably the best part of woman namely her gaze
is for me the woman’s ocean
and the woman i meet only once in life
crossing her path for just a moment wherever it may be
perhaps many miles from the ocean
but a woman i can’t ever forget
no matter how awash i am in sorrows or worries
is the woman whatever woman
i call the woman from the ocean
in that late september when i depart
from a city whatever city
when i can feel that someone is dying
that something lingers forever in the days
and i sincerely fear i might sink
into some eyes or into water
into a little or a lot of water
an ocean wave a tear or a glassy gaze
i’ll say loudly or softly however i’m able
with wide-open mouth or already choking
the words ocean or woman
slowly and ever slower almost in slow motion
woman ocean
then almost as just a vague notion
ocean woman
i don’t know but maybe it will be
more than anything else
my way of saying farewell",pt_XX,en_XX,"my way of saying goodbye
there's ocean there's woman
and both of them reach me in friendly bays
opening up for instance in the churchyard of sunday afternoons
i hear them call but not just any old way
they call in a particular manner
perhaps as a plea or a presence or a pain
the fact is that fundamentally
and despite all the words in all the pages of dictionaries
i really only have since the world's first dawn
two words at my disposal
to name just two things
whatever two i choose
i'm not sure which i cherish more
whether ocean or woman
i know i cherish ocean i know i cherish woman
and when i say ocean when i say woman
i don't say ocean or woman just to say it
when i say ocean when i say woman
there's a certain tone in my voice a certain taste in my mouth
which seem to me to clearly show that ocean and woman
as i say ocean as i say woman
pronounced ocean pronounced woman
are not just words used for speaking
but are perhaps a way of cherishing
and the awareness of cherishing
and a pleasure in saying so
a cherishing of the fact of cherishing
woman-ocean is after all
close to womb-emotion
if we forget the letters
and obey the sense of sound
there are waves in the ocean
the ocean breaks in waves that spread in the woman's long hair
and she makes it wave better now and then
in the month of september when the tide is highest
probably the best part of woman namely her gaze
is for me the woman's ocean
and the woman i meet only once in life
crossing her path for just a moment wherever it may be
perhaps many miles from the ocean
but a woman i can't ever forget
no matter how submerged i am in sorrows or worries
is the woman whatever woman
i call the woman from the ocean
in that late september when i depart
from a city whatever city
when i can feel that someone is dying
that something lingers forever in the days
and i sincerely fear i might sink
into some eyes or into water
into a little or a lot of water
an ocean wave a tear or a glassy gaze
i'll say loudly or softly however i'm able
with wide-open mouth or already choking
the words ocean or woman
slowly and ever slower almost in slow motion
woman ocean
then almost as just a vague notion
ocean woman
i don't know but maybe it will be
more than anything else
my way of saying goodbye",3
"o último poeta romano
enquanto rebentam as ondas junto às praias,
e há troar de canhões além dos muros da cidade,
queria o direito a uma hora indulgente e fugaz,
num espaço inviolável,
guardado pelas asas da musa e os provérbios da sibila
como o actor recolhido aos bastidores do teatro.
esquecidos os sonhos da cabeça adornada por folhas de louro
ou os canapés onde se alongam as últimas almas epicuristas,
num sossego adverbial, em que nada mais ouvisse,
tudo ele pudesse guardar, no âmbito da sua arte,
com a leveza que deixa a pluma ao roçar o papel.
purificada, ao salivá-la como hóstia sob a língua,
cada palavra tivesse a autoridade da grinalda
ou do selo real
e estreitasse numa sebe o mundo que conheceu,
enquanto tudo se gentiliza e desmorona à sua volta.
nesse trabalho de falcoaria sobre o tempo ido,
escrever lembra-lhe os cortes feitos pela navalha
do prisioneiro na parede da cela, contando os dias,
certo de esperá-lo o nó corrediço da forca
ou o tiro disparado de frente sobre o crânio.
sabendo todo o seu trabalho entregue nessa hora
à dispersão,
deseja salvar, consoladora e suficiente,
palavra sua na face de uma estela futura.","the last roman poet
as waves break over the beaches
and cannons boom beyond the city walls,
he asks for one fleeting, indulgent hour
in an inviolable place,
shielded by the muse’s wings and the sibyl’s words
like an actor gone backstage.
forgetting the dream of a laurel-crowned head
and the couches that cradle the last epicurean souls,
he longs only for adverbial quiet – not a sound –
in which all might be preserved, in the ambit of his art,
with the lightness of a quill passing over paper.
that each word, purified, rolling on the tongue
like a host, might have the authority of a garland
or royal seal
and press the world he knew into a hedge
as everything degenerates and collapses around him.
in this work of falconry applied to time past,
writing reminds him of the notches the prisoner
cuts in the wall of his cell to count the days,
knowing what will come: the slipknot of the gallows
or a shot fired straight into his brain.
aware that all his work will now suffer
dispersion,
he wants to save, consoling and sufficient,
a word on the face of a future stele.",pt_XX,en_XX,"the last roman poet
as waves crash upon the shore and cannons roar beyond the city's walls,
he craves a fleeting, indulgent hour,
in an inviolable space,
guarded by the muse's wings and the sibyl's sayings
like an actor retiring to the backstage of the theatre.
forgotten the dreams of heads crowned with laurel leaves
or the couches where epicurean souls languish,
in tranquil adverbial solitude, where no other sound intrudes,
he would gather all within the realm of his art,
with the lightness that a feather exerts upon the paper.
each word, purified and sacred, like a host upon the tongue,
should carry the authority of a garland
or the royal seal,
and enclose the world he knew within a hedge,
while all around gentleness and ruin abound.
in this falconry of the past,
writing reminds him of the prisoner's blade scoring the cell's wall,
counting the days,
knowing the noose or the frontal shot awaits.
aware that all his labor is now scattered,
he longs to preserve, a consoling and sufficient word,
upon the face of a future stele.",3
"de temporum fine comoedia
1
assomas no arco da porta com teu rosto de cera
e seguras o colar num gesto extravagante,
defendida de mais uma piada suburbana.
“espera-te o museu”, ia dizer, numa derrisão fatal.
a palavra é recolher sem perda de tempo
e tudo receber com uma última aclamação.
rufam tambores, querida, como nos tempos
antigos, ébrios de sangue, chamando-nos
à cerimónia sacrificial. o rosto que nos promete
o televisor, vê, tem algo de ancestral e terrífico
quando o vemos a meio da fatídica arenga.
mutismo. em casa não temos almofada de joelhos
e a segurança, já o sabemos, é o teu sonho preferido,
se te debruças para os toldos e a linha da água.
vais até à varanda como testemunha ocular dos fogos
que se acendem, inelutavelmente, na distância.
vejo como o medo em ti cinzela uma estátua
de olhar velado e face muda, inexpressiva,
recolhida, como estás, dentro de ti,
ao esconderijo mais abstruso de todos.
2
chegados um ao outro, felizes se ouvimos
um ruído clamoroso na distância, olhamo-nos,
pois cumprida é a promessa, o sacramento
de ordem com que fomos investidos pelo tempo.
que fazer, perguntas. içar o velame
ou escavar em casa a galeria de mina,
desertando os dois, por um fuso horário,
na descida para os antípodas do mundo?
tomar um revulsivo ou deixarmo-nos ir,
movidos pelo vento, sob a aba dos telhados?
nada poderás levar, num último arrebatamento.
tu mesma serás presa, na tarde momentosa,
de quando foi desejo teu e perdes sem apelo
sob a lei da plebe ou uma qualquer ordem
pretoriana, sentenciada ao motivo bíblico
e à resignação de uma existência romana.
hoje tens só a imitação do teu rosto
no espelho. e nada mais te cumpre defender
à hora de sublevarem-se as obras de deus
(além do olhar, vê, tens ainda o mundo inteiro . . .).","de temporum fine comoedia
1
you loom in the doorway with your waxen face,
flamboyantly clutching your necklace
like a shield against one more suburban joke.
“rehearsing for the museum?” i thought to shoot.
the order of the day is to retreat in haste
and to salute everything with a last hurrah.
drums are rolling, dear, as in olden times, drunk
with blood, calling us to the sacrificial rite.
there’s something ancestral and terrifying
about the face the television promises, look,
in the middle of its ominous harangue.
no comment. we don’t have kneeling pads
at home, and if you lean out to the umbrellas along
the shore, we know security is your preferred dream.
you go to the balcony as an eyewitness of the fires
inevitably blazing in the distance.
i see how fear chisels in you a statue
with veiled gaze and a speechless,
expressionless face, withdrawn into you,
the most recondite hiding place of all.
2
together now, happy if we hear a racket
in the distance, we look at each other,
for the promise is fulfilled, the ritual
sacrament conferred on us by time.
what should we do, you ask. hoist the sails
or dig a mine shaft in the floor, deserting
who we are as we descend time’s tunnel
to reach the world’s antipodes?
swallow a pill or let ourselves go,
pushed by the wind, beneath the eaves?
you cannot, in a final rapture, take anything.
you’ll be the prey, on that crucial day,
of all you desired and lose, without appeal,
under mob rule or some praetorian
order, sentenced to biblical logic
and the resignation of roman existence.
all you have today is your face’s imitation
in the mirror. and that’s all you'll have to defend
in the hour when god's creation rebels (and beyond
your gaze – look! – there's still the whole world . . .).",pt_XX,en_XX,"The End of Time's Comedy
1
You loom in the doorway with your waxen face,
Flaunting your necklace like a shield against another suburban jest.
""Rehearsing for the museum?"" I thought to quip.
The order of the day is to retreat in haste
And to salute everything with a last hurrah.
Drums are rolling, dear, as in olden times, drunk
With blood, calling us to the sacrificial rite.
There's something ancestral and terrifying
About the visage the television promises, look,
In the midst of its ominous harangue.
No comment. We don't have kneeling pads at home,
And if you lean out to the umbrellas along
The shore, we know security is your preferred dream.
You go to the balcony as an eyewitness to the fires
Inevitably blazing in the distance.
I see how fear carves in you a statue
With veiled gaze and a speechless, expressionless face, withdrawn into you,
The most recondite hiding place of all.
2
Together now, happy if we hear a racket
In the distance, we look at each other,
For the promise is fulfilled, the ritual
Sacrament bestowed upon us by time.
What should we do, you ask. Hoist the sails
Or dig a mine shaft in the floor, abandoning
Who we are as we descend time's tunnel
To reach the world's antipodes?
Swallow a pill or let ourselves go,
Pushed by the wind, beneath the eaves?
You cannot, in a final rapture, take anything.
You'll be the prey, on that crucial day,
Of all you desired and lose, without appeal,
Under mob rule or some praetorian
Order, sentenced to biblical logic
And the resignation of Roman existence.
All you have today is your face's imitation
In the mirror. And that's all you'll have to defend
In the hour when God's creation rebels (and beyond
Your gaze – look! – there's still the whole world . . .).",3
"oh as casas as casas as casas
oh as casas as casas as casas
as casas nascem vivem e morrem
enquanto vivas distinguem-se umas das outras
distinguem-se designadamente pelo cheiro
variam até de sala pra sala
as casas que eu fazia em pequeno
onde estarei eu hoje em pequeno?
onde estarei aliás eu dos versos daqui a pouco?
terei eu casa onde reter tudo isto
ou serei sempre somente esta instabilidade?
as casas essas parecem estáveis
mas são tão frágeis as pobres casas
oh as casas as casas as casas
mudas testemunhas da vida
elas morrem não só ao ser demolidas
elas morrem com a morte das pessoas
as casas de fora olham-nos pelas janelas
não sabem nada de casas os construtores
os senhorios os procuradores
os ricos vivem nos seus palácios
mas a casa dos pobres é todo o mundo
os pobres sim têm o conhecimento das casas
os pobres esses conhecem tudo
eu amei as casas os recantos das casas
visitei casas apalpei casas
só as casas explicam que exista
uma palavra como intimidade
sem casas não haveria ruas
as ruas onde passamos pelos outros
mas passamos principalmente por nós
na casa nasci e hei-de morrer
na casa sofri convivi amei
na casa atravessei as estações
respirei – ó vida simples problema de respiração
oh as casas as casas as casas","oh houses houses houses
oh houses houses houses
houses are born and live and die
while alive they stand out from each other
they stand out namely by their smell
they differ even from room to room
ah the houses i built in my childhood
where might i be today in my childhood?
where might i be in a little while from these verses?
will i have a house to store all of this in
or will i always be just this instability?
unlike me houses seem stable
but they’re so fragile poor houses
oh houses houses houses
silent witnesses of life
they die not only when demolished
they die with the death of people
houses look at us through their windows
builders landlords and real estate agents
know nothing about houses
rich people have their palaces
but the house of the poor is the whole world
it’s the poor who know about houses
the poor know everything
i loved houses their nooks and corners
i visited houses i fondled houses
only houses can explain
why a word like intimacy exists
without houses there would be no streets
the streets where we cross paths with others
and especially with ourselves
in a house i was born and i’ll die
in a house i suffered i lived with others i loved
in a house i went through the seasons
i breathed – o life simple problem of respiration
oh houses houses houses",pt_XX,en_XX,"Oh, the houses, the houses, the houses
Oh, the houses, the houses, the houses
The houses are born, live, and die
While alive, they distinguish themselves
Distinguish themselves notably by scent
Vary even from room to room
The houses I made as a child
Where am I now as a child?
Where will I be henceforth in the verses soon to come?
Will I have a house to retain all this
Or will I always be this instability?
The houses, these appear stable
But are so frail, the poor houses
Oh, the houses, the houses, the houses
Mute witnesses to life
They die not only when demolished
They die with the death of the people
The houses from outside watch us through the windows
Builders, landlords, procurers know nothing of houses
The rich live in their palaces
But the poor's house is the whole world
The poor, they know everything about houses
The poor, they know everything
I loved the houses, the nooks of the houses
Visited houses, touched houses
Only houses explain why there exists
A word like intimacy
Without houses, there would be no streets
The streets where we pass others
But we pass ourselves mainly
In the house I was born and will die
In the house, I suffered, lived, loved
In the house, I crossed the seasons
Breathed – oh simple life, a problem of breathing
Oh, the houses, the houses, the houses",3
"you are welcome to elsinore
entre nós e as palavras há metal fundente
entre nós e as palavras há hélices que andam
e podem dar-nos morte violar-nos tirar
do mais fundo de nós o mais útil segredo
entre nós e as palavras há perfis ardentes
espaços cheios de gente de costas
altas flores venenosas portas por abrir
e escadas e ponteiros e crianças sentadas
à espera do seu tempo e do seu precipício
ao longo da muralha que habitamos
há palavras de vida há palavras de morte
há palavras imensas, que esperam por nós
e outras, frágeis, que deixaram de esperar
há palavras acesas como barcos
e há palavras homens, palavras que guardam
o seu segredo e a sua posição
entre nós e as palavras, surdamente,
as mãos e as paredes de elsinore
e há palavras nocturnas palavras gemidos
palavras que nos sobem ilegíveis à boca
palavras diamantes palavras nunca escritas
palavras impossíveis de escrever
por não termos connosco cordas de violinos
nem todo o sangue do mundo nem todo o amplexo do ar
e os braços dos amantes escrevem muito alto
muito além do azul onde oxidados morrem
palavras maternais só sombra só soluço
só espasmos só amor só solidão desfeita
entre nós e as palavras, os emparedados
e entre nós e as palavras, o nosso dever falar","you are welcome to elsinore
between us and words there’s molten metal
between us and words there are spinning propellers
that can kill us ravish us wrench
from our inner depths the most worthwhile secret
between us and words there are burning profiles
spaces full of people with their backs turned
tall poisonous flowers closed doors
and stairs and ticking clocks and seated children
waiting for their time and their precipice
along the walls in which we live
there are words of life words of death
there are vast words that wait for us
and other, fragile words that have stopped waiting
there are words lit up like boats
and there are words that are men, words that conceal
their secret and their position
between us and words, without a sound,
the hands and walls of elsinore
and there are words of night words that are moans
illegible words that rise to our lips
diamond words unwritten words
words that can’t be written
because here we don’t have any violin strings
we don’t have all the world’s blood or the air’s whole embrace
and the arms of lovers write high overhead
far beyond the blue where they rust and die
maternal words just shadow just sobbing
just spasms just love just solitude’s dissolution
between us and words those who are walled in,
and between us and words our duty to speak",pt_XX,en_XX,"you are welcome to elsinore
betwixt us and words, molten metal flows
betwixt us and words, gears grind ceaselessly
they can slay us, defile us, extort
the deepest, most useful secret from our core
betwixt us and words, flickering profiles loom
spaces crowded with backs turned
deadly high blooms, doors sealed tight
and staircases and dials and children seated
awaiting their time and their precipice
along the wall we inhabit
words of life, words of death
words vast, awaiting our touch
and others, fragile, long ceased to wait
words ablaze like boats
and words that are men, guarding
their secret and stance
betwixt us and words, silently,
the walls and hands of elsinore
and words nocturnal, words moans
words rise unreadable in our mouths
words diamonds, words never penned
words impossible to write
for we lack violins' strings
all the world's blood, air's embrace
lovers' arms write far above
oxidized, blue's end they perish
maternal words, shadow alone, sighs
spasms, love alone, solitude undone
betwixt us and words, the walled-in
and betwixt us and words, our duty to speak",3
