original_poem,translated_poem,src_lang,tgt_lang,translated_by_TA,topic
"pedaços de vinil com lama
devia ser o disco mais ouvido:
a quinta sinfonia, numa gravação
de klemperer. as manhãs
e as tardes auguravam um futuro
melhor, prendados costumes
que depressa perdi. já então olhava
para a taberna da ana,
enchendo a janela do meu quarto.
tinha medo da sombra, do silêncio,
adivinhando em cada passo o monstro
que me habitava. e lia, para não pensar,
desacreditados escritores franceses.
um dia, de tanto o amar,
peguei no disco e quebrei-o
em pequenos pedaços de vinil
– para doerem mais, melhor.
mantive, não sei bem porquê,
a dura capa de cartão,
essa fúnebre alegoria da infância.
e o que sobrou do disco foi parar
ao ribeiro junto à casa dos meus pais.
mais tarde, o ribeiro com hortas
de domingo à volta foi sufocado pelo terror
de um aldeamento, versão provinciana
de condomínio fechado, num mundo
em que são cada vez mais as portas.
beethoven, esse, quase deixou
de me comover, soterrado como as rãs
pelas mãos invisíveis de quem mata.
o que me comove, passado tanto
tempo, é perceber que fiz a esse disco
o mesmo que faço e volto a fazer
aos corpos que julgo amar:
parti-los, muito devagar, para
que doam sempre um pouco mais.","grimy bits of vinyl
it must have been the most-played record:
the fifth symphony, conducted
by klemperer. the mornings
and afternoons promised a better
future, virtuous habits,
which i soon forgot. i was already eyeing
ana’s tavern,
which filled my bedroom window.
i feared the shadows, silence,
feeling in each footstep the monster
inside me. and i read, so as not to think,
discredited french writers.
i loved it so much that one day
i grabbed the record and broke it
to bits – tiny bits of vinyl –
so that they’d hurt even more.
i’m not sure why, but i kept
the stiff cardboard jacket,
that lugubrious allegory of childhood.
and the remains of the record ended up
in the stream next to my parents’ house.
later on the stream, flanked by weekend
vegetable patches, was strangled by an implacable
housing development, the provincial version
of a gated condominium, in a world
with ever more doors.
as for beethoven, buried like the frogs
by invisible killing hands,
he almost ceased to move me.
what moves me now, years
later, is to realize i did to that record
the same thing i do over and over
to the bodies i think i love:
i shatter them, very slowly, so that
they’ll keep on hurting a little more.",pt_XX,en_XX,"shards of vinyl with mud
should have been the most played record:
beethoven's fifth, a klemperer's recording.
mornings and afternoons promised a better future,
a quaint set of customs i quickly lost. even then i looked
at ana's tavern, filling my room's window.
i feared the shadow, the silence,
foreseeing in every step the monster
within me. and read, not to think,
discredited french writers.
one day, from loving it so much,
i took the record and broke it
into small shards of vinyl
— to hurt more, better.
i kept, i don't know why,
the hard cardboard cover,
that funereal allegory of childhood.
and what was left of the record went to
the brook near my parents' house.
later, the brook with sunday gardens
around it was buried by the terror
of a village settlement, a provincial version
of a gated community, in a world
where doors are multiplying.
beethoven, he almost stopped
moving me, buried like the frogs
by the invisible hands of those who kill.
what moves me, after all this time,
is realizing that i did to this record
the same i do and redo
to the bodies i think i love:
i break them, very slowly, so
they hurt a little more each time.",3
"chopin: um inventário
quase sessenta mazurcas; cerca de trinta estudos;
duas dúzias de prelúdios; uma vintena de nocturnos;
umas quinze valsas; mais de uma dúzia de “polonaises”;
“scherzos”, improvisos, e baladas, quatro de cada;
três sonatas para piano; e dois concertos para piano e orquestra,
uma “berceuse”, uma barcarola, uma fantasia, uma tarantela, etc.,
além de umas dezassete canções para canto e piano; uma tuberculose mortal;
um talento de concertista; muitos sucessos mundanos; uma paixão infeliz;
uma ligação célebre com mulher ilustre; outras ligações sortidas;
uma pátria sem fronteiras seguras nem independência concreta;
a europa francesa do romantismo; várias amizades com homens eminentes;
e apenas trinta e nove anos de vida. outros viveram menos, escreveram mais,
comeram mais amargo o classicamente amargo pão do exílio, foram ignorados
ou combatidos, morreram abandonados, não se passearam nas alcovas
ou nos salões da glória, confinaram-se menos ao instrumento que melhor dominavam,
e mesmo foram mais apátridas sofrendo de uma pátria que não haja.
além disso, quase todos escaparam mais à possibilidade repelente
de ser melodia das virgens, ritmo dos castrados,
requebro de meia-tijela, nostalgia dos analfabetos,
e outras coisas medíocres e mesquinhas da vulgaridade, como ele não. ou de ser
prato de não-resistência para os concertistas que tocam para as pessoas que julgam
que gostam de música mas não gostam. ainda por cima
era um arrivista, um pedante convencido da aristocracia que não tinha,
um reaccionário ansiando por revoluções que libertassem as oligarquias
da polónia, coitadinhas, e outras. e, para cúmulo,
a gente começa a desconfiar de que não era sequer um romântico,
pelo menos da maneira que ele fingiu ser e deixou entender que era.
uma arte de compor a música como quem escreve um poema,
a força que se disfarça em languidez, um ar de inspiração
ocultando a estrutura, uma melancolia harmónica por sobre
a ironia melódica (ou o contrário), a magia dos ritmos
usada para esconder o pensamento – e escondê-lo tanto,
que ainda passa por burro de génio este homem que tinha o pensamento nos dedos,
e cuja audácia usava a máscara do sentimento ou das formas livres
para criar-se a si mesmo. tão hábil na sua cozinha, que pode servir-se
morno, às horas da saudade e da amargura,
quente, nas grandes ocasiões da vida triunfal,
e frio, quando só a música dirá o desespero vácuo
de ser-se piano e nada mais no mundo.","chopin: an inventory
almost sixty mazurkas; about thirty etudes;
two dozen preludes; a score of nocturnes;
some fifteen waltzes; over a dozen polonaises;
scherzos, improvisations, ballades, four of each;
three sonatas for piano; and two concertos for piano and orchestra,
one berceuse, one barcalole, one fantasy, one tarantella, etc.,
besides some seventeen songs for voice and piano; a fatal case of tuberculosis;
a talent for concertizing; many mundane successes; an unhappy passion;
a celebrated liaison with a famous woman; other assorted liaisons;
a country without sure borders or definite independence;
the french europe of romanticism; several friendships with the eminent;
and scarcely thirty-nine years of life. others lived less, wrote more,
tasted more bitterly the classically bitter bread of exile, were ignored
or persecuted, died forsaken, didn’t linger in alcoves
or salons of glory, confined themselves less to the instrument they had mastered most,
and were exiled longer in suffering for a non-existent country.
besides, almost all the others escaped the repugnant possibility
of becoming a melody for virgins, a rhythm for the castrated,
a sham, a languishing, a nostalgia of illiterates,
and other vulgar, mediocre, and ungenerous things – as he did not. or of becoming
a piece de non-résistance for performers who play for those who believe
they like music but really don’t. and what’s more,
he was a parvenu, a pedant sure of an aristocracy he couldn’t claim,
a reactionary anguished over revolutions that would liberate, among others,
the oligarchies of poland – poor things. and, finally,
one begins to suspect he was not even a romantic,
at least not in the sense he pretended or let others believe he was.
a knack for composing music as one writes a poem,
a power disguising itself in languor, an air of inspiration
concealing the structure, a harmonious melancholy above
an ironic melody (or the other way round), the magic of rhythms
used to hide thought – and hide it so well
that he still passes for an ass of a genius, this man who had thought in his fingers,
whose boldness put on the mask of feeling and free forms
to create a self. so able in the kitchen, that he can be served
lukewarm, in hours of longing and sorrow,
hot, at those great occasions of triumphant life,
or cold, when music alone expresses the empty despair of being
nothing more in the world than a piano.",pt_XX,en_XX,"Chopin: An Inventory
Almost sixty mazurkas; about thirty etudes;
Two dozen preludes; a score of nocturnes;
Some fifteen waltzes; over a dozen polonaises;
Scherzos, improvisations, ballades, four of each;
Three sonatas for piano; and two concertos for piano and orchestra,
One berceuse, one barcarolle, one fantasy, one tarantella, etc.,
Besides some seventeen songs for voice and piano; a fatal case of tuberculosis;
A talent for concertizing; many mundane successes; an unhappy passion;
A celebrated liaison with a famous woman; other assorted liaisons;
A country without sure borders or definite independence;
The French Europe of romanticism; several friendships with the eminent;
And scarcely thirty-nine years of life. Others lived less, wrote more,
Tasted more bitterly the classically bitter bread of exile, were ignored
Or persecuted, died forsaken, didn't linger in alcoves
Or salons of glory, confined themselves less to the instrument they had mastered most,
And were exiled longer in suffering for a non-existent country.
Besides, almost all the others escaped the repugnant possibility
Of becoming a melody for virgins, a rhythm for the castrated,
A sham, a languishing, a nostalgia of illiterates,
And other vulgar, mediocre, and ungenerous things – as he did not. Or of becoming
A pièce de non-résistance for performers who play for those who believe
They like music but really don't. And what's more,
He was a parvenu, a pedant sure of an aristocracy he couldn't claim,
A reactionary anguished over revolutions that would liberate, among others,
The oligarchies of Poland – poor things. And, finally,
One begins to suspect he was not even a romantic,
At least not in the sense he pretended or let others believe he was.
A knack for composing music as one writes a poem,
A power disguising itself in languor, an air of inspiration
Concealing the structure, a harmonious melancholy above
An ironic melody (or the other way round), the magic of rhythms
Used to hide thought – and hide it so well
That he still passes for an ass of a genius, this man who had thought in his fingers,
Whose boldness put on the mask of feeling and free forms
To create a self. So able in the kitchen, that he can be served
Lukewarm, in hours of longing and sorrow,
Hot, at those great occasions of triumphant life,
Or cold, when music alone expresses the empty despair of being
Nothing more in the world than a piano.",3
"a presenca mais pura
nada do mundo mais próximo
mas aqueles a quem negamos a palavra
o amor, certas enfermidades, a presença mais pura
ouve o que diz a mulher vestida de sol
quando caminha no cimo das árvores
«a que distância da língua comum deixaste
o teu coração?»
a altura desesperada do azul
no teu retrato de adolescente há centenas de anos
a extinção dos lírios no jardim municipal
o mar desta baía em ruínas ou se quiseres
os sacos do supermercado que se expandem nas gavetas
as conversas ainda surpreendentemente escolares
soletradas em família
a fadiga da corrida domingueira pela mata
as senhas da lavandaria com um «não esquecer» fixado
o terror que temos
de certos encontros de acaso
porque deixamos de saber dos outros
coisas tão elementares
o próprio nome
ouve o que diz a mulher vestida de sol
quando caminha no cimo das árvores
«a que distância deixaste
o coração?»","the purest presence
nothing in the world is closer
but those to whom we deny our words
love, certain infirmities, the purest presence
hear what the woman dressed in sunlight says
when she walks on top of the trees
“how far away from common speech did you leave
your heart?”
the desperate height of the blueness
in your teenage photo hundreds of years ago
the disappearance of lilies from the public garden
the sea of this bay in ruins or if you prefer
the supermarket bags expanding in the drawer
the conversations from our school days
still recited in the family
the fatigue of sunday’s run through the woods
the dry-cleaning stubs with a “don’t forget” attached
the terror we have
of certain chance meetings
because we’ve stopped knowing basic things
about others
their very names
hear what the woman dressed in sunlight says
when she walks on top of the trees
“how far away from common speech did you leave
your heart?”",pt_XX,en_XX,"the purest presence
nothing in the world is closer
but those to whom we deny the word
love, certain ailments, the purest presence
hear what the woman clad in sunlight says
as she walks atop the trees
""at what distance from the common tongue
did you leave your heart?""
the desperate height of blue
in your portrait as a teenager hundreds of years ago
the extinction of lilies in the municipal garden
the sea of this ruined bay or if you will
the supermarket bags expanding in the drawers
the conversations still surprisingly school-like
spelled out in family
the fatigue of the Sunday jog through the forest
the laundry tickets with a ""don't forget"" pinned
the terror we feel
of certain chance encounters
because we've forgotten about others
such elementary things
the name itself
hear what the woman clad in sunlight says
as she walks atop the trees
""at what distance did you leave
your heart?""",3
"uma palavra no coração
. . . mit einer hoffnung auf ein kommendes wort im herzen
paul celan
quando celan visitou heidegger, e passearam
pelo bosque antes da chuva, ao despedir-se escreveu
no livro da casa sobre a esperança de uma
palavra a vir no coração. e repetiu em todtnauberg,
dois anos antes de morrer, a referência obscura
à linha escrita nesse livro, de uma esperança, então, de que,
a um ser pensante?, de um ser pensante?,
viesse uma palavra no coração. no coração, no lugar onde
a palavra reconcilia por lá se encontrar desde antes,
esperadamente. ao coração, seria menos visceral.
ou já lá estava pronta a vir ou não valia a pena
fosse quebrado o silêncio em tanta expectativa.
as raízes do fogo e do sangue são as raízes
violentas do poema, no seu magma revolto de estranhezas
ou nalguma ténue chama azulando-se em sílabas
delicadas como asas. instalada no coração,
uma palavra, uma oferenda de música e plantas silvestres,
viria a irromper do orvalho, benfazeja, transportando
se não o esquecimento, a paz. uma palavra.
tudo o que celan pedia e não sabemos se obteve
e talvez ainda procurasse numa noite de abril, no rio sena.","a word in the heart
. . . mit einer hoffnung auf ein kommendes wort im herzen
paul celan
when celan visited heidegger and they walked
in the woods before it rained, on leaving he wrote
in the visitors’ book about his hope in a
word to come in the heart. and in todtnauberg,
two years before dying, he again referred to the obscure
phrase written in that book, about a hope that a word
would come (to a thinking being? from a thinking being?)
in the heart. in the heart, that place where
the word is able to reconcile since it’s there beforehand,
ardently waiting. to the heart would be less visceral.
either it’s already there, ready to come out, or there’s no point
in breaking the silence with so much expectation.
the roots of fire and of blood are the poem’s same violent
roots, in its convulsive magma of wondrous things
or in a tenuous flame bluing into syllables
delicate as wings. planted in the heart,
a word, an offering of music and wild plants,
would come from out of the dew and bless, if not
with forgetting, then at least with peace.
that was all celan asked for and we don’t know if he obtained it
or if he still sought it, one april night, in the seine.",pt_XX,en_XX,"when celan visited heidegger, they strolled
through the woods before the rain, and in parting
he wrote in the guest book of the house, of the hope for a
word to come in the heart. and he repeated in todtnauberg,
two years before his death, the obscure reference
to the line penned in that book, of a hope then, that
to a thinking being?, to a thinking being?,
a word would come in the heart. in the heart, where
the word reconciles has since awaited expectantly. to the heart,
it would be less visceral. or it was already ready to come or
it wasn't worth breaking the silence with so much expectation.
the roots of fire and blood are the violent roots of the poem,
in its roiled magma of oddities
or in some faint blue flame flickering in delicate syllables
like wings. installed in the heart,
a word, an offering of music and wild plants,
would irrupt from the dew, beneficent, carrying
if not forgetfulness, peace. a word.
all celan asked for and we don't know if he got
and perhaps he still sought on an april night, on the seine.",3
"para a educação sentimental
tantas vezes se vive de uma arrebatada
noção dos contrastes mais fortes entre o bem e o
mal, entre a grandeza e a abjecção, entre as rápidas
peripécias de um heroísmo ansioso e o destino inexorável,
que o melodrama é da nossa mais funda natureza,
nostálgica, obscuramente nostálgica do coração radical,
do que vai à desfilada nos sonhos contraditórios,
do que engendra imagens capciosas e julga viver em liberdade,
mas é só imprudente e explosivo, mas esbarra
nas malhas deste mundo, nos imprevistos
da traição e da morte, ou tem de renunciar perante os rasgos
mais sublimes. a paixão dilacera bruscamente as personagens
apegadas à felicidade, os obstáculos
também têm protagonistas, ajustes de contas, cruéis fulgores,
perseguições, e nos casos desvairados de amor não há saída.
desse falhanço insuportável nasce o melodrama,
lírico, incontido, entre golfadas de espiral vertiginosa
com o sangue e a memória, com o que não tem remédio e a música trágica,
em que alguém vai morrer, alguém se perde alucinado,
e alguém se salva e porventura alguém escreve
a história e alguém lhe junta a música
para as emoções serem mais opressivas e talvez mais devoradoras
e mais fáceis, e alguém tem o desejo disso, um estremecimento
de arrepio e vulgaridade, um ávido prazer inconfessado.","sentimental education
we often live according to a rash
notion of stark contrasts between good
and evil, greatness and wretchedness, the swift deeds
of an avid heroism and the inexorable march of destiny,
melodrama being part of our deepest nature,
obscurely but stubbornly nostalgic for the radical heart,
which races at top speed in contradictory dreams,
which engenders seductive images and thinks it lives in freedom,
but it’s merely reckless and explosive, it stumbles
into the world’s snares, into unexpected
treachery and death, or it must renounce in the face of the most
sublime flashes. passion rudely lacerates people
attached to happiness. the obstacles we meet
also have protagonists, scores to settle, cruel splendors,
feverish pursuits. and in desperate cases of love there’s no way out.
from that unbearable failure is born lyrical, unbridled
melodrama, amid whirling, dizzying spurts
of blood and memory, of dashed hopes and tragic music,
in which someone dies, someone goes mad,
and someone is saved, and maybe someone writes down
the story, and someone else adds music
for the emotions to be more oppressive and perhaps more consuming
and facile, and someone desires this, it makes someone feel a shiver
of tingling banality, a voracious and unconfessed thrill.",pt_XX,en_XX,"For sentimental education
Often we live by an abrupt notion
Of the strongest contrasts between good and evil,
Greatness and abjection, between the rapid twists
Of eager heroism and the inexorable fate,
That melodrama lies in our deepest nature,
Nostalgic, obscurely nostalgic of the radical heart,
Of what rides roughshod through contradictory dreams,
Of what generates deceitful images and believes to live in freedom,
But is just reckless and explosive, yet entangles
In the web of this world, in the unforeseen
Deceit and death, or must renounce before the strokes
Of the most sublime. Passion rends abruptly the characters
Attached to happiness, obstacles also have protagonists, settle of accounts, cruel flashes,
Persecutions, and in the wild cases of love there is no exit.
From this unbearable failure melodrama is born,
Lyric, uncontained, amidst torrents of dizzy spiral
With blood and memory, with what has no remedy and the tragic music,
In which someone will die, someone is lost in delusion,
And someone is saved and perhaps someone writes
The story and someone adds the music
For emotions to be more oppressive and perhaps more devouring
And easier, and someone desires this, a shiver
Of spine-chill and vulgarity, a greedy pleasure unconfessed.",3
"laudator temporis acti
entregue a verbenas e banhos, a europa,
agastada porque respira um ar nocivo,
entre o hábito da retórica e apodos
em honra de aretino, vai adorando
estátuas milenares a hermes e diana,
cristos em talha, sensuais madonas,
sem nada recear,
o velho conciliábulo entre fome e peste
que a levou tantas vezes à submissão.
deleitada à vista dos seus domínios
como senhor das ameias de um castelo
derrama o olhar pela lisura das planícies
assinalando, aqui, um mosteiro franciscano
com o seu voto de abstinência na paisagem,
ali, uma catedral onde anjos se imobilizam
na pedra, sem gestos,
e dirigem uma atenção gelada ao que, em baixo,
perece ou se contrai em fatalidade e impenitência.","laudator temporis acti
chafed because she breathes a noxious air,
europe, wallowing in baths and banquets,
addicted to rhetoric and taunts in homage
to aretino, continues to venerate
millenary statues of hermes and diana,
carved-wood christs and sensual madonnas
without fearing in the least
the old conspiracy of plague and hunger
which so often brought her down.
delighting in the view of her domains,
like the lord of a castle’s battlements,
she runs her eyes over the smooth plains
noting, over here, a franciscan monastery
with its vow of poverty dotting the landscape
and, other there, a cathedral where angels
trapped in stone, perfectly still,
cast their frozen gaze to what, below,
perishes or shrinks in fatality and impenitence.",pt_XX,en_XX,"laudator temporis acti
enthralled by verbena and baths, Europe lies,
grievous because she breathes an injurious air,
between the habit of rhetoric and nicknames
in honor of Aretino, she adores
milenarian statues to Hermes and Diana,
carved Christs, sensuous Madonnas,
undaunted,
the old conciliabulum between hunger and plague
that so often led her to submission.
delighted by the view of her dominions
like a lord from the battlements of a castle
she casts her gaze across the smooth plains
noting here a Franciscan monastery
with its vow of abstinence in the landscape,
there, a cathedral where angels are immobile
in stone, without gestures,
and direct a cold attention to what, below,
perishes or contracts in fatality and impenitence.

---

Note: This translation attempts to preserve the poetic quality and rhyme scheme of the original poem. The rhyme scheme is not perfect in English due to the inherent differences in language structure, but I've aimed for an approximate effect.",3
