original_poem,translated_poem,src_lang,tgt_lang,translated_by_TA,topic
"passado
ah velha sebenta
em que escrevia as minhas composições de francês
mes vacances: gostei muito das férias
je suis allée à la plage (com dois ee,
o verbo ètre pede concordância), j'ai beaucoup
nagé e depois terminava com o sol a pôr-se
no mar e ia ver gaivotas ao dicionário
as correcções a vermelho e o passé simple,
escrever cem vezes nous fûmes vous fûtes ils fûrent
as tardes de sol
e madame denise que dizia toi ma petite
com ar de sargento e a cara zangada a fazer-se
vermelha (tenho glóbulos a mais, faites attention)
e o olhar que desmentia tudo
em ternura remplit
e as regras decoradas e as terminações
verbais ais, ais, ait,
a hora de estudo extra e o sol de fim de tarde
a filtrar-se pelas carteiras,
a freira a vigiar distraída em salmos
eu a sonhar de livro aberto
once upon a time there was a little boy
e as equações de terceiro grau a uma
incógnita
ah tardes claras em que era bom
ser boa, não era o santinho nem o rebuçado
era a palavra doce a afagar-me por dentro,
as batas todas brancas salpicdas de gouache
colorido e o cinto azul que eu trazia sempre largo
assim a cair de lado à espadachim
as escadas de madeira rangentes
ao compasso dos passos, sentidas ainda
à distância de vinte anos,
todas nós em submissa fila a responder à chamada,
""presente"" parecia-me então lógico e certo
como assistir à oração na capela e ler as epístolas
(de são paulo aos coríntios:
naquele tempo...),
tem uma voz bonita e lê tão bem, e depois
mandavam-me apertar o cinto para ficar
mais composta em cima do banquinho,
à direita do padre
e o fascínio das confissões,
as vozes sussuradas na fina madeira
castanha a esconder uma falta,
o cheiro do chão encerrado e da cera das velas
e quando deixei de acreditar em pecados
e comecei a achar que as palavras não prestam
e que era inútil
inútil a teia de madeira
ah noites de insónia à distância de vinte anos,
once upon a time there was a little boy
and he went up on journey
there was a little girl, une petite fille
e o passé simple, como parecia simples o passado
au clair de la lune
mon ami pierrot
prête-moi ta plume
pour écrire un mot
escrever uma palavra
uma só
ao luar
a pedir concordância como uma carícia
elles sont parties,
les mouettes","the past
ah… old copybook
where i wrote out my french themes,
mes vacances: i adored holidays
je suis allée à la plage (with two e’s,
the verb être asking to agree), j’ai beaucoup
nagé and then i’d end with the sunset
over the sea, looking up ‘gulls’ in the dictionary
corrections in red and the passé simple,
writing nous fûmes vous fûtes ils fûrent a hundred times
during sunny afternoons
and madame denise who said toi ma petite
like a drill sergeant her face turning angry
and red (i have too many globules! faites attention)
and that look which contradicted it all
with remplit tenderness
and the rules memorized and the verb
endings ais, ais, ait
during extra help and the falling afternoon light
pooling beneath the desks,
our nun lost in her psalms
me dreaming over my open book
once upon a time there was a little boy
and the algebraic equations
with x as unknown
ah… beautiful afternoons when it was good
to be good, and neither the little saint nor candy,
but the sweet word fondling me from within,
our white smocks spotted with bright hued gouache
the blue belt i always wore draped
like a swashbuckler
creaking wooden stairs
rhyming to steps
twenty years on,
falling into formation to the roll,
“present” seemed so logical and certain then,
like going to prayers in the chapel and reading the epistles
(saint paul to the corinthians:
in that time…),
you have such a beautiful voice and read so well,
and then they made me tighten my belt,
primped in my pew
to the right of the priest
the pull of the confession,
voices murmuring through the fine wooden web
dissembling defects,
smell of the waxed floor and the wax of the candles
and when i stopped believing in sin,
knew words didn’t do any good,
that the wooden web
was useless
ah… nights of insomnia twenty years on
once upon a time there was a little boy
and he went on a journey
there was a little girl, une petite fille
and the simple past, how its seemed simple and past
au clair de la lune
mon ami pierrot
prête-moi ta plume
pour écrire un mot
to write just a word
just one moonlit word
to request concordance like a caress
elles sont parties,
les mouettes",pt_XX,en_XX,"The Past
Ah... old copybook
Where I wrote out my French themes,
Mes vacances: I adored holidays
Je suis allée à la plage (with two e's,
The verb être asking to agree), j'ai beaucoup
Nagé and then I'd end with the sunset
Over the sea, looking up 'gulls' in the dictionary
Corrections in red and the passé simple,
Writing nous fûmes vous fûtes ils fûrent a hundred times
During sunny afternoons
And Madame Denise who said toi ma petite
Like a drill sergeant her face turning angry
And red (I have too many globules! Faites attention)
And that look which contradicted it all
With remplit tenderness
And the rules memorized and the verb
Endings ais, ais, ait
During extra help and the falling afternoon light
Pooling beneath the desks,
Our nun lost in her psalms
Me dreaming over my open book
Once upon a time there was a little boy
And the algebraic equations
With x as unknown
Ah... beautiful afternoons when it was good
To be good, and neither the little saint nor candy,
But the sweet word fondling me from within,
Our white smocks spotted with bright-hued gouache
The blue belt I always wore draped
Like a swashbuckler
Creaking wooden stairs
Rhyming to steps
Twenty years on,
Falling into formation to the roll,
""Present"" seemed so logical and certain then,
Like going to prayers in the chapel and reading the epistles
(St. Paul to the Corinthians:
In that time...),
You have such a beautiful voice and read so well,
And then they made me tighten my belt,
Primped in my pew
To the right of the priest
The pull of the confession,
Voices murmuring through the fine wooden web
Dissembling defects,
Smell of the waxed floor and the wax of the candles
And when I stopped believing in sin,
Knew words didn't do any good,
That the wooden web
Was useless
Ah... nights of insomnia twenty years on
Once upon a time there was a little boy
And he went on a journey
There was a little girl, une petite fille
And the simple past, how it seemed simple and past
Au clair de la lune
Mon ami Pierrot
Prête-moi ta plume
Pour écrire un mot
To write just a word
Just one moonlit word
To request concordance like a caress
They are gone,
The seagulls.",3
"a neve e o amor
neste dia de calor ardente, estou esperando a neve.
sempre estive à sua espera.
quando menino, li recordações da casa dos mortos
e vi a neve caindo na estepe siberiana
e no casaco roto de fédor dostoievski.
amo a neve porque ela não separa o dia da noite
nem afasta o céu das aflições da terra.
une o que está separado:
os passos dos homens condenados ao gelo escurecido
e os suspiros de amor que se perdem no ar.
é necessário ter um ouvido muito afiado
para ouvir a música da neve caindo, algo quase silencioso
como o roçar da asa de um anjo, caso os anjos existissem,
ou o estertor de um pássaro.
não se deve esperar a neve como se espera o amor.
são coisas diferentes. basta abrirmos os olhos para ver a neve
cair no campo desolado. e ela cai em nós, a neve branca e fria
que não queima como o fogo do amor.
para ver o amor os nossos olhos não bastam,
nem os ouvidos, nem a boca, nem mesmo os nossos corações
que batem na escuridão com o mesmo rumor
da neve caindo nas estepes
e nos telhados das cabanas escuras
e no casaco roto de fédor dostoievski.
para ver o amor, nada basta. e tanto o frio do inverno como o calor escaldante
o afastam de nós, de nossos braços abertos
e de nossos corações atormentados.
fiel à minha infância, prefiro ver a neve
que une o céu e a terra, a noite e o dia,
a ser a presa indefesa do amor,
o amor que não é branco nem puro nem frio como a neve.","snow and love
on this day of burning heat, i’m waiting for snow.
i’ve been waiting for it always.
when i was a boy, i read notes from the house of the dead
and saw snow falling on siberian steppes
and on the tattered coat of fyodor dostoevsky.
i love snow because it doesn’t separate day from night
or distance heaven from the sufferings of earth.
it unites what’s separate:
the footsteps of those condemned to darkened ice
and sighs of love vanishing in the air.
one has to have a fine-tuned ear
to hear the music of falling snow, something almost silent
like the touch of an angel’s wing, assuming there are angels,
or the dying breath of a bird.
one shouldn’t wait for snow the way one waits for love.
they are different things. it’s enough to open our eyes to see the snow
falling on a deserted field. and it falls on us, cold white snow
that doesn’t burn like the flame of love.
to see love our eyes do not suffice,
nor our ears, nor our mouth, nor even our hearts
that beat in the dark with the same sound
as snow falling on the steppes
and on the roofs of darkened hovels
and on the tattered coat of fyodor dostoevsky.
to see love, nothing suffices. both winter cold and searing heat
keep it from us, from our open arms
and our tormented hearts.
faithful to my childhood, i prefer to see snow
that unites heaven and earth, night and day,
rather than be a helpless prey to love,
love that is neither white nor pure nor cold as snow.",pt_XX,en_XX,"Snow and Love

On this day of burning heat, I wait for snow.
I've always waited for it.
When I was a boy, I read notes from the house of the dead
And saw snow fall on Siberian steppes
And on the tattered coat of Fyodor Dostoevsky.
I love snow because it doesn't separate day from night
Or distance heaven from the sufferings of earth.
It unites what's separate:
The footsteps of those condemned to darkened ice
And sighs of love vanishing in the air.
One must have a fine-tuned ear
To hear the music of falling snow, something almost silent
Like the touch of an angel's wing, assuming there are angels,
Or the dying breath of a bird.
One shouldn't wait for snow the way one waits for love.
They are different things. It's enough to open our eyes to see the snow
Falling on a deserted field. And it falls on us, cold white snow
That doesn't burn like the flame of love.
To see love, our eyes do not suffice,
Nor our ears, nor our mouth, nor even our hearts
That beat in the dark with the same sound
As snow falling on the steppes
And on the roofs of darkened hovels
And on the tattered coat of Fyodor Dostoevsky.
To see love, nothing suffices. Both winter cold and searing heat
Keep it from us, from our open arms
And our tormented hearts.
Faithful to my childhood, I prefer to see snow
That unites heaven and earth, night and day,
Rather than be a helpless prey to love,
Love that is neither white nor pure nor cold as snow.",3
"pax lusitanica
ora se bem me lembro bem bastava
ter que me dar a gregos e troianos.
mas dar-me a americanos, russos
e chineses, arre! isso não, que bem me bastam
os portugueses! esses facínoras de pé na mão, esses
minhocas endomingados na semana
e tesos ao domingo.
gregos de ulisses, vale é uma chama
acesa no altar da pátria.
troianos . . . há eneias, piedoso,
acartando nas costas o seu povo.
de portugal, não se fala, nem do gama.
mas dar-me a americanos, russos
e chineses, arre! isso não, que bem me bastam
os portugueses!
quero ver-me é entre tahitianas,
titiro manhoso, vendedor de flautas
e com elas convívio amenizado.
quero é dar-me a circe, enfeitiçar-me
em cavernas simbólicas
onde não faltem os sobresselentes,
o simulacro, o ver de cão travado
pelo cheiro a carne quente.
penélope esperou-me tanto tempo
que pode esperar mais, como lisboa.
mas dar-me a americanos, russos
e chineses, arre! isso não, que bem me bastam
os portugueses!
acertadas as contas, quero ver
se não me engano.
contra ulisses, eu quero ser troiano.
quero ter
viagem paga, um fim que dignifique,
uma toga, um palácio . . . tudo o que
justifique
minha precária existência
marcada pela traição, pelo pavor
piloto morto, pelo sonhador, pelo incêndio, pela lágrima
de aligator . . .
verdade, que há um cheiro lusitano . . .
sou romano.
aquilo que prometo nunca faço.
mas dar-me a americanos, russos
e chineses, arre! isso não, que bem
me bastam os portugueses!","pax lusitanica
well, if i remember right it was bad enough
having to give myself to greeks and trojans.
but to give myself to americans, russians,
and chinese, arghh! not that, the portuguese
are bad enough! those
strutting thugs, those
tiny worms in sunday-best all week
and then flat-broke on sundays.
odysseus’ greeks, well, fine, o.k., a flame
burning on the homeland\'s altar.
trojans . . . there’s aeneas, pious guy,
lugging all his people on his back.
of portugal, nothing’s said, not even the name da gama.
but to give myself to americans, russians,
and chinese, arghh! not that, the portuguese
are bad enough!
i’d like to see myself among tahitian girls,
cunning titiro, a seller of flutes,
living with them in soothed familiarity.
i’d like to give myself to circe, get bewitched
in symbolic caverns
suffering no dearth of provender,
with a simulacrum, the vision of a dog fettered
by smell to the warm flesh.
penelope has waited so long for me
she can, like lisbon, wait a little longer.
but to give myself to americans, russians,
and chinese, arghh! not that, the portuguese
are bad enough!
my affairs in order, i’d like to see
if i’ve got it right.
against odysseus, i’d like to be a trojan.
i’d like to have
my trip for free, an end that dignifies,
a toga, a palace . . . all that might
justify
my precarious existence
marked by treason, dread,
the pilot dead, by the dreamer, fire, an alligator
tear . . .
true, there is a lusitanian smell . . .
i am a roman.
what i promise, i never do.
but to give myself to americans, russians,
and chinese, arghh!, not that, the portuguese
are bad enough!",pt_XX,en_XX,"portuguese peace
well, if i remember rightly, it was bad enough
to have to give myself to greeks and trojans.
but to give myself to americans, russians,
and chinese, arghh! not that, the portuguese
are bad enough! those
strutting thugs, those
tiny worms in sunday-best all week
and then flat-broke on sundays.
odysseus' greeks, well, fine, o.k., a flame
burning on the homeland's altar.
trojans... there's aeneas, pious guy,
lugging all his people on his back.
of portugal, nothing's said, not even the name da gama.
but to give myself to americans, russians,
and chinese, arghh! not that, the portuguese
are bad enough!
i'd like to see myself among tahitian girls,
cunning titiro, a seller of flutes,
living with them in soothed familiarity.
i'd like to give myself to circe, get bewitched
in symbolic caverns
suffering no dearth of provender,
with a simulacrum, the vision of a dog fettered
by smell to the warm flesh.
penelope has waited so long for me
she can, like lisbon, wait a little longer.
but to give myself to americans, russians,
and chinese, arghh! not that, the portuguese
are bad enough!
my affairs in order, i'd like to see
if i've got it right.
against odysseus, i'd like to be a trojan.
i'd like to have
my trip for free, an end that dignifies,
a toga, a palace... all that might
justify
my precarious existence
marked by treason, dread,
the pilot dead, by the dreamer, fire, an alligator
tear...
true, there's a lusitanian scent...
i am a roman.
what i promise, i never do.
but to give myself to americans, russians,
and chinese, arghh!, not that, the portuguese
are bad enough!",3
"os ciganos
dizem que vêm da europa central. eu vejo-os vir
dos lados de grijó em lassa caravana.
debaixo da carroça trota a coelheira,
aproveitando a sombra débil e ambulante.
sentado na boleia, as rédeas na mão morena
descuidadas, um homem cisma, confia
do caminho ao macho lento a decisão.
outros homens a pé e mulheres novas
entretêm de riso a caminhada espessa.
logo após, sobre os burros, os pertences.
alguns velhos também, já cansados de tudo,
tiram partido do precário trote. as crianças
de peito sugam em sonolenta teima
as elásticas tetas sacudidas, mas alvas e redondas.
os mais velhitos caminham repartidos
em pequenas e lúdicas manadas, dando
às hortas laterais breves saltos furtivos.
toda esta gente é morena e tem fala cantada,
levanta para mim doces olhos castanhos.
dizem que vêm
da europa central, de uma raça sem chão,
e aqui procura, de insultos rodeada,
cumprir a sua luta, seu degredo
e sua primitiva vocação.
dizem que os ciganos desenterram animais defuntos
de alguma enfermidade menos limpa
e neles cravam dentes de fome milenária.
dizem que as mulheres estão na intimidade
das estrelas e a troco de uns mil-réis
lêem nas mãos destinos coloridos.
dizem que roubam quintais e assaltam capoeiras,
e os aldeões, em pânico secreto,
os expulsam com voz impiedosa e decidida mão
das cercanias do seu chão governado.
dizem que enganam os incautos campónios
em negócios sempre escuros de animais,
em que fazem passar por uma estampa
o mais escalavrado e cego dos cavalos.
dizem que na vila, ao desfazer das feiras,
têm por costume, depois de embriagados,
trocar com as bengalas possantes e vistosas
pancadaria rija, de que morrem.
dizem que vivem estranhos dramas passionais.
dizem que não têm deus e que se casam
lançando ao ar jubilosos chapéus.
dizem tudo isso dos ciganos. eu não sei.
vejo-os vir dos lados de grijó
e estão todos de frente para mim
e parecem-me gente – nada mais.","gypsies
it is said they come from central europe. i see them coming
from the direction of grijó, in a weary caravan.
the she-dog trots beneath the only wagon,
availing herself of the jiggling, faint shade.
in the driver’s seat, with his swarthy hand
slackly holding the reins, a man daydreams,
trusting the slow mule to lead the way.
other men on foot, along with the young women,
lighten with laughter the long hard trek.
then come their chattels, loaded on donkeys
whose precarious trotting also bears
a few oldsters tired of everything. nursing infants
suck with drowsy stubbornness at teats
stretched and shaking, but round and white.
the children run along in playful
little herds, making brief and furtive sallies
into the vegetable plots on either side.
they are all dark-skinned and have a sing-song speech.
they all look at me with soft brown eyes.
it is said they come
from central europe, from a landless race,
and here, amid insults, they seek
to carry out their struggle, their exile
and their primitive vocation.
it is said they unearth animals deceased
from foul diseases and sink
into them their millenary hunger.
it is said their women are intimate
with the stars and for a few dollars
will read colorful futures in your hands.
it is said they rob gardens and poach chickens,
and the villagers, in secret alarm,
banish them with iron hand and ruthless voice
from the environs of their peaceable land.
it is said they fool unwary farmers
in their never transparent dealings to sell animals,
passing off as a thoroughbred
the blindest and most broken-down nag.
it is said that in the towns, after taking down their fairs
and getting drunk, they trade vicious swipes
with their sturdy, handsome canes from which they die.
it is said they have strange passionate dramas.
it is said they have no god and get married
by tossing joyful hats into the air.
all this and more is said about gypsies. i don’t know.
i see them coming from the direction of grijó
and there they all are, right in front of me,
and they look to me like people, just people.",pt_XX,en_XX,"Gypsies

They say they come from Central Europe. I see them coming
From the direction of Grijó, in a weary caravan.
The she-dog trots beneath the solitary wagon,
Enjoying the swaying, faint shade.
In the driver's seat, with his tanned hand
Loosely holding the reins, a man daydreams,
Trusting the slow mule to lead the way.
Other men on foot, along with the young women,
Lighten with laughter the long hard trek.
Then come their possessions, loaded on donkeys
Whose precarious trotting also bears
A few elders weary of all things. Nursing infants
Suck with drowsy persistence at breasts
Stretched and trembling, yet round and white.
The children run along in playful
Little herds, making brief and furtive dashes
Into the vegetable patches on either side.
They are all dark-skinned and have a singsong speech.
They all look at me with soft brown eyes.
They say they come
From Central Europe, from a landless race,
And here, amid insults, they seek
To carry out their struggle, their exile
And their primitive vocation.
They say they exhume animals deceased
From foul diseases and sate
Their millennial hunger upon them.
They say their women are intimate
With the stars and for a few dollars
Will read colorful futures in your palms.
They say they plunder gardens and poach chickens,
And the villagers, in secret alarm,
Banish them with an iron hand and ruthless voice
From the environs of their peaceful land.
They say they deceive unwary farmers
In their never transparent dealings to sell animals,
Passing off as a thoroughbred
The blindest and most broken-down nag.
They say that in the towns, after dismantling their fairs
And getting drunk, they trade vicious blows
With their sturdy, handsome canes from which they die.
They say they have strange passionate dramas.
They say they have no god and marry
By tossing joyful hats into the air.
All this and more is said about gypsies. I don't know.
I see them coming from the direction of Grijó
And there they all are, right in front of me,
And they look to me like people, just people.",3
"ladrões de bicicletas - vittorio de sica (1948)
mil quilómetros por dia pedalava meu pai, desde
a cama junto ao douro até à próspera cerâmica
de valadares. se qualquer homem recebe,
à nascença, uns sessenta inimigos por hora,
imaginem a jornada de um operário ciclista.
tudo são despesas para ele: o rosário de geada
nas giestas, o jornal atropelado pelo vento, o verdor
da primavera, a poalha do suor em cada mão.
meu pai, é claro, não se queixa, ganha um conto
de réis, tem uma casa portuguesa e grandes sonhos
de amanhãs a gasolina. pelo menos não trabalho
em nenhum matadouro, pensa ele, e com razão,
erguido nos pedais do seu veículo de sombra,
solitário trepador pela encosta de avintes. não
trabalha em nenhum matadouro. e nesse reconforto
passa à quinta dos frades, alcança o freixieiro,
sente já o rumor de fumacentos camiões na nacional,
onde tudo, depois, será muito mais plano.","the bicycle thief - vittorio de sica (1948)
500 miles per day pedaled my father, from his bed
near the douro river to the booming ceramicware
plant of valadares. if all men, from birth,
are given some sixty enemies per hour,
imagine a life cycling to and from a factory.
one effort after another: the rosary of frost covering
clusters of broom, a newspaper battered by the wind,
the greenness of spring, the dusty sweat on each hand.
my father, to be sure, never complains. he earns five
dollars a day and has a small house and big dreams
of gas-powered tomorrows. “at least i don’t work
in a slaughterhouse”, he thinks, and with good reason,
standing tall on the pedals of his shadowy vehicle,
a solitary cyclist climbing the slope at avintes. he doesn’t
work in a slaughterhouse. and with that solace
he rides past the quinta dos frades, reaches freixieiro,
and hears the rumble of the smoky trucks on the highway,
where the ride, at last, will be much smoother.",pt_XX,en_XX,"Bicycle Thieves - Vittorio De Sica (1948)

My father pedaled a thousand kilometers a day,
from his bed by the Douro to the thriving ceramics
of Valadares. If every man receives,
at birth, sixty enemies per hour,
imagine the journey of a cycling worker.
Everything is expense to him: the rosary of frost
on the gorse, the newspaper felled by wind, the green
of spring, the dust of sweat on each hand.
My father, of course, complains not, earns a thousand
reis, has a Portuguese house and great dreams
of tomorrow's gasoline. At least he doesn't work
in any slaughterhouse, he thinks, and rightly so,
lifted on the pedals of his shadowy machine,
solitary climber up the slope of Avintes. No
work in any slaughterhouse. And in this comfort
he passes Quinta dos Frades, reaches Freixieiro,
senses the murmur of smoky trucks on the national road,
where everything, afterward, will be much flatter.",3
