original_poem,translated_poem,src_lang,tgt_lang,translated_by_TA,topic
"a viagem de alexandre à índia
andaste de um ao outro lado da terra na vida interminável,
tiveste degredos, piedosos cíumes, a fé desvanescida,
amantes paradas na lavoura, roubando-te o rosto amado.
viste vestígios de que foste a sombra de ninguém,
olhos sem pudor, do reflexo dos ferros no tropel,
franjas do domínio pueril de alexandre, olhando gaugamela.
partiste num porto de transição para o levante,
com vazios para trás, todo o tempo a poder ver,
e ao primeiro inverno, pelos cardeais das suas cinzas,
começaste a travessia que não termina, a história que não acaba.
soubeste porque se vislumbra, em lágrimas, o pinheiro da juventude,
o nome quebrado num turvo ar medido sem corda,
e a maresia do vento de feição no segundo inverno.
em troca perseguiste o que rege o homem fortuito,
segredando em palácios de mármore que são apenas pedras,
dos fracassos a que jamais alguém ajoelhara.
ao terceiro inverno descobriste o hemisfério, e ao quarto,
sem ideia de guerra ou ordem para mudar o reino,
escolheste adornar os aquedutos sob o manto dos regatos,
sentado, na brisa no tanque, ao febril entardecer.
de quem te aproximaste, no seu trajecto interminado,
sem lugar senão o que esfria na mente recortada,
naquilo que se ramifica, tornando-se na própria teia,
contigo propagou o dever de passar em toda a parte.
e quando veio o quinto inverno, e o sexto, suturaste o sangue,
trouxeste a pele à curva dos rios, acolheste o que de resto se desmorona,
e pudeste enfim, na crença dos migradores furtivos, entender que
tudo se perde noutro lugar ainda, e após esse ainda noutro
e que ao fim de cada manhã noutra manhã
tudo é incerto, tão conforme o dente-de-leão no meio de searas,
tão emudecido como a veia exausta dos não sepultados.
na mansarda onde vagueia o dia e a noite
o vento responde, cortando o centeio e o calcário, e a vela
que brilha na luz de estrelas veladas, já desaparecidas,
pisadas, mudas, engolidas aos pés do sétimo inverno,
arpoa o coração e a ruína — os meridianos despem-se, voam
em vinte e cinco anos que há pouco se beijavam, e seja dito ou não dito
o prazer que inflige um pico de tormentos
por lábios que só as mulheres conhecem
no moinho das águas da morte em varanasi,
sacode a chama de quanto vale, dura e canta
o princípio e o fim do teu poder na terra.","alexandres`s travel to india
you wandered an interminable life across the earth,
suffered exile, piteous jealousy, futile faith,
labour-arrested lovers plundering your beloved’s face.
you saw traces of having been no one’s shadow,
impudent eyes, the reflection of iron on the rampage,
hints of alexander’s puerile dominance, contemplating gaugamela.
you set off from a transient port towards the levant,
leaving emptiness behind, seeing all of time,
and in the first winter, by the cardinals of its ashes,
you started the endless crossing, the incessant history.
you knew, because the pine tree of youth can be glimpsed through tears,
of the shattered name in a cloudy mood measured without ropes,
and of the favourable sea breeze in the second winter.
in exchange you pursued that which rules the fortuitous man,
whispering in marble palaces that are but stones,
failures to which no one had ever knelt.
by the third winter you discovered the hemisphere, and by the fourth,
non intent on war or order to change the kingdom,
you chose to adorn aqueducts with the mantle of streams,
sitting by the pool breeze, in the evening´s lingering fever.
whomever you approached, in their indefinite path,
without a place except that which fades inside a patchy mind,
in that which branches out and becomes the very web,
has spread with you the duty to pass through everywhere.
and by the fifth winter, and the sixth, you stitched up the blood,
brought the skin on to the river bends, welcomed that which falls apart,
and were at last capable, with the belief of a stealthy migrant, of understanding
that all is lost yet in another place, and after this in yet another
and that by the end of each morning in another morning
all is uncertain, just like a dandelion in a field of wheat,
as muted as the exhausted vein of the unburied.
in the attic where night and day roam
the wind replies, cutting the chalk and the rye, and the candle,
shimmering in the light of the veiled stars already gone,
trodden, voiceless, swallowed up by the seventh winter,
spears the heart and the ruin — the meridians undress, fly away
in twenty five years that were just kissing yesterday, and be it told or untold
the pleasure that brings a peak of torment, inflicted
by lips that only women know
in the turmoil of varanasi´s death waters,
tests the flame of the merit, endurance and song of
the beginning and the end of your power on earth.",pt_XX,en_XX,"Alexander's journey to India

You wandered an endless life across the earth,
Suffered exile, pitiful jealousy, futile faith,
Labour-arrested lovers plundering your beloved's face.
You saw traces of having been no one's shadow,
Impudent eyes, the reflection of iron on the rampage,
Hints of Alexander's puerile dominance, contemplating Gaugamela.
You set off from a transient port towards the Levant,
Leaving emptiness behind, seeing all of time,
And in the first winter, by the cardinals of its ashes,
You started the endless crossing, the incessant history.
You knew, because the pine tree of youth can be glimpsed through tears,
Of the shattered name in a cloudy mood measured without ropes,
And of the favourable sea breeze in the second winter.
In exchange you pursued that which rules the fortuitous man,
Whispering in marble palaces that are but stones,
Failures to which no one had ever knelt.
By the third winter you discovered the hemisphere, and by the fourth,
Not intent on war or order to change the kingdom,
You chose to adorn aqueducts with the mantle of streams,
Sitting by the pool breeze, in the evening's lingering fever.
Whomever you approached, in their indefinite path,
Without a place except that which fades inside a patchy mind,
In that which branches out and becomes the very web,
Has spread with you the duty to pass through everywhere.
And by the fifth winter, and the sixth, you stitched up the blood,
Brought the skin on to the river bends, welcomed that which falls apart,
And were at last capable, with the belief of a stealthy migrant, of understanding
That all is lost yet in another place, and after this in yet another
And that by the end of each morning in another morning
All is uncertain, just like a dandelion in a field of wheat,
As muted as the exhausted vein of the unburied.
In the attic where night and day roam
The wind replies, cutting the chalk and the rye, and the candle,
Shimmering in the light of the veiled stars already gone,
Trodden, voiceless, swallowed up by the seventh winter,
Spears the heart and the ruin — the meridians undress, fly away
In twenty-five years that were just kissing yesterday, and be it told or untold
The pleasure that brings a peak of torment, inflicted
By lips that only women know
In the turmoil of Varanasi's death waters,
Tests the flame of the merit, endurance and song of
The beginning and the end of your power on earth.",3
"indústria cultural
as distrações
para as famílias do interior
exigem recursos humanos
próprios.
aqui
não vêm atuar
os grandes atores,
aqui
não vêm ler
os grandes poetas,
aqui
não vêm cantar
os grandes cantores,
aqui
não se digna
a interpretações
a intelligentsia.
aqui,
às igrejas evangélicas
e às academias de ginástica
pertence a implementação
do mens sana in corpore sano.
as visitas à sorveteria
que antes fora uma pizzaria
e antes, uma lanchonete,
apenas mudam as paredes,
que não trazem
nem fotografia nem pintura
de tradições centenárias.
o espaço público
— nem ágora nem eclésia —
incita variações
— agora aos sussurros —
dos ressentimentos velhos,
das irritações pequenas
que se acumulam
e latejam como pústulas.
as frustrações do pai,
as frustrações da mãe,
e assim, em escadinha,
as frustrações nascentes
da prole toda, em perdas
crescentes.
à mesa
reina nossa mesma
falta de assunto da janta
ou o assunto repetido
à exaustão. as dívidas
com deus e com césar.
e sim, o silêncio
sobre os únicos assuntos
que quiçá nos salvassem.
quem-nos-dera, num instante
de lucidez repentina,
aguássemos agora
os sorvetes, as pizzas, os lanches
com lágrimas, esgoelando juntos
na sarjeta. mas o que diriam
os vizinhos?
nas capitais
lacrimeja a intelligentsia
— o povo! o povo! —
enquanto o mofo e o musgo
cobrem aos poucos
a nossa não-boca, a nossa não-alma.","the culture industry
entertainments
for families in the interior
require their own
human resources.
here,
great actors
do not come to play;
here,
great poets
do not come to read;
here,
great singers
do not come to sing;
here,
the intelligentsia
does not deign
to interpret.
here,
evangelical churches
and fitness centers
administer implementation
of mens sana in corpore sano.
visits to the ice cream parlor
which used to be a pizzeria
and before that, a snack bar.
only the walls have changed;
they bear neither photograph
nor painting from venerable traditions.
the public space
— neither agora nor ecclesia —
incites variations
— now whispered —
on old resentments
and petty irritations
that swell and throb
like carbuncles.
the frustrations of the father,
the frustrations of the mother;
hence the progress
of nascent discontent
in offspring frustrated
over heightened
losses.
at the dinner table
reigns our same
lack of subject matter
or matter repeated
unto exhaustion. the debts
to god and to caesar.
and yes, our silence
about the only things
that could possibly save us.
if only, in an instant
of sudden lucidity,
we could drown
ice cream, pizzas and snacks
in tears, blubbering together
in the gutter. but what would
the neighbors say?
in the capitals
the intelligentsia drop their tears
— the people! the people! —
while mold and moss
gradually encroach upon
our non-mouth, our non-soul.",pt_XX,en_XX,"cultural industry
distractions for
interior families
demand human resources
of their own.
here
big actors don't come to perform,
here
the great poets aren't read,
here
the top singers don't come to sing,
here
the intelligentsia doesn't
bother with interpretations.
here,
to evangelical churches
and gyms belongs
the implementation of mens sana in corpore sano.
visits to the ice cream parlor
which was once a pizzeria
and once a diner,
only change the walls,
which bring no
photograph or painting
of centuries-old traditions.
the public space
— neither agora nor ecclesia —
provokes variations
— now in whispers —
of old grievances,
minor irritations
that accumulate
and throb like sores.
the father's frustrations,
the mother's frustrations,
and so on the ladder,
the emerging frustrations
of the entire brood, in losses
that only grow.
at the table
reigns our own lack
of dinner conversation
or the repeated topic
to exhaustion. debts
to god and to caesar.
and yes, the silence
on the only topics
that perhaps would save us.
wouldn't it be great, in a moment
of sudden clarity,
to drench now
the ice creams, pizzas, and snacks
with tears, bellowing together
in the gutter. but what would the neighbors say?
in the capitals
the intelligentsia weeps
— the people! the people! —
while mildew and moss
slowly cover our silent mouth, our silent soul.",3
"a europa em roterdão
dói-me o coração da europa, com as suas veias inchadas
pelo vento do ocidente, e as mãos gretadas pelo gelo
dos invernos. sentei-me com a europa num bar de roterdão,
desenhando na cabeça os mapas do mundo; e obriguei-a
a beber o café holandês, com os seus lábios doentes,
como se a europa não fosse o continente insone
dos últimos milénios, varrido pelos temporais da
mitologia, de crença abalada por um terror ateu.
vi a europa nesse café de roterdão, antes de sair
para as ruas desenhadas a compasso e esquadro;
perguntei-lhe para onde queria ir; e ouvi o seu
murmúrio despir-se de uma palidez plural, como
se ela quisesse ser o rosto único da multidão,
e passear num anonimato de rua cosmopolita,
ouvindo as vozes que lhe falam de ilhas e praias,
restituindo-lhe um sonho de antigas viagens.
vejo nos seus olhos um reflexo das gruas e
guindastes do porto de roterdão, e apago-o com
a borracha da eternidade, para que ela se sente
na esplanada onde lhe peço que me fale; e
ela olha-me, em silêncio, com a voz alucinada
num eco de loucura; e ouço-a dizer-me que
não sabe em que tempo vive, como se fosse
eu que lhe tivesse de ensinar o caminho.
pego na sua mão; e ela desfaz-se nas linhas
improváveis do poema, onde se projecta uma
sombra que eu perco, na noite de roterdão.","europe in rotterdam
the heart of europe is hurting me, with its veins swollen
by the wind out of the west, and its hands cracked by the ice
of winters. i sat down with europe in a rotterdam bar,
drawing the maps of the world in my mind; i made her
drink a dutch coffee, with her sick lips,
as though europe were not the insomniac continent
of the latest millennia, swept by the storms of
mythology, belief shaken by an atheist terror.
i saw europe in that café in rotterdam, before going out
into the streets drawn by compass and set square;
i asked her where she would like to go; and heard her
murmur slip out of her plural paleness, as though
she’d wanted to be the crowd’s single face,
and walk anonymously down the cosmopolitan street,
hearing the voices which speak of to her of islands and beaches,
that restore her dream of ancient voyages.
in her eyes i see a reflection of the cranes and
winches of rotterdam port, and i rub it out
with eternity’s eraser, so that she’ll sit
on the esplanade where i ask her to talk to me; and
she looks at me, in silence, with her voice crazed
by an echo of madness; and i listen to her tell me that
she doesn’t know what period she lives in, as though
it had to be me that had shown her the path.
i take her hand; she comes undone in the improbable
lines of the poem, where a shadow is
projected, which i lose, in the rotterdam night.",pt_XX,en_XX,"The heart of Europe aches in Rotterdam
Europe's heart aches, its veins swollen
By west winds, and her hands cracked by winter's frost.
In Rotterdam's bar, I sat with Europe,
Mapping worlds in my mind, forcing her to drink
Her Dutch coffee, lips sick, as if Europe weren't
The wakeful continent of the last millennia,
Swept by myth's storms, shaken by atheistic dread.
In that Rotterdam café, I saw Europe,
Before she stepped out to streets geometrically laid out;
I asked her where she wanted to go; and heard her
Murmur shed its plural pallor, as if she wished
To be the sole face of the multitude, to stroll
In a cosmopolitan street's anonymity,
Listening to voices of islands and beaches,
Restoring dreams of ancient journeys.
In her eyes, I see Rotterdam's port cranes reflected,
And erase it with the eraser of eternity,
So she sits on the terrace where I ask her to speak;
She silently gazes at me, voice hallucinated
In madness' echo, telling me she doesn't know
In what time she lives, as if I must teach her the way.
I take her hand; she dissolves into the poem's
Unlikely lines, casting a shadow I lose,
In Rotterdam's night.",3
"fala de musurukutu
rei me fizeram para governar a guerra
e do sangue da raça
me investi.
perdi o reino e a graça de uma paz
em que reinava sem ter sido eleito.
a guerra está perdida:
para me encontrar agora
é procurar pastor.
pastor que sou
ser rei não faz sentido e estar na vida
é depender da chuva
e não do mando.
que não vos dê cuidado
a minha fuga.
não fujo para reinar
porém para ter
o sol de novo às mãos
e o leite azedo.","in the words of musurukutu
they made me king to run the war
and i invested myself
with the blood of the race.
i lost my kingdom and the grace of peace
in which i reigned without being elected.
the war is lost:
to find me now
you have to look for the shepherd.
as a shepherd
it makes no sense to be a king, and to be part of life
is to depend on the rain
and not the mandate.
would that my escape
not worry you.
i don’t run away to reign
rather to have
the sun once again at hand
and the sour milk.",pt_XX,en_XX,"Musurukutu's lament
I was made to rule over war,
and from the blood of lineage,
I was anointed.
I lost my kingdom and the grace
of a peace where I reigned without election.
The war is lost:
to find me now,
look for a shepherd.
Shepherd that I am,
being king makes no sense, and to live
is to depend on rain
and not on command.
Let my escape not concern you.
I flee not to reign,
but to reclaim
the sun in my hands
and sour milk.",3
"domingo em casa
amanhã podia ser domingo, e
não haver sol; podia ouvir os sinos e
dizer que era apenas uma ilusão; podia
descer a rua e não encontrar o homem
que vende os jornais; podia chegar
ao largo e não ver as mulheres
em grupo a caminho da igreja, onde
vai começar a missa.
amanhã podia não ser domingo,
e as ruas estarem vazias como se
não houvesse nada para fazer; podia não
ser domingo e todas as lojas
fecharem; podia não
ser domingo e alguém perguntar
o que é que se faz quando não
é domingo.
amanhã podia ser um dia qualquer,
e não saber em que dia estou; podia
olhar para o relógio e descobrir que
os ponteiros estão parados; podia
ouvir alguém falar, e não saber de onde
vem a voz que sai da sua boca, como
se estivesse sozinho.
ou então, podia abrir a porta e
ver que o domingo quer entrar; e
puxá-lo para dentro da casa, para
que lá fora fique sem domingo; e
sair para a rua num dia qualquer,
perguntando a quem passa
se viu passar o domingo.","sunday at home
tomorrow might be sunday, and
sunless; i might hear the bells and
say that it was just an illusion; i might
go down to the street and not find the man
who sells newspapers; i might go as far as
the square and not see the women
moving in a group towards church, where
mass is about to begin.
tomorrow might not be sunday,
and the streets empty as though
there were nothing to do; it might not
be sunday, and all the stores
closed; it might not
be sunday and someone asking
what does one do when it is
not sunday.
tomorrow might be any day,
and i not knowing what day it is; i might
look at my watch and discover that
its hands have stopped; i might
here someone speaking, and have no idea where
the voice that comes from their mouth comes from,
as though i were all alone.
and then, i might open the door and
see that sunday wants to come in; and
pull it into my house, so that
the outside was left sundayless; and
go out into the street on any day
whatsoever, asking passersby
if they saw which way sunday went.",pt_XX,en_XX,"Sunday at home
Tomorrow could be Sunday, and
there needn't be any sun; I could hear the bells and
say it was just an illusion; I might walk down the street and
not find the man who sells newspapers; I might arrive
at the square and not see the women
in groups on their way to church, where
the mass will begin.
Tomorrow might not be Sunday,
and the streets could be empty as if
there was nothing to do; it might not be Sunday and all
the shops could be closed; it could not
be Sunday and someone might ask
what to do when it's not Sunday.
Tomorrow could be just another day,
and I might not know what day it is; I could look
at the clock and find the hands are still; I might hear
someone speak, and not know where
the voice comes from, as if
I were alone.

Or, I might open the door and
see that Sunday wants to enter; and
pull it into the house, so
outside there's no Sunday; and
step out into the street on just another day,
asking those who pass
if they saw Sunday go by.",3
"roteiro
fui a delft, à procura de cerâmica.
fui à cerâmica, à procura de delft.
nos mapas, não vinham nem delft
nem a cerâmica.
os mapas, porém, tinham tudo
de delft,
e tinham tudo de cerâmica:
as cores,
as linhas, as fronteiras.
pus os mapas na parede.
também pus delft na parede.
e fiquei com uma cerâmica de delft.","itinerary
i went to delft, looking for ceramics.
i went to ceramics, looking for delft.
on the maps, neither delft nor
ceramics appeared.
the maps, however, had everything
delft had.
and everything that ceramics had:
the colors,
the lines, the borders.
i put the maps on the wall.
i also put delft on the wall,
and ended up with ceramics from delft.",pt_XX,en_XX,"itinerary
I went to Delft in search of porcelain.
I went to the porcelain in search of Delft.
Maps showed no trace of Delft,
nor of the porcelain.
Yet the maps held all of Delft,
and all of the porcelain:
the hues,
the lines, the borders.
I hung the maps on the wall.
I also hung Delft upon the wall.
And thus I crafted Delft's porcelain dream.",3
"minha pátria
minha pátria não é a língua portuguesa.
nenhuma língua é a pátria.
minha pátria é a terra mole e peganhenta onde nasci
e o vento que sopra em maceió.
são os caranguejos que correm na lama dos mangues
e o oceano cujas ondas continuam molhando os meus pés quando sonho.
minha pátria são os morcegos suspensos no forro das igrejas carcomidas,
os loucos que dançam ao entardecer no hospício junto ao mar,
e o céu encurvado pelas constelações.
minha pátria são os apitos dos navios
e o farol no alto da colina.
minha pátria é a mão do mendigo na manhã radiosa.
são os estaleiros apodrecidos
e os cemitérios marinhos onde os meus ancestrais tuberculosos e implaudados não não param de tossir e tremer nas noite frias
e o cheiro de açúcar nos armazéns portuários
e as tainhas que se debatem nas redes dos pescadores
e as résteas de cebola enrodilhadas na treva
e a chuva que cai sobre os currais de peixe.
a língua de que me utilizo não é e nunca foi a minha pátria.
nenhuma língua enganosa é a pátria.
ela serve apenas para que eu celebre a minha grande e pobre pátria muda,
minha pátria desintérica e desdentada, sem gramática e sem dicionário,
minha pátria sem língua e sem palavras.","my home
the portuguese language is not my home.
no language is a home.
my home is the soft and viscous land where i was born
and the waft of the wind in maceió.
it is the crabs scurrying through the muck of mangrove swamps
and the ocean whose waves still wet my feet when i dream.
my home is bats hanging from the ceiling of churches in decay,
madmen dancing at sunset in the asylum by the sea,
and the sky curved round by constellations.
my home is the sound of the ship’s horn
and the lighthouse high on the hill.
my home is the beggar’s hand in radiant morning.
and the rotting shipyards
and the graves by the sea where my ancestors, consumptive
and malarial, can’t stop coughing and trembling on cold nights
and the smell of sugar in warehouses along the wharves
and mullets struggling in the fishermen’s nets
and strands of onions tangled in the dark
and rain falling over the fish pens.
the language i use is not and never was my home.
no deceitful language is a home.
it merely serves for me to celebrate my great impoverished silent land,
my dysentery-ridden toothless home, devoid of grammar books and dictionaries,
this land, my home, without language, without words.",pt_XX,en_XX,"my homeland
my homeland isn't the Portuguese language.
no language is one's homeland.
my homeland is the soft and sticky earth where i was born
and the wind that blows in maceió.
they are the crabs that scurry through the mud of the mangroves
and the ocean whose waves keep wetting my feet when i dream.
my homeland is the bats hanging from the ceilings of decaying churches,
the lunatics who dance at dusk by the sea,
and the sky bowed by constellations.
my homeland is the whistles of the ships
and the lighthouse at the top of the hill.
my homeland is the beggar's hand in the radiant morning.
they are the rotting shipyards
and the marine cemeteries where my tubercular and uncelebrated ancestors never stop coughing and trembling in the cold nights
and the scent of sugar in the port warehouses
and the mullets struggling in the fishermen's nets
and the strands of onions coiled in the darkness
and the rain that falls on the fish corrals.
the language i use isn't and never was my homeland.
no deceptive language is one's homeland.
it serves only to celebrate my large and poor speechless homeland,
my homeland destitute of rhetoric and teeth,
my homeland without language or words.",3
