original_poem,translated_poem,src_lang,tgt_lang
"Um dia a areia branca
Teus pés irão tocar
E vai molhar seus cabelos
A água azul do mar
 Janelas e portas vão se abrir
Pra ver você chegar
E ao se sentir em casa
Sorrindo vai chorar
 Debaixo dos caracóis dos seus cabelos
Uma história pra contar
De um mundo tão distante
Debaixo dos caracóis dos seus cabelos
Um soluço e a vontade
De ficar mais um instante
 As luzes e o colorido
Que você vê agora
Nas ruas por onde anda
Na casa onde mora
 Você olha tudo e nada
Lhe faz ficar contente
Você só deseja agora
Voltar pra sua gente
 Debaixo dos caracóis dos seus cabelos
Uma história pra contar
De um mundo tão distante
Debaixo dos caracóis dos seus cabelos
Um soluço e a vontade
De ficar mais um instante
 Você anda pela tarde
E o seu olhar tristonho
Deixa sangrar no peito
Uma saudade, um sonho
 Um dia vou ver você
Chegando num sorriso
Pisando a areia branca
Que é seu paraíso
 Debaixo dos caracóis dos seus cabelos
Uma história pra contar
De um mundo tão distante
Debaixo dos caracóis dos seus cabelos
Um soluço e a vontade
De ficar mais um instante","Un jour tes pieds vont toucher
Le sable blanc
Et l'eau bleue de la mer
Va mouiller tes cheveux
 Les fenêtres et les portes vont s'ouvrir
Pour te voir arriver
Et à te sentir chez toi,
Souriant tu vas pleurer
 Sous les boucles de tes cheveux
Une histoire d'un monde
Si distant à raconter
Sous les boucles de tes cheveux
Un sanglot et l'envie
De rester un instant de plus
 La lumière et la couleur
Que tu vois maintenant
Dans les rues où tu marches,
Dans la maison où tu habites
 Tu regardes tout et rien
Ne te rend content
Tu désires seulement maintenant
Retourner auprès des tiens
 Sous les boucles de tes cheveux
Une histoire d'un monde
Si distant à raconter
Sous les boucles de tes cheveux
Un sanglot et l'envie
De rester un instant de plus
 Tu marches l'après-midi
Et ton regard tristounet
Fais saigner dans la poitrine
Une nostalgie et un rêve
 Un jour je vais te voir
Arriver en souriant
Foulant le sable blanc
Qui est ton paradis
 Sous les boucles de tes cheveux
Une histoire d'un monde
Si distant à raconter
Sous les boucles de tes cheveux
Un sanglot et l'envie
De rester un instant de plus",pt_XX,fr_XX
"Quando você me deixou, meu bem,
Me disse pra ser feliz e passar bem.
Quis morrer de ciúme, quase enlouqueci,
Mas depois, como era de costume, obedeci.
 Quando você me quiser rever
Já vai me encontrar refeita, pode crer.
Olhos nos olhos,
Quero ver o que você faz
Ao sentir que sem você eu passo bem demais
 E que venho até remoçando,
Me pego cantando, sem mais, nem por quê.
Tantas águas rolaram,
Quantos homens me amaram
Bem mais e melhor que você.
 Quando talvez precisar de mim,
Cê sabe que a casa é sempre sua, venha sim.
Olhos nos olhos,
Quero ver o que você diz.
Quero ver como suporta me ver tão feliz","Quand tu m'as quitté, mon amour,
Tu m'as dit d'être heureux, d'aller bien.
J'ai voulu mourir de jalousie, j'ai failli devenir fou,
Mais après, comme d'habitude, j'ai obéis.
 Quand tu voudras me revoir
Tu me trouveras comme neuve, tu peux le croire.
Les yeux dans les yeux,
Je veux voir ce que tu fais
Quand tu entendras que sans toi, je vais très bien
 Et je rajeunis même
Je me retrouve à chanter, ni plus, sans raison.
Tant d'eau a coulé,
Tant d'hommes m'auront aimé
Bien plus et mieux que toi.
 Quand tu auras besoin de moi,
Tu sais que que tu es toujours chez toi ici, oui, viens.
Les yeux dans les yeux,
Je veux voir ce que tu dis.
Je veux voir comment tu supportes de me voir si heureuse.",pt_XX,fr_XX
"Eu vou lhe dar a medida do Bonfim
Não me valeu
Mas fico com o disco do Pixinguinha, sim?
O resto é seu
Trocando em miúdos, pode guardar
As sobras de tudo que chamam lar
As sombras de tudo que fomos nós
As marcas de amor nos nossos lençóis
As nossas melhores lembranças
Aquela esperança de tudo se ajeitar
Pode esquecer
Aquela aliança, você pode empenhar
Ou derreter
Mas devo dizer que não vou lhe dar
O enorme prazer de me ver chorar
Nem vou lhe cobrar pelo seu estrago
Meu peito tão dilacerado
Aliás
Aceite uma ajuda do seu futuro amor
Pro aluguel
Devolva o Neruda que você me tomou
E nunca leu
Eu bato o portão sem fazer alarde
Eu levo a carteira de identidade
Uma saideira, muita saudade
E a leve impressão de que já vou tarde","Je vais te donner le bracelet de Bonfim
Il ne m'a servi à rien
Mais je garde le disque de Pixinguinha, ok ?
Le reste est à toi
Parlons sérieusement, tu peux garder
Les restes de tout ce qu'on appelle un foyer
Les ombres de tout ce que nous avons été
Nos marques d'amour, nos mouchoirs
Nos meilleurs souvenirs
Cette espérance que tout s'harmonise
Tu peux les oublier
Cette alliance, tu peux l'hypothéquer
Ou la faire fondre
Mais je dois te dire que je ne vais pas te donner
L'énorme plaisir de me voir pleurer
Je ne vais même pas te réclamer de dommages
Pour mon cœur déchiré
D'ailleurs
Accepte une aide de ton futur amant
Pour le loyer
Rends-moi le Neruda que tu m'as pris
Et n'as jamais lu
Je ferme la porte sans faire de scandale
J'emporte la carte d'identité
Un bonnet de nuit, beaucoup de nostalgie
Et la légère impression que je m'en vais un peu tard",pt_XX,fr_XX
"Olha que coisa mais linda
Mais cheia de graça
É ela menina
Que vem e que passa
Seu doce balanço, a caminho do mar
 Moça do corpo dourado
Do sol de Ipanema
O seu balançado é mais que um poema
É a coisa mais linda que eu já vi passar
 Ah, porque estou tão sozinho
Ah, porque tudo é tão triste
Ah, a beleza que existe
A beleza que não é só minha
Que também passa sozinha
 Ah, se ela soubesse
Que quando ela passa
O mundo inteirinho se enche de graça
E fica mais lindo
Por causa do amor","Regarde quelle jolie chose
Si pleine de grâce
C'est elle la fille
Qui vient et qui passe
Dans un doux balancement, sur le chemin de la mer
 Jeune fille au corps doré
Par le soleil d'Ipanema
Son balancement est plus qu'un poème
C'est la plus jolie chose que j'ai déjà vu passer
 Ah, pourquoi suis-je si seul
Ah, pourquoi tout est si triste ?
Ah, la beauté qui existe
La beauté qui n'est pas rien qu'à moi
Elle qui aussi marche seule
 Ah, si elle savait
Que quand elle passe
Le monde entier se remplit de grâce
Et devient plus joli
À cause de l'amour",pt_XX,fr_XX
"Tu ris, tu mens trop
Tu pleures, tu meurs trop
Tu as le tropique
Dans le sang et sur la peau
Geme de loucura e de torpor
Já é madrugada
Acorda, acorda, acorda, acorda, acorda
 Mata-me de rir
Fala-me de amor
Songes et mensonges
Sei de longe e sei de cor
Geme de prazer e de pavor
Já é madrugada
Acorda, acorda, acorda, acorda, acorda
 Vem molhar meu colo
Vou te consolar
Vem, mulato mole
Dançar dans mes bras
Vem, moleque me dizer
Onde é que está
Ton soleil, ta braise
 Quem me enfeitiçou
O mar, marée, bateau
Tu as le parfum
De la cachaça e de suor
Geme de preguiça e de calor
Já é madrugada
Acorda, acorda, acorda, acorda, acorda","Tu ris, tu mens trop
Tu pleures, tu meurs trop
Tu as le tropique
Dans le sang et sur la peau
Tu gémis de folie et de torpeur
C'est déjà l'aube
Réveille-toi, réveille-toi, réveille-toi, réveille-toi, réveille-toi
 Tue-moi de rire
Parle-moi d'amour
Les songes et les mensonges
Je les connais de loin, je les connais par cœur
Tu gémis de folie et de torpeur
C'est déjà l'aube
Réveille-toi, réveille-toi, réveille-toi, réveille-toi, réveille-toi
 Viens mouiller mes genoux
Je vais te consoler
Viens, métis mou
Danser dans mes bras
Viens me dire, gamin
Où est
Ton soleil, ta braise
 Qui m'a ensorcelée
La mer, la marée, le bateau
Tu as le parfum
De la cachaça et de la sueur
Tu gémis de paresse et de chaleur
C'est déjà l'aube
Réveille-toi, réveille-toi, réveille-toi, réveille-toi, réveille-toi",pt_XX,fr_XX
"Não chore ainda não, que eu tenho um violão
E nós vamos cantar
Felicidade aqui pode passar e ouvir
E se ela for de samba há de querer ficar
Seu padre toca o sino que é pra todo mundo saber
Que a noite é criança, que o samba é menino
Que a dor é tão velha que pode morrer
Olê, olê, olê, olá
Tem samba de sobra, quem sabe sambar
Que entre na roda, que mostre o gingado
Mas muito cuidado, não vale chorar
 Não chore ainda não, que eu tenho uma razão
Pra você não chorar
Amiga, me perdoa, se eu insisto à toa
Mas a vida é boa para quem cantar
Meu pinho, toca forte que é pra todo mundo acordar
Não fale da vida, nem fale da morte
Tem dó da menina, não deixa chorar
Olê, olê, olê, olá
Tem samba de sobra, quem sabe sambar
Que entre na roda, que mostre o gingado
Mas muito cuidado, não vale chorar
 Não chore ainda não, que eu tenho a impressão
Que o samba vem aí
É um samba tão imenso que eu às vezes penso
Que o próprio tempo vai parar pra ouvir
Luar, espere um pouco, que é pra o meu samba poder chegar
Eu sei que o violão está fraco, está rouco
Mas a minha voz não cansou de chamar
Olê, olê, olê, olá
Tem samba de sobra, ninguém quer sambar
Não há mais quem cante, nem há mais lugar
O sol chegou antes do samba chegar
Quem passa nem liga, já vai trabalhar
E você, minha amiga, já pode chorar","Ne pleure pas encore, car j'ai une guitare
Et nous allons chanter
Le bonheur pourrait passer par ici et entendre
Et s'il aime la samba il voudra rester
Ton curé fait sonner les cloches pour que tout le monde sache
Que la nuit est une enfant, que la samba est gamine
Que la douleur est si vieille qu'elle peut mourir
Olê, olê, olê, olá
Il reste encore de la samba, que celui qui sait danser
Entre dans la ronde, qu'il montre son déhanchement
Mais attention, il ne faut pas pleurer
 Ne pleure pas encore, car j'ai une raison
Pour que tu ne pleures pas
Amie, pardonne-moi si j'insiste en vain
Mais la vie est belle pour celui qui chante
Ma guitare, joue fort pour que tout le monde se réveille
Ne parle pas de la vie, ni de la mort
Aie pitié de la fille, ne la laisse pas pleurer
Olê, olê, olê, olá
Il reste encore de la samba, que celui qui sait danser
Entre dans la ronde, qu'il montre son déhanchement
Mais attention, il ne faut pas pleurer
 Ne pleure pas encore, car j'ai l'impression
Que la samba arrive
C'est une samba si grande que parfois je pense
Que le temps lui-même va s'arrêter pour écouter
Clair de lune, attends un peu, que ma samba puisse arriver
Je sais que ma guitare est faible, qu'elle est rauque
Mais ma voix ne s'est pas fatiguée de l'appeler
Olê, olê, olê, olá
Il reste encore de la samba, personne ne veut danser
Il n'y a personne qui chante, il n'y a plus d'endroit
Le soleil est arrivé avant la samba
Ceux qui passent ne font même pas attention, ils vont travailler
Et toi, mon amie, tu peux maintenant pleurer",pt_XX,fr_XX
"Estava à toa na vida
O meu amor me chamou
Pra ver a banda passar
Cantando coisas de amor
 A minha gente sofrida
Despediu-se da dor
Pra ver a banda passar
Cantando coisas de amor
 O homem sério que contava dinheiro parou
O faroleiro que contava vantagem parou
A namorada que contava as estrelas parou
Para ver, ouvir e dar passagem
 A moça triste que vivia calada sorriu
A rosa triste que vivia fechada se abriu
E a meninada toda se assanhou
Pra ver a banda passar
Cantando coisas de amor
 Estava à toa na vida
O meu amor me chamou
Pra ver a banda passar
Cantando coisas de amor
 A minha gente sofrida
Despediu-se da dor
Pra ver a banda passar
Cantando coisas de amor
 O velho fraco se esqueceu do cansaço e pensou
Que ainda era moço pra sair no terraço e dançou
A moça feia debruçou na janela
Pensando que a banda tocava pra ela
 A marcha alegre se espalhou na avenida e insistiu
A lua cheia que vivia escondida surgiu
Minha cidade toda se enfeitou
Pra ver a banda passar cantando coisas de amor
 Mas para meu desencanto
O que era doce acabou
Tudo tomou seu lugar
Depois que a banda passou
 E cada qual no seu canto
Em cada canto uma dor
Depois da banda passar
Cantando coisas de amor
Depois da banda passar
Cantando coisas de amor...","J'étais en train de ne rien faire
Mon amour m'a appelé
Pour voir la troupe passer
Chantant des choses d'amour
 Les gens qui souffraient
Ont quitté leur douleur
Pour voir la troupe passer
Chantant des choses d'amour
 L'homme sérieux qui comptait son argent s'est arrêté
Le fanfaron qui comptait des avantages s'est arrêté
L'amoureuse qui comptait les étoiles s'est arrêtée
Pour voir, écouter et laisser le passage.
 La fille triste qui vivait muette a souri
La rose triste qui vivait fermée s'est ouverte
Tous les enfants se sont excités
Pour voir la troupe passer
Chantant des choses d'amour
 J'étais en train de ne rien faire
Mon amour m'a appelé
Pour voir la troupe passer
Chantant des choses d'amour
 Les gens qui souffraient
Ont quitté leur douleur
Pour voir la troupe passer
Chantant des choses d'amour
 Le vieux faible a oublié sa fatigue et a pensé
Qu'il était encore jeune pour sortir sur la terrasse et danser
La fille laide s'est penchée à la fenêtre
Pensant que la troupe jouait pour elle
 La marche joyeuse s'est répandue dans l'avenue et a insisté
La pleine lune qui vivait cachée a surgi
Ma ville entière s'est embellie
Pour voir la troupe passer chantant des choses d'amour
 Mais pour mon désenchantement
Ce qui était bon s'est terminé
Tout a repris sa place
Après que la troupe soit passée
 Et chacun retourne dans son coin
Dans chaque coin il y a une douleur
Après que la troupe soit passée
Chantant des choses d'amour
Après que la troupe soit passée
Chantant des choses d'amour",pt_XX,fr_XX
"Você era a mais bonita das cabrochas dessa ala
Você era a favorita onde eu era mestre-sala
Hoje a gente nem se fala mas a festa continua
Suas noites são de gala, nosso samba ainda é na rua
 Hoje o samba saiu, lá lalaiá, procurando você
Quem te viu, quem te vê
Quem não a conhece não pode mais ver pra crer
Quem jamais esquece não pode reconhecer
 Quando o samba começava você era a mais brilhante
E se a gente se cansava você só seguia a diante
Hoje a gente anda distante do calor do seu gingado
Você só dá chá dançante onde eu não sou convidado
 O meu samba assim marcava na cadência os seus passos
O meu sonho se embalava no carinho dos seus braços
Hoje de teimoso eu passo bem em frente ao seu portão
Pra lembrar que sobra espaço no barraco e no cordão
 Todo ano eu lhe fazia uma cabrocha de alta classe
De dourado eu lhe vestia pra que o povo admirasse
Eu não sei bem com certeza porque foi que um belo dia
Quem brincava de princesa acostumou na fantasia
 Hoje eu vou sambar na pista, você vai de galeria
Quero que você me assista na mais fina companhia
Se você sentir saudade por favor não de na vista
Bate palma com vontade, faz de conta que é turista","Tu étais la plus jolie des négresses de cette aile
Tu étais la favorite où j'étais maître de cérémonie
Aujourd'hui on ne se parle même plus mais la fête continue
Tes nuits sont de gala, notre samba est encore dans la rue.
 Aujourd'hui la samba est de sortie, lalalala, à ta recherche
Qui t'a vue, qui te voit
Qui ne te connaît pas ne peut plus le voir pour le croire
Qui n'oublie jamais ne peut pas reconnaître
 Quand la samba a commencé tu étais la plus brillante
Si on se fatiguait tu continuais seule devant
Aujourd'hui je marche loin de la chaleur de ton déhanchement
Tu ne donnes que des thés dansants où je ne suis pas invité
 Ma samba marquait ainsi la cadence de tes pas
Mon rêve s'emballait dans la tendresse de tes bras
Aujourd'hui je passe têtu bien en face de ton portail
Pour te rappeler qu'il reste de la place dans ma baraque et dans le cortège
 Chaque année je te transformais en danseuse de grande classe
Je te couvrais de dorures pour que le peuple t'admire
Je ne sais pas avec certitude pourquoi un beau jour
Celle qui jouait à la princesse s'est habituée au déguisement
 Aujourd'hui je vais danser la samba sur la piste, tu seras dans la galerie
Je veux que tu me regardes en bonne compagnie
Si tu as des regrets s'il te plaît ne le montre pas
Applaudis avec envie, fais semblant d'être une touriste.",pt_XX,fr_XX
"Com açúcar, com afeto,
Fiz seu doce predileto
Pra você parar em casa,
Qual o quê
Com seu terno mais bonito,
Você sai, não acredito
Quando diz que não se atrasa
 Você diz que é um operário,
Sai em busca do salário
Pra poder me sustentar,
Qual o quê
No caminho da oficina,
Existe um bar em cada esquina
Pra você comemorar,
Sei lá o quê
 Sei que alguém vai sentar junto,
Você vai puxar assunto
Discutindo futebol
E ficar olhando as saias
De quem vive pelas praias
Coloridas pelo sol
 Vem a noite e mais um copo,
Sei que alegre ma non troppo
Você vai querer cantar
Na caixinha um novo amigo
Vai bater um samba antigo
Pra você rememorar
 Quando a noite enfim lhe cansa,
Você vem feito criança
Pra chorar o meu perdão,
Qual o quê
Diz pra eu não ficar sentida,
Diz que vai mudar de vida
Pra agradar meu coração
 E ao lhe ver assim cansado,
Maltrapilho e maltratado
Ainda quis me aborrecer,
Qual o quê
Logo vou esquentar seu prato,
Dou um beijo em seu retrato
E abro os meus braços pra você","Avec du sucre, avec amour,
J’ai fait ton dessert favori
Pour que tu restes à la maison,
À quoi bon ?
Dans ton plus beau costume,
Tu sors, je ne te crois pas
Quand tu dis que tu ne tarderas pas.
 Tu dis que tu es un travailleur,
Que tu sors à la recherche d'un salaire
Pour pouvoir subvenir à mes besoins,
À quoi bon ?
Sur le chemin du bureau,
Existe un bar à chaque coin de rues
Pour commémorer,
Va savoir quoi ?
 Je sais que quelqu’un va s'asseoir à côté de toi,
Tu vas engager la conversation
En discutant de football
Et tu resteras là, à regarder les jupes
De celles qui vivent sur les plages
Colorées par le soleil.
 La nuit vient, encore un verre,
Je sais que joyeux, ""ma non troppo""
Tu vas vouloir chanter
Sur une caisse un nouvel ami
Va rythmer une vieille samba
Pour te souvenir du bon temps
 Quand la nuit enfin te lasse,
Tu reviens, comme un enfant
Pour implorer mon pardon,
À quoi bon ?
Tu me demandes de ne pas être désolée,
Tu dis que tu vas changer de vie
Pour plaire à mon cœur
 Et à te voir ainsi fatigué,
Mal vêtu et maltraité,
J'ai failli encore me fâcher,
À quoi bon ?
Je vais tout de suite réchauffer ton plat,
J’embrasse ton portrait
Et je t’ouvre mes bras.",pt_XX,fr_XX
"Dia de luz, festa de sol
E o barquinho a deslizar
No macio azul do mar
Tudo é verão, o amor se faz
No barquinho pelo mar
Que desliza sem parar
Sem intenção, nossa canção
Vai saindo desse mar
E o sol
Beija o barco e luz
Dias tão azuis
 Volta do mar, desmaia o sol
E o barquinho a deslizar
E a vontade de cantar
Céu tão azul, ilhas do sul
E o barquinho, coração
Deslizando na canção
Tudo isso é paz
Tudo isso traz
Uma calma de verão
E então
O barquinho vai
E a tardinha cai","Jour de lumière, fête du soleil
Et un petit bateau qui glisse
Sur l'azur doux de la mer
C'est le plein été, on fait l'amour
Dans le bateau sur la mer
Qui glisse sans arrêt
Sans intention, notre chanson
Va sortir de cette mer
Et le soleil
Embrasse le bateau et luit
En ces jours si bleus
 Retour de mer, le soleil s'évanouit
Et le petit bateau glisse
Et l'envie de chanter
Sous un ciel si bleu, dans les îles du sud
Et le petit bateau, cœur
Qui glisse dans cette chanson
Tout cela sent bon la paix
Tout cela apporte
Le calme de l'été
Et alors
Le petit bateau s'en va
Et le soir tombe",pt_XX,fr_XX
"O que será, que será
Que andam suspirando pelas alcovas
Que andam sussurando em versos e trovas
Que andam combinando no breu das tocas
Que anda nas cabeças, anda nas bocas
Que andam acendendo velas nos becos
Que estão falando alto pelos botecos
Que gritam nos mercados, que com certeza
Está na natureza, será que será
O que não tem certeza, nem nunca terá
O que não tem conserto, nem nunca terá
O que não tem tamanho
O que será que será
Que vive nas idéias desses amantes
Que cantam os poetas mais delirantes
Que juram os profetas embriagados
Que está na romaria dos mutilados
Que está na fantasia dos infelizes
Que está no dia a dia das meretrizes
No plano dos bandidos, dos desvalidos
Em todos os sentidos, será que será
O que não tem decência, nem nunca terá
O que não tem censura, nem nunca terá
O que não faz sentido
O que será que será
Que todos os avisos não vão evitar
Porque todos os risos vão desafiar
Porque todos os sinos irão repicar
Porque todos os hinos irão consagrar
E todos os meninos vão desembestar
E todos os destinos irão se encontrar
E o mesmo Padre Eterno que nunca foi lá
Olhando aquele inferno, vai abençoar
O que não tem governo, nem nunca terá
O que não tem vergonha nem nunca terá
O que não tem juizo
O que não tem juizo
O que será que serà..........","Qu'en sera-t-il, sera-il ?
De ceux qui marchent en soupirant dans les alcôves
De ceux qui marchent en combinant dans l'obscurité des antres
De ce qui trotte dans les têtes, qui sort des bouches
De ceux qui vont allumer des bougies dans les ruelles
De ceux qui parlent fort dans les bars
Qui crient sur les marchés, ce qui bien sûr
Est naturel, Qu'en sera-t-il ?
De ce qui n'est pas certain et ne le sera jamais
De ce qui ne se répare pas, et ne le sera jamais
De ce qui n'a pas de taille
Qu'en sera-t-il, sera-t-il ?
De ceux qui vivent dans les idées de ces amants
De ce que chantent les poètes les plus délirants
De ce que jurent les prophètes enivrés
De ceux qui sont dans le pèlerinage des mutilés
De ceux qui sont dans la fantaisie des malheureux
De ceux qui vivent le quotidien des putains
Dans les plans des bandits, des déshérités
Dans tous les sens du terme, qu'en sera-t-il ?
De ce qui n'a pas de décence, ni n'en aura jamais
De ce qui n'a pas de censure, ni n'en aura jamais
De ce qui n'a pas de sens
Qu'en sera-t-il, sera-t-il ?
Car tous les avis ne vont rien éviter
Car tous les rires vont défier
Car toutes les cloches vont carillonner
Car tous les hymnes vont consacrer
Et tous les enfants ne seront plus bêtes
Et tous les destins vont se rencontrer
Et même le Père Éternel qui n'a jamais été là
Regardant cet enfer, va bénir
Ce qui n'a pas de gouverne ni n'en aura jamais
Ce qui n'a pas de honte ni n'en aura jamais
Ce qui n'a pas de raison
Ce qui n'a pas de raison
Qu'en sera-t-il, sera-t-il.......",pt_XX,fr_XX
"Tristeza não tem fim
Felicidade sim
 A felicidade é como a pluma
Que o vento vai levando pelo ar
Voa tão leve mas tem a vida breve
Precisa que haja vento sem parar
 A felicidade do pobre parece
A grande ilusão do carnaval
A gente trabalha o ano inteiro
Por um momento de sonho
Pra fazer a fantasia
De rei ou de pirata ou jardineira
E tudo se acabar na quarta-feira
 Tristeza não tem fim
Felicidade sim...
 A felicidade é como a gota
De orvalho numa pétala de flor
Brilha tranquila depois de leve oscila
E cai como uma lágrima de amor
 A minha felicidade está sonhando
Nos olhos da minha namorada
É como esta noite
Passando, passando
Em busca da madrugada
Falem baixo, por favor
Pra que ela acorde alegre como o dia
Oferecendo beijos de amor
 Tristeza não tem fim
Felicidade sim...","La tristesse n'a pas de fin
Le bonheur si
 Le bonheur est comme la plume
Que le vent emporte dans l'air
Elle vole si légère mais sa vie est brève
Il faut qu'il y ait du vent sans arrêt
 Le bonheur des pauvres ressemble
A la grande illusion du carnaval
Les gens travaillent toute l'année
Pour un moment de rêve
Pour faire le déguisement
Du roi ou du pirate ou de la jardinière
Et tout se termine le mercredi
 La tristesse n'a pas de fin
Le bonheur si
 Le bonheur est comme une goutte
De rosée sur un pétale de fleur
Elle brille tranquillement, ensuite oscille légèrement
Et tombe comme une larme d'amour
 Mon bonheur rêve
Dans les yeux de ma petite amie
Il est comme cette nuit
Qui passe, passe
A la recherche de l'aube
Parlez doucement, s'il vous plaît
Pour qu'elle se réveille joyeuse comme le jour
En offrant des baisers d'amour
 La tristesse n'a pas de fin
Le bonheur si",pt_XX,fr_XX
"Vai minha tristeza
E diz a ela
Que sem ela não pode ser
Diz-lhe numa prece
Que ela regresse
Por que eu não posso mais sofrer
Chega de saudade
A realidade
É que sem ela não há paz
Não há beleza
É só tristeza
E a melancolia
Que não sai de mim
Não sai de mim, não sai
 Mas se ela voltar, se ela voltar
Que coisa linda, que coisa louca
Pois há menos peixinhos a nadar no mar
Do que os beijinhos
Que eu darei na sua boca
 Dentro dos meus braços
Os abraços
Hão de ser milhões de abraços
Apertado assim
Colado assim
Calado assim
Abraços e beijinhos
E carinhos sem ter fim
Que é pra acabar com esse negócio
De você viver sem mim
Não quero mais esse negócio
De você viver sem mim","Va-t-en, tristesse
Et dis-lui
Que sans elle ce n'est pas possible
Dis-lui une prière
Qu'elle revienne
Car je ne peux plus souffrir
Assez de cette tristesse
La vérité
C'est qu'il n'y a pas de paix sans elle
Il n'y a pas de beauté
Juste de la tristesse
Et la mélancolie
Ne me lâche pas
Ne me lâche pas, ne me lâche pas
 Mais si elle revient, si elle revient
Quelle beauté, quelle folie ce sera
Car il y a moins de petits poissons qui nagent dans la mer
Que de petits baisers
Que je poserai sur sa bouche
 Entre mes bras
Les embrassades
Devront être des millions
Serrés comme ça
Collés comme ça
Silencieux comme ça
Embrassades et petits baisers
Et des caresses sans fin
Car il faut en finir avec cette histoire
De vivre sans moi
Je ne veux plus cette histoire
De vivre sans moi.",pt_XX,fr_XX
