original_poem,translated_poem,src_lang,tgt_lang
"Ô mamãe, eu quero eu quero
Brilhantina pro cabelo,
Meu cabelo é marombado,
Só bota banha de cheiro.
 As moças de Moxotó,
Foram à rua passear
Foram ao jogo do bilhar
Em capital de Maceió
Jogar no dominó
E telegrafa pra Penedo
E eu perdi o medo,
Eu perdi o medo
De jogar no futebol
 Eu quero a chave do portão
Pra destrancar meu jardim
Meu galhinho de alecrim
Tranquei Rosa na mão
Galho de manjericão
E anda a roda brilhantina
Laranjeira é lima
Ô laranja lima é limão","Ô maman, je veux, je veux
De la brillantine pour mes cheveux,
Mes cheveux sont faux
Alors mets de la graisse de porc parfumée
 Les filles de Moxotó,
Sont allées se promener dans la rue
Elles sont allées jouer au billard
Dans la capitale Maceió
Jouer aux dominos
Et télégraphe à Penedo
Que j'ai perdu la peur,
J'ai perdu la peur
De jouer au football
 Je veux la clé du portail
Pour ouvrir mon jardin
Mon petit brin de romarin
J'ai enfermé une rose dans ma main
Un brin de basilic
Et tourne la ronde de brillantine
Oranger et citron vert
Ô orange, citron vert et citron",pt_XX,fr_XX
"Moreno, não me abandona
Que viver sozinha
Não é possível.
 Moreno, não me abandona
Que viver sozinha
Não é possível.
 Volta e vem me amar
Enxuga as lágrimas
Faz um sorriso.
 Volta e vem me amar
Enxuga as lágrimas
Faz um sorriso...
 Moreno, não me abandona
Que viver sozinha
Não é possível.
 Moreno, não me abandona
Que viver sozinha
Não é possível.
 Volta e vem me amar
Enxuga as lágrimas
Faz um sorriso.
 Volta e vem me amar
Enxuga as lágrimas
Faz um sorriso...
 Moreno, não me abandona
Que viver sozinha
Não é possível.
 Moreno, não me abandona
Que viver sozinha
Não é possível.
 Volta e vem me amar
Enxuga as lágrimas
Faz um sorriso.
 Volta e vem me amar
Enxuga as lágrimas
Faz um sorriso","Moreno *, ne m'abandonne pas
Car vivre toute seule
N'est pas possible
 Moreno, ne m'abandonne pas
Car vivre toute seule
N'est pas possible
 Reviens et viens m'aimer
Essuie les larmes
Fais un sourire.
 Reviens et viens m'aimer
Essuie les larmes
Fais un sourire...
 Moreno, ne m'abandonne pas
Car vivre toute seule
N'est pas possible
 Moreno, ne m'abandonne pas
Car vivre toute seule
N'est pas possible
 Reviens et viens m'aimer
Essuie les larmes
Fais un sourire.
 Reviens et viens m'aimer
Essuie les larmes
Fais un sourire...
 Moreno, ne m'abandonne pas
Car vivre toute seule
N'est pas possible
 Moreno, ne m'abandonne pas
Car vivre toute seule
N'est pas possible
 Reviens et viens m'aimer
Essuie les larmes
Fais un sourire.
 Reviens et viens m'aimer
Essuie les larmes
Fais un sourire",pt_XX,fr_XX
"Não sou nada.
Nunca serei nada.
Não posso querer ser nada.
À parte isso, tenho em mim todos os sonhos do mundo.
 Janelas do meu quarto,
Do meu quarto de um dos milhões do mundo que ninguém sabe quem é
(E se soubessem quem é, o que saberiam?),
Dais para o mistério de uma rua cruzada constantemente por gente,
Para uma rua inacessível a todos os pensamentos,
Real, impossivelmente real, certa, desconhecidamente certa,
Com o mistério das coisas por baixo das pedras e dos seres,
Com a morte a pôr humidade nas paredes e cabelos brancos nos homens,
Com o Destino a conduzir a carroça de tudo pela estrada de nada.
 Estou hoje vencido, como se soubesse a verdade.
Estou hoje lúcido, como se estivesse para morrer,
E não tivesse mais irmandade com as coisas
Senão uma despedida, tornando-se esta casa e este lado da rua
A fileira de carruagens de um comboio, e uma partida apitada
De dentro da minha cabeça,
E uma sacudidela dos meus nervos e um ranger de ossos na ida.
 Estou hoje perplexo como quem pensou e achou e esqueceu.
Estou hoje dividido entre a lealdade que devo
À Tabacaria do outro lado da rua, como coisa real por fora,
E à sensação de que tudo é sonho, como coisa real por dentro.
 Falhei em tudo.
Como não fiz propósito nenhum, talvez tudo fosse nada.
A aprendizagem que me deram,
Desci dela pela janela das traseiras da casa,
Fui até ao campo com grandes propósitos.
Mas lá encontrei só ervas e árvores,
E quando havia gente era igual à outra.
Saio da janela, sento-me numa cadeira. Em que hei-de pensar?
 Que sei eu do que serei, eu que não sei o que sou?
Ser o que penso? Mas penso ser tanta coisa!
E há tantos que pensam ser a mesma coisa que não pode haver tantos!
Génio? Neste momento
Cem mil cérebros se concebem em sonho génios como eu,
E a história não marcará, quem sabe?, nem um,
Nem haverá senão estrume de tantas conquistas futuras.
Não, não creio em mim.
Em todos os manicómios há doidos malucos com tantas certezas!
Eu, que não tenho nenhuma certeza, sou mais certo ou menos certo?
Não, nem em mim...
Em quantas mansardas e não-mansardas do mundo
Não estão nesta hora génios-para-si-mesmos sonhando?
Quantas aspirações altas e nobres e lúcidas —
Sim, verdadeiramente altas e nobres e lúcidas —,
E quem sabe se realizáveis,
Nunca verão a luz do sol real nem acharão ouvidos de gente?
O mundo é para quem nasce para o conquistar
E não para quem sonha que pode conquistá-lo, ainda que tenha razão.
Tenho sonhado mais que o que Napoleão fez.
Tenho apertado ao peito hipotético mais humanidades do que Cristo,
Tenho feito filosofias em segredo que nenhum Kant escreveu.
Mas sou, e talvez serei sempre, o da mansarda,
Ainda que não more nela;
Serei sempre o que não nasceu para isso;
Serei sempre só o que tinha qualidades;
Serei sempre o que esperou que lhe abrissem a porta ao pé de uma parede sem porta
E cantou a cantiga do Infinito numa capoeira,
E ouviu a voz de Deus num poço tapado.
Crer em mim? Não, nem em nada.
Derrame-me a Natureza sobre a cabeça ardente
O seu sol, a sua chuva, o vento que me acha o cabelo,
E o resto que venha se vier, ou tiver que vir, ou não venha.
Escravos cardíacos das estrelas,
Conquistámos todo o mundo antes de nos levantar da cama;
Mas acordámos e ele é opaco,
Levantámo-nos e ele é alheio,
Saímos de casa e ele é a terra inteira,
Mais o sistema solar e a Via Láctea e o Indefinido.
 (Come chocolates, pequena;
Come chocolates!
Olha que não há mais metafísica no mundo senão chocolates.
Olha que as religiões todas não ensinam mais que a confeitaria.
Come, pequena suja, come!
Pudesse eu comer chocolates com a mesma verdade com que comes!
Mas eu penso e, ao tirar o papel de prata, que é de folhas de estanho,
Deito tudo para o chão, como tenho deitado a vida.)
 Mas ao menos fica da amargura do que nunca serei
A caligrafia rápida destes versos,
Pórtico partido para o Impossível.
Mas ao menos consagro a mim mesmo um desprezo sem lágrimas,
Nobre ao menos no gesto largo com que atiro
A roupa suja que sou, sem rol, pra o decurso das coisas,
E fico em casa sem camisa.
 (Tu, que consolas, que não existes e por isso consolas,
Ou deusa grega, concebida como estátua que fosse viva,
Ou patrícia romana, impossivelmente nobre e nefasta,
Ou princesa de trovadores, gentilíssima e colorida,
Ou marquesa do século dezoito, decotada e longínqua,
Ou cocote célebre do tempo dos nossos pais,
Ou não sei quê moderno — não concebo bem o quê —,
Tudo isso, seja o que for, que sejas, se pode inspirar que inspire!
Meu coração é um balde despejado.
Como os que invocam espíritos invocam espíritos invoco
A mim mesmo e não encontro nada.
Chego à janela e vejo a rua com uma nitidez absoluta.
Vejo as lojas, vejo os passeios, vejo os carros que passam,
Vejo os entes vivos vestidos que se cruzam,
Vejo os cães que também existem,
E tudo isto me pesa como uma condenação ao degredo,
E tudo isto é estrangeiro, como tudo.)
 Vivi, estudei, amei, e até cri,
E hoje não há mendigo que eu não inveje só por não ser eu.
Olho a cada um os andrajos e as chagas e a mentira,
E penso: talvez nunca vivesses nem estudasses nem amasses nem cresses
(Porque é possível fazer a realidade de tudo isso sem fazer nada disso);
Talvez tenhas existido apenas, como um lagarto a quem cortam o rabo
E que é rabo para aquém do lagarto remexidamente.
 Fiz de mim o que não soube,
E o que podia fazer de mim não o fiz.
O dominó que vesti era errado.
Conheceram-me logo por quem não era e não desmenti, e perdi-me.
Quando quis tirar a máscara,
Estava pegada à cara.
Quando a tirei e me vi ao espelho,
Já tinha envelhecido.
Estava bêbado, já não sabia vestir o dominó que não tinha tirado.
Deitei fora a máscara e dormi no vestiário
Como um cão tolerado pela gerência
Por ser inofensivo
E vou escrever esta história para provar que sou sublime.
 Essência musical dos meus versos inúteis,
Quem me dera encontrar-te como coisa que eu fizesse,
E não ficasse sempre defronte da Tabacaria de defronte,
Calcando aos pés a consciência de estar existindo,
Como um tapete em que um bêbado tropeça
Ou um capacho que os ciganos roubaram e não valia nada.
 Mas o Dono da Tabacaria chegou à porta e ficou à porta.
Olhou-o com o desconforto da cabeça mal voltada
E com o desconforto da alma mal-entendendo.
Ele morrerá e eu morrerei.
Ele deixará a tabuleta, e eu deixarei versos.
A certa altura morrerá a tabuleta também, e os versos também.
Depois de certa altura morrerá a rua onde esteve a tabuleta,
E a língua em que foram escritos os versos.
Morrerá depois o planeta girante em que tudo isto se deu.
Em outros satélites de outros sistemas qualquer coisa como gente
Continuará fazendo coisas como versos e vivendo por baixo de coisas como tabuletas,
Sempre uma coisa defronte da outra,
Sempre uma coisa tão inútil como a outra,
Sempre o impossível tão estúpido como o real,
Sempre o mistério do fundo tão certo como o sono de mistério da superfície,
Sempre isto ou sempre outra coisa ou nem uma coisa nem outra.
 Mas um homem entrou na Tabacaria (para comprar tabaco?),
E a realidade plausível cai de repente em cima de mim.
Semiergo-me enérgico, convencido, humano,
E vou tencionar escrever estes versos em que digo o contrário.
 Acendo um cigarro ao pensar em escrevê-los
E saboreio no cigarro a libertação de todos os pensamentos.
Sigo o fumo como uma rota própria,
E gozo, num momento sensitivo e competente,
A libertação de todas as especulações
E a consciência de que a metafísica é uma consequência de estar mal disposto.
 Depois deito-me para trás na cadeira
E continuo fumando.
Enquanto o Destino mo conceder, continuarei fumando.
 (Se eu casasse com a filha da minha lavadeira
Talvez fosse feliz.)
Visto isto, levanto-me da cadeira. Vou à janela.
 O homem saiu da Tabacaria (metendo troco na algibeira das calças?).
Ah, conheço-o: é o Esteves sem metafísica.
(O Dono da Tabacaria chegou à porta.)
Como por um instinto divino o Esteves voltou-se e viu-me.
Acenou-me adeus gritei-lhe Adeus ó Esteves!, e o universo
Reconstruiu-se-me sem ideal nem esperança, e o Dono da Tabacaria sorriu.","Je ne suis rien
Je ne serai jamais rien.
Je ne puis vouloir être rien.
A part ça, je porte en moi tous les rêves du monde.
 Fenêtres de ma chambre,
De la chambre d’un seul parmi des millions d’êtres sans personne qui le connaisse
(Et que saurait le monde s’il le connaissait ?),
Vous donnez sur le mystère d’une rue où se croisent constamment les gens,
Une rue inaccessible à toute pensée,
Réelle, d’une réalité impossible, précise, d’une précision inconnaissable,
Avec le mystère des choses dans le soubassement des pierres et des êtres,
Avec la mort, la poussière humide des parois et les cheveux blancs des hommes,
Avec la destinée qui conduit le carrosse de tout sur les routes du rien.
 Aujourd’hui je suis vaincu, comme si je savais la vérité;
Aujourd’hui je suis lucide, comme si j’étais prêt de mourir,
N’ayant plus d’autre fraternité avec les choses
Que celle d’un adieu ; cette maison change et ce côté-ci de la rue devient
L’enfilade des wagons d’un train, et le sifflet du départ
Au-dedans de ma tête,
Et une secousse de mes nerfs et un craquement d’os s’en allant.
 Aujourd’hui je suis perplexe, comme celui qui pense, et trouve, et oublie.
Aujourd’hui je suis divisé entre la loyauté que je dois
Au Bureau de Tabac de l’autre côté de la rue, comme une chose réelle au dehors
Et à la sensation que tout ceci n’est qu’un rêve, comme une chose réelle au dedans.
 En tout j’ai failli.
De n’avoir jamais rien proposé, tout peut-être fut-il jamais rien
Les apprentissages que j’ai reçus, tous
je les ai jetés par la fenêtre, en arrière dans les cours au loin.
Je suis parti jusqu’aux champs avec de grands espoirs,
Mais je n’ai trouvé là qu’herbages et forêts,
Et quand il y avait quelqu’un il était pareil aux autres.
Je m’éloigne de la fenêtre, je m’assieds sur une chaise. À quoi vais-je penser ?
 Puis-je savoir qui je serai moi qui ne sais pas qui je suis ?
Être ce que je pense être ? Mais je pense être tant de choses !
Et il y en a tant qui pense être la même chose, qu’il ne se peut qu’il y en ait tant !
Un génie ? En ce moment
Cent mille cerveaux se conçoivent en rêve aussi génial que moi,
et l’histoire n’en retiendra, qui sait ? peut-être, pas même un seul ;
Il n’y aura que le fumier qui restera de tant de conquêtes futures.
Non, non, je ne crois pas en moi.
Dans tous les hôpitaux, il y a des détraqués qui souffrent de tant de certitudes !
Moi qui n’aie plus aucune certitude, ai-je plus ou moins de foi ?
Non. Pas même en moi !
Dans combien de mansardes et de non-mansardes du monde
Y a-t-il à cette heure génies-pour-soi-même occupés à rêver ?
Combien de hautes, nobles et lucides aspirations –
Oui, véritablement hautes, nobles et lucides –
Et qui sait peut-être, réalisables,
Ne verront la clarté réelle du soleil, ni ne retentiront à nos oreilles.
Le monde est à ceux qui naissent pour le conquérir,
Et non à ceux qui rêvent de pouvoir le conquérir, même à bon droit.
J’ai plus rêvé que n’a pu agir Napoléon.
J’ai serré contre ma poitrine hypothétique plus d’humanité que le Christ.
J’ai conçu en secret des philosophies que nul Kant n’a écrites.
Mais je suis, et serais peut-être pour toujours, celui de la mansarde,
Sans que j’y demeure pour autant ;
Je serais toujours celui qui n’était pas né pour ça ;
Je serais toujours celui qui, seul, avait des dispositions ;
Je serais toujours celui qui attend qu’on lui ouvre la porte auprès d’un mur sans porte
Et chante le chant de l’Infini dans un poulailler
Et entend la voix de Dieu dans un puit obstrué.
Croire en moi ? Non, ni en rien.
Que la Nature déverse sur ma tête ardente
Ses soleils, ses pluies, le vent qui tourmente mes cheveux
Et que le reste vienne s’il vient, ou doit venir – ou qu’il ne vienne pas.
Esclaves cardiaques des étoiles,
Nous avons déjà conquis le monde avant de nous lever du lit
Mais nous nous réveillons et il est opaque
Nous nous levons et il est à d’autres
Nous sortons de nous et il est la terre entière,
Plus le système solaire et la Voie Lactée et l’Indéfini.
  (Mange des chocolats, fillette ;
Mange des chocolats !
Comprends qu’il n’est rien de plus métaphysique au monde que le chocolat.
Comprends que toutes les religions n’enseignent que la confiserie.
Mange, petite cochonne, mange !
Puissè-je manger des chocolats avec autant de vérité que tu les manges.!
Mais je pense, en retirant le papier d’argent qu’il n’est que feuille d’étain,
Et je laisse tout tomber par terre comme j’ai laissé tomber ma vie.)
 Mais au moins reste-t-il l’amertume que je ne serais jamais
Le rapide calligraphe de mes vers
Portique brisé au départ de l’Impossible
Mais au moins ai-je consacré à moi-même un mépris sans larmes
Noble au moins dans le geste large avec lequel je jette
Le linge sale que je suis, sans reçu, dans le décours des choses,
Et je reste chez moi sans chemise.
  (Toi qui consoles, qui n’existes pas et pour cela consoles,
Déesse grecque, conçue comme statue autrefois vivante,
Ou bien patricienne romaine, infiniment noble et néfaste,
Ou princesse de troubadours, très gente dame enluminée,
Ou marquise du dix-huitième siècle, lointaine et décolletée,
Ou cocotte célèbre du temps de nos pères,
Ou je ne sais quoi de moderne – je ne sais trop concevoir ce que c’est –,
Tout cela, qu’il soit ou que tu le sois, s’il peut m’inspirer qu’il m’inspire.!
Il s'est renversé le baquet de mon cœur...
Comme ceux qui invoquent les esprits invoquent des esprits je m’invoque
Moi-même et je ne trouve rien.
Je vais à la fenêtre et je vois la rue avec une netteté absolue.
Je vois les magasins, je vois les trottoirs, je vois les voitures qui passent.
Je vois des êtres vêtus, vivants qui se croisent,
je vois des chiens qui, eux aussi, existent,
et tout cela me pèse comme une condamnation au bagne,
et tout cela est étranger, comme tout le reste.)
 J’ai vécu, étudié, aimé – et même été jusqu’à croire,
et aujourd’hui, pas un seul mendiant que je n’envie de n’être pas moi.
En chacun d’eux je vois les haillons, et les plaies et la prose
Et je me dis : « peut-être n’as-tu jamais vécu ni étudié, ni aimé, ni eu la foi.»
(Car il est possible de rendre la réalité de tout ceci sans rien faire de cela) ;
« Peut-être, lézard dont on a coupé la queue, ton existence fut-elle écourtée
et la queue séparée du lézard frétille-t-elle avec frénésie ».
 Je ne sais ce que j’ai fait de moi,
Et ce que je pouvais faire de moi je ne l’ai pas fait.
Le domino1 que j’ai revêtu n’était pas le bon.
On m’a pris aussitôt pour ce que je n’étais pas, je n’ai pas démenti et me suis perdu.
Quand j’ai voulu ôter le masque
Il me collait au visage.
Quand je l’ai ôté et me vis dans le miroir,
J’avais déjà vieilli.
J’étais soûl, je ne savais plus porter le domino que je n’avais pas enlevé.
J’ai laissé tomber le masque et j’ai dormi au vestiaire
Comme un chien toléré par le gérant
Parce qu’il est inoffensif –
Et je vais écrire cette histoire afin de prouver que je suis sublime.
 Essence musicale de mes vers inutiles,
Qui me donnera de te rencontrer comme une chose que j’ai faite,
Sans rester toujours en face du Bureau de Tabac d’en face,
Foulant aux pieds la conscience d’être… existant,
Comme un tapis où un ivrogne vient s’empêtrer,
Comme une paillasse que les tsiganes ont dérobée, et qui ne vaut rien.
 Mais le Patron du Bureau de Tabac est venu à la porte, et il s’est arrêté à la porte.
Je le regarde avec l’inconfort d’une tête mal tournée
Et avec l’inconfort d’une âme mal entendant.
Il mourra, et je mourrai.
Il laissera une enseigne et moi des vers.
Après un certain temps mourra l’enseigne aussi, et les vers, aussi.
Et puis un temps encore et mourra la rue où était l’enseigne,
Et la langue dans laquelle furent écrits les vers.
Mourra enfin la planète tournante où tout cela s’est produit.
Sur d’autres satellites, d’autres systèmes, quelque chose comme des gens
Continuera de faire des sortes de vers et de vivre à l’ombre de sortes d’enseignes,
Une chose toujours en face d’une autre,
Une chose toujours aussi inutile qu’une autre,
Une chose toujours aussi stupide que le réel,
Le mystère du fond toujours aussi certain que l’absence de mystère de la surface,
Toujours ceci ou toujours autre chose, ou bien ni une chose ni une autre.
 Mais un homme est entré dans le Bureau (pour acheter du tabac ?)
Et la réalité plausible me tombe soudainement dessus.
Je me redresse à demi, énergique, convaincu, humain,
et je m’en vais avec l’intention d’écrire ces vers où je dis le contraire.
 J’allume une cigarette en pensant les écrire
Et je savoure dans la cigarette la libération de toutes les pensées.
Je suis la fumée des yeux comme mon propre itinéraire,
Et je goûte dans un moment de sensibilité mêlé de compétence
A la libération de toutes les spéculations
Et à la conscience que la métaphysique n’est que la conséquence d’une indisposition.
 Puis je me renverse sur ma chaise
Et je continue à fumer.
Tant que le destin me l’accordera je continuerai à fumer.
 (Si j’épousais la fille de ma blanchisseuse,
Peut-être serais-je heureux.)
Ceci dit, je me lève de ma chaise. Je vais à la fenêtre.
 L’homme est sorti du Bureau de Tabac (en mettant la monnaie dans la poche de son pantalon ?)
Ah, je le connais: c’est Estève sans métaphysique.
(Le Patron du Bureau de Tabac est revenu à la porte.)
Avec un instinct de divination, Estève s’est retourné et il m’a vu.
Il m’a salué de la main, je lui ai crié: « Salut Estève ! », et l’univers
S’est reconstruit en moi sans idéal et sans espoir, et le Patron du Bureau de Tabac a souri.
  1.

Habillement ou costume de bal masqué, composé d’une robe ouverte, descendant jusqu’aux talons, et d’une espèce de capuchon ou camail.",pt_XX,fr_XX
"Coimbra é uma lição
De sonho e tradição
O lente é uma canção
E a lua a faculdade
O livro é uma mulher
Só passa quem souber
E aprende-se a dizer saudade
 Coimbra do choupal
Ainda és capital
Do amor em Portugal, ainda
Coimbra onde uma vez
Com lágrima se fez
A história dessa Inês
Tão linda
Coimbra das canções
Tão meiga que nos pões
Os nossos corações a nú
Coimbra dos doutores
Pra nós os teus cantores
A fonte dos amores, és tu","Coimbra est une leçon
De rêve et de tradition
La lenteur est une chanson
Et la lune la faculté
Le livre est une femme
Seulement passe celui qui possède le savoir
Et l'on apprend à dire nostalgie
 Coimbra do choupal
Tu es encore la capitale
De l'amour au Portugal
Coimbra où une fois
Avec une larme s'est faite
L'histoire de cette Inês
Tellement belle
Coimbra des chansons
Tellement douce que tu nous mets
Nos coeurs à nu
Coimbra des médecins
Pour nous tes chanteurs
La fontaine des amours, c'est toi.",pt_XX,fr_XX
"Minha cunhada, prima irmã de tia minha
Já me disse que a vizinha vai morrer do coração
Eu descobri que pimenta malagueta
Quando entra na buceta vai se enganchar no pulmão
 Não
Não é assim que se fode, não
Não é assim que se fode, não
Não é assim que se fode, não
Não é assim que se fode
Eu vou te dar uma lição
 Pense nisso, meu amor, que o buraco é mais embaixo
Se te dão uma banana, você logo pede o cacho
Você deve tá achando a brincadeira engraçada
É certo que tu tá ficando muito, muito alaceada
E quando o meu pinto se sentir um pouco frouxo
Vou te botar de quatro e aí pôr no seu cú
Não
Não é assim que se fode, não
Não é assim que se fode, não
Não é assim que se fode, não
Não é assim que se fode
Não é assim que se fode, não
Não é assim que se fode, não
Não é assim que se fode, não
Não é assim que se fode
Não é assim que se fode, não
Não é assim que se fode, não
Não é assim que se fode, não
Não é assim que se fode
Eu vou te dar uma lição","Ma belle-sœur, cousine germaine de ma tante
M'a déjà dit que la voisine va mourir du cœur
J'ai découvert que le piment
Quand il entre dans la chatte va encrasser les poumons
 Non,
Ce n'est pas comme ça qu'on baise, non
Ce n'est pas comme ça qu'on baise, non
Ce n'est pas comme ça qu'on baise, non
Ce n'est pas comme ça qu'on baise
Je vais te donner une leçon
 Pense à ça, mon amour, le trou est plus bas
Si on te donne une banane, tu demandes tout de suite le régime
Tu dois trouver la plaisanterie rigolote
Il est vrai que tu deviens très, très (....)
Et quand ma queue se sentira un peu molle
Je vais de mettre à quatre pattes et te la mettre dans le cul
Non
Ce n'est pas comme ça qu'on baise, non
Ce n'est pas comme ça qu'on baise, non
Ce n'est pas comme ça qu'on baise, non
Ce n'est pas comme ça qu'on baise
Ce n'est pas comme ça qu'on baise, non
Ce n'est pas comme ça qu'on baise, non
Ce n'est pas comme ça qu'on baise, non
Ce n'est pas comme ça qu'on baise
Ce n'est pas comme ça qu'on baise, non
Ce n'est pas comme ça qu'on baise, non
Ce n'est pas comme ça qu'on baise, non
Ce n'est pas comme ça qu'on baise
Je vais te donner une leçon",pt_XX,fr_XX
"Para quem quer se soltar invento o cais
Invento mais que a solidão me dá
Invento lua nova a clarear
Invento o amor e sei a dor de me lançar
Eu queria ser feliz
Invento o mar
Invento em mim o sonhador
Para quem quer me seguir eu quero mais
Tenho o caminho do que sempre quis
E um saveiro pronto pra partir
Invento o cais
E sei a vez de me lançar","Pour ceux qui veulent se libérer, j'invente le quai
J'invente plus que ce que la solitude me donne
L'invente la nouvelle lune pour éclairer
J'invente l'amour et je sais la douleur de m'y jeter
Je voudrais être heureux
J'invente la mer
J'invente en moi le rêveur
Pour ceux qui veulent me suivre, je veux plus
J'ai le chemin de ce que j'ai toujours voulu
Et un voilier prêt à partir
J'invente le quai
Et je sais quand je dois me lancer",pt_XX,fr_XX
