original_poem,translated_poem,src_lang,tgt_lang
"Meus dois pais me tratam muito bem
(O que é que você tem que não fala com ninguém?)
Meus dois pais me dão muito carinho
(Então porque você se sente sempre tão sozinho?)
Meus dois pais me compreendem totalmente
(Como é que cê se sente, desabafa aqui com a gente!)
Meus dois pais me dão apoio moral
(Não dá pra ser legal, só pode ficar mal!)
 MAMA MAMA MAMA MAMA
(PAPA PAPA PAPA PAPA)
 Minha mãe até me deu essa guitarra
Ela acha bom que o filho caia na farra
E o meu carro foi meu pai que me deu
Filho homem tem que ter um carro seu
Fazem questão que eu só ande produzido
Se orgulham de ver o filhinho tão bonito
Me dão dinheiro prá eu gastar com a mulherada
Eu realmente não preciso mais de nada
 Meus pais não querem
Que eu fique legal
Meus pais não querem
Que eu seja um cara normal
 Não vai dar, assim não vai dar
Como é que eu vou crescer sem ter com quem me revoltar
Não vai dar, assim não vai dar
Pra eu amadurecer sem ter com quem me rebelar","Mes deux parents me traitent très bien
(Qu'est-ce que tu as que tu ne parles avec personne ?)
Mes deux parents me donnent beaucoup de tendresse
(Alors pourquoi te sens-tu toujours si seul ?)
Mes deux parents me comprennent totalement
(Comment te sens-tu, défoule-toi ici avec nous)
Mes deux parents me donnent un appui moral
(Ca ne peut pas être génial, tu ne peux que te sentir mal)
 MAMAN MAMAN MAMAN MAMAN
(PAPA PAPA PAPA PAPA)
 Ma mère m'a même donné cette guitare
Elle trouve ça bien que son fils fasse la fête
Et ma voiture c'est mon père qui me l'a donnée
Un fils doit avoir une voiture à lui
Ils insistent pour que je sois seulement habillé à la mode
Ils sont fiers de voir leur fiston si joli
Ils me donne de l'argent à dépenser avec les femmes
Je n'ai vraiment plus besoin de rien
 Mes parents ne veulent pas
Que je sois un type sympa
Mes parents ne veulent pas
Que je sois un type normal
 Ca ne va pas marcher, ainsi ça ne va pas marcher
Comment est-ce que je vais grandir sans avoir quelqu'un contre qui me révolter
Ca ne va pas marcher, ainsi ça ne va pas marcher
Pour que je mûrisse sans avoir quelqu'un contre qui me rebeller",pt_XX,fr_XX
"A gente não sabemos
Escolher presidente
A gente não sabemos
Tomar conta da gente
A gente não sabemos
Nem escovar os dente
Tem gringo pensando
Que nóis é indigente...
 ""Inúteu""!
A gente somos ""inúteu""!
""Inúteu""!
A gente somos ""inúteu""!
 A gente faz carro
E não sabe guiar
A gente faz trilho
E não tem trem prá botar
A gente faz filho
E não consegue criar
A gente pede grana
E não consegue pagar...
 ""Inúteu""!
A gente somos ""inúteu""!
""Inúteu""!
A gente somos ""inúteu""!
""Inúteu""!
A gente somos ""inúteu""!
""Inúteu""!
A gente somos ""inúteu""!
""Inúteu""!
A gente somos ""inúteu""!
""Inúteu""!
A gente somos ""inúteu""!
 A gente faz música
E não consegue gravar
A gente escreve livro
E não consegue publicar
A gente escreve peça
E não consegue encenar
A gente joga bola
E não consegue ganhar...
 ""Inúteu""!
A gente somos ""inúteu""!
""Inúteu""!
A gente somos ""inúteu""!
""Inúteu""!
""Inúteu""!
""Inúteu""!
Inú! inú! inú...","On ne sait pas
Choisir un président
On ne sait pas
S'occuper de nous
On ne sait même pas
Se laver les dents
Il y a des gringos qui pensent
Que nous sommes indigents
 Inutiles
Nous sommes inutiles
Inutiles
Nous sommes inutiles
 On fait des voitures
Qu'on ne sait pas conduire
On fait des rails
Et il n'y a pas de train à y mettre
On fait des enfants
Et on n'arrive pas à les élever
On demande de l'argent
Et on n'arrive pas à payer...
 Inutiles
Nous sommes inutiles
Inutiles
Nous sommes inutiles
Inutiles
Nous sommes inutiles
Inutiles
Nous sommes inutiles
Inutiles
Nous sommes inutiles
Inutiles
Nous sommes inutiles
 On fait de la musique
Et on n'arrive pas à l'enregistrer
On écrit des livres
Et on n'arrive pas à les publier
On écrit des pièces
Et on n'arrive pas à les mettre en scène
On joue au ballon
Et on n'arrive pas à gagner
 Inutiles
Nous sommes inutiles
Inutiles
Nous sommes inutiles
Inutiles
Inutiles
Inutiles
Inu ! Inu ! Inu ...",pt_XX,fr_XX
"Daqui do morro dá pra ver tão legal
O que acontece aí no seu litoral
Nós gostamos de tudo, nós queremos é mais
Do alto da cidade até a beira do cais
Mais do que um bom bronzeado
Nós queremos estar do seu lado
 Nós 'tamo' entrando sem óleo nem creme
Precisando a gente se espreme
Trazendo a farofa e a galinha
Levando também a vitrolinha
Separa um lugar nessa areia
Nós vamos chacoalhar a sua aldeia
 Mistura sua laia
Ou foge da raia
Sai da tocaia
Pula na baia
Agora nós vamos invadir sua praia
 Daqui do morro dá pra ver tão legal
O que acontece aí no seu litoral
Nós gostamos de tudo, nós queremos é mais
Do alto da cidade até a beira do cais
Mais do que um bom bronzeado
Nós queremos estar do seu lado
 Agora se você vai se incomodar
Então é melhor se mudar
Não adianta nem nos desprezar
Se a gente acostumar a gente vai ficar
A gente tá querendo variar
E a sua praia vem bem a calhar
 Não precisa ficar nervoso
Pode ser que você ache gostoso
Ficar em companhia tão saudável
Pode até lhe ser bastante recomendável
A gente pode te cutucar
Não tenha medo, não vai machucar","D'ici sur la colline il y a une vue superbe
Sur ce qui se produit sur ton littoral
Nous aimons tout, nous en voulons plus
Du sommet de la ville jusqu'au bord des quais
Plus qu'un simple bronzage
Nous voulons être à tes côtés
 Nous arrivons sans huile ni crème
Nous avons besoin de nous serrer
Nous apportons la farofa et la poule
Nous apportons aussi le tourne-disque
Réserve-nous un endroit sur ce sable
Nous allons secouer ton village
 Mélange ta nature
Ou sors du couloir
Sors de ta cachette
Saute dans la stalle
Maintenant, nous allons envahir ta plage
 D'ici sur la colline il y a une vue superbe
Sur ce qui se produit sur ton littoral
Nous aimons tout, nous en voulons plus
Du sommet de la ville jusqu'au bord des quais
Plus qu'un simple bronzage
Nous voulons être à tes côtés
 Maintenant si cela t'incomode
Alors il vaut mieux que tu déménages
Ca ne sert même à rien de nous mépriser
Si on s'y habitue on va rester
On a envie de changer
Et ta plage tombe bien
 Il ne faut pas être nerveux
Peut-être que tu vas trouver ça adorable
D'être en si saine compagnie
Ca peut même t'être plutôt recommandable
On peut te tripoter
N'aie pas peur, ça ne va pas te blesser",pt_XX,fr_XX
"Perdi a hora
mas encontrei você aqui
Desde aquela noite
eu nunca mais me entendi
Você levou meu coração
Levou o meu olhar
Eu sigo cego e infeliz
Querendo te encontrar
Pra conversar
Te convencer
Te confessar
Quero só você
Não esqueci seu nome
Seu rosto
Sua voz
Outro dia eu te vi numa tarde,
tão veloz
Você passou no circular
Pela Praia do Leblon
Corri atrás
Tarde demais
Perdi a condição
De conversar
De te convencer
Te confessar
Quero só você
Sei que isso não tem importân...cia
Pra você não faz sentido
Mas a noite aumenta a distân...cia
Me perdi no seu caminho
Me encontrei falando sozinho
Sigo sempre sem destino
Pra te encontrar
Pra conversar
Te convencer
Te confessar
Quero só você
A vida tem dessas coisas
Olhe só nos dois aqui
Presos num elevador
Uma noite sem dormir
Zero hora no relógio
Legal você está aqui
E amanhã pela manhã
A gente pode sair
E conversar
Se convencer
Se confessar
Quero só você
Pra conversar
Te convencer
Te confessar
Quero só você","J'ai manqué l'heure
mais je t'ai rencontrée ici
Depuis cette nuit-là
je ne me suis plus jamais compris
Tu as emporté mon cœur
Emporté mon regard
Je continue aveugle et malheureux
Voulant de rencontrer
Pour discuter
Te convaincre
Te confesser
Je ne veux que toi
Je n'ai pas oublié ton nom
Ton visage
Ta voix
Un autre jour je t'ai vu un après-midi
Si rapide
Tu es passée dans le bus
Sur la plage de Leblon
J'ai couru derrière
Trop tard
J'ai perdu la possibilité
De discuter
De te convaincre
Te confesser
Je ne veux que toi
Je sais que cela n'a pas d'importance
Pour toi cela n'a pas de sens
Mais la nuit augmente la distance
Je me suis perdu sur ton chemin
Je suis me retrouvé à parler tout seul
Je continue toujours sans destin
Pour te rencontrer
Pour discuter
Te convaincre
Te confesser
Je ne veux que toi
La vie réserve de ces choses
Regarde un peu, nous deux ici
Prisonniers dans un ascenseur
Une nuit sans dormir
Heure zéro sur la montre
Super tu es ici
Et demain matin
Nous pourrons sortir
Et discuter
Nous convaincre
Nous confesser
Je ne veux que toi
Pour discuter
Te convaincre
Te confesser
Je ne veux que toi",pt_XX,fr_XX
"Como foi, ninguém sabe muito bem
Ela entrou feito um raio
Não esbarrou em ninguém
Vive sempre assim, a mil anos além
A mulher invisível
 Entra e sai, muita gente, confusão
O sinal fechado, e ela vem na contramão
Ela é invencível, pura ficção
A mulher invisível
 Ela está onde ninguém está
Ela é dona da noite, abandona o dia
Ela mora em nenhum lugar
Ela é pura energia......
 Vai passar, está passando, já passou
Seu olhar nos olhos é uma história de amor
Não me deixa só, me deixe por favor
Oh mulher invisível
 Muito perto o deserto do olhar
Longe o horizonte, a imensidão do mar
Mas onde será que ela quer chegar?
A mulher invisível
 Ela está onde ninguém está
Abandona a noite, é dona do dia
Ela mora em nenhum lugar
Ela é pura energia......","Comment ça s'est passé, personne ne le sait vraiment
Elle est entrée comme un rayon
Elle n'a heurté personne
Elle vit tout le temps comme ça, à mille ans d'ici
La femme invisible
 Elle entre et sort, beaucoup de monde, confusion
Le feu au rouge, elle vient à contre-sens
Elle est invincible, une pure fiction
La femme invisible
 Elle est où personne n'est
Elle est la reine de la nuit, elle abandonne le jour
Elle n'habite nulle part
Elle est pure énergie
 Elle va passer, elle passe, elle est déjà passée
Son regard dans les yeux est une histoire d'amour
Ne me laisse pas seul, laisse-moi s'il te plaît
Oh femme invisible
 De très près le désert du regard
L'horizon est loin, l'immensité de la mer
Mais où est-ce qu'elle veut en arriver ?
La femme invisible
 Elle est où personne n'est
Elle abandonne la nuit, elle la reine du jour
Elle n'habite nulle part
Elle est une pure fiction...",pt_XX,fr_XX
"Uma tigresa de unhas negras e íris cor de mel
Uma mulher, uma beleza que me aconteceu
Esfregando a pele de ouro marrom do seu corpo contra o meu
Me falou que o mal é bom e o bem cruel
 Enquanto os pelos dessa deusa tremem ao vento ateu
Ela me conta, sem certeza, tudo o que viveu
Que gostava de política em 1966
E hoje dança no Frenetic Dancing Days
 Ela me conta que era atriz e trabalhou no Hair
Com alguns homens foi feliz, com outros foi mulher
Que tem muito ódio no coração, que tem dado muito amor
E espalhado muito prazer e muita dor
 Mas ela ao mesmo tempo diz que tudo vai mudar
Porque ela vai ser o que quis, inventando um lugar
Onde a gente e a natureza feliz vivam sempre em comunhão
E a tigresa possa mais do que o leão
 As garras da felina me marcaram o coração
Mas as besteiras de menina que ela disse, não
E eu corri pra o violão num lamento, e a manhã nasceu azul
Como é bom poder tocar um instrumento","Une tigresse aux ongles noirs et à l'iris couleur de miel
Une femme, une beauté qui m'est arrivée
Frottant la peau brun doré de son corps contre le mien
Elle m'a dit que le mal est bon et le bien cruel
 Tandis que les poils de cette déesse tremblent au vent athée
Elle me raconte, sans certitude, tout ce qu'elle a vécu
Qu'elle aimait la politique en 1966
Et qu'aujourd'hui elle danse au Frenetic Dancing Days
 Elle me raconte qu'elle était actrice et a joué dans Hair
Avec quelques hommes elle a été heureuse, avec d'autres elle a été femme
Qu'elle a beaucoup de haine dans le cœur, qu'elle a donné beaucoup d'amour
Et répandu beaucoup de plaisir et beaucoup de douleur
 Mais en même temps elle dit que tout va changer
Parce qu'elle va être ce qu'elle voulait, inventant un lieu
Où nous et la nature heureuse vivrons toujours en communion
Et la tigresse pourra plus que le lion
 Les griffes de la féline m'ont marqué le cœur
Mais les bêtises de petite fille qu'elle a dites, non
Et j'ai couru vers ma guitare en me lamentant, et le matin est né tout bleu
Comme c'est bon de pouvoir jouer d'un instrument",pt_XX,fr_XX
"Alguém cantando longe daqui
Alguém cantando longe, longe
Alguém cantando muito
Alguém cantando bem
Alguém cantando é bom de se ouvir
Alguém cantando alguma canção
A voz de alguém nessa imensidão
A voz de alguém que canta
A voz de um certo alguém
Que canta como que pra ninguém
A voz de alguém quando vem do coração
De quem mantém toda a pureza
Da natureza
Onde não há pecado nem perdão","Quelqu'un qui chante loin d'ici
Quelqu'un qui chante loin, loin
Quelqu'un qui chante beaucoup
Quelqu'un qui chante bien
Quelqu'un qui chante, c'est bon à entendre
Quelqu'un qui chante une chanson
La voix de quelqu'un dans cette immensité
La voix de quelqu'un qui chante
La voix d'une certaine personne
Qui chante comme si ce n'était pour personne
La voix de quelqu'un quand elle vient du cœur
Duquel elle maintient toute la pureté
De la nature
Où il n'y a ni pêché ni pardon",pt_XX,fr_XX
"Eu não sou daqui
Marinheiro só
Eu não tenho amor
Marinheiro só
Eu sou da bahia
Marinheiro só
De são salvador
Marinheiro só
Lá vem, lá vem
Marinheiro só
Como ele vem faceiro
Marinheiro só
 Todo de branco
Marinheiro só
Com o seu bonezinho
Marinheiro só
 Ô, marinheiro marinheiro
Marinheiro só
Ô, quem te ensinou a nadar
Marinheiro só
Ou foi o tombo do navio
Marinheiro só
Ou foi o balanço do mar
Marinheiro só","Je ne suis pas d'ici
Marin solitaire
Je n'ai pas d'amour
Marin solitaire
Je suis de Bahia
Marin solitaire
De São Salvador
Marin solitaire
Il arrive, il arrive
Marin solitaire
Comme il est élégant
Marin solitaire
 Tout de blanc vêtu
Marin solitaire
Avec son petit bonnet
Marin solitaire
 Oh, marin, marin
Marin solitaire
Oh, qui t'a appris à nager
Marin solitaire
Ou c'est le naufrage du navire
Marin solitaire
Ou c'est le balancement de la mer
Marin solitaire",pt_XX,fr_XX
"Eu quero ir, minha gente, eu não sou daqui
Eu não tenho nada, quero ver Irene rir
Quero ver Irene dar sua risada
Quero ver Irene dar sua risada
Irene ri, Irene ri, Irene
Irene ri, Irene ri, Irene
Quero ver Irene dar sua risada","Je veux y aller, mes amis, je ne suis pas d'ici
Je n'ai rien, je veux voir Irène rire
Je veux voir Irène pousser son rire
Je veux voir Irène pousser son rire
Irène rit, Irène rit, Irène
Irène rit, Irène rit, Irène
Je veux voir Irène pousser son rire",pt_XX,fr_XX
"Não me venha falar na malícia de toda mulher
Cada um sabe a dor e a delícia de ser o que é
Não me olhe como se a polícia andasse atrás de mim
Cale a boca, e não cale na boca notícia ruim
 Você sabe explicar
Você sabe entender, tudo bem
Você está
Você é
Você faz
Você quer
Você tem...
 Você diz a verdade
A verdade é o seu dom de iludir
Como pode querer que a mulher
Vá viver sem mentir...","Ne viens pas me parler
De la malice de toutes les femmes
Chacun sait la douleur
Et le délice
D'être ce qu'on est
 Ne me regarde pas
Comme si la police
Marchait derrière moi
Tais-toi
Et ne mets pas dans ta bouche
Des mauvaises nouvelles
 Tu sais expliquer
Tu sais comprendre
Très bien
Tu es
Tu existes
Tu fais
Tu veux
Tu as...
 TU dis la vérité
La vérité est ton don
De tromper
Comment peut-on vouloir
Qu'une femme
Aille vivre sans mentir...",pt_XX,fr_XX
"Kalu, Kalu
Tira o verde desses óios di riba d'eu
 Kalu, Kalu
Não se esqueça que você já me esqueceu
 Kalu, Kalu
Esse oiá despois do que se assucedeu
 Com certeza só não tendo coração
Fazê tar judiação
Você tá mangando di eu
 Com certeza só não tendo coração
Fazê tar judiação
Você tá mangando di eu
 Kalu, Kalu
Tira o verde desses óios di riba d'eu
 Kalu, Kalu
Não se esqueça que você já me esqueceu
 Kalu, Kalu
Esse oiá despois do que se assucedeu
 Com certeza só não tendo coração
Fazê tar judiação
Você tá mangando di eu
 Com certeza só não tendo coração
Fazê tar judiação
Você tá mangando di eu
 Kalu, Kalu
Tira o verde desses óios di riba d'eu
 Kalu, Kalu
Não se esqueça que você já me esqueceu
 Kalu, Kalu
Esse oiá despois do que se assucedeu
 Com certeza só não tendo coração
Fazê tar judiação
Você tá mangando di eu
 Com certeza só não tendo coração
Fazê tar judiação
Você tá mangando di eu","Kalu, Kalu
Enlève le vert de ces yeux qui me regardent
 Kalu, Kalu
N'oublie pas que tu m'as déjà oublié
 Kalu, Kalu
Ce regard après ce qui s'est passé
 C'est sûr, tu n'as pas de cœur
Pour faire une telle perversité
Tu te moques de moi
 C'est sûr, tu n'as pas de cœur
Pour faire une telle perversité
Tu te moques de moi
 Kalu, Kalu
Enlève le vert de ces yeux qui me regardent
 Kalu, Kalu
N'oublie pas que tu m'as déjà oublié
 Kalu, Kalu
Ce regard après ce qui s'est passé
 C'est sûr, tu n'as pas de cœur
Pour faire une telle perversité
Tu te moques de moi
 C'est sûr, tu n'as pas de cœur
Pour faire une telle perversité
Tu te moques de moi
 Kalu, Kalu
Enlève le vert de ces yeux qui me regardent
 Kalu, Kalu
N'oublie pas que tu m'as déjà oublié
 Kalu, Kalu
Ce regard après ce qui s'est passé
 C'est sûr, tu n'as pas de cœur
Pour faire une telle perversité
Tu te moques de moi
 C'est sûr, tu n'as pas de cœur
Pour faire une telle perversité
Tu te moques de moi",pt_XX,fr_XX
"Sofro calado
Na solidão
Guardo comigo
A memória do teu vulto
Em vão
Eu fui tão bom pra você
E o resultado
Desilusão
O dia passa
A noite vem
A solução desse caso
Cansei de buscar
Eu vou rezar
Pra você me querer
Outra vez
Como um dia me quis
Quando a saudade aperta
Não se acanhe comigo
Pode me procurar","Je souffre en silence
Dans la solitude
Je garde en moi
La mémoire de ton corps
En vain
J'ai été si bon avec toi
Et le résultat
Désillusion
Le jour passe,
La nuit vient
La solution de ce cas
Je me suis fatigué de la chercher
Je vais prier
Pour que tu m'aimes
Une autre fois
Comme le jour où tu m'as aimé
Quand la nostalgie m'angoisse
Ne sois pas timide avec moi
Tu peux venir me chercher",pt_XX,fr_XX
"Linda como um neném
Que sexo tem, que sexo tem?
Namora sempre com gay
Que nexo faz tão sexy gay
 Rock´n´roll?
Pra ela é jazz
Já transou
Hi-life, society
Bancando o jogo alto
 Totalmente demais, demais
 Esperta como ninguém
Só vai na boa
Só se dá bem
Na lua cheia tá doida
Apaixonada, não sei por quem
 Agitou um broto a mais
Nem pensou
Curtiu, já foi,
Foi só pra relaxar
 Totalmente demais, demais
 Sabe sempre quem tem
Faz avião, só se dá bem
Se pensa que tem problema
Não tem problema
Faz sexo bem
 Seu carro é do ano
Seu broto é lindo
Seu corpo, tapete, do tipo que voa
É toda fina
Modelito design
 Se pisca, hello
Se não dá, bye-bye
 Seu cheque é novinho, ela adora gastar
Transou um Rolling Stone no Canadá
 Fazendo manha
Bancando o jogo
Que mulher
 Totalmente demais, demais
Totalmente demais, demais","Jolie comme un bébé
Quel est son sexe, quel est son sexe ?
Elle drague tout le temps les gays
Quelle union cela fait un gay si sexy
 Rock'n'roll ?
Pour elle c'est du jazz
Elle couche
Avec la haute société
Elle joue un match au sommet
 Totalement trop, trop
 Experte comme personne
Elle ne va que dans les bons coups
Elle ne se donne que du bien
Les nuits de pleine lune elle est folle
Passionnée, je ne sais pas pour qui
 Elle a excité un ado de plus
Sans y penser
Elle l'a aimé, elle est déjà partie
C'était juste pour se relaxer
 Totalement trop, trop
 Elle sait toujours qui en a
Elle fait l'avion, elle ne se donne que bien
Si elle pense qu'il y a un problème
Il n'y a pas de problème
Elle fait bien l'amour
 Sa voiture est du dernier cri
Sa jeunesse est belle
Son corps, un tapis, du genre volant
Elle est tout en finesse
Petit modèle design
 Si tu lui fais un clin d’œil, hello
Si ça ne va pas, bye bye
 Elle tient jusqu'au matin
Elle joue le jeu
Quelle femme
 Totalement trop, trop
Totalement trop, trop",pt_XX,fr_XX
"Pra que mentir
Se tu ainda não tens
Esse dom de saber
De iludir
Pra que,
Pra que mentir
Se não há necessidade de me trair
Pra que mentir
Se tu ainda não tens
A malícia de toda mulher
Pra que mentir
Se eu sei que gostas de outro
Que te diz
Que não te quer
Pra que mentir
Tanto assim
Se tu sabes que eu sei
Que tu não gostas de mim
Tu sabes que eu te quero
Apesar de ser traído
Pelo teu ódio sincero
Ou por teu amor fingido
Pra que mentir
Se tu ainda não tens
A malícia de toda mulher
Pra que mentir
Se eu sei que gostas de outro
Que te diz
Que não te quer
Pra que mentir
Tanto assim
Se tu sabes que eu sei
Que tu não gostas de mim
Tu sabes que eu te quero
Apesar de ser traído
Pelo teu ódio sincero
Ou por teu amor fingido
Pra que mentir
Se tu ainda não tens
A malícia de toda mulher
Pra que mentir
Se eu sei que gostas de outro
Que te diz
Que não te quer","Pourquoi mentir
Si tu n'as pas encore
Ce don de savoir
tromper
Pourquoi
Pourquoi mentir
S'il n'y a pas de nécessité de me trahir
Pourquoi mentir
Si tu n'as pas encore
La malice de toutes les femmes
Pourquoi mentir
Si je sais que tu en aimes un autre
Qui te dit
Qu'il ne t'aime pas
Pourquoi mentir
Ainsi autant
Si tu sais que je sais
Que tu ne m'aimes pas
Tu sais que je t'aime
Bien que je sois trahi
Par ta haine sincère
Ou par ton amour feint
Pourquoi mentir
Si tu n'as pas encore
La malice de toutes les femmes
Pourquoi mentir
Si je sais que tu en aimes un autre
Qui te dit
Qu'il ne t'aime pas
Pourquoi mentir
Ainsi autant
Si tu sais que je sais
Que tu ne m'aimes pas
Tu sais que je t'aime
Bien que je sois trahi
Par ta haine sincère
Ou par ton amour feint
Pourquoi mentir
Si tu n'as pas encore
La malice de toutes les femmes
Pourquoi mentir
Si je sais que tu en aimes un autre
Qui te dit
Qu'il ne t'aime pas",pt_XX,fr_XX
"Amanhã!
Será um lindo dia
Da mais louca alegria
Que se possa imaginar
Amanhã!
Redobrada a força
Prá cima que não cessa
Há de vingar
Amanhã!
Mais nenhum mistério
Acima do ilusório
O astro rei vai brilhar
Amanhã!
A luminosidade
Alheia a qualquer vontade
Há de imperar!
Há de imperar!
 Amanhã!
Está toda a esperança
Por menor que pareça
Existe e é prá vicejar
Amanhã!
Apesar de hoje
Será a estrada que surge
Prá se trilhar
Amanhã!
Mesmo que uns não queiram
Será de outros que esperam
Ver o dia raiar
Amanhã!
Ódios aplacados
Temores abrandados
Será pleno!
Será pleno!","Demain
Sera une belle journée
De la plus folle joie
Qui puisse s'imaginer
Demain
La force sera redoublée
Sans cesse
Elle devra venger
Demain
Mais aucun mystère
Au-dessus de l'illusoire
L'astre roi va briller
Demain
La luminosité
Étrangère à toute volonté
Devra régner !
Devra régner !
 Demain
Est tout en espoir
Pour moins qu'il semble
Il existe et doit prospérer
Demain
Malgré aujourd'hui
Sera une route qui surgit
Pour qu'on la suive
Demain
Même si certains ne le veulent pas
Sera pour les autres qui espèrent
Voir le jour briller
Demain
Les haines apaisées
Les peurs freinées
Sera une plénitude !
Sera une plénitude !",pt_XX,fr_XX
"Mais uma dose? É claro!
É claro que eu tô a fim
A noite nunca tem fim
Por que quê a gente é assim?
 Agora fica comigo
E não, não
Não desgruda de mim
Vê se ao menos me engole
Não me mastigue assim...
 Canibais de nós mesmos
Antes que a terra nos coma
Cem gramas, sem dramas
Por que quê a gente é assim?
 Mais uma dose? É claro!
É claro que eu tô a fim
A noite nunca tem fim
Por que quê a gente é assim?
 Você tem exatamente
Três mil horas
Prá parar de me beijar
Meu bem, você tem tudo
Tudo prá me conquistar...
 Você tem apenas um segundo
Um segundo
Prá aprender a me amar
Você tem a vida inteira
Baby!
A vida inteira
Prá me devorar...
 Agora fica comigo
E não, não
Não desgruda de mim
Vê se ao menos me engole
Não me mastigue assim...
 Você tem exatamente
Três mil horas
Prá parar de me beijar
Meu bem, você tem tudo
Tudo prá me conquistar...
 Você tem apenas um segundo
Um segundo
Prá aprender a me amar
Você tem a vida inteira
A vida inteira
Prá me devorar...","Encore un verre ? Bien sûr !
Bien sûr que j'ai envie
La nuit n'a jamais de fin
Pourquoi sommes-nous ainsi ?
 Maintenant reste avec moi
Et non, non
Ne te sépare pas de moi
Voyons si au moins tu m'avales
Ne me mastique pas ainsi...
 Cannibales de nous-mêmes
Avant que la terre ne nous mange
Cent grammes, sans drames
Pourquoi sommes-nous ainsi ?
 Encore un verre ? Bien sûr !
Bien sûr que j'ai envie
La nuit n'a jamais de fin
Pourquoi sommes-nous ainsi ?
 Tu as exactement
Trois mille heures
Pour arrêter de m'embrasser
Ma chère, tu as tout
Tout pour me conquérir...
 Tu as à peine une seconde
Une seconde
Pour apprendre à m'aimer
Tu as la vie entière
bébé !
La vie entière
Pour me dévorer...
 Maintenant reste avec moi
Et non, non
Ne te sépare pas de moi
Voyons si au moins tu m'avales
Ne me mastique pas ainsi...
 Tu as exactement
Trois mille heures
Pour arrêter de m'embrasser
Ma chère, tu as tout
Tout pour me conquérir...
 Tu as à peine une seconde
Une seconde
Pour apprendre à m'aimer
Tu as la vie entière
bébé !
La vie entière
Pour me dévorer...",pt_XX,fr_XX
