original_poem,translated_poem,src_lang,tgt_lang
"Jês, Kariris, Karajás, Tukanos, Caraíbas,
Makus, Nambikwaras, Tupis, Bororós,
Guaranis, Kaiowa, Ñandeva, YemiKruia
Yanomá, Waurá, Kamayurá, Iawalapiti, Suyá,
Txikão, Txu-Karramãe, Xokren, Xikrin, Krahô,
Ramkokamenkrá, Suyá
 Hey! Hey! Hey!
Hey! Hey! Hey!
 Curumim chama cunhatã que eu vou contar
Cunhatã chama curumim que eu vou contar
Curumim, cunhatã
Cunhatã, curumim
 Antes que os homens aqui pisassem
Nas ricas e férteis terraes brazilis
Que eram povoadas e amadas por milhões de índios
Reais donos felizes
Da terra do pau-brasil
Pois todo dia, toda hora, era dia de índio
Pois todo dia, toda hora, era dia de índio
 Mas agora eles só têm um dia
O dia dezenove de abril
Mas agora eles só têm um dia
O dia dezenove de abril
 Amantes da pureza e da natureza
Eles são de verdade incapazes
De maltratarem as femeas
Ou de poluir o rio, o céu e o mar
Protegendo o equilíbrio ecológico
Da terra, fauna e flora
Pois na sua história, o índio
É o exemplo mais puro
Mais perfeito, mais belo
Junto da harmonia da fraternidade
E da alegria,
 Da alegria de viver
Da alegria de amar
Mas no entanto agora
O seu canto de guerra
É um choro de uma raça inocente
Que já foi muito contente
Pois antigamente
 Todo dia, toda hora, era dia de índio
Todo dia, toda hora, era dia de índio
 Hey! Hey! Hey!
 Jês, Kariris, Karajás, Tukanos, Caraíbas,
Makus, Nambikwaras, Tupis, Bororós,
Guaranis, Kaiowa, Ñandeva, YemiKruia
Yanomá, Waurá, Kamayurá, Iawalapiti, Suyá,
Txikão, Txu-Karramãe, Xokren, Xikrin, Krahô,
Ramkokamenkrá, Suyá
 Todo dia, toda hora, era dia de índio
Todo dia, toda hora, era dia de índio
 Hey! Hey! Hey!
Curumim, cunhatã
Hey! Hey! Hey!
Cunhatã, curumim
Hey! Hey! Hey!
Curumim, cunhatã
Hey! Hey! Hey!
Cunhatã, curumim","Jês, Kariris, Karajás, Tukanos, Caraíbas,
Makus, Nambikwaras, Tupis, Bororós,
Guaranis, Kaiowa, Ñandeva, YemiKruia
Yanomá, Waurá, Kamayurá, Iawalapiti, Suyá,
Txikão, Txu-Karramãe, Xokren, Xikrin, Krahô,
Ramkokamenkrá, Suyá
 Hey! Hey! Hey!
Hey! Hey! Hey!
 Curumim appelle Cunhatã car je vais raconter
Cunhatã appelle Curumim car je vais raconter
Curumim, cunhatã
Cunhatã, curumim
 Avant que les hommes ne mettent le pied ici
Sur les riches et fertiles terres du Brésil
Qui étaient peuplées e aimées par des millions d'Indiens
Les vrais heureux propriétaires
De la terre du bois brésil
Car chaque jour, à chaque heure, c'était le jour de l'Indien
Car chaque jour, à chaque heure, c'était le jour de l'Indien
 Mais maintenant ils n'ont plus qu'un jour
Le 19 avril
Mais maintenant ils n'ont plus qu'un jour
Le 19 avril
 Amants de la pureté et de la nature
Ils sont en vérité incapables
De maltraiter les femmes
Ou de polluer la rivière, le ciel et la mer
Protégeant l'équilibre écologique
De la terre, de la faune et de la flore
Car dans son histoire, l'Indien
Est l'exemple le plus pur
Le plus parfait, le plus beau
Aux côtés de l'harmonie de la fraternité
Et de la joie
 De la joie de vivre
De la joie d'aimer
Mais maintenant
Son cri de guerre
Est le pleur d'une race innocente
Qui a déjà été très contente
Car autrefois
 Chaque jour, chaque heure, c'était le jour de l'Indien
Chaque jour, chaque heure, c'était le jour de l'Indien
 Hey! Hey! Hey!
 Jês, Kariris, Karajás, Tukanos, Caraíbas,
Makus, Nambikwaras, Tupis, Bororós,
Guaranis, Kaiowa, Ñandeva, YemiKruia
Yanomá, Waurá, Kamayurá, Iawalapiti, Suyá,
Txikão, Txu-Karramãe, Xokren, Xikrin, Krahô,
Ramkokamenkrá, Suyá
 Todo dia, toda hora, era dia de índio
Todo dia, toda hora, era dia de índio
 Hey! Hey! Hey!
Curumim, cunhatã
Hey! Hey! Hey!
Cunhatã, curumim
Hey! Hey! Hey!
Curumim, cunhatã
Hey! Hey! Hey!
Cunhatã, curumim",pt_XX,fr_XX
"Eu perguntei ao tempo
Quanto tempo eu tenho
Pra passar o tempo
O tempo me respondeu
Deixo o tempo passar
Você tem muito tempo
Das Neves, você tem muito tempo
Quem pensa no tempo também perde tempo,
Das Neves, você tem muito tempo,
Pois é dá um tempo,
Que o tempo é pra já. (2x)
 Quem diz todo o tempo
Que o tempo é dinheiro
Não tem passa-tempo
Nenhum tempo afora
Pra se ter bom tempo
Tem que ter tempero
Não põe contra-tempo
Que o tempo piora
O tempo procura
Não ter tempo quente
Pra fechar o tempo
Hoje o tempo demora
Os tempos mudaram,
Pois já foi-se o tempo
Da temperatura dos tempos de outrora
Ninguém ganha tempo
Que o tempo é momento
Do temperamento do tempo de agora
O tempo só quer
Que se dê tempo ao tempo
Que tudo do tempo chega a tempo e hora
 Das Neves, você tem muito tempo
Quem pensa no tempo também perde tempo,
Das Neves, você tem muito tempo
Pois é dá um tempo,
Que o tempo é pra já.
 Composição: Paulo César Pinheiro / Wilson DasNeves ·","J'ai demandé au temps
Combien de temps j'avais
Pour passer le temps
Le temps m'a répondu
Laisse le temps passer
Tu as beaucoup de temps
Das Neves, tu as beaucoup de temps
Celui qui pense au temps perd aussi du temps
Das Neves, tu as beaucoup de temps,
Alors attends un peu,
Car il sera bientôt temps (2x)
 Qui dit tout le temps
Que le temps est de l'argent
N'a pas de passe-temps
Aucun temps libre
Pour avoir du bon temps
Il faut qu'il y ait du piment
Ne sois pas à contre-temps
Car le temps ne fait qu'empirer
Le temps cherche
A ne pas avoir de chaleur
Pour fermer le temps
Aujourd'hui le temps tarde
Les temps ont changé
Car il est déjà parti, le temps
Des températures des temps anciens
Personne ne gagne du temps
Car le temps est le moment
Du tempérament du temps d'aujourd'hui
Le temps veut juste
Que l'on donne du temps au temps
Car tout le temps arrive à temps et à l'heure
 Das Neves, tu as beaucoup de temps
Celui qui pense au temps perd aussi du temps
Das Neves, tu as beaucoup de temps,
Alors attends un peu,
Car il sera bientôt temps",pt_XX,fr_XX
"Parece até que eu
Jamais falei no amor
Parece até que jamais amei
Criança é mesmo assim
Bobagem , beleza só fala
Maravilhas banais
Quero amar você
De todas as maneiras
Que eu puder viver você estribilho
Por todos os caminhos
Que eu puder sentir você
Em todos os sentidos do prazer
Há que fel
Mamão com mel
E eu nem preciso asas pra voar
Melhor é bem difícil de sonhar
Amar viver sentir a vida com você
Amar sentir você mas que prazer
Ah, que céu
Mamão com mel
E eu nem preciso de asas pra voar
Melhor é bem difícil de sonhar
Amar, viver, sentir a vida com você","On dirait presque que
Je n'ai jamais parlé à l'amour
On dirait presque que je n'ai jamais aimé
Un enfant est ainsi
Des sottises, une beauté
Qui ne dit que des merveilles banales
 Je veux t'aimer
De toutes les manières
Que je puisse te vivre
Par tous les chemins
Où je puisse te sentir
Dans tous les sens du plaisir (2x)
 Ah je suis au ciel !
De la papaye avec du miel
Je n'ai même pas besoin d'ailes pour voler
C'est bien difficile de mieux rêver
Aimer, vivre, sentir la vie avec toi
Aimer, te sentir, mais quel plaisir
 Ah, je suis au ciel !
De la papaye avec du miel
Je n'ai même pas besoin d'ailes pour voler
C'est bien difficile de mieux rêver
Aimer, vivre, sentir la vie avec toi",pt_XX,fr_XX
"Já me perdi
Mais uma vez
Já percebi
O que me faz sofrer
Não...
Vou voltar aqui
Não...
Vou voltar a amar assim
 Não ,não vou voltar
A perdoar
O que me faz chorar
Sim, sim já esqueci
E já me perdi
Mais uma vez
 Já conheci
O que me faz chorar
Já, senti
O meu mundo a desabar
Não...
Vou voltar aqui
Não...
Vou voltar a amar assim
 Não ,não vou voltar
A perdoar
O que me faz chorar
Sim, sim já esqueci
E já me perdi
Mais uma vez
 Não, não, não, não
Não, não, não, não
 Não ,não vou voltar
A perdoar
O que me faz chorar
Sim, sim já esqueci
E já me perdi
Mais uma vez
 Não, não, não, não
Não, não, não, não
 Vou lá voltar...","Je suis perdu
encore une fois
je réalise
Ce qui me fait souffrir
Non ...
Je ne vais pas y retourner
Non ...
Je ne vais pas revenir à l'amour de cette façon
 Non, non, je ne vais pas revenir
pardonner
Ce qui me fait pleurer
Oui, oui je l'ai déjà oublié
Et je suis perdu
encore une fois
 je sais
Ce qui me fait pleurer
Je l'ai déjà, senti
Mon monde effondrer
Non ...
Je ne vais pas y retourner
Non ...
Je ne vais pas revenir à l'amour de cette façon
 Non, non, je ne vais pas revenir
pardonner
Ce qui me fait pleurer
Oui, oui je l'ai déjà oublié
Et je suis perdu
encore une fois
 Non Non Non Non
Non Non Non Non
 Non, non, je ne vais pas revenir
pardonner
Ce qui me fait pleurer
Oui, oui je l'ai déjà oublié
Et je suis perdu
encore une fois
 Non Non Non Non
Non Non Non Non
 Je ne vais pas revenir ...",pt_XX,fr_XX
"No bico do beija-flor, beija-flor, beija-flor
Toda fauna-flora grita de amor
Quem segura o porta-estandarte
Tem a arte, tem a arte
E aqui passa com raça eletrônico maracatu atômico
 Anamauê, auêia, aê
Anamauê, auêia, aê
Anamauê, auêia, aê
Anamauê
 Atrás do arranha-céu tem o céu tem o céu
E depois tem outro céu sem estrelas
Em cima do guarda-chuva, tem a chuva tem a chuva,
Que tem gotas tão lindas que até dá vontade de
comê-las
 Anamauê, auêia, aê
Anamauê, auêia, aê
Anamauê, auêia, aê
Anamauê, auêia, aê
 No meio da couve-flor tem a flor, tem a flor,
Que além de ser uma flor tem sabor
Dentro do porta-luva tem a luva, tem a luva
Que alguém de unhas tão negras e tão afiadas esqueceu
de pôr
 Anamauê, auêia, aê
Anamauê, auêia, aê
Anamauê, auêia, aê
Anamauê, auêia, aê
 No fundo do para-raio tem o raio, tem o raio,
Que caiu da nuvem negra do temporal
Todo quadro negro é todo negro é todo negro
Que eu escrevo seu nome nele só pra demonstrar o meu
apego
 Anamauê, auêia, aê
Anamauê, auêia, aê
Anamauê, auêia, aê
Anamauê, auêia, aê
 No bico do beija-flor, beija-flor, beija-flor,
Toda fauna flora grita de amor
Quem segura o porta-estandarte
Tem a arte, tem a arte
E aqui passa com raça eletrônico maracatu atômico
 Anamauê, auêia, aê
Anamauê, auêia, aê
Anamauê, auêia, aê
Anamauê, auêia, aê...","Sur le bec du colibri, colibri, colibri
Toute la faune et la flore crie d'amour
Pour celui tient le porte-drapeau
C'est tout un art, tout un art
Et voici que passe avec race le maracatu atomique électronique
 Anamauê, auêia, aê
Anamauê, auêia, aê
Anamauê, auêia, aê
Anamauê
 Derrière le gratte-ciel il y a le ciel, il y a le ciel
Et ensuite il y a un autre ciel sans étoiles
Au-dessus du parapluie il y a la pluie, il y a la pluie
Qui a de si jolies gouttes que ça donne même envie de les manger
 Anamauê, auêia, aê
Anamauê, auêia, aê
Anamauê, auêia, aê
Anamauê, auêia, aê
 Au milieu du chou-fleur il y a la fleur, il y a la fleur,
Qui en plus d'être une fleur a de la saveur
Dans l'étui à gants il y a le gant, il y a le gant
Que quelqu'un aux ongles si noirs et si aiguisés a oublié de mettre
 Anamauê, auêia, aê
Anamauê, auêia, aê
Anamauê, auêia, aê
Anamauê, auêia, aê
 Au fond du paratonnerre il y a la foudre, il y a la foudre
Qui est tombée du nuage noir de l'orage
Tout tableau noir est tout noir, est tout noir
Où j'écris ton nom juste pour démontrer mon affection
 Anamauê, auêia, aê
Anamauê, auêia, aê
Anamauê, auêia, aê
Anamauê, auêia, aê
 Sur le bec du colibri, colibri, colibri
Toute la faune et la flore crie d'amour
Pour celui tient le porte-drapeau
C'est tout un art, tout un art
Et voici que passe avec race le maracatu atomique électronique
 Anamauê, auêia, aê
Anamauê, auêia, aê
Anamauê, auêia, aê
Anamauê",pt_XX,fr_XX
"Quando a gente conversa
Contando casos, besteiras
Tanta coisa em comum
Deixando escapar segredos
E eu não sei que hora dizer
Me dá um medo, que medo
 É que eu preciso dizer que eu te amo
Te ganhar ou perder sem engano
É, eu preciso dizer que eu te amo tanto
 E até o tempo passa arrastado
Só pra eu ficar do teu lado
Você me chora dores de outro amor
Se abre e acaba comigo
E nessa novela eu não quero
Ser teu amigo
 É que eu preciso dizer que eu te amo
Te ganhar ou perder sem engano
É, eu preciso dizer que eu te amo tanto
 Eu já nem sei se eu tô misturando
Eu perco o sono
Lembrando em cada riso teu
Qualquer bandeira
Fechando e abrindo a geladeira
A noite inteira
 Eu preciso dizer que eu te amo
Te ganhar ou perder sem engano
Eu preciso dizer que eu te amo tanto.","Quand nous discutons
Racontant des histoires, des bêtises
Autant de choses en commun
Laissant échapper des secrets
Et je ne saurais pas dire à quelle heure
Ça me fait peur, quelle peur !
 C'est que j'ai besoin de dire que je t'aime
Te gagner ou te perdre sans tromperie
Oui, j'ai besoin de te dire que je t'aime autant
 Et même le temps passe en traînant
Juste pour que je reste à tes côtés
Tu te plains des douleurs d'un autre amour
Tu t'ouvres et tu en finis avec moi
Et dans ce feuilleton je ne veux pas
Etre ton ami
 C'est que j'ai besoin de dire que je t'aime
Te gagner ou te perdre sans tromperie
Oui, j'ai besoin de te dire que je t'aime autant
 Je ne sais même pas si je suis perdu
Je perds le sommeil
Me souvenant dans chacun de tes rires
N'importe quel éclat de rire
Fermant et ouvrant le frigo
La nuit entière
 J'ai besoin de dire que je t'aime
Te gagner ou te perdre sans tromperie
Oui, j'ai besoin de te dire que je t'aime autant",pt_XX,fr_XX
"Chora a tristeza de viver assim,
A loucura tomará conta de mim.
Por que você me abandonou?
E eu que lhe dediquei
Todo um grande amor,
Vou pelas noites a vagar
Até você voltar num raio de sol.
Mas se sentir que vale a pena,
Venha matar saudades,
Mas venha pra ficar.
 Por que você me abandonou?
E eu que lhe dediquei
Todo um grande amor,
Vou pelas noites a vagar
Até você voltar num raio de sol.
Mas se sentir que vale a pena,
Venha matar saudades,
Venha matar saudades,
Venha matar saudades,
Mas venha pra ficar.
 Venha matar saudades,
Venha matar saudades,
Venha matar saudades,
Mas venha pra ficar.","Pleure la tristesse de vivre ainsi
La folie s'est emparée de moi
Pourquoi m'as tu abandonné ?
Moi qui t'ai dédié
Tout un grand amour
Je vais errer dans la nuit
Jusqu'à ce que tu reviennes dans un rayon de soleil
Mais si si tu sens que ça vaut la peine
Viens revivre les souvenirs
Mais viens pour rester.
 Pourquoi m'as-tu abandonné ?
Moi qui t'ai dédié
Tout un grand amour
Je vais errer dans la nuit
Jusqu'à ce que tu reviennes dans un rayon de soleil
Mais si si tu sens que ça vaut la peine
Viens revivre les souvenirs
Viens revivre les souvenirs
Viens revivre les souvenirs
Mais viens pour rester.
 Viens revivre les souvenirs
Viens revivre les souvenirs
Viens revivre les souvenirs
Mais viens pour rester.",pt_XX,fr_XX
"Claudio Zoli - Cada Um, Cada Um (a Namoradeira)
 Foi bom te ver
Saber que você, é
É feliz
Impossível te esquecer
Lembrar você
Parece um dom
 * A namoradeira
No escuro da sala
Sonhando e beijando
De segunda a sexta
No fim de semana
De noite na Barra
Procurando vaga
De noite na Barra
Agora é cada um
Cada um *
 Foi um lindo amor
Pena não sobreviver
Quando a vida
Me iluminou
A minha luz
Era você
 * Repeat","Ce fut bon de te voir
Savoir que tu es
Heureuse
Impossible de t'oublier
Me souvenir de toi
Ressemble à un don
 Ce fut un bel amour
Dommage qu'il n'ait pas survécu
Quand la vie m'illuminait
Ma lumière c'était toi
 La dragueuse
Dans l'obscurité de la salle
Rêvant et embrassant
Du lundi au vendredi
Les weekends à Barra
Cherchant une place libre
Le soir à Barra
Maintenant c'est chacun
Pour soi.
 Ce fut un bel amour
Dommage qu'il n'ait pas survécu
Quand la vie m'illuminait
Ma lumière
c'était toi",pt_XX,fr_XX
"Moça, me espere amanhã
Levo o meu coração
Pronto pra te entregar
 Moça,
Moça eu te prometo
Eu me viro do avesso,
Só pra te abraçar
 Moça, eu sei que já não és pura,
Teu passado é tão forte
Pode até machucar
 Moça, dobre as mangas do tempo
Jogue o teu sentimento
Todo em minhas mãos
 Eu quero me enrolar nos teus cabelos
Abraçar teu corpo inteiro,
Morrer de amor,
De amor me perder
Eu quero,eu quero...
 Eu quero me enrolar nos teus cabelos
Abraçar teu corpo inteiro,
Morrer de amor,
De amor me perder
 Moça, eu sei que já não és pura,
Teu passado é tão forte
Pode até machucar
 Moça, dobre as mangas do tempo
Jogue o teu sentimento
Todo em minhas mãos
 Eu quero me enrolar nos teus cabelos
Abraçar teu corpo inteiro,
Morrer de amor,
De amor me perder
Eu quero,eu quero...
 Eu quero me enrolar nos teus cabelos
Abraçar teu corpo inteiro,
Morrer de amor,
De amor me perder
Eu quero,eu quero...
 Eu quero me enrolar nos teus cabelos
Abraçar teu corpo inteiro,
Morrer de amor,
De amor me perder!","Demoiselle, attends-moi demain
J'apporte mon cœur
Prêt à être livré
 Demoisellle,
Demoiselle je te promets
Je me mettrai la tête en bas
Juste pour t'embrasser
 Demoiselle, je sais que tu n'es déjà plus pure,
Ton passé est si fort
Cela peut même blesser
 Demoiselle, retrousse les manches du temps
Jette tes sentiments
Entiers entre mes mains
 Je veux m'enrouler dans tes cheveux
Embrasser ton corps entier,
Mourir d'amour,
Me perdre d'amour
Je veux, je veux...
 Je veux m'enrouler dans tes cheveux
Embrasser ton corps entier,
Mourir d'amour,
Me perdre d'amour
 Demoiselle, je sais que tu n'es déjà plus pure,
Ton passé est si fort
Cela peut même blesser
 Demoiselle, retrousse les manches du temps
Jette tes sentiments
Entiers entre mes mains
 Je veux m'enrouler dans tes cheveux
Embrasser ton corps entier,
Mourir d'amour,
Me perdre d'amour
Je veux, je veux...
 Je veux m'enrouler dans tes cheveux
Embrasser ton corps entier,
Mourir d'amour,
Me perdre d'amour
Je veux, je veux...
 Je veux m'enrouler dans tes cheveux
Embrasser ton corps entier,
Mourir d'amour,
Me perdre d'amour",pt_XX,fr_XX
"O que é que eu vou fazer
Com essa tal liberdade?
Se estou na solidão
Pensando em você
Eu nunca imaginei
Sentir tanta saudade
Meu coração não sabe
Como te esquecer...
 Eu andei errado
Eu pisei na bola
Troquei quem mais amava
Por uma ilusão
Mas a gente aprende
A vida é uma escola
Não é assim que acaba
Uma grande paixão...
 Quero te abraçar
Quero te beijar
Te desejo noite e dia
Quero me prender todo em você
Você é tudo o que eu queria...","Qu'est-ce que je vais faire
Avec cette sacrée liberté ?
Si je suis dans la solitude
Pensant à toi
Je n'ai jamais imaginé
Ressentir autant de nostalgie
Mon cœur ne sait pas
Comment t'oublier...
 Je me suis trompé
J'ai marché sur le ballon
J'ai échangé celle que j'aimais
Contre une illusion
Mais on apprend
La vie est une école
Ce n'est pas ainsi que se termine
Une grande passion...
 Je veux te prendre dans mes bras
Je veux t'embrasser
Je te désire jour et nuit
Je veux m'emprisonner totalement en toi
Tu es tout ce que je voulais...",pt_XX,fr_XX
"Você minha morena dengosa
O meu verso minha prosa o meu riso meu viver
Você tão graciosa e faceira
Que pra mim era a primeira de toda multidão
 No carnaval sambando na avenida você era a mais querida e eu não via mais ninguém
Arrasta a sandália, que eu quero ver, eu quero ver, eu quero ver
 Na quarta-feira, quando acaba um o sonho
Vejo seu corpo cansado, dos três dias de folia
No canto a sandália empoeirada
A fantasia castigada, nada importa você é minha
 No carnaval....","Toi ma tendre brunette
Mes vers, ma prose, mon rire, ma vie
Toi si gracieuse et charmante
Pour moi tu as été la première de toute la multitude
 Au carnaval, dansant la samba dans l'avenue, tu étais la plus
Désirée et je ne voyais personne d'autre
Fais glisser tes sandales, car je veux te voir, je veux te voir, je
veux te voir
 Le mercredi, quand le rêve se termine
Je vois ton corps fatigué par les trois jours de folie
Dans un coin tes sandales poussiéreuses
Le déguisement froissé, rien ne m'importe, tu es à moi
 Au carnaval...",pt_XX,fr_XX
"Olha pra mim
Não diga nada
Nos seus olhos vai nascer a madrugada
Sonha pra mim
Um sonho lindo
Nos seus olhos vejo um filme colorido
 O momento de esquecer
Esse mundo absurdo
Mas não pense que eu fico mudo
Por não ter razão
 Não diga nada
Talvez eu encontre o caminho
Não diga nada
Entre nós não existe segredo
Não diga nada
Deixe o vento varrer as palavras
Olha pra mim.","Regarde-moi
Ne dis rien
Dans tes yeux va naître l'aube
Rêve pour moi
Un joli rêve
Dans tes yeux je vois un film en couleur
 C'est le moment d'oublier
Ce monde absurde
Mais ne crois pas que je reste muet
Pour ne pas avoir raison
 Ne dis rien
Peut-être vais-je trouver le chemin
Ne dis rien
Etre nous il n'existe pas de secret
Ne dis rien
Laisse le vent balayer les paroles
Regarde-moi",pt_XX,fr_XX
"Tenho pena de quem chora
De quem chora tenho dó
Quando o choro de quem chora
Não é choro, é chororô
 Quando uma pessoa chora seu choro baixinho
De lágrima a correr pelo cantinho do olhar
Não se pode duvidar
Da razão daquela dor
Não se pode atrapalhar
Sentindo seja o que for
 Mas quando a pessoa chora o choro em desatino
Batendo pino como quem vai se arrebentar
Aí, penso que é melhor
Ajudar aquela dor
A encontrar o seu lugar
No meio do chororô
 Chororô, chororô, chororô
É muita água, é mágoa, é jeito bobo de chorar
Chororô, chororô, chororô
É mágoa, é muita água, a gente pode se afogar
 Chororô, chororô, chororô
É muita água, é mágoa, é jeito bobo de chorar
Chororô, chororô, chororô
É mágoa, é muita água, a gente pode se acabar","J'ai de la peine pour celui qui pleure
De celui qui pleure j'ai pitié
Quand les pleurs de celui qui pleure
Ne sont pas des pleurs mais des sanglots
 Quand une personne pleure doucement
Avec une larme qui court au coin de l’œil
On ne peut pas douter
De la raison de cette douleur
On ne peut pas l'empêcher
Quelle que soit la douleur que l'on ressente
 Mais quand une personne pleure à la folie
Devenant folle comme quelqu'un qui va exploser
Alors je pense qu'il vaut mieux
Aider cette douleur
A trouver sa place
Au milieu des sanglots
 Les sanglots, les sanglots, les sanglots
C'est beaucoup d'eau, c'est de la tristesse, c'est une façon bête de pleurer
Les sanglots, les sanglots, les sanglots
C'est de la tristesse c'est beaucoup d'eau, on peut s'y noyer
 Les sanglots, les sanglots, les sanglots
C'est beaucoup d'eau, c'est de la tristesse, c'est une façon bête de pleurer
Les sanglots, les sanglots, les sanglots
C'est de la tristesse c'est beaucoup d'eau, on peut s'y noyer",pt_XX,fr_XX
"Tinha amor à terra que o mar lhe ocultava
Amor, como uma mulher ao ente que vai nascer
Assim ia cuidando e em sonhos se afundava
No alto da coberta, olhando a proa erguer
 Pareceu-lhe que algo se mexia
Uma névoa ao longe a querer romper
Enquanto o barco, espumando, as águas dividia
De encontro à terra prestes a nascer
 Ao descobri-la porém, soube-lhe a traição
Nada os unia. Oculto no silêncio, nenhum cordão
De novo quis encobri-la mas era tarde de mais:
Nua jazia aos olhos do mundo. Apenas lhe restava
Seguir curso tristemente, sem destino nem cais
E sem corrente – vazio de si no vazio dos mares","Il portait un amour à la terre que la mer lui masquait
Un amour à l’enfant, comme une femme qui accouche
Il allait ainsi préoccupé, il sombrait dans ses rêves.
A l’avant du navire, regardant la proue se dresser.
 Il lui semblait que quelque chose bougeait
Une nuée au loin qu’il voulait rompre,
Pendant que le bateau, écumant, séparait les eaux
A la rencontre d'une terre – prête à naitre.
 Pour la découvrir, cependant, saurait-il la trahir ?
//Rien qui les unisse.// Muré dans le silence et sans attaches.
Il désirait qu’elle se couvre de nouveau //mais il était trop tard//
Exhibée, nue aux yeux du monde. A peine l’avait-il quitté
Suivant sa route tristement, sans destin ni repos
Et sans plus de force – vide, de toute la vacuité des mers.",pt_XX,fr_XX
"Este amor não é um rio
Tem a vastidão do mar
E a dança verde das ondas
Soluça no meu olhar
 Tentei esquecer as palavras
Nunca ditas entre nós
Mas pairam sobre o silencio
Nas margens da nossa voz
 Tentei esquecer os teus olhos
Que não sabem ler nos meus
Mas neles nasce a alvorada
Que amanhece a terra e os céus
 Tentei esquecer o teu nome
Arrancá-lo ao pensamento
Mas regressa a todo o instante
Entrelaçado no vento
 Tentei ver a minha imagem
Mas foi a tua que vi
No meu espelho, porque trago
Os olhos rasos de ti
 Este amor não é um rio
Tem abismos como o mar
E o manto negro das ondas
Cobre-me de negro o olhar
 Este amor não é um rio
Tem a vastidão do mar","Cet amour n’est pas un fleuve,
Il a de la mer, l’amplitude.
La danse verte des vagues
Sanglote dans mes yeux.
 J’ai essayé d’oublier les paroles
Jamais dites entre nous,
Restées là silencieuses, suspendues
Au bord de nos lèvres
 J’ai essayé d’oublier tes yeux
Qui ne savent pas lire les miens
Mais dans lesquels nait l’aubade
Du petit matin de la terre et du ciel.
 J’ai essayé d’oublier ton nom,
De l’arracher de mes pensées
Mais il revient à tout instant
Dans les entrelacs du vent
 J’ai essayé de voir ma propre image
Mais c’est la tienne que j’ai vue
dans mon miroir, car de toi
mes yeux débordent.
 Cet amour n’est pas un fleuve,
Il a des abîmes comme la mer
Et le manteau noir des vagues jette
Sur mes yeux une ombre noire.
 Cet amour n’est pas un fleuve,
Il a l'amplitude de la mer.",pt_XX,fr_XX
