original_poem,translated_poem,src_lang,tgt_lang,translated_by_TA,topic
"je fais souvent ce rêve étrange et pénétrant
d’une femme inconnue, et que j’aime, et qui m’aime,
et qui n’est, chaque fois, ni tout à fait la même
ni tout à fait une autre, et m’aime et me comprend.
car elle me comprend, et mon coeur transparent
pour elle seule, hélas! cesse d’être un problème
pour elle seule, et les moiteurs de mon front blême,
elle seule les sait rafraîchir, en pleurant.
est-elle brune, blonde ou rousse? je l’ignore.
son nom? je me souviens qu’il est doux et sonore,
comme ceux des aimés que la vie exila.
son regard est pareil au regard des statues,
et, pour sa voix, lointaine, et calme, et grave, elle a
l’inflexion des voix chères qui se sont tues.","muitas vezes, o sonho estranho me surpreende
de uma ignota mulher que eu amo e que me adora,
e que a mesma não é, certamente, a toda hora,
não sendo outra, porém, e me ama e me compreende.
todo o meu coração deixo que ela o desvende.
ela somente o faz transparente e o avigora,
e se eu sofro, se a dor minha fronte descora,
ela é o consolo ideal que sobre mim se estende.
é ela trigueira, ou loira, ou ruiva? – eu o ignoro.
seu nome? apenas sei que ele é doce e sonoro
como o de quem se amou e da vida fugiu.
seu olhar, como o olhar de uma estátua, é sem alma,
e tem na sua voz, grave, longínqua e calma,
a inflexão de uma voz cara que se extingiu.",fr_XX,pt_XX,"Muitas vezes tenho esse sonho estranho e penetrante
de uma mulher desconhecida, a quem amo e que me ama,
e que não é, cada vez, inteiramente o mesmo
nem outro completamente diferente, e me ama e me entende.
porque ela me entende, e meu coração transparente
só para ela, ai de mim! deixa de ser um problema
só para ela, e a umidade da minha testa pálida,
Só ela sabe como refresco-los, chorando.
Ela é morena, loira ou ruiva? Não sei.
o nome dele? Lembro-me de que era suave e sonoro,
como os dos entes queridos que a vida exila.
seu olhar é como o olhar das estátuas,
e, por sua voz, distante, calma e séria, ela tem
a inflexão de vozes queridas que se calaram.",1
"je fais souvent ce rêve étrange et pénétrant
d’une femme inconnue, et que j’aime, et qui m’aime,
et qui n’est, chaque fois, ni tout à fait la même
ni tout à fait une autre, et m’aime et me comprend.
car elle me comprend, et mon coeur transparent
pour elle seule, hélas! cesse d’être un problème
pour elle seule, et les moiteurs de mon front blême,
elle seule les sait rafraîchir, en pleurant.
est-elle brune, blonde ou rousse? je l’ignore.
son nom? je me souviens qu’il est doux et sonore,
comme ceux des aimés que la vie exila.
son regard est pareil au regard des statues,
et, pour sa voix, lointaine, et calme, et grave, elle a
l’inflexion des voix chères qui se sont tues.","sonho às vezes o sonho estranho e persistente
de não sei que mulher que eu quero e que me quer,
e que nunca é, de fato, uma única mulher
e nem outra, de fato, e me compreende e sente.
compreende-me, e este meu coração, transparente
para ela, não é mais um problema qualquer,
só para ela, o meu suor de angústia, se quiser,
chorando, ela transforma em frescura envolvente.
se é morena, ou se loura, ou se ruiva – eu ignoro.
seu nome? é como o nome ideal, doce e sonoro,
dos amados que a vida exilou para além.
seu olhar lembra o olhar de alguma estátua antiga,
e sua voz longínqua, e calma, e grave, tem
certa inflexão de emudecida voz amiga.",fr_XX,pt_XX,"Muitas vezes tenho esse sonho estranho e penetrante
de uma mulher desconhecida, a quem amo e que me ama,
e que não é, cada vez, inteiramente o mesmo
nem outro completamente diferente, e me ama e me entende.
porque ela me entende, e meu coração transparente
só para ela, ai de mim! deixa de ser um problema
só para ela, e a umidade da minha testa pálida,
Só ela sabe como refresco-los, chorando.
Ela é morena, loira ou ruiva? Não sei.
o nome dele? Lembro-me de que era suave e sonoro,
como os dos entes queridos que a vida exila.
seu olhar é como o olhar das estátuas,
e, por sua voz, distante, calma e séria, ela tem
a inflexão de vozes queridas que se calaram.",1
"maintenant que je suis loin de la populace
je puis sonder mon âme et recueillir mes
pleurs.
j’ai mis un voile sur le front de mes douleurs,
et personne n’a vu la souffrance en ma face.
car j’ai trop de fierté pour montrer mes émois
et tout ce que mes yeux reflètent d’amertume,
et mon rire toujours comme une dense brume
empêche l’étranger de connaître mon “moi”.
je fais semblant de rire alors que dans moi
même
quelque chose de las, de lourd et d’étouffant
contemple ma gaîté et, sombre, la blasphème.
devant l’indifférent je sonne l’olifant,
pour que le monde croie encor ma vie heureuse
et ne découvre point ma lassitude affreuse.","agora que distante estou da populaça
posso sondar minha alma e recolher meu
pranto.
minhas dores cobri com um espesso manto,
e ninguém entreviu em meu rosto a desgraça.
pois sou muito vaidoso e não mostro o que sinto
nem o que meu olhar reflete de amargores,
e tal qual densa bruma afinal meus humores
vedam ter de meu “eu” ao estranho o instinto.
eu simulo sorrir, dentro de mim, contudo,
um quê de farto e árduo e muito sufocante
contempla meu contento e o blasfema, sisudo.
ante o desimportante eu toco um olifante,
para que o mundo creia em minha alegre vida
e que nunca descubra a minha alma abatida.",fr_XX,pt_XX,"agora que estou longe da população
Posso buscar minha alma e reunir meus
lágrimas.
Coloquei um véu sobre a testa das minhas tristezas,
e ninguém viu o sofrimento em meu rosto.
porque tenho muito orgulho para mostrar minhas emoções
e toda a amargura que meus olhos refletem,
e meu riso ainda como uma névoa densa
impede que o estranho conheça o meu “eu”.
Eu finjo rir enquanto estou dentro de mim
até
algo cansado, pesado e sufocante
contempla minha alegria e, sombriamente, a blasfema.
diante do indiferente eu soo o olifante,
para que o mundo ainda acredite que minha vida é feliz
e não descubra meu terrível cansaço.",1
"je suis triste toujours quand ton visage est triste,
je pleure quand tes yeux sont mouillés par les
pleurs,
car tu es mon seul but, mon rêve trismégiste,
et l’âme que mon âme enchâsse en sa douleur.
et mon amour pour toi n’est pas un égoïste
qui cherche le plaisir de la chair et du cœur;
non, même loin de toi mon grand amour
subsiste
pour me guider vers l’idéal, grave et songeur.
comme un religieux aux pieds de la madone,
mon âme s’en va toute en prières vers toi,
en soupirs aussi doux qu’une brise d’automne.
aux lentes fins de jour quand chantent les
émois,
je pense à ton bonheur – ô belle souveraine –
si nous pouvions partir les mains encore
pleines
de rires, de sanglots, de douleurs et de joies.","tristonho sempre estou se teu rosto é tristonho,
eu choro se por choro alaga-se tua vista,
pois meu desejo és tu, meu trismegisto sonho,
uma alma que minha alma em sua dor
conquista.
e meu amor por ti não é um interesseiro
que quer da alma e da carne o prazer tão
somente;
mesmo longe de ti meu amor é parceiro
que ao ideal conduz, sonhador e imponente.
tal fiel da madona ajoelhado ao trono,
minha alma, em oração, busca em ti moradia,
em suspiros sutis como um vento de outono.
e quando ao pôr do sol cantarola a agonia,
eu penso em teu deleite – ó soberana airosa –
se possível nos for partir com generosa
soma de riso e dor, de lamento e alegria.",fr_XX,pt_XX,"Eu sempre fico triste quando seu rosto está triste,
Eu choro quando seus olhos estão molhados de
lágrimas,
porque você é meu único objetivo, meu sonho de Trismegisto,
e a alma que minha alma consagra em sua dor.
e meu amor por você não é egoísta
que busca o prazer da carne e do coração;
não, mesmo longe de você meu grande amor
restos
para me guiar em direção ao ideal, sério e pensativo.
como um monge aos pés da Madona,
Minha alma se dirige a você em oração,
em suspiros tão suaves quanto uma brisa de outono.
no final lento do dia quando o
emoções,
Penso na tua felicidade – ó bela soberana –
se pudéssemos sair com as mãos paradas
completo
de risos, soluços, dor e alegria.",1
