original_poem,translated_poem,src_lang,tgt_lang,translated_by_TA,topic
"which eye’s his eye?
which limb lies
next the mirror?
for neither is clearer
nor a different color
than the other,
nor meets a stranger
in this arrangement
of leg and leg and
arm and so on.
to his mind
it’s the indication
of a mirrored reflection
somewhere along the line
of what we call the spine.","qual olho é o dele?
qual membro é real
e qual está no espelho?
a cor é igual
à esquerda e à direita,
e ninguém suspeita
que esta ou aquela
perna, ou braço, seja
verdade ou impostura
nessa estranha estrutura.
a seu ver,
isso é prova garantida
de uma imagem refletida
ao longo desta linha
que chamamos de espinha.",en_XX,pt_XX,"qual olho é o olho dele?
qual membro está
próximo ao espelho?
pois nenhum é mais claro
nem de uma cor diferente
do outro,
nem encontra um estranho
nesse arranjo
de perna e perna e
braço e assim por diante.
para sua mente
é a indicação
de um reflexo espelhado
em algum lugar ao longo da linha
do que chamamos de espinha.",2.0
"he felt in modesty
his person was
half looking-glass,
for why should he
be doubled?
the glass must stretch
down his middle,
or rather down the edge.
but he’s in doubt
as to which side’s in or out
of the mirror.
there’s little margin for error,
but there’s no proof, either.
and if half his head’s reflected,
thought, he thinks, might be affected.","modesto, sentia
que sua pessoa
era metade espelho:
pois duplicar-se seria
um total destrambelho.
o vidro se prolonga
por sua mediana,
ou melhor, sua borda.
mas ele não sabe direito
o que está dentro ou fora
da imagem refletida.
não há muita margem de erro,
mas provar é impossível.
e se meio cérebro é reflexo
seu pensamento terá nexo?",en_XX,pt_XX,"ele sentiu em modéstia
sua pessoa era
metade espelho,
pois por que ele deveria
ser dobrado?
o vidro deve se esticar
até o meio,
ou melhor, até a borda.
mas ele está em dúvida
quanto a qual lado está dentro ou fora
do espelho.
há pouca margem para erro,
mas também não há provas.
e se metade de sua cabeça estiver refletida,
o pensamento, ele pensa, pode ser afetado.",2.0
"up the façades,
his shadow dragging like a photographer’s cloth behind him,
he climbs fearfully, thinking that this time he will manage
to push his small head through that round clean opening
and be forced through, as from a tube, in black scrolls on the light.
(man, standing below him, has no such illusions.)
but what the man-moth fears most he must do, although
he fails, of course, and falls back scared but quite unhurt.","sobe as fachadas,
medroso, arrastando como um pano de fotógrafo
sua sombra, e pensa que dessa vez vai conseguir
meter a cabeça naquele furo bem redondo
e sair, como de um tubo, em dobras negras na luz.
(o homem, lá embaixo, não tem tais ilusões.)
porém o homem-mariposa tem de fazer o que mais teme,
e fracassa, é claro: cai, assustado, mas ileso.",en_XX,pt_XX,"subindo pelas fachadas,
sua sombra arrastando-se como um pano de fotógrafo atrás dele,
ele sobe com medo, pensando que desta vez conseguirá
empurrar sua pequena cabeça através daquela abertura redonda e limpa
e ser forçado a passar, como de um tubo, em pergaminhos pretos na luz.
(o homem, de pé abaixo dele, não tem tais ilusões.)
mas o que o homem-mariposa mais teme ele deve fazer, embora
ele falhe, é claro, e cai para trás assustado, mas ileso.",2.0
"if you catch him,
hold up a flashlight to his eye. it’s all dark pupil,
an entire night itself, whose haired horizon tightens
as he stares back, and closes up the eye. then from the lids
one tear, his only possession, like the bee’s sting, slips.
slyly he palms it, and if you’re not paying attention
he’ll swallow it. however, if you watch, he’ll hand it over,
cool as from underground springs and pure enough to drink.","se você o pegar,
aponte uma lanterna para o seu olho. é só pupila,
uma pequena noite, cujo horizonte estreito
se aperta quando ele olha, e fecha-se. então uma só lágrima,
seu único pertence, como o ferrão da abelha, brota.
discreto, ele a colhe e, se você se distrair,
engole. mas se você olhar, ele a entrega,
fresca como água de fonte, potável de tão pura.",en_XX,pt_XX,"se você pegá-lo,
segure uma lanterna em seu olho. é tudo pupila escura,
uma noite inteira em si, cujo horizonte cabeludo se estreita
enquanto ele olha de volta, e fecha o olho. então das pálpebras
uma lágrima, sua única posse, como a picada de uma abelha, escorrega.
astutamente ele a espalma, e se você não estiver prestando atenção
ele a engolirá. no entanto, se você observar, ele a entregará,
fresca como de fontes subterrâneas e pura o suficiente para beber.",2.0
"more slowly falling into sight
and showering into stippled faces,
darkening, condensing all his light;
in spite of all the dreaming
squandered upon him with that look,
suffers our uses and abuses,
sinks through the drift of bodies,
sinks through the drift of classes
to evening to the beggar in the park
who, weary, without lamp or book
prepares stupendous studies:
the fiery event
of every day in endless
endless assent.","mais lentamente, aparecem
os rostos sarapintados,
condensam sua luz, e a escurecem;
apesar de tantos sonhos
gastos nela em tal olhar,
atura nosso uso e abuso,
mergulha no fluxo de corpos,
mergulha no fluxo de classes
até chegar ao mendigo exausto
sem livro, sem luz, no lusco-fusco,
imerso em estupendos estudos:
este incandescente evento
de cada dia em constante
constante consentimento.",en_XX,pt_XX,"mais lentamente caindo à vista
e chovendo em rostos pontilhados,
escurecendo, condensando toda a sua luz;
apesar de todo o sonho
desperdiçado sobre ele com aquele olhar,
sofre nossos usos e abusos,
afunda através da deriva dos corpos,
afunda através da deriva das classes
até a noite para o mendigo no parque
que, cansado, sem lâmpada ou livro
prepara estudos estupendos:
o evento ardente
de cada dia em infinito
consentimento infinito.",2.0
"i need a virgin mirror
no one’s ever looked at,
that’s never looked back at anyone,
to flash up the spirits’ eyes
and help me recognize them.
the storekeeper offered me
a box of little mirrors,
but each time i picked one up
a neighbor looked over my shoulder
and then that one was spoiled —
spoiled, that is, for anything
but the girls to look at their mouths in,
to examine their teeth and smiles.","preciso de um espelho virgem
um que ninguém nunca olhou,
que nunca olhou pra ninguém,
pra olhar nos olhos dos espíritos
e reconhecer cada um.
na loja me deram uma caixa
cheia de espelhos novos,
mas cada um que eu pegava
alguém trás de mim se mirava
e pronto, estragava o espelho,
que agora só servia mesmo
pra moça ficar se olhando,
vendo os dentes e o sorriso.",en_XX,pt_XX,"preciso de um espelho virgem
que ninguém nunca olhou,
que nunca olhou de volta para ninguém,
para fazer brilhar os olhos dos espíritos
e me ajudar a reconhecê-los.
o lojista me ofereceu
uma caixa de pequenos espelhos,
mas cada vez que eu pegava um
um vizinho olhava por cima do meu ombro
e então aquele estava estragado —
estragado, isto é, para qualquer coisa
exceto as meninas para olhar suas bocas,
para examinar seus dentes e sorrisos.",2.0
"set ope all shutters, that the day come in
like a sea or a din!
let not a nook of useless shade compel
thoughts of the night, or tell
the mind's comparing that some things are sad,
for this day all are glad!
'tis morn, 'tis open morn, the full sun is
risen from out the abyss
where last night lay beyond the unseen rim
of the horizon dim.
now is the bride awaking. lo! she starts
to feel the day is home
whose too-near night will put two different hearts
to beat as near as flesh can let them come.
guess how she joys in her feared going, nor opes
her eyes for fear of fearing at her joy.
now is the pained arrival of all hopes.
with the half-thought she scarce knows how to toy.
oh, let her wait a moment or a day
and prepare for the fray
for which her thoughts not ever quite prepare!
with the real day's arrival she's half wroth.
though she wish what she wants, she yet doth stay.
her dreams yet merged are
in the slow verge of sleep, which idly doth
the accurate hope of things remotely mar.","abram-se as janelas e que entre o dia
como um mar de ruído!
nem reste um canto de vã sombra a compelir
pensares noturnos, ou contar
ao cotêjo da mente que há coisas tão tristes
neste dia de tanta alegria.
é manhã, manhã aberta, o pleno sol
ascendeu do abismo
onde à noite estêve além do inviso arco
do horizonte fôsco.
vai despertando a noiva. eis!
começa a sentir que entra o dia
cuja noite tão logo fará dois diferentes corações
bater tão perto quanto a carne o permitir.
pensai quanto se alegra no temido ir-se,
nem abre os olhos de medo de temer a alegria.
já é a vinda dorida de toda a esperança.
com tal pressentir ela nem sabe bem brincar.
oh, deixai que espere um instante, um dia
p'ra dispor-se a esta luta
à qual seu pensar nem sempre se dispôs!
vindo o dia realmente, está quase irada.
se ela anela o que quer, assim mesmo fica.
seus sonhos 'inda imersos são
na tarda margem do sono, que em vão
a precisa espera das coisas vagamente mancha.",en_XX,pt_XX,"abra todas as persianas, que o dia chegue
como um mar ou um barulho!
não deixe um recanto de sombra inútil obrigar
pensamentos da noite, ou dizer
à mente que compara que algumas coisas são tristes,
pois neste dia todos estão alegres!
é manhã, é manhã aberta, o sol pleno
nasceu do abismo
onde a noite passada jazia além da borda invisível
do horizonte escuro.
agora a noiva está acordando. veja! ela começa
a sentir que o dia está em casa
cuja noite muito próxima colocará dois corações diferentes
para bater tão perto quanto a carne pode deixá-los chegar.
adivinhe como ela se alegra em sua temida partida, nem abre
seus olhos por medo de temer sua alegria.
agora é a chegada dolorosa de todas as esperanças.
com o meio-pensamento que ela mal sabe como brincar.
oh, deixe-a esperar um momento ou um dia
e se preparar para a briga
para a qual seus pensamentos nunca se preparam!
com a chegada do dia real ela está meio furiosa.
embora ela deseje o que quer, ela ainda fica.
seus sonhos ainda fundidos estão
à beira lenta do sono, que preguiçosamente
a esperança precisa das coisas remotamente estraga.",2.0
"part from the windows the small curtains set
sight more than light to omit!
look on the general fields, how bright they lie
under the broad blue sky,
cloudless, and the beginning of the heat
does the sight half ill-treat!
the bride hath wakened. lo! she feels her shaking
heart better all her waking!
her breasts are with fear's coldness inward clutched
and more felt on her grown,
that will by hands other than hers be touched
and will find lips sucking their budded crown.","separai nas janelas as leves cortinas:
desvelam mais que a luz omitem!
olhai o extenso campo, quão brilhante jaz
sob o amplo céu azul
sem nuvens, e o começo do calor
já faz quase mal à vista!
a noiva está acordando. eis! pressente o palpitar
do coração enquanto acorda!
seus seios são por frio receio contraídos,
mais cientes de no seu desabrochar
que mãos outras que as dela os tocarão
e terão lábios sorvendo as flóreas pontas.",en_XX,pt_XX,"parte das janelas as pequenas cortinas fixam
a visão mais do que a luz para omitir!
olhe para os campos gerais, quão brilhantes eles estão
sob o amplo céu azul,
sem nuvens, e o começo do calor
faz a visão meio maltratar!
a noiva acordou. veja! ela sente seu coração tremendo
melhor durante todo o seu despertar!
seus seios estão com a frieza do medo para dentro agarrados
e mais sentidos em seu crescimento,
que serão tocados por outras mãos que não as dela
e encontrarão lábios sugando sua coroa brotada.",2.0
"lo! the thought of the bridegroom's hands already
feels her about where even her hands are shy,
and her thoughts shrink till they become unready
she gathers up her body and still doth lie.
she vaguely lets her eyes feel opening.
in a fringed mist each thing
looms, and the present day is truly clear
but to her sense of fear.
like a hue, light lies on her lidded sight,
and she half hates the inevitable light.","eis! já as maõs-imagens do noivo sente
tocar mesmo onde as dela se acanham,
e seu pensar se encolhe até a indistinção.
ela soergue o corpo, deita-se contudo.
vagamente deixa os olhos sentir-se abrindo.
em franjada névoa cada coisa
imerge, e o presente dia é mesmo claro
menos ao seu senso-receio.
qual matiz, luz lhe jaz sobre pálpebras,
e quase odeia a inevitável luz.",en_XX,pt_XX,"eis! o pensamento das mãos do noivo já
a sente onde até suas mãos são tímidas,
e seus pensamentos encolhem até ficarem despreparados
ela reúne seu corpo e ainda fica deitada.
ela vagamente deixa seus olhos se abrirem.
em uma névoa franjada cada coisa
assombra, e o dia presente é verdadeiramente claro
mas para seu senso de medo.
como uma tonalidade, a luz repousa sobre sua visão entreaberta,
e ela meio que odeia a luz inevitável.",2.0
"open the windows and the doors all wide
lest aught of night abide
or, like a ship's trail in the sea, survive
what made it there to live!
she lies in bed half waiting that her wish
grow bolder or more rich
to make her rise, or poorer, to oust fear,
and she rise as a common day were here.
that she would be a bride in bed with man
the parts where she is woman do insist
and send up messages that shame doth ban
from being dreamed but in a shapeless mist.","abram janelas e as portas de todo.
que nada da noite fique,
ou, qual rasto de barco no mar, resista
ao que a fez viver ali!
no leito fica, como à espera que o desejo
cresça mais, audaz e fértil
para erguê-la, ou tão tênue que expulse o medo,
e ela se erga como se comum fôsse o dia.
que se tornaria noiva na cama com homem
suas partes de mulher insistem
e mandam acima mensagens que o pudor proíbe
serem sonhadas salvo em vaga névoa.",en_XX,pt_XX,"abra as janelas e as portas bem abertas
para que nada da noite permaneça
ou, como o rastro de um navio no mar, sobreviva
o que chegou lá para viver!
ela fica deitada na cama meio esperando que seu desejo
fique mais ousado ou mais rico
para fazê-la se levantar, ou mais pobre, para expulsar o medo,
e ela se levante como um dia comum estivesse aqui.
que ela seria uma noiva na cama com um homem
as partes onde ela é mulher insistem
e enviam mensagens que a vergonha proíbe
de serem sonhadas, mas em uma névoa informe.",2.0
"now flushed and whispering loud sally ye out
to church! the sun pours on ordered rout,
and all their following eyes clasp round the bride:
they feel like hands her bosom and her side;
like the inside of vestments next her skin.
they round her round and fold each crevice in;
they lift her skirts up, as to tease or woo
the cleft hid thing below;
and this they think at her peeps in their ways
and in their glances plays.","já agitados, murmurando alto, ide logo
à igreja! verte-se o sol na ordenada turba,
e todos os olhos perseguem, envolvem a noiva:
apalpam qual mãos seus seios e flancos;
como o avesso das vestes rente à pele,
envolvem-na em volta e cada prega preenchem;
as saias levantam pra bulir ou tentar
a tal fenda oculta embaixo;
e este nela pensarem espreita em gestos deles
e brinca nos olhares.",en_XX,pt_XX,"agora coradas e sussurrando alto saiam
para a igreja! o sol se derrama em rota ordenada,
e todos os seus olhos seguintes se fecham em volta da noiva:
eles sentem como mãos seu peito e seu lado;
como o interior das vestes próximo à sua pele.
eles a rodeiam e dobram cada fenda;
eles levantam suas saias, como para provocar ou cortejar
a fenda escondida abaixo;
e isso eles pensam em suas espreitadelas em seus caminhos
e em seus olhares brinca.",2.0
"so are all things, that between this and dark
will be passed, a dim work
of minutes, hours seen in a sleep, and dreamed
untimed and wrongly deemed.
the bridal and the walk back and the feast
are all for each a mist
where he sees others through a blurred hot notion
of drunk and veined emotion,
and a red race runs through his seeing and hearing,
a great carouse of dreams seen each on each,
till their importunate careering
a stopped, half-hurting point of mad joy reach.","assim é tudo, que daqui ao ocaso
se dará, obra obscura
dos minutos, horas em sono vistas, e sonhadas
atemporais e despercebidas.
as bodas e o regresso e a festa
é tudo pra todos névoa
onde um vê os outros numa quente imagem vaga
de ébria emoção nas veias,
e rubra corrida transpassa seu ver e ouvir,
grande ebrifesta de sonhos um no outro vistos,
até que o intempestivo atropelo
num quasi dorido ponto de insana alegria estanca.",en_XX,pt_XX,"assim são todas as coisas, que entre isto e a escuridão
serão passadas, um trabalho obscuro
de minutos, horas vistas em um sono, e sonhadas
sem tempo e erroneamente consideradas.
o casamento e a caminhada de volta e a festa
são todas para cada uma névoa
onde ele vê os outros através de uma noção quente e turva
de emoção bêbada e cheia de veias,
e uma raça vermelha corre através de sua visão e audição,
uma grande farra de sonhos vistos cada um em cada um,
até que sua carreira importuna
um ponto parado, meio machucado de alegria louca alcance.",2.0
"rage out in naked glances till ye fright
your ague of delight,
in glances seeming clothes and thoughts to hate
that flesh separate!
stretch out your limbs to the warm day outside,
to feel it while it bide!
for the strong sun, the hot ground, the green grass,
each far lake's dazzling glass,
and each one's flushed thought of the night to be
are all one joy-hot unity.","raivai em relances nus até espantar
vossa febre de deleite,
relances como a odiar mentes e roupas
que separam corpos!
vossos membros estendei ao calor do dia fora
pra senti-lo enquanto dura!
pois sol intenso, quente terra, verde erva,
o fulgente reflexo de um lago ao longe,
e cada rubra imagem que fazeis da noite a vir,
tudo é uma quente-contente unidade.",en_XX,pt_XX,"enfurece-se em olhares nus até assustar
sua febre de prazer,
em olhares roupas e pensamentos que parecem odiar
essa carne separada!
estique seus membros para o dia quente lá fora,
para senti-lo enquanto ele espera!
pois o sol forte, o chão quente, a grama verde,
o vidro deslumbrante de cada lago distante,
e o pensamento corado de cada um sobre a noite que está por vir
são todos uma unidade de alegria quente.",2.0
"set the great flemish hour aflame!
your senses of all leisure maim!
cast down with blows that joy even where they hurt,
the hands that mock to avert!
all things pick up to bed that lead ye to
be naked that ye woo!","fazei a grande hora flamenga inflamar-se!
dos sentidos amputai todo o lazer!
caia a golpes essa alegria, mesmo quando eles ferem,
as mãos que fingem evitar!
juntai sobre a cama tudo que vos chama
à nudez que buscais!",en_XX,pt_XX,"incendeia a grande hora flamejante!
seus sentidos de todo o lazer mutilam!
derruba com golpes essa alegria mesmo onde machucam,
as mãos que zombam para evitar!
todas as coisas pegam para a cama que te levam a
estar nu que você corteja!",2.0
"ample make this bed.
make this bed with awe'
in it wait ti11 judgement break
excellent and fair.
be its ir.attress straight,
be its pillow round;
let no sunrise' yellow noise
interrupt this ground.","arruma a cama bem larga
arruma a cama com susto:
e nela espera o juízo
excelente e justo.
travesseiro redondo.
bem firme o colchão:
rumor louro de aurora
não perturbe este chão.",en_XX,pt_XX,"amplo faça esta cama.
faça esta cama com admiração
nela espere até que o julgamento se quebre
excelente e justo.
seja sua cama reta,
seja seu travesseiro redondo;
que nenhum ruído amarelo do nascer do sol
interrompa este chão.",2.0
"when we wake up brushed by panic in the dark
our pupils grope for the shape of things we know.
photons loosed from slits like greyhounds at the track
reveal light’s doubleness in their cast shadows
that stripe a dimmed lab’s wall—particles no more—
and with a wave bid all certainties goodbye.
for what’s sure in a universe that dopplers
away like a siren’s midnight cry? they say
a flash seen from on and off a hurtling train
will explain why time dilates like a perfect
afternoon; predicts black holes where parallel lines
will meet, whose stark horizon even starlight,
bent in its tracks, can’t resist. if we can think
this far, might not our eyes adjust to the dark?","quando acordamos tomados pelo pânico no escuro
nossas pupilas tateiam buscando a forma das coisas que conhecemos.
fótons desprendidos das frestas como galgos na pista
revelam a duplicidade da luz em suas sombras projetadas
que riscam um muro do laboratório escurecido – basta de partículas –
e com um aceno dão adeus a todas as certezas.
o que é certo em um universo que se
esvai como o canto da sereia à meia noite? dizem
um flash visto de dentro e de fora de um trem desgovernado
explicará por que o tempo se dilata como uma tarde
perfeita; adivinha buracos negros onde linhas paralelas
se encontrarão, cujo horizonte despido mesmo a luz das estrelas,
curvada em seus rastros, não é capaz de resistir. se chegamos
tão longe, não poderiam nossos olhos se ajustar ao escuro?",en_XX,pt_XX,"quando acordamos varridos pelo pânico no escuro
nossas pupilas tateiam em busca da forma das coisas que conhecemos.
fótons soltos de fendas como galgos na pista
revelam a duplicidade da luz em suas sombras projetadas
que riscam a parede de um laboratório escuro — partículas não mais —
e com uma onda dizem adeus a todas as certezas.
pois o que é certo em um universo que se dopple
dissipa como o grito de meia-noite de uma sereia? eles dizem
um flash visto de dentro e de fora de um trem em disparada
explicará por que o tempo se dilata como uma perfeita
tarde; prevê buracos negros onde linhas paralelas
se encontrarão, cujo horizonte árido nem mesmo a luz das estrelas,
curvada em seus trilhos, pode resistir. se podemos pensar
tão longe, nossos olhos não se ajustariam à escuridão?",2.0
