original_poem,translated_poem,src_lang,tgt_lang,translated_by_TA,topic
"je lui ai proposé mieux …
de devenir un ami.
lui, très gentil,
plutôt … intelligent,
devient alors, comme il dit :
» mon pote « .
dans ce contexte, finalement,
je l’ai trouvé à mon côté,
dans mon lit …
pour découvrir ensuite,
un océan de souffrance,
une citerne de tendresse,
un petit vase rustique,
et une mer de sagesse.
si seulement les circonstances étaient plus simples,
je naviguerais dans cet océan,
et je purifierais tout le mal là incrusté.
si seulement mon âme n’était pas voilée,
je plongerais dans cette citerne,
pour faire fusionner ses tendresses aux miennes.
si seulement le courage me faisait surface,
je prendrais ce vase pour le modeler,
et y faire jaillir de la sérénité.
si seulement la frontière était plus proche,
je nagerais dans cette mer et m’y accosterais,
pour sentir … ma vie.","eu lhe propus melhor …
de vir a ser meu amigo.
ele, muito gentil,
digamos … inteligente,
se torna entao, como ele diz :
» meu camarada « .
neste contexto, finalmente,
eu o encontrei ao meu lado,
no meu leito …
para descobrir em seguida,
um oceano de sofrimento,
uma cisterna de ternura,
um vazinho rústico,
e um mar de juizo.
se pelo menos, as circunstancias fossem mais simples,
eu navegaria neste oceano,
e purificaria todo o mal ali incrustado.
se pelo menos, minha alma nao tivesse esse véu,
eu mergulharia nesta cisterna,
para fazer fusionar suas ternuras às minhas.
se pelo menos a coragem me viesse à tona,
eu pegaria este vazo para molda-lo
e faria jorrar dele a serenidade.
se pelo menos, a fronteira estivesse mais perto,
eu nadaria neste mar e me acostaria ali,
para sentir … minha vida.",fr_XX,pt_XX,"Eu lhe propus mais...
de se tornar um amigo.
ele, muito gentil,
antes de tudo... inteligente,
então se torna, como diz:
""meu parceiro"".
neste contexto, afinal,
o encontrei ao meu lado,
na minha cama...
para descobrir em seguida,
um oceano de sofrimento,
uma cisterna de ternura,
um pequeno vaso rústico,
e um mar de sabedoria.
se as circunstâncias fossem mais simples,
navegaria nesse oceano,
e purificaria todo mal ali incrustado.
se minha alma não estivesse velada,
mergulharia nesta cisterna,
para fundir suas ternuras às minhas.
se o coragem me fizesse à superfície,
tomaria esse vaso para moldá-lo,
e fazer jorrar serenidade.
se a fronteira fosse mais próxima,
nadaria nesse mar e a ele me acostaria,
para sentir... minha vida.",3
"la sottise, l’erreur, le péché, la lésine,
occupent nos esprits et travaillent nos corps,
et nous alimentons nos aimables remords,
comme les mendiants nourrissent leur vermine.
nos péchés sont têtus, nos repentirs sont lâches;
nous nous faisons payer grassement nos aveux,
et nous rentrons gaiement dans le chemin bourbeux,
croyant par de vils laver toutes nos taches.
sur l’oreiller du mal c’est satan trismégiste
qui berce longuement notre esprit enchanté,
et le riche métal de notre volonté
est tout vaporisé par ce savant chimiste.
c’est le diable qui tient les fils qui nous remuent!
aux objets répugnants nous trouvons des appas;
chaque jour vers l’enfer nous descendons d’un pas,
sans horreurs, à travers des ténèbres qui puent.
ainsi qu’un débauché pauvre qui baise et mange
le sein martyrisé d’une antique catin,
nous volons au passage un plaisir clandestin
que nous pressons bien fort comme une vieille orange.","a tolice, o pecado, o logro, a mesquinhez
habitam nosso espiríto e o corpo viciam,
e adoráveis remorsos sempre nos saciam,
como o mendigo exibe a sua sordidez.
fiéis ao pecado, a contrição nos amordaça;
impomos alto preço à infâmia confessada,
e alegres retornamos à lodosa estrada,
na ilusão de que o pranto as nódoas nos desfaça.
na almofada do mal é satã trismegisto
quem docemente nosso espírito consola,
e o metal puro da vontade então se evola
por obra deste sábio que age sem ser visto.
é o diabo que nos move e até nos manuseia!
em tudo o que repugna uma joia encontramos;
dia após dia, para o inferno caminhamos,
sem medo algum, dentro da treva que nauseia.
assim como um voraz devasso beija e suga
o seio murcho que lhe oferta uma vadia,
furtamos ao acaso uma carícia esguia
para espremê-la qual laranja que se enruga.",fr_XX,pt_XX,"A tolice, o erro, o pecado, a mesquinhez,
habitam nossos espíritos e consomem nossos corpos,
e nutrimos nossos amáveis remorsos,
como mendigos alimentam sua praga.
Nossos pecados são teimosos, nosso arrependimento é fraco;
Pagamos caro por nossos confissos,
e retornamos alegremente ao caminho lodoso,
crendo que com vis lavamos todas as nódoas.
Sobre o travesseiro do mal, é satã trismegisto
que embala longamente nosso espírito encantado,
e o rico metal de nossa vontade
está todo vaporizado por esse sábio alquimista.
É o diabo que segura as rédeas que nos movem!
Nos objetos repugnantes encontramos encantos;
Cada passo rumo ao inferno descemos,
Sem horrores, através de trevas fétidas.
Assim como um devasso pobre que beija e come
O seio martirizado de uma velha cortesã,
Roubamos um prazer clandestino
Que apertamos bem forte como uma velha laranja.",3
"tu mettrais l’univers entier dans ta ruelle,
femme impure! le’ennui rend ton âme cruelle.
pour exercer tes dents à ce jeu singulier,
il te faut chaque jour un cœur au râtelier.
tes yeux, illuminés ainsi que des boutiques
et des ifs flamboyants dans les fêtes publiques,
usent insolemment d’un pouvoir emprunté,
sans connaître jamais la loi de leur beauté.
machine aveugle et sourde, en cruautés, féconde!
salutaire instrument, buveur du sang du monde,
comment n’as-tu pas honte et comment n’as-tu pas
devant tous les miroirs vu pâlir tes appas?
la grandeur de ce mal où tu te crois savante
ne t’a donc jamais fait reculer d’épouvante,
quand la nature, grande en ses desseins cachés,
de toi se sert, ô femme, ô reine des péchés,
— de toi, vil animal, — pour pétrir un génie?
o fangeuse grandeur! sublime ignominie!","porias o universo inteiro em teu bordel,
mulher impura! o tédio é que te torna cruel
para teus dentes neste jogo exercitar,
a cada dia um coração tens que sangrar.
teus olhos, cuja luz recorda a dos lampejos
e dos rútilos teixos que ardem nos festejos,
exibem arrogantes uma vã nobreza,
sem conhecer jamais a lei de sua beleza.
ó monstro cego e surdo, em cruezas fecundo!
salutar instrumento, vampiro do mundo,
como não te envergonhas ou não vês sequer
murchar no espelho teu fascínio de mulher?
a grandeza do mal de que crês saber tanto
não te obriga jamais a vacilar de espanto
quando a mãe natureza, em desígnios velados,
recorre a ti, mulher, ó deusa dos pecados
— a ti, vil animal —, para um gênio forjar?
ó lodosa grandeza! ó desonra exemplar!",fr_XX,pt_XX,"Você colocará o universo inteiro na sua viela,
mulher impura! O tédio torna tua alma cruel.
Para exercitar teus dentes nesse jogo singular,
te é necessário cada dia um coração ao arreio.
Teus olhos, iluminados tal qual lojas
e teixos flamejantes nas festas públicas,
usurpam insolentemente um poder emprestado,
sem jamais conhecer a lei de sua beleza.
Máquina cega e surda, em crueldades, fecunda!
Instrumento salutar, bebedor do sangue do mundo,
como não tens vergonha e como não tens
diante de todos os espelhos visto empalidecer teus dotes?
A grandeza desse mal onde te julgas sábia
nunca te fez recuar de espanto,
quando a natureza, grande em seus desígnios ocultos,
de ti se serve, ó mulher, ó rainha dos pecados,
— de ti, vil animal, — para moldar um gênio?
Oh, grandeza lamacenta! Sublime ignomínia!",3
"quelle est la fin de tout? la vie, ou bien la tombe?
est-ce l’onde où l’on flotte ? est-ce l’ombre où l’on tombe?
de tant de pas croisés quel est le but lointain?
le berceau contient-il l’homme ou bien le destin?
sommes-nous ici-bas, dans nos maux, dans nos joies,
des rois prédestinés ou de fatales proies?
ô seigneur, dites-nous, dites-nous, ô dieu fort,
si vous n’avez créé l’homme que pour le sort?
si déjà le calvaire est caché dans la crèche?
et si les nids soyeux, dorés par l’aube fraîche,
où la plume naissante éclôt parmi des fleurs,
sont faits pour les oiseaux ou pour les oiseleurs?","qual é o fim de tudo? a vida ou a tumba?
a onda que nos sustém? ou a que nos afunda?
qual a longínqua meta de tanto passo cruzado?
é o berço que embala o homem ou é o seu fado?
seremos aqui na terra, nas alegrias, nos ais,
reis predestinados ou simples presas fatais?
ó senhor, responde, responde-nos, ó deus forte,
se condenaste o homem apenas à sua sorte,
se já no presépio o calvário se anuncia
e se os ninhos sedosos, dourados pela manhã fria,
onde as crias vêm ao mundo por entre flores,
são feitos para as aves ou para predadores.",fr_XX,pt_XX,"qual é o fim de tudo? a vida, ou a tumba?
será o leito onde flutuamos? será a sombra onde tombamos?
de tantos passos cruzados, qual é o destino distante?
o berço contém o homem ou o destino?
estamos aqui embaixo, em nossas dores, em nossas alegrias,
reis predestinados ou presas fatais?
ó senhor, dizei-nos, dizei-nos, ó deus forte,
se criastes o homem só para o destino incerto?
se o calvário já está oculto no presépio?
e se os ninhos sedosos, dourados pela aurora fresca,
onde a pluma nascente desabrocha entre flores,
são feitos para os pássaros ou para os caçadores?",3
"quelle est la fin de tout? la vie, ou bien la tombe?
est-ce l’onde où l’on flotte ? est-ce l’ombre où l’on tombe?
de tant de pas croisés quel est le but lointain?
le berceau contient-il l’homme ou bien le destin?
sommes-nous ici-bas, dans nos maux, dans nos joies,
des rois prédestinés ou de fatales proies?
ô seigneur, dites-nous, dites-nous, ô dieu fort,
si vous n’avez créé l’homme que pour le sort?
si déjà le calvaire est caché dans la crèche?
et si les nids soyeux, dorés par l’aube fraîche,
où la plume naissante éclôt parmi des fleurs,
sont faits pour les oiseaux ou pour les oiseleurs?","qual é o fim de tudo? a vida ou a tumba?
a onda que nos sustém? ou a que nos afunda?
qual a longínqua meta de tanto passo cruzado?
é o berço que embala o homem ou é o seu fado?
seremos aqui na terra, nas alegrias, nos ais,
reis predestinados ou simples presas fatais?
ó senhor, responde, responde-nos, ó deus forte,
se condenaste o homem apenas à sua sorte,
se já no presépio o calvário se anuncia
e se os ninhos sedosos, dourados pela manhã fria,
onde as crias vêm ao mundo por entre flores,
são feitos para as aves ou para predadores.",fr_XX,pt_XX,"qual é o fim de tudo? a vida, ou a tumba?
será o leito onde flutuamos? será a sombra onde tombamos?
de tantos passos cruzados, qual é o destino distante?
o berço contém o homem ou o destino?
estamos aqui embaixo, em nossas dores, em nossas alegrias,
reis predestinados ou presas fatais?
ó senhor, dizei-nos, dizei-nos, ó deus forte,
se criastes o homem só para o destino incerto?
se o calvário já está oculto no presépio?
e se os ninhos sedosos, dourados pela aurora fresca,
onde a pluma nascente desabrocha entre flores,
são feitos para os pássaros ou para os caçadores?",3
"les litanies de satan
ô toi, le plus savant et le plus beau des anges,
dieu trahi par le sort et privé de louanges,
ô satan, prends pitié de ma longue misère!
ô prince de l’exil, à qui l’on a fait tort
et qui, vaincu, toujours te redresses plus fort,
ô satan, prends pitié de ma longue misère!
toi qui sais tout, grand roi des choses souterraines,
guérisseur familier des angoisses humaines,
ô satan, prends pitié de ma longue misère!
toi qui, même aux lépreux, aux parias maudits,
enseignes par l’amour le goût du paradis,
ô satan, prends pitié de ma longue misère!
ô toi qui de la mort, ta vieille et forte amante,
engendras l’espérance, — une folle charmante!
ô satan, prends pitié de ma longue misère!
toi qui fais au proscrit ce regard calme et haut
qui damne tout un peuple autour d’un échafaud.
ô satan, prends pitié de ma longue misère!
toi qui sais en quels coins des terres envieuses
le dieu jaloux cacha les pierres précieuses,
ô satan, prends pitié de ma longue misère!
toi dont l’oeil clair connaît les profonds arsenaux
où dort enseveli le peuple des métaux,
ô satan, prends pitié de ma longue misère!
toi dont la large main cache les précipices
au somnambule errant au bord des édifices,
ô satan, prends pitié de ma longue misère!
toi qui, magiquement, assouplis les vieux os
de l’ivrogne attardé foulé par les chevaux,
ô satan, prends pitié de ma longue misère!
toi qui, pour consoler l’homme frêle qui souffre,
nous appris à mêler le salpêtre et le soufre,
ô satan, prends pitié de ma longue misère!
toi qui poses ta marque, ô complice subtil,
sur le front du crésus impitoyable et vil,
ô satan, prends pitié de ma longue misère!
toi qui mets dans les yeux et dans le coeur des filles
le culte de la plaie et l’amour des guenilles,
ô satan, prends pitié de ma longue misère!
bâton des exilés, lampe des inventeurs,
confesseur des pendus et des conspirateurs,
ô satan, prends pitié de ma longue misère!
père adoptif de ceux qu’en sa noire colère
du paradis terrestre a chassés dieu le père,
ô satan, prends pitié de ma longue misère!","as litânias de satã
ó tu, o anjo mais belo e também o mais culto,
deus que a sorte traiu e privou do seu culto,
tem piedade, ó satã, desta longa miséria!
ó príncipe do exílio a quem alguém fez mal,
e que, vencido, sempre te ergues mais brutal,
tem piedade, ó satã, desta longa miséria!
tu que vês tudo, ó rei das coisas subterrâneas,
charlatão familiar das humanas insânias,
tem piedade, ó satã, desta longa miséria!
tu que, mesmo ao leproso, ao pária infame, ao réu
ensinas pelo amor as delícias do céu,
tem piedade, ó satã, desta longa miséria!
tu que da morte, tua velha e forte amante,
engendraste a esperança – a louca fascinante!
tem piedade, ó satã, desta longa miséria!
tu que dás ao proscrito esse alto e calmo olhar
que faz ao pé da forca o povo desvairar,
tem piedade, ó satã, desta longa miséria!
tu que sabes onde é que em terras invejosas
o deus ciumento esconde as pedras preciosas,
tem piedade, ó satã, desta longa miséria!
tu cujo claro olhar conhece os arsenais
onde dorme sepulto o povo dos metais,
tem piedade, ó satã, desta longa miséria!
tu cuja larga mão oculta os precipícios
ao sonâmbulo a errar na orla dos edifícios,
tem piedade, ó satã, desta longa miséria!
tu que, magicamente, abrandas como mel
os velhos ossos do ébrio moído num tropel,
tem piedade, ó satã, desta longa miséria!
tu que ao homem que é fraco e sofre deste o alvitre
de poder misturar ao enxofre o salitre,
tem piedade, ó satã, desta longa miséria!
tu que pões tua marca, ó cúmplice sutil,
sobre a fronte do creso implacável e vil,
tem piedade, ó satã, desta longa miséria!
tu que, abrindo a alma e o olhar das raparigas, a ambos
dás o culto da chaga e o amor pelos molambos,
tem piedade, ó satã, desta longa miséria!
do exilado bordão, lanterna do inventor,
confessor do enforcado e do conspirador,
tem piedade, ó satã, desta longa miséria!
pai adotivo que és dos que, furioso, o mestre,
o deus padre, expulsou do paraíso terrestre,
tem piedade, ó satã, desta longa miséria!",fr_XX,pt_XX,"As litânicas de satã

Ó tu, anjo mais belo e também o mais culto,
Deus que a sorte traiu e do culto foi privado,
Tem piedade, ó satã, desta longa miséria!
Ó príncipe do exílio a quem alguém fez mal,
E que, vencido, sempre te ergues mais brutal,
Tem piedade, ó satã, desta longa miséria!

Tu que vês tudo, ó rei das coisas subterrâneas,
Charlatão das insânias humanas, familiar,
Tem piedade, ó satã, desta longa miséria!
Tu que, mesmo ao leproso, ao pária infame, ao réu,
Ensinas pelo amor as delícias do céu,
Tem piedade, ó satã, desta longa miséria!

Tu que da morte, tua velha e forte amante,
Engendraste a esperança – a louca fascinante!
Tem piedade, ó satã, desta longa miséria!
Tu que dás ao proscrito esse alto e calmo olhar
Que faz ao pé da forca o povo desvairar,
Tem piedade, ó satã, desta longa miséria!

Tu que sabes onde é que em terras invejosas
O deus ciumento esconde as pedras preciosas,
Tem piedade, ó satã, desta longa miséria!
Tu cujo claro olhar conhece os arsenais
Onde dorme sepulto o povo dos metais,
Tem piedade, ó satã, desta longa miséria!

Tu cuja larga mão oculta os precipícios
Ao sonâmbulo a errar na orla dos edifícios,
Tem piedade, ó satã, desta longa miséria!
Tu que, magicamente, abrandas como mel
Os velhos ossos do ébrio moído num tropel,
Tem piedade, ó satã, desta longa miséria!

Tu que ao homem que é fraco e sofre deste o alvitre
De poder misturar ao enxofre o salitre,
Tem piedade, ó satã, desta longa miséria!
Tu que pões tua marca, ó cúmplice sutil,
Sobre a fronte do creso implacável e vil,
Tem piedade, ó satã, desta longa miséria!

Tu que, abrindo a alma e o olhar das raparigas, a ambos
Dás o culto da chaga e o amor pelos molambos,
Tem piedade, ó satã, desta longa miséria!
Do exilado bordão, lanterna do inventor,
Confessor do enforcado e do conspirador,
Tem piedade, ó satã, desta longa miséria!

Pai adotivo que és dos que, furioso, o mestre,
O deus padre, expulsou do paraíso terrestre,
Tem piedade, ó satã, desta longa miséria!",3
"adieu la cour, adieu les dames,
adieu les filles et les femmes,
adieu vous dis pour quelques temps,
adieu vos plaisants passetemps;
adieu le bal, adieu la danse,
adieu mesure, adieu cadence,
tambourin, haubois et violons,
puisqu’à la guerre nous allons.
adieu les regards gracieux,
messagers des coeurs soucieux ;
adieu les profondes pensées,
satisfaites ou offensées ;
adieu les harmonieux sons
de rondeaux, dizains et chansons ;
adieu piteux département,
adieu regrets, adieu tourment,
adieu la lettre, adieu le page,
adieu la cour et l’équipage,
adieu l’amitié si loyale,
qu’on la pourrait dire royale,
etant gardée en ferme foi
par ferme coeur digne de roi.
adieu ma mie la dernière,
en vertus et beauté première ;
je vous prie me rendre à présent
le coeur dont je vous fis présent,
pour, en la guerre où il faut être,
en faire service à mon maître.
or quand de vous se souviendra,
l’aiguillon d’honneur l’époindra
aux armes et vertueux faits :
et s’il en sortait quelque effet
digne d’une louange entière,
vous en seriez seule héritière.
de votre coeur donc se souvienne,
car si dieu veut que je revienne,
je le rendrai en ce beau lieu.
or je fais fin à mon adieu.","adeus à corte, adeus às damas,
adeus meninas e senhoras,
adeus vos digo por uns tempos,
adeus suaves passatempos,
adeus ao baile, adeus à dança,
adeus compasso, adeus festança,
violas, bombos e guitarra,
pois que partimos para a guerra.
adeus olhares graciosos,
vozes dos corações ciosos;
adeus pensamentos perfeitos,
despeitados ou satisfeitos;
adeus harmonias fiéis
de canções, odes e rondéis;
adeus tristonho apartamento,
adeus saudades e tormento,
adeus ao mordomo e à letra,
adeus à corte, à etiqueta,
adeus amizade leal,
tanto quanto foras real,
guardada em fé digna de lei
por coração digno de rei.
adeus amiga destes dias,
primeira em beleza e valias;
peço-lhe que devolva aqui
o coração que lhe ofereci,
assim, na guerra onde estarei,
o meu senhor eu servirei.
quando de vós se recordar,
a honra o fará desviar
para as armas e os altos feitos:
se dele surtissem efeitos
dignos de aprovação inteira,
seríeis única herdeira,
lembrai pois vosso coração,
que pousarei na vossa mão
se então voltar querendo deus.
assim termino o meu adeus.",fr_XX,pt_XX,"Adeus à corte, adeus às damas,
Adeus meninas e senhoras,
Adeus vos digo por uns tempos,
Adeus suaves passatempos,
Adeus ao baile, adeus à dança,
Adeus compasso, adeus festança,
Violas, bombos e guitarra,
Pois partimos para a guerra.

Adeus olhares graciosos,
Vozes dos corações ciosos;
Adeus pensamentos perfeitos,
Despeitados ou satisfeitos;
Adeus harmonias fiéis
De canções, odes e rondéis;
Adeus tristonho apartamento,
Adeus saudades e tormento,
Adeus ao mordomo e à letra,
Adeus à corte, à etiqueta,
Adeus amizade leal,
Tanto quanto foste real,
Guardada em fé digna de lei
Por coração digno de rei.

Adeus amiga destes dias,
Primeira em beleza e valias;
Peço-te que devolvas aqui
O coração que te ofereci,
Assim, na guerra onde estarei,
O meu senhor eu servirei.
Quando de ti te recordares,
A honra te fará desviar
Para as armas e os altos feitos:
Se delas surtirem efeitos
Dignos de aprovação inteira,
Serás única herdeira,
Lembra pois teu coração,
Que porei na tua mão
Se então voltar querendo Deus.
Assim termino o meu adeus.",3
"sans trop d’ardeur à la fois enflammant
la rose qui cruelle ou déchirée et lasse
même du blanc habit de pourpre le délace
pour ouïr dans sa chair pleurer le diamant
oui sans ces crises de rosée et gentiment
ni brise quoique, avec, le ciel orageux passe
jalouse d’apporter je ne sais quel espace
au simple jour le jour très vrai du sentiment
ne te semble-t-il pas, mary, que chaque année
dont sur ton front renaît la grâce spontanée
suffise selon quelque apparence et pour moi
comme un éventail frais dans la chambre s’étonne
à raviver du peu qu’il faut ici d’émoi
toute notre native amitié monotone.","sem tanto ardor embora ainda flamante
a rosa que cruel ou lacerada e lassa
se deveste do alvor que a púpura deslaça
para em sua carne ouvir o choro do diamante
sim sem crises de orvalho antes em doce alento
nem brisa o fragor do céu leve ao fracasso
com ciúme de criar não sei bem qual espaço
no simples dia o dia real do sentimento,
não te ocorre, talvez, que a cada ano que passa
quando em tua fronte se alça o encanto ressurreto
basta-me um dom qualquer natural de tua graça
como na alcova o cintilar de um leque inquieto
a reviver do pouco de emoção que grassa
todo o nosso nativo e monótono afeto.",fr_XX,pt_XX,"Sem demasiada ardência, a chama se acende
Na rosa que, cruel ou despedaçada e cansada,
Até o branco hábito de púrpura despoja,
Para ouvir na sua carne o diamante a chorar.
Sim, sem essas crises de orvalho e gentilmente,
Nem brisa, embora, com ela, o céu tempestuoso passe,
Ciumenta de oferecer não sei que espaço,
Ao simples dia, o dia verdadeiro do sentimento.
Não te parece, Mary, que cada ano
Cuja graça espontânea em tua fronte renasce,
Baste, segundo alguma aparência e para mim,
Como um leque fresco na alcova se espanta
Para reavivar o pouco de emoção aqui necessário,
Toda a nossa nativa amizade monótona?",3
"tu ris. — bien! — fais de l’amertume,
prends le pli, méphisto blagueur.
de l’absinthe! et ta lèvre écume…
dis que cela vient de ton cœur.
fais de toi ton œuvre posthume,
châtre l’amour… l’amour — longueur!
ton poumon cicatrisé hume
des miasmes de gloire, ô vainqueur!
assez, n’est-ce pas? va-t’en!
laisse
ta bourse — dernière maîtresse —
ton revolver — dernier ami…
drôle de pistolet fini!
… ou reste, et bois ton fond de vie,
sur une nappe desservie…","tu ris. – pois ri! – te acostuma
ao fel, mefisto gozador.
absinto! e teu lábio escuma…
diz que vem do peito esta dor.
faz de ti tua obra póstuma.
castra o amor… o amor – torpor!
a glória em miasmas se avoluma
em teu mau pulmão, ó vencedor!
basta. agora vai!
deixa antes
tua bolsa – última amante –
e a arma – último camarada…
essa pistola enferrujada!
… ou bebe teu resto de vida
sobre a toalha desservida…",fr_XX,pt_XX,"Você ri. — Ótimo! — De amargor te revestes,
toma o feitio, Mefisto gracejador.
De absinto! E tua boca espumeja...
Dize que isso vem do teu coração.
Faze de ti tua obra póstuma,
castra o amor... o amor — longa duração!
Teu pulmão cicatrizado aspira
miasmas de glória, ó vencedor!
Basta, não é? Vai-te embora!
deixa
tua bolsa — última amante —
teu revólver — último amigo...
Que pistola estranha, finda!
... ou fica, e bebe o resto da vida,
sobre uma toalha já retirada...",3
