original_poem,translated_poem,src_lang,tgt_lang,translated_by_TA,topic
"je meurs de seuf auprès de la fontaine,
chaud comme feu, et tremble dent à dent;
en mon pays suis en terre lointaine;
lez un brasier frissonne tout ardent;
nu comme un ver, vêtu en président,
je ris en pleurs et attends sans espoir;
confort reprends en triste désespoir;
je m’éjouis et n’ai plaisir aucun;
puissant je suis sans force et sans pouvoir,
bien recueilli, débouté de chacun.
rien ne m’est sûr que la chose incertaine;
obscur, fors ce qui est tout évident;
doute ne fais, fors en chose certaine;
science tiens à soudain accident;
je gagne tout et demeure perdant;
au point du jour dis: “dieu vous doint bon soir!”
gisant envers, j’ai grand paour de choir ;
j’ai bien de quoi et si n’en ai pas un;
echoite attends et d’homme ne suis hoir,
bien recueilli, débouté de chacun.
de rien n’ai soin, si mets toute ma peine
d’acquérir biens et n’y suis prétendant;
qui mieux me dit, c’est cil qui plus m’ataine,
et qui plus vrai, lors plus me va bourdant;
mon ami est, qui me fait entendant
d’un cygne blanc que c’est un corbeau noir;
et qui me nuit, crois qu’il m’aide à pourvoir;
bourde, verté, aujourd’hui m’est tout un;
je retiens tout, rien ne sait concevoir,
bien recueilli, débouté de chacun.
prince clément, or vous plaise savoir
que j’entends mout et n’ai sens ne savoir:
partial suis, à toutes lois commun.
que sais-je plus ? quoi? les gages ravoir,
bien recueilli, débouté de chacun.","morro de sede quase ao pé da fonte,
quente qual fogo, mas batendo os dentes;
em meu país vivo além do horizonte;
junto a um braseiro tremo e fico ardente;
nu como um verme. o traje: um presidente;
rio no pranto e espero sem esperança;
conforto acho na desesperança,
e alegro-me sem ter prazer algum;
tenho o poder sem força ou segurança;
e sou bem vindo a todos e a nenhum.
só me é certo algo com que eu não conte;
nada é obscuro, exceto o que é evidente;
e sem dúvidas, fora as que defronte,
tomo a ciência por mero acidente;
conquisto tudo e fico dependente
digo “boa noite” se a aurora avança;
deito-me sem controle em confiança;
tenho alguns bens, mas sem vintém algum;
sou um herdeiro mas serm ter herança,
e sou bem-vindo a todos e a nenhum
descuido-me de tudo e suo a fronte
para ter bens, sem ter um pretendente;
com quem mais me afague, me confronte,
quem mais me é veraz é quem mais mente;
é meu amigo que diz procedente
de um cisne alvo e um corvo a semelhança;
em quem me nega enxergo uma aliança;
a patranha e a verdade acho comum;
recordo tudo sem a menor lembrança
e sou bem-vindo a todos e a nenhum.
príncipe brando: se isso não vos cansa,
de tudo eu sei, e a mente não alcança;
sou faccioso e sigo a lei comum.
que faço? o quê? dos meus bens a cobrança,
e sou bem-vindo a todos e a nenhum.",fr_XX,pt_XX,"Morro de sede quase ao pé da fonte,
Quente como fogo, mas tremo de frio;
No meu país vivo além da visão,
Junto a um braseiro, fico em fogo e gelo;
Nu como um verme, o manto é um desvio,
Rio no pranto e espero sem ter sonho;
Conforto acho na desesperança,
E alegro-me sem ter prazer algum;
Tenho o poder sem força ou garantia;
E sou bem-vindo a todos e a nenhum.

Nada é certo, exceto o que não prevejo;
Nada é obscuro, exceto o que é evidente;
E sem dúvidas, salvo as que me acenam,
Tomo a ciência por mero acaso;
Conquisto tudo e fico dependente,
Digo ""boa noite"" se a aurora avança;
Deito-me sem controle em confiança,
Tenho alguns bens, mas sem vintém algum;
Sou um herdeiro mas sem ter herança,
E sou bem-vindo a todos e a nenhum.

Desprezo tudo e suor na fronte,
Para ter bens, sem ter um pretendente;
Quem mais me afaga, mais me enfrenta,
Quem mais mente, parece ser leal;
É meu amigo que compara um cisne alvo
A um corvo negro em estranha semelhança;
Em quem me nega vejo uma aliança,
A mentira e a verdade acho comum;
Recordo tudo sem a menor lembrança,
E sou bem-vindo a todos e a nenhum.

Príncipe brando, se isso não vos cansa,
De tudo eu sei, e a mente não alcança;
Sou faccioso e sigo a lei comum.
Que faço? O quê? Dos meus bens a cobrança,
E sou bem-vindo a todos e a nenhum.",3
"quelle est la fin de tout? la vie, ou bien la tombe?
est-ce l’onde où l’on flotte ? est-ce l’ombre où l’on tombe?
de tant de pas croisés quel est le but lointain?
le berceau contient-il l’homme ou bien le destin?
sommes-nous ici-bas, dans nos maux, dans nos joies,
des rois prédestinés ou de fatales proies?
ô seigneur, dites-nous, dites-nous, ô dieu fort,
si vous n’avez créé l’homme que pour le sort?
si déjà le calvaire est caché dans la crèche?
et si les nids soyeux, dorés par l’aube fraîche,
où la plume naissante éclôt parmi des fleurs,
sont faits pour les oiseaux ou pour les oiseleurs?","qual é o fim de tudo? a vida ou a tumba?
a onda que nos sustém? ou a que nos afunda?
qual a longínqua meta de tanto passo cruzado?
é o berço que embala o homem ou é o seu fado?
seremos aqui na terra, nas alegrias, nos ais,
reis predestinados ou simples presas fatais?
ó senhor, responde, responde-nos, ó deus forte,
se condenaste o homem apenas à sua sorte,
se já no presépio o calvário se anuncia
e se os ninhos sedosos, dourados pela manhã fria,
onde as crias vêm ao mundo por entre flores,
são feitos para as aves ou para predadores.",fr_XX,pt_XX,"Qual é o fim de tudo? A vida ou a tumba?
Será o flutuar nas ondas? Será a sombra que cai?
De tantos passos cruzados, qual o destino distante?
O berço contém o homem ou o destino?
Estamos aqui embaixo, nas dores, nas alegrias,
Reis predestinados ou presas fatais?
Ó senhor, dize-nos, dize-nos, ó Deus forte,
Se criaste o homem apenas para o sofrimento?
Se já o calvário está oculto no presépio?
E se os ninhos sedosos, dourados pela alvorada fresca,
Onde a pena nascente desabrocha entre flores,
São feitos para os pássaros ou para os caçadores?",3
"quelle est la fin de tout? la vie, ou bien la tombe?
est-ce l’onde où l’on flotte ? est-ce l’ombre où l’on tombe?
de tant de pas croisés quel est le but lointain?
le berceau contient-il l’homme ou bien le destin?
sommes-nous ici-bas, dans nos maux, dans nos joies,
des rois prédestinés ou de fatales proies?
ô seigneur, dites-nous, dites-nous, ô dieu fort,
si vous n’avez créé l’homme que pour le sort?
si déjà le calvaire est caché dans la crèche?
et si les nids soyeux, dorés par l’aube fraîche,
où la plume naissante éclôt parmi des fleurs,
sont faits pour les oiseaux ou pour les oiseleurs?","qual é o fim de tudo? a vida ou a tumba?
a onda que nos sustém? ou a que nos afunda?
qual a longínqua meta de tanto passo cruzado?
é o berço que embala o homem ou é o seu fado?
seremos aqui na terra, nas alegrias, nos ais,
reis predestinados ou simples presas fatais?
ó senhor, responde, responde-nos, ó deus forte,
se condenaste o homem apenas à sua sorte,
se já no presépio o calvário se anuncia
e se os ninhos sedosos, dourados pela manhã fria,
onde as crias vêm ao mundo por entre flores,
são feitos para as aves ou para predadores.",fr_XX,pt_XX,"Qual é o fim de tudo? A vida ou a tumba?
Será o flutuar nas ondas? Será a sombra que cai?
De tantos passos cruzados, qual o destino distante?
O berço contém o homem ou o destino?
Estamos aqui embaixo, nas dores, nas alegrias,
Reis predestinados ou presas fatais?
Ó senhor, dize-nos, dize-nos, ó Deus forte,
Se criaste o homem apenas para o sofrimento?
Se já o calvário está oculto no presépio?
E se os ninhos sedosos, dourados pela alvorada fresca,
Onde a pena nascente desabrocha entre flores,
São feitos para os pássaros ou para os caçadores?",3
"ce n’est pas juste enfin! moi je suis trop sensible.
quand tu m’as fait du mal, je tente bien parfois
de te le rendre. mais ça n’est jamais possible!
je souffre toujours plus que toi.
toi, tu sais supporter les longues bouderies,
les regards durs et lês silences obstines…
ah! ne sois pas méchante avec moi, ma chérie!
j’ai trop de chagrin quand j’em ai…
… mais je suis fou! n’écoute pas! je te confesse
naïvement de dangereuses vérités…
tu sais à présent ma faiblesse:
tu vas peut-être em profiter…","mas isso não é justo! eu sou muito sensível…
qualquer maldade que você me faça e que eu tente
retribuir, não consigo, é impossível!
eu sofro mais do que você.
você suporta bem os acintes sem fim,
os silêncios ruins e os olhares brutais…
mas não seja cruel, tenha pena de mim!
quando eu sofro, eu sofro demais…
… mas, não! não ouça! eu confessei
ingênuo e fraco, uma cousa que eu não devia confessar…
você sabe agora o meu fraco:
e vai talvez se aproveitar…",fr_XX,pt_XX,"Não é justo, afinal! Eu sou muito sensível.
Quando você me fez mal, às vezes tento
Revidar, mas isso nunca é possível!
Eu sofro sempre mais que você.
Você sabe suportar longas indiferenças,
Olhares duros e silêncios obstinados...
Ah! Não seja má comigo, meu amor!
Tenho muita mágoa quando isso acontece...
... mas sou louco! Não ouça! Confesso
Inocentemente verdades perigosas...
Agora você sabe minha fraqueza:
Talvez você queira se aproveitar...",3
"alors, adieu. tu n’oublies rien?… c’est bien. va-t’em.
nous n’avons plus rien à nous dire. je te laisse.
tu peux partir… pourtant, attends encore, attends.
il pleut… attends que cela, cesse.
couvre-toi bien surtout! tu sais qu’il fait très froid
dehors. c’est um manteau d’hiver qu’il fallait mettre…
je t’ai bien tout rendu? je n’ai plus rien à toi?
tu as pris ton portrait, tes lettres?…
allons! regarde-moi, puisqu’on va se quitter…
mais prends garde! ne pleurons pas! ce serait bete.
quel effort il faut faire, hein? dans nos pauvres têtes,
pour revoir les amants que nous avons été!
nos deux viés s’étaient l’une à l’autre données toutes,
pour toujours… et voici que nous les reprenons!
et nous allons partir, chacun avec son nom,
recommencer, errer, vivre ailleurs… oh! sans doute,
nous souffrirons… pendant quelque temps. et puis, quoi!
l’oubli viendra, la seule chose qui pardonne.
et il y aura toi, et il y aura moi,
at nous serons parmi les autres deux persones.
ainsi, déjà, tu vas entrer dans mon passe!
nous nous rencontrerons par hasard, dans lês rues.
je te regarderai de loin, sans traverser.
tu passeras avec des robes inconnues.
et puis nous resterons sans nous voir de longs móis.
et des amis te donneront de mes nouvelles.
et je dirai de toi qui fus ma vie, de toi
qui fus ma force et ma douceur: “comment va-t-elle?”
notre grand coeur, c’était cette petite chose!
étions-nous assez fous, pourtant, les premiers jours!
tu te souviens, l’enchantement, l’apothéose?
s’aimait-on!… et voilà: c’était ça, notre amour!
ainsi nous, même nous, quand nous disons “je t’aime”,
voilá donc la valeur que cela a! mon dieu!
vrai, c’est humiliant. on est donc tous les mêmes?
nous sommes donc pareils aux autres?… comme il pleut!
tu ne peux pas partir par ce temps… allons, reste!
oui, reste, va! on tâchera de s’arranger.
on ne sait pas. nos coeurs, quoiqu’ils aient bien changé,
se reprendront peut-être au charme des vieux gestes.
on fera son possible. on sera bon. et puis,
on a beau dire, au fond, on a des habitudes…
assieds-toi, va! reprends près de moi ton ennui
moi près de toi je reprendrai ma solitude.","pois bem, adeus. nada esqueceu?… tem tudo já?
não temos nada mais a dizer face a face.
pode ir… mas, não! espere um pouco!
como está chovendo!… espere que isso passe.
agasalhe-se bem! está frio lá fora.
você devia pôr um “manteau” mais pesado.
já tem tudo o que é seu? nada me resta agora?
as suas cartas? o retrato?…
já que a gente se vai separar, olhe-me ainda um instante…
mas sem chorar: seria idiota.
como é horrível agora a lembrança remota
do que nós fomos numa vida antiga e linda!
nossas vidas se confundiram totalmente…
e agora cada qual retoma o seu caminho!
nós vamos partir, cada qual mais sozinho,
recomeçar, vagar por aí… certamente,
sofreremos também… mas há de vir, depois
o esquecimento, a única cousa que perdoa.
e há de haver eu haver você; sermos dois;
sermos isto: uma pessoa e outra pessoa.
veja! você já vai entrar no meu passado!
havemos de nos ver na rua, casualmente…
eu hei de olhar e de ir, sem ter atravessado…
você irá com vestidos novos, diferentes…
e viveremos nossas vidas paralelas…
e amigos contarão a você minha história…
e eu direi de você, que foi a minha glória,
a minha força e a minha fé: “como vai ela?”
o nosso amor… era esta cousa sem valor!…
no entanto, que loucura a dos primeiros dias!
lembra-se bem? que apoteose, que magia!…
se nos amávamos!… e era isto o nosso amor!
mesmo nós, até nós então, quando dizemos “eu te amo!”,
o que é que vale o que estamos dizendo?…
é humilhante, meu deus!… somos todos os mesmos?
iguais aos outros, nós?… mas, como está chovendo!
você não sai com um tempo assim… fique comigo!
fique! vamos viver – não sei… – mais conformados…
os nossos corações, embora bem mudados,
se reforçam talvez às luzes do sonho antigo…
vamos tentar. ser bons, de novo. que remédio!
podem falar: a gente tem seus hábitos…
então? não vá! fique! e retome ao meu lado o seu tédio,
eu retomo ao seu lado a minha solidão.",fr_XX,pt_XX,"Bem, adeus. Nada esqueceu?... Tem tudo já?
Não temos nada mais a dizer frente a frente.
Pode ir... mas, não! Espere um pouco!
Como está chovendo!... Espere que isso passe.
Aguarde-se bem! Está frio lá fora.
Você devia pôr um casaco mais pesado.
Já tem tudo o que é seu? Nada me resta agora?
As suas cartas? O retrato?...
Já que vamos nos separar, olhe-me ainda um instante...
Mas sem chorar: seria idiota.
Como é horrível agora a lembrança remota
Do que nós fomos numa vida antiga e linda!
Nossas vidas se confundiram totalmente...
E agora cada qual retoma o seu caminho!
Nós vamos partir, cada qual mais sozinho,
Recomeçar, vagar por aí... certamente,
Sofreremos também... mas há de vir, depois
O esquecimento, a única coisa que perdoa.
E há de ser eu, ser você; sermos dois;
Seremos isto: uma pessoa e outra pessoa.
Veja! Você já vai entrar no meu passado!
Havemos de nos ver na rua, casualmente...
Eu hei de olhar e de ir, sem ter atravessado...
Você irá com vestidos novos, diferentes...
E viveremos nossas vidas paralelas...
E amigos contarão a você minha história...
E eu direi de você, que foi a minha glória,
A minha força e a minha fé: ""Como vai ela?""
O nosso amor... era esta coisa sem valor!...
No entanto, que loucura a dos primeiros dias!
Lembra-se bem? Que apoteose, que magia!...
Se nos amávamos!... E era isto o nosso amor!
Mesmo nós, até nós então, quando dizemos ""eu te amo!"",
O que é que vale o que estamos dizendo?...
É humilhante, meu Deus!... Somos todos os mesmos?
Iguais aos outros, nós?... Mas, como está chovendo!
Você não sai com um tempo assim... Fique comigo!
Fique! Vamos viver – não sei... – mais conformados...
Os nossos corações, embora bem mudados,
Se reforçam talvez às luzes do sonho antigo...
Vamos tentar. Ser bons, de novo. Que remédio!
Podem falar: a gente tem seus hábitos...
Então? Não vá! Fique! E retome ao meu lado o seu tédio,
Eu retomo ao seu lado a minha solidão.",3
"que faites-vous là petite fille
avec ces fleurs fraîchement coupées
que faites-vous là jeune fille
avec ces fleurs ces fleurs séchées
que faites-vous là jolie femme
avec ces fleurs qui se fanent
que faites-vous là vieille femme
avec ces fleurs qui meurent
j’attends le vainqueur.","o que faz aqui, garotinha,
com estas flores recém-cortadas?
o que faz aqui, jovem menina,
com essas flores, essas flores secas?
o que faz aqui, bela mulher,
com essas flores que murcham?
o que faz aqui, decrépita mulher,
com essas flores que morrem?
estou à espera pela triunfante.",fr_XX,pt_XX,"O que fazes aí, pequena flor?
Com essas flores, recém-cortadas
O que fazes aí, jovem donzela?
Com essas flores, já ressecadas
O que fazes aí, bela mulher?
Com essas flores, que murcham cedo
O que fazes aí, velha senhora?
Com essas flores, que já morreram
Espero pelo vencedor.",3
"a eux la faute, pourquoi tant d’orgueil ?
stendhal.
o poëte, il le faut, honorons la matière ;
mais ne l’honorons point d’une amitié grossière,
et gardons d’offenser, pour des plaisirs trop courts,
l’amour, qui se souvient, et se venge toujours.
notre âme est trop souvent comme cette bacchante
que, dans une attitude aimable et provocante,
le satyre caresse et retient dans ses bras,
rouge de ses désirs et de son embarras,
la tête renversée et les lèvres mi-closes,
et que l’enfant amour châtie avec des roses.","a eux la faute, pourquoi tant d’orgueil ?
stendhal.
ó poeta, é preciso, honremos a matéria;
mas não a honremos com uma amizade fera,
e não ofendamos, por prazeres à míngua,
o amor que se recorda e que sempre se vinga.
nossa alma é, muitas vezes, como essa bacante,
que, com uma amável atitude provocante,
o sátiro acarinha e segura em seus braços,
rubro de seus desejos e seus embaraços,
lábios semicerrados, cabeça pra trás,
e que o infante amor castiga com rosais.",fr_XX,pt_XX,"Eles a culpa, por quê tanta arrogância?
Stendhal.

O poeta, ele o é, honremos a matéria;
mas não a honremos com uma amizade grosseira,
e guardemos de ofender, por prazeres tão breves,
o amor, que se lembra, e se vinga sempre.

Nossa alma é muitas vezes como essa bacante
que, numa atitude amável e provocante,
o sátiro acaricia e mantém em seus braços,
rubra de seus desejos e de seu embaraço,
a cabeça inclinada e os lábios semi-cerrados,
e que o menino amor castiga com rosas.",3
