original_poem,translated_poem,src_lang,tgt_lang,translated_by_TA,topic
"passion, amour, sexe …
homme, que faites-vous?
vos paroles viriles, fébriles, attisées,
poussant les portes d’un rêve oublié,
dans l’âme d’une femme douée,
que le monde semble agripper…
homme, que voulez-vous ?
sentir votre verge danser dans ses entrailles,
voir son corps frémissant et attisé,
jusqu’à ce que votre désir igné,
hurle sa chanson charnelle ?
et voir s’envoler de nouveau,
la passion pour un désir fougueux,
qui part vous laissant le vide,
jusqu’à ce qu’une autre flamme la suscite de nouveau ?
ou voulez-vous, homme…
la serrer contre votre cœur,
l’aimer et sentir bonheur,
chaque soir, chaque matin,
et encore saluer dieu
pour chaque jour de vie en vous !?","paixão, amor, sexo ..
homem, que estas fazendo ?
tuas palavras viris, febris, instigadas, forçando as portas de um sonho esquecido,
na alma de uma mulher dotada,
que o mundo parece agarrar…
homem, que estas querendo ?
sentir tua haste dançar em seu ventre,
ver seu corpo tremer de excitação,
até que teu desejo ígneo,
brade sua canção ?
e ver partir de novo,
a paixão por um desejo fogoso,
que parte te deixando o vazio,
até que outra chama, a desperte de novo ?
ou queres, homem…
aperta-la contra seu coração,
amá-la e sentir felicidade,
toda manhã, toda noite
e ainda saudar deus
por cada dia de vida em vós ?!!!",fr_XX,pt_XX,"paixão, amor, sexo…
homem, o que você faz?
suas palavras viris, febris, incendiadas,
empurrando as portas de um sonho esquecido,
na alma de uma mulher talentosa,
que o mundo parece agarrar…
homem, o que você deseja?
sentir seu falo dançar em suas entranhas,
ver seu corpo tremendo e incendiado,
até que seu desejo ígneo,
grite sua canção carnal?
e ver voar de novo,
a paixão por um desejo ardente,
que parte deixando-o vazio,
até que outra chama o reacenda?
ou você deseja, homem…
abraçá-la contra seu coração,
amá-la e sentir felicidade,
cada noite, cada manhã,
e ainda saudar Deus
por cada dia de vida em você!?",1
"cœur déchiré
pourquoi l’avoir dérobé, si tu ne désirais pas le garder ?
et ainsi avec tant d’ardeur, à leurer même le cupidon ?
oh voleur ! tôt ou tard je te le reprendrai,
et aussi brutalement comme tu me l’as fait à moi.
en arrivant comme un angelot,
en partant comme un voleur,
et comme si le monde,
ne tournait qu’autour de toi.
ce jour arrivera et toi,
ne te moqueras plus de moi, de ma naïveté.
et tu éprouveras comme moi aujourd’hui,
l’abandon, la déchirure, un mal être bien défini.
et l’amour, de retour dans mon ego,
je le détiendrai si calme, si serein,
dans mon être plein de vie,
pour un autre bien choisi.","coração rasgado
porque tê-lo roubado, se não desejava guarda-lo ?
e com tanto ardor, enganando até o cupido ?
oh ladro ! cedo ou tarde eu o pegarei de volta,
assim tão brutalmente como o fez comigo.
chegando como um anjinho,
partindo como um ladrão,
et como se o mundo,
so girasse ao seu redor.
este dia chegará e voce,
nao rirá mais de mim, de minha inocencia.
e provará como eu atualmente,
o abandono, o rasgão, um mal estar bem definido.
e o amor, de volta ao meu ego,
eu o guardarei tão calmo, tão sereno
no meu ser cheio de vida,
para um outro bem escolhido.",fr_XX,pt_XX,"coração partido
por que o roubaste, se não querias mantê-lo?
e assim, com tanta paixão, enganando até Cupido?
oh ladrão! cedo ou tarde vou retomá-lo,
e tão brutalmente como fizeste comigo.
chegando como um anjinho,
partindo como um ladrão,
e como se o mundo
girasse apenas em torno de ti.
esse dia chegará e tu,
não mais zombarás de mim, da minha ingenuidade.
e sentirás como eu hoje,
o abandono, a dilaceração, um mal-estar bem definido.
e o amor, de volta ao meu ego,
eu o segurarei tão calmo, tão sereno,
em meu ser cheio de vida,
para outro escolhido com sabedoria.",1
"mon fils …
vingt ans se sont passés …
avant je te soutenais dans mes bras,
et ne ratais un seul instant,
pour te faire plein de bisous partout.
aujourd’hui t’as pris tes pas,
et suis seul ton avenir.
comme un grand, plein de sagesse,
t’es ma fierté, mon seul but.
j’ai toute confiance en toi,
pour mettre en œuvre ce que je t’ai appris,
pour bâtir une vie honnête,
remplie de toutes les vertus.
et mon amour qui te suit,
ne demande qu’à te soutenir,
te donner la force pour réussir,
et à dieu de te protéger toujours.","meu filho …
vinte anos se passaram …
antes eu lhe amparava nos meus braços,
e não perdia um so instante,
para lhe dar um montão de beijinhos.
hoje voce caminha autônomo,
et segue sozinho seu futuro.
como um senhor,
cheio de juizo,
voce é meu orgullo,
meu único alvo.
tenho toda confiança em voce,
para colocar em obras tudo que lhe ensinei,
para construir uma vida honesta,
cheia de todas as virtudes.
et meu amor que lhe segue,
pede para lhe apoiar sempre,
lhe dar forças para vencer,
et a deus de lhe proteger.",fr_XX,pt_XX,"meu filho …
vinte anos se passaram …
antes, eu te segurava nos meus braços,
e não perdia um só momento,
para te encher de beijos por toda parte.
hoje, você deu seus passos,
e eu acompanho sozinho o seu futuro.
como um grande, cheio de sabedoria,
você é o meu orgulho, o meu único objetivo.
tenho total confiança em você,
para colocar em prática o que te ensinei,
para construir uma vida honesta,
repleta de todas as virtudes.
e o meu amor que te segue,
só deseja te apoiar,
te dar a força para ter sucesso,
e a Deus para te proteger sempre.",1
"moment de nostalgie.
oh sentiment profond,
qui pénètre la poitrine et insiste à y rester.
cette chose poignante qui révèle le vide,
paralyse le regard le remplissant de tristesse.
oh, sentiment qui creuse,
qui jette dans le vide,
tout être aimable sans aucune pitié.
obligée je suis de te laisser la place,
si tu insistes à m’y habiter.
voilà, une lueur s’impose !
me dévoile, me secoue, t’arrachant de moi.
je partais fragile, naïve et inerte,
contente je suis de m’être séparée de toi.","momento de nostalgia
oh sentimento profond,
que penetra no peito
e insiste em ali ficar,
esta coisa pungente que revela o vazio,
paralisa o olhar lhe enchendo de tristesa.
oh, sentimento que perfura, que joga no vazio todo ser amável,
sem nenhuma piedade.
obrigada eu sou de me deixar partir,
se tu persistes em dentro morar …
eis que uma luz se impõe,
me desvela, me sacode,
te arrancando de mim.
eu partia frágil, inocente e inerte,
contente estou de ter me separado de ti.",fr_XX,pt_XX,"momento de nostalgia.
oh, sentimento profundo,
que penetra o peito e insiste em permanecer.
essa coisa tocante que revela o vazio,
paralisa o olhar, enchendo-o de tristeza.
oh, sentimento que escava,
que joga no vazio,
todo ser amável sem piedade alguma.
sou obrigada a te dar espaço,
se insistes em habitar em mim.
aqui está, uma luz se impõe!
me revela, me sacode, te arrancando de mim.
partia frágil, ingênua e inerte,
feliz estou por ter me separado de ti.",1
"il paraît que j’ai un beau sourire,
que mes yeux pétillent,
que mon regard fascine,
il est vrai que j’aime la vie.
il paraît que mes mots sont forts,
que suis douce et tendre,
que j’inspire le bonheur,
il est vrai que les envies me supportent.
si mon sourire est beau,
si mes yeux pétillent,
si mon regard fascine,
je ne vois que votre âme.
si mes mots sont forts,
si je suis douce et tendre,
si j’inspire le bonheur,
je ne vois que votre cœur.
où est le mal, je ne le vois pas,
si je ne vois que le bien !
ou est la critique, je ne le fais pas,
si je ne sais pas juger !
je me laisse bercer,
je suis le rythme.
je me laisse guider,
j’ai confiance en vous.
je glisse …
dans l’intelligence du cœur,
dans la beauté de l’âme,
dans la façon élégante,
dont les choses sont faites.
et …
puisse moi ne pas me tromper,
puissent les anges m’accompagner.","parece que tenho um belo sorriso,
que meus olhos faíscam,
que meu olhar facina,
é verdade que eu amo a vida.
parece que minhas palavras são fortes,
que sou serena e carinhosa,
que inspiro a felicidade,
é verdade que os desejos me suportam.
se meu sorriso é bonito,
se meus olhos faíscam,
se meu olhar facina,
é que so vejo sua alma.
se minhas palavras são fortes,
se sou serena e carinhosa,
se inspiro a felicidade,
é que so vejo seu coração.
onde esta o mal, eu não o vejo,
se eu so vejo o bem !
onde esta a crítica, eu não a faço,
se eu não sei julgar !
eu me deixo balançar,
eu sigo o ritmo,
eu me deixo guiar,
tenho confiança em voce.
eu desliso …
na inteligência do coração,
na beleza da alma,
na maneira elegante,
com a qual as coisas são feitas.
e …
possa eu não me enganar.
possam os anjos me acompanhar.",fr_XX,pt_XX,"Parece que tenho um lindo sorriso,
que meus olhos brilham,
que meu olhar fascina,
é verdade que eu amo a vida.
Parece que minhas palavras são fortes,
que sou doce e terna,
que inspiro felicidade,
é verdade que os desejos me apoiam.
Se meu sorriso é bonito,
se meus olhos brilham,
se meu olhar fascina,
só vejo sua alma.
Se minhas palavras são fortes,
se sou doce e terna,
se inspiro felicidade,
só vejo seu coração.
Onde está o mal, eu não vejo,
se vejo só o bem!
Onde está a crítica, eu não faço,
se não sei julgar!
Deixo-me embalar,
sigo o ritmo.
Deixo-me guiar,
confio em você.
Deslizo...
na inteligência do coração,
na beleza da alma,
na maneira elegante,
como as coisas são feitas.
E...
que eu não me engane,
que os anjos me acompanhem.",1
"ma petite brune
une lumière dans mon cœur,
a installé le bonheur,
quand la porte s’est ouverte
et ton visage j’ai vu.
et mes yeux dans les tiens,
ne demandaient que toi.
toi ma petite brune,
qui j’ai aimé dés les premiers instants.
t’es restée en moi,
toi ma petite brune,
t’es la plus belle,
t’es le plus beau cadeau qu’est arrivé dans ma vie.","minha moreninha
uma luz no coração,
instalou a felicidade,
quando a porta se abriu
e sua face eu vi.
e meus olhos nos seus,
so pediam voce.
voce minha moreninha,
que eu amei desde o primeiro instante.
voce ficou em mim,
voce minha moreninha,
voce é a mais bela,
voce é o presente,
o mais bonito que aconteceu na minha vida.",fr_XX,pt_XX,"minha pequena morena
uma luz no meu coração,
instalou a felicidade,
quando a porta se abriu
e vi seu rosto.
e meus olhos nos seus,
só pediam por você.
você, minha pequena morena,
que amei desde os primeiros instantes.
você permaneceu em mim,
você, minha pequena morena,
é a mais linda,
é o presente mais bonito que chegou em minha vida.",1
"les femmes et les hommespourquoi sur le chemin,
les hommes et les femmes y passent,
se entrelacent et tentent de construire un jardin,
et finissent pour y planter des souffrances ?
les femmes et les hommes en souffrent. ils se blessent, pleurent, subissent. ils sont tendus, malheureux, sombres. puis un jour déchirés ils se quittent.
les femmes et les hommes espèrent,
tous les jours le bonheur.
souvent l’attente est pérenne
et la solitude envahie leur cœur.
leurs émotions souvent meurtris
ils se replient dans un monde vide,
bordant une vie fade et triste,
ils se demandent si le bonheur exiiste.
mieux vaut vivre dans la certitude,
qu’un grand homme,
qu’une grande femme,
les attendent dans l’esprit de dieu.","as mulheres e os homensporque no caminho,
mulheres e homens ali passam,
se entrelaçam et tentam construir um jardim,
et acabam por plantar sofrimentos ?
as mulheres e os homens sofrem. eles se machucam, se aturam, choram. eles são tensos, infelizes, tristes, e um dia, dilacerados, eles se separam.
as mulheres e os homens esperam, todos os dias, a felicidade. muitas vezes a espera é eterna, e uma imensa solidão os invade.
suas emoções quase sempre feridas,
eles se fecham num mundo vazio,
tocando uma vida triste e sombria,
eles se perguntam se a felicidade existe.
melhor viver na certeza
que um grande homem,
que uma grande mulher,
lhes esperam no seio de deus.",fr_XX,pt_XX,"As mulheres e os homens
Por que no caminho,
os homens e as mulheres passam,
se entrelaçam e tentam construir um jardim,
e acabam plantando sofrimentos?
As mulheres e os homens sofrem. Eles se machucam, choram, sofrem. Eles estão tensos, infelizes, sombrios. E então, um dia, rasgados, se separam.
As mulheres e os homens esperam,
todos os dias, a felicidade.
Muitas vezes a espera é eterna
e a solidão invade seus corações.
Suas emoções muitas vezes machucadas
os fazem se retrair em um mundo vazio,
beirando uma vida sem graça e triste,
eles se perguntam se a felicidade existe.
É melhor viver na certeza,
de que um grande homem,
de que uma grande mulher,
os aguardam no espírito de Deus.",1
"t’es vraiment amoureux ?
alors, t’es pris par un sentiment féroce …
comme un aimant,
il t’attire, inlassablement, vers ton bien aimé.
il envahit ton être, tu deviens radieux et envoûté.
il t’emmène dans un tourbillon de désirs.
désirs de l’autre, de le toucher,
du contact de son corps contre le tien,
et quel plaisir de sentir sa respiration …
l’importance de sa présence,
c’est la fleur assoiffée qui boit,
c’est l’enfant perdu qui retrouve sa mère,
c’est le poisson que tu remets dans l’eau,
c’est l’oiseau dans son premier envol,
c’est ton premier regard devant l’océan,
et le sans-abri, à qui tu donnes une maison …
que c’est bon de l’avoir à tes côtés …
de pouvoir poser tes regards en admiration sur les siens,
de pouvoir le caresser pour exprimer ta tendresse,
de lui sourire et d’en recevoir à ton tour,
de pouvoir lui parler et entendre sa voix,
et de l’embrasser et lui dire : je t’aime…","estás realmente apaixonado ?
então, estás tomado por un sentimento feroz …
como um imã,
ele te atrai, incançavelmente, para teu bem amado.
ele invade teu ser, tu te tornas radioso e cativo.
ele te leva num turbilhão de desejos.
desejos do outro, de tocá-lo,
do contato de seu corpo contra o teu,
e que prazer de sentir sua respiração …
a importancia de sua presença …
é a flor sediada que bebe,
é a criança perdida que reencontra sua mãe,
é o peixe que tu recolocas na água,
é o pássaro no seu primeiro vôo,
é teu primeiro olhar diante do oceano,
e é o sem- abrigo, à quem tu daste uma casa …
como é bom tê-lo ao teu lado …
de poder cruzar olhares de admiração,
de poder acariciá-lo para exprimir teu afeto,
de lhe sorrir et de receber o seu,
de poder lhe falar e escutar sua voz,
e de lhe abraçar et lhe dizer : eu te amo.",fr_XX,pt_XX,"Estás realmente apaixonado?
Então, estás dominado por um sentimento feroz...
como um ímã,
ele te atrai, incansavelmente, para o teu amado.
Ele invade o teu ser, tornando-te radiante e encantado.
Ele te leva a um turbilhão de desejos.
Desejos pelo outro, de tocar nele,
do contato do seu corpo contra o teu,
e que prazer sentir a sua respiração...
A importância da sua presença,
é a flor sedenta que bebe,
é a criança perdida que reencontra a mãe,
é o peixe que devolves à água,
é o pássaro no seu primeiro voo,
é o teu primeiro olhar diante do oceano,
e o sem-abrigo a quem dás uma casa...
Que bom tê-lo ao teu lado...
poder admirar os seus olhos com admiração,
poder acariciá-lo para expressar a tua ternura,
sorrir para ele e receber um sorriso em troca,
poder falar com ele e ouvir a sua voz,
e beijá-lo e dizer-lhe: eu te amo...",1
"t’as perdu ton amour ?
alors, t’es pris par un sentiment féroce …
c’est comme un boa qui t’avale en entier,
et tu perds tous tes moyens.
perdre son amour c’est …
se sentir complètement seul.
c’est la fleur privée de l’eau,
c’est l’enfant qu’a perdu sa mère,
c’est le poisson que tu retires de l’eau,
c’est l’oiseau que tu empêches de s’en voler,
c’est ton regard aveuglé devant l’océan,
et le sans-abri qui ne trouve pas où s’abriter…
perdre son amour c’est …
c’est une atroce souffrance perdue dans la solitude,
c’est le désespoir de ne plus pouvoir le toucher,
de ne plus pouvoir le voir.
c’est la douleur, la révolte qui crie : « pourquoi ? »
c’est l’esprit constamment tourné vers lui,
c’est croiser les gens et ne voir personne,
c’est entrer dans un tunnel silencieux,
et ce sont des larmes dans tes yeux sans lumière…","perdeste teu amor ?
então, estas tomado por um sentimento feroz …
é como uma jibóia que te engole inteirinho,
et tu perdes todos teus poderes.
perder seu amor é …
se sentir completamente sozinho.
é a flor com falta de água,
é a criança que perdera sua mãe,
é o peixe que tu retiras da água,
é o pássaro que tu impedes de voar,
é o teu olhar cego face ao oceano,
e é o sem-abrigo que não achou onde se abrigar …
perder seu amor é …
um sofrer feroz perdido na solidão,
é o desespero de não mais poder lhe tocar,
não mais poder lhe ver.
é a dor, a revolta que grita : « porque? «
é o espírito constantemente voltado para ele,
é cruzar gente e não ver ninguem,
é entrar num túnel silencioso,
e são lágrimas nos teus olhos sem luz …",fr_XX,pt_XX,"Perdeste o teu amor?
Então, estás preso por um sentimento feroz...
É como uma serpente que te engole por inteiro,
e perdes todas as tuas forças.
Perder o teu amor é...
sentir-se completamente sozinho.
É a flor privada de água,
é a criança que perdeu a mãe,
é o peixe que tiras da água,
é o pássaro que impedes de voar,
é o teu olhar cego diante do oceano,
e o sem-teto que não encontra onde se abrigar...
Perder o teu amor é...
uma atroz dor perdida na solidão,
é o desespero de não poder mais tocá-lo,
de não poder mais vê-lo.
É a dor, a revolta que grita: ""porquê?""
é a mente constantemente voltada para ele,
é cruzar as pessoas e não ver ninguém,
é entrar num túnel silencioso,
e são lágrimas nos teus olhos sem luz...",1
"je te voulais auprès de moi …
mais je ne savais pas où te trouver,
je voulais t’appeler,
mais je ne savais pas en quelle direction,
je voulais de ton amour,
mais je ne savais pas qu’il existait.
combien de fois dans mes rêves,
je t’ai emmené auprès de moi …
je rêvais de toi, sans t’avoir jamais vu.
je rêvais de ton êtr sans t’avoir jamais rencontré.
je t’ emmenais déjà auprès de moi …
je sentais ta chaleur sans que je sache que c’était la tienne.
je sentais ta vibration sans que je sache que c’était toi.
je sentais tes baisers sans que je sache que c’étaient tes lèvres.
aujourd’hui, t’es rentré dans mon âme,
comme une brise câline et ardente,
m’apportant paix et sérénité.
je te respire, je te sens, je te vis profondément.
reste auprès de moi …","eu ja te queria perto de mim …
mas não sabia onde te encontrar,
eu queria te chamar,
mas não sabia em qual direção,
eu queria do teu amor,
mas não sabia que ele existia.
quantas vezes nos meus sonhos,
eu te levei junto a mim …
eu sonhava contigo, sem nunca ter te visto.
eu sonhava com teu ser, sem nunca ter te encontrado.
eu ja te levava junto a mim …
eu sentia teu calor, sem que eu soubesse que era o teu.
eu sentia tua vibração, sem que eu soubesse que eras tu.
eu sentia teus beijos, sem que eu soubesse que eram teus lábios.
hoje, tu entraste na minha alma,
como uma brisa meiga e cálida,
me trazendo paz e serenidade.
eu te respiro, te sinto, te vivo profundamente.
ficas comigo …",fr_XX,pt_XX,"Eu queria você ao meu lado…
mas não sabia onde te encontrar,
eu queria te chamar,
mas não sabia em que direção,
eu queria o seu amor,
mas não sabia que ele existia.
Quantas vezes nos meus sonhos,
te levei ao meu lado…
eu sonhava com você, sem nunca ter te visto.
eu sonhava com o seu ser, sem nunca ter te conhecido.
eu já te levava ao meu lado…
sentia o seu calor sem saber que era o seu.
sentia a sua vibração sem saber que era você.
sentia os seus beijos sem saber que eram seus lábios.
hoje, você entrou na minha alma,
como uma brisa carinhosa e ardente,
me trazendo paz e serenidade.
eu te respiro, te sinto, te vivo profundamente.
fica ao meu lado…",1
"hier …
il faisait si longtemps …
hier, nos regards se sont croisés,
la tristesse a envahi l’âme
et la nostalgie jusqu’à la peau.
et l’envie folle de nous approcher,
a toujours été présente,
nous le savons si bien…
si nos regards se fixaient,
si nos corps se rapprochaient,
inutiles seraient les mots
et les larmes en diraient le tout.
alors …
on aurait finalement trouvé la paix,
le trésor dont l’âme cherche
pour nourrir son soi de sérénité et d’amour.
parce que l’âme se rend compte que la liberté sans amour,
n’est qu’un chemin aride dénué de fleurs …","ontem …
ja fazia tanto tempo …
ontem nossos olhares se cruzaram,
a tristesa invadiu a alma
e a nostalgia até à pele.
e o desejo louco de nos aproximar,
sempre estêve presente,
nós o sabemos tão bem…
se nossos olhares se fixassem,
se nossos corpos se aproximassem,
inúteis seríam as palavras e as lágrimas diríam o tudo.
e aí … (então)
encontraríamos enfim a paz,
o tesouro o qual toda alma procura,
para nutrir seu eu de serenidade et de amor.
porque a alma percebe que a liberdade sem amor,
nao passa de um caminho árido sem flôres.",fr_XX,pt_XX,"Aqui está a tradução do poema para o português:

ontem...
há tanto tempo...
ontem, nossos olhares se cruzaram,
a tristeza invadiu a alma
e a saudade chegou à pele.
e o desejo louco de nos aproximar,
sempre esteve presente,
nós sabemos tão bem...
se nossos olhares se fixassem,
se nossos corpos se aproximassem,
seriam inúteis as palavras
e as lágrimas diriam tudo.
então...
finalmente teríamos encontrado a paz,
o tesouro que a alma busca
para alimentar seu ser com serenidade e amor.
porque a alma percebe que a liberdade sem amor,
é apenas um caminho árido sem flores...",1
"tant de questions, tant de pression,
tant de choses comme si on jouait un jeu.
moi, je ne joue plus, jeu compliqué
où on se perd dedans.
tant de réponses, tant de réflexions,
toutes analysées comme un chercheur.
moi, je ne sais plus, je réponds n’importe quoi,
vu que l’amour, lui fait si peur.
l’amour quand il est là,
nous donne élan, nous irradie.
l’amour quand il n’y est pas,
laisse nostalgie et nous flétrit.
l’amour quand il s’en va,
dans ses idées souvent erronées,
sème confusion et dans cet embarras,
impossible de distinguer les éléments.
l’amour quand il part, part …
dans une lueur sans égal
en écrasant pour la vie,
ce qui pourrait être le plus beau.","tantas perguntas, tanta pressão,
tantas coisas, como se jogássemos um jogo.
eu não jogo mais, jogo complicado,
onde nos perdemos dentro.
tantas respostas, tantas reflexões,
todas analisadas como um pesquisador.
eu ja não sei mais, ja respondo qualquer coisa,
visto que o amor, lhe faz tanto mêdo.
o amor quando está,
nos da ímpeto, nos irradia.
o amor quando não está,
deixa nostalgia e nos fenece.
o amor quando se vai,
no seu juizo, quase sempre falso,
seme confusão e neste embaraço,
impossível de distinguir os elementos.
o amor quando parte, parte …
numa centelha sem igual,
esmagando por uma vida,
o que poderia ser de mais bonito.",fr_XX,pt_XX,"Tantas perguntas, tanta pressão,
tantas coisas como se estivéssemos jogando um jogo.
Eu, eu não jogo mais, jogo complicado
onde nos perdemos dentro.
Tantas respostas, tantas reflexões,
todas analisadas como um pesquisador.
Eu, eu não sei mais, respondo qualquer coisa,
visto que o amor, ele dá tanto medo.
O amor quando está presente,
nos dá impulso, nos irradia.
O amor quando não está lá,
deixa saudade e nos murcha.
O amor quando se vai,
em suas ideias frequentemente equivocadas,
semeia confusão e nessa confusão,
impossível distinguir os elementos.
O amor quando parte, parte...
em um brilho sem igual,
esmagando para a vida,
o que poderia ser o mais belo.",1
"l’amour en solitaire
c’est quoi cela
qui m’est arrivé comme ça,
qui devrait m’émerveiller,
mais m’angoisse plutôt ?
c’est quoi cette chose,
qui m’a envahie sans permission,
comme une flèche droit dans l’âme,
en m’arrachant de mon ego ?
l’amour que l’on n’explique pas
est tombé sur moi et
pourtant je l’attendais
pour être vraie dans ma passion.
mais lui, profitant de la tempête,
est passé avec le vent,
et m’a largué un amour énorme
dans mon cœur solitaire …","o amor em solitario
que é isto que chegou
assim de repente,
que deveria me maravilhar,
mas me deixa angustiada ?
que é esta coisa,
que me invade sem permissão,
como uma flecha direto na alma,
me tirando do meu ego ?
o amor que não se explica,
entrou bem dentro de mim,
no entanto eu o esperava
pra ser autêntica na minha paixão.
mas ele, aproveitando da tempestade,
passou com o vento,
largando em mim um amor enorme no meu coração solitário …",fr_XX,pt_XX,"O amor solitário
o que é isso
que me aconteceu assim,
que deveria me maravilhar,
mas me angustia em vez disso?
o que é essa coisa,
que me invadiu sem permissão,
como uma flecha direto na alma,
arrancando-me do meu ego?
o amor inexplicável
caiu sobre mim e
no entanto eu o esperava
para ser verdadeiro em minha paixão.
mas ele, aproveitando a tempestade,
passou com o vento,
e me deixou um amor imenso
em meu coração solitário...",1
