original_poem,translated_poem,src_lang,tgt_lang,translated_by_TA,topic
"solitude
sur un banc où deux êtres, assis côte à côte, ne faisaient qu’une tache noire.
– pauvres gens ! ce n’est pas du dégoût qu’ils m’inspirent, mais une immense pitié. parmi tous les mystères de la vie humaine, il en est un que j’ai pénétré : notre grand tourment dans l’existence vient de ce que nous sommes éternellement seuls, et tous nos efforts, tous nos actes ne tendent qu’à fuir cette solitude. ceux-là, ces amoureux des bancs en plein air, cherchent, comme nous, comme toutes les créatures, à faire cesser leur isolement, rien que pendant une minute au moins ; mais ils demeurent, ils demeureront toujours seuls ; et nous aussi.
depuis quelque temps j’endure cet abominable supplice d’avoir compris, d’avoir découvert l’affreuse solitude où je vis, et je sais que rien ne peut la faire cesser, rien, entends-tu ! quoi que nous tentions, quoi que nous fassions, quels que soient l’élan de nos cœurs, l’appel de nos lèvres et l’étreinte de nos bras, nous sommes toujours seuls.
je t’ai entraîné ce soir, à cette promenade, pour ne pas rentrer chez moi, parce que je souffre horriblement, maintenant, de la solitude de mon logement. a quoi cela me servira-t-il ? je te parle, tu m’écoutes, et nous sommes seuls tous deux, côte à côte, mais seuls.
me comprends-tu ?
bienheureux les simples d’esprit, dit l’écriture. ils ont l’illusion du bonheur. ils ne sentent pas, ceux-là, notre misère solitaire, ils n’errent pas, comme moi, dans la vie, sans autre contact que celui des coudes, sans autre joie que l’égoïste satisfaction de comprendre, de voir, de deviner et de souffrir sans fin de la connaissance de notre éternel isolement.
tu me trouves un peu fou, n’est-ce pas ?
écoute-moi. depuis que j’ai senti la solitude de mon être, il me semble que je m’enfonce, chaque jour davantage, dans un souterrain sombre, dont je ne trouve pas les bords, dont je ne connais pas la fin, et qui n’a point de bout, peut-être ! j’y vais sans personne avec moi, sans personne autour de moi, sans personne de vivant faisant cette même route ténébreuse. ce souterrain, c’est la vie. parfois j’entends des bruits, des voix, des cris… je m’avance à tâtons vers ces rumeurs confuses. mais je ne sais jamais au juste d’où elles partent ; je ne rencontre jamais personne, je ne trouve jamais une autre main dans ce noir qui m’entoure. me comprends-tu ?
quelques hommes ont parfois deviné cette souffrance atroce.
musset s’est écrié :
qui vient ? qui m’appelle ? personne. je suis seul. – c’est l’heure qui sonne. o solitude ! – o pauvreté !
mais, chez lui, ce n’était là qu’un doute passager, et non pas une certitude définitive, comme chez moi. il était poète ; il peuplait la vie de fantômes, de rêves. il n’était jamais vraiment seul. – moi, je suis seul !
gustave flaubert, un des grands malheureux de ce monde, parce qu’il était un des grands lucides, n’écrivait-il pas à une amie cette phrase désespérante : « nous sommes tous dans un désert. personne ne comprend personne. »
non, personne ne comprend personne, quoi qu’on pense, quoi qu’on dise, quoi qu’on tente. eh bien, l’homme ne sait pas davantage ce qui se passe dans un autre homme.
sais-tu quelque chose de plus affreux que ce constant frôlement des êtres que nous ne pouvons pénétrer ! nous nous aimons les uns les autres comme si nous étions enchaînés, tout près, les bras tendus, sans parvenir à nous joindre. un torturant besoin d’union nous travaille, mais tous nos efforts restent stériles, nos abandons inutiles, nos confidences infructueuses, nos étreintes impuissantes, nos caresses vaines. quand nous voulons nous mêler, nos élans de l’un vers l’autre ne font que nous heurter l’un à l’autre.
je ne me sens jamais plus seul que lorsque je livre mon cœur à quelque ami, parce que je comprends mieux alors l’infranchissable obstacle. il est là, cet homme ; je vois ses yeux clairs sur moi ; mais son âme, derrière eux, je ne la connais point. il m’écoute. que pense-t-il ? oui, que pense-t-il ? tu ne comprends pas ce tourment ? il me hait peut-être ? ou me méprise ? ou se moque de moi ? il réfléchit à ce que je dis, il me juge, il me raille, il me condamne, m’estime médiocre ou sotte. comment savoir ce qu’il pense ? comment savoir s’il m’aime comme je l’aime ? et ce qui s’agite dans cette petite tête ronde ? quel mystère que la pensée inconnue d’un être, la pensée cachée et libre, que nous ne pouvons ni connaître, ni conduire, ni dominer, ni vaincre !
et moi, j’ai beau vouloir me donner toute entière, ouvrir toutes les portes de mon âme, je ne parviens point à me livrer. je garde au fond, tout au fond, ce lieu secret du moi où personne ne pénètre. personne ne peut le découvrir, y entrer, parce que personne ne me ressemble, parce que personne ne comprend personne.
me comprends-tu, au moins, en ce moment, toi ?
non, tu me juges fou! tu m’examines, tu te gardes de moi ! tu te demandes : « qu’est-ce qu’il a, ce soir ? » mais si tu parviens à saisir un jour, à bien deviner mon horrible et subtile souffrance, viens-t’en me dire seulement : je t’ai compris ! et tu me rendras heureux, une seconde, peut-être.
ce sont les femmes qui me font encore le mieux apercevoir ma solitude.
misère ! misère ! comme j’ai souffert par elles, parce qu’elles m’ont donné, plus que les hommes, l’illusion de n’être pas seul !
quand on entre dans l’amour, il semble qu’on s’élargit. une félicité surhumaine vous envahit. sais-tu pourquoi ? sais-tu d’où vient cette sensation d’immense bonheur ? c’est uniquement parce qu’on s’imagine n’être plus seul. l’isolement, l’abandon de l’être humain paraît cesser. quelle erreur !
plus tourmentée encore que nous par cet éternel besoin d’amour qui ronge notre cœur solitaire, la femme est le grand mensonge du rêve.
tu connais ces heures délicieuses passées face à face avec cet être aux traits charmeurs et dont le regard nous affole. quel délire égare notre esprit ! quelle illusion nous emporte !
elle et moi, nous n’allons plus faire qu’un, tout à l’heure, semble-t-il ? mais ce tout à l’heure n’arrive jamais, et, après des semaines d’attente, d’espérance et de joie trompeuse, je me retrouve tout à coup, un jour, plus seul que je ne l’avais encore été.
après chaque baiser, après chaque étreinte, l’isolement s’agrandit. et comme il est navrant, épouvantable.
un poète, m. sully prudhomme, n’a-t-il pas écrit :
les caresses ne sont que d’inquiets transports,
infructueux essais du pauvre amour qui tente
l’impossible union des âmes par les corps…
et puis, adieu. c’est fini. c’est à peine si on reconnaît cette femme qui a été tout pour nous pendant un moment de la vie, et dont nous n’avons jamais connu la pensée intime et banale sans doute !
aux heures mêmes où il semblait que, dans un accord mystérieux des êtres, dans un complet emmêlement des désirs et de toutes les aspirations, on était descendu jusqu’au profond de son âme, un mot, un seul mot, parfois, nous révélait notre erreur, nous montrait, comme un éclair dans la nuit, le trou noir entre nous.
et pourtant, ce qu’il y a encore de meilleur au monde, c’est de passer un soir auprès d’une femme qu’on aime, sans parler, heureux presque complètement par la seule sensation de sa présence. ne demandons pas plus, car jamais deux êtres ne se mêlent.
quant à moi, maintenant, j’ai fermé mon âme. je ne dis plus à personne ce que je crois, ce que je pense et ce que j’aime. me sachant condamnée à l’horrible solitude, je regarde les choses, sans jamais émettre mon avis. que m’importent les opinions, les querelles, les plaisirs, les croyances ! ne pouvant rien partager avec personne, je me suis désintéressée de tout. ma pensée, invisible, demeure inexplorée. j’ai des phrases banales pour répondre aux interrogations de chaque jour, et un sourire qui dit : « oui », quand je ne veux même pas prendre la peine de parler.
me comprends-tu ?","solidão
num banco onde dois sêres, assentados lado a lado, pareciam ser, juntos, uma mancha prêta.
_ coitado deles ! eles não me inspiram desgosto mas uma imensa piedade. entre todos os mistérios da vida humana, tem um que eu penetrei : nosso grande tormento vem do fato de que somos eternamente sozinhos, e todos nossos esforços, todos nossos atos vão no sentido de querermos fugir dessa solidão. aqueles ali, estes amantes de bancos em ar livre, procuram, como nós, como todas as criaturas, a fazer cessar o isolamento deles, nem que fôr pelo menos por um minuto ; mas eles ficam, eles ficarão sempre sozinhos, e nós tambem. ja ha algum tempo, eu passo por esta abominẚvel súplica de ter compreendido, de ter descoberto esta horrorosa solidão onde eu vivo, e eu sei que nada pode fazê-la cessar, nada, entende ! seja la o que tentarmos, seja la o que façamos, seja la qual for o impulso de nossos corações, o chamado de nossos lẚbios e a força de nossos abraços, nós estamos sempre sozinhos. eu te levei esta noite, a este passeio, para não entrar na solidão da minha casa, porque eu sofro terrivelmente, agora, da solidão do meu abrigo. isto me servirẚ para que ? eu te falo, voce me escuta, e nós somos sozinhos todos dois, lado a lado, mas sozinhos. voce me entende ?
felizes os simples de espírito, diz a escritura. eles têm a ilusão da felicidade. eles não sentem nossa miséria solidão, eles não vagam como eu na vida, sem outro contato senão aqueles dos cotovelos, sem outra alegria senão a egoísta satistação de compreender, de ver, de adivinhar e de sofrer sem fim do conhecimento de nosso eterno isolamento.
voce me acha um pouco louco, não é ?
escuta-me. depois que sinto a solidão do meu ser, parece que eu mergulho cada dia mais num subterrâneo escuro no qual eu não acho os lados, o qual eu nao conheço o fim, e que nao tem o fim talvez ! eu vou sem ninguem comigo, sem ninguem ao redor de mim, sem ninguem de vivo fazendo essa mesma estrada tenebrosa. este subterrâneo, é a vida.
as vezes eu escuto barulhos, vozes, gritos … eu me avanço como quem avança no escuro em direção a estes rumores confusos. mas não sei ao justo de onde eles vêm; eu não encontro nunca ninguem, eu não encontro uma outra mão nesta obscuridade que me rodeia. voce me entende ?
alguns homens as vezes entenderam este sofrimento pavoroso.
musset se exclamou :
quem vem ? quem me chama ? ninguém.
eu estou sozinho _ é a hora que estẚ chamando. oh solidão ! oh pobreza !
mas com ele, era apenas uma dúvida passageira, e não a certeza definitiva como comigo. ele era poeta; ele povoava a vida de fantasmas, de sonhos. ele nunca estava realmente sozinho. eu, eu estou sozinho !
gustave flaubert, um dos grandes infelizes desse mundo, porque ele era um dos grandes lúcidos, não escrevia ele, a uma amiga esta frase desesperante ? : “nós estamos todos num deserto. ninguem não compreende ninguem.”
não, ninguem não compreende ninguem, seja la o que se pensa, seja la o que se diga, seja la o que se tente. assim é, o homem não sabe o que se passa num outro homem. voce conhece algo de mais horroroso que este constante tocar de sêres que nós não podemos penetrar ! nós amamos uns aos outros como se estivéssemos acorrentados, pertinhos, com os braços esticados sem conseguirmos nos unir. uma torturante necessidade de união nos atormenta, mas todos nossos esforços ficam estérios, nossas confidências infrutíferas, nossos abraços impotentes, nossas carícias vãs.
quando queremos nos envolver, nossos impulsos de um para o outro, so nos faz ofender un ao outro.
eu não me sinto jamais sozinho quando eu entrego meu coração a algum amigo, porque eu então compreendo melhor o irresistível obstẚculo. ele estẚ aqui, este homem; eu vejo seus olhos claros sobre mim, mas sua alma atras deles, eu não conheço nada dela. ele me escuta. que pensa ele ? sim, o que pensa ele ? voce não entende este tormento ? ele talvez me odeia ? ou me menospreza ? ou ri de mim ? ele reflete sobre o que lhe disse, ele me julga, ele ironiza, ele me condena, me acha medíocre ou bôbo. como saber o que ele pensa ? como saber se ele me ama como eu o amo ? e o que se agita nessa pequena cabeça redonda ? que mistério que é o pensamento desconhecido de um sêr, o pensamento escondido e livre que nós não podemos nem conhecer, nem conduzir, nem dominar, nem vencer !
e eu, por mais que eu queira me dar todo por inteiro, abrir todas as portas da minha alma, eu não consigo de forma alguma confiar em alguém. eu guardo no fundo, la no fundinho, este lugar secreto de mim onde ninguem penetra. ninguem o pode descobrir, entrar nele, porque ninguem se parece comigo, porque ninguem não compreende ninguem.
voce me entende, pelo menos neste momento, voce ?
não, voce me julga louco ! voce me examina, voce se protege de mim ! voce se pergunta : “que tem ele hoje ?” mas se um dia voce conseguir entender, advinhar bem meu horrível e sútil sofrimento, vem me dizer somente : eu lhe entendi ! e voce me farẚ feliz um segundo talvez.
são as mulheres que me fazem perceber melhor minha solidão.
miséria ! miséria ! como eu sofri através delas, porque elas me deram mais que os homens, a ilusão de não estar so !
quando se entra no amor, parece que a gente engrandece. uma felicidade sobrenatural lhe invade. sabe voce porque ? sabe voce de onde vem esta sensação imensa de felicidade ? é unicamente porque a gente imagina não estar mais sozinho. o isolamento, o abandono do ser humano parece cessar. como é horrivel !
mais atormentada que nós ainda, por esta eterna necessidade de amor que roe nosso coração solitẚrio, a mulher é a grande mentira do sonho.
voce conhece essas horas deliciosas passadas face a face com este sêr de traços charmosos e cujo olhar nos enlouquece. mas que delírio extravia nosso espírito ! qual ilusão nos leva à elas !
ela e eu, nós vamos ser um so daqui a pouco, assim parece ? mas este daqui a pouco não chega nunca, e , apos semanas de espera, de esperança e de alegria enganadora, eu me encontro de repente, um dia, mais sozinho como nunca havia ficado.
apos cada beijo, apos cada abraço, o isolamento cresce. isso é uma aflição, é terrível.
um poeta, m. sully prudhomme, ele, não escreveu isto ? :
os carinhos são apenas transportes inquietos, infrutuosas experiencias do pobre amor que tenta a impossível união das almas pelos corpos …
e depois, adeus. acabou. mal se conhece essa mulher que foi tudo para nós durante um momento da vida, e de quem jamais conhecemos o pensamento íntimo e banal sem duvida !
e mesmo nas horas onde parecia que num acordo misterioso dos sêres, num completo embaraço de desejos e de todas aspirações, et que tínhamos descido até o profundo de sua alma, uma palavra, um so palavra, as vezes, nos revelava nosso erro, nos mostrava como um relâmpago na noite, o buraco negro entre nós.
e no entanto, o que tem de melhor ainda no mundo, é passar uma tarde ao lado de uma mulher que a gente gosta, sem falar, quase completamente felizes simplesmente pela sensação de sua presença. não peçamos mais, pois jamais dois seres se misturam.
quanto à mim, agora, eu fechei minha alma. eu não digo mais a ninguem o que eu acho, o que eu penso e o que eu gosto. me sabendo condenada à horrivel solidão, eu olho as coisas sem nunca expressar minha opinião. que me importa as opiniões, as brigas, os prazeres, as crenças ! não podendo nada compartilhar com ninguem, eu me desinteressei de tudo. meu pensamento, invisível, fica inexplorado.
eu tenho frases banais para responder às interrogações de cada dia, e um sorriso que diz : “sim”, quando eu nem sequer quero fazer o esforço de falar.
você, você me entende ?",fr_XX,pt_XX,"solidão
em um banco onde dois seres, sentados lado a lado, formavam apenas uma mancha negra.
- pobres pessoas! não me inspiram repugnância, mas uma imensa compaixão. entre todos os mistérios da vida humana, há um que eu desvendei: nosso grande tormento na existência vem do fato de que estamos eternamente sozinhos, e todos os nossos esforços, todas as nossas ações, visam apenas escapar dessa solidão. aqueles, os amantes dos bancos ao ar livre, buscam, como nós, como todas as criaturas, cessar seu isolamento, nem que seja por apenas um minuto; mas eles permanecem, permanecerão sempre sozinhos; e nós também.
há algum tempo suporto esse abominável suplício de ter compreendido, de ter descoberto a terrível solidão em que vivo, e sei que nada pode pôr fim a ela, nada, ouviu bem! não importa o que tentemos, o que façamos, quaisquer que sejam os anseios de nossos corações, o chamado de nossos lábios e o abraço de nossos braços, estamos sempre sozinhos.
te trouxe esta noite para este passeio para não voltar para casa, porque sofro horrivelmente, agora, com a solidão de meu lar. de que adiantará? falo contigo, tu me ouves, e estamos ambos sozinhos, lado a lado, mas sozinhos.
me entendes?
bem-aventurados os simples de espírito, diz a escritura. eles têm a ilusão da felicidade. eles não sentem, esses, a nossa miséria solitária, não vagueiam, como eu, na vida, sem outro contato além do dos cotovelos, sem outra alegria além da egoísta satisfação de compreender, de ver, de adivinhar e de sofrer sem fim pelo conhecimento de nosso eterno isolamento.
me achas um pouco louco, não é?
escuta-me. desde que senti a solidão de meu ser, parece que mergulho cada vez mais, a cada dia, em um subterrâneo sombrio, cujas bordas não encontro, cujo fim não conheço, e que talvez não tenha fim! vou sem ninguém comigo, sem ninguém ao meu redor, sem ninguém vivo seguindo este mesmo caminho tenebroso. esse subterrâneo é a vida. às vezes ouço ruídos, vozes, gritos... me encaminho às cegas para esses rumores confusos. mas nunca sei exatamente de onde vêm; nunca encontro ninguém, nunca encontro outra mão neste escuro que me envolve. entendes-me?
alguns homens às vezes adivinharam este sofrimento atroz.
musset exclamou:
quem vem? quem me chama? ninguém. estou só. - é a hora que soa. ó solidão! - ó pobreza!
mas, nele, era apenas uma dúvida passageira, não uma certeza definitiva, como em mim. ele era poeta; povoava a vida de fantasmas, de sonhos. nunca estava realmente sozinho. - eu, estou só!
gustave flaubert, um dos grandes infelizes deste mundo, porque era um dos grandes lúcidos, não escreveu a uma amiga esta frase desesperadora: ""estamos todos num deserto. ninguém compreende ninguém.""
não, ninguém compreende ninguém, seja qual for o pensamento, a palavra, a tentativa. bem, o homem não sabe mais o que se passa em outro homem.
sabes de algo mais terrível do que esse constante roçar dos seres que não podemos penetrar! amamos uns aos outros como se estivéssemos acorrentados, bem próximos, braços estendidos, sem conseguir nos unir. uma angustiante necessidade de união nos consome, mas todos os nossos esforços são estéreis, nossas entregas inúteis, nossas confidências infrutíferas, nossos abraços impotentes, nossos carinhos vãos. quando buscamos nos fundir, nossos anseios de um em direção ao outro apenas nos fazem colidir um com o outro.
nunca me sinto mais sozinho do que quando entrego meu coração a um amigo, porque então compreendo melhor o obstáculo intransponível. ele está ali, aquele homem; vejo seus olhos claros sobre mim; mas sua alma, atrás deles, eu não a conheço. ele me ouve. o que pensa? sim, o que pensa? não entendes essa angústia? talvez me odeie? ou despreze? ou zombe de mim? pondera sobre o que digo, me julga, me zomba, me condena, me considera medíocre ou tolo. como saber o que ele pensa? como saber se me ama como eu o amo? e o que se agita nessa pequena cabeça redonda? que mistério é o pensamento desconhecido de um ser, o pensamento oculto e livre, que não podemos conhecer, dirigir, dominar, vencer!
e eu, mesmo querendo me entregar por completo, abrir todas as portas de minha alma, não consigo me entregar. guardo lá no fundo, bem no fundo, esse lugar secreto do eu onde ninguém penetra. ninguém pode descobri-lo, entrar nele, porque ninguém é como eu, porque ninguém compreende ninguém.
entendes ao menos, neste momento, tu?
não, me julgas louco! me examinas, te manténs afastado de mim! te perguntas: ""o que há com ele esta noite?"" mas se um dia conseguires captar, adivinhar bem minha dor terrível e sutil, vem me dizer apenas: te compreendi! e me farás feliz, por um segundo, talvez.
são as mulheres que mais me fazem perceber minha solidão.
miséria! miséria! como sofri por elas, porque mais do que os homens, me deram a ilusão de não estar só!
quando se entra no amor, parece que se expande. uma felicidade sobre-humana nos invade. sabes por quê? sabes de onde vem essa sensação de imensa felicidade? é apenas porque imaginamos não estar mais sozinhos. o isolamento, o abandono do ser humano parece cessar. que erro!
ainda mais atormentada do que nós por essa eterna necessidade de amor que corrói nosso coração solitário, a mulher é a grande mentira do sonho.
conheces aquelas horas deliciosas passadas face a face com aquele ser de traços encantadores e cujo olhar nos enlouquece. que delírio desorienta nosso espírito! que ilusão nos arrebata!
ela e eu, não vamos ser um só, em breve, parece? mas esse em breve nunca chega, e, após semanas de espera, esperança e alegria enganosa, me vejo de repente, um dia, mais sozinho do que jamais estivera.
após cada beijo, após cada abraço, o isolamento se amplia. e como é desolador, aterrador.
um poeta, m. sully prudhomme, não escreveu:
os carinhos são apenas inquietantes transportes,
ensaios infrutíferos do pobre amor que tenta
a impossível união das almas pelos corpos...
e",1
"prélude …
donnons nous l’envie,
l’ envie de nous découvrir,
de nous désirer, de nous donner enfin.
ouvrons nous le cœur avant de commencer.
soyons l’envie de l’autre, dans l’écoute et dans les mots.
quoi de plus beau, de plus excitant, q‘un baiser accompagné d’une âme bien aimée ?
quoi de plus vibrant, de plus désiré, q’un câlin sorti de la fusion de nos âmes entrelacées ?
puis, sans crainte, sans aucune réticence, nos cœurs couronnés, nous âmes avides, nos corps suivent en symbiose … l’union parfaite, un seul corps, donnant ainsi à tout jamais, l’envie de suivre à deux, dans une alliance harmonieuse, pour une vie pleine d’amour.
cela serait un rêve, d’une maturité remplie d’ardeur…
heureux celui qu’arrive la garder auprès de soi, pour satisfaire tous ses désirs :
des mots et de l’écoute,
des regards et de la présence,
des baisers et encore des baisers,
et des sourires et des larmes.
l’important c’est d’être ensemble, ne se quitter, que pour mourir… et peut-être, qu’au-delà, se retrouver, si dieu le veut …","preludio …
demo-nos o desejo,
o desejo de nos descobrir, de nos desejar,
de nos dar-mos enfim.
abramo-nos o coração antes de começar.
sejamos o desejo do outro na escuta e nas palavras.
que existe de mais belo, de mais excitante,
que um beijo acompanhado de uma alma querida?
que existe de mais vibrante, de mais desejado,
que um carinho saido da fusão, de nossas almas entrelaçadas ?
depois sem mêdo, sem nenhuma reticencia, nossos corações coroados, nossas almas avidas,
nossos corpos seguem, em simbiose … a união perfeita, un so corpo, dando assim, para sempre, o desejo de seguir a dois numa aliança harmoniosa,
para uma vida cheia de amor.
isto seria um sonho, de uma maturidade repleta de ardor …
feliz aquele que consegue guarda-la junto a si para satisfazer todos seus desejos :
de palavras, de escuta,
de olhares e de presença,
de beijos e mais beijos,
e de sorrisos e de lágrimas.
o importante é estar juntos, se separar, so para morrer …
e talvez que, no além, se reencontrar, si deus quiser…",fr_XX,pt_XX,"prelúdio...
deixemo-nos levar,
levar-nos a descobrir,
a desejar-nos, a finalmente nos dar.
abramos o coração antes de começar.
sejamos a vontade um do outro, na escuta e nas palavras.
o que há de mais belo, de mais excitante, do que um beijo acompanhado de uma alma amada?
o que há de mais vibrante, de mais desejado, do que um abraço surgido da fusão de nossas almas entrelaçadas?
então, sem medo, sem qualquer reticência, nossos corações coroados, nossas almas ávidas, nossos corpos seguem em simbiose... a união perfeita, um só corpo, dando assim para sempre, a vontade de seguir a dois, em uma aliança harmoniosa, para uma vida cheia de amor.
isso seria um sonho, de uma maturidade repleta de ardor...
feliz aquele que consegue mantê-lo consigo, para satisfazer todos os seus desejos:
de palavras e escuta,
de olhares e presença,
de beijos e mais beijos,
e de sorrisos e lágrimas.
o importante é estar juntos, não se separar, senão para morrer... e talvez, além disso, reencontrar-se, se Deus assim o quiser...",1
