original_poem,translated_poem,src_lang,tgt_lang,translated_by_TA,topic
"j’ai cru pouvoir briser la profondeur l’immensité
par mon chagrin tout nu sans contact sans écho
je me suis étendu dans ma prison aux portes vierges
comme un mort raisonnable qui a su mourir
un mort non couronné sinon de son néant
je me suis étendu sur les vagues absurdes
du poison absorbé par amour de la cendre
la solitude m’a semblé plus vive que le sang
je voulais désunir la vie
je voulais partager la mort avec la mort
rendre mon cœur au vide et le vide à la vie
tout effacer qu’il n’y ait rien ni vitre ni buée
ni rien devant ni rien derrière rien entier
j’avais éliminé le glaçon des mains jointes
j’avais éliminé l’hivernale ossature
du vœu qui s’annule
tu es venue le feu s’est alors ranimé
l’ombre a cédé le froid d’en bas s’est étoilé
et la terre s’est recouverte
de ta chair claire et je me suis senti léger
tu es venue la solitude était vaincue
j’avais un guide sur la terre je savais
me diriger je me savais démesuré
j’avançais je gagnais de l’espace et du temps
j’allais vers toi j’allais sans fin vers la lumière
la vie avait un corps l’espoir tendait sa voile
le sommeil ruisselait de rêves et la nuit
promettait à l’aurore des regards confiants
les rayons de tes bras entrouvraient le brouillard
ta bouche était mouillée des premières rosées
le repos ébloui remplaçait la fatigue
et j’adorais l’amour comme à mes premiers jours
les champs sont labourés les usines rayonnent
et le blé fait son nid dans une houle énorme
la moisson la vendange ont des témoins sans nombre
rien n’est simple ni singulier
la mer est dans les yeux du ciel ou de la nuit
la forêt donne aux arbres la sécurité
et les murs des maisons ont une peau commune
et les routes toujours se croisent.
les hommes sont faits pour s’entendre
pour se comprendre pour s’aimer
ont des enfants qui deviendront pères des hommes
ont des enfants sans feu ni lieu
qui réinventeront les hommes
et la nature et leur patrie
celle de tous les hommes
celle de tous les temps.","julguei que podia quebrar a profundeza a
[imensidade
com o meu desgosto nu sem contacto sem eco
estendi-me na minha prisão de portas virgens
como um morto razoável que soube morrer
um morto cercado apenas pelo seu nada
estendi-me sobre as vagas absurdas
do veneno absorvido por amor da cinza
a solidão pareceu-me mais viva que o sangue
queria desunir a vida
queria partilhar a morte com a morte
entregar meu coração ao vazio e o vazio à vida
apagar tudo que nada houvesse nem o vidro
[nem o orvalho
nada nem à frente nem atrás nada inteiro
havia eliminado o gelo das mãos postas
havia eliminado a invernal ossatura
do voto de viver que se anula
tu vieste o fogo então reanimou-se
a sombra cedeu o frio de baixo iluminou-se de
[estrelas
e a terra cobriu-se
da tua carne clara e eu senti-me leve
vieste a solidão fora vencida
eu tinha um guia na terra
sabia conduzir-me sabia-me desmedido
avançava ganhava espaço e tempo
caminhava para ti dirigia-me incessantemente
[para a luz
a vida tinha um corpo a esperança desfraldava
[as suas velas
o sono transbordava de sonhos e a noite
prometia à aurora olhares confiantes
os raios dos teus braços entreabriam o nevoeiro
a tua boca estava húmida dos primeiros orvalhos
o repouso deslumbrado substituía a fadiga
e eu adorava o amor como nos meus primeiros
[tempos
os campos estão lavrados as fábricas irradiam
e o trigo faz o seu ninho numa vaga enorme
a seara e a vindima têm inúmeras testemunhas
nada é simples nem singular
o mar espelha-se nos olhos do céu ou da noite
a floresta dá segurança às árvores
e as paredes das casas têm uma pele comum
e as estradas cruzam-se sempre
os homens nasceram para se entenderem
para se compreenderem para se amarem
têm filhos que se tornarão pais dos homens
têm filhos sem eira nem beira
que hão-de reinventar o fogo
que hão-de reinventar os homens
e a natureza e a sua pátria
a de todos os homens
a de todos os tempos.",fr_XX,pt_XX,"Eu pensei que poderia quebrar a profundidade a imensidão
pela minha tristeza nua sem contato sem eco
me deitei na minha prisão com portas virgens
como um morto razoável que soube morrer
um morto não coroado exceto por seu nada
me deitei nas ondas absurdas
do veneno absorvido por amor à cinza
a solidão me pareceu mais viva que o sangue
eu queria desunir a vida
eu queria compartilhar a morte com a morte
devolver meu coração ao vazio e o vazio à vida
apagar tudo para que não haja nada nem vidro nem embaçamento
nada à frente nem nada atrás, nada inteiro
eu tinha eliminado o cubo de gelo das mãos unidas
eu tinha eliminado a ossatura invernal
do desejo que se anula
você veio o fogo então se reacendeu
a sombra cedeu o frio de baixo se estrelou
e a terra se cobriu
com tua carne clara e eu me senti leve
você veio a solidão foi vencida
eu tinha um guia na terra eu sabia
me orientar eu me sentia grande
eu avançava eu ganhava espaço e tempo
ia em tua direção ia sem fim em direção à luz
a vida tinha um corpo a esperança estendia sua vela
o sono escorria de sonhos e a noite
prometia à aurora olhares confiantes
os raios de seus braços rompiam a névoa
tua boca estava molhada com o orvalho
o descanso cegante substituía o cansaço
e eu adorava o amor como nos meus primeiros dias
os campos são arados as fábricas irradiam
e o trigo faz seu ninho em uma onda enorme
a colheita a vindima têm testemunhas sem número
nada é simples nem singular
o mar está nos olhos do céu ou da noite
a floresta dá segurança às árvores
e as paredes das casas têm uma pele comum
e as estradas sempre se cruzam.
os homens são feitos para se entender
para se compreender para se amarem
têm filhos que se tornarão pais de homens
têm filhos sem fogo nem lugar
que reinventarão os homens
e a natureza e sua pátria
a de todos os homens
a de todos os tempos.",1
"qu’est ce que tu m’as dit encore, en me quittant:
que’l on ne s’aimait plus? …mais si, mais si, on s’aime!
tu as pleure? tu seras donc toujours la meme?
mais puisque je te dis qu’on s’aime! tu m’entends?
sois donc plus simple! il faut toujours que tu compliques
les choses! dis-toi donc qu à notre epoque, enfin,
cela devient par trop poncif et ridicule,
sous pretexte qu’on est des amants un peu fins,
d’ecrire amour et coeur avec des majuscules.
nous employons des mots qui servent a rien,
et qui sont tres génants..et dangereux! on pose!
on dit: mon coeur , notre coeur… on y tient.
je te jure que’l on s’en passerait tres bien,
et que ce la simplifierait beaucoup les choses.
il n y a pas nos coeurs: il y a toi et moi, oui, toi et moi,
qui n’avons rien d’extraordinaire.
mais on se grise avec des mots, on s’exagere
l’importance de tout, et puis on s’aperçoit
que la realite n’est pas a la hauteur…
je t’en supplie, laissons mon coeur, laissons ton coeur!
soyons nous!… eh! bien, oui, c’est vrai, quand on se voit,
on n’est plus tres troublé.. c’est moins bien qu’autrefois.
tu ne t’affoles pas.. moi non plus. eh bien, quoi?
il n y a là rien de bien tragique. nous sommes
un peu calmés? mais c’est tout naturel, cela.
c’est l’habitude. on est habitué. voilà.
si nous nous retrouvons sans passion, en somme,
chaq un de nous s’ennuie quand l’autre n’est plus là.
on se croit malheureux, on n’a de gout à rien,
on se sent seul … eh ! bien, mais c’est deja tres bien!","que foi que você disse, há pouco, ao despedir-se?
que nós não nos gostamos mais?… gostamos, sim!
você chorou? por que você há de ser assim?…
mas se eu digo que sim! não ouviu o que eu disse?…
seja mais simples, mais humana! não complique
as coisas! hoje em dia, entenda bem, já são
ridículas demais essas preocupações
de se escrever, sob pretexto de ser “chic”,
com maiúsculas só, amor e coração.
usamos expressões inúteis, expressões
que atrapalham até… nós dizemos: o meu,
o nosso coração… e fazemos questão.
se a gente não tivesse essa preocupação,
simplificava muito as coisas, compreendeu?
não existe o que é nosso: existe eu e você.
sim, um eu e um você sem nada de especial.
a gente embriaga-se de frases afinal,
e vive exagerando tudo, para quê?
se a realidade nunca alcança uma ilusão…
por favor, deixe o seu, deixe o meu coração!
vamos ser nós, só nós!… sim, é verdade, agora,
quando a gente se vê, já não é como outrora,
não se embaraça mais… mas é assim mesmo… o quê?
mas não há nada, aí, de trágico! você
e eu estamos mais calmos só. é natural.
é o hábito. nós já nos habituamos. e,
se é sem paixão que nós nos vemos, cada qual,
quando o outro não está, sente-se mal, tão mal,
e aborrece-se, e sofre muito, e fica tão
desgraçado… mas isto é alguma coisa, então!",fr_XX,pt_XX,"O que é que me disseste outra vez, ao me deixar:
que já não nos amávamos? ...mas sim, mas sim, amamo-nos!
Choraste? Serás então sempre a mesma?
Mas se te digo que nos amamos! Ouves-me?
Sê mais simples então! É sempre necessário que compliques
as coisas! Diz a ti mesma que na nossa época, afinal,
torna-se excessivamente banal e ridículo,
sob pretexto de sermos amantes um pouco refinados,
escrever amor e coração com maiúsculas.
Usamos palavras que não servem para nada,
e que são muito embaraçosas... e perigosas! Posamos!
Dizemos: meu coração, nosso coração... importamo-nos.
Juro-te que nos passaríamos muito bem sem eles,
e que simplificaria muito as coisas.
Não há os nossos corações: há tu e eu, sim, tu e eu,
que não somos nada de extraordinário.
Mas embriagamo-nos com palavras, exageramos
a importância de tudo, e depois percebemos
que a realidade não está à altura...
Peço-te, deixemos o meu coração, deixemos o teu coração!
Sejamos nós!... Pois bem, sim, é verdade, quando nos vemos,
já não ficamos muito perturbados... é menos bom do que antigamente.
Tu não te afliges... eu também não. Pois bem, e então?
Não há nada de muito trágico nisso. Somos
um pouco acalmados? Mas é tudo muito natural, isso.
É o hábito. Estamos habituados. É isso.
Se nos reencontramos sem paixão, afinal,
cada um de nós aborrece-se quando o outro não está.
Pensamos que somos infelizes, não temos gosto em nada,
sentimo-nos sós... Pois bem, mas já é muito bom!",1
"au fond, vois-tu, mon erreur,
ma grande folie,
c’est d’avoir charge ton coeur
de tout le poids de ma vie.
le jours où l’on s’est aimé,
j’ai cru qu’en ce coeur offert
j’allais pouvoir enfermer
tout mon univers.
c’est de cette erreur profonde
que maintenant nous souffrons.
on ne fait pas tenir le monde
derrière un front.
ton coeur est tendre et sincère,
ardent et soumis.
mais, tout seul, pouvait-il faire
que je me passe de ma mère
et de me amis?","afinal, meu gesto doido,
meu erro, querida,
foi ter posto em você
todo o peso da minha vida.
ao começar este amor
num coração tão diverso do meu
pensei poder pôr
todo o meu universo.
e é desse erro tão profundo
que vamos sofrendo então.
não se pode pôr um mundo
sobre um coração.
o seu coração é sincero,
ardente comigo
mas, só, será suficiente
para afastar-me dos parentes
e dos meus amigos?",fr_XX,pt_XX,"No fundo, vês tu, meu erro,
minha grande loucura,
foi ter carregado teu coração
com todo o peso da minha vida.
O dia em que nos amamos,
acreditei que neste coração oferecido
poderia aprisionar
todo o meu universo.
É por este profundo erro
que agora sofremos.
Não se pode conter o mundo
atrás de uma fronte.
Teu coração é terno e sincero,
ardente e submisso.
Mas, sozinho, poderia ele fazer
com que eu dispensasse minha mãe
e meus amigos?",1
"ne soyons pas trop exigeants:
le bonheur n’est pas accessible
à toutes les sortes de gens.
il faudrait être moins sensible,
ou bien avoir beaucoup d’argent…
ne demandons pas l’impossible.
nous devons nous trouver contents
d’être les êtres que nous sommes:
des amoureux intermittents
qui sont fous l’un de l’autre en somme
de temps en temps.
c’est déja beaucoup d’être deux,
deux côte à cote sur la terre,
qui peuvent souffrir entre eux
et vivre sans trop se taire.
et si l’on est plus exigeant,
si l’on se sent en y songeant
l’âme encor trop célibataire,
c’est qu’on a mauvais caractère…
ou qu’on est trop intelligent.","não sejamos muito exigentes:
nem sempre a sorte é acessível
a todo mundo, a toda a gente.
ela é só dos menos sensíveis,
ou dos ricos, naturalmente…
não desejemos o impossível.
devemos estar contentes
de ser quem somos:
simplesmente namorados intermitentes
loucamente se namorando
de vez em quando.
é já uma grande cousa a gente
ser dois, à parte, entre os mortais,
dois que se bastam mutuamente
e não se aborrecem demais.
e somos mais exigentes,
se às vezes a alma ainda se sente
solteira e triste, isso é explicável:
temos um gênio insuportável…
ou somos muito inteligentes.",fr_XX,pt_XX,"Não sejamos muito exigentes:
a felicidade não é acessível
a todos os tipos de pessoas.
Seria necessário ser menos sensível,
ou ter muito dinheiro...
não exijamos o impossível.
Devemos nos sentir contentes
por ser os seres que somos:
amantes intermitentes
que são loucos um pelo outro,
de vez em quando.
Já é muito ser dois,
dois lado a lado na terra,
que podem sofrer juntos
e viver sem se calar muito.
E se formos mais exigentes,
se nos sentimos ao pensar nisso
ainda muito solitários,
é porque temos um mau caráter...
ou somos muito inteligentes.",1
"ce n’est pas juste enfin! moi je suis trop sensible.
quand tu m’as fait du mal, je tente bien parfois
de te le rendre. mais ça n’est jamais possible!
je souffre toujours plus que toi.
toi, tu sais supporter les longues bouderies,
les regards durs et lês silences obstines…
ah! ne sois pas méchante avec moi, ma chérie!
j’ai trop de chagrin quand j’em ai…
… mais je suis fou! n’écoute pas! je te confesse
naïvement de dangereuses vérités…
tu sais à présent ma faiblesse:
tu vas peut-être em profiter…","mas isso não é justo! eu sou muito sensível…
qualquer maldade que você me faça e que eu tente
retribuir, não consigo, é impossível!
eu sofro mais do que você.
você suporta bem os acintes sem fim,
os silêncios ruins e os olhares brutais…
mas não seja cruel, tenha pena de mim!
quando eu sofro, eu sofro demais…
… mas, não! não ouça! eu confessei
ingênuo e fraco, uma cousa que eu não devia confessar…
você sabe agora o meu fraco:
e vai talvez se aproveitar…",fr_XX,pt_XX,"Isso não é justo afinal! Eu sou muito sensível.
Quando você me machuca, eu tento às vezes
te machucar de volta. Mas isso nunca é possível!
Eu sofro sempre mais do que você.
Você sabe suportar os longos ressentimentos,
os olhares duros e os silêncios obstinados...
Ah! Não seja má comigo, meu querido!
Eu sofro tanto quando estou...
... mas estou louco! Não escute! Eu confesso
ingenuamente perigosas verdades...
Agora você conhece a minha fraqueza:
você talvez vá se aproveitar dela...",1
"on aime d’abord par hasard,
par jeu, par curiosité,
pour avoir dans um regard
lu des possibilites.
et puis comme au fond soi-même
on s’aime beaucoup,
se quelqu’un vous aime, on l’aime
par conformité de goût.
on se rend grâce, on s’invite
à partager ses moindres maux.
on prend l’habitude, vite,
d’échanger de petits mots.
quand on a longtemps dit les mêmes,
on les redit sans y penser.
et alors, mon dieu, l’on aime
parce qu’on a commencé.","a gente começa a amar,
por simples curiosidade,
por ter lido num olhar
certa possibilidade.
e como, no fundo, a gente
se quer muito bem,
ama quem ama somente
pelo gosto igual que tem.
pelo amor de amar começa
a repartir dor por dor.
e se habitua depressa,
a trocar frases de amor.
e, sem pensar, vai falando,
de novo as que já falou.
e então continua amando
só porque já começou.",fr_XX,pt_XX,"Amar-se-á, primeiramente, por acaso,
por brincadeira, por curiosidade,
por ter, num olhar, encontrado
possibilidades.
E depois, como no fundo de si mesmo,
se gosta muito,
se alguém nos ama, o ama-se
por afinidade de gostos.
Agradece-se um ao outro, convida-se
a partilhar os menores males.
Adquire-se rapidamente o hábito
de trocar pequenas palavras.
Quando se diz por muito tempo as mesmas coisas,
repetem-se sem pensar.
E então, meu Deus, ama-se
porque se começou.",1
"ah! je vous aime! je vous aime!
vous entendez? je suis fou de vous. je suis fou…
je dis des moi, toujours lês mêmes…
mais je vous aime! je vous aime! …
je vous aime, comprenez-vous?
vous riez? j’ai l’air stupide?
mais comment faire alors pour que tu saches bien,
pour que tu sentes bien? ce qu’on dit, c’est si vide!
je cherche, je cherche un moyen…
ce n’est pas vrai que les baisers peuvent suffire.
quelque chose m’étouffe, ici, comme un sanglot.
j’ai besoin d’exprimer, d’expliquer, de traduire.
on ne sent tout à fait que ce qu’on a su dire.
on vit plus ou moins à travers des mots.
j’ai besoin de mots, d’analyses.
il faut, il faut que je te dise…
il faut que tu saches… mais quoi!
si je savais trouver des choses de poète,
en dirais-je plus – résponds-moi –
que lorsque je te tiens ainsi, petite tête,
et que cent fois et mille fois
je te répète éperdument et te répète:
toi! toi! toi! toi!","eu gosto, gosto de você
compreende?
eu tenho por você uma doidice…
falo, falo, nem sei o que
mas gosto, gosto de você
você ouviu bem isso que eu disse? …
você ri? eu pareço um louco?
mas, que fazer para explicar isso direito,
para que você sinta? …
o que eu digo é tão oco!
eu procuro, procuro um jeito…
não é exato que o beijo só pode bastar.
qualquer cousa que me afoga, entre soluço e ais.
é preciso exprimir, traduzir, explicar…
ninguém sente senão o que soube falar.
vive-se de palavras, nada mais.
mas é preciso que eu consiga
essas palavras e que eu diga,
e você saiba… mas, o que?
se eu soubesse falar
como um poeta que sente,
diria eu mais do que
quando tomo entre as mãos
essa cabeça linda
e cem mil vezes, loucamente,
digo e repito
e torno a repetir ainda:
você! você! você! você!",fr_XX,pt_XX,"ah! eu te amo! eu te amo!
Você entende? Estou louco por você. Estou louco...
Digo as mesmas coisas, sempre...
Mas eu te amo! Eu te amo! ...
Eu te amo, você entende?
Você está rindo? Pareço idiota?
Mas como fazer então para que você saiba bem,
Para que você sinta bem? O que se diz, é tão vazio!
Estou procurando, procurando um jeito...
Não é verdade que beijos possam bastar.
Algo me sufoca aqui, como um soluço.
Preciso expressar, explicar, traduzir.
Sente-se completamente apenas o que se soube dizer.
Vivemos mais ou menos através das palavras.
Preciso de palavras, de análises.
É preciso, é preciso que eu te diga...
É preciso que você saiba... mas o quê!
Se eu soubesse encontrar coisas de poeta,
Diria mais - me responda -
Do que quando te seguro assim, pequena cabeça,
E cem vezes e mil vezes
Te repito loucamente e te repito:
Você! Você! Você! Você!",1
"je sais bien qu’irritable, exigeant et morose,
insatisfait, jaloux, malheureux pour un mot,
je te cherche souvent des querelles sans cause
si je t’aime si mal, c’est que je t’aime trop.
je te poursuis. je te tourmente. je te gronde…
tu serais plus heureuse, et mieux aimée aussi,
si tu n’étais pour moi tout ce qui compte au monde,
et si ce pauvre amour n’était mon seul souci.","eu bem sei que, ciumento, exigente, impulsivo, irritado,
infeliz por cousas tão banais,
eu vivo a provocar discussões sem motivo…
mas eu amo tão mal porque eu amo demais.
e atormento você, e persigo…
você havia de ser melhor amada e mais feliz também,
se não fosse você a minha única alegria,
e se este amor não fosse o meu único bem.",fr_XX,pt_XX,"Eu sei que sou irritável, exigente e mal-humorado,
insatisfeito, ciumento, infeliz por um simples motivo,
muitas vezes te provoco brigas sem razão,
se te amo tão mal, é porque te amo demais.
Eu te persigo. Eu te atormento. Eu te repreendo...
tu serias mais feliz, e também mais amada,
se não fosses para mim tudo o que importa no mundo,
e se este pobre amor não fosse minha única preocupação.",1
"et pourtant, nous pouvions ne jamais nous connaitre!
mon amour, imaginez-vous
tout ce que le sort dut permettre
pour qu’on soit là, qu’on s’aime, et pour que ce soit nous?
tu dis: “nous étions nés l’un pour l’autre.” mais pense
à ce qu’il dut falloir de chances, de concours,
de causes, de coïncidences,
pour réaliser ça, simplement, notre amour!
songe qu’avant d’unir nos têtes vagabondes,
nous avons vécu seuls, separes, égarés,
et que c’est long, le temps, et que c’est grand, le monde,
et que nous aurions pu ne pas nous rencontrer.
as-tu jamais pense, ma jolie aventure,
aux dangers que courut notre pauvre bonheur
quand l’um vers l’autre, au fond de l’infinie nature,
mystérieusement gravitaient nos deux coeurs?
sais-tu que cette course était bien incertaine
qui vers un soir nous conduisait,
et qu’un caprice, une migraine,
pouvaient nous écarter l’un de l’autre à jamais?
je ne t’ai jamais dit cette chose inouïe:
lorsque je t’aperçus pour la première fois,
je ne vis pás d’abord que tu étais jolie.
je pris à peine garde à toi.
ton amie m’occupait bien plus, avec son rire.
c’est tard, très tard, que nos regards se sont croisés.
songe, nous aurions pu ne pas savoir y lire,
et toi ne pas comprendre, et moi ne pas oser.
où serions-nous oe soir si, ce soir-là, ta mère
t’avait reprise um peu plus tôt?
et si tu n’avais pas rougi, sous les lumières,
quand voulus t’aider à mettre ton manteau?
car souviens-toi, ce furent là toutes les causes.
un retard, um empêchement,
et rien n’aurait été du cher enivrement,
de l’exquise métamorphose!
notre amour aurait pu ne jamais advenir!
tu pourrais aujourd hui n’être pas dans ma vie!…
mon petit coeur, mon coeur, ma petite chérie,
je pense à cette maladie
dont vous avez failli mourir…","podíamos jamais nos conhecer talvez!
meu amor, imagine, pois,
tudo isso que a sorte nos fez
para estarmos aqui, para sermos nós dois!
nós fomos feitos um para o outro – diz você.
mas pense no que foi preciso se interpor
de coincidências, para que
pudesse haver apenas isto: o nosso amor!
que antes de unir nosso destino vagabundo,
vivemos longe um do outro, e sós, separados,
e que é tão longo o tempo, e que é tão grande o mundo,
e a gente era capaz de não se ter encontrado.
você nunca pensou, meu romance bonito,
e que este amor correu de risco e indecisões
quando, ao encontro um do outro, em torno do infinito,
gravitaram à toa os nossos corações?
você não sabe então que era incerta essa estrada
que conduziu nossos ideais,
e que um capricho, um quase nada
podia não ter nos juntado nunca mais?
nunca lhe confessei esta coisa esquisita:
quando visitei você pela primeira vez,
a princípio nem vi que você era bonita…
não reparei quase em você.
sua amiga me atraiu muito mais, com seu sorriso.
foi só muito depois que cruzamos o olhar…
nós podíamos não ter lido nada disso:
e você, não compreender, e eu, nem sequer ousar.
que seria de nós se, aquela noite, alguém
viesse buscar você antes?
ou se, entre luzes, você não corasse também
quando eu quis ajudar a pôr o seu manteau?…
pois foram essas razões, lembra-se ainda?
um atraso, um impedimento,
e nada existiria deste encantamento,
desta metamorfose linda!
nunca aconteceria o amor que aconteceu!
você não estaria agora em minha vida!…
meu coração, meu coração, minha querida,
penso naquela doença
que você quase morreu…",fr_XX,pt_XX,"e no entanto, poderíamos nunca ter nos conhecido!
meu amor, imagine
tudo o que o destino teve que permitir
para que estivéssemos aqui, nos amando, e para que fossemos nós?
Tu dizes: ""nascemos um para o outro"". Mas pense
em toda a sorte de chances, eventos,
causas, coincidências,
para que isso se tornasse real, simplesmente, nosso amor!
Pense que antes de unirmos nossas mentes errantes,
vivíamos sozinhos, separados, perdidos,
e que o tempo é longo, e o mundo é grande,
e poderíamos não ter nos encontrado.
Já pensaste, minha bela aventura,
nos perigos que nossa pobre felicidade enfrentou
quando um em direção ao outro, no fundo da natureza infinita,
nossos dois corações misteriosamente gravitavam?
Sabias que essa corrida era tão incerta
que nos conduzia a uma noite,
e que um capricho, uma enxaqueca,
poderiam nos separar para sempre?
Nunca te disse essa coisa incrível:
quando te vi pela primeira vez,
nem notei que eras bonita.
Apenas reparei em ti.
Sua amiga me distraía muito mais, com seu riso.
Foi tarde, muito tarde, que nossos olhares se cruzaram.
Pensa, poderíamos não ter sabido ler neles,
e tu não ter compreendido, e eu não ter ousado.
Onde estaríamos naquela noite se, naquela noite, tua mãe
te tivesse levado um pouco mais cedo?
E se tu não tivesses corado, sob as luzes,
quando quis te ajudar a colocar teu casaco?
Pois lembra-te, essas foram todas as causas.
Um atraso, um impedimento,
e nada teria acontecido desse querido encantamento,
desse êxtase exquisito!
Nosso amor poderia nunca ter acontecido!
Tu poderias hoje não estar na minha vida!...
Meu pequeno coração, meu coração, minha pequena querida,
penso nessa doença
da qual quase morreste...",1
