original_poem,translated_poem,src_lang,tgt_lang,translated_by_TA,topic
"isto dizendo, manda os diligentes
ministros amostrar as armaduras:
vêm arneses, e peitos reluzentes,
malhas finas, e lâminas seguras,
escudos de pinturas diferentes,
pelouros, espingardas de aço puras,
arcos, e sagitíferas aljavas,
partazanas agudas, chuças bravas:
as bombas vêm de fogo, e juntamente
as panelas sulfúreas, tão danosas;
porém aos de vulcano não consente
que deem fogo às bombardas temerosas;
porque o generoso ânimo e valente,
entre gentes tão poucas e medrosas,
não mostra quanto pode, e com razão,
que é fraqueza entre ovelhas ser leão.","il dit: el cent marins, comme aux jours des batailles,
de ses brillants faisceaux dépouillent l'arsenal,
on montre les harnais et les cottes de mailles,
les flexibles cuissards, les brassards de métal,
les casques reluisants, les pesantes cuirasses,
les piques d’abordage et les mousquets d’acier,
la perluisane et l’arc, les redoutables masses,
les écus à blasons, et le rond bouclier.
on apporte l’obus, les bombes meurtrières,
les projectiles pleins et de fer et de poix,
mais pourtant de vulcain, les desservants austères
des mortiers ne font point tonner les grandes voix.
il n’appartient jamais au noble et vrai courage,
quand il se trouve auprès des faibles, des petits,
de faire de sa force un pompeux étalage,
et se montrer un lion au milieu des brebis.",pt_XX,fr_XX,"Cela dit, ordonne aux diligents
ministres de montrer les armures:
arrivent les harnais, les poitrails brillants,
les mailles fines, et les lames sûres,
boucliers aux peintures variées,
balles, fusils en acier pur,
arcs, et carquois de flèches,
hallebardes aiguisées, lances féroces:
les bombes arrivent en feu, et aussi
les marmites soufrées, si nuisibles;
mais aux hommes de Vulcain il n'est pas permis
de mettre le feu aux terribles bombes;
car l'âme généreuse et vaillante,
parmi des gens si peu nombreux et craintifs,
ne montre pas tout son pouvoir, à juste titre,
car c'est de la faiblesse d'être un lion parmi les brebis.",1
"pilotos lhe pedia o capitão,
por quem pudesse à índia ser levado;
diz-lhe que o largo prémio levarão
do trabalho que nisso for tomado.
promete-lhos o mouro, com tenção
de peito venenoso, e tão danado,
que a morte, se pudesse, neste dia,
em lugar de pilotos lhe daria.","ce que voulait surtout l’illustre capitaine,
c’était qu’ils fissent choix d'un bon pilote cnlr'eux
pour le guider vers l’inde; il promet que sa peine
sera récompensée au delà de ses vœux.
le maure accède à tout: mais dans le but damnablc
de les sacrifier, el de leur faire tort,
el désirerait bien si c’était praticable,
leur envoyer au lieu d'un pilote... la mort.",pt_XX,fr_XX,"Les pilotes lui demandaient le capitaine,
Par qui ils pourraient être amenés en Inde ;
Il leur dit qu'ils recevront une grande récompense
Pour le travail qui sera accompli.
Le Maure leur promet, avec l'intention
D'un cœur empoisonné, si maudit,
Que s'il le pouvait, ce jour-là,
Au lieu des pilotes, il donnerait la mort.",1
"partiu-se disto enfim co'a companhia,
das naus o falso mouro despedido,
com enganosa e grande cortesia,
com gesto ledo a todos, e fingido.
cortaram os batéis a curta via
das águas de netuno, e recebido
na terra do obsequente ajuntamento
se foi o mouro ao cógnito aposento.","le traître maure enfin termine sa visite;
il part avec ses gens; ses adieux animés,
ses protestations, sa ferveur hypocrite,
baissent en sa faveur tous les esprits charmés.
les canots ont bientôt des ondes de neptune,
franchi le court trajet. le cheik à son retour
du peuple curieux est reçu sur la dune,
mais sans proférer mot, il gagne son séjour.",pt_XX,fr_XX,"Il s'en est finalement allé avec la compagnie,
Du navire, le faux Maure a pris congé,
Avec une fausse et grande courtoisie,
Avec un sourire feint pour tous.
Les canots ont coupé court le chemin
Des eaux de Neptune, et arrivé
Sur la terre de l'assemblée obligeante,
Le Maure s'est rendu dans sa chambre connue.",1
"do claro assento etéreo o grão tebano,
que da paternal coxa foi nascido,
olhando o ajuntamento lusitano
ao mouro ser molesto e avorrecido,
no pensamento cuida um falso engano,
com que seja de todo destruído.
e enquanto isto só na alma imaginava,
consigo estas palavras praticava:
está do fado já determinado,
que tamanhas vitórias, tão famosas,
hajam os portugueses alcançado
das indianas gentes belicosas.
e eu só, filho do padre sublimado,
com tantas qualidades generosas,
hei de sofrer que o fado favoreça
outrem, por quem meu nome se escureça?","le thebain immortel qui reçut la lumière
en sortant d'une cuisse, ayant du haut des cieux
vu que des portugais l’entreprise guerrière,
excitait le courroux du païen odieux,
imagine aussitôt quelle serait la voie,
de mettre sa malice et sa haine à profil,
et tandis que sans honte il est ainsi la proie
d'envieuses passions, en lui-même il se dit:
«il paraît que le sort en son caprice ordonne,
«que ces fiers lusitains, partout victorieux,
« imposeront leur joug, et la loi de bellone
«sur les peuples de l'inde aguerris et nombreux.
«et moi, fils d un père, entre les dieux auguste,
«qui de litres si grands puis me glorifier,
«tranquille, je verrais que le destin injuste
«elevé un nouveau nom qui doit m’humilier.",pt_XX,fr_XX,"De l'auguste trône céleste le grand thébain,
qui de la paternelle cuisse est né,
regardant l'assemblée portugaise
lorsque l'ennemi maure est gênant et ennuyeux,
dans sa pensée croit à une fausse tromperie,
par laquelle il doit être tout détruit.
et tandis qu'il imaginait cela seulement dans son âme,
il prononçait ces paroles en lui-même :
il est déjà déterminé par le destin,
que de si grandes victoires, si célèbres,
les Portugais ont remportées
sur les peuples guerriers des Indes.
et moi seul, fils du prêtre élevé,
avec tant de qualités généreuses,
je devrai supporter que le destin favorise
un autre, par qui mon nom s'obscurcira ?",1
"já quiseram os deuses que tivesse
o filho de filipo nesta parte
tanto poder, que tudo submetesse
debaixo de seu jugo o fero marte.
mas há-se de sofrer que o fado desse
a tão poucos tamanho esforço e arte,
que eu co'o grão macedónio, e o romano,
demos lugar ao nome lusitano?
não será assim, porque antes que chegado
seja este capitão, astutamente
lhe será tanto engano fabricados
que nunca veja as partes do oriente.
eu descerei à terra, e o indignado
peito revolverei da maura gente;
porque sempre por via irá direita
quem do oportuno tempo se aproveita.","«quad les dieux ont permis que le fils de philippe
«enchaînât l’univers à son char triomphal,
«j’ai gardé le silence, et l'inde participe
«aux triomphes sanglants de ce héros fatal ;
«mais qu'un peuple sans force et que rien ne renomme
«prétende partager d’aussi nobles destins,
«et qu’aux illustres noms de macédoine et rome,
«on veuille adjoindre encor le nom des lusitains;
«non, ce ne sera pas. je tendrai tant d’entraves,
«je les poursuivrai tant sur la terre et les eaux,
«que ces aventuriers, qu’on dit être si braves,
«seront heureux de fuir les bords orientaux.
«a terre, descendons; le maure encore hésite;
«soulevons sa fureur, son indignation,
«de ses projets toujours l’on voit la réussite,
«quand on sait à propos saisir l'occasion.»",pt_XX,fr_XX,"Les dieux ont voulu que le fils de Philippe ait
Tel pouvoir en cette région,
Que tout se soumette
Sous son joug, même le féroce Mars.
Mais le destin a décidé
De donner à si peu de gens tant de force et d'art,
Que moi, avec le grand Macédonien et le Romain,
Devrions-nous laisser la place au nom lusitanien ?
Ce ne sera pas le cas, car avant son arrivée,
Ce capitaine se verra astucieusement
Tellement trompé
Qu'il ne verra jamais les terres de l'Orient.
Je descendrai sur terre et,
Je bouleverserai le cœur indigné du peuple maure ;
Car toujours, il ira droit
Celui qui sait profiter du moment opportun.",1
"e sabe mais, lhe diz, como entendido
tenho destes cristãos sanguinolentos,
que quase todo o mar têm destruído
com roubos, com incêndios violentos;
e trazem já de longe engano urdido
contra nós; e que todos seus intentos
são para nos matarem e roubarem,
e mulheres e filhos cativarem.","«redoute tout, dit-il, de ces chrétiens infâmes,
«ils désolent les mers en terribles forbans,
«et partout où ils vont, les meurtres et les flammes
«accompagnent leurs pas. —contre les vrais croyants
«ils redoublent surtout leurs fureurs sacrilèges.
«si nous les souffrions en paix dans le pays,
«ils nous massacreraient ou nous tendraient des pièges
«pour enlever nos biens, nos femmes et nos fils.",pt_XX,fr_XX,"et sachez, lui dit-il, en tant qu'expert,
que j'ai de ces chrétiens sanguinaires
qui ont presque détruit tout la mer
par des vols, par des incendies violents ;
et ils apportent déjà de loin un piège
contre nous ; et que tous leurs desseins
sont de nous tuer et nous voler,
et capturer femmes et enfants.",1
"e também sei que tem determinado
de vir por água a terra muito cedo
o capitão dos seus acompanhado,
que da tensão danada nasce o medo.
tu deves de ir também co'os teus armado
esperá-lo em cilada, oculto e quedo;
porque, saindo a gente descuidada,
cairão facilmente na cilada.","demain au point du jour, ils descendront à terre
pour se pourvoir d’eau douce. outre les travailleurs
le commandant conduit sa suite militaire,
car les méchants toujours sont remplis de terreur;
postés en embuscade, attendons-les en armes,
sans se douter de rien qu’ils passent devant nous,
puis en se retirant, confiants et sans alarmes,
qu ils se trouvent cernés, et tombent sous nos coups.",pt_XX,fr_XX,"Et je sais aussi qu'il est déterminé
à venir par eau à terre très tôt
le capitaine de ses accompagnateurs,
que de la tension maudite naît la peur.
Toi aussi tu dois y aller avec tes armes,
l'attendre en embuscade, caché et calme;
car, en sortant négligemment,
ils tomberont facilement dans l'embuscade.",1
"e se inda não ficarem deste jeito
destruídos, ou mortos totalmente
eu tenho imaginado no conceito
outra manha e ardil, que te contente:
manda-lhe dar piloto, que de jeito
seja astuto no engano, e tão prudente,
que os leve aonde sejam destruídos,
desbaratados, mortos, ou perdidos.","«si ces maudits chrétiens ont la fortune extrême
«de ne pas être tous détruits dans le combat,
«j'ai conçu dans l’esprit un autre stratagème
«qui produira sans doute un heureux résultat.
«envoie leur un’pilote, expert en artifices,
«qui donne à leurs vaisseaux telle direction,
«que tout en ce berçant d’espérances factices,
«ils ne trouvent que mort et que destruction.»",pt_XX,fr_XX,"et s'ils ne restent pas de cette manière
détruits, ou complètement morts
j'ai imaginé dans le concept
un autre stratagème et ruse, qui te plaît :
fais-leur donner un pilote, qui de manière
soit astucieux dans la tromperie, et si prudent,
qu'il les mène là où ils seront détruits,
vaincus, morts, ou perdus.",1
"tanto que estas palavras acabou,
o mouro, nos tais casos sábio e velho,
os braços pelo colo lhe lançou,
agradecendo muito o tal conselho;
e logo nesse instante concertou
para a guerra o belígero aparelho,
para que ao português se lhe tornasse
em roxo sangue a água, que buscasse.","a ces mots qui flattaient ses inclinations basses,
le cheik, de trahisons digne appréciateur,
le serre entre ses bras, et lui rend mille grâces,
de trouver des moyens si bien suivant son cœur.
i our i attaque aussitôt il se met en mesures,
assigne à ses guerriers et leur poste et leur rang
dispose, ordonne tout, pour qu'en place d’eaux pures
les portugais surpris n'emportent que du sang",pt_XX,fr_XX,"Autant que ces paroles ont pris fin,
le Maure, dans ces cas sage et vieux,
lui a jeté les bras autour du cou,
remerciant beaucoup ce conseil ;
et à cet instant même, il a arrangé
l'attirail belliqueux pour la guerre,
afin que pour le Portugais il devienne
en sang pourpre l'eau qu'il chercherait.",1
"e busca mais, para o cuidado engano,
mouro, que por piloto à nau lhe mande,
sagaz, astuto, e sábio em todo o dano,
de quem fiar-se possa um feito grande.
diz-lhe que acompanhando o lusitano,
por tais costas e mares com ele ande,
que, se daqui escapar, que lá diante
vá cair onde nunca se alevante.","il cherche également pour le plan qu’il médite
un dévoué pilote, artificieux et fin,
oui vieilli dans la fourbe, ajuste droit mérite
l’honneur d’exécuter son perfide dessein.
il doit des portugais, accompagnant la route,
les faire en leur trajet, tellement dériver,
qu’ils devront prendre terre en des lieux où sans doute
ils tomberont enfin pour ne plus se lever.",pt_XX,fr_XX,"et cherche davantage, pour la ruse du soin,
maure, afin qu'il envoie un pilote au navire,
astucieux, rusé et sage en tout dommage,
en qui on puisse placer sa confiance pour une grande entreprise.
Dis-lui de suivre le Portugais,
de parcourir ces côtes et mers avec lui,
et que s'il échappe d'ici, là-bas
il aille tomber là où il ne se relèvera jamais.",1
"já o raio apolíneo visitava
os montes nabateos acendido,
quando o gama, c’os seus determinava
de vir por água a terra apercebido.
a gente nos batéis se concertava,
como se fosse o engano já sabido:
mas pode suspeitar-se facilmente,
que o coração pressago nunca mente.","a peine d’apollon l’éclatante lumière,
des monts nabathéens le faite illuminait
que gaina détermine une descente à terre,
pour aller se pourvoir de l’eau qui lui manquait.
les marins, à son ordre, ont armé les chaloupes,
ils portent avec eux leurs armes, leurs mousquets,
car le mot trahison a parcouru les groupes,
pressentiments du cœur qui ne mentent jamais.",pt_XX,fr_XX,"Alors que le rayon apollinien visitait
Les montagnes nabatéennes embrasées,
Quand Gamma, avec les siens, décidait
De venir par l'eau à terre préparé.
Les gens sur les bateaux se rangeaient,
Comme si l'erreur était déjà connue :
Mais on peut facilement soupçonner
Que le cœur présageur ne ment jamais.",1
"e mais também mandado tinha a terra,
de antes, pelo piloto necessário,
e foi-lhe respondido em som de guerra,
caso do que cuidava mui contrário;
por isto, e porque sabe quanto erra
quem se crê de seu pérfido adversário,
apercebido vai como podia,
em três batéis somente que trazia.","puis quand gama la veille, fit demander dans l'île,
le pilote promis dont il avait besoin,
certaine activité, et leur réponse hostile,
eveilla des soupçons dont il était bien loin.
se fier à la foi d'un ennemi perfide,
c’est commettre une erreur digne des insensés,
aussi fit-il armer une troupe intrépide,
trois embarcations les reçoivent pressés.",pt_XX,fr_XX,"et il avait aussi reçu des ordres de la terre,
auparavant, par le pilote nécessaire,
et lui fut répondu en sons de guerre,
contrairement à ce à quoi il pensait;
pour cela, et parce qu'il sait combien il se trompe
celui qui se croit de son adversaire perfide,
il se prépare comme il le peut,
avec seulement trois bateaux qu'il avait.",1
"mas os mouros que andavam pela praia,
por lhe defender a água desejada,
um de escudo embraçado e de azagaia,
outro de arco encurvado e seta ervada,
esperam que a guerreira gente saia,
outros muitos já postos em cilada.
e, porque o caso leve se lhe faça,
põem uns poucos diante por negaça,
andam pela ribeira alva, arenosa,
os belicosos mouros acenando
com a adarga e co'a hástia perigosa,
os fortes portugueses incitando.
não sofre muito a gente generosa
andar-lhe os cães os dentes amostrando.
qualquer em terra salta tão ligeiro,
que nenhum dizer pode que é primeiro.","les maures sont épars tout le long de la baie,
et leur air menaçant prouve leur trahison ;
l’un arme de massue et l’autre de zagaie,
ceux-ci d'arcs et de traits trempés dans le poison.
on pouvait croire encor qu’une sotte bravade
seule réunissait ces païens peu nombreux,
mais le gros de leurs corps postés en embuscade
m’attendait que l’instant de se montrer aux yeux.
déjà les plus hardis s’avançant sur les sables,
insultent les bateaux de gestes et de cris,
et brandissant en l’air leurs armes redoutables
paraissent délier les portugais aigris.
les hommes généreux n’ont pas pour l’ordinaire
de souffrir que les chiens leur montrent trop les dents,
aussi d’un même accord, tous s’élancent à terre,
on ne pourrait d’entr’eux citer les plus ardents.",pt_XX,fr_XX,"mais les Maures qui marchaient sur la plage,
pour défendre l'eau désirée,
un avec un bouclier embrassé et une lance,
l'autre avec un arc courbé et une flèche empoisonnée,
attendent que la guerrière sorte,
déjà beaucoup d'autres se cachent en embuscade.
Et, pour que l'affaire soit légère,
quelques-uns se mettent en avant pour nier,
les belliqueux Maures marchent
le long de la rive blanche et sablonneuse,
agitant leur bouclier et leur lance dangereuse,
incitant les forts Portugais.
La noble gente ne supporte pas
que les chiens leur montrent les dents.
Chacun saute si vite à terre,
qu'aucun ne peut dire qui est le premier.",1
"não se contenta a gente portuguesa,
mas seguindo a vitória estrui e mata;
a povoação, sem muro e sem defesa,
esbombardeia, acende e desbarata.
da cavalgada ao mouro já lhe pesa,
que bem cuidou comprá-la mais barata;
já blasfema da guerra, e maldizia,
o velho inerte, e a mãe que o filho cria.","les portugais sur eux chargent avec furie;
poursuivant leur victoire, ils poussent les fuyards,
et toujours massacrant, de leur artillerie
ils brûlent et foudroient leur cité sans remparts.
le maure vivement déjà pleure et regrette
de son aggression les fâcheux résultats,
et la mère emportant son enfant qu’elle allaite,
et l'inerte vieillard, blasphèment des combats.",pt_XX,fr_XX,"La population portugaise n'est pas satisfaite,
Mais suivant la victoire, détruit et tue ;
La ville, sans mur ni défense,
Est bombardée, incendiée et détruite.
De la chevauchée contre les Maures, elle est fatiguée,
Croyant bien l'acheter à moindre coût ;
Elle blasphème déjà la guerre et maudit,
Le vieil inerte et la mère qui élève son fils.",1
"fugindo, a seta o mouro vai tirando
sem força, de covarde e de apressado,
a pedra, o pau, e o canto arremessando;
dá-lhe armas o furor desatinado.
já a ilha e todo o mais desemparando,
a terra firme foge amedrontado;
passa e corta do mar o estreito braço,
que a ilha em torno cerca, em pouco espaço.","les ennemis fuyant décochaient en arrière
des flèches au hasard, et d’un bras incertain,
ils lancent le caillou, le bâton et la pierre,
tout ce qu’en leur fureur, ils trouvent sous la main.
dans leur course, de l’ile ils atteignent le terme,
mais toujours poursuivis, ils sautent dans les flots
et passant le détroit, ce n’est qu’en terre ferme,
qu’ils espèrent pouvoir respirer en repos.",pt_XX,fr_XX,"fuyant, la flèche l'homme maure enlevant
sans force, lâche et pressé,
la pierre, le bâton et le chant lançant;
la fureur démente lui donne des armes.
déjà l'île et tout le reste abandonnant,
la terre ferme s'enfuit effrayée;
il passe et coupe le bras du détroit de la mer,
qui entoure l'île en peu d'espace.",1
"uns vão nas almadias carregadas,
um corta o mar a nado diligente,
quem se afoga nas ondas encurvadas,
quem bebe o mar, e o deita juntamente.
arrombam as miúdas bombardadas
os pangaios sutis da bruta gente:
desta arte o português enfim castiga
a vil malícia, pérfida, inimiga.","les canots de ceux-ci sous le nombre s’affaissent,
ceux-la fendent la vague et nagent violemment,
dans la courbe des eaux, ils roulent, disparaissent,
l’autre boit l’onde amère et la rend à l’instant.
les bateaux surchargés, frêles cl peu solides
ne peuvent résister au feu des portugais,
presque tous coulent bas dans les gouffres liquides;
digne punition de leurs lâches projets.",pt_XX,fr_XX,"Certains vont dans les barques chargées,
Un coupe la mer en nageant diligemment,
Certains se noient dans les vagues courbées,
Certains boivent la mer et la recrachent ensemble.
Les petits vaisseaux des brutaux
Sont brisés par les bombardements :
Ainsi les Portugais punissent
La vilaine malice, perfide, ennemie.",1
"tornam vitoriosos para a armada,
co'o despojo da guerra e rica presa,
e vão a seu prazer fazer aguada,
sem achar resistência, nem defesa.
ficava a maura gente magoada,
no ódio antigo mais que nunca acesa;
e vendo sem vingança tanto dano,
somente estriba no segundo engano.","les portugais vainqueurs, maîtres de la bourgade,
ne trouvant plus personne à qui donner la mort,
sans opposition vont faire leur aiguade,
et chargés de butin, s’en retournent à bord.
le maure humilié, voyant son impuissance
sentait croître sa haine avec son désespoir,
et pour ne pas laisser tous ses maux sans vengeance
dans son second moyen, mettait tout son espoir.",pt_XX,fr_XX,"Ils deviennent victorieux pour l'armada,
Avec le butin de la guerre et les riches prises,
Et vont à leur guise pour faire de l'eau,
Sans rencontrer de résistance ni de défense.
Le peuple maure restait blessé,
Dans une haine ancienne plus que jamais allumée;
Et voyant tant de dommages sans vengeance,
Seule repose sur une deuxième tromperie.",1
"o capitão, que já lhe então convinha
tornar a seu caminho acostumado,
que tempo concertado e ventos tinha
para ir buscar o indo desejado,
recebendo o piloto, que lhe vinha,
foi dele alegremente agasalhado;
e respondendo ao mensageiro a tento,
as velas manda dar ao largo vento.","gama jugeant alors qu’il était convenable
de poursuivre sa roule, et profitant d'ailleurs
de la belle saison et du vent favorable
qui vers l’inde soufflait, n’usa point de rigueur,
et surtout avec joie accueillit le pilote;
puis ayant pris congé du messager tremblant,
il fail d’appareiller le signal à la flotte,
qui déploie aussitôt toutes voiles au vent.",pt_XX,fr_XX,"le capitaine, qui alors lui convenait
de reprendre son chemin habituel,
ayant le temps et les vents réunis
pour aller chercher la destination souhaitée,
accueillant le pilote qui venait vers lui,
fut joyeusement accueilli par lui ;
et répondant au messager avec soin,
il ordonne de hisser les voiles au vent large.",1
"desta arte despedida a forte armada,
as ondas de anfitrite dividia,
das filhas de nereu acompanhada,
fiel, alegre e doce companhia.
o capitão, que não caía em nada
do enganoso ardil, que o mouro urdia,
dele mui largamente se informava
da índia toda, e costas que passava.","les lusilains laissant celle infâme contrée,
d'amphitrite fendaient les flots capricieux,
séduisantes d’attraits les filles de nérée
leur tenaient compagnie el nageaient autour d'eux.
le sage commandant qui le maure soupçonne,
et ne veut pas tomber dans des pièges nouveaux,
le surveille, lui parle, au long le questionne
sur l'inde el sur la côte où voguaient les vaisseaux.",pt_XX,fr_XX,"De cette art l'adieu la forte armée,
les vagues d'Amphitrite partageait,
accompagnée des filles de Nérée,
fidèle, joyeuse et douce compagnie.
Le capitaine, qui ne tombait en rien
dans le piège trompeur que le Maure tissait,
il s'informait abondamment de lui
de toute l'Inde et des côtes qu'il traversait.",1
"mas o mouro, instruído nos enganos
que o malévolo baco lhe ensinara,
de morte ou cativeiro novos danos,
antes que à índia chegue, lhe prepara:
dando razões dos portos indianos,
também tudo o que pede lhe declara,
que, havendo por verdade o que dizia,
de nada a forte gente se temia.","mais le maure rusé, sachant mettre en usage
les avis cauteleux que lui donna bacchus,
compte qu ils recevront la mort ou l’esclavage
avant qu'en orient ils ne soient parvenus.
répondant avec ait à l’interrogatoire
il s'étend en détail sur l'inde et sa splendeur;
et les forts portugais, portés à tout accroire, ’
sans s’étonner en rien, en redoublaient d’ardeur",pt_XX,fr_XX,"mais le Maure, instruit dans les tromperies
que le maléfique Bacchus lui avait enseignées,
de nouveaux maux de mort ou de captivité,
avant d'arriver en Inde, il prépare :
fournissant des informations sur les ports indiens,
il lui dévoile également tout ce qu'il demande,
car, croyant en la vérité de ce qu'il disait,
la forte population ne craignait rien.",1
"e diz-lhe mais, com o falso pensamento
com que sinon os frígios enganou:
que perto está uma ilha, cujo assento
povo antigo cristão sempre habitou.
o capitão, que a tudo estava a tento,
tanto com estas novas se alegrou,
que com dádivas grandes lhe rogava,
que o leve à terra onde esta gente estava.","il leur dit, se servant de la ruse subtile,
dont sinon autrefois trompa les phrygiens,
qu’il sait que dans ces mers doit exister une île
habitée en entier par d’anciens chrétiens.
gama, qui l’écoulait d’une oreille attentive,
de trouver des chrétiens était si désireux,
que le comblant de dons dans sa joie excessive,
il le fait à l’instant gouverner vers ces lieux.",pt_XX,fr_XX,"et dis-lui de plus, avec la fausse pensée
avec laquelle Sinon trompa les Phrygiens:
qu'une île est proche, où le siège
un ancien peuple chrétien a toujours habité.
le capitaine, qui était attentif à tout,
se réjouit tellement de ces nouvelles,
qu'il le suppliait avec de grands cadeaux
de le conduire sur la terre où se trouvaient ces gens.",1
