original_poem,translated_poem,src_lang,tgt_lang,translated_by_TA,topic
"vê que já teve o indo sojugado
e nunca lhe tirou fortuna ou caso
por vencedor da índia ser cantado
de quantos bebem a água de parnaso.
teme agora que seja sepultado
seu tão célebre nome em negro vaso
de água do esquecimento, se lá chegam
os fortes portugueses que navegam.","dans les temps reculés, il a subjugue l’inde;
soit fortune ou hasard, ce fait a mérité
que tous les sectateurs buvant aux eaux du pindc,
comme son conquérant l’aient seul toujours chanté.
ce litre glorieux et qui l’immortalise,
les flots noirs de l’oubli l’éteindraient à jamais,
si celle région élail enfin soumise
a des navigateurs tels que les portugais.",pt_XX,fr_XX,"Vois que l'Inde jadis soumise
N'a jamais enlevé sa chance ni son sort
Car célébré comme vainqueur de l'Inde il est chanté
Par ceux qui boivent l'eau du Parnasse.
Il craint désormais d'être enterré
Son nom si célèbre dans un vase noir
D'eau d'oubli, s'ils y parviennent
Les forts Portugais qui naviguent.",1
"sustentava contra ele vénus bela,
afeiçoada à gente lusitana,
por quantas qualidades via nela
da antiga tão amada sua romana;
nos fortes corações, na grande estrela
que mostraram na terra tingitana,
e na língua, na qual quando imagina,
com pouca corrupção crê que é a latina.","pour eux et contre lui plaidait vénus la belle;
elle veut proléger un peuple généreux
qui par des traits brillants à son âme rappelle
ces romains qu'elle aimait, et que l’on vit comme eux.
poussés par leur étoile et leur brillant courage,
etendre leurs succès sur le sol africain;
(test pareille valeur, presque même langage
qui sous tant de rapports parait être latin.",pt_XX,fr_XX,"Elle soutenait contre lui la belle Vénus,
attachée au peuple lusitanien,
pour toutes les qualités qu'elle voyait en elle
de la si aimée ancienne romaine ;
dans les forts cœurs, dans la grande étoile
qu'ils ont montrée sur la terre tingitane,
et dans la langue, dans laquelle lorsqu'il imagine,
avec peu de corruption il croit qu'elle est la latine.",1
"a viseira do elmo de diamante
alevantando um pouco, mui seguro,
por dar seu parecer se pôs diante
de júpiter, armado, forte e duro;
e dando uma pancada penetrante
co'o conto do bastão no sólio puro,
o céu tremeu, e apolo, de torvado,
um pouco a luz perdeu, como enfiado.","du casque en diamant qui recouvrait sa tête,
la visière est levée et montre cet œil fier,
qui des combats sanglants dirige la tempête;
d'un pas ferme il s’avance, et devant jupiter,
pour donner son avis, il s’arrête terrible;
alors frappant son dard d'un bras si vigoureux
qu'il ébranla le ciel, et qu'un effroi visible
altéra d'apollon les rayons lumineux",pt_XX,fr_XX,"Le visière du casque de diamant
Se leva un peu, très sûr,
Pour donner son avis, il se mit devant
Jupiter, armé, fort et dur;
Et donnant un coup perçant
Avec le bout du bâton sur le trône pur,
Le ciel trembla, et Apollon, avec colère,
Perdit un peu de sa lumière, comme effrayé.",1
"e disse assim: ó padre, a cujo império
tudo aquilo obedece que criaste:
se esta gente que busca outro hemisfério,
cuja valia e obras tanto amaste,
não queres que padeçam vitupério,
como há já tanto tempo que ordenaste,
não onças mais, pois és juiz direito,
razões de quem parece que é suspeito.","«maître des dieux, dit il, qui d’un amour de père
«gouverne ces humains dont lu fus créateur,
«si des mortels, cherchant un nouvel hémisphère,
«ont su par leur audace et leur haute valeur,
«mériter de ta part et secours et refuge,
«pourquoi laisser l'envie après eux s’acharner?
«a quoi sert d’écouter, quand lu dois être juge,
«tous ces motifs suspects qu’on ose te donner?",pt_XX,fr_XX,"et a dit ainsi : ô prêtre, dont l'empire
tout obéit à ce que tu as créé :
si ces gens qui cherchent un autre hémisphère,
dont la valeur et les œuvres tu as tant aimées,
tu ne veux pas qu'ils souffrent l'opprobre,
comme il y a déjà longtemps que tu l'as ordonné,
ne juge plus, car tu es un juge juste,
les raisons de celui qui semble être suspect.",1
"que, se aqui a razão se não mostrasse
vencida do temor demasiado,
bem fora que aqui baco os sustentasse,
pois que de luso vem, seu tão privado;
mas esta tenção sua agora passe,
porque enfim vem de estômago danado;
que nunca tirará alheia inveja
o bem que outrem merece e o céu deseja.","«n’est-il pas positif qu'une terreur panique
«a fait croire à bacclius qu’il doit craindre pour lui,
«el que sans l’intérêt de son renom antique,
«de ces fils de lusus, il deviendrait l’appui;
«dans leurs vastes desseins si ce dieu les entrave
«de sa malignité ne voit-on pas l’effet?
«et permettrons-nous donc que l’envie ôte au brave,
«la gloire qu’il mérite, et que le sort promet?",pt_XX,fr_XX,"Si la raison ne se montrait pas vaincue
par une peur excessive,
il aurait été bon que Bacchus nous soutienne ici,
car il est si lié aux Lusitaniens ;
mais cette tension doit maintenant passer,
car enfin il vient d'un estomac malade ;
car jamais la jalousie des autres
ne retirera le bien mérité et désiré par le ciel.",1
"e tu, padre de grande fortaleza,
da determinação que tens tomada
não tornes por detrás, pois é fraqueza
desistir-se da cousa começada.
mercúrio, pois excede em ligeireza
ao vento leve e à seta bem talhada,
lhe vá mostrar a terra onde se informe
da índia, e onde a gente se reforme.","«et toi, dieu tout puissant, en la haute sagesse,
«si lu voulus fixer un terme à leurs travaux
«ne l’en désiste pas, car seule la faiblesse
«dans ce qu’elle entreprend, s’arrête sans propos.
«laisse partir mercure et que son vol rapide,
«plus vile que la flèche et que le vent léger,
«leur montre cette terre où la flotte intrépide,
«doit s'informer de l'inde et se ravitailler.»",pt_XX,fr_XX,"Et toi, prêtre d'une grande force,
de la détermination que tu as prise
ne reviens pas en arrière, car c'est une faiblesse
d'abandonner la chose commencée.
Mercure, car il surpasse en rapidité
le vent léger et la flèche bien taillée,
va lui montrer la terre où il s'informe
de l'Inde, et où les gens se réforment.",1
"como isto disse, o padre poderoso,
a cabeça inclinando, consentiu
no que disse mavorte valeroso
e néctar sobre todos esparziu.
pelo caminho lácteo glorioso
logo cada um dos deuses se partiu
fazendo seus reais acatamentos,
para os determinados aposentos.","il dit, et jupiter en inclinant la tète
donne à l’avis de mars, sa pleine adhésion;
la séance est levée et tout débat s’arrête,
on verse le nectar avec profusion.
enfin prenant congé, chaque dieu se relire,
et de la voie lactée les différents chemins,
les ramènent aux lieux, sièges de leur empire,
pour recueillir l’encens et les voeux des humains.",pt_XX,fr_XX,"Comme l'a dit ceci, le puissant prêtre,
Inclinant la tête, approuva
Ce que dit le courageux Mavorte
Et répandit le nectar sur tous.
Par le chemin lacté glorieux
Chaque dieu partit bientôt
Faisant ses révérences royales,
Vers les salles désignées.",1
"vasco da gama, o forte capitão,
que a tamanhas empresas se oferece,
de soberbo e de altivo coração,
a quem fortuna sempre favorece,
para se aqui deter não vê razão,
que inabitada a terra lhe parece.
por diante passar determinava,
mas não lhe sucedeu como cuidava.","mais vasco de gama, l’illustre capitaine
qui de celle entreprise osa seul se charger,
dont l'indomptable cœur, la valeur plus qu’humaine
ont contraint la fortune à le favoriser:
gama, dans son esprit n’ayant le moindre doute
qu’en ces sauvages lieux aucun être habitait,
avait fait le signal de poursuivre la route,
mais il n’en advint point ainsi qu’il le pensait.",pt_XX,fr_XX,"Vasco da Gama, le capitaine courageux,
qui se consacre à de si grandes entreprises,
d'un cœur fier et hautain,
que la fortune favorise toujours,
ne voit aucune raison de s'attarder ici,
car la terre lui semble inhabité.
Il avait décidé de continuer devant lui,
mais les choses ne se sont pas passées comme il le pensait.",1
"eis aparecem logo em companhia
uns pequenos batéis, que vêm daquela
que mais chegada à terra parecia,
cortando o longo mar com larga vela.
a gente se alvoroça, e de alegria
não sabe mais que olhar a causa dela.
que gente será esta, em si diziam,
que costumes, que lei, que rei teriam?","de pile la plus grande et la plus proche terre,
plusieurs petits canots parlent en même temps.
tendant leur longue voile à la brise légère
ils paraissent glisser sur les flots transparents.
un hourra retentit dans tous les équipages,
tous fixent même objet. l’on se dit entre soi,
que seront ces gens-là, leurs mœurs et leurs usages?
quelle loi suivront-ils, et quel sera leur roi?",pt_XX,fr_XX,"Voici qu'apparaissent bientôt en compagnie
quelques petites barques, venues de cette
qui semblait être la plus proche de la terre,
franchissant la longue mer avec une grande voile.
Les gens s'agitent, et de joie
ne savent plus que regarder la cause de cela.
Quel peuple est-ce, se disaient-ils,
quels coutumes, quelle loi, quel roi auraient-ils?",1
"as embarcações eram, na maneira,
mui veloces, estreitas e compridas:
as velas, com que, vêm, eram de esteira
dumas folhas de palma, bem tecidas;
a gente da cor era verdadeira,
que faeton, nas terras acendidas,
ao mundo deu, de ousado, o não prudente:
o pado o sabe, o lampetusa o sente.","ces canots que déjà détaille mieux la vue,
et,aient fort longs, étroits, paraissant fins voiliers;
la voile qu’ils portaient était longue et tissue
des flexibles rameaux de certains palmiers.
quant aux gens ils étaient de l’obscure nuance
que transmit phaëlon, quand l’imprudent faillit
allumer sur la terre un incendie immense;
au padus, on le sait; lampétuse en gémit!",pt_XX,fr_XX,"Les embarcations étaient, de manière,
très rapides, étroites et longues :
les voiles, avec lesquelles elles venaient, étaient tissées
de feuilles de palmier, bien travaillées ;
les gens étaient de couleur vraie,
que Phaéton, dans les terres brûlantes,
a donné au monde, audacieux, non prudent :
le pâtre le sait, le lampétuse le ressent.",1
"co'os panos e co'os braços acenavam
as gentes lusitanas, que esperassem;
mas já as proas ligeiras se inclinavam
para que junto às ilhas amainassem.
a gente e marinheiros trabalhavam,
como se aqui os trabalhos se acabassem;
tomam velas; amaina-se a verga alta;
da âncora, o mar ferido, em cima salta.","leur pagnes et leurs bras qu’en tous sens ils agitent
disent de les attendre aux vaillants portugais;
mais inclinant la proue, eux mêmes leur évitent,
la moitié du chemin, et vont mouiller auprès.
comme arrivant au bout de sa course lointaine,
avec ardeur chacun à la manœuvre agit,
on cargue la voilure, on amène l'antenne,
la mer que l’ancre blesse, écume et rejaillit.",pt_XX,fr_XX,"Avec les voiles et les bras, ils agitaient
les gens lusitaniens, leur demandant d'attendre ;
mais déjà les proues légères s'inclinaient
pour s'approcher des îles apaisantes.
Les gens et les marins travaillaient,
comme si ici les travaux se terminaient ;
ils prennent les voiles ; la vergue haute s'apaise ;
de l'ancre, la mer blessée, saute dessus.",1
"não eram ancorados, quando a gente
estranha pelas cordas já subia.
no gesto ledos vêm, e humanamente
o capitão sublime os recebia:
as mesas manda pôr em continente;
do licor que lieo prantado havia
enchem vasos de vidro, e do que deitam,
os de faeton queimados nada enjeitam.","l’on n’était pas mouillé qu’aux agrès et aux câbles.
tous ces gens s’accrochant, sont grimpés lestement.
leurs gestes, leur regards sont bienveillants, affables.
gama, dans son accueil, est non moins confiant.
par son ordre, on leur sert des mets de toute espèce,
la coupe de cristal s’emplit d’un vin vermeil
el l'abondance règne à la vive allégresse
de ces hommes noircis par les feux du soleil.",pt_XX,fr_XX,"Ils n'étaient pas ancrés, quand nous
étrangers, déjà montions par les cordes.
Dans un geste joyeux ils viennent, et humainement
le sublime capitaine les accueillait :
il ordonne de mettre les tables en place ;
du vin limpide déjà versé
ils remplissent des verres en verre, et de celui qu'ils déversent,
les convives des Phaétons brûlés rien ne rejettent.",1
"comendo alegremente perguntavam,
pela arábica língua, donde vinham,
quem eram, de que terra, que buscavam,
ou que partes do mar corrido tinham?
os fortes lusitanos lhe tornavam
as discretas respostas, que convinham:
os portugueses somos do ocidente,
imos buscando as terras do oriente.","tout en mangeant gaîment, en arabe langage
ils demandent leur nom et d’où sont-ils venus?
ce qu’ils viennent chercher sur ce lointain rivage?
quels endroits de la mer ils avaient parcourus?
les braves portugais, usant de courtoisie,
répondent en ces mots: «nous venons d'occidenl,
«on nomme portugal notre belle patrie,
«nous cherchons une issue aux pays d'orient.",pt_XX,fr_XX,"En mangeant joyeusement, ils demandaient,
par la langue arabe, d'où ils venaient,
qui ils étaient, de quelle terre, ce qu'ils cherchaient,
ou quelles parties de la mer ils avaient traversées ?
les forts lusitaniens leur donnaient
les réponses discrètes qui convenaient :
nous, Portugais, venons de l'ouest,
nous cherchons les terres de l'est.",1
"e por mandado seu, buscando andamos
a terra oriental que o indo rega;
por ele, o mar remoto navegamos,
que só dos feios focas se navega.
mas já razão parece que saibamos,
se entre vós a verdade não se nega,
quem sois, que terra é esta que habitais,
ou se tendes da índia alguns sinais?
somos, um dos das ilhas lhe tornou,
estrangeiros na terra, lei e nação;
que os próprios são aqueles, que criou
a natura sem lei e sem razão.
nós temos a lei certa, que ensinou
o claro descendente de abraão
que agora tem do mundo o senhorio,
a mãe hebreia teve, e o pai gentio.","«en cherchant par son ordre une issue aux contrées
«qu’arrosent dans leur cours et le gange et l’indus,
«nous avons vu des mers par nul homme explorées,
«où les phoques hideux étaient seuls parvenus.
«vous savez notre nom et ce qui nous amène;
«a votre tour, parlez: comment vous nommez-vous?
«comment appelle-t-on celle terre lointaine?
«de l’inde désirée enfin approchons-nous?
«nous sommes, leur répond un des gens de cette île,
«etrangers à ces lieux envahis sans combat.
«les naturels du sol, errants et sans asile,
«sont tels que les plaça la nature ici bas;
«nous jouissons des bienfaits de la sainte croyance,
«que transmit d’abraham l’illustre petit fils,
«ismaël, dont le monde adore l’influence,
«qui doit son père aux juifs et sa mère aux gentils.",pt_XX,fr_XX,"et sur ses ordres, nous cherchons
la terre orientale arrosée par l'Indus ;
grâce à lui, nous naviguons sur les mers lointaines
que seuls les laids phoques naviguent.
Mais il semble juste que nous sachions
si parmi vous la vérité n'est pas niée,
qui vous êtes, quelle terre vous habitez,
ou si vous avez des signes de l'Inde ?
nous sommes, l'un des îliens lui a dit,
étrangers sur la terre, loi et nation ;
car ils sont ceux-là mêmes qu'a créés
la nature sans loi ni raison.
nous avons la loi certaine qui a été enseignée
par le clair descendant d'Abraham
qui possède maintenant la souveraineté du monde,
la mère hébraïque et le père païen.",1
"esta ilha pequena, que habitamos,
em toda esta terra certa escala
de todos os que as ondas navegamos
de quíloa, de mombaça e de sofala;
e, por ser necessária, procuramos,
como próprios da terra, de habitá-la;
e por que tudo enfim vos notifique,
chama-se a pequena ilha moçambique.","«l’ile que vous voyez, est tellement centrale
«que c’est l’unique échelle où s’arrêtent tous ceux
«qui vont à quiloa, mombaça et sofale:
«sachant combien l’endroit était avantageux
«nous l’avons pris pour nous. les brutes insulaires
«ne purent empêcher cette usurpation,
«ils s’enfuirent bientôt dans les bois et les terres,
«pour tout vous dire enfin: mozambique est son nom.",pt_XX,fr_XX,"cette petite île que nous habitons,
sur cette terre de taille certaine,
parmi tous ceux qui naviguent les vagues
de Quíloa, de Mombasa et de Sofala ;
et, parce qu'il est nécessaire, nous cherchons,
comme les habitants de la terre, à l'occuper ;
et pour que tout soit notifié enfin,
cette petite île s'appelle Mozambique.",1
"e já que de tão longe navegais,
buscando o indo idaspe e terra ardente,
piloto aqui tereis, por quem sejais
guiados pelas ondas sabiamente.
também será bem feito que tenhais
da terra algum refresco, e que o regente
que esta terra governa, que vos veja,
e do mais necessário vos proveja.","«et puisque votre roi commande à votre flotte
«de chercher l’orienl et l’hydaspe indien,
«nous vous procurerons un habile pilote,
«qui vous en montrera sur l'onde le chemin.
«l’île, quoique petite, est pourtant bien pourvue
«de rafraîchissements, et notre gouverneur
«qui désire avec vous avoir une entrevue,
«aux plus pressants besoins pourvoira de grand cœur.»",pt_XX,fr_XX,"Et puisque vous naviguez de si loin,
cherchant les Indes, Idaspe et terre ardente,
ici vous aurez un pilote, par qui vous serez
guidés sagement par les vagues.
Il sera également bon que vous ayez
quelque rafraîchissement de la terre, et que le souverain
qui gouverne cette terre, vous voie,
et vous fournisse de ce dont vous avez besoin.",1
"isto dizendo, o mouro se tornou
a seus batéis com toda a companhia;
do capitão e gente se apartou
com mostras de devida cortesia.
nisto febo nas águas encerrou,
co'o carro de cristal, o claro dia,
dando cargo à irmã, que alumiasse
o largo mundo, enquanto repousasse.","disant ces mots, le maure et tout son entourage,
regagnent leurs canots, mais en quittant le bord
ils font au capitaine ainsi qu a l’équipage,
des signes bienveillants et du meilleur accord.
alors phébus ayant achevé sa carrière,
dans son char de cristal s’abîmait dans les îlots,
et déjà de sa sœur, la plus douce lumière
le remplaçait pendant qu’il se livre au repos.",pt_XX,fr_XX,"Cela dit, le Maure est devenu
Vers ses bateaux avec toute sa compagnie ;
Du capitaine et de ses gens il s'est séparé
Avec des signes de courtoisie appropriée.
À ce moment, Phébus a plongé dans les eaux,
Avec son char de cristal, le jour clair,
Donnant à sa sœur la tâche d'éclairer
Le vaste monde pendant qu'il se reposait.",1
"mas assim como a aurora marchetada
os formosos cabelos espalhou
no céu sereno, abrindo a roxa entrada
ao claro hiperiônio, que acordou,
começa a embandeirar-se toda a armada,
e de toldos alegres se adornou,
por receber com festas e alegria
o regedor das ilhas, que partia.","l’aurore, dans les cieux, secouant sa chevelure,
a peine devançait le retour, empourpre,
du radieux phébus, flambeau de la nature.
qu’a bord pour l’entrevue on a tout prépare.
de brillantes couleurs la flotte se pavoise,
sur le pont, on étend de soyeux pavillons,
gama, par une fêle éclatante et courtoise,
veut accueillir le chef et ses noirs compagnons.",pt_XX,fr_XX,"mais comme l'aurore estampillée
a répandu ses beaux cheveux
dans le ciel serein, ouvrant l'entrée pourpre
au clair Hyperion, qui s'est réveillé,
toute l'armée commence à se parer,
et se pare de joyeux auvents,
pour accueillir avec fêtes et joie
le régent des îles, qui partait.",1
"partia alegremente navegando,
a ver as naus ligeiras lusitanas,
com refresco da terra, em si cuidando
que são aquelas gentes inumanas,
que, os aposentos cáspios habitando,
a conquistar as terras asianas
vieram; e por ordem do destino,
o império tomaram a constantino.","mais déjà de ceux-ci la flotille s’avance,
pour voir des portugais les navires légers,
les viandes cl les fruits viennent en abondance,
le cheik croyait trouver ces farouches gucrricis
qui s’élançant des bords de la mer caspienne
inondèrent l’asie, obtenant du destin
de courber à leur joug, et sous la foi païenne
l'empire glorieux fondé par constantin.",pt_XX,fr_XX,"Il partait joyeusement en naviguant,
pour voir les navires rapides portugais,
avec le rafraîchissement de la terre, pensant en lui-même
qu'ils sont ces gens inhumains,
qui, habitant les chambres caspiennes,
sont venus conquérir les terres asiatiques
et, par ordre du destin,
ont pris l'empire de Constantinople.",1
"recebe o capitão alegremente
o mouro, e toda a sua companhia;
dá-lhe de ricas peças um presente,
que só para este efeito já trazia;
dá-lhe conserva doce, e dá-lhe o ardente
não usado licor, que dá alegria.
tudo o mouro contente bem recebe;
e muito mais contente come e bebe.","les saluts échangés en paroles flatteuses
le commandant au cheik aussitôt fait offrir
un superbe présent d'étoffes précieuses
qu’il gardait en ce but. il fait à tous servir
les exquises douceurs et l'ardente eau-de-vie,
liqueur inusitée et qui réjouit le cœur.
le maure accepte tout, et sa suite ravie,
aux douceurs, aux boissons, fait le plus grand honneur.",pt_XX,fr_XX,"Le capitaine reçoit joyeusement
le Maure et toute sa compagnie ;
Il lui offre des cadeaux précieux,
qu'il apportait déjà pour cette occasion ;
Il lui donne des confitures sucrées, et lui offre l'alcool
non utilisé, qui apporte de la joie.
Le Maure reçoit tout cela avec satisfaction ;
et il mange et boit encore plus joyeusement.",1
"e mais lhe diz também, que ver deseja
os livros de sua lei, preceito eu fé,
para ver se conforme à sua seja,
ou se são dos de cristo, como crê.
e porque tudo note e tudo veja,
ao capitão pedia que lhe dê
mostra das fortes armas de que usavam,
quando co'os inimigos pelejavam.","il demandait à voir les livres vénérables,
de la religion sacrés et pieux gardiens,
pour juger s’ils étaient à leurs dogmes semblables,
ou si plutôt ils sont, comme il le croit, chrétiens.
el pour vérifier de secrètes alarmes,
priait le commandant qu’à ses yeux on montrât
l'arsenal des vaisseaux, et les terribles armes,
dont ils fesaienl usage aux grands jours de combat.",pt_XX,fr_XX,"Il lui dit aussi encore qu'il souhaite voir
les livres de sa loi, précepte et foi,
pour voir s'ils correspondent à la sienne,
ou s'ils sont ceux du Christ, comme il croit.
Et parce qu'il veuille tout noter et tout voir,
il demandait au capitaine de lui montrer
les puissantes armes qu'ils utilisaient
quand ils combattaient les ennemis.",1
"responde o valeroso capitão
por um, que a língua escura bem sabia:
dar-te-ei, senhor ilustre, relação
de mim, da lei, das armas que trazia.
nem sou da terra, nem da geração
das gentes enojosas de turquia:
mas sou da forte europa belicosa,
busco as terras da índia tão famosa.","un portugais, versé dans l’obscure langage,
lui traduisit ces mots que gama prononçait:
sur nous, notre patrie et notre long voyage,
lu vas être, grand chef, pleinement satisfait.
nous n’appartenons point à la race méchante,
de turquie, occupant les cantons opprimés;
nous venons de l'europe, aguerrie et puissante,
et de l’inde cherchons les pays renommés.",pt_XX,fr_XX,"répond le valeureux capitaine
pour l'un, qui bien connaissait la langue sombre :
je vous donnerai, illustre seigneur, un récit
de moi, de la loi, des armes que je portais.
je ne suis ni de la terre, ni de la génération
des gens dégoûtants de Turquie :
mais je suis de la forte Europe belliqueuse,
je cherche les terres de l'Inde si célèbre.",1
"a lei tenho daquele, a cujo império
obedece o visíbil e invisíbil
aquele que criou todo o hemisfério,
tudo o que sente, o todo o insensíbil;
que padeceu desonra e vitupério,
sofrendo morte injusta e insofríbil,
e que do céu à terra, enfim desceu,
por subir os mortais da terra ao céu.","«nous adorons le dieu qui lient sous son empire,
«le qui frappe la vue, ou se dérobe aux sens.
«le dieu qui donne l’être à tout ce qui respire,
«qui créa la matière et les mondes roulants.
«qui soutirant les douleurs, l'injure et la colère,
«mourut par le supplice, ainsi qu’un criminel,
«ayant daigné des cicux descendre sur la terre,
«pour nous faire monter de cette terre au ciel.",pt_XX,fr_XX,"J'ai la loi de celui dont l'empire
Obéit au visible et à l'invisible,
Celui qui a créé tout l'hémisphère,
Tout ce qui ressent, tout l'insensible ;
Qui a enduré l'opprobre et l'outrage,
Souffrant une mort injuste et insupportable,
Et qui du ciel à la terre finalement est descendu,
Pour élever les mortels de la terre au ciel.",1
