original_poem,translated_poem,src_lang,tgt_lang,translated_by_TA,topic
"while his gills were breathing in
the terrible oxygen
— the frightening gills,
fresh and crisp with blood,
that can cut so badly —
i thought of the coarse white flesh
packed in like feathers,
the big bones and the little bones,
the dramatic reds and blacks
of his shiny entrails,
and the pink swim-bladder
like a big peony.
i looked into his eyes
which were far larger than mine
but shallower, and yellowed,
the irises backed and packed
with tarnished tinfoil
seen through the lenses
of old scratched isinglass.
they shifted a little, but not
to return my stare.
— it was more like the tipping
of an object toward the light.","suas guelras respiravam
o terrível oxigênio
— as guelras assustadoras,
túmidas de sangue vivo,
capazes de cortar a fundo —
e pensei na carne branca,
que se abria como penas,
espinhas grossas e finas,
tons vivos, preto e vermelho,
das vísceras reluzentes,
e a bexiga natatória,
como uma peônia rosa.
olhei-o nos olhos,
muito maiores que os meus,
mas mais rasos, amarelos,
com um fundo de papel
de alumínio manchado,
visto através de velhas
lentes de mica arranhadas.
mexeram-se um pouco, mas não
para retribuir meu olhar.
— era como um objeto
que se inclina para a luz.",en_XX,pt_XX,"enquanto suas brânquias respiravam
o terrível oxigênio
— as assustadoras brânquias,
frescas e viçosas de sangue,
que podem cortar tão mal —
pensei na carne grossa e branca
empilhada como penas,
os grandes ossos e os pequenos ossos,
os dramáticos vermelhos e negros
de suas entranhas brilhantes,
e a bexiga natatória rosa
como uma grande peônia.
olhei em seus olhos
que eram muito maiores que os meus
mas mais rasos, e amarelados,
as íris recobertas e empilhadas
com folhas-de-flandres oxidadas
vistas através das lentes
de antigos vidros arranhados.
eles se moveram um pouco, mas não
para retribuir meu olhar.
— era mais como o inclinar
de um objeto em direção à luz.",0.0
"from a magician’s midnight sleeve
the radio-singers
distribute all their love-songs
over the dew-wet lawns.
and like a fortune-teller’s
their marrow-piercing guesses are whatever you believe.
but on the navy yard aerial i find
better witnesses
for love on summer nights.
five remote red lights
keep their nests there; phoenixes
burning quietly, where the dew cannot climb.","da manga escura de um mágico
os cantores do rádio
espalham canções de amor
pela grama, sobre o orvalho noturno.
e preveem para o futuro,
qual cartomantes, o que se quiser supor.
mas na antena do estaleiro distingo
observadores mais dignos
de apreciar o amor. do alto de seu galho,
cinco luzes vermelhas, remotas,
se aninham; fênix silenciosas,
ardendo onde nunca chega o orvalho.",en_XX,pt_XX,"de uma manga de meia-noite de mágico
os cantores de rádio
espalham todas as suas canções de amor
sobre os gramados orvalhados.
e como adivinhos
suas suposições lancinantes são o que você acredita.
mas na antena do estaleiro naval eu encontro
melhores testemunhas
para o amor nas noites de verão.
cinco luzes vermelhas distantes
guardam seus ninhos; fênix
queimando silenciosamente, onde o orvalho não pode subir.",0.0
"cootchie, miss lula’s servant, lies in marl,
black into white she went
below the surface of the coral-reef.
her life was spent
in caring for miss lula, who is deaf,
eating her dinner off the kitchen sink
while lula ate hers off the kitchen table.
the skies were egg-white for the funeral
and the faces sable.
tonight the moonlight will alleviate
the melting of the pink wax roses
planted in tin cans filled with sand
placed in a line to mark miss lula’s losses;
but who will shout and make her understand?
searching the land and sea for someone else,
the lighthouse will discover cootchie’s grave
and dismiss all as trivial; the sea, desperate,
will proffer wave after wave.","cootchie, a criada da dona lula, jaz em marga,
negra no branco, afundou
na superfície do recife de coral.
a vida toda ela passou
cuidando da dona lula, que escuta mal,
comendo seu jantar na pia da cozinha
enquanto lula, na mesa da cozinha, comia o seu.
no enterro dela, o céu era bem alvo
e os rostos feito breu.
esta noite a lua vai aliviar
o desmanchar-se das rosas de cera rosada
plantadas em latas de areia grossa
que assinalam as perdas da dona lula, coitada;
mas quem há de gritar pra que ela ouça?
varrendo terra e mar em busca de outro alguém,
o farol vai dar com cootchie em sua cova funda
e ignorá-la, por trivial; desesperado, o mar
há de ofertar onda após onda.",en_XX,pt_XX,"Cootchie, a criada da dona Lula, jaz em Marga,
Negra no branco, afundou
Na superfície do recife de coral.
A vida toda ela passou
Cuidando da dona Lula, que escuta mal,
Comendo seu jantar na pia da cozinha
Enquanto Lula, na mesa da cozinha, comia o seu.
No enterro dela, o céu era bem alvo
E os rostos feitos breu.
Esta noite a lua vai aliviar
O desfazer-se das rosas de cera rosada
Plantadas em latas de areia grossa
Que assinalam as perdas da dona Lula, coitada;
Mas quem há de gritar para que ela ouça?
Varrendo terra e mar em busca de outro alguém,
O farol vai dar com Cootchie em sua cova funda
E ignorá-la, por trivial; desesperado, o mar
Há de ofertar onda após onda.",0.0
"a washing hangs upon the line,
but it’s not mine.
none of the things that i can see
belong to me.
the neighbors got a radio with an aerial;
we got a little portable.
they got a lot of closet space;
we got a suitcase.
i say, “le roy, just how much are we owing?
something i can’t comprehend,
the more we got the more we spend...”
he only answers, “let’s get going.”
le roy, you’re earning too much money now.
i sit and look at our backyard
and find it very hard.
what have we got for all his dollars and cents?
— a pile of bottles by the fence.
he’s faithful and he’s kind
but he sure has an inquiring mind.
he’s seen a lot; he’s bound to see the rest,
and if i protest
le roy answers with a frown,
“darling, when i earns i spends.
the world is wide; it still extends...
i’m going to get a job in the next town.”
le roy, you’re earning too much money now.","tem roupa no varal, limpinha,
só que não é minha.
tem muita coisa aqui espalhada,
mas eu não tenho nada.
tem um rádio grande no vizinho;
nós temos um pequenino.
lá tem armário até na sala;
nós temos uma mala.
“le roy, quanto que a gente deve agora?”
pergunto. “a gente não economiza,
e gasta logo tudo quanto ganha...”
ele só diz: “mulher, vamos embora”.
le roy, de onde que vem toda essa grana?
eu fico olhando pro quintal
e penso: vamos mal.
todo o dinheiro que entra em nossa vida
se gasta em bebida.
ele é fiel, ele é carinhoso,
mas é muito curioso.
correu meio mundo e quer correr o resto,
e se eu protesto
fica enfezado, esse meu nego,
e diz: “eu ganho, eu gasto, e pronto.
o mundo é grande, e a sorte manda...
na próxima cidade eu arrumo emprego.”
le roy, de onde que vem toda essa grana?",en_XX,pt_XX,"Uma roupa seca pendurada na corda,
mas não é minha.
Nada do que vejo pertence a mim.
Os vizinhos têm um rádio com antena;
Nós temos um portátil pequeninim.
Eles têm muito espaço no armário;
Nós temos uma mala velhinha.
Eu digo: ""Le Roy, quanto devemos?
Algo que não consigo entender,
Quanto mais temos, mais gastamos...""
Ele só responde: ""Vamos embora.""
Le Roy, você ganha demais agora.
Eu sento e olho nosso quintal,
E a coisa fica bem difícil.
O que temos por seus dólares e centavos?
— Um monte de garrafas junto aos cercados.
Ele é leal e tem bom coração,
Mas tem uma mente investigativa, sim senhor.
Ele viu muito; vai ver mais ainda,
E se eu protesto
Le Roy responde com um franzir:
""Querida, quanto ganho, tanto gasto.
O mundo é vasto; ainda se expande...
Vou arrumar um trabalho na próxima cidade.""
Le Roy, você ganha demais agora.",0.0
"the time has come to call a halt;
and so it ends.
he’s gone off with his other friends.
he needn’t try to make amends,
this occasion’s all his fault.
through rain and dark i see his face
across the street at flossie’s place.
he’s drinking in the warm pink glow
to th’ accompaniment of the piccolo.
the time has come to call a halt.
i met him walking with varella
and hit him twice with my umbrella.
perhaps that occasion was my fault,
but the time has come to call a halt.
go drink your wine and go get tight.
let the piccolo play.
i’m sick of all your fussing anyway.
now i’m pursuing my own way.
i’m leaving on the bus tonight.
far down the highway wet and black
i’ll ride and ride and not come back.
i’m going to go and take the bus
and find someone monogamous.
the time has come to call a halt.
i’ve borrowed fifteen dollars fare
and it will take me anywhere.
for this occasion’s all his fault.
the time has come to call a halt.","agora não dá mais. ah, tenha dó!
chega de briga.
ele saiu lá com os amigos.
nem vem de conversa comigo:
agora a culpa é dele só.
está escuro, e chove, e mesmo assim
eu vejo ele, lá no botequim,
bebendo e ouvindo a música simpática
que sai da vitrola automática.
agora não dá mais. ah, tenha dó:
peguei em flagra, andando com a varella
e dei-lhe um tapa, bem na frente dela.
daquela vez a culpa não foi dele só,
porém agora não dá mais; ah, tenha dó.
vai, bebe, bebe, até ficar bem zonzo,
canta essa música baixinho.
pois eu enjoei do teu carinho,
e vou tomar o meu caminho.
comprei passagem no ônibus das onze.
eu vou-me embora, e não volto mais,
por essa estrada, sem olhar pra trás.
mesmo que eu vá parar em deus-me-livre
eu acho alguém que não me ponha chifre.
agora não dá mais; ah, tenha dó.
peguei emprestado o dinheiro da passagem
e vou embarcar numa longa viagem.
pois dessa vez a culpa é dele só.
agora não dá mais. ah, tenha dó!",en_XX,pt_XX,"Agora não dá mais, ah, tenha dó!
Chega de briga, vai viver sem nó.
Ele saiu lá com os amigos seus,
Nem vem de conversa comigo, eu não deixo.
Agora a culpa é dele só, sem contestar.
Está escuro e chove, mas eu percebo,
Lá no botequim ele está bebendo,
Ouvindo a música simpática,
Que sai da vitrola automática.
Agora não dá mais, ah, tenha dó:
Peguei em flagrante, andando com a Varella,
E dei-lhe um tapa, bem na frente dela.
Daquela vez a culpa não foi dele só,
Mas agora não dá mais; ah, tenha dó.
Vai, bebe, bebe, até ficar bem zonzo,
Canta essa música baixinho.
Pois eu cansei do teu carinho,
E vou tomar o meu caminho.
Comprei passagem no ônibus das onze.
Eu vou-me embora, e não volto mais,
Por essa estrada, sem olhar pra trás.
Mesmo que eu vá parar em Deus-me-livre,
Eu acho alguém que não me ponha chifre.
Agora não dá mais; ah, tenha dó.
Peguei emprestado o dinheiro da passagem
E vou embarcar numa longa viagem.
Pois dessa vez a culpa é dele só.
Agora não dá mais, ah, tenha dó!",0.0
"lullaby.
adult and child
sink to their rest.
at sea the big ship sinks and dies,
lead in its breast.
lullaby.
let nations rage,
let nations fall.
the shadow of the crib makes an enormous cage
upon the wall.
lullaby.
sleep on and on,
war’s over soon.
drop the silly, harmless toy,
pick up the moon.
lullaby.
if they should say
you have no sense,
don’t you mind them; it won’t make
much difference.
lullaby.
adult and child
sink to their rest.
at sea the big ship sinks and dies,
lead in its breast.","nana neném.
criança e adulto
dormem fundo.
no mar, o navio ferido naufraga,
cheio de chumbo.
nana neném.
países brigam,
países morrem.
a sombra do berço traça na parede
uma gaiola enorme.
nana neném.
dorme que a guerra acaba
e o sono continua.
larga esse brinquedo bobo
e pega a lua.
nana neném.
se alguém disser
que criança não tem siso,
não liga pra eles não, que isso de siso
não é preciso.
nana neném.
criança e adulto
dormem fundo.
no mar, o navio ferido naufraga,
cheio de chumbo.",en_XX,pt_XX,"canção de ninar.

adulto e criança
descem ao repouso.
no mar o grande navio afunda e morre,
chumbo no seu peito.
canção de ninar.

deixem as nações rugirem,
deixem as nações caírem.
a sombra do berço faz uma enorme gaiola
na parede.
canção de ninar.

durmam sem cessar,
a guerra logo passa.
larguem o tolo e inofensivo brinquedo,
peguem a lua.
canção de ninar.

se disserem
que você não faz sentido,
não ligue; não fará
grande diferença.
canção de ninar.

adulto e criança
descem ao repouso.
no mar o grande navio afunda e morre,
chumbo no seu peito.",0.0
"each day with so much ceremony
begins, with birds, with bells,
with whistles from a factory;
such white-gold skies our eyes
first open on, such brilliant walls
that for a moment we wonder
“where is the music coming from, the energy?
the day was meant for what ineffable creature
we must have missed?” oh promptly he
appears and takes his earthly nature
instantly, instantly falls
victim of long intrigue,
assuming memory and mortal
mortal fatigue.","cada dia, cerimonioso,
começa com pássaros, e fábricas
a apitar, estrepitosas;
diante de céus aurialvos
tão claros nossos olhos se abrem,
e por um instante perguntamos:
“de onde esta força, esta melodia?
para qual inefável criatura
que não vimos, foi feito este dia?”
logo, logo ela surge, e assume
sua natureza terrena
e cai vítima da intriga,
sob o ônus da memória,
da mortal, mortal fadiga.",en_XX,pt_XX,"cada dia com tanta cerimônia
começa, com pássaros, com sinos,
com apitos de uma fábrica;
tais céus branco-ouro nossos olhos
primeiro abrem-se a, tais muros brilhantes
que por um momento nos perguntamos
""de onde vem a música, a energia?
o dia foi feito para que criatura inefável
devemos ter perdido?"" oh prontamente ele
aparece e assume sua natureza terrena
instantaneamente, instantaneamente cai
vítima de longa intriga,
assumindo memória e mortal
mortal fadiga.",0.0
"a cold spring:
the violet was flawed on the lawn.
for two weeks or more the trees hesitated;
the little leaves waited,
carefully indicating their characteristics.
finally a grave green dust
settled over your big and aimless hills.
one day, in a chill white blast of sunshine,
on the side of one a calf was born.
the mother stopped lowing
and took a long time eating the after-birth,
a wretched flag,
but the calf got up promptly
and seemed inclined to feel gay.
the next day
was much warmer.
greenish-white dogwood infiltrated the wood,
each petal burned, apparently, by a cigarette-butt;
and the blurred redbud stood
beside it, motionless, but almost more
like movement than any placeable color.","uma primavera fria:
uma violeta estragada no gramado.
por duas semanas ou mais as árvores hesitaram;
as folhinhas esperaram,
indicando com cuidado as suas características.
por fim uma poeira veneranda e verde
desceu sobre os teus morros altos e aleatórios.
um dia, numa explosão fria e branca de sol,
na encosta de uma delas um bezerro nasceu.
a mãe parou de mugir
e ficou por um bom tempo comendo a placenta,
uma bandeira miserável,
mas o bezerro logo pôs-se em pé
e parecia inclinado a ser alegre.
o dia seguinte
foi bem mais quente.
cornisos verde-claros infiltraram o bosque,
cada pétala parecendo queimada por uma guimba de cigarro;
e a olaia desfocada a seu lado
estava imóvel, mas era quase mais
um movimento que uma cor identificável.",en_XX,pt_XX,"uma primavera fria:
a violeta estava imperfeita no gramado.
por duas semanas ou mais as árvores hesitaram;
as pequenas folhas esperaram,
indicando cuidadosamente suas características.
finalmente uma poeira verde séria
se instalou sobre suas grandes colinas despretensiosas.
um dia, em uma fria explosão de claridade,
em um lado de uma, nasceu um bezerro.
a mãe parou de mugir
e gastou um longo tempo comendo a placenta,
uma triste bandeira,
mas o bezerro levantou-se prontamente
e parecia inclinado a sentir-se alegre.
no dia seguinte
estava muito mais quente.
a dogwood esverdeada infiltrou-se na mata,
cada pétala queimada, aparentemente, por um bituca;
e o redbud embaçado ficou
ao lado, imóvel, mas quase mais
como movimento do que qualquer cor identificável.",0.0
"four deer practised leaping over your fences.
the infant oak-leaves swung through the sober oak.
song-sparrows were wound up for the summer,
and in the maple the complementary cardinal
cracked a whip, and the sleeper awoke,
stretching miles of green limbs from the south.
in his cap the lilacs whitened,
then one day they fell like snow.
now, in the evening,
a new moon comes.
the hills grow softer. tufts of long grass show
where each cow-flop lies.
the bull-frogs are sounding,
slack strings plucked by heavy thumbs.
beneath the light, against your white front door,
the smallest moths, like chinese fans,
flatten themselves, silver and silver-gilt
over pale yellow, orange, or gray.
now, from the thick grass, the fireflies
begin to rise:
up, then down, then up again:
lit on the ascending flight,
drifting simultaneously to the same height,
— exactly like the bubbles in champagne.
— later on they rise much higher.
and your shadowy pastures will be able to offer
these particular glowing tributes
every evening now throughout the summer.","quatro veados praticavam saltar por cima das tuas cercas.
as folhas tenras do carvalho balançavam-se no carvalho severo.
pássaros canoros estavam com a corda toda para o verão,
e no bordo um cardeal de lambuja
estalava seu chicote, e o dorminhoco despertou,
quilômetros de membros espreguiçando-se a partir do sul.
em sua touca os lilases alvearam,
até que um dia caíram feito neve.
agora, ao entardecer,
vem a lua nova.
os morros suavizam-se. tufos de capim alto assinalam
os montinhos de bosta de vaca.
as rãs-touros coaxam,
cordas frouxas tangidas por polegares pesados.
abaixo da luz, contra a porta branca da tua casa,
as menores mariposas, feito leques chineses,
se achatam, prateadas e douradas
sobre um fundo amarelado, laranja ou cinza.
agora, do capim espesso, os vaga-lumes
começam a subir:
acendem-se quando ascendem,
pairando todos na mesma altitude,
— exatamente como bolhas de champanhe.
— mais tarde sobem bem mais alto.
e teus pastos sombrios poderão oferecer
esses exatos tributos luminosos
a cada entardecer, por todo o verão.",en_XX,pt_XX,"Quatro veados praticavam saltar por tuas cercas de vento.
As folhas tenras do carvalho balançam no tronco severo.
Pássaros canoros estavam em festa para o verão,
E num bordo um cardeal rubro
Estalava seu chicote, e o dorminhoco acordou,
Quilômetros de membros se estirando do sul.
Em sua touca os lilases desabrocharam,
Até que um dia caíram como neve.
Agora, ao entardecer,
Surge a lua nova.
Os morros se suavizam. Tufos de capim alto marcam
Os montinhos de esterco vacum.
As rãs-touro coaxam,
Cordas frouxas tangidas por polegares pesados.
À luz, contra a porta branca de tua casa,
As menores mariposas, como leques chineses,
Se achatam, prateadas e douradas
Sobre um fundo amarelado, laranja ou cinza.
Agora, do capim espesso, os vaga-lumes
Começam a subir:
Acendem-se ao ascender,
Pairando todos na mesma altura,
— Exatamente como bolhas de champanhe.
— Mais tarde sobem bem mais alto.
E teus pastos sombrios poderão oferecer
Esses exatos tributos luminosos
A cada entardecer, por todo o verão.",0.0
"thus should have been our travels:
serious, engravable.
the seven wonders of the world are tired
and a touch familiar, but the other scenes,
innumerable, though equally sad and still,
are foreign. often the squatting arab,
or group of arabs, plotting, probably,
against our christian empire,
while one apart, with outstretched arm and hand
points to the tomb, the pit, the sepulcher.
the branches of the date-palms look like files.
the cobbled courtyard, where the well is dry,
is like a diagram, the brickwork conduits
are vast and obvious, the human figure
far gone in history or theology,
gone with its camel or its faithful horse.
always the silence, the gesture, the specks of birds
suspended on invisible threads above the site,
or the smoke rising solemnly, pulled by threads.
granted a page alone or a page made up
of several scenes arranged in cattycornered rectangles
or circles set on stippled gray,
granted a grim lunette,
caught in the toils of an initial letter,
when dwelt upon, they all resolve themselves.
the eye drops, weighted, through the lines
the burin made, the lines that move apart
like ripples above sand,
dispersing storms, god’s spreading fingerprint,
and painfully, finally, that ignite
in watery prismatic white-and-blue.","assim deviam ter sido as nossas viagens:
sérias, ilustráveis.
as sete maravilhas do mundo estão gastas
e um tanto batidas, mas as outras cenas,
inumeráveis, embora tão tristes e tranquilas
quanto elas, são estrangeiras. sempre um árabe
ou grupo de árabes, de cócoras, decerto tramando
contra o nosso império cristão,
enquanto um outro, afastado, mão e braço estendidos,
indica a tumba, o túmulo, o sepulcro.
os galhos das tamareiras lembram lixas.
o pátio de pedra, com seu poço seco,
parece um diagrama, os dutos de tijolo
são vastos e óbvios, a figura humana
já remota na história ou teologia,
com seu camelo ou fiel cavalo.
sempre o silêncio, o gesto, os pontinhos dos pássaros
suspensos em fios invisíveis sobre o lugar,
ou a fumaça subindo solene, puxada por fios.
numa página inteira, ou numa que contém
diversas cenas numa diagonal de retângulos
ou círculos contra um fundo cinza pontilhado,
ou então numa sóbria moldura,
presos nas gavinhas de uma capitular,
ao serem contemplados, todos se resolvem.
o olho cai, pesado, atravessando as linhas
traçadas a buril, linhas que se separam
como círculos na água sobre areia,
dispersando tormentas, a impressão digital de deus,
e laboriosamente, ao fim, se incendeiam
em azul-e-branco aguado, iridescente.",en_XX,pt_XX,"Assim deveriam ser as nossas jornadas:
Sérias, ilustráveis.
As sete maravilhas do mundo estão gastas
E um tanto batidas, mas as outras cenas,
Inumeráveis, embora tão tristes e tranquilas
Quanto elas, são estrangeiras. Sempre um árabe
Ou grupo de árabes, de cócoras, decerto tramando
Contra o nosso império cristão,
Enquanto um outro, afastado, mão e braço estendidos,
Indica a tumba, o túmulo, o sepulcro.
Os ramos das tamareiras lembram lixas.
O pátio de pedra, com seu poço seco,
Parece um diagrama, os dutos de tijolo
São vastos e óbvios, a figura humana
Já remota na história ou teologia,
Com seu camelo ou fiel cavalo.
Sempre o silêncio, o gesto, os pontinhos dos pássaros
Suspensos em fios invisíveis sobre o lugar,
Ou a fumaça subindo solene, puxada por fios.
Numa página inteira, ou numa que contém
Diversas cenas numa diagonal de retângulos
Ou círculos contra um fundo cinza pontilhado,
Ou então numa sóbria moldura,
Presos nas gavinhas de uma capitular,
Ao serem contemplados, todos se resolvem.
O olho cai, pesado, atravessando as linhas
Traçadas a buril, linhas que se separam
Como círculos na água sobre areia,
Dispersando tormentas, a impressão digital de Deus,
E laboriosamente, ao fim, se incendeiam
Em azul-e-branco aguado, iridescente.",0.0
