original_poem,translated_poem,src_lang,tgt_lang,translated_by_TA,topic
"think of the long trip home.
should we have stayed at home and thought of here?
where should we be today?
is it right to be watching strangers in a play
in this strangest of theatres?
what childishness is it that while there’s a breath of life
in our bodies, we are determined to rush
to see the sun the other way around?
the tiniest green hummingbird in the world?
to stare at some inexplicable old stonework,
inexplicable and impenetrable,
at any view,
instantly seen and always, always delightful?
oh, must we dream our dreams
and have them, too?
and have we room
for one more folded sunset, still quite warm?","pensemos na longa viagem de volta.
devíamos ter ficado em casa pensando nas terras daqui?
onde estaríamos hoje?
será direito ver estranhos encenando uma peça
neste teatro tão estranho?
que infantilidade nos impele, enquanto houver um sopro de vida
no corpo, a partir decididos a ver
o sol nascendo do outro lado?
o menor beija-flor verde do mundo?
ficar contemplando uma antiga e inexplicável obra de cantaria,
inexplicável e impenetrável,
qualquer paisagem,
imediatamente vista e sempre, sempre deleitosa?
ah, por que insistimos em sonhar os nossos sonhos
e vivê-los também?
e será que ainda temos lugar
para mais um pôr do sol extinto, ainda morno?",en_XX,pt_XX,"pense na longa viagem de volta.
deveríamos ter ficado em casa e pensado aqui?
onde deveríamos estar hoje?
é certo assistir estranhos em uma peça
neste mais estranho dos teatros?
que infantilidade é essa que enquanto há fôlego de vida
em nossos corpos, estamos decididos a correr
para ver o sol do outro lado?
o menor beija-flor verde do mundo?
para olhar alguma obra de pedra inexplicável,
inexplicável e indevassável,
em qualquer vista,
instantaneamente vista e sempre, sempre deliciosa?
oh, devemos sonhar nossos sonhos
e tê-los, também?
e teremos espaço
para mais um pôr do sol dobrado, ainda quente?",0.0
"but surely it would have been a pity
not to have seen the trees along this road,
really exaggerated in their beauty,
not to have seen them gesturing
like noble pantomimists, robed in pink.
— not to have had to stop for gas and heard
the sad, two-noted, wooden tune
of disparate wooden clogs
carelessly clacking over
a grease-stained filling-station floor.
(in another country the clogs would all be tested.
each pair there would have identical pitch.)
— a pity not to have heard
the other, less primitive music of the fat brown bird
who sings above the broken gasoline pump
in a bamboo church of jesuit baroque:
three towers, five silver crosses.
— yes, a pity not to have pondered,
blurr’dly and inconclusively,
on what connection can exist for centuries
between the crudest wooden footwear
and, careful and finicky,
the whittled fantasies of wooden cages.
— never to have studied history in
the weak calligraphy of songbirds’ cages.
— and never to have had to listen to rain
so much like politicians’ speeches:
two hours of unrelenting oratory
and then a sudden golden silence
in which the traveller takes a notebook, writes:
“is it lack of imagination that makes us come
to imagined places, not just stay at home?
or could pascal have been not entirely right
about just sitting quietly in one’s room?
continent, city, country, society:
the choice is never wide and never free.
and here, or there... no. should we have stayed at home,
wherever that may be?”","mas certamente seria uma pena
não ter visto as árvores à beira dessa estrada,
de uma beleza realmente exagerada,
não tê-las visto gesticular
como nobres mímicos de vestes róseas.
— não ter parado num posto de gasolina e ouvido
a melancólica melodia de madeira, com duas notas só,
de um par de tamancos descasados
pisando sonoros, descuidados,
um chão todo sujo de graxa.
(num outro país, os tamancos seriam todos testados.
os dois pés produziriam exatamente a mesma nota.)
— uma pena não ter ouvido
a outra música, menos primitiva, do gordo pássaro pardo
cantando acima da bomba de gasolina quebrada
numa igreja de bambu de um barroco jesuítico:
três torres, cinco cruzes prateadas.
— sim, uma pena não ter especulado,
confusa e inconclusivamente,
sobre a relação que existiria há séculos
entre o mais tosco calçado de madeira
e, cuidadosas, caprichosas,
as formas fantásticas das gaiolas de madeira.
— jamais ter estudado história
na caligrafia fraca das gaiolas.
— e nunca ter ouvido essa chuva
tão parecida com discurso de político:
duas horas de oratória implacável
e de súbito um silêncio de ouro
em que a viajante abre o caderno e escreve:
“será falta de imaginação o que nos faz procurar
lugares imaginados tão longe do lar?
ou pascal se enganou quando escreveu
que é em nosso quarto que devíamos ficar?
continente, cidade, país: não é tão sobeja
a escolha, a liberdade, quanto se deseja.
aqui, ali... não. teria sido melhor ficar em casa,
onde quer que isso seja?”",en_XX,pt_XX,"Certamente seria uma pena
não ter visto as árvores à beira dessa estrada,
de uma beleza realmente exagerada,
não tê-las visto gesticular
como nobres mímicos de vestes rosadas.
— não ter parado num posto de gasolina e ouvido
a melancólica melodia de madeira, com duas notas só,
de um par de tamancos desparelhados
pisando sonoros, descuidados,
um chão todo sujo de graxa.
(num outro país, os tamancos seriam todos calibrados.
os dois pés produziriam exatamente a mesma nota.)
— uma pena não ter ouvido
a outra música, menos primitiva, do gordo pássaro pardo
cantando acima da bomba de gasolina quebrada
numa igreja de bambu de um barroco jesuítico:
três torres, cinco cruzes prateadas.
— sim, uma pena não ter refletido,
confusa e inconclusivamente,
sobre a relação que existiria há séculos
entre o mais tosco calçado de madeira
e, cuidadosas, caprichosas,
as formas fantásticas das gaiolas de madeira.
— jamais ter estudado história
na caligrafia fraca das gaiolas.
— e nunca ter ouvido essa chuva
tão parecida com discurso de político:
duas horas de oratória implacável
e de súbito um silêncio de ouro
em que a viajante abre o caderno e escreve:
""será falta de imaginação o que nos faz buscar
lugares imaginados tão distantes do lar?
ou pascal se enganou quando escreveu
que é em nosso quarto que devíamos ficar?
continente, cidade, país: não é tão ampla
a escolha, a liberdade, quanto se deseja.
aqui, ali... não. teria sido melhor ficar em casa,
onde quer que isso seja?""",0.0
"on the unbreathing sides of hills
they play, a specklike girl and boy,
alone, but near a specklike house.
the sun’s suspended eye
blinks casually, and then they wade
gigantic waves of light and shade.
a dancing yellow spot, a pup,
attends them. clouds are piling up;
a storm piles up behind the house.
the children play at digging holes.
the ground is hard; they try to use
one of their father’s tools,
a mattock with a broken haft
the two of them can scarcely lift.
it drops and clangs. their laughter spreads
effulgence in the thunderheads,
weak flashes of inquiry
direct as is the puppy’s bark.
but to their little, soluble,
unwarrantable ark,
apparently the rain’s reply
consists of echolalia,
and mother’s voice, ugly as sin,
keeps calling to them to come in.
children, the threshold of the storm
has slid beneath your muddy shoes;
wet and beguiled, you stand among
the mansions you may choose
out of a bigger house than yours,
whose lawfulness endures.
its soggy documents retain
your rights in rooms of falling rain.","na ilharga inerte do morro, à tarde,
dois pontos, menina e menino, brincando,
a sós, junto a um outro ponto, uma casa.
o sol pisca o olho de vez em quando,
e os dois atravessam enormes ondas
que se sucedem, de luz e sombra.
um cisco amarelo os acompanha,
um cachorrinho. atrás da montanha
nuvens de chuva crescem mais e mais.
as crianças cavam buracos. o chão
é duro; elas tentam utilizar
uma ferramenta do pai, um alvião
imenso, de cabo quebrado,
que mal conseguem erguer de tão pesado.
a ferramenta cai. as gargalhadas
iluminam as nuvens arroxeadas,
fracos lampejos interrogativos,
diretos como o latir do cachorro.
mas para as crianças, naquele abrigo
solúvel, indesculpável, no morro,
a resposta da chuva é tão vazia
quanto uma vaga ecolalia,
e a voz da mãe, antipática e insistente,
manda que entrem imediatamente.
crianças, o temporal foi mais ligeiro
que os seus pés enlameados a correr;
logradas, molhadas, vocês estão no meio
de muitas mansões, e podem escolher
dentre elas uma casa para ser sua,
com direito inclusive a escritura.
papéis molhados lhes garantem a posse
desses palácios de chuva grossa.",en_XX,pt_XX,"nos lados silenciosos das colinas
eles brincam, uma garota e um menino,
sós, mas perto de uma casa minúscula.
o olho suspenso do sol
piscar casualmente, e então eles avançam
gigantes ondas de luz e sombra.
um ponto amarelo dançante, um filhote,
os acompanha. nuvens se acumulam;
uma tempestade se forma atrás da casa.
as crianças brincam de cavar buracos.
o chão é duro; tentam usar
uma das ferramentas do pai,
uma enxada com cabo quebrado
os dois mal conseguem erguer.
ela cai e bate. sua risada se espalha
fulgência nas nuvens de trovão,
fracos clarões de interrogação
diretos como o latido do cachorrinho.
mas para o pequeno, solúvel,
indefensável arca,
aparentemente a resposta da chuva
consiste em ecolalia,
e a voz da mãe, feia como o pecado,
continua chamando-os para entrar.
crianças, o limiar da tempestade
deslizou sob seus sapatos sujos;
molhados e enganados, vocês estão entre
as mansões que podem escolher
fora de uma casa maior que a de vocês,
cuja legitimidade perdura.
seus documentos encharcados mantêm
seus direitos em salas de chuva.",0.0
"[brazil. a friend of the writer is speaking.]
half squatter, half tenant (no rent) —
a sort of inheritance; white,
in your thirties now, and supposed
to supply me with vegetables,
but you don’t; or you won’t; or you can’t
get the idea through your brain —
the world’s worst gardener since cain.
tilted above me, your gardens
ravish my eyes. you edge
the beds of silver cabbages
with red carnations, and lettuces
mix with alyssum. and then
umbrella ants arrive,
or it rains for a solid week
and the whole thing’s ruined again
and i buy you more pounds of seeds,
imported, guaranteed,
and eventually you bring me
a mystic three-legged carrot,
or a pumpkin “bigger than the baby.”","[brasil. fala uma amiga da escritora.]
rendeiro que veio com a terra
(mas nunca paga aluguel) —
branco, trintão, meu suposto
fornecedor de legumes,
só que não quer, ou não sabe,
fornecer nada pra mim —
o pior hortelão desde caim.
sua horta, lá no alto, torta,
é uma festa pros olhos. nas beiras
dos canteiros de repolho
você planta cravos, e alface
misturada com escudinha.
então vêm as saúvas, ou
chove uma semana inteira,
e tudo se perde outra vez
e eu lhe dou sementes aos quilos,
importadas, garantidas,
e um dia você me traz
uma cenoura mística, trípede,
ou uma abóbora “maior que um bebê”.",en_XX,pt_XX,"[Brasil. Um amigo do escritor está falando.]

Meio invasor, meio inquilino (sem aluguel) —
um tipo de herança; branco,
na casa dos trinta agora, e suposto
a me fornecer vegetais,
mas não; ou não quer; ou não consegue
entender na cabeça —
o pior jardineiro do mundo desde caim.
Inclinados acima de mim, seus jardins
deslumbram meus olhos. você contorna
as camas de repolhos prateados
com cravinas vermelhas, e alfaces
se misturam com alyssum. e então
formigas-abelha chegam,
ou chove por uma semana inteira
e tudo se estraga de novo
e compro mais libras de sementes para você,
importadas, garantidas,
e eventualmente você me traz
uma mística cenoura de três pernas,
ou uma abóbora ""maior que o bebê"".",0.0
"i watch you through the rain,
trotting, light, on bare feet,
up the steep paths you have made —
or your father and grandfather made —
all over my property,
with your head and back inside
a sodden burlap bag,
and feel i can’t endure it
another minute; then,
indoors, beside the stove,
keep on reading a book.
you steal my telephone wires,
or someone does. you starve
your horse and yourself
and your dogs and family.
among endless variety,
you eat boiled cabbage stalks.
and once i yelled at you
so loud to hurry up
and fetch me those potatoes
your holey hat flew off,
you jumped out of your clogs,
leaving three objects arranged
in a triangle at my feet,
as if you’d been a gardener
in a fairy tale all this time
and at the word “potatoes”
had vanished to take up your work
of fairy prince somewhere.","eu vejo você caminhando,
pés ágeis, descalços, na chuva,
subindo os caminhos íngremes
que você, ou seu pai, ou seu avô,
abriram por toda a minha terra,
cabeça e costas protegidas
por um saco de aniagem, e sinto
que não aguento mais um minuto;
depois, junto à estufa, mergulho
na leitura de algum livro.
você, ou alguém, me rouba
os fios telefônicos. você
passa fome, e faz passar fome
seu cavalo, seu cão, sua família.
no meio de tanta fartura
você come caule de repolho.
e uma vez gritei com você
tão alto pra me trazer logo
aquelas batatas, que o seu
chapéu furado voou, e
você saiu sem os tamancos,
deixando três objetos
num triângulo a meus pés,
como se fosse um jardineiro
de alguma história de fadas,
que ao ouvir a palavra “batatas”
sumisse, pra virar príncipe
nalgum país encantado.",en_XX,pt_XX,"te vejo através da chuva,
troteando leve, descalço,
subindo caminhos íngremes —
que você ou seu pai e avô fez —
por toda minha propriedade,
com a cabeça e as costas dentro
de um saco de aniagem encharcado,
e sinto que não posso suportar
mais um minuto; então,
dentro de casa, junto à lareira,
continuo lendo um livro.
você rouba meus fios telefônicos,
ou alguém o faz. você esfomeia
seu cavalo e a si mesmo
e seus cães e família.
entre infinita variedade,
você come talos de repolho cozidos.
e uma vez gritei tanto
pra você se apressar
e buscar aquelas batatas
seu chapéu furado voou,
você pulou fora das galochas,
deixando três objetos arranjados
em triângulo aos meus pés,
como se fosse um jardineiro
em conto de fadas todo esse tempo
e ao ouvir ""batatas""
tivesse desaparecido para retomar
seu trabalho de príncipe encantado em algum lugar.",0.0
"the strangest things happen, to you.
your cow eats a “poison grass”
and drops dead on the spot.
nobody else’s does.
and then your father dies,
a superior old man
with a black plush hat, and a moustache
like a white spread-eagled sea gull.
the family gathers, but you,
no, you “don’t think he’s dead!
i look at him. he’s cold.
they’re burying him today.
but you know, i don’t think he’s dead.”
i give you money for the funeral
and you go and hire a bus
for the delighted mourners,
so i have to hand over some more
and then have to hear you tell me
you pray for me every night!
and then you come again,
sniffing and shivering,
hat in hand, with that wistful
face, like a child’s fistful
of bluets or white violets,
improvident as the dawn,
and once more i provide
for a shot of penicillin
down at the pharmacy, or
one more bottle of
electrical baby syrup.
or, briskly, you come to settle
what we call our “accounts,”
with two old copybooks,
one with flowers on the cover,
the other with a camel.
immediate confusion.
you’ve left out the decimal points.
your columns stagger,
honeycombed with zeros.
you whisper conspiratorially;
the numbers mount to millions.
account books? they are dream books.
in the kitchen we dream together
how the meek shall inherit the earth —
or several acres of mine.","tem coisas que só acontecem
com você. sua vaca come
“capim veneno” e cai morta.
não morre nenhuma outra vaca.
depois quem morre é seu pai,
um velho alinhado, chapéu
de feltro preto, e um bigode
que é como asas de gaivota.
toda a família reunida,
e você: “ele não morreu não!
eu olho pra ele. está frio.
o enterro é hoje. mas eu
acho que ele não morreu.”
eu dou dinheiro pro enterro,
você vai e aluga um ônibus
pra satisfação geral,
e eu tenho que lhe dar mais,
e você ainda vem me dizer
que reza por mim toda noite!
depois me aparece de novo,
fungando e tremendo, chapéu
na mão, com uma cara triste
feito um punhado de violetas
brancas em mão de criança,
negligente como a aurora,
e eu mais uma vez financio
uma injeção de penicilina
lá na farmácia, ou um vidro
de xarope infantil elétrico.
ou então, chega todo enérgico
pra “fazer as contas” comigo,
com dois cadernos velhos, um
com flores na capa, o outro
um camelo. confusão
imediata. você esqueceu
as vírgulas decimais.
as colunas estão tortas,
uma colmeia de zeros.
você cochicha baixinho
que nem um conspirador;
as cifras chegam a milhões.
contas? que contas? são sonhos.
na cozinha sonhamos juntos
que os mansos possuirão a terra —
ou vários hectares da minha.",en_XX,pt_XX,"Há coisas que só acontecem
contigo. tua vaca come
""capim veneno"" e cai morta.
nenhuma outra vaca morre.
depois quem morre é teu pai,
um velho alinhado, chapéu
de feltro preto, e um bigode
que é como asas de gaivota.
toda a família reunida,
e tu: ""ele não morreu não!
eu olho pra ele. está frio.
o enterro é hoje. mas eu
acho que ele não morreu.""
eu dou dinheiro pro enterro,
tu vais e alugas um ônibus
pra satisfação geral,
e eu tenho que te dar mais,
e tu ainda vens me dizer
que rezas por mim toda noite!
depois reapareces, fungando
e tremendo, chapéu
na mão, com uma cara triste
feito um punhado de violetas
brancas em mão de criança,
negligente como a aurora,
e eu mais uma vez financio
uma injeção de penicilina
lá na farmácia, ou um vidro
de xarope infantil elétrico.
ou então, chegas todo enérgico
pra ""fazer as contas"" comigo,
com dois cadernos velhos, um
com flores na capa, o outro
um camelo. confusão
imediata. esqueceste
as vírgulas decimais.
as colunas estão tortas,
uma colmeia de zeros.
tu cochichas baixinho
que nem um conspirador;
as cifras chegam a milhões.
contas? que contas? são sonhos.
na cozinha sonhamos juntos
que os mansos possuirão a terra —
ou vários hectares dos meus.",0.0
"with blue sugar bags on their heads,
carrying your lunch,
your children scuttle by me
like little moles aboveground,
or even crouch behind bushes
as if i were out to shoot them!
— impossible to make friends,
though each will grab at once
for an orange or a piece of candy.
twined in wisps of fog,
i see you all up there
along with formoso, the donkey,
who brays like a pump gone dry,
then suddenly stops.
— all just standing, staring
off into fog and space.
or coming down at night,
in silence, except for hoofs,
in dim moonlight, the horse
or formoso stumbling after.
between us float a few
big, soft, pale-blue,
sluggish fireflies,
the jellyfish of the air...
patch upon patch upon patch,
your wife keeps all of you covered.
she has gone over and over
(forearmed is forewarned)
your pair of bright-blue pants
with white thread, and these days
your limbs are draped in blueprints.
you paint — heaven knows why —
the outside of the crown
and brim of your straw hat.
perhaps to reflect the sun?
or perhaps when you were small,
your mother said, “manuelzinho,
one thing: be sure you always
paint your straw hat.”
one was gold for a while,
but the gold wore off, like plate.
one was bright green. unkindly,
i called you klorophyll kid.
my visitors thought it was funny.
i apologize here and now.
you helpless, foolish man,
i love you all i can,
i think. or do i?
i take off my hat, unpainted
and figurative, to you.
again i promise to try.","sacos de açúcar na cabeça,
carregando o almoço do pai,
seus filhos correm ao me ver,
toupeirinhas fora da toca,
ou escondem-se atrás das moitas
como se eu fosse caçá-los!
— impossível conquistá-los,
mas se trago laranja ou bala
vêm logo pegar, correndo.
entre fiapos de bruma
vejo vocês lá no alto,
mais formoso, o burro, que zurra
como bomba em poço sem água,
e de repente se cala.
— todos parados, os olhares
perdidos no espaço e na névoa.
ou então descendo, à noite,
em silêncio, fora os cascos
do cavalo ou do formoso
vindo atrás, num vago luar.
flutuando entre nós, passam
vaga-lumes moles, grandes,
preguiçosos, azulados,
as águas-vivas do ar...
com um remendo aqui, outro ali,
sua mulher veste vocês todos.
já retocou tantas vezes
(melhor que prevenir é remediar)
suas calças azul-cheguei
com linha branca, que parecem
uma cópia heliográfica.
você pinta — só deus sabe
por quê — a copa e a aba
do seu chapéu de palha.
é pra refletir o sol?
ou foi sua mãe que lhe disse
quando menino: “manuelzinho,
veja lá: nunca esqueça
de pintar o seu chapéu.”
um foi dourado uns tempos,
mas o ouro gastou. o outro
era verde vivo. eu, maldosa,
chamei-o de “kid klorofila”.
meus amigos acharam graça.
peço sinceras desculpas.
seu tonto, seu incapaz,
gosto de você demais,
eu acho. mas isso é gostar?
tiro o chapéu — metafórico
e sem tinta — pra você.
de novo, prometo tentar.",en_XX,pt_XX,"com sacos de açúcar azuis na cabeça,
levando seu almoço,
seus filhos passam por mim
como pequenos toupeiras fora da toca,
ou mesmo se escondem atrás de arbustos
como se eu fosse atirar neles!
— impossível fazer amizade,
embora cada um agarre de pronto
uma laranja ou um doce.
envolto em baços de névoa,
vejo todos vocês aí em cima
junto com formoso, o jumento,
que zurra como uma bomba d'água seca,
depois pára de repente.
— todos ali, parados, olhando
para a névoa e o espaço vazio.
ou descendo à noite,
em silêncio, exceto pelos cascos,
na luz pálida da lua, o cavalo
ou formoso tropeçando atrás.
entre nós flutuam alguns
grandes, moles, pálidos vagalumes,
as medusas do ar...
mancha sobre mancha sobre mancha,
sua esposa cobre todos vocês.
ela passou e repassou
(prevenir é precaver)
sua calça azul-brilhante
com linha branca, e estes dias
seus membros estão cobertos por plantas.
você pinta — quem sabe por quê —
o lado de fora da coroa
e da aba do chapéu de palha.
talvez para refletir o sol?
ou talvez quando você era pequeno,
sua mãe disse: ""manuelzinho,
uma coisa: sempre pinte
seu chapéu de palha.""
um foi dourado por um tempo,
mas o dourado se desgastou, como louça.
um foi verde-brilhante. sem cerimônia,
chamei você de garoto clorofila.
meus visitantes acharam engraçado.
aqui e agora me desculpo.
você, homem inerte e tolo,
amo tanto quanto posso,
acho que sim. ou não?
tiro meu chapéu, sem pintura
e figurativo, para vocês.
mais uma vez prometo tentar.",0.0
"hidden, oh hidden
in the high fog
the house we live in,
beneath the magnetic rock,
rain-, rainbow-ridden,
where blood-black
bromelias, lichens,
owls, and the lint
of the waterfalls cling,
familiar, unbidden.
in a dim age
of water
the brook sings loud
from a rib cage
of giant fern; vapor
climbs up the thick growth
effortlessly, turns back,
holding them both,
house and rock,
in a private cloud.
at night, on the roof,
blind drops crawl
and the ordinary brown
owl gives us proof
he can count:
five times — always five —
he stamps and takes off
after the fat frogs that,
shrilling for love,
clamber and mount.","oculta, oculta,
na névoa, na nuvem,
a casa que é nossa,
sob a rocha magnética,
exposta a chuva e arco-íris,
onde pousam corujas
e brotam bromélias
negras de sangue, liquens
e a felpa das cascatas,
vizinhas, íntimas.
numa obscura era
de água
o riacho canta de dentro
da caixa torácica
das samambaias gigantes;
por entre a mata grossa
o vapor sobe, sem esforço,
e vira para trás, e envolve
rocha e casa
numa nuvem só nossa.
à noite, no telhado,
gotas cegas escorrem,
e a coruja canta sua copla
e nos prova
que sabe contar:
cinco vezes — sempre cinco —
bate o pé e decola
atrás das rãs gordas, que
coaxam de amor
em plena cópula.",en_XX,pt_XX,"oculto, oh oculto
na névoa alta
a casa onde vivemos,
sob a rocha magnética,
chuva-, arco-íris-travessada,
onde brómulas negras,
líquens,
corujas, e o lixo
das cachoeiras se agarram,
familiares, inesperados.
numa era sombria
de água
o riacho canta alto
de uma caixa torácica
de samambaia gigante; vapor
sobe pela vegetação densa
sem esforço, retorna,
mantendo ambos,
casa e rocha,
numa nuvem privada.
à noite, no telhado,
gotas cegas rastejam
e a coruja marrom ordinária
nos dá prova
de que sabe contar:
cinco vezes — sempre cinco —
ele carimba e decola
após os sapos gordos que,
gritando por amor,
escalando e montando.",0.0
