original_poem,translated_poem,src_lang,tgt_lang,translated_by_TA,topic
"but, for the general award of love,
the little sweet doth kill much bitterness;
though dido silent is in under-grove,
and isabella’s was a great distress,
though young lorenzo in warm indian clove
was not embalm’d, this truth is not the less -
even bees, the little almsmen of spring-bowers,
know there is richest juice in poison-flowers.","mais, soyons juste envers l'amour.
un peu de bonheur fait oublier beaucoup de tristesse;
didon resta silencieuse sous son bosquet,
la détresse d'isabelle fut extrême,
cependant le jeune lorenzo ne fut pas embaumé avec des épices
de l'inde torride, cette vérité est incontestable—
même les abeilles, ces petites mendiantes des berceaux printaniers
savent que la plus grande abondance de suc se trouve dans les fleurs empoisonnées.",en_XX,fr_XX,"Mais pour la récompense générale de l'amour,
Le petit doux tue beaucoup d'amertume ;
Bien que Didon garde le silence sous le bosquet,
Et qu'Isabelle ait connu une grande détresse,
Bien que le jeune Lorenzo dans un clou de girofle chaud des Indes
N'ait pas été embaumé, cette vérité n'en est pas moins vraie -
Même les abeilles, les petits aumôniers des bosquets de printemps,
Savent qu'il y a un jus plus riche dans les fleurs empoisonnées.",1
"«love, isabel!» said he, «i was in pain
«lest i should miss to bid thee a good morrow:
«ah! what if i should lose thee, when so fain
«i am to stifle all the heavy sorrow
«of a poor three hours’ absence? but we’ll gain
«out of the amorous dark what day doth borrow.
«good bye! i’ll soon be back.» - «good bye!» said she: -
and as he went she chanted merrily.","«mon amour, isabelle», dit-il, «je craignais
de ne pouvoir t'adresser un tendre adieu:
ah! si j'allais te perdre, pendant que contraint
je suis d'étouffer mon pesant chagrin
d'être séparé de toi trois tristes heures? mais nous regagnerons
dans l'amoureuse obscurité ce que le jour nous fait perdre.
adieu! je serai bientôt de retour». «adieu», dit-elle:
et comme il s'éloignait, elle chantait heureuse.",en_XX,fr_XX,"«amour, isabel!» dit-il, «j'étais en douleur
«de peur de manquer de te souhaiter un bonjour:
«ah! et si je devais te perdre, quand si désireux
«je suis d'étouffer toute la lourde peine
«d'une pauvre absence de trois heures? mais nous gagnerons
«de l'obscurité amoureuse ce que le jour emprunte.
«au revoir! je serai bientôt de retour.» - «au revoir!» dit-elle: -
et tandis qu'il partait, elle chantait joyeusement.",1
"but selfishness, love’s cousin, held not long
its fiery vigil in her single breast;
she fretted for the golden hour, and hung
upon the time with feverish unrest -
not long - for soon into her heart a throng
of higher occupants, a richer zest,
came tragic; passion not to be subdued,
and sorrow for her love in travels rude.","mais l'égoïsme, cousin de l'amour, n'imposa pas longtemps
sa brûlante insomnie en son sein seulement;
elle se consuma dans l'attente de l'heure fortunée et compta
les instants fièvreusement, haletante, sans relâche—
pas longtemps—car bientôt sur son cœur une infinité
de tourments plus nobles, une douleur plus aiguë
s'abattit tragiquement; passion insurmontable,
et cruelle inquiétude pour les voyages de son amant.",en_XX,fr_XX,"Mais l'égoïsme, cousin de l'amour, ne tint pas longtemps
sa vigile ardente dans son sein unique ;
elle se tourmentait pour l'heure dorée, et se suspendait
au temps avec une agitation fiévreuse -
pas longtemps - car bientôt dans son cœur une foule
de nouveaux occupants, un zeste plus riche,
arriva tragiquement ; une passion impossible à maîtriser,
et la douleur pour son amour dans des voyages rudes.",1
"«i know what was, i feel full well what is,
«and i should rage, if spirits could go mad;
«though i forget the taste of earthly bliss,
«that paleness warms my grave, as though i had
«a seraph chosen from the bright abyss
«to be my spouse: thy paleness makes me glad;
«thy beauty grows upon me, and i feel
«a greater love through all my essence steal.»","je sais ce qui était. je ressens pleinement ce qui est,
et je deviendrais fou, si les esprits le pouvaient;
pourtant j'oublie le goût de la félicité terrestre,
cette pâleur réchauffe ma tombe, comme si par moi
un séraphin sortant des noirs abîmes avait été choisi
pour me servir d'épouse: ta pâleur me rend heureux;
ta beauté enveloppe tout mon être, et je sens
un amour plus puissant pénétrer mon essence.»",en_XX,fr_XX,"Je sais ce qui était, je ressens pleinement ce qui est,
Et je devrais être en rage, si les esprits pouvaient devenir fous ;
Bien que j'oublie le goût de la béatitude terrestre,
Cette pâleur réchauffe ma tombe, comme si j'avais
Un séraphin choisi parmi l'abîme brillant
Pour être mon époux : ta pâleur me réjouit ;
Ta beauté grandit en moi, et je sens
Un amour plus grand s'emparer de tout mon être.",1
"a third time pass’d they by, and, passing, turn’d
each one the face a moment whiles to me;
then faded, and to follow them i burn’d
and ached for wings, because i knew the three;
the first was a fair maid, and love her name;
the second was ambition, pale of cheek,
and ever watchful with fatiguèd eye;
the last, whom i love more, the more of blame
is heap’d upon her, maiden most unmeek,—
i knew to be my demon poesy.","une troisième fois encore elles passèrent, et en passant, tournèrent
chacune leur face, l'espace d'un moment, vers moi;
puis elles disparurent; et pour les suivre, ardent
et haletant, je souhaitais des ailes parce que je reconnaissais les trois.
la première était une belle jeune fille, qui s'appelait l'amour;
la seconde était l'ambition, les joues pâles,
toujours aux aguets, les yeux caves.
la dernière, ma préférée, celle qui le plus de blâme
accumula sur sa tête, jeune fille sans pitié,
je la reconnus pour mon démon, c'était la poésie.",en_XX,fr_XX,"Ils passèrent une troisième fois, et, en passant, se tournèrent
chacun le visage un instant vers moi ;
puis s'évanouirent, et les suivre je brûlais
et languissais pour des ailes, car je connaissais les trois ;
la première était une belle jeune fille, et son nom était l'amour ;
la deuxième était l'ambition, pâle de visage,
et toujours vigilante de son œil fatigué ;
la dernière, que j'aime davantage, plus de blâme
est jeté sur elle, jeune fille la plus humble, —
je savais qu'elle était mon démon poésie.",1
"they told her how, upon st. agnes' eve,
young virgins might have visions of delight,
and soft adorings from their loves receive
upon the honey'd middle of the night,
if ceremonies due they did aright;
as, supperless to bed they must retire,
and couch supine their beauties, lily white;
nor look behind, nor sideways, but require
of heaven with upward eyes for all that they desire.","elles lui avaient dit comment la veille de sainte agnès,
de jeunes vierges pouvaient avoir des visions de délices,
et recevoir les tendres aveux de leurs amants,
a l'heure de minuit au parfum de miel,
si elles exécutaient ponctuellement les cérémonies requises;
comment, sans souper elles devaient se mettre au lit,
puis étendre leurs beaux corps, blancs comme des lis;
sans regarder derrière, ni de côté, mais implorer
du ciel, les yeux tournés vers lui, tout ce qu'elles désiraient.",en_XX,fr_XX,"Ils lui ont dit comment, la veille de la sainte Agnès,
de jeunes vierges pourraient avoir des visions de délice,
et recevoir des adorations douces de leurs amours
au milieu de la nuit miellée,
si les cérémonies dues étaient correctement accomplies ;
comme, sans souper, elles devaient se retirer au lit,
et se coucher sur le dos, leurs beautés, blancs comme le lys ;
ne regardant ni en arrière, ni sur les côtés, mais demandant
au ciel avec des yeux levés tout ce qu'elles désirent.",1
"so, purposing each moment to retire,
she linger'd still. meantime, across the moors,
had come young porphyro, with heart on fire
for madeline. beside the portal doors,
buttress'd from moonlight, stands he, and implores
all saints to give him sight of madeline,
but for one moment in the tedious hours,
that he might gaze and worship all unseen;
perchance speak, kneel, touch, kiss—in sooth such things have been.","ainsi, se proposant à chaque moment de se retirer,
elle tardait encore. pendant ce temps, traversant la lande,
etait arrivé le jeune porphyro, le cœur enflammé
pour madeline. accoudé contre le portail d'entrée,
arc-boutant éclairé par la lune, debout, il implore
tous les saints de lui accorder de voir madeline,
ne fût-ce qu'une seconde, pendant ces pénibles heures,
qu'il puisse la contempler et l'adorer, invisible pour tous;
par aventure parler, s'agenouiller, toucher, baiser—en vérité que de telles joies surviennent.",en_XX,fr_XX,"Ainsi, voulant chaque instant se retirer,
elle tardait encore. Pendant ce temps, à travers les landes,
était venu le jeune Porphyro, le cœur en feu
pour Madeline. À côté des portes du portail,
soutenu de la lueur de la lune, il se tient et implore
tous les saints de lui donner vue sur Madeline,
ne serait-ce qu'un instant parmi les heures ennuyeuses,
pour qu'il puisse contempler et adorer en secret ;
peut-être parler, s'agenouiller, toucher, embrasser - en vérité, de telles choses ont déjà été.",1
