original_poem,translated_poem,src_lang,tgt_lang,translated_by_TA,topic
"he felt in modesty
his person was
half looking-glass,
for why should he
be doubled?
the glass must stretch
down his middle,
or rather down the edge.
but he’s in doubt
as to which side’s in or out
of the mirror.
there’s little margin for error,
but there’s no proof, either.
and if half his head’s reflected,
thought, he thinks, might be affected.","modesto, sentia
que sua pessoa
era metade espelho:
pois duplicar-se seria
um total destrambelho.
o vidro se prolonga
por sua mediana,
ou melhor, sua borda.
mas ele não sabe direito
o que está dentro ou fora
da imagem refletida.
não há muita margem de erro,
mas provar é impossível.
e se meio cérebro é reflexo
seu pensamento terá nexo?",en_XX,pt_XX,"Ele sentia em modéstia,
Seu ser era
Meio espelho,
Por que deveria
Ser dobrado?
O espelho deve se estender
Pelo meio,
Ou melhor, pela borda.
Mas ele está em dúvida
Sobre qual lado está dentro ou fora
Do espelho.
Há pouco espaço para erro,
Mas não há prova, também.
E se metade de sua cabeça é refletida,
Pensa, ele pensa, a mente pode ser afetada.",4.0
"part from the windows the small curtains set
sight more than light to omit!
look on the general fields, how bright they lie
under the broad blue sky,
cloudless, and the beginning of the heat
does the sight half ill-treat!
the bride hath wakened. lo! she feels her shaking
heart better all her waking!
her breasts are with fear's coldness inward clutched
and more felt on her grown,
that will by hands other than hers be touched
and will find lips sucking their budded crown.","separai nas janelas as leves cortinas:
desvelam mais que a luz omitem!
olhai o extenso campo, quão brilhante jaz
sob o amplo céu azul
sem nuvens, e o começo do calor
já faz quase mal à vista!
a noiva está acordando. eis! pressente o palpitar
do coração enquanto acorda!
seus seios são por frio receio contraídos,
mais cientes de no seu desabrochar
que mãos outras que as dela os tocarão
e terão lábios sorvendo as flóreas pontas.",en_XX,pt_XX,"Partindo das janelas, cortinas pequenas se erguem,
Visão mais que luz, exclui-se!
Olha os campos gerais, quão brilhantes jazem
Sob o amplo céu azul,
Sem nuvens, e o começo do calor
A visão maltrata, quase tortura!
A noiva despertou. Eis! Ela sente o coração tremendo,
Melhorando todo o seu despertar!
Seios com frio da ansiedade apertados,
Sensações mais em seu ser,
Que por mãos outras que não as suas serão tocados
E encontrarão lábios sugando sua coroa em botão.",4.0
"lo! the thought of the bridegroom's hands already
feels her about where even her hands are shy,
and her thoughts shrink till they become unready
she gathers up her body and still doth lie.
she vaguely lets her eyes feel opening.
in a fringed mist each thing
looms, and the present day is truly clear
but to her sense of fear.
like a hue, light lies on her lidded sight,
and she half hates the inevitable light.","eis! já as maõs-imagens do noivo sente
tocar mesmo onde as dela se acanham,
e seu pensar se encolhe até a indistinção.
ela soergue o corpo, deita-se contudo.
vagamente deixa os olhos sentir-se abrindo.
em franjada névoa cada coisa
imerge, e o presente dia é mesmo claro
menos ao seu senso-receio.
qual matiz, luz lhe jaz sobre pálpebras,
e quase odeia a inevitável luz.",en_XX,pt_XX,"Olá! A ideia das mãos do noivo já sente
Onde suas próprias mãos são tímidas, ela sente.
E seus pensamentos encolhem até se desfazerem,
Ela reúne seu corpo, ainda deitada se mantém.
Vagamente deixa seus olhos a abrir-se.
Na névoa franjada cada coisa
Aparece, e o presente dia é claro
Mas para o seu medo, nada mais é.
Como uma cor, a luz repousa em sua visão cerrada,
E ela odeia meio-termo essa luz inevitável.",4.0
"open the windows and the doors all wide
lest aught of night abide
or, like a ship's trail in the sea, survive
what made it there to live!
she lies in bed half waiting that her wish
grow bolder or more rich
to make her rise, or poorer, to oust fear,
and she rise as a common day were here.
that she would be a bride in bed with man
the parts where she is woman do insist
and send up messages that shame doth ban
from being dreamed but in a shapeless mist.","abram janelas e as portas de todo.
que nada da noite fique,
ou, qual rasto de barco no mar, resista
ao que a fez viver ali!
no leito fica, como à espera que o desejo
cresça mais, audaz e fértil
para erguê-la, ou tão tênue que expulse o medo,
e ela se erga como se comum fôsse o dia.
que se tornaria noiva na cama com homem
suas partes de mulher insistem
e mandam acima mensagens que o pudor proíbe
serem sonhadas salvo em vaga névoa.",en_XX,pt_XX,"abra as janelas e as portas bem amplas
para que nada da noite persista
ou, como o rastro de um navio nas águas, resista
o que lá foi feito, viva!
ela jaz na cama, à espera que seu desejo
se torne mais audaz ou rico
para que a faça erguer, ou mais pobre, expulsar o medo,
e ela surja como um dia comum surgisse.
que ela seja uma noiva na cama com um homem
as partes onde é mulher insistem
e enviam mensagens que a vergonha proíbe
de serem sonhadas, apenas em uma névoa indistinta.",4.0
"let the wide light come through the whole house now
like a herald with brow
garlanded round with roses and those leaves
that love for its love weaves!
between her and the ceiling this day's ending
a man's weight will be bending.
lo! with the thought her legs she twines, well knowing
a hand will part them then;
fearing that entering in her, that allowing
that will make softness begin rude at pain.
if ye, glad sunbeams, are inhabited
by sprites or gnomes that dally with the day
whisper her, if she shrink that she'll be bled,
that love's large bower is doored in this small way.","deixai que a plena luz já transpasse a casa tôda
qual arauto co'a fronte
em tais guirlandas de rosas e folhas
que o amor por amor se tece!
entre ela e o teto ao fim do dia
um homem arqueará seu pêso.
vê! a esta idéia as pernas cruza, bem sabendo
que mãos as virão separar;
temendo este entrar nela, o consentir
que fará ternura começar rude em dor.
se sois, gaios raios de sol, habitados
por espíritos ou gnomos que com o dia ludiam,
soprai-lhe, caso se encolha à idéia de sangrar,
que do amor à larga alcova tal porta estreita conduz.",en_XX,pt_XX,"Deixe a ampla luz entrar por toda a casa agora
como um arauto com fronte
guarnecida com rosas e aquelas folhas
que o amor tecendo para seu amor!
entre ela e o teto este dia findo
o peso de um homem se inclinará.
veja! com o pensamento suas pernas ela enlaça, bem sabendo
uma mão as separará então;
temendo que ao entrar nela, ao permitir
isso suavidade iniciará rude pela dor.
se vós, raios de sol alegres, sois habitados
por espíritos ou gnomos que brincam com o dia
sussurrar-lhe, se ela se retrair que será sangrada,
que o amplo recinto do amor é portado por esta pequena maneira.",4.0
"now is she risen. look how she looks down,
after her slow down-slid night-gown,
on her unspotted while of nakedness
save where the beast's difference from her white frame
hairily triangling black below doth shame
her to-day's sight of it, till the caress
of the chemise cover her body. dress!
stop not, sitting upon the bed's hard edge,
stop not to wonder at by-and-bye, nor guess!
list to the rapid birds i'th' window ledge!
up, up and washed! lo! she is up half-gowned,
for she lacks hands to have power to button fit
the white symbolic wearing, and she's found
by her maids thus, that come to perfect it.","já está de pé. vêde como olha abaixo,
ao lento deslisar da camisola,
o seu momento de nudez pura
salvo onde em sua alva feição, o contraste animal,
negros pelos triangulando embaixo, envergonha
vê-los hoje, até que a caricia
da camisa cubra seu corpo. veste-te!
não pares, sentada à ardua borda da cama,
não pares a indagar o vir-a-ser, a adivinhar!
ouve as aves rápidas na beira da janela!
levanta-te e lava-te! eis! de pé, meio vestida
pois lhe faltam mãos que os botões possam fechar
da simbólica veste branca, assim a encontraram
suas damas, que vieram enfeitá-la.",en_XX,pt_XX,"agora ela está erguida. veja como ela olha para baixo,
depois de seu descenso lento, o roupão noturno desliza,
sobre sua brancura intacta de nudez
salvo onde a diferença da fera de seu quadro alvo
cabeludamente triangulando negro embaixo a envergonha
seu olhar de hoje, até que o carinho
da camisola cubra seu corpo. veste-te!
não pare, sentada na borda dura da cama,
não pare para admirar aos poucos, nem adivinhar!
escute os pássaros rápidos na beira da janela!
levanta-te, levanta-te e lava-te! olha, ela está meio vestida,
pois lhe faltam mãos para ter poder de ajustar
o vestir simbólico branco, e é encontrada
por suas criadas assim, que vêm para completar.",4.0
"look how over her seeing-them-not her maids
smile at each other their same thoughts or her!
already is she deflowred in others' thoughts.
with curious carefulness of inlocked braids,
with hands that in the sun minutely stir,
one works her hair into concerted knots.","vêde como, sobre ela não vê-las, as jovens
entre si sorriem o mesmo pensar dela!
já está deflorada em outras mentes.
com raro cuidado, em cerradas tranças,
e mãos que ao sol se movem em minúcias,
dispõe-lhe uma os cabelos em belos laços.",en_XX,pt_XX,"veja como sobre ela, sem vê-los, suas criadas
sorriem uma para a outra, pensamentos iguais ou dela!
já foi desflorada nos pensamentos dos outros.
com curiosa cuidadosa destreza de tranças enclavinhadas,
com mãos que ao sol se movem minuciosamente,
uma trança seu cabelo em nós concordantes.",4.0
"another buttons tight the gown; her hand,
touching the body's warmth of life, doth band
her thoughts with the rude bridegroom's hand to be.
the first then, on the veil placed mistily,
lays on her head, her own head sideways leaning,
the garland soon to have no meaning.
the other, at her knees, makes the white shoon
fit close the trembling feet, and her eyes see
the stockinged leg, road upwards to that boon
where all this day centres its revelry.","um'outra ajusta-lhe a veste; a mão
tocando o corpóreo calor de vida, reata
seu pensar à mão do noivo, que rude será.
a primeira, posta em névoa, sobre o véu
pousa-lhe à cabeça, de lado a sua inclinando,
a grinalda, tão logo sem sentido.
a outra, de joelhos, faz os sapatos brancos
se estreitarem aos trêmulos pés e seus olhos vêem
na meia as pernas, e correm acima àquele bem
onde todo este dia a folia centra.",en_XX,pt_XX,"Outra prende o vestido justo; sua mão,
toca o calor do corpo vivo, e então,
amarra seus pensamentos com a rude mão
do noivo. A primeira, neblina no véu,
coloca sobre sua cabeça, inclinando-se,
a grinalda que em breve terá nenhum véu.
A outra, aos seus joelhos, ajusta o sapato branco
para caber nos tremulentos pés, e seus olhos vêem
a perna de meia, caminho ascendente ao prêmio
onde toda essa jornada centraliza a alegria.",4.0
"so are all things, that between this and dark
will be passed, a dim work
of minutes, hours seen in a sleep, and dreamed
untimed and wrongly deemed.
the bridal and the walk back and the feast
are all for each a mist
where he sees others through a blurred hot notion
of drunk and veined emotion,
and a red race runs through his seeing and hearing,
a great carouse of dreams seen each on each,
till their importunate careering
a stopped, half-hurting point of mad joy reach.","assim é tudo, que daqui ao ocaso
se dará, obra obscura
dos minutos, horas em sono vistas, e sonhadas
atemporais e despercebidas.
as bodas e o regresso e a festa
é tudo pra todos névoa
onde um vê os outros numa quente imagem vaga
de ébria emoção nas veias,
e rubra corrida transpassa seu ver e ouvir,
grande ebrifesta de sonhos um no outro vistos,
até que o intempestivo atropelo
num quasi dorido ponto de insana alegria estanca.",en_XX,pt_XX,"Assim são todas as coisas, entre luz e sombra
passarão, um trabalho tênue
de minutos, horas vistas num sono, e sonhadas
sem tempo e mal julgadas.
O casamento e o retorno e a festa
são para cada qual uma névoa
onde vê os outros através de uma confusa emoção quente
de embriaguez e veia pulsante,
e uma corrida rubra percorre sua visão e audição,
uma grande orgia de sonhos vistos cada qual no outro,
até sua invasiva corrida
um ponto travado, meio dolorido de louco prazer atingir.",4.0
"the bridegroom aches for the end of this and lusts
to know those paps in sucking gusts,
to put his first hand on that belly's hair
and feel for the lipped lair,
the fortress made to be taken, for which
he feels the battering ram grow large and itch.
the trembling glad bride feels all the day hot
on that still cloistered spot
where only her maiden hand did feign
a pleasure's empty gain.
and, of the others, most will whisper at this,
knowing the spurt it is;
and children yet, that watch with looking eyes,
will now thrill to be wise
in flesh, and with big men and women act
the liquid tickling fact
for whose taste they'll in secret corners try
they scarce know what still dry.","o noivo anseia pelo fim disso, lascivo
por ter estas têtas sorvendo em tormenta,
tocar primeira vez nos pelos do ventre
e apalpar a labiada toca,
fortaleza feita só prá ser vencida,
pela qual ele sente tumescer e prurir o aríete.
a trêmula alegre noiva sente todo o calor do dia
neste inda enclaustrado ponto
onde só sua mão de virgem noturnamente fingia
ganhar vazio prazer.
e disso é que irá murmurar a maioria,
sabendo qual arranque será;
e crianças ainda, que espiam com olhos atentos
já ante-vibram o saber da carne
e, homens e mulheres feitos, encenarão
o titilante líquido ato
cuja amostra tentam em secretos cantos
mal sabendo o quanto ainda é seco.",en_XX,pt_XX,"o noivo anseia pelo fim desta espera e almeja
conhecer aqueles seios em sugadas festas,
pôr sua primeira mão naquela barriga felpuda
e sentir a morada labial,
a fortaleza feita para ser tomada, pela qual
sente crescer o ímpeto e coçar como um aríete.
a tremula noiva feliz sente todo o dia ardente
naquele ainda recolhido ponto
onde só sua mão de donzela fingiu
um prazer de ganho vazio.
e, dos outros, muitos murmurarão a este respeito,
sabendo tratar-se de um jato breve;
e crianças ainda, que observam com olhos atentos,
agora estremecerão ao se fazerem sábias
na carne, e com homens e mulheres de fato
viverão a lúbrica realidade
cujo sabor em cantos secretos tentarão
o que mal sabem ainda é seco.",4.0
"no matter now or past or future. be
lover's age in your glee!
give all your thoughts to this great muscled day
that like a courser tears
the bit of time, to make night come and say
the maiden mount now her first rider bears!
flesh pinched, flesh bit, flesh sucked, flesh girt around,
flesh crushed and ground,
these things inflame your thoughts and make dim
in what ye say or seem!","o que já importa os idos ou porvir?
tendes a idade do amante, no prazer!
dai toda a mente a este grande musculado dia
que rompe qual corcel
o freio do tempo, fazendo a noite vir dizer
que a virgem sela já leva seu primeiro ginete!
carne apertada, mordida; carne sugada, cingida,
carne esmagada, oprimida,
tais coisas inflamam vossa mente e tornam turvas
vossa fala e face!",en_XX,pt_XX,"seja presente, passado ou futuro, não importa!
alegra-te, amante, com tua juventude eterna!
entrega todos os teus pensamentos a este dia imenso
que, como um corcel, rompe
o freio do tempo, para que a noite possa anunciar
que a donzela agora monta seu primeiro amante!
carne apertada, carne mordida, carne sugada, carne enlaçada,
carne esmagada e moída,
tais coisas inflamam teus pensamentos e obscurecem
tudo o que dizes ou pareces!",4.0
"and ye, that wed today, guess these instincts
of the concerted group in hints
yourselves from nature naturally have,
and your good future brave!
close lips, nude arms, felt breasts and organ mighty,
do your joy's night work rightly!
teach them these things, o day of pomp of heat!
leave them in thoughts such as must make the feat
of flesh inevitable and natural as
pissing when wish doth press!
let them cling, kiss and fit
together with natural wit,
and let the night, coming, teach them that use
for youth is in abuse!","e vós, que hoje casais, tomai tais instintos
do inteiro grupo, por alusões
que naturalmente tendes da natura,
e vosso bom futuro enfrentai!
lábios unidos, braços nus, sentidos seios, órgão potente,
fazei bem vossa alegre obra noturna!
mostra a eles coisas tais, oh dia da pompa do cio!
deixe-os em tal tenção que instigue ao feito
da carne, inevitável e natural
como mijar quando o impulso impele!
que se agarrem e se beijem
se ajustem com natural engenho,
e deixa a noite vinda mostrar tais hábitos
pois haja juventude!",en_XX,pt_XX,"E vós que hoje em laços entrastes, notai
os instintos que o grupo unido traz
em indícios que a natureza vos dá,
e o futuro bravo, ousai!
Lábios cerrados, braços nus, seios tocados e órgão forte,
fazei da noite de prazer um momento exato!
Ensinai-lhes essas coisas, ó dia de pompa e calor!
Deixai que em pensamentos fiquem marcas que façam o ato
da carne ser inevitável e natural como
mijar quando a vontade urge!
Que se agarrem, beijem e encaixem
com a natural malícia,
e que a noite que vem lhes ensine esse uso
pois na juventude está o abuso!",4.0
"o hands that once had clasped hadrian's warm hands,
whose cold now found them cold!
o hair bound erstwhile with the pressing bands!
o eyes half-diffidently bold!
o bare female male-body such
as a god's likeness to humanity!
o lips whose opening redness erst could touch
lust's seats with a live art's variety!
o fingers skilled in things not to be told!
o tongue which, counter-tongued, made the blood bold!
o complete regency of lust throned on
raged consciousness's spilled suspension!
these things that now must be no more.","oh mãos que já enlaçaram as de adriano ardentes,
cuja frieza agora as sente frias!
oh cabelos outrora atados por faixas!
oh olhos de meio-tímida audácia!
oh corpo, liso qual fêmea, masculino
se assemelhando um deus à humanidade!
oh lábios cujo róseo entreabrir podia tocar
tronos da volúpia com variações de arte viva!
oh dedos destros em coisas que não se diz!
oh língua que, outra tocando, tornava o sangue audaz!
oh total regência da luxúria entronizada
na vertida suspensão da consciência irada!
são coisas tais que já não devem ser.",en_XX,pt_XX,"mãos que outrora apertaram mãos de adriano,
agora frias, encontraram seu frio!
cabelos antes presos com tiras firmes!
olhos meio-difidentes e audazes!
corpo feminino masculino nu
tal qual a semelhança de um deus na humanidade!
lábios cuja vermelhidão ao abrir
tocado os assentos do desejo com arte viva!
dedos hábeis em coisas não a serem ditas!
língua que, contra-língua, fez o sangue audaz!
regência completa do desejo tronada sobre
a consciência enfurecida em suspensão derramada!
essas coisas que agora não mais devem ser.",4.0
"no warmth of his another's warmth demands.
now will his hands behind his head no more,
linked, in that posture giving all but hands,
on the projected body hands implore.
the rain falls, and he lies like one who hath
forgotten all the gestures of his love
and lies awake waiting their hot return.
but all his arts and toys are now with death.
this human ice no way of heat can move;
these ashes of a fire no flame can burn.
o hadrian, what will now thy cold life be?
what boots it to be lord of men and might?
his absence o'er thy visible empery
comes like a night,
nor is there morn in hopes of new delight.","nem seu calor, calor do outro reclama.
agora suas mãos atrás da cabeça não mais irão,
unidas, nesta postura dando tudo menos mãos,
mãos implorar sobre o corpo ofertado.
a chuva cai, e ele jaz como quem tenha
esquecido todos os gestos de seu amado
e jaz desperto esperando seu quente retorno.
mas toda sua arte e sua manha já é morte.
tal gelo humano nenhum calor comove;
tais cinzas de um fogo nem chama consome.
oh adriano, que já será de tua vida fria?
de que serve ser senhor de homens e mentes?
a ausência dele sobre teu visível império
cai como a noite,
sem uma aurora pra espera de novas delícias.",en_XX,pt_XX,"sem o calor daquele outro calor ele reclama.
agora suas mãos não mais atrás da cabeça repousam,
ligadas, naquela postura que tudo entrega, menos as mãos,
no corpo projetado, as mãos imploram.
a chuva cai, e ele jaz como um que houvesse
esquecido todos os gestos de seu amor
e jaz acordado, esperando seu ardente retorno.
mas todas suas artes e brinquedos agora são com a morte.
este gelo humano nenhuma forma de calor pode mover;
estas cinzas de fogo nenhuma chama pode queimar.
ó hadriano, o que será agora tua fria vida?
que proveito há em ser senhor dos homens e do poder?
sua ausência sobre teu império visível
vem como uma noite,
e não há manhã nas esperanças de novo prazer.",4.0
