original_poem,translated_poem,src_lang,tgt_lang,translated_by_TA,topic
"adieu la cour, adieu les dames,
adieu les filles et les femmes,
adieu vous dis pour quelques temps,
adieu vos plaisants passetemps;
adieu le bal, adieu la danse,
adieu mesure, adieu cadence,
tambourin, haubois et violons,
puisqu’à la guerre nous allons.
adieu les regards gracieux,
messagers des coeurs soucieux ;
adieu les profondes pensées,
satisfaites ou offensées ;
adieu les harmonieux sons
de rondeaux, dizains et chansons ;
adieu piteux département,
adieu regrets, adieu tourment,
adieu la lettre, adieu le page,
adieu la cour et l’équipage,
adieu l’amitié si loyale,
qu’on la pourrait dire royale,
etant gardée en ferme foi
par ferme coeur digne de roi.
adieu ma mie la dernière,
en vertus et beauté première ;
je vous prie me rendre à présent
le coeur dont je vous fis présent,
pour, en la guerre où il faut être,
en faire service à mon maître.
or quand de vous se souviendra,
l’aiguillon d’honneur l’époindra
aux armes et vertueux faits :
et s’il en sortait quelque effet
digne d’une louange entière,
vous en seriez seule héritière.
de votre coeur donc se souvienne,
car si dieu veut que je revienne,
je le rendrai en ce beau lieu.
or je fais fin à mon adieu.","adeus à corte, adeus às damas,
adeus meninas e senhoras,
adeus vos digo por uns tempos,
adeus suaves passatempos,
adeus ao baile, adeus à dança,
adeus compasso, adeus festança,
violas, bombos e guitarra,
pois que partimos para a guerra.
adeus olhares graciosos,
vozes dos corações ciosos;
adeus pensamentos perfeitos,
despeitados ou satisfeitos;
adeus harmonias fiéis
de canções, odes e rondéis;
adeus tristonho apartamento,
adeus saudades e tormento,
adeus ao mordomo e à letra,
adeus à corte, à etiqueta,
adeus amizade leal,
tanto quanto foras real,
guardada em fé digna de lei
por coração digno de rei.
adeus amiga destes dias,
primeira em beleza e valias;
peço-lhe que devolva aqui
o coração que lhe ofereci,
assim, na guerra onde estarei,
o meu senhor eu servirei.
quando de vós se recordar,
a honra o fará desviar
para as armas e os altos feitos:
se dele surtissem efeitos
dignos de aprovação inteira,
seríeis única herdeira,
lembrai pois vosso coração,
que pousarei na vossa mão
se então voltar querendo deus.
assim termino o meu adeus.",fr_XX,pt_XX,"adeus à corte, adeus às damas,
adeus às moças e às mulheres,
por algum tempo vos digo adeus,
adeus aos vossos divertimentos alegres;
adeus ao baile, adeus à dança,
adeus à medida, adeus à cadência,
tamboril, oboé e violinos,
pois para a guerra nós partimos.
adeus aos olhares graciosos,
mensageiros dos corações aflitos;
adeus aos pensamentos profundos,
satisfeitos ou ofendidos;
adeus aos sons harmoniosos
de rondós, sonetos e canções;
adeus à triste despedida,
adeus aos arrependimentos, adeus tormento,
adeus à carta, adeus à página,
adeus à corte e à comitiva,
adeus à amizade tão leal,
que poderia ser dita real,
sendo guardada em firme fé
por um coração firme digno de rei.
adeus, minha amada, a última,
em virtude e beleza a primeira;
peço-vos agora que me devolvais
o coração que vos ofereci,
para, na guerra em que é preciso estar,
servir ao meu senhor.
quando de vós se lembrar,
o aguilhão da honra o picará
para as armas e feitos virtuosos:
e se de lá sair algum feito
digno de louvor completo,
seríeis a única herdeira.
lembrai-vos então do vosso coração,
pois se Deus quiser que eu retorne,
eu o restituirei neste belo lugar.
agora ponho fim ao meu adeus.",1
"sans trop d’ardeur à la fois enflammant
la rose qui cruelle ou déchirée et lasse
même du blanc habit de pourpre le délace
pour ouïr dans sa chair pleurer le diamant
oui sans ces crises de rosée et gentiment
ni brise quoique, avec, le ciel orageux passe
jalouse d’apporter je ne sais quel espace
au simple jour le jour très vrai du sentiment
ne te semble-t-il pas, mary, que chaque année
dont sur ton front renaît la grâce spontanée
suffise selon quelque apparence et pour moi
comme un éventail frais dans la chambre s’étonne
à raviver du peu qu’il faut ici d’émoi
toute notre native amitié monotone.","sem tanto ardor embora ainda flamante
a rosa que cruel ou lacerada e lassa
se deveste do alvor que a púpura deslaça
para em sua carne ouvir o choro do diamante
sim sem crises de orvalho antes em doce alento
nem brisa o fragor do céu leve ao fracasso
com ciúme de criar não sei bem qual espaço
no simples dia o dia real do sentimento,
não te ocorre, talvez, que a cada ano que passa
quando em tua fronte se alça o encanto ressurreto
basta-me um dom qualquer natural de tua graça
como na alcova o cintilar de um leque inquieto
a reviver do pouco de emoção que grassa
todo o nosso nativo e monótono afeto.",fr_XX,pt_XX,"sem muito ardor de uma vez inflamando
a rosa, cruel ou despedaçada e cansada
mesmo do branco hábito de púrpura desatando
para ouvir em sua carne chorar o diamante
sim, sem essas crises de orvalho e gentilmente
nem brisa, embora, com, o céu tempestuoso passe
com inveja de trazer não sei qual espaço
ao simples dia, o dia muito verdadeiro do sentimento
não te parece, maria, que a cada ano
em que em tua testa renasce a graça espontânea
basta, segundo alguma aparência e para mim
como um leque fresco na sala se surpreende
a reavivar do pouco que é preciso aqui de emoção
toda a nossa nativa amizade monótona.",2
"las de l’amer repos où ma paresse offense
une gloire pour qui jadis j’ai fui l’enfance
adorable des bois de roses sous l’azur
naturel, et plus las sept fois du pacte dur
de creuser par veillée une fosse nouvelle
dans le terrain avare et froid de ma cervelle,
fossoyeur sans pitié pour la stérilité,
– que dire à cette aurore, ô rêves, visité
par les roses, quand, peur de ses roses livides,
le vaste cimetière unira les trous vides? –
je veux délaisser l’art vorace d’un pays
cruel, et, souriant aux reproches vieillis
que me font mes amis, le passé, le génie,
et ma lampe qui sait pourtant mon agonie,
imiter le chinois au coeur limpide et fin
de qui l’extase pure est de peindre la fin
sur ses tasses de neige à la lune ravie
d’une bizarre fleur qui parfume sa vie
transparente, la fleur qu’il a sentie, enfant,
au filigrane bleu de l’âme se greffant.
et, la mort telle avec le seul rêve du sage,
serein, je vais choisir un jeune paysage
que je peindrais encor sur les tasses, distrait.
une ligne d’azur mince et pâle serait
un lac, parmi le ciel de porcelaine nue,
un clair croissant perdu par une blanche nue
trempe sa corne calme en la glace des eaux,
non loin de trois grands cils d’émeraude, roseaux.","cansado do ócio amargo onde meu tédio humilha
a gloria que me fez perder outrora a trilha
de uma infância de bosques e de rosas, puro.
azul matico e, ainda mais, do pacto duro.
de cavar toda noite uma fossa imponente
no território avaro e hostil da minha mente,
coebeiro impiedoso da esterilidade,
– quer dizer a esta aurora, ó sonho, infinidade
de rosas, se, temor de suas rosas frias,
o vasto cemitério une as valas vazias? –
quero deixar a arte voraz deste país
cruel, e sem ouvir as críticas senis
dos meus amigos, do passado, da poesia,
da lâmpada que sabe da minha agonia,
imitar o chinês de alma límpida e fina
cujo êxtase puro é pintar a ruína
sobre taças de neve à lua subtraída
de uma bizarra flor que lhe perfuma a vida
fluida, a flor que ele sentia ainda criança,
e à filigrana azul do espirito se entrança.
e como a morte, único sonho do saber,
sereno, uma paisagem cálida escolher,
que eu pintarei, indiferente, sobre a taça.
uma linha de azul fina e pálida traça
um lago, sob o céu de porcelana rara,
um crescente caído atrás da nuvem clara
molha no vidro de água um dos cornos aduncos
junto a três grandes cílios de esmeralda, juncos.",fr_XX,pt_XX,"nas do amargo repouso onde minha preguiça ofende
uma glória por quem outrora fugi da infância
adorável dos bosques de rosas sob o azul
natural, e mais cansado sete vezes do pacto duro
de cavar pela vigília uma nova cova
no terreno avarento e frio de minha mente,
coveiro sem piedade pela esterilidade,
- o que dizer a esta aurora, ó sonhos, visitada
pelas rosas, quando, medo de suas rosas lívidas,
o vasto cemitério unirá os buracos vazios? -
quero abandonar a arte voraz de uma terra
cruel, e, sorrindo para os reproches envelhecidos
que me fazem meus amigos, o passado, o gênio,
e minha lâmpada que conhece ainda minha agonia,
imitar o chinês de coração límpido e refinado
cujo puro êxtase é pintar o fim
em suas xícaras de neve à lua encantada
por uma estranha flor que perfuma sua vida
transparente, a flor que sentiu, criança,
sobre o filigrana azul da alma se enxertando.
e, a morte assim com o único sonho do sábio,
sereno, vou escolher uma jovem paisagem
que ainda pintaria nas xícaras, distraído.
uma linha de azul fina e pálida seria
um lago, entre o céu de porcelana nua,
um claro crescente perdido por uma branca nua
mergulha seu chifre calmo no gelo das águas,
não longe de três grandes cílios de esmeralda, juncos.",1
"mes bouquins refermés sur le nom de paphos,
il m’amuse d’élire avec le seul génie
une ruine, par mille écumes bénie
sous l’hyacinthe, au loin, de ses jours triomphaux.
coure le froid avec ses silences de faux,
je n’y hululerai pas de vide nénie
si ce très blanc ébat au ras du sol dénie
a tout site l’honneur du paysage faux.
ma faim qui d’aucuns fruits ici ne se régale
trouve en leur docte manque une saveur égale:
qu’un éclate de chair humain et parfumant!
le pied sur quelque guivre où notre amour tisonne,
je pense plus longtemps peut-être éperdument
a l’autre, au sein brûlé d’une antique amazone.","pafos – um nome só do fundo da memória,
meus livros já fechados, longe, me fascina
das espumas querer salvar uma ruína
sob os jacintos de seus vãos dias de glória.
que corra o frio com a sua foice muda.
nenhuma nênia inócua urlará minha boca
se vórtice tão branco ao rés do chão não muda
todo lugar no honor de uma paisagem oca.
minha fome que aqui fruto nenhum exalta
encontra igual sabor em sua douta falta:
que um só rebento em carne humana e odorante!
pé sobre a serpe de onde o nosso amor sazona,
um outro sobreleva o meu pensar constante:
o seio a que abrasou uma antiga amazona.",fr_XX,pt_XX,"meus livros fechados sobre o nome de pafos,
diverte-me eleger com o único engenho
uma ruína, por mil espumas abençoada
sob o jacinto, ao longe, de seus dias triunfais.
corre o frio com seus silêncios de falso,
não vou ulular vazio negado
se este muito branco brinca rente ao chão
negando a toda paisagem o falso louvor.
minha fome que em nenhuma fruta se deleita aqui
encontra em sua falta sábia um sabor igual:
que um estoure de carne humana e perfumada!
o pé sobre alguma serpente onde nosso amor crepita,
penso por mais tempo talvez desesperadamente
no outro, no seio queimado de uma antiga amazona.",-1
"victorieusement fui le suicide beau
tison de gloire, sang par écume, or, tempête!
ô rire si là-bas une pourpre s’apprête
a ne tendre royal que mon absent tombeau.
quoi! de tout cet éclat pas même le lambeau
s’attarde, il est minuit, à l’ombre qui nous fête
excepté qu’un trésor présomptueux de tête
verse son caressé nonchaloir sans flambeau,
la tienne si toujours le délice! la tienne
oui seule qui du ciel évanoui retienne
un peu de puéril triomphe en t’en coiffant
avec clarté quand sur les coussins tu la poses
comme un casque guerrier d’impératrice enfant
dont pour te figurer il tomberait des roses.","triunfalmente a fugir o belo suicida,
tição de glória, espuma em sangue, ouro, tormenta!
oh! riso se me chama a púrpura perdida
ao cortejo real da tumba que me tenta.
não! de todo o fulgor nem mesmo se sustenta
um brilho, é meia-noite e a sombra nos convida,
salvo o tesouro audaz que uma cabeça ostenta
no mimado torpor sem lume em que é servida.
a tua, sempre, sim, delícia que me vem,
a única que do céu extinto ainda retém
no meu pentear, pueril, um pouco da triunfante
luz, quando a pousas, só, entre as dobras sedosas,
capacete imortal de imperatriz infante
de onde, para espelhar-te, choveriam rosas.",fr_XX,pt_XX,"triunfantemente fui o belo suicídio
brasa de glória, sangue por espuma, ouro, tempestade!
ó riso se lá longe um púrpura se prepara
para nenhum túmulo real além do meu ausente.
o quê! de todo esse esplendor nem mesmo um pedaço
persiste, é meia-noite, na sombra que nos celebra
exceto por um tesouro presunçoso de cabeça
derramando seu acariciado desleixo sem tocha,
o teu se sempre o encanto! o teu
sim, apenas tu que do céu desvanecido seguras
um pouco de infantil triunfo ao te enfeitar
com clareza quando nos travesseiros a colocas
como um capacete guerreiro de imperatriz criança
de quem para te imaginares cairiam rosas.",3
"le soleil, sur le sable, ô lutteuse endormie,
en l’or de tes cheveux chauffe un bain langoureux
et, consumant l’encens sur ta joue ennemie,
il mêle avec les pleurs un breuvage amoureux.
de ce blanc flamboiement l’immuable accalmie
t’a fait dire, attristée, ô mes baisers peureux,
“nous ne serons jamais une seule momie
sous l’antique désert et les palmiers heureux!”
mais ta chevelure est une rivière tiède,
où noyer sans frissons l’âme qui nous obsède
et trouver ce néant que tu ne connais pas!
je goûterai le fard pleuré par tes paupières,
pour voir s’il sait donner au coeur que tu frappas
l’insensibilité de l’azur et des pierres.","o sol, na areia, aquece, ó brava adormecida,
o ouro da tua coma em banho langoroso,
queimando o seu incenso em tua face aguerrida,
e mistura aos teus prantos um filtro amoroso.
desse branco fulgor a imóvel calmaria
te faz dizer, dolente, ó carícias discretas,
“jamais nós dois seremos uma múmia fria
sob o antigo deserto e as palmeiras eretas!”
porém os teus cabelos, rio morno, imploram
para afogar sem medo a nossa alma triste
e encontrar esse nada que em teu ser não medra.
degustarei o bistre que teus cílios choram
para ver se ele doa àquele que feriste
a insensibilidade do azul e da pedra.",fr_XX,pt_XX,"O sol, na areia, ó lutadora adormecida,
no ouro de teus cabelos aquece um banho langoroso
e, consumindo o incenso em tua face inimiga,
ele mistura com as lágrimas uma bebida amorosa.
deste branco fulgor a calma imutável
te fez dizer, entristecida, ó meus beijos temerosos,
""nunca seremos uma única múmia
sob o antigo deserto e as palmeiras felizes!""
mas teus cabelos são um rio morno,
onde afogar sem arrepios a alma que nos assombra
e encontrar esse vazio que não conheces!
provarei o pó chorado por tuas pálpebras,
para ver se ele sabe dar ao coração que feriste
a insensibilidade do azul e das pedras.",-1
"le vase où meurt cette vervaine
d’un coup d’éventail fut fêlé;
le coup dut l’effleurer à peine,
aucun bruit ne l’a révélé.
.
mais la légère meurtrissure,
mordant le cristal chaque jour,
d’une marche invisible et sûre
en a fait lentement le tour.
.
son eau fraîche a fui goutte à goutte,
le suc des fleurs s’est épuisé;
personne encore ne s’en doute,
n’y touchez pas, il est brisé.
.
souvent aussi la main qu’on aime
effleurant le coeur, le meurtrit;
puis le coeur se fend de lui-même,
la fleur de son amour périt;
.
toujours intact aux yeux du monde,
il sent croître et pleurer tout bas
sa blessure fine et profonde:
il est brisé, n’y touchez pas.","o vaso azul destas verbenas,
partiu-o um leque que o tocou:
golpe subtil, roçou-o apenas,
pois nem um ruído o revelou.
.
mas a ferida persistente,
mordendo-o sempre e sem sinal,
fez, firme e imperceptivelmente,
a volta toda do cristal.
.
a água fugiu calada e fria,
a seiva toda se esgotou;
ninguém de nada desconfia.
não toquem, não, que se quebrou.
.
assim, a mão de alguém, roçando
num coração, enche-o de dor;
e ele se vai, calmo, quebrando,
e morre a flor do seu amor;
.
embora intacto ao olhar do mundo,
sente, na sua solidão,
crescer seu mal fino e profundo.
já se quebrou; não toquem não.",fr_XX,pt_XX,"O vaso onde morre esta verbena
Com um leque foi rachado de repente;
O golpe mal roçou a flor serena,
Nenhum som revelou sua semente.

Mas a leve contusão marcante,
Mordendo o cristal a cada dia,
Com passos seguros e constantes,
Fez um círculo em sua agonia.

Sua água fresca escorre gota a gota,
O suco das flores se esvaziou;
Ninguém ainda percebe a sua nota,
Não toque, pois ele se despedaçou.

Às vezes também a mão amada
Acariciando o coração, o fere;
Então o próprio coração se despedaça,
A flor de seu amor perece e perece.

Sempre íntegro aos olhos do mundo,
Sente crescer e chorar em silêncio
Sua ferida, sutil e profunda:
Ele se despedaçou, não toque, é o seu círculo.",-1
"sans bruit, sous le miroir des lacs profonds et calmes,
le cygne chasse l’onde avec ses larges palmes,
et glisse. le duvet de ses flancs est pareil
a des neiges d’avril qui croulent au soleil;
mais, ferme et d’un blanc mat, vibrant sous le zéphire,
sa grande aile l’entraîne ainsi qu’un lent navire.
il dresse son beau col au-dessus des roseaux,
le plonge, le promène allongé sur les eaux,
le courbe gracieux comme un profil d’acanthe,
et cache son bec noir dans sa gorge éclatante.
tantôt le long des pins, séjour d’ombre et de paix,
il serpente, et, laissant les herbages épais
traîner derrière lui comme une chevelure,
il va d’une tardive et languissante allure.
la grotte où le poète écoute ce qu’il sent,
et la source qui pleure un éternel absent,
lui plaisent; il y rôde; une feuille de saule
en silence tombée effleure son épaule.
tantôt il pousse au large, et, loin du bois obscur,
superbe, gouvernant du côté de l’azur,
il choisit, pour fêter sa blancheur qu’il admire,
la place éblouissante où le soleil se mire.","sem rumor, sob o espelho em lagos fundos, calmos,
o cisne impele a onda com as amplas palmas,
e desliza. a penugem em seus flancos, tal
neves de abril tremendo ao sol de forma igual;
mas, rijo, branco mastro a vibrar pelo vento,
sua imensa asa o leva assim qual barco lento,
passa seu belo peito acima de umas plantas,
mergulha e sobre as águas o alonga, levanta,
arqueia-o gracioso qual perfil de acanto
e guarda o negro bico em seu colo de encanto.
ora ao longo dos pinhos, lar de sombra e paz,
serpeia, deixando ervas espessas atrás
arrastando-se assim como uma cabeleira,
e segue ele em suave e lânguida maneira.
a gruta onde o poeta escuta o que ele sente
e a fonte que lamenta um sempre eterno ausente
lhe prazem; lá gira ele; e a folha de salgueiro
em silêncio caída, ao seu dorso se abeira.
quanto mais ele faz-se ao largo; a se afastar
do bosque escuro e, esplêndido, no azul reinar,
só elegeu para saudar o alvor que admira
o lugar reluzente em onde o sol se mira.",fr_XX,pt_XX,"Sem ruído, sob o espelho dos lagos profundos e calmos,
o cisne espanta a água com suas largas palmas,
e desliza. o penugem de seus flancos é similar
a neves de abril que se desfazem sob o sol;
mas, firme e de um branco opaco, vibrando sob o zéfiro,
sua grande asa o arrasta como um lento navio.
Ele ergue seu belo pescoço acima dos juncos,
o mergulha, o leva estendido sobre as águas,
curva-se gracioso como um perfil de acanto,
e esconde seu bico negro em sua garganta resplandecente.
Às vezes ao longo dos pinheiros, refúgio de sombra e paz,
ele serpenteia, e, deixando as densas pastagens
arrastarem-se atrás dele como uma cabeleira,
ele vai com uma lenta e languidosa postura.
A gruta onde o poeta escuta o que sente,
e a fonte que chora um eterno ausente,
o agradam; ele vagueia por lá; uma folha de salgueiro
caída em silêncio roça seu ombro.
Às vezes ele se lança ao largo, e, longe da floresta escura,
soberbo, dirigindo-se para o lado do azul,
ele escolhe, para celebrar sua brancura que admira,
o lugar deslumbrante onde o sol se reflete.",-1
"puis, quand les bords de l’eau ne se distinguent plus,
a l’heure où toute forme est un spectre confus,
où l’horizon brunit rayé d’un long trait rouge,
alors que pas un jonc, pas un glaïeul ne bouge,
que les rainettes font dans l’air serein leur bruit,
et que la luciole au clair de lune luit,
l’oiseau, dans le lac sombre où sous lui se reflète
la splendeur d’une nuit lactée et violette,
comme un vase d’argent parmi des diamants,
dort, la tête sous l’aile, entre deux firmaments","e depois quando as margens tornam-se confusas,
na hora onde toda forma é um espectro difuso,
onde reduz um horizonte em rubro risco,
enquanto nenhum junco ou espadana pisca,
com as rãs verdes a soar no sereno ar
e quando o pirilampo refulge ao luar,
a ave, no sombrio lago aonde se reflete
o fulgor de uma noite láctea e violeta,
como um jarro de prata em meio a diamantes,
dorme, a cabeça entre asas e dois céus brilhantes",fr_XX,pt_XX,"Depois, quando as margens da água já não se distinguem,
na hora em que toda forma se torna um espectro confuso,
onde o horizonte avermelha riscado por um longo traço vermelho,
enquanto nenhum junco, nenhum lírio se move,
as rãs fazem seu som no ar sereno,
e o vaga-lume brilha à luz da lua,
o pássaro, no lago sombrio onde sob ele se reflete
o esplendor de uma noite leitosa e violeta,
como um vaso de prata entre diamantes,
dorme, com a cabeça sob a asa, entre dois céus.",-1
