original_poem,translated_poem,src_lang,tgt_lang,translated_by_TA,topic
"vie de femme …
les sentiments passent en premier.
ils sont absorbés et préservés.
si banalisés … exterminés.
si entretenus … sauvegardés.
si sauvegardés, elle est séduite.
si exterminés, l’autre est vite oublié.
et le poisson prend le large …
pour nager dans d’autres rives,
a l’encontre d’une âme pure,
telle que la sienne.
la solitude corrompt l’âme.
le téméraire loyal qui passe par là,
chanceux ou don juan,
c’est qu’il est arrivé …
sur le bon endroit au bon moment.","vida de mulher …
os sentimentos passam em primeiro.
eles são absorvidos e preservados.
si banalizados … exterminados.
si alimentados… salvados.
si salvados, ela é seduzida.
si exterminados, o outro é rápido esquecido.
e o peixe cai em alto mar …
para nadar em outras margens,
ao encontro de uma alma pura,
tal como a sua.
a solidão corrompe a alma.
o temerário leal que ali passa,
felizardo ou don juan,
é que ele chegou …
no bom lugar no momento certo.",fr_XX,pt_XX,"caminho da mulher...
os sentimentos vêm em primeiro lugar.
são absorvidos e preservados.
se banalizados... exterminados.
se nutridos... salvaguardados.
se salvaguardados, ela se encanta.
se exterminados, o outro é rapidamente esquecido.
e o peixe segue em frente...
para nadar em outras margens,
contra uma alma pura,
tal como a sua.
a solidão corrompe a alma.
o ousado leal que por ali passa,
sortudo ou don juan,
é porque chegou...
no lugar certo, na hora certa.",-1
"vie de femme …
les sentiments passent en premier.
ils sont absorbés et préservés.
si banalisés … exterminés.
si entretenus … sauvegardés.
si sauvegardés, elle est séduite.
si exterminés, l’autre est vite oublié.
et le poisson prend le large …
pour nager dans d’autres rives,
a l’encontre d’une âme pure,
telle que la sienne.
la solitude corrompt l’âme.
le téméraire loyal qui passe par là,
chanceux ou don juan,
c’est qu’il est arrivé …
sur le bon endroit au bon moment.","vida de mulher …
os sentimentos passam em primeiro.
eles são absorvidos e preservados.
si banalizados … exterminados.
si alimentados… salvados.
si salvados, ela é seduzida.
si exterminados, o outro é rápido esquecido.
e o peixe cai em alto mar …
para nadar em outras margens,
ao encontro de uma alma pura,
tal como a sua.
a solidão corrompe a alma.
o temerário leal que ali passa,
felizardo ou don juan,
é que ele chegou …
no bom lugar no momento certo.",fr_XX,pt_XX,"caminho de mulher...
os sentimentos vêm primeiro.
são absorvidos e preservados.
se banalizados... exterminados.
se alimentados... guardados.
se guardados, ela se encanta.
se exterminados, o outro é logo esquecido.
e o peixe parte rumo ao largo...
para nadar em outras margens,
em contraste com uma alma pura,
como a sua.
a solidão corrompe a alma.
o audaz fiel que por ali passa,
sortudo ou dom juan,
é porque chegou...
no lugar certo, na hora certa.",-1
"un soir d’été …
je t’ai vu un soir d’été,
t’étais là, élégant et svelte,
j’ai vu le ciel, j’ai vu tes mirettes,
tout en bleu j’ai vu le tableau.
je t’ai vu, je me suis stoppée,
pour t’observer en peu.
une sensation j’ai éprouvée,
une anxiété avec ardeur.
j’ai eu peur parce que mon corps,
jusqu’alors soumis à moi,
s’abandonnerait au tien aussi en cœur,
si tu le désirais ainsi comme moi.
le soleil brulait en nous,
en tête à tête nous étions,
sur ton visage j’ai vu la bonté,
et dans ton âme j’ai vu la beauté.
les moments que nous avons passé,
avec calme et spontanéité,
sans effort et en toute simplicité,
toi et moi nous avons aimé …
dans un silence plein de tendresse,
nos âmes nues et entrelacées,
hébergée dans tes bras j’entendais ton cœur,
le mien complice a accéléré sa marche.
avec volupté et sensualité, entre caresses et baisers,
nos entrailles ont proclamé le plaisir frémissant…
dehors la pluie tombait, comme si pour arroser,
la beauté de ces moments.","uma tarde de verão …
eu lhe vi numa tarde de verão,
voce estava ali, elegante e esbelto,
eu vi o céu, eu vi seus olhos,
todo azul eu vi o quadro.
eu lhe vi, eu parei,
para lhe observar un pouco.
uma sensação eu senti,
uma ansiedade com ardor.
eu tive medo porque meu corpo,
até então submisso à mim,
se abandonaria ao seu, tambem em coração,
se voce o desejasse assim como eu.
eu senti o sol que queimava em nós,
e frente à frente nós estávamos,
no seu rosto eu vi a bondade,
e a beleza da sua alma.
os momentos que juntos passamos,
com calma e espontâneidade,
com carinho e com simplicidade,
voce e eu, nós amamos …
num silencio cheio de emoção,
nossas almas nuas e entrelaçadas,
acolhida nos seus braços seu coração eu escutava ,
o meu cúmplice acelerou sua cançao.
entre carinhos e beijos,com sensualidade e volúpcia,
nossas entranhas proclamaram o prazer frêmito …
la fora a chuva caía, como se para arrozar,
a beleza destes momentos.",fr_XX,pt_XX,"Numa noite de verão…
te vi numa noite de verão,
estavas lá, elegante e esbelto,
vi o céu, vi teus olhos brilhantes,
todo azul vi o quadro.
te vi, parei para te observar um pouco,
uma sensação eu experimentei,
uma ansiedade ardente.
tive medo porque meu corpo,
até então submisso a mim,
se entregaria ao teu também de coração,
se assim desejasses como eu.
o sol queimava em nós,
cara a cara estávamos,
em teu rosto vi a bondade,
e em tua alma vi a beleza.
os momentos que passamos,
com calma e espontaneidade,
sem esforço e com simplicidade,
tu e eu nos amamos…
num silêncio cheio de ternura,
nossas almas nuas e entrelaçadas,
abrigo em teus braços, ouvia teu coração,
o meu cúmplice acelerou seu passo.
com volúpia e sensualidade, entre carícias e beijos,
nossos ventres proclamaram o prazer palpitante…
 lá fora a chuva caía, como se para regar,
a beleza desses momentos.",-1
"que veux-tu quand tu seras grand ?
trouver l’amour …
que veux tu faire avec l’amour ?
le chérir …
que veux tu comme amour ?
le vrai …
quel nom lui donnerais-tu ?
sincérité …
comment le souhaites-tu ?
constant …
que demanderais-tu à cet amour ?
fidélité …
combien de temps le garderais-tu ?
pour toujours …
où l’emmènerais tu ?
dans mon coeur …
que serais-tu pour lui ?
l’amour …
il en est déjà un !?
non ! il est la moitié d’un amour","que queres quando serás grande ?
encontrar o amor …
que queres fazer com o amor ?
amá-lo …
que queres como amor ?
o verdadeiro …
qual nome o darias tu ?
sinceridade …
como o desejas tu ?
constante …
que pedirias tu a este amor ?
fidelidade …
quanto tempo o guardarias tu ?
para sempre …
onde o levarias tu ?
no meu coração …
que serias tu para ele ?
o amor …
ele ja é um !?
nao ! ele é a metade de um amor …",fr_XX,pt_XX,"O que queres quando fores adulto?
Encontrar o amor...
O que queres fazer com o amor?
Amar...
Que tipo de amor desejas?
O verdadeiro...
Que nome lhe darias?
Sinceridade...
Como o desejas?
Constante...
O que pedirias a este amor?
Fidelidade...
Por quanto tempo o guardarias?
Para sempre...
Onde o levarias?
Dentro do meu coração...
O que serias para ele?
O amor...
Mas já existe um amor!?
Não! Ele é a metade de um amor.",0
"toi, yeux verts, visage brun
si un jour ton visage m’a perturbé à jamais,
et si pendant mon parcours ton regard m’a suivi,
il ne m’est resté que nostalgie dans les allées de ma vie …
si les rides
ont changé ton visage,
et si même de moi
tu ne te souviens plus,
j’aurai toujours mon être
pour me perdre
dans ton regard…
si un jour la vie
me permet de rêver,
et si dans mon rêve toi,
tu m’apparaît pour moi,
j’aurai mon âme, pour t’embrasser !
si sur terre je n’ai plus l’espoir,
de sentir de nouveau cet envoûtement,
malheureuse, je suis morte dans le monde pour ne plus y espérer…
mais toi, yeux verts, visage brun,
pourvu que tu sois heureux, avec une belle et gentille fleur,
entouré d’un beau jardin, sous l’amour de dieu …","voce, olhos verdes, rosto moreno
se um dia seu rosto me pertubou para sempre,
e se durante meu percurso seu olhar me seguiu,
so me restou nostalgia nas alas da minha vida…
se as rugas mudaram seu rosto,
e se até mesmo de mim voce não mais se lembrar,
terei sempre meu sêr para me perder nos seus olhos…
se um dia a vida me permitir de sonhar,
e se no meu sonho seu rosto me aparecer,
eu terei minha alma para enfim lhe abraçar !
se na terra, eu não tenho mais esperança,
de sentir de novo este encantamento,
infeliz, estou morta no mundo para não mais esperar…
mas voce, olhos verdes, rosto moreno,
oxala esteja feliz, com uma bela e gentil flôr,
meio a um belo jardim, sob o amor de deus.",fr_XX,pt_XX,"tu, olhos verdes, rosto moreno
se um dia teu rosto me perturbou para sempre,
e se durante minha jornada teu olhar me seguiu,
restou-me apenas nostalgia nos caminhos da minha vida...
se as rugas
mudaram teu rosto,
e se mesmo de mim
não te lembras mais,
sempre terei meu ser
para me perder
em teu olhar...
se um dia a vida
me permitir sonhar,
e se em meu sonho tu,
apareceres para mim,
tenderei minha alma, para te abraçar!
se na terra não tenho mais esperança,
de sentir novamente esse encantamento,
infeliz, morri no mundo para não mais esperar...
mas tu, olhos verdes, rosto moreno,
que sejas feliz, com uma bela e gentil flor,
cercado por um belo jardim, sob o amor de deus...",0
"tais-toi
je t’aime … mon amour, ma chérie.
tais-toi, ne répètes plus jamais ça,
tais-toi, tu ne sais pas ce que tu dis.
les mots qui caressent,
viennent en fusion avec dieu.
je ne veux pas de tes mots,
qu’ arrivent avec tes ténèbres,
de ton esprit sans paix,
qui débat contre ton corps.
les mots sortis de ta bouche,
ne guérissent pas ta blessure,
te rendent encore plus jaloux,
de ceux qu’ont connu l’amour.
je t’aime … mon amour, ma chérie.
tais-toi, tu ne sais pas ce qu’est l’amour,
tais-toi, tu ne sais pas ce que tu fais.
si seulement, t’ avais connu musset,
tu saurais, que tu n’as pas encore vécu.
que ta vie, n’est pas sommeil,
elle est seulement … un cauchemar.","cala-te
eu te amo … meu amor, minha querida.
cala-te, nao repitas nunca mais isso,
cala-te, tu nao sabes o que dises.
as palavras que acariciam,
vêm em fusao com deus.
nao quero tuas palavras,
que chegam com tuas trevas,
de teu espirito sem paz,
que debate contra teu corpo.
as palavras saidas de tua boca,
não curam tua cicatriz,
te tornam ainda mais ciumento,
daqueles que conheceram o amor.
eu te amo … meu amor, minha querida.
cala-te, tu nao sabes o que é o amor,
cala-te, tu nao sabes o que fazes.
si pelo menos, tu tivesses conhecido musset,
tu saberias que ainda nao viveu.
que tua vida nao é sono,
ela é somente … um pesadelo.",fr_XX,pt_XX,"Silencia-te
amo-te ... meu amor, minha querida.
Silencia-te, não repitas isso nunca mais,
Silencia-te, não sabes o que dizes.
As palavras que acariciam,
vêm em fusão com Deus.
Não quero as tuas palavras,
que chegam com as tuas trevas,
da tua mente sem paz,
que luta contra o teu corpo.
As palavras que saem da tua boca,
não curam a tua ferida,
apenas te tornam mais ciumento,
daqueles que conheceram o amor.
Amo-te ... meu amor, minha querida.
Silencia-te, não sabes o que é o amor,
Silencia-te, não sabes o que fazes.
Se apenas tivesses conhecido Musset,
saberias que ainda não viveste.
Que a tua vida não é sono,
é apenas ... um pesadelo.",0
"ta différence …
où es tu, que fais tu, comment vas-tu ?
et le temps qui passe et cette bataille éternelle,
« ta différence » fait ton arrogance et ta peur.
la peur qui t’enferme dans ta coquille,
« ta différence » qui t’isole dans ton monde.
et la solitude nous corrompt et nous ronge les âmes.
et ton esprit se souvenant encore du mien,
s’adosse sur mon âme et la rends nostalgique et fragile.
et mon esprit se souvenant encore du tien,
s’adosse sur ton âme et la rends nostalgique et fragile.
je le sais … ton berceau différent du mien,
je le sais … ton être enchainé à la profondeur de ta créature.
et tes envies dans ton esprit confus, tourbillonnant dans ton cœur…
et la peur … incrustée en toi te rendant craintif et indécis.
ton âme je l’ai percée …
si seulement ton coeur me serait ouvert,
le temps serait à nous,
« ta différence » serait la mienne,
et nous serions heureux …","sua diferença …
onde está você, que faz você, como vai você ?
e o tempo que passa et esta batalha eterna,
« sua diferença » faz sua arrogância e seu mêdo.
o mêdo que te encarcera no seu caracol,
« sua diferença » que te isola no seu mundo.
e a solidão nos corrompe et nos rói as almas.
e seu espírito se lembrando aínda do meu,
se encosta na minha alma e a torna nostálgica e frágil.
e meu espírito se lembrando aínda do seu,
se encosta na sua alma e a torna nostálgica e frágil.
eu sei … seu berço diferente do meu,
eu sei … seu ser prisoneiro na profundeza de sua criação.
e seus desejos no seu espírito confuso, turbilhonando no seu coração …
e o mêdo … encrustado em voce lhe tornando receioso e indeciso.
sua alma eu a penetrei …
se seu coração tivesse se abrido,
o tempo sería nosso,
sua diferença seria minha,
e nós seríamos felizes …",fr_XX,pt_XX,"tua diferença...
onde estás, o que fazes, como estás?
e o tempo que passa e essa batalha eterna,
""tua diferença"" faz tua arrogância e teu medo.
o medo que te aprisiona em tua concha,
""tua diferença"" que te isola em teu mundo.
e a solidão nos corrompe e devora as almas.
e teu espírito ainda se lembrando do meu,
se apoia em minha alma e a torna nostálgica e frágil.
e meu espírito ainda se lembrando do teu,
se apoia em tua alma e a torna nostálgica e frágil.
eu sei... teu berço diferente do meu,
eu sei... teu ser acorrentado à profundidade de tua criatura.
e teus desejos em tua mente confusa, turbilhando em teu coração...
e o medo... impregnado em ti te tornando temeroso e indeciso.
tua alma eu a penetrei...
se apenas teu coração se abrisse para mim,
o tempo seria nosso,
""tua diferença"" seria minha,
e seríamos felizes...",0
"souvenir d’enfance
j’entendais en pleine nuit,
un son régulier,
comme une chanson dans le noir,
coupant le silence de la nuit.
je me paniquais, je criais maman.
mon petit frère se réveillait,
entendait la chanson dans le noir.
mon petit frère se paniquait,
et criait maman aussi.
la voix de maman,
magie, splendeur, douceur dans la nuit.
elle nous assurait que ce son,
n’était que papa en train de ronfler.
mais ce son ainsi insistant,
ouvrait les ailes de l’imagination,
la peur nous envahissait,
et voilà que tout à coup, ups !
quatre petites jambes pardessus le barreau,
du berceau où nous dormions.
et ainsi bien collés,
au chaud entre papa et maman,
mon petit frère et moi,
nous dormions comme si on était,
dans le ciel, dans les bras de dieu …","lembrança de infancia
eu ouvia em plena madrugada,
um som regular,
como uma canção na escuridão,
cortando o silencio da noite.
em pânico, eu gritava mamãe.
meu irmãozinho se acordava,
escutava a canção na escuridão.
meu irmãozinho em pânico,
gritava mamãe tambem.
a voz de mamãe …
magia, esplendor e brandura na escuridão.
ela nos assegurava que este som,
era so papai roncando no seu sono.
mas esse som assim persistente,
abria as asas da imaginação,
o mêdo nos invadia,
e eis que de repente, ups !
quatro perninhas por cima da barra,
do berço onde dormíamos.
e assim bem agarradinhos,
no quentinho entre papai e mamãe,
meu irmãozinho e eu,
nós dormíamos como si estivéssemos,
no céu, nos braços de deus …",fr_XX,pt_XX,"lembrança de infância
ouvia na noite escura,
um som regular,
como uma canção no escuro,
cortando o silêncio da noite.
eu entrava em pânico, gritava por mamã.
meu irmãozinho acordava,
ouvindo a canção no escuro.
meu irmãozinho entrava em pânico,
e também gritava por mamã.
a voz de mamã,
magia, esplendor, doçura na noite.
ela nos assegurava que esse som,
era apenas papai roncando.
mas esse som tão insistente,
abria as asas da imaginação,
o medo nos invadia,
e de repente, ups!
quatro perninhas por cima da grade,
do berço onde dormíamos.
e assim bem juntinhos,
no calor entre papai e mamã,
meu irmãozinho e eu,
dormíamos como se estivéssemos,
no céu, nos braços de Deus...",1
