original_poem,translated_poem,src_lang,tgt_lang,translated_by_TA,topic
"j’avais devant les yeux les ténèbres. l’abîme
qui n’a pas de rivage et qui n’a pas de cime,
était là, morne, immense ; et rien n’y remuait.
je me sentais perdu dans l’infini muet.
au fond, à travers l’ombre, impénétrable voile,
on apercevait dieu comme une sombre étoile.
je m’écriai : — mon âme, ô mon âme ! il faudrait,
pour traverser ce gouffre où nul bord n’apparaît,
et pour qu’en cette nuit jusqu’à ton dieu tu marches,
bâtir un pont géant sur des millions d’arches.
qui le pourra jamais ! personne ! ô deuil ! effroi !
pleure ! — un fantôme blanc se dressa devant moi
pendant que je jetai sur l’ombre un œil d’alarme,
et ce fantôme avait la forme d’une larme ;
c’était un front de vierge avec des mains d’enfant ;
il ressemblait au lys que la blancheur défend ;
ses mains en se joignant faisaient de la lumière.
il me montra l’abîme où va toute poussière,
si profond, que jamais un écho n’y répond;
et me dit : — si tu veux je bâtirai le pont.
vers ce pâle inconnu je levai ma paupière.
— quel est ton nom ? lui dis-je. il me dit: — la prière.","diante de mim, a escuridão. a voragem
que não tem cimo e que nem sequer tem margem
lá estava, sombria, imensa; nada nela mexia.
perdido no mundo infinito eu me sentia.
ao longe, através da sombra, impenetrável véu,
entrevia-se deus, pálida estrela no céu.
clamei: – ó alma, alma minha! eu precisava,
para atravessar o abismo cujo fim não vislumbrava,
e para durante a noite até deus eu ascender,
de construir uma ponte e em mil arcos a estender.
quem o conseguirá? ninguém!ó dor! tormento!
chora! – um fantasma branco ergueu-se no momento
em que à sombra um olhar de temor eu deitava.
a forma de uma lágrima esse fantasma mostrava;
tinha uma fronte de virgem e duas mãos de criança;
lembrava um lírio que toda a brancura alcança;
as suas duas mãos juntas acendiam uma luz.
apontou o abismo onde tudo a pó se reduz,
tão fundo que nem o eco aí segue a sua lei,
e disse-me: – se quiseres, a ponte construirei.
para o desconhecido ergui meus olhos do chão.
-como te chamas? perguntei. respondeu: – a oração.",fr_XX,pt_XX,"Eu tinha diante dos olhos as trevas. O abismo
que não tem margem e não tem cume,
estava lá, sombrio, imenso; e nada ali se movia.
Eu me sentia perdido no silêncio infinito.
No fundo, através da sombra, véu impenetrável,
divisava-se Deus como uma estrela sombria.
Eu exclamei: — minha alma, ó minha alma! seria preciso,
para atravessar este abismo onde nenhuma margem aparece,
e para que nesta noite até teu Deus marches,
construir uma ponte gigante sobre milhões de arcos.
Quem poderá fazê-lo! Ninguém! Ó luto! terror!
Chora! — um fantasma branco surgiu diante de mim
enquanto lançava um olhar de alarme sobre a sombra,
e esse fantasma tinha a forma de uma lágrima;
era uma fronte de virgem com mãos de criança;
assemelhava-se ao lírio que a brancura defende;
suas mãos unidas produziam luz.
Ele me mostrou o abismo para onde vai toda poeira,
tão profundo que nunca um eco responde;
e me disse: — se quiseres, construirei a ponte.
Para esse pálido desconhecido ergui minha pálpebra.
— Qual é o teu nome? lhe perguntei. Ele me disse: — A oração.",2
"un jour, maigre et sentant un royal appétit,
un singe d’une peau de tigre se vêtit.
le tigre avait été méchant; lui, fut atroce.
il avait endossé le droit d’être féroce.
il se mit à grincer des dents, criant: je suis
le vainqueur des halliers, le roi sombre des nuits!
il s’embusqua, brigand des bois, dans les épines
il entassa l’horreur, le meurtre, les rapines,
egorgea les passants, dévasta la forêt,
fit tout ce qu’avait fait la peau qui le couvrait.
il vivait dans un antre, entouré de carnage.
chacun, voyant la peau, croyait au personnage.
il s’écriait, poussant d’affreux rugissements:
regardez, ma caverne est pleine d’ossement;
devant moi tout recule et frémit, tout émigre,
tout tremble; admirez-moi, voyez, je suis un tigre!
les bêtes l’admiraient, et fuyaient à grands pas.
un belluaire vint, le saisit dans ses bras,
déchira cette peau comme on déchire un linge,
mit à nu ce vainqueur, et dit: tu n’es qu’un singe!","um dia, magro e sentindo um real desfastio,
um macaco com a pele de um tigre se vestiu.
o tigre fora malvado, ele tornou-se atroz
ele tinha assumido o direito de ser feroz.
arreganhava os dentes, gritando: eu serei
o herói dos matagais, da noite o temível rei!
como malfeitor dos bosques, emboscado nos espinhos,
de horror, morte e rapinas, escureceu os caminhos,
degolou os viajantes e devastou a floresta,
fez tudo o que faz aquela pele funesta.
vivia no seu antro, no meio da voragem.
todos, vendo-lhe a pele, criam na personagem.
gritava e rugia como as feras danadas:
olhem, a minha caverna está cheia de ossadas;
olhem para mim, sou um tigre! tudo treme,
diante de mim, tudo recua e emigra; tudo freme!
temiam-no os animais, fugindo com grandes passos.
um domador apareceu e tomando-o nos braços,
rasgou-lhe a pele, como se rasga um farrapo,
e, pondo a nu o herói, disse: não passas de um macaco!",fr_XX,pt_XX,"Um dia, magro e com apetite real,
um macaco vestiu pele de tigre, afinal.
O tigre foi malvado; ele, atroz se mostrou.
Assumiu o direito de ser feroz, gritou.
Rangeu os dentes, bradando: sou o senhor
dos matagais, rei sombrio do torpor!
Escondeu-se, bandido dos bosques, nos espinhos,
acumulou horror, morte, desatinos,
degolou transeuntes, devastou a floresta,
fez tudo o que a pele que o cobria lhe manifesta.
Vivia em uma gruta, cercado de carnificina.
Ao ver a pele, todos criam na sina.
Exclamava, soltando horríveis rugidos:
vejam, minha caverna está cheia de ossos perdidos;
tudo recua e estremece diante de mim,
tudo treme; admiro-me, sou um tigre, enfim!
As feras o admiravam, fugiam em disparada.
Um domador veio, o pegou com força desmedida,
rasgou aquela pele como quem desfaz um pano,
desnudou o vencedor, e disse: és apenas um macaco, mano!",1
"dans le frais clair-obscur du soir charmant qui tombe,
l’une pareille au cygne et l’autre à la colombe,
belle, et toutes deux joyeuses, ô douceur !
voyez, la grande soeur et la petite soeur
sont assises au seuil du jardin, et sur elles
un bouquet d’oeillets blancs aux longues tiges frêles,
dans une urne de marbre agité par le vent,
se penche, et les regarde, immobile et vivant,
et frissonne dans l’ombre, et semble, au bord du vase,
un vol de papillons arrêté dans l’extase.","no fresco claro-escuro da bela tarde que tomba,
uma me lembra um cisne, e a outra uma pomba,
muito belas, muito alegres, ó suavidade!
vede, a irmã mais velha e a de menos idade
sentadas junto ao jardim; e para as duas olhando,
um ramo de cravos brancos, com os caules pousando
num vaso de mármore, agitado pelo vento,
sobre elas se inclina, imóvel e atento,
e tremendo na sombra, parece, assim curvado,
um voo de borboletas em êxtase parado.",fr_XX,pt_XX,"No fresco claro-escuro da noite encantada que cai,
uma semelhante a um cisne e a outra a uma pomba,
belas, e ambas alegres, oh doçura!
vejam, a irmã mais velha e a mais nova
estão sentadas no limiar do jardim, e sobre elas
um buquê de cravos brancos com longos talos frágeis,
em uma urna de mármore agitada pelo vento,
se inclina, e as observa, imóvel e vivo,
e estremece na sombra, e parece, na borda do vaso,
um voo de borboletas parado em êxtase.",-1
"par-dessus l’horizon aux collines brunies,
le soleil, cette fleur des splendeurs infinies,
se penchait sur la terre à l’heure du couchant;
une humble marguerite, éclose au bord d’un champ,
sur un mur gris, croulant parmi l’avoine folle,
blanche épanouissait sa candide auréole;
et la petite fleur, par-dessus le vieux mur,
regardait fixement, dans l’éternel azur,
le grand astre épanchant sa lumière immortelle.
«et, moi, j’ai des rayons aussi !» lui disait-elle.","por cima do horizonte de colinas sem cor,
o sol, essa flor de infinito esplendor,
se inclinava sobre a terra à hora do poente;
uma humilde margarida, no campo florescente,
sobre um muro cinzento, entre a aveia a vibrar,
branca, sua cândida auréola faz desabrochar;
e a pequenina flor, sobre o seu velho muro,
fixamente olhava, no eterno azul tão puro,
o grande astro que a luz imortal envia.
– e eu, eu também tenho raios! – lhe dizia.",fr_XX,pt_XX,"Sobre o horizonte, colinas amareladas,
o sol, flor de esplendores infinitos,
se inclinava sobre a terra ao pôr-do-sol;
uma modesta margarida, desabrochada à beira de um campo,
em um muro cinzento, desmoronando entre a aveia selvagem,
branca desdobrava seu halo cândido;
e a pequena flor, sobre o velho muro,
fitava firmemente, no eterno azul,
o grande astro derramando sua luz imortal.
""Eu também tenho raios!"" lhe dizia.",-1
"l’aigle, c’est le génie ! oiseau de la tempête,
qui des monts les plus hauts cherche le plus haut faîte ;
dont le cri fier, du jour chante l’ardent réveil ;
qui ne souille jamais sa serre dans la fange,
et dont l’œil flamboyant incessamment échange
des éclairs avec le soleil.
son nid n’est pas un nid de mousse ; c’est une aire,
quelque rocher, creusé par un coup de tonnerre,
quelque brèche d’un pic, épouvantable aux yeux,
quelque croulant asile, aux flancs des monts sublimes,
qu’on voit, battu des vents, pendre entre deux abîmes,
le noir précipice et les cieux !
ce n’est pas l’humble ver, les abeilles dorées,
la verte demoiselle aux ailes bigarrées
qu’attendent ses petits, béants, de faim pressés ;
non ! c’est l’oiseau douteux, qui dans la nuit végète ;
c’est l’immonde lézard, c’est le serpent qu’il jette,
hideux, aux aiglons hérissés.
nid royal ! palais sombre, et que d’un flot de neige
la roulante avalanche en bondissant assiège !
le génie y nourrit ses fils avec amour,
et, tournant au soleil leurs yeux remplis de flammes,
sous son aile de feu couve de jeunes âmes,
qui prendront des ailes un jour !
pourquoi donc t’étonner, ami, si sur ta tête,
lourd de foudres, déjà le nuage s’arrête ?
si quelque impur reptile en ton nid se débat ?
ce sont tes premiers j eux, c’est ta première fête :
pour vous autres aiglons, chaque heure a sa tempête,
chaque festin est un combat.
rayonne, il en est temps ! et, s’il vient un orage,
en prisme éblouissant change le noir nuage.
que ta haute pensée accomplisse sa loi.
viens, joins ta main de frère à ma main fraternelle.
poète, prends ta lyre ; aigle, ouvre ta jeune aile ;
étoile, étoile, lève-toi !
la brume de ton aube, ami, va se dissoudre.
fais-toi connaître, aiglon, du soleil, de la foudre.
viens arracher un nom par tes chants inspirés ;
viens ; cette gloire, en butte à tant de traits vulgaires,
ressemble aux fiers drapeaux qu’on rapporte des guerres,
plus beaux quand ils sont déchirés !
vois l’astre chevelu qui, royal météore,
roule, en se grossissant des mondes qu’il dévore ;
tel, ô jeune géant, qui t’accrois tous les jours,
tel ton génie ardent, loin des routes tracées,
entraînant dans son cours des mondes de pensées,
toujours marche et grandit toujours !","a águia é o gênio… da tormenta o pássaro,
que do monte arremete altivo píncaro,
qu’ergue um grito aos fulgores do arrebol,
cuja garra jamais se pela em lodo,
e cujo olhar de fogo troca raios
contra os raios do sol.
não tem ninho de palhas… tem um antro
rocha talhada ao martelar do raio,
brecha em serra, ant’a qual o olhar tremeu. . .
no flanco da montanha asilo trêmulo,
que sacode o tufão entre os abismos
o precipício e o céu.
nem pobre verme, nem dourada abelha
nem azul borboleta… sua prole
faminta, boquiaberta espera ter…
não! são aves da noite, são serpentes,
são lagartos imundos, que ela arroja
aos filhos p’ra viver.
ninho de rei!… palácio tenebroso,
que a avalanche a saltar cerca tombando!…
o gênio aí enseiba a geração…
e ao céu lhe erguendo os olhos flamejantes
sob as asas de fogo aquenta as almas
que um dia voarão.
por que espantas-te, amigo, se tua fronte
já de raios pejada, choca a nuvem?…
se o réptil em seu ninho se debate?…
é teu folgar primeiro… é tua festa!…
águias! p’ra vós cad’hora é uma tormenta,
cada festa um combate!…
radia!… é tempo!… e se a lufada erguer-se
muda a noite feral em prisma fúlgido!
de teu alto pensar completa a lei!…
irmão! prende esta mão de irmão na minha!. . .
toma a lira poeta! águia! esvoaça!
sobe, sobe, astro rei! . .
de tua aurora a bruma vai fundir-se
águia! faz-te mirar do sol, do raio;
arranca um nome no febril cantar.
vem! a glória, que é o alvo de vis setas,
é bandeira arrogante, que o combate
embeleza ao rasgar.
o meteoro real de coma fúlgida
rola e se engrossa ao devorar dos mundos…
gigante! cresces todo o dia assim!. :.
tal teu gênio, arrastando em novos trilhos
no curso audaz constelações de idéias,
marcha e recresce no marchar sem fim!",fr_XX,pt_XX,"A águia, é o gênio! ave da tormenta,
que dos montes mais altos busca a mais alta venta;
cujo grito altivo, do dia canta o ardente despertar;
que nunca suja sua garra na lama,
e cujo olho flamejante incessantemente troca
relâmpagos com o sol.
Seu ninho não é um ninho de musgo; é um ninho,
alguma rocha, escavada por um golpe de trovão,
alguma brecha de um pico, terrível aos olhos,
algum refúgio desabando, nas encostas dos montes sublimes,
que se vê, batido pelos ventos, pendurado entre dois abismos,
o negro precipício e os céus!
Não é o humilde verme, as abelhas douradas,
a verde libélula de asas multicoloridas
que aguardam seus filhotes, ávidos, de fome pressionados;
não! é a ave duvidosa, que na noite vegeta;
é o imundo lagarto, é a serpente que ele lança,
horrível, aos aguilhões eriçados.
Ninho real! palácio sombrio, e que por um fluxo de neve
a rolando avalanche assedia saltitante!
O gênio aí nutre seus filhos com amor,
e, voltando para o sol seus olhos cheios de chamas,
sob sua asa de fogo choca jovens almas,
que um dia alçarão voo!
Por que então te espantas, amigo, se sobre tua cabeça,
pesada de raios, já a nuvem se detém?
se algum réptil impuro em teu ninho se debate?
são teus primeiros jogos, é tua primeira festa:
para vós, aguilhões, cada hora tem sua tempestade,
cada festim é um combate.
Brilha, é tempo! e, se vier uma tempestade,
em prisma deslumbrante transforma a nuvem negra.
Que teu pensamento elevado cumpra sua lei.
Vem, junta tua mão de irmão à minha mão fraternal.
Poeta, pega tua lira; águia, abre tua jovem asa;
estrela, estrela, ergue-te!
A bruma de tua alvorada, amigo, vai se dissipar.
Faz-te conhecer, aguilhão, pelo sol, pelo trovão.
Vem arrancar um nome por teus cantos inspirados;
vem; esta glória, alvo de tantas flechas vulgares,
assemelha-se às férreas bandeiras que se trazem das guerras,
mais belas quando estão despedaçadas!
Vê o astro hirsuto que, real meteoro,
rola, ao aumentar-se dos mundos que devora;
tal, ó jovem gigante, que cresces a cada dia,
tal teu gênio ardente, longe das rotas traçadas,
arrastando em seu curso mundos de pensamentos,
sempre avança e cresce sempre!",-1
"– elle était fort déshabillée
et de grands arbres indiscrets
aux vitres jetaient leur feuillée
malinement, tout près, tout près.
.
assise sur ma grande chaise,
mi-nue, elle joignait les mains.
sur le plancher frissonnaient d’aise
ses petits pieds si fins, si fins.
.
– je regardai, couleur de cire
un petit rayon buissonnier
papillonner dans son sourire
et sur son sein, – mouche au rosier.
.
– je baisai ses fines chevilles.
elle eut un doux rire brutal
qui s’égrenait en claires trilles,
un joli rire de cristal.
.
les petits pieds sous la chemise
se sauvèrent: “veux-tu finir!”
– la première audace permise,
le rire feignait de punir!
.
– pauvrets palpitants sous ma lèvre,
je baisai doucement ses yeux:
– elle jeta sa tête mièvre
en arrière: “oh! c’est encor mieux!…
.
monsieur, j’ai deux mots à te dire…”
– je lui jetai le reste au sein
dans un baiser, qui la fit rire
d’un bon rire qui voulait bien…
.
– elle était fort déshabillée
et de grands arbres indiscrets
aux vitres jetaient leur feuillée
malinement, tout près, tout près.","– quase despida estava ela
e de um grande ramo indiscreto
folhas saltavam na janela
em malícia, perto, perto.
.
seminua, cruzava as mãos,
assentada sem muito tino
no sofá, esfregando ao chão
os pezinhos tão finos, finos.
.
– pálido, ficava a observar
uma pequena luz gazeteira
em seu sorriso borboletear
e no seio, – mosca na roseira.
.
– beijei-lhe os tornozelos finos.
soltou doce riso brutal
que se desfez em claros trinos,
um belo riso de cristal.
.
pequeninos pés em partida
sob a camisa: “queres parar!”
– primeira audácia permitida,
e o riso que fingia castigar!
.
– sob os meus lábios, palpitantes
os olhos se deixavam beijar:
– joga a cabeça petulante
pra trás: “muito melhor está!…
.
senhor, tenho algo a lhe dizer…”
– o resto no seio eu lançava
num beijo que lhe deu prazer
com um bom riso que aceitava…
.
– quase despida estava ela
e de um grande ramo indiscreto
folhas saltavam na janela
em malícia, perto, perto.",fr_XX,pt_XX,"– ela estava bem despojada
e grandes árvores curiosas
nas janelas lançavam sua folhagem
sorrateiramente, tão perto, tão perto.

sentada em minha grande cadeira,
meio nua, ela juntava as mãos.
no chão tremiam de prazer
seus pezinhos tão finos, tão finos.

– eu olhava, cor de cera,
um pequeno raio furtivo
pululando em seu sorriso
e em seu seio, – mosca na rosa.

– beijei suas finas tornozelas.
ela soltou uma doce risada bruta
que se desmanchava em claras trinados,
uma linda risada de cristal.

os pezinhos sob a camisa
se escaparam: ""queres terminar!""
– a primeira audácia permitida,
a risada fingia punir!

– pobres batendo sob meu lábio,
beijei suavemente seus olhos:
– ela jogou sua cabeça delicada
para trás: ""oh! é ainda melhor!...

senhor, tenho duas palavras para te dizer...""
– joguei o resto em seu seio
em um beijo, que a fez rir
de um bom riso que queria bem...

– ela estava bem despojada
e grandes árvores curiosas
nas janelas lançavam sua folhagem
sorrateiramente, tão perto, tão perto.",1
"je me suis enfin détaché
de toutes choses naturelles
je peux enfin mourir mais non pêcher
et ce qu’on n’a jamais touché
je l’ai touché je l’ai palpé
et j’ai scruté tout ce que nul
ne peut en rien imaginer
et j’ai soupesé maintes fois
même la vie impondérable
je peux mourir en souriant","eu finalmente me afastei
de tudo que há de natural
posso morrer mas não pecar
e o que ninguém jamais tocou
não só toquei como apalpei
já perscrutei o que ninguém
nunca sequer imaginou
e sopesei vezes sem conta
até a vida imponderável
se vou morrer, morro sorrindo",fr_XX,pt_XX,"Finalmente me desliguei
de todas as coisas naturais
posso agora morrer, mas não pecar
e o que nunca foi tocado
eu toquei, eu senti
e examinei tudo o que ninguém
pode sequer imaginar
e pesei muitas vezes
até a vida impalpável
posso morrer sorrindo.",-1
"mon ptit lou adoré je voudrais mourir un jour que tu m’aimes
je voudrais être beau pour que tu m’aimes
je voudrais être fort pour que tu m’aimes
je voudrais être jeune jeune pour que tu m’aimes
je voudrais que la guerre recommençât pour que tu m’aimes
je voudrais te prendre pour que tu m’aimes
je voudrais te fesser pour que tu m’aimes
je voudrais te faire mal pour que tu m’aimes
je voudrais que nous soyons seuls dans une chambre d’hôtel à grasse pour que tu m’aimes
je voudrais que nous soyons seuls dans mon petit bureau près de la terrasse couchés sur le lit de fumerie pour que tu m’aimes
je voudrais que tu sois ma soeur pour t’aimer incestueusement
je voudrais que tu eusses été ma cousine pour qu’on se soit aimés très jeunes
je voudrais que tu sois mon cheval pour te chevaucher longtemps, longtemps
je voudrais que tu sois mon coeur pour te sentir toujours en moi.
je voudrais que tu sois le paradis ou l’enfer selon le lieu où j’aille
je voudrais que tu sois un petit garçon pour être ton précepteur
je voudrais que tu sois la nuit pour nous aimer dans les ténèbres
je voudrais que tu sois ma vie pour être par toi seule
je voudrais que tu sois un obus boche pour me tuer d’un soudain amour","meu lobinho adorado queria morrer no dia em que você me amasse
queria ser bonito para que você me amasse
queria ser forte para que você me amasse
queria ser jovem jovem para que você me amasse
queria que guerra recomeçasse para que você me amasse
queria agarrar você para que você me amasse
queria dar palmadas na sua bunda para que você me amasse
queria maltratar você para que você me amasse
queria que estivéssemos sós no meu estudiozinho junto ao terraço deitados na cama do fuminho de ópio para que você me amasse
queria que você fosse minha irmã para amar você in-ces-tu-o-sa-men-te
queria que você fosse minha prima para que a gente pudesse se amar bem jovem
queria que você fosse meu cavalo para cavalgar você muito tempo muito tempo
queria que você fosse meu coração para sentir você sempre em mim
queria que você fosse o paraíso ou o inferno conforme o lugar aonde eu vou
queria que você fosse um menino para que eu fosse o seu professor
queria que você fosse a noite para eu amar você nas trevas
queria que você fosse a minha vida para que ela fosse só de você
queria que você fosse um obus alemão para me matar de um amor súbito",fr_XX,pt_XX,"meu querido lobo adorado, um dia eu gostaria de morrer para que me ames
gostaria de ser belo para que me ames
gostaria de ser forte para que me ames
gostaria de ser jovem jovem para que me ames
gostaria que a guerra recomeçasse para que me ames
gostaria de te pegar para que me ames
gostaria de te bater para que me ames
gostaria de te machucar para que me ames
gostaria que estivéssemos sozinhos em um quarto de hotel em Grasse para que me ames
gostaria que estivéssemos sozinhos no meu pequeno escritório perto do terraço deitados na cama de fumar para que me ames
gostaria que fosses minha irmã para te amar de maneira incestuosa
gostaria que tivesses sido minha prima para que nos tivéssemos amado desde jovens
gostaria que fosses meu cavalo para cavalgar-te por muito tempo, muito tempo
gostaria que fosses meu coração para sempre te sentir em mim
gostaria que fosses o paraíso ou o inferno, conforme o lugar aonde vá
gostaria que fosses um menino para ser teu preceptor
gostaria que fosses a noite para nos amarmos nas trevas
gostaria que fosses minha vida para ser só por ti
gostaria que fosses um obus alemão para me matar de um amor repentino",1
