original_poem,translated_poem,src_lang,tgt_lang,translated_by_TA,topic
"sur mes cahiers d’écolier
sur mon pupitre et les arbres
sur le sable sur la neige
j’écris ton nom
sur toutes les pages lues
sur toutes les pages blanches
pierre sang papier ou cendre
j’écris ton nom
sur les images dorées
sur les armes des guerriers
sur la couronne des rois
j’écris ton nom
sur la jungle et le désert
sur les nids sur les genêts
sur l’écho de mon enfance
j’écris ton nom
sur les merveilles des nuits
sur le pain blanc des journées
sur les saisons fiancées
j’écris ton nom
sur tous mes chiffons d’azur
sur l’étang soleil moisi
sur le lac lune vivante
j’écris ton nom
sur les champs sur l’horizon
sur les ailes des oiseaux
et sur le moulin des ombres
j’écris ton nom
sur chaque bouffée d’aurore
sur la mer sur les bateaux
sur la montagne démente
j’écris ton nom
sur la mousse des nuages
sur les sueurs de l’orage
sur la pluie épaisse et fade
j’écris ton nom
sur les formes scintillantes
sur les cloches des couleurs
sur la vérité physique
j’écris ton nom
sur les sentiers éveillés
sur les routes déployées
sur les places qui débordent
j’écris ton nom
sur la lampe qui s’allume
sur la lampe qui s’éteint
sur mes maisons réunies
j’écris ton nom
sur le fruit coupé en deux
du miroir et de ma chambre
sur mon lit coquille vide
j’écris ton nom
sur mon chien gourmand et tendre
sur ses oreilles dressées
sur sa patte maladroite
j’écris ton nom
sur le tremplin de ma porte
sur les objets familiers
sur le flot du feu béni
j’écris ton nom
sur toute chair accordée
sur le front de mes amis
sur chaque main qui se tend
j’écris ton nom
sur la vitre des surprises
sur les lèvres attentives
bien au-dessus du silence
j’écris ton nom
sur mes refuges détruits
sur mes phares écroulés
sur les murs de mon ennui
j’écris ton nom
sur l’absence sans désir
sur la solitude nue
sur les marches de la mort
j’écris ton nom
sur la santé revenue
sur le risque disparu
sur l’espoir sans souvenir
j’écris ton nom
et par le pouvoir d’un mot
je recommence ma vie
je suis né pour te connaître
pour te nommer
liberté.","nos meus cadernos de escola
no banco dela e nas árvores
e na areia e na neve
escrevo o teu nome
em todas as folhas lidas
nas folhas todas em branco
pedra sangue papel cinza
escrevo o teu nome
nas imagens todas de ouro
e nas armas dos guerreiros
nas coroas dos monarcas
escrevo o teu nome
nas selvas e nos desertos
nos ninhos e nas giestas
no eco da minha infância
escrevo o teu nome
nas maravilhas das noites
no pão branco das manhãs
nas estações namoradas
escrevo o teu nome
nos meus farrapos de azul
no charco sol bolorento
no lago da lua viva
escrevo o teu nome
nos campos e no horizonte
nas asas dos passarinhos
e no moinho das sombras
escrevo o teu nome
no bafejar das auroras
no oceano nos navios
e na montanha demente
escrevo o teu nome
na espuma fina das nuvens
no suor do temporal
na chuva espessa apagada
escrevo o teu nome
nas formas mais cintilantes
nos sinos todos das cores
na verdade do que é físico
escrevo o teu nome
nos caminhos despertados
nas estradas desdobradas
nas praças que se transbordam
escrevo o teu nome
no candeeiro que se acende
no candeeiro que se apaga
nas minhas casas bem juntas
escrevo o teu nome
no fruto cortado em dois
do meu espelho e do meu quarto
na cama concha vazia
escrevo o teu nome
no meu cão guloso e terno
nas suas orelhas tesas
na sua pata desastrada
escrevo o teu nome
no trampolim desta porta
nos objectos familiares
na onda do lume bento
escrevo o teu nome
na carne toda rendida
na fronte dos meus amigos
em cada mão que se estende
escrevo o teu nome
na vidraça das surpresas
nos lábios todos atentos
muito acima do silêncio
escrevo o teu nome
nos refúgios destruídos
nos meus faróis arruinados
nas paredes do meu tédio
escrevo o teu nome
na ausência sem desejos
na desnuda solidão
nos degraus mesmos da morte
escrevo o teu nome
na saúde rediviva
aos riscos desaparecidos
no esperar sem saudade
escrevo o teu nome
por poder de uma palavra
recomeço a minha vida
nasci para conhecer-te
nomear-te
liberdade.",fr_XX,pt_XX,"sobre meus cadernos de escola
sobre minha carteira e as árvores
sobre a areia sobre a neve
escrevo teu nome
em todas as páginas lidas
em todas as páginas em branco
pedra sangue papel ou cinza
escrevo teu nome
nas imagens douradas
nas armas dos guerreiros
na coroa dos reis
escrevo teu nome
na selva e no deserto
nos ninhos nos tojos
no eco da minha infância
escrevo teu nome
nas maravilhas das noites
no pão branco dos dias
nas estações noivas
escrevo teu nome
em todos meus trapos de azul
no charco sol mofado
no lago lua viva
escrevo teu nome
nos campos no horizonte
nas asas dos pássaros
e no moinho das sombras
escrevo teu nome
em cada sopro de aurora
no mar nos barcos
na montanha insana
escrevo teu nome
na espuma das nuvens
no suor da tempestade
na chuva densa e insossa
escrevo teu nome
nas formas cintilantes
nos sinos das cores
na verdade física
escrevo teu nome
nas trilhas despertas
nas estradas desdobradas
nas praças transbordantes
escrevo teu nome
na lâmpada que se acende
na lâmpada que se apaga
nas minhas casas reunidas
escrevo teu nome
na fruta cortada ao meio
do espelho e do meu quarto
na minha cama concha vazia
escrevo teu nome
no meu cão guloso e terno
nas suas orelhas atentas
na sua pata desajeitada
escrevo teu nome
no batente da minha porta
nos objetos familiares
no fluxo do fogo abençoado
escrevo teu nome
em toda carne harmonizada
na testa dos meus amigos
em cada mão estendida
escrevo teu nome
no vidro das surpresas
nos lábios atentos
bem acima do silêncio
escrevo teu nome
nos meus refúgios destruídos
nos meus faróis desabados
nas paredes do meu tédio
escrevo teu nome
na ausência sem desejo
na solidão nua
nos degraus da morte
escrevo teu nome
na saúde recuperada
no risco desaparecido
na esperança sem lembrança
escrevo teu nome
e pelo poder de uma palavra
recomeço minha vida
nasci para te conhecer
para te chamar
liberdade.",1
"frères humains, qui après nous vivez,
n’ayez les coeurs contre nous endurcis,
car, si pitié de nous pauvres avez,
dieu en aura plus tôt de vous mercis.
vous nous voyez ci attachés, cinq, six:
quant à la chair, que trop avons nourrie,
elle est piéça dévorée et pourrie,
et nous, les os, devenons cendre et poudre.
de notre mal personne ne s’en rie;
mais priez dieu que tous nous veuille absoudre!
se frères vous clamons, pas n’en devez
avoir dédain, quoique fûmes occis
par justice. toutefois, vous savez
que tous hommes n’ont pas bon sens rassis.
excusez-nous, puisque sommes transis,
envers le fils de la vierge marie,
que sa grâce ne soit pour nous tarie,
nous préservant de l’infernale foudre.
nous sommes morts, âme ne nous harie,
mais priez dieu que tous nous veuille absoudre!
la pluie nous a débués et lavés,
et le soleil desséchés et noircis.
pies, corbeaux nous ont les yeux cavés,
et arraché la barbe et les sourcils.
jamais nul temps nous ne sommes assis
puis çà, puis là, comme le vent varie,
a son plaisir sans cesser nous charrie,
plus becquetés d’oiseaux que dés à coudre.
ne soyez donc de notre confrérie;
mais priez dieu que tous nous veuille absoudre!
prince jésus, qui sur tous a maistrie,
garde qu’enfer n’ait de nous seigneurie:
a lui n’ayons que faire ne que soudre.
hommes, ici n’a point de moquerie;
mais priez dieu que tous nous veuille absoudre!","irmãos humanos que ao redor viveis,
não nos olheis com duro coração,
pois se aos pobres de nós absolveis
também a vós deus vos dará perdão.
aqui nos vedes presos, cinco, seis:
quanto era cara viva que comia
foi devorado e em pouco apodrecia.
ficamos, cinza e pó, os ossos, sós.
que de nossa aflição ninguém se ria,
mas suplicai a deus por todos nós.
se dizemos irmãos, vós não deveis
sentir desprezo, embora condenados
tenhamos sido em vida. bem sabeis:
nem todos têm os sentidos sentados.
desculpai-nos, que já estamos gelados,
perante o filho da virgem maria.
que seu favor não nos falte um só dia
para livrar-nos do inimigo atroz.
estamos mortos: que ninguém sorria,
mas suplicai a deus por todos nós.
a chuva nos lavou e nos desfez
e o sol nos fez negros e ressecados,
corvos furaram nossos olhos e eis-
nos de pêlos e cílios despojados,
paralíticos, nunca mais parados,
pra cá, pra lá, como o vento varia,
ao seu talante, sem cessar, levados,
mais bicados do que um dedal. a vós
não ofertamos nossa confraria,
mas suplicai a deus por todos nós.
meu príncipe jesus, que a tudo vês,
não nos entregues à soberania
do inferno, que só ouvimos tua voz.
homens, aqui não cabe zombaria,
mas suplicai a deus por todos nós.",fr_XX,pt_XX,"Irmãos humanos, que após nós viverdes,  
não tenhais os corações endurecidos contra nós,  
pois, se tiverdes piedade de nós pobres,  
Deus terá mais cedo misericórdia de vós.  
Nos vedes aqui amarrados, cinco, seis:  
quanto à carne, que demasiado alimentamos,  
há muito devorada e apodrecida,  
e nós, os ossos, tornamo-nos cinza e pó.  
De nosso mal ninguém deve rir-se;  
mas rogai a Deus que a todos queira absolver!  
Se vos clamamos irmãos, não deveis  
ter desdém, embora fôssemos mortos  
pela justiça. Contudo, sabeis  
que nem todos os homens têm bom senso equilibrado.  
Desculpai-nos, pois estamos exangues,  
em relação ao filho da Virgem Maria,  
que sua graça não se esgote para nós,  
nos preservando do infernal trovão.  
Estamos mortos, a alma não nos atormenta,  
mas rogai a Deus que a todos queira absolver!  
A chuva nos lavou e purificou,  
e o sol nos secou e enegreceu.  
Pegavas, corvos nos cavaram os olhos,  
e arrancaram a barba e as sobrancelhas.  
Nunca em tempo algum nos sentamos  
quiçá aqui, quiçá lá, como o vento varia,  
a seu bel-prazer sem cessar nos carrega,  
mais bicados por aves do que dados de costura.  
Não sejais, pois, de nossa confraria;  
mas rogai a Deus que a todos queira absolver!  
Príncipe Jesus, que sobre todos tens domínio,  
guarda que o inferno não tenha senhorio sobre nós:  
a ele não tenhamos que fazer ou soldar.  
Homens, aqui não há zombaria;  
mas rogai a Deus que a todos queira absolver!",2
"se j’ayme et sers la belle de bon hait.
m’en devez vous tenir ne vil ne sot?
elle a en soy des biens a fin souhait.
pour son amour sains bouclier et passot;
quand viennent gens, je cours et happe un pot,
au vin m’en voys, sans demener grand bruit;
je leur tends eaue, frommage, pain et fruit.
s’ilz payent bien, je leur dis “bene stat;
retournez cy, quand vous serez en ruit,
en ce bordeau ou tenons notre estat.”
mais adoncques il y a grand deshait
quand sans argent s’en vient couchier margot;
veoir ne la puis, mon coeur a mort la hait.
sa robe prends, demi-ceint et surcot,
si luy jure qu’il tendra pour l’escot.
par les côtés se prend “c’est antecrist”;
crie, et jure par la mort jhesucrist
que non fera. lors empongne un esclat;
dessus son nez luy en fais ung escript,
en ce bordeau ou tenons notre estat..
puis paix se fait et me fait ung gros pet,
plus enflé qu’ung velimeux escarbot.
riant, m’assiet son poing sur mon sommet,
“go! go!” me dit, et me fiert le jambot.
tous deux yvres, dormons comme ung sabot.
et au resveil, quand le ventre luy bruit,
monte sur moy, que ne gaste son fruit.
soubz elle geins, plus qu’un aiz me fais plat,
de paillarder tout elle me destruit,
en ce bordeau ou tenons notre état.
vente, gresle, gelle, j’ai mon pain cuit.
ie suis paillart, la paillarde me suit.
lequel vault mieulx ? chascun bien s’entresuit.
l’ung l’autre vaut; c’est à mau rat mau chat.
ordure aimons, ordure nous assuit;
nous deffuyons honneur, il nous deffuit,
en ce bordeau ou tenons notre estat.","se eu amo e sirvo a dona de bom grado,
tomar-me-ão por vil, paspalho e tudo?
ela dá conta de qualquer recado,
por seu amor cinjo punhal e escudo.
quando vem gente, eu me despacho, grudo
um pichel de vinho e me viro na moita, não
sem dar água, queijo, fruta e pão.
digo (se pagam bem): “nomine figlii,
e voltem sempre às ordens do tesão,
a este bordel, que é o nosso domicílio!”
não tarda muito, e eis-me de humor amargo,
se sem dinheiro ela me vem pro quarto:
não a suporto, quero vê-la morta:
faço a pilhagem nos seus quatro trapos
e juro me pagar por conta e encargo.
pego-a por trás e ela: “anticristo!”
– jura por nosso senhor jesus cristo
que não dará. passo a mão num porrete
e lhe gravo na estampa um bom lembrete,
neste bordel, que é o nosso domicílio.
mas vem a paz, e ela me vem com um bruto
peido, mais venenoso do que um bafo
de onça. rindo, me acerta um squiafo no
coco, diz: “vem, filhote”, e abre o pernão.
então, dormimos como um pau, briacos.
margô desperta, o ventre lhe ronrona,
e monta em mim: desatrofia o anão,
de milho em milho me debulha o saco.
de tanto putear, fico na lona,
neste bordel, que é o nosso domicílio.
tenho o pão quente – vente, chova ou neve.
sou putanheiro e puta não faz greve:
quem vale mais, se não se vê a mais leve
diferença de brilho – se a tal mãe, tal filho?!
amor ao lixo – e o lixo vem atrás;
desprezo à honra – e a honra é mais voraz,
neste bordel, que é o nosso domicílio.",fr_XX,pt_XX,"Se amo e sirvo a bela de bom coração,
Devo ser considerado vil ou tolo?
Ela em si tem bens desejáveis ​​em abundância.
Por seu amor, sã proteção e passagem;
Quando as pessoas chegam, eu corro e pego um jarro,
Para o vinho vou, sem fazer muito barulho;
Ofereço-lhes água, queijo, pão e fruta.
Se pagam bem, digo-lhes ""tudo bem;
Voltem aqui, quando estiverem em festa,
Neste bordel onde mantemos nosso estado.""
Mas então há um grande desejo
Quando sem dinheiro vem dormir Margot;
Não posso vê-la, meu coração a odeia mortalmente.
Pego seu vestido, meio-cinto e sobretudo,
E juro que ele pagará pelo escote.
Pelos lados ele é pego ""é o anticristo"";
Grita e jura pela morte de Jesus Cristo
Que não fará. Então pego um caco;
Sobre seu nariz escrevo uma inscrição,
Neste bordel onde mantemos nosso estado.
Então a paz se faz e ela solta um grande peido,
Mais inchado do que um asqueroso escaravelho;
Rindo, ela bate seu punho em minha cabeça,
""Vai! Vai!"" ela diz, e bate na minha perna.
Ambos bêbados, dormimos como um par.
E ao acordar, quando sua barriga ronca,
Ela se deita sobre mim, para não estragar sua fruta.
Debaixo dela eu gemi, mais que um asno me rendo,
Com toda a promiscuidade ela me destrói,
Neste bordel onde mantemos nosso estado.
Vento, granizo, geada, tenho meu pão cozido.
Sou devasso, a devassa me segue.
Qual de nós vale mais? Cada um bem se entende.
Um ao outro vale; é mau rato, mau gato.
Amamos a sujeira, a sujeira nos acompanha;
Fugimos da honra, ela nos foge,
Neste bordel onde mantemos nosso estado.",-1
"quoiqu’on tient belles langagères
florentines, vénitiennes,
assez pour être messagères,
et mêmement les anciennes,
mais soient lombardes, romaines.
genevoises, à mes périls,
pimontoises, savoisiennes,
il n’est bon bec que de paris.
de beau parler tiennent chaïères,
ce dit-on, les napolitaines,
et sont très bonnes caquetières
allemandes et prussiennes ;
soient grecques, egyptiennes,
de hongrie ou d’autres pays,
espagnoles ou catelennes,
il n’est bon bec que de paris.
brettes, suisses n’y savent guères,
gasconnes, n’aussi toulousaines:
de petit pont deux harengères
les concluront, et les lorraines,
angloises et calaisiennes,
(ai-je beaucoup de lieux compris?)
picardes de valenciennes;
il n’est bon bec que de paris.
prince, aux dames parisiennes
de bien parler donnez le prix;
quoi que l’on die d’italiennes,
il n’est bon bec que de paris.","que sejam boas linguareiras
florentinas e venezianas,
para servir de mensageiras,
também lombardas e romanas,
e as genovesas e as toscanas.
aqui vos garante quem diz
(em que pese às sicilianas):
para a boca, só de paris.
em bem falar serão vezeiras,
doutoras, as napolitanas.
como boas cacarejeiras
as de bruges e as alamanas.
que sejam gregas ou troianas,
e de hungria ou de outro país,
aragonezas, castelhanas;
para a boca, só de paris.
bretãs, suíças, más palradeiras.
mais gascoas e toulousanas:
um par das nossas regateiras
cala-as logo e às alsacianas,
às ingresas como às renanas
(é bastante a lista que eu fiz?),
e às picardas e às sabolanas:
para a boca, só de paris.
senhor, às damas mais maganas
o prémio deveis dar, feliz.
por mais que valham italianas
– para a boca, só de paris.",fr_XX,pt_XX,"Embora sejam belas faladoras 
florentinas, venezianas, 
suficientemente para serem mensageiras, 
e até mesmo as antigas, 
mas sejam lombardas, romanas, 
genebrinas, sob meu risco, 
piemontesas, saboiardas, 
não há bom bico senão o de Paris. 
De belo falar têm cadeira, 
dizem, as napolitanas, 
e são ótimas tagarelas 
alemãs e prussianas; 
sejam gregas, egípcias, 
húngaras ou de outros países, 
espanholas ou catalãs, 
não há bom bico senão o de Paris. 
Bretãs, suíças não sabem muito, 
gasconhas, nem tampouco toulousanas: 
duas vendedoras do Petit Pont 
as encerrarão, e as lorranesas, 
inglesas e calaisianas, 
(tenho eu muitos lugares incluídos?) 
picardas de Valenciennes; 
não há bom bico senão o de Paris. 
Príncipe, às damas parisienses 
dê o prêmio de bem falar; 
o que quer que digam das italianas, 
não há bom bico senão o de Paris.",1
"frères humains, qui après nous vivez,
n’ayez les coeurs contre nous endurcis,
car, si pitié de nous pauvres avez,
dieu en aura plus tôt de vous mercis.
vous nous voyez ci attachés, cinq, six:
quant à la chair, que trop avons nourrie,
elle est piéça dévorée et pourrie,
et nous, les os, devenons cendre et poudre.
de notre mal personne ne s’en rie;
mais priez dieu que tous nous veuille absoudre!
se frères vous clamons, pas n’en devez
avoir dédain, quoique fûmes occis
par justice. toutefois, vous savez
que tous hommes n’ont pas bon sens rassis.
excusez-nous, puisque sommes transis,
envers le fils de la vierge marie,
que sa grâce ne soit pour nous tarie,
nous préservant de l’infernale foudre.
nous sommes morts, âme ne nous harie,
mais priez dieu que tous nous veuille absoudre!
la pluie nous a débués et lavés,
et le soleil desséchés et noircis.
pies, corbeaux nous ont les yeux cavés,
et arraché la barbe et les sourcils.
jamais nul temps nous ne sommes assis
puis çà, puis là, comme le vent varie,
a son plaisir sans cesser nous charrie,
plus becquetés d’oiseaux que dés à coudre.
ne soyez donc de notre confrérie;
mais priez dieu que tous nous veuille absoudre!
prince jésus, qui sur tous a maistrie,
garde qu’enfer n’ait de nous seigneurie:
a lui n’ayons que faire ne que soudre.
hommes, ici n’a point de moquerie;
mais priez dieu que tous nous veuille absoudre!","irmãos humanos que ainda viveis,
não sejais corações endurecidos;
tendo pena de nós, pobres, talvez
de deus sereis mais cedo merecidos.
vede os pescoços, cinco ou seis, torcidos;
a carne, que sorveu tanto alimento,
está hoje devorada e em fermento,
e ossos, a cinza e pó vamos volver.
ninguém ria de tal padecimento:
clamai a deus a nos absolver.
se de irmão vos chamarmos, não deveis
tratar-nos com desdém por termos sido
justiçados. contudo, vós sabeis:
nem por todo o senso é conhecido,
desculpai-nos, por sermos falecidos,
junto ao filho da virgem, seu assento.
conserve-nos da graça o acolhimento:
livre-no de no inferno dissolver.
eis-nos mortos, ninguém nos dê tormento:
clamai a deus a nos absolver.
a chuva nos lavou, limpou de vez,
e o sol secou e pôs enegrecidos;
corvos cravam os olhos de avidez,
barba e fios puxando enfurecidos.
não nos firmamos mais, enrijecidos,
balançando de um lado a outro, ao vento,
sempre ao seu bel-prazer em movimento,
mais furos que em dedal, a revolver.
evitai da irmandade o envolvimento:
clamai a deus a nos absolver.
príncipe jesus, guiai-nos o tento,
cuidai que o inferno não esteja atento:
lá, não há o que ver ou resolver.
homens, do riso aqui há banimento:
clamai a deus a nos absolver.",fr_XX,pt_XX,"Irmãos humanos, que após nós viverdes,
não endureçais vossos corações contra nós,
pois se piedade de nós pobres tendes,
Deus terá mais cedo misericórdia de vós.
Vede-nos aqui atados, cinco, seis:
quanto à carne, que demasiado nutrimos,
há muito foi devorada e apodreceu,
e nós, os ossos, tornamo-nos cinzas e pó.
De nosso mal ninguém se ria;
mas rogai a Deus que a todos nos queira absolver!
Se irmãos vos clamamos, não deveis
ter desdém, mesmo que fôssemos mortos
pela justiça. no entanto, sabeis
que nem todos os homens têm bom senso sólido.
Desculpai-nos, pois estamos traspassados,
em relação ao filho da virgem Maria,
que sua graça não se esgote para nós,
nos preservando do infernal raio.
Estamos mortos, a alma não nos assombre,
mas rogai a Deus que a todos nos queira absolver!
A chuva nos encharcou e lavou,
e o sol nos secou e escureceu.
Pios, corvos nos arrancaram os olhos,
e arrancaram a barba e as sobrancelhas.
Nunca um só momento nos assentamos
sempre de um lado para o outro, como o vento varia,
aos seus caprichos sem cessar nos carrega,
mais bicados por pássaros do que dados de costura.
Portanto, não façais parte de nossa confraria;
mas rogai a Deus que a todos nos queira absolver!
Príncipe Jesus, que sobre todos tem domínio,
guarda que o inferno de nós não tenha senhorio:
a ele não temos nada a dever nem a pagar.
Homens, aqui não há zombaria;
mas rogai a Deus que a todos nos queira absolver!",2
"ayez pitié, ayez pitié de moi,
a tout le moins, s’il vous plaît, mes amis!
en fosse gis, non pas sous houx ne mai,
en cet exil ouquel je suis transmis
par fortune, comme dieu l’a permis.
filles aimant jeunes gens et nouveaux,
danseurs, sauteurs, faisant les pieds de veaux,
vifs comme dards, aigus comme aiguillon,
gousiers tintant clair comme cascaveaux,
le laisserez là, le pauvre villon ?
chantres chantant à plaisance, sans loi,
galants riant, plaisants en faits et dits,
coureux allant francs de faux or, d’aloi,
gens d’esperit, un petit étourdis,
trop demourez, car il meurt entandis.
faiseurs de lais, de motets et rondeaux,
quand mort sera, vous lui ferez chaudeaux!
où gît, il n’entre éclair ne tourbillon:
de murs épais on lui a fait bandeaux.
le laisserez là, le pauvre villon?
venez le voir en ce piteux arroi,
nobles hommes, francs de quart et de dix,
qui ne tenez d’empereur ne de roi,
mais seulement de dieu de paradis;
jeûner lui faut dimanches et merdis,
dont les dents a plus longues que râteaux;
après pain sec, non pas après gâteaux,
en ses boyaux verse eau à gros bouillon;
bas en terre, table n’a ne tréteaux.
le laisserez là, le pauvre villon?
princes nommés, anciens, jouvenceaux,
lmpétrez-moi grâces et royaux sceaux,
et me montez en quelque corbillon.
ainsi le font, l’un à l’autre, pourceaux,
car, où l’un brait, ils fuient à monceaux.
le laisserez là, le pauvre villon?","tende piedade, ó tende piedade
ao menos vós, amigos mais sentidos!
no fosso estou, e sem amenidades
cá neste exílio ao qual fui remetido
pela sorte, e por deus foi permitido.
moças, amantes, jovens e donzéis,
saltimbancos girando sobre os pés,
gargantas-guizos como cascavéis,
fica o pobre villon sob os grilhões?
cantores livres, soltos, à vontade,
galantes palradores desmedidos,
biltres sem ouro falso ou de verdade,
seres de tanto espírito aturdido,
tardais muito, porque morre estendido!
com rondós e motetos, menestréis,
dai-lhe, ao morrer, um bom caldo, ao invés!
onde está, não vão raios, turbilhões:
muros espessos são vendas cruéis.
fica o pobre villon sob os grilhões?
vinde vê-lo em atroz calamidade,
nobres homens, sem tributos retidos,
que sois livres de império e majestade,
e só a deus no céu sois prometidos.
terça e domingo são jejuns batidos
e tem os dentes mais longos que ancinhos;
após pão seco – e nada de pastéis –
corre nas tripas água aos borbotões.
jaz no solo, sem mesa e sem tripés:
fica o pobre villon sob os grilhões?
príncipes raros, velhos ou donzéis,
dai-me o selo real sobre os papéis
e tirai-me em canastra dos porões;
até os porcos juntos são fiéis:
se um ronca, seguem outros em tropéis.
fica o pobre villon sob os grilhões?",fr_XX,pt_XX,"Tende piedade, tende piedade de mim,
ao menos, por favor, meus amigos!
Em sepultura jaz, não sob azevinho nem maio,
neste exílio em que fui lançado
pela fortuna, como Deus permitiu.
Moças amando jovens e novos,
dançarinos, saltadores, fazendo pés de bezerro,
ágeis como flechas, afiados como aguilhão,
gargantas soando claro como sinos,
o deixarão lá, o pobre vilão?
Cantores cantando à vontade, sem lei,
galantes rindo, agradáveis em feitos e ditos,
corredores indo francos de falsas moedas, de liga,
pessoas de espírito, um pouco distraídas,
muito demoradas, porque ele morre ouvindo.
Criadores de lais, motetes e rondós,
quando a morte vier, vocês farão chaleiras para ele!
Onde jaz, não entra relâmpago nem turbilhão:
com paredes grossas lhe fizeram faixas.
O deixarão lá, o pobre vilão?
Venham vê-lo nesse lastimoso estado,
nobres homens, francos de quinto e de dízimo,
que não descendem de imperador nem rei,
mas somente de Deus do paraíso;
ele precisa jejuar domingos e quartas-feiras,
tem dentes mais longos que ancinhos;
depois de pão seco, não de bolos,
em suas entranhas despeja água em borbotões;
baixo na terra, sem mesa ou cavalete.
O deixarão lá, o pobre vilão?
Príncipes nomeados, antigos, jovens,
Imploro-lhes graças e selos reais,
e me levem em algum cesto.
Assim fazem, um ao outro, como porcos,
pois, onde um grunhe, eles fogem aos montes.
O deixarão lá, o pobre vilão?",1
