original_poem,translated_poem,src_lang,tgt_lang,translated_by_TA,topic
"i do not know what windings in the waste
of those strange sea-lanes brought me home once more,
but on my porch i trembled, white with haste
to get inside and bolt the heavy door.
i had the book that told the hidden way
across the void and through the space-hung screens
that hold the undimensioned worlds at bay,
and keep lost aeons to their own demesnes.
at last the key was mine to those vague visions
of sunset spires and twilight woods that brood
dim in the gulfs beyond this earth’s precisions,
lurking as memories of infinitude.
the key was mine, but as i sat there mumbling,
the attic window shook with a faint fumbling.","je ne sais quels détours dans ces déliquescences
du curieux bord de mer me menèrent chez moi,
mais tremblant sur le seuil, je blêmis d’impatience
de me trouver enfin à l’abri sous mon toit.
j’avais le livre qui indiquait le chemin
entre vide et parois suspendus dans l’espace,
contenant les mondes sans dimension ni fin,
et gardant les éons à leur exacte place.
je possédais la clé de ces vagues visions
de flèches au couchant, de bois crépusculaires
dans des gouffres par-delà toute description,
tels des souvenirs d’infini qui se resserrent.
la clé m’appartenait, mais comme j’ânonnais,
la fenêtre au grenier se mit à résonner.",en_XX,fr_XX,"je ne sais pas quel tourbillon dans les décombres
des chemins maritimes étranges m'a ramené chez moi,
mais sur ma véranda j'étais tremblant, blanc de hâte
d'entrer et de verrouiller la lourde porte.
j'avais le livre qui racontait le chemin secret
à travers le vide et à travers les écrans suspendus à l'espace
qui tiennent à distance les mondes sans dimension,
et maintiennent les âges perdus dans leurs propres domaines.
enfin, la clé était à moi pour ces visions vagues
de flèches au crépuscule et de forêts au crépuscule qui hantent
sombres dans les gouffres au-delà des précisions de cette terre,
guettant comme des souvenirs d'infinitude.
la clé était à moi, mais alors que j'étais là à marmonner,
la fenêtre de l'attique tremblait avec un faible frottement.",2
"this mortal body of a thousand days
now fills, o burns, a space in thine own room,
where thou didst dream alone on budded bays,
happy and thoughtless of thy day of doom!
my pulse is warm with thine old barley-bree,
my head is light with pledging a great soul,
my eyes are wandering, and i cannot see,
fancy is dead and drunken at its goal;
yet can i stamp my foot upon thy floor,
yet can i ope thy window-sash to find
the meadow thou hast tramped o'er and o'er,--
yet can i think of thee till thought is blind,--
yet can i gulp a bumper to thy name,--
o smile among the shades, for this is fame!","ce corps mortel d'un millier de jours
occupe en ce moment, burns, une place dans la propre chambre,
où tu as rêvé seul de lauriers en bourgeons,
heureux et sans penser au jour fatal!
mon pouls s'échauffe avec ton propre barley-bree,
ma tête est légère pour porter un toast à une grande âme,
mes yeux sont hagards, et je ne peux pas voir,
mon imagination est anéantie et enivrée de son but;
et cependant je peux appuyer mon pied sur ton plancher,
je peux ouvrir le châssis de ta fenêtre pour découvrir
la prairie que tu as foulée si souvent,—
et cependant je peux penser à toi jusqu'à m'aveugler la pensée,—
et je peux boire une rasade en ton nom,—
oh! souris parmi les ombres, car c'est la célébrité!",en_XX,fr_XX,"ce corps mortel de mille jours
rempli, ô brûle, un espace dans ta propre chambre,
où tu as rêvé seul sur des rameaux en fleur,
heureux et insouciant de ton jour de déchéance !

mon pouls est chaud avec ton ancienne bière d'orge,
ma tête est légère en faisant un vœu à une grande âme,
mes yeux sont errants et je ne peux pas voir,
l'imagination est morte et ivre à son objectif ;
pourtant, je peux frapper du pied sur ton plancher,
je peux ouvrir ton store pour trouver
la prairie que tu as foulée fois après fois,
je peux penser à toi jusqu'à ce que la pensée soit aveugle,
je peux avaler une rasade à ton nom,
oh sourire parmi les ombres, car c'est la renommée !",2
"upon a sabbath-day it fell;
twice hoy was the sabbath-bell,
that call'd the folk to evening prayer;
the city streets were clean and fair
from wholesome drench of april rains;
and, on the western window panes,
the chilly sunset faintly told
o unmatur'd green vallies cold,
of the green thorny bloomless hedge,
of rivers new with spring-tide sedge,
of primroses by shelter'd rills,
and daisies on the aguish hills.
twice holy was the sabbath-bell:
the silent streets were crowded well
with staid an pious companies,
warm from their fire-side orat'ries;
and moving, with demurest air,
to even-song, and vesper prayer.
each arched porch, and entry low,
was fill'd with patient fold and slow,
with whispers hush, and shuffling feet,
while play'd the organ loud and sweet.","cela tomba un jour de sabbath;
deux fois sainte était la cloche du sabbath
qui appelait les fidèles à la prière du soir;
les rues de la ville étaient propres et nettes
purgées par les saines averses d'avril;
et sur les vitres des croisées, à l'occident,
le frileux coucher de soleil parlait tout bas
des froides vallées d'une verdure sans maturité,
des haies d'épines vertes sans fleurs,
des rivières récemment formées avec leurs joncs printaniers,
des primevères aux berges des ruisselets ombragés,
et des pâquerettes sur les frissonnantes collines.
deux fois sainte était la cloche du sabbath:
les silencieuses rues étaient encombrées
de groupes graves et pieux, encore
imprégnés de la chaleur de leurs oratoires;
ils se dirigeaient de l'air le plus réservé
vers les chants du soir et la prière de vêpres.
chaque porche cintré, chaque porte basse
etait plein d'une lente et patiente foule,
chuchotant à mi-voix, traînant les pieds,
tandis que résonnait l'orgue bruyant et doux.",en_XX,fr_XX,"Sur le jour du sabbat, cela tomba ;
deux fois sonna le clocher du sabbat,
appelant le peuple à la prière du soir ;
les rues de la ville étaient propres et belles
après l'arrosage salutaire des pluies d'avril ;
et, sur les fenêtres occidentales,
le crépuscule frais racontait
la verdure immaturée des vallées froides,
des haies épineuses sans fleur vertes,
des rivières neuves avec des roseaux du printemps,
des primevères au bord des ruisseaux abrités,
et des marguerites sur les agrestes collines.
deux fois sainte était la cloche du sabbat :
les rues silencieuses étaient bien remplies
de compagnies modestes et pieuses,
chaudes de leurs veillées ou de leurs oratoires ;
et se déplaçant, avec le plus sérieux des airs,
vers le chant du soir, et la prière des vêpres.
chaque porche voûté, et entrée basse,
étaient remplis de bêtes patientes et lentes,
avec des chuchotements discrets, et des pas traînants,
alors que l'orgue jouait fort et doucement.",2
"all was silent, all was gloom,
abroad and in the homely room:
down she sat, poor cheated soul!
and struck a lamp from the dismal coal;
lean'd forward, with bright drooping hair
and slant book, full against the glare.
her shadow, in uneasy guise,
hover'd about a giant size,
on ceiling-beam and old oak chair
the parrot's cage, and panel square;
and the warm angled winter screen,
on which were many monsters seen,
call'd doves of siam, lima mice,
and legless birds of paradise,
macaw, and tender avadavat,
and silken-furr'd angora cat.
untir'd she read, her shadow still
glower'd about, as it would fill
the room with wildest forms and shades,
as though some ghostly queen of spades
had come to moch behind her back,
and dance, and ruffle her garments black.","tout était silencieux, tout était sombre
au dehors et au dedans de la chambre:
elle s'assit, pauvre âme déçue!
puis alluma une lampe aux charbons presque éteints,
penchée en avant, sa brillante chevelure pendant,
et le livre incliné, en plein devant la clarté.
son ombre en une attitude guindée
vacillait de ci, de là, démesurément agrandie
sur les poutres du plafond et la vieille chaise de chêne,
sur la cage du perroquet et le panneau carré,
et l'écran brûlant placé en angle
sur lequel étaient dessinés un nombre infini de monstres
appelés colombes de siam, souris de lima,
et des oiseaux de paradis sans pattes,
un ara, et le tendre avadavat
et l'angora à la soyeuse fourrure.
sans se lasser elle lisait, et son ombre toujours
s'étendait, comme si elle voulait remplir
la pièce de ses formes et de ses silhouettes les plus fantasques,
comme si quelque dame de pique fantôme
etait venue ricaner derrière son dos,
danser et faire voltiger ses noirs vêtements.",en_XX,fr_XX,"Tout était silencieux, tout était tristesse,
à l'extérieur et dans la chère salle :
assise elle était, pauvre âme trahie !
et elle alluma une lampe avec le charbon sombre ;
penchée en avant, avec ses cheveux brillants et tombants
et son livre oblique, plein contre la clarté ;
son ombre, dans une allure inquiète,
se déplaçait à la taille d'un géant,
sur le poutre du plafond et le vieux fauteuil en chêne,
la cage de perroquet, et le panneau carré ;
et le châssis chauffé de l'écran d'hiver,
sur lequel on voyait de nombreux monstres,
appelés colombes de Siam, souris de Lima,
et oiseaux sans pattes des paradis,
le cacahuète, et tendre avadavat,
et le chat angora à fourrure soyeuse.
Sans relâche elle lisait, son ombre encore
se déployait, comme elle remplirait
la pièce des formes et des ombres les plus sauvages,
comme si une reine fantomatique des cartes de tarot
venait se faufiler derrière elle,
pour danser et froisser ses vêtements noirs.",2
"untir'd she read the legend page,
of holy mark, from youth to age,
on land, on sea, in pagan chains,
rejoicing for his many pains.
sometimes the learned eremite,
with golden star, or dagger bright,
referr'd to pious poesies
written in smallest crow-quill size
beneath the text; and thus the rhyme
was parcell'd out from time to time:
- als writith he of swevenis,
men han beforne they wake in bliss,
whanne that hir friendes thinke hem bound
in crimped shroude farre under grounde;
and how a litling child mote be
a saint er its nativities,
gif that the modre (god her blesse!)
kepen in solitarinesse,
and kissen devoute the holy croce.
of goddes love, and sathan's force, -
he writith; and thinges many mo:
of swiche thinges i may not show.
bot i must tellen verilie
somdel of saintè cicilie,
and chieflie what he auctorethe
of saintè markis life and dethe:
at length her constant eyelids come
upon the fervent martyrdom;
then lastly to his holy shrine,
exalt amid the tapers' shine
at venice, -","sans se lasser elle lisait la légende
de saint-marc, de son enfance à son âge mûr,
sur terre, sur mer, enchaîné par les païens,
trouvant son bonheur dans ses nombreux tourments.
quelquefois le docte ermite,
avec une astérisque d'or, ou la flèche indicatrice,
renvoyait à de pieuses poésies
ecrites avec la plus fine plume de corbeau
en dessous du texte, de telle sorte que la rime
etait éparpillée de temps en temps:
—il écrivit aussi sur l'état de perdition
dans lequel se trouvait l'homme avant de s'éveiller dans la béatitude,
quand ses amis le croyaient enseveli,
sous terre, dans un beau suaire plissé;
et comment un petit enfant pouvait être
un saint avant sa naissance,
etant donné que sa mère (que dieu la bénisse!)
se gardât dans la solitude,
et embrassât dévotement la sainte croix.
sur l'amour de dieu et la puissance de satan
il écrivit, et sur bien d'autres choses,
de douces choses que je ne peux citer.
mais je dois en vérité parler
quelque peu de sainte cécile,
et surtout de ce qu'il a écrit
sur la vie de saint marc et sur sa mort:
a la fin ses regards se fixèrent
sur le fervent martyr,
puis en dernier lieu sur sa sainte châsse
elevée au milieu des cierges étincelants
a venise,—",en_XX,fr_XX,"Elle lisait sans se lasser la légende page,
de saint Marc, de la jeunesse à l'âge,
sur terre, sur mer, en chaînes païennes,
réjouissant pour ses nombreuses douleurs.
Parfois l'ermite savant,
avec étoile dorée, ou dague brillante,
faisait allusion à de pieuses poésies
écrites en lettres minuscules d'aile de corbeau
sous le texte ; et ainsi la rime
s'écoulait peu à peu :
- Comme il écrit des swevenis,
des hommes qui ont avant de se réveiller connu le bonheur,
lorsque leurs amis pensent les lier
dans un suaire noué loin sous le sol ;
et comment un tout jeune enfant peut être
un saint avant ses propres naissances,
si la mère (que Dieu la bénisse !)
garde la solitude,
et embrasse pieusement le sainte croix.
De l'amour de Dieu, et de la force de Satan, -
il écrit ; et bien d'autres choses encore :
des choses telles que je ne peux pas montrer.
Mais je dois dire véridiquement
un peu sur sainte Cecilie,
et principalement ce qu'il authore
de la vie et de la mort de saint Marc :
finalement ses paupières constantes se ferment
sur le martyr fervent ;
ensuite finalement à son saint autel,
exalté au milieu de la lueur des chandelles
à Venise, -",2
"because i would not stop for death --
he kindly stopped for me --
the carriage held but just ourselves --
and immortality.
we slowly drove -- he knew no haste,
and i had put away
my labour, and my leisure too
for his civility --
we passed the school, where children played,
their lessons scarcely done
we passed the fields of gazing grain,
we passed the setting sun.
we paused before a house that seemed
a swelling of the ground;
the roof was scarcely visible,
the cornice but a mound.
since then 'tis centuries; but each
feels shorter than the day
i first surmised the horses' heads
were toward eternity.","parce que je n'ai pas voulu m'arrêter pour la mort
il s'est arrêté gentiment pour moi.
la voiture ne contenait que nous deux
et l'immortalité.
nous avancions doucement, il n'est pas pressé
et j'avais renoncé à
mon travail, et à mon temps libre aussi
par courtoisie envers lui.
nous sommes passés devant l'école où jouaient les enfants
leurs cours à peine finis
nous sommes passés devant les champs de blé qui regardaient
nous sommes passés devant le soleil couchant.
nous nous sommes arrêtés devant une maison qui semblait
un renflement de terre
le toit était à peine visible
la corniche n'était qu'un monticule.
depuis des siècles ont passé mais chacun
semble plus court que le jour
où j'ai supposé la première fois que la tête des chevaux
étaient tournées vers l'éternité.",en_XX,fr_XX,"Parce qu'il ne s'arrêterait pas pour la mort --
Il s'est arrêté poliment pour moi --
La voiture ne contenait que nous deux --
Et l'immortalité.
Nous avons ralenti -- il ne connaissait pas la hâte,
Et j'avais déposé
Mon travail, et ma loisir aussi
Pour sa civilité --
Nous avons passé l'école, où les enfants jouaient,
Leur leçon à peine terminée
Nous avons passé les champs de blé mûr,
Nous avons passé le soleil couchant.
Nous nous sommes arrêtés devant une maison qui semblait
Une enflure du sol;
Le toit à peine visible,
La corniche n'était qu'une butte.
Depuis lors ce sont des siècles; mais chacun
Parait plus court que le jour
Où j'ai d'abord supposé que les têtes des chevaux
Se dirigeaient vers l'éternité.",2
"two roads diverged in a yellow wood, and sorry i could not travel both and be one traveler, long i stood and looked down one as far as i could to where it bent in the undergrowth; then took the other, as just as fair, and having perhaps the better claim, because it was grassy and wanted wear; though as for that the passing there had worn them really about the same, and both that morning equally lay in leaves no step had trodden black. oh, i kept the first for another day! yet knowing how way leads on to way, i doubted if i should ever come back. i shall be telling this with a sigh somewhere ages and ages hence: two roads diverged in a wood, and i— i took the one less traveled by, and that has made all the difference.","deux routes divergeaient dans un bois jaune, et désolé de ne pas pouvoir voyager sur les deux et être un seul voyageur, je suis resté longtemps et j’ai regardé l’une d’elles aussi loin que je pouvais jusqu’à ce qu’elle se courbe dans le sous-bois ; puis j’ai pris l’autre, qui était tout aussi juste, et ayant peut-être les meilleures prétentions, parce qu’elle était herbeuse et qu’elle n’avait pas besoin d’être usée ; bien que pour cela le passage là-bas les avait usées à peu près de la même façon, et les deux, ce matin-là, reposaient également dans des feuilles qu’aucun pas n’avait foulées. oh, j’ai gardé la première pour un autre jour ! mais sachant comment le chemin mène au chemin, je me demandais si je reviendrais un jour. je raconterai cela avec un soupir quelque part dans des siècles et des siècles : deux routes divergent dans un bois, et je… j’ai pris celle qui était la moins fréquentée, et cela a fait toute la différence.",en_XX,fr_XX,"deux chemins divergeaient dans une forêt jaune, et regrettablement je ne pouvais pas parcourir les deux, étant un seul voyageur, longtemps j'ai attendu et j'ai regardé le long de l'un aussi loin que je pouvais, où il se courbait dans la végétation dense; puis j'ai choisi l'autre, aussi juste que le premier, et ayant peut-être la meilleure revendication, parce qu'il était herbeux et en besoin d'usage; bien que pour cela le passage là avait usé les deux presque de la même façon, et les deux ce matin-là étaient également recouverts de feuilles qu'aucun pas n'avait noirci. oh, j'ai gardé le premier pour un autre jour ! mais sachant comment un chemin mène à un autre, j'ai douté que je revienne jamais. je raconterai cela avec un soupir, quelque part dans des âges et des âges futurs : deux chemins divergeaient dans une forêt, et moi— moi j'ai choisi celui moins emprunté, et cela a fait toute la différence.",2
"two roads diverged in a yellow wood, and sorry i could not travel both and be one traveler, long i stood and looked down one as far as i could to where it bent in the undergrowth; then took the other, as just as fair, and having perhaps the better claim, because it was grassy and wanted wear; though as for that the passing there had worn them really about the same, and both that morning equally lay in leaves no step had trodden black. oh, i kept the first for another day! yet knowing how way leads on to way, i doubted if i should ever come back. i shall be telling this with a sigh somewhere ages and ages hence: two roads diverged in a wood, and i— i took the one less traveled by","deux routes divergeaient dans un bois jaune, et désolé de ne pas pouvoir voyager sur les deux et être un seul voyageur, je suis resté longtemps et j’ai regardé l’une d’elles aussi loin que je pouvais jusqu’à ce qu’elle se courbe dans le sous-bois ; puis j’ai pris l’autre, qui était tout aussi juste, et ayant peut-être les meilleures prétentions, parce qu’elle était herbeuse et qu’elle n’avait pas besoin d’être usée ; bien que pour cela le passage là-bas les avait usées à peu près de la même façon, et les deux, ce matin-là, reposaient également dans des feuilles qu’aucun pas n’avait foulées. oh, j’ai gardé la première pour un autre jour ! mais sachant comment le chemin mène au chemin, je me demandais si je reviendrais un jour. je raconterai cela avec un soupir quelque part dans des siècles et des siècles : deux routes divergent dans un bois, et je… j’ai pris celui qui était le moins fréquenté",en_XX,fr_XX,"deux chemins divergeaient dans une forêt dorée, et je regrettais de ne pouvoir suivre les deux étant un seul voyageur, longtemps j'ai tenu et regardé le long de l'un aussi loin que je pouvais voir où il se courbait dans la végétation; puis j'ai choisi l'autre, aussi juste et beau, et ayant peut-être la meilleure revendication, parce qu'il était herbeux et peu emprunté; bien que pour cela, le passage avait usé les deux presque de la même façon, et les deux ce matin étaient également recouverts de feuilles que pas un pas n'avait noirci. oh, j'ai gardé le premier pour un autre jour ! mais sachant comment un chemin conduit à un autre, j'ai douté que je revienne jamais. je raconterai cela avec un soupir quelque part dans les âges et les âges à venir : deux chemins divergeaient dans une forêt, et moi— moi j'ai pris celui moins emprunté",2
"dark house, by which once more i stand here in the long unlovely street, doors, where my heart was used to beat so quickly, waiting for a hand, a hand that can be clasp’d no more— behold me, for i cannot sleep, and like a guilty thing i creep at earliest morning to the door. he is not here; but far away the noise of life begins again, and ghastly thro’ the drizzling rain on the bald street breaks the blank day. o days and hours, your work is this, to hold me from my proper place, a little while from his embrace, for fuller gain of after bliss: that out of distance might ensue desire of nearness doubly sweet; and unto meeting when we meet, delight a hundredfold accrue, for every grain of sand that runs, and every span of shade that steals, and every kiss of toothèd wheels, and all the courses of the suns.","maison sombre, près de laquelle je me trouve une fois de plus. ici, dans la longue rue sans amour, les portes, où mon coeur avait l’habitude de battre si rapidement, attendant une main, une main qui ne peut plus être serrée- regardez-moi, car je ne peux pas dormir, et comme une chose coupable je me glisse au petit matin vers la porte. il n’est pas là, mais au loin le bruit de la vie recommence, et à travers la pluie qui tombe en gouttes sur la rue chauve se brise le jour vide. o jours et heures, votre travail est le suivant, me retenir de la place qui m’est due, un petit moment de son étreinte, pour un gain plus complet de la félicité après : pour que de la distance puisse naître le désir d’une proximité doublement douce ; et pour que, lorsque nous nous rencontrons, le plaisir s’accroît au centuple, pour chaque grain de sable qui coule, et pour chaque parcelle d’ombre qui s’envole, et chaque baiser des roues dentées, et toutes les courses des soleils.",en_XX,fr_XX,"maison obscure, où je me tiens encore ici, dans cette longue rue désagréable, portes, où mon cœur battait autrefois si rapidement, attendant une main, une main qui ne peut plus être serrée— regardez-moi, car je ne peux pas dormir, et comme une chose coupable je me glisse au petit matin vers la porte. lui n'est pas ici; mais loin, le bruit de la vie recommence, et sinistre à travers la pluie fine sur la rue dépelée, le jour vide se brise. ô jours et heures, votre travail est de me retenir, un petit moment de son étreinte, pour un gain ultérieur plus grand: que de la distance puisse découler un désir d'intimité deux fois plus suave; et à la rencontre quand nous nous rencontrerons, un plaisir cent fois plus grand s'ajoutera, pour chaque grain de sable qui s'écoule, et pour chaque portion d'ombre qui se faufile, et pour chaque baiser des roues dentelées, et pour tous les parcours des soleils.",2
"when the full morning came, she had devised
how she might secret to the forest hie;
how she might find the clay, so dearly prized,
and sing to it one latest lullaby;
how her short absence might be unsurmised,
while she the inmost of the dream would try.
resolv’d, she took with her an aged nurse,
and went into that dismal forest-hearse.","quand le jour fut tout à fait levé, elle avait combiné
comment elle pourrait secrètement gagner la forêt;
comment elle pourrait retrouver les restes, qu'elle estimait si chers,
et leur chanter une dernière berceuse;
comment sa courte absence pourrait passer inaperçue,
pendant qu'elle vérifierait la réalité du rêve.
bien décidée, elle prit avec elle sa vieille nourrice
et se dirigea vers cette funeste forêt mortuaire.",en_XX,fr_XX,"lorsque le matin s'est levé, elle avait conçu
comment elle pourrait s'échapper secrètement vers la forêt ;
comment elle pourrait trouver la terre, si chèrement estimée,
et chanter à cette dernière son ultime berceuse ;
comment son absence pourrait rester inaperçue,
pendant qu'elle tenterait d'atteindre l'intime du rêve.
résolue, elle emmena avec elle une vieille nourrice,
et partit vers cette sinistre forêt-nécropole.",2
