original_poem,translated_poem,src_lang,tgt_lang,translated_by_TA,topic
"zone
à la fin tu es las de ce monde ancien
bergère ô tour eiffel le troupeau des ponts bêle ce matin
tu en as assez de vivre dans l’antiquité grecque et romaine
ici même les automobiles ont l’air d’être anciennes
la religion seule est restée toute neuve la religion
est restée simple comme les hangars de port-aviation
seul en europe tu n’es pas antique ô christianisme
l’européen le plus moderne c’est vous pape pie x
et toi que les fenêtres observent la honte te retient
d’entrer dans une église et de t’y confesser ce matin
tu lis les prospectus les catalogues les affiches qui chantent tout haut
voilà la poésie ce matin et pour la prose il y a les journaux
il y a les livraisons à 25 centimes pleines d’aventures policières
portraits des grands hommes et mille titres divers
j’ai vu ce matin une jolie rue dont j’ai oublié le nom
neuve et propre du soleil elle était le clairon
les directeurs les ouvriers et les belles sténodactylographes
du lundi matin au samedi soir quatre fois par jour y passent
le matin par trois fois la sirène y gémit
une cloche rageuse y aboie vers midi
les inscriptions des enseignes et des murailles
les plaques les avis à la façon des perroquets criaillent
j’aime la grâce de cette rue industrielle
située à paris entre la rue aumont-thiéville et l’avenue des ternes
voilà la jeune rue et tu n’es encore qu’un petit enfant
ta mère ne t’habille que de bleu et de blanc
tu es très pieux et avec le plus ancien de tes camarades rené dalize
vous n’aimez rien tant que les pompes de l’église
il est neuf heures le gaz est baissé tout bleu vous sortez du dortoir en cachette
vous priez toute la nuit dans la chapelle du collège
tandis qu’éternelle et adorable profondeur améthyste
tourne à jamais la flamboyante gloire du christ
c’est le beau lys que tous nous cultivons
c’est la torche aux cheveux roux que n’éteint pas le vent
c’est le fils pâle et vermeil de la douloureuse mère
c’est l’arbre toujours touffu de toutes les prières
c’est la double potence de l’honneur et de l’éternité
c’est l’étoile à six branches
c’est dieu qui meurt le vendredi et ressuscite le dimanche
c’est le christ qui monte au ciel mieux que les aviateurs
il détient le record du monde pour la hauteur
pupille christ de l’oeil
vingtième pupille des siècles il sait y faire
et changé en oiseau ce siècle comme jésus monte dans l’air
les diables dans les abîmes lèvent la tête pour le regarder
ils disent qu’il imite simon mage en judée
ils crient s’il sait voler qu’on l’appelle voleur
les anges voltigent autour du joli voltigeur
icare énoch élie apollonius de thyane
flottent autour du premier aéroplane
ils s’écartent parfois pour laisser passer ceux qui portent la sainte-eucharistie
ces prêtres qui montent éternellement en élevant l’hostie
l’avion se pose enfin sans refermer les ailes
le ciel s’emplit alors de millions d’hirondelles
à tire d’aile viennent les corbeaux les faucons les hiboux
d’afrique arrivent les ibis les flamands les marabouts
l’oiseau roc célébré par les conteurs et les poètes
plane tenant dans les serres le crâne d’adam la première tête
l’aigle fond de l’horizon en poussant un grand cri
et d’amérique vient le petit colibri
de chine sont venus les pihis longs et souples
qui n’ont qu’une seule aile et qui volent par couples
puis voici la colombe esprit immaculé
qu’escortent l’oiseau-lyre et le paon ocellé
le phénix ce bûcher qui soi-même s’engendre
un instant voile tout de son ardente cendre
les sirènes laissant les périlleux détroits
arrivent en chantant bellement toutes trois
et tous aigle phénix et pihis de la chine
fraternisent avec la volante machine
maintenant tu marches dans paris tout seul parmi la foule
des troupeaux d’autobus mugissants près de toi roulent
l’angoisse de l’amour te serre le gosier
comme si tu ne devais jamais plus être aimé
si tu vivais dans l’ancien temps tu entrerais dans un monastère
vous avez honte quand vous vous surprenez à dire une prière
tu te moques de toi et comme le feu de l’enfer ton rire pétille
les étincelles de ton rire dorent le fond de ta vie
c’est un tableau pendu dans un sombre musée
et quelquefois tu vas la regarder de près
aujourd’hui tu marches dans paris les femmes sont ensanglantées
c’était et je voudrais ne pas m’en souvenir c’était au déclin de la beauté
entourée de flammes ferventes notre-dame m’a regardé à chartres
le sang de votre sacré-coeur m’a inondé à montmartre
je suis malade d’ouïr les paroles bienheureuses
l’amour dont je souffre est une maladie honteuse
et l’image qui te possède te fait survivre dans l’insomnie et dans l’angoisse
c’est toujours près de toi cette image qui passe
maintenant tu es au bord de la méditerranée
sous les citronniers qui sont en fleur toute l’année
avec tes amis tu te promènes en barque
l’un est nissard il y a un mentonasque et deux turbiasques
nous regardons avec effroi les poulpes des profondeurs
et parmi les algues nagent les poissons images du sauveur
tu es dans le jardin d’une auberge aux environs de prague
tu te sens tout heureux une rose est sur la table
et tu observes au lieu d’écrire ton conte en prose
la cétoine qui dort dans le coeur de la rose
épouvanté tu te vois dessiné dans les agates de saint-vit
tu étais triste à mourir le jour où tu t’y vis
tu ressembles au lazare affolé par le jour
les aiguilles de l’horloge du quartier juif vont à rebours
et tu recules aussi dans ta vie lentement
en montant au hradchin et le soir en écoutant
dans les tavernes chanter des chansons tchèques
te voici à marseille au milieu des pastèques
te voici à coblence à l’hôtel du géant
te voici à rome assis sous un néflier du japon
te voici à amsterdam avec une jeune fille que tu trouves belle et qui est laide
elle doit se marier avec un étudiant de leyde
on y loue des chambres en latin cubicula locanda
je me souviens j’y ai passé trois jours et autant à gouda
tu es à paris chez le juge d’instruction
comme un criminel on te met en état d’arrestation
tu as fait de douloureux et de joyeux voyages
avant de t’apercevoir du mensonge et de l’âge
tu as souffert de l’amour à vingt et à trente ans
j’ai vécu comme un fou et j’ai perdu mon temps
tu n’oses plus regarder tes mains et à tous moments je voudrais sangloter
sur toi sur celle que j’aime sur tout ce qui t’a épouvanté
tu regardes les yeux pleins de larmes ces pauvres émigrants
ils croient en dieu ils prient les femmes allaitent les enfants
ils emplissent de leur odeur le hall de la gare saint-lazare
ils ont foi dans leur étoile comme les rois-mages
ils espèrent gagner de l’argent dans l’argentine
et revenir dans leur pays après avoir fait fortune
une famille transporte un édredon rouge comme vous transportez votre coeur
cet édredon et nos rêves sont aussi irréels
quelques-uns de ces émigrants restent ici et se logent
rue des rosiers ou rue des écouffes dans des bouges
je les ai vu souvent le soir ils prennent l’air dans la rue
et se déplacent rarement comme les pièces aux échecs
il y a surtout des juifs leurs femmes portent perruque
elles restent assises exsangues au fond des boutiques
tu es debout devant le zinc d’un bar crapuleux
tu prends un café à deux sous parmi les malheureux
tu es la nuit dans un grand restaurant
ces femmes ne sont pas méchantes elles ont des soucis cependant
toutes même la plus laide a fait souffrir son amant
elle est la fille d’un sergent de ville de jersey
ses mains que je n’avais pas vues sont dures et gercées
j’ai une pitié immense pour les coutures de son ventre
j’humilie maintenant à une pauvre fille au rire horrible ma bouche
tu es seul le matin va venir
les laitiers font tinter leurs bidons dans les rues
la nuit s’éloigne ainsi qu’une belle métive
c’est ferdine la fausse ou léa l’attentive
et tu bois cet alcool brûlant comme ta vie
ta vie que tu bois comme une eau-de-vie
tu marches vers auteuil tu veux aller chez toi à pied
dormir parmi tes fétiches d’océanie et de guinée
ils sont des christ d’une autre forme et d’une autre croyance
ce sont les christ inférieurs des obscures espérances
adieu adieu
soleil cou coupé","te cansaste afinal desta vida anciã
pastora ó torre eiffel teu rebanho de pontos bale esta manhã
já viveste demais na antiguidade dos gregos e romanos
aqui até os automóveis tem um ar de muitos anos
só a religião permaneceu nova a religião
permaneceu simples como os hangares do campo de aviação
antigo na europa ó cristianismo só tu não és
o europeu mais moderno sois vós ó pio dez
e tu que as janelas espreitam a vergonha te escora
de entrar numa igreja e confessar-te agora
lês prospectos catálogos cartazes cantando alto seus versos
eis a poesia da manhã e para a prosa há os jornais
os folhetins baratos cheio de aventuras policiais
retratos de figurões e mil fatos diversos
a rua cujo nome esqueço e donde vim
esta manhã nova e limpa de sol era um clarim
operários patrões estenógrafas belas
de segunda a sexta passam quatro vezes por ela
toda manhã por três vezes a sirene branda
um sino raivoso ao meio-dia ladra
as inscrições das tabuletas e dos outros muros
as placas os avisos parecem araras em apuros
amo a graça desta rua industrial, no cerne
de paris entre a aumout-thièville e a avenue de ternes
esta é a rua da infância e não passas de um pivete
tua mãe só de azul e branco é que te veste
és carola e com teu colega mais antigo, ou seja,
rené dalize, amas acima de tudo as pompas da igreja
são nove horas baixaram o gás azul sais do dormitório às furtadelas
vocês rezam a noite interna na capela do colégio
enquanto eterna e adorável profundeza ametista
gira sem fim a flamejante glória de cristo
é o belo lírio que cada um de nós carrega
é a tocha de cabelos ruivos que o vento não encerra
é o filho da dolorosa mãe pálido e rubente
é a árvore sempre densa de orações constantes
é a duplo esteio de honra e eternidade
é a estrela de seis pontas
é deus que morre na sexta e domingo ressuscita
é cristo que sobe onde aviador nenhum se aventura
ele é o recordista do mundo em altura
menina cristo dos olhos
vigésima pupila dos séculos disso ele entende
e mudado em pássaro este século como jesus ascende
os diabos em seus abismos levantam os olhos para vê-los
dizem que ele imita simão o mago da judéia
gritam que se sabe decolar o que seja degolado
o belo volteador pelos anjos é volteado
ícaro enoque elias apolônio de tiana
flutuam em torno do primeiro aeroplano
afastam-se às vezes para deixar passar aqueles que a santa eucaristia transporta
esses padres que sobem eternamente elevando a hóstia
finalmente o avião pousa sem fechar as asas
e então as andorinhas enchem os céus aos milhões
num piscar de olhos vêm os corvos os mochos os falcões
da áfrica chegam os íbis os flamingos os marabus
o pássaro roca celebrado em verso e prosa passa
levantando nas garras o crânio de adão a primeira cabeça
a águia mergulha do horizonte largando um fundo grito
e da américa vem o pequeno colibri
da china vieram os longos e macios piís
que têm uma só asa e voam em pares
e eis então a pomba do espírito imaculado
escortada pelo pássaro-lira e o pavão ocelado
a fênix que se engendra no fogo que a debela
entre cinzas ardentes num sopro tudo vela
três sereias que fogem de estreitos perigosos
e ressurgem entoando seus cantos prazerosos
com a máquina voadora se estreitam por sua vez
a águia e a fênix e o pihis chinês
zanza agora em paris sozinho entre a gente
a seu redor ônibus rodam em rebanho mugente
os desgostos do amor quase deixam sem ar
como se nunca mais lhe fosse dado amar
vivesse noutros tempos teria ingressado num mosteiro
fica sem jeito ao se pegar rezando qual cordeiro
troça a si e soa a fogo do inferno seu riso-estalido
doura o fundo de sua vida esse faiscar de brasido
é um quadro pendurado num museu sombrio
que às vezes você fica olhando horas a fio
hoje anda por paris as mulheres então vermelho-sangue
era isso e eu queria esquecer que a beleza ia ficando exangue
entre chamas ardentes notre-dame contemplou-me em chartres
sangue de vosso sacré-couer inundou-me em montmartre
de ouvir o verbo bem-aventurado eu tornei-me céreo
o amor que me atormenta é um mal venéreo
a imagem que o invade o faz sobreviver insone e em agonia
está sempre por perto a imagem fugidia
você respira agora ares mediterrâneos
sob o florir perene dos limoeiros litorâneos
com os companheiros sai de barco a passeio
dois da turbie um de menton de nice o terceiro
espreitamos os polvos do fundo com pavor
e entre as algas nadam peixes símbolos do salvador
tu estás no jardim de um albergue na região de praga
tu te sentes feliz há uma rosa sobre a mesa
e observas em vez de escrever teu conto em prosa
a cetônia a dormir no coração da rosa
espantada te vês desenhada nas ágatas de saint-vit
morrias de tristeza quando ali te viste
pareces-te com lázaro pela luz do aturdido
os ponteiros do relógio do bairro judeu vão contra o sentido
e tu recuas também na vida devagar
ao subir ao hradchin e à noite ao escutar
nas tavernas cantarem tchecas melodias
eis que estás em marselha em meio a melancias
eis que estás em coblence no hotel do gigante
eis que estás em roma sentado sob uma nespeira do japão
eis que estás em amsterdã com uma mocinha a quem achas bonita e que é feia
ela deve casar-se com um estudante de leyde
lá se alugam quartos em latim cubicula locanda
eu me lembro passei três dias lá e outros tantos em gouda
tu estás em paris junto ao juiz de instrução
como a um criminoso te põem em estado de prisão
tu fizeste viagens de dores e prazeres
antes de a mentira e a idade perceberes
tu sofreste do amor aos vinte e aos trinta anos
eu vivi como um louco e perdi um tempo insano
não ousas mais olhar tuas mãos e a cada instante eu quisera soluçar
sobre ti sobre aquela que amo sobre tudo que pôde te espantar
olhas com olhos cheios de lágrimas esses emigrantes rotos
eles crêem em deus rezam as mulheres aleitam garotos
inundam com seu cheiro a estação st lazare
seguem como os reis magos sua estrela a um lugar
como a argentina onde farão fortuna e cada qual
voltará rico a seu país natal
uma família leva um edredom como por dentro vós levais
o coração mas o edredom e nossos sonhos não são reais
há imigrantes que alugam qualquer espelunca
na rua des rosiers ou des ecouffes e não partem nunca
vejo-os na rua amiúde quando à tarde tomam ar
e como peças de xadrez se movem devagar
são judeus sobretudo cujas pálidas esposas
que usam perucas ficam só no fundo de suas lojas
estás frente ao balcão de um bar imundo e ao lado
dos miseráveis bebes um café barato
à noite estás num belo restaurante
as mulheres daqui não sendo más têm não obstante
seus problemas e até a mais feia faz sofrer o amante
seu pai em jersey de onde vem é um policial
eu tenho dó das cicatrizes no seu ventre e mal
havia visto suas duras mãos cheias de calo
frente à coitada com seu riso atroz me calo
estás sozinho vem chegando a aurora
leitores fazem tinir latas rua afora
a noite feito a mais linda mulata
ferdine a falsa ou léa a afável já se afasta
o álcool que bebes é tua vida e arde igualmente
bebes tua vida feito um aguardente
caminhas rumo a auteil vais para a casa a pé
dormir entre fetiches da oceania e da guiné
que são os cristos de outras formas dos credos alheios
os cristos inferiores de enigmáticos anseios
adeus adeus
sol pescoço sem cabeça",fr_XX,pt_XX,"zona
no final tu és a última deste mundo antigo
pastora ó torre eiffel o rebanho de pontes berra esta manhã
tu estás farta de viver na antiguidade grega e romana
aqui mesmo os automóveis parecem ser antigos
a religião sozinha permanece totalmente nova a religião
permanece simples como os hangares de aeroportos marítimos
só na europa tu não és antigo ó cristianismo
o europeu mais moderno és tu papa pio x
e tu a quem as janelas observam a vergonha te retém
de entrar numa igreja e de te confessar esta manhã
lês os prospectos os catálogos os cartazes que cantam bem alto
aqui está a poesia esta manhã e para a prosa há os jornais
há as entregas a 25 cêntimos cheias de aventuras policiais
retratos dos grandes homens e mil títulos diversos
vi esta manhã uma rua bonita cujo nome esqueci
nova e limpa do sol ela era a trombeta
os diretores os operários e as belas estenodatilógrafas
da segunda-feira à noite ao sábado à tarde passam por ali quatro vezes por dia
de manhã três vezes a sirene geme lá
um sino raivoso late por volta do meio-dia
as inscrições das placas e dos muros
as placas os avisos à maneira dos papagaios gritam
gosto da graça desta rua industrial
situada em paris entre a rua aumont-thiéville e a avenida des ternes
aqui está a jovem rua e tu és apenas uma criança
tua mãe só te veste de azul e branco
és muito piedoso e com o teu mais antigo camarada rené dalize
não gostais de nada tanto como das pomposas da igreja
são nove horas o gás é baixado todo azul tu sais furtivamente do dormitório
rezas toda a noite na capela do colégio
enquanto eterna e adorável profundidade ametista
gira para sempre a flamejante glória de cristo
é o belo lírio que todos cultivamos
é a tocha de cabelos ruivos que o vento não apaga
é o filho pálido e rubro da dolorosa mãe
é a árvore sempre frondosa de todas as orações
é o duplo laço da honra e da eternidade
é a estrela de seis pontas
é deus que morre na sexta-feira e ressuscita no domingo
é cristo que sobe aos céus melhor do que os aviadores
ele detém o recorde mundial de altura
pupila cristo do olho
vigésima pupila dos séculos ele sabe como fazer
e transformado em pássaro este século como jesus sobe no ar
os diabos nos abismos erguem a cabeça para o ver
dizem que ele imita simão o mago na judeia
gritam se ele sabe voar que o chamem ladrão
os anjos voam em torno do belo acrobata
ícaro enoque elias apolônio de tiana
flutuam em torno do primeiro aeroplano
às vezes se afastam para deixar passar os que levam a sagrada eucaristia
esses padres que sobem eternamente ao elevar a hóstia
o avião finalmente pousa sem fechar as asas
o céu então se enche de milhões de andorinhas
a voar vêm os corvos os falcões as corujas
da áfrica chegam os íbis os flamingos os marabus
o pássaro roc celebrado pelos contadores de histórias e poetas
planando segurando nas garras o crânio de adão a primeira cabeça
a águia mergulha no horizonte soltando um grande grito
e da américa vem o pequeno beija-flor
da china vieram os pihis longos e flexíveis
que têm apenas uma asa e voam em pares
depois vem a pomba espírito imaculado
que são escoltados pelo pássaro-lira e o pavão ocelado
o fênix essa fogueira que se auto-engendra
por um instante esconde-se toda em sua ardente cinza
as sereias deixando os perigosos estreitos
chegam cantando belamente as três
e todas águia fênix e pihis da china
fraternizam com a máquina voadora
agora caminhas em paris sozinho entre a multidão
manadas de ônibus mugem perto de ti passam
a angústia do amor te aperta a garganta
como se nunca mais fosses amado
se vivesses nos tempos antigos entrarias num mosteiro
tens vergonha quando te apanhas a rezar
zombas de ti e como o fogo do inferno o teu riso estala
as faíscas do teu riso douram o fundo da tua vida
é um quadro pendurado num sombrio museu
e por vezes vais olhá-lo de perto
hoje caminhas por paris as mulheres estão ensanguentadas
foi e eu gostaria de não me lembrar foi no declínio da beleza
cercada de chamas fervorosas notre-dame olhou para mim em chartres
o sangue do teu sagrado coração inundou-me em montmartre
estou doente de ouvir as palavras felizes
o amor de que sofro é uma doença vergonhosa
e a imagem que te possui faz-te sobreviver no insónia e na angústia
está sempre perto de ti essa imagem que passa
agora estás à beira do mediterrâneo
sob os limoeiros que florescem todo o ano
com os teus amigos passeias de barco
um é de nice há um de menton e dois de turbie
olhamos com horror os polvos das profundezas
e entre as algas nadam os peixes imagens do salvador
estás no jardim de uma estalagem nos arredores de praga
sentes-te tão feliz uma rosa está na mesa
e observas em vez de escrever o teu conto em prosa
o besouro que dorme no coração da rosa
aterrorizado vês-te desenhado nas ágatas de são-vito
estavas triste a morrer no dia em que te viste
pareces o lázaro aterrorizado pelo dia
os ponteiros do relógio do bairro judeu andam para trás",0
"tu demandes pourquoi j’ai tant de rage au coeur
et sur un col flexible une tête indomptée;
c’est que je suis issu de la race d’antée,
je retourne les dards contre le dieu vainqueur.
oui, je suis de ceux-là qu’inspire le vengeur,
il m’a marqué le front de sa lèvre irritée,
sous la pâleur d’abel, hélas! ensanglantée,
j’ai parfois de caïn l’implacable rougeur!
jéhovah! le dernier, vaincu par ton génie,
qui, du fond des enfers, criait: “ô tyrannie!”
c’est mon aïeul bélus ou mon père dagon…
ils m’ont plongé trois fois dans les eaux du cocyte,
et, protégeant tout seul ma mère amalécyte,
je ressème à ses pieds les dents du vieux dragon.","perguntas-me por que no peito tal furor
sobre o colo dobrado, o espirito indomado;
é porque pela raça de anteu fui talhado,
eu devolvo estes dardos ao deus vencedor.
sim, sou um dos que inspiram esse vingador,
ele marcou-me a fronte com lábio irritado,
na palidez de abel, assim! ensangüentado,
eu tenho de cain o implacável rubor!
jeová! último, vencido por tua mestria,
do fundo dos infernos, grita: “ó tiramia!”
será meu avô belus ou meu pai dagão…
jogaram-me três vezes em água em cocito,
e eu só a proteger a mãe amalecita,
a seus pés planto os dentes do velho dragão.",fr_XX,pt_XX,"Tu perguntas por que tenho tanto ódio no coração
e sobre um pescoço flexível uma cabeça indomável;
é porque eu sou da linhagem de Anteu,
eu volto as lanças contra o deus vencedor.
sim, sou daqueles que o vingador inspira,
ele marcou minha testa com seus lábios irritados,
sob a palidez de Abel, ai! ensanguentada,
às vezes tenho a implacável vermelhidão de Caim!
Jeová! o último, vencido por teu gênio,
que, do fundo dos infernos, gritava: ""ó tirania!""
é meu avô Belus ou meu pai Dagon...
eles me mergulharam três vezes nas águas do Cocito,
e, protegendo sozinho minha mãe Amalécita,
eu semeio aos seus pés os dentes do velho dragão.",0
"je pense à toi, myrtho, divine enchanteresse,
au pausilippe altier, de mille feux brillant,
à ton front inondé des clartés de l’orient,
aux raisins noirs mêlés avec l’or de ta tresse.
c’est dans ta coupe aussi que j’avais bu l’ivresse,
et dans l’éclair furtif de ton oeil souriant,
quand aux pieds d’lacchus on me voyait priant,
car la muse m’a fait l’un des fils de la grèce.
je sais pourquoi là-bas le volcan s’est rouvert…
c’est qu’hier tu l’avais touché d’un pied agile,
et de cendres soudain l’horizon s’est couvert.
depuis qu’un duc normand brisa tes dieux d’argile,
toujours, sous les rameaux du laurier de virgile,
le pâle hortensia s’unit au myrte vert!","myrtho, divina, invoco a ti que encantos lanças,
ao pausílipo altivo em mil fogos luzente,
em tua fronte imersa em brilhos do oriente,
e uvas negras mescladas a esse ouro das tranças.
também em tua taça eu bebi inconsciência,
e no clarão furtivo em teu olho ridente,
enquanto aos pés de lacos vêm-me reverente,
pois a musa me fez como um filho da grécia.
sei porque lá adiante está o vulcão aberto…
foi porque ontem tocaste-o com o pé intranqüilo,
e de súbito em cinzas o horizonte inserto.
desde que um duque destruiu deuses de argila,
sempre, sob as ramagens, louros de virgílio,
uniu-se a hortênsia pálida à mirtácea verde!",fr_XX,pt_XX,"Penso em ti, Myrto, divina encantadora,
no altivo Pausílipo, brilhando em mil fogos,
na tua testa inundada pelas luzes do Oriente,
nas uvas negras misturadas com o ouro do teu cabelo.
Foi também no teu cálice que bebi a embriaguez,
e no lampejo furtivo do teu olhar sorridente,
quando aos pés de Baco me viam rezando,
pois a musa me fez um dos filhos da Grécia.
Eu sei por que lá longe o vulcão se reabriu...
foi que ontem tu o tocaste com um pé ágil,
e de cinzas subitamente o horizonte se cobriu.
Desde que um duque normando quebrou teus deuses de argila,
sempre, sob os ramos do loureiro de Virgílio,
a pálida hortênsia se une ao mirto verde!",0
