original_poem,translated_poem,src_lang,tgt_lang,translated_by_TA,topic
"vous qui ronflez au coin d’une épouse endormie,
ruminant! savez-vous ce soupir: l’insomnie?
— avez-vous vu la nuit, et le sommeil ailé,
papillon de minuit dans la nuit envolé,
sans un coup d’aile ami, vous laissant sur le seuil,
seul, dans le pot-au-noir au couvercle sans œil?
— avez-vous navigué?… la pensée est la houle
ressassant le galet: ma tête… votre boule.
— vous êtes-vous laissé voyager en ballon?
— non? — bien, c’est l’insomnie. — un grand coup de talon
là! — vous voyez cligner des chandelles étranges:
une femme, une gloire en soleil, des archanges…
et, la nuit s’éteignant dans le jour à demi,
vous vous réveillez coi, sans vous être endormi.","você que ronca ao pé da esposa adormecida,
ruminante! conhece a insónia, esse gemido?
— você já viu a noite, viu o sono alado,
mariposa à meia-noite alta esvoaçada,
sem asas amigas, ficando na soleira,
só, em um buraco negro sem ribanceira?
já navegou?… — não? — o pensamento restolha
seixos como a onda: minha cabeça… uma bóia.
— já deixou-se embarcar em um balão?
— não? — pois é a insónia. — um pontapé malsão
lá! — você verá velinhas em desarranjo:
uma mulher, uma glória de sol, arcanjos…
e quando apaga a noite no dia mal nascido,
você acorda imóvel, sem ter adormecido.",fr_XX,pt_XX,"vocês que roncam ao lado de uma esposa adormecida,
ruminação! sabem o que é esse suspiro: a insônia?
— já viram a noite, e o sono alado,
borboleta da meia-noite na noite voando,
sem um bater de asas amigo, deixando-os à soleira,
sozinhos, na escuridão com tampa sem olho?
— já navegaram?... o pensamento é a onda
rebatendo na pedra: minha cabeça... sua bola.
— permitiram-se viajar de balão?
— não? — bem, é a insônia. — um grande chute no calcanhar
aqui! — veem piscar velas estranhas:
uma mulher, uma glória em sol, arcanjos...
e, a noite se apagando no meio do dia,
vocês acordam calados, sem terem dormido.",0
"sommeil! écoute-moi: je parlerai bien bas:
sommeil — ciel-de-lit de ceux qui n’en ont pas!
toi qui planes avec l’albatros des tempêtes,
et qui t’assieds sur les casques-à-mèche honnêtes!
sommeil! — oreiller blanc des vierges assez bêtes!
et soupape à secret des vierges assez faites!
— moelleux matelas de l’échine en arête!
sac noir où les chassés s’en vont cacher leur tête!
rôdeur de boulevard extérieur! proxénète!
pays où le muet se réveille prophète!
césure du vers long, et rime du poète!
sommeil! — loup-garou gris! sommeil noir de fumée!
sommeil! — loup de velours, de dentelle embaumée!
baiser de l’inconnue, et baiser de l’aimée!
— sommeil! voleur de nuit! folle-brise pâmée!
parfum qui monte au ciel des tombes parfumées!
carrosse à cendrillon ramassant les traînées!
obscène confesseur des dévotes mort-nées!
toi qui viens, comme un chien, lécher la vieille plaie
du martyr que la mort tiraille sur sa claie!
ô sourire forcé de la crise tuée!
sommeil! brise alizée! aurorale buée!
trop-plein de l’existence, et torchon neuf qu’on passe
au café de la vie, à chaque assiette grasse!
grain d’ennui qui nous pleut de l’ennui des espaces!
chose qui court encor, sans sillage et sans traces!
pont-levis des fossés! passage des impasses!
sommeil! — caméléon tout pailleté d’étoiles!
vaisseau-fantôme errant tout seul à pleines voiles!
femme du rendez-vous, s’enveloppant d’un voile!
sommeil! — triste araignée, étends sur moi ta toile!
sommeil auréolé! féerique apothéose,
exaltant le grabat du déclassé qui pose!
patient auditeur de l’incompris qui cause!
refuge du pêcheur, de l’innocent qui n’ose!
domino ! diables-bleus! ange-gardien rose!
voix mortelle qui vibre aux immortelles ondes!
réveil des échos morts et des choses profondes,
— journal du soir: temps, siècle et revue des deux mondes!
fontaine de jouvence et borne de l’envie!
— toi qui viens assouvir la faim inassouvie!
toi qui viens délier la pauvre âme ravie,
pour la noyer d’air pur au large de la vie!
toi qui, le rideau bas, viens lâcher la ficelle
du chat, du commissaire, et de polichinelle,
du violoncelliste et de son violoncelle,
et la lyre de ceux dont la muse est pucelle!
grand dieu, maître de tout! maître de ma maîtresse
qui me trompe avec toi — l’amoureuse paresse —
ô bain de voluptés! éventail de caresse!
sommeil! honnêteté des voleurs! clair de lune
des yeux crevés! — sommeil! roulette de fortune
de tout infortuné! balayeur de rancune!
ô corde-de-pendu de la planète lourde!
accord éolien hantant l’oreille sourde!
— beau conteur à dormir debout: conte ta bourde?…
sommeil! — foyer de ceux dont morte est la falourde!
sommeil — foyer de ceux dont la falourde est morte!
passe-partout de ceux qui sont mis à la porte!
face-de-bois pour les créanciers et leur sorte!
paravent du mari contre la femme-forte!
surface des profonds! profondeur des jocrisses!
nourrice du soldat et soldat des nourrices!
paix des juges-de-paix! police des polices!
sommeil! — belle-de-nuit entr’ouvrant son calice!
larve, ver-luisant et nocturne cilice!
puits de vérité de monsieur la palisse!
soupirail d’en haut! rais de poussière impalpable,
qui viens rayer du jour la lanterne implacable!","sono! falarei baixo : escuta-me direito :
sono. – dossel-de leito dos que não têm leito!
tu que planas junto ao albatroz da tormenta,
e que em honestos gorros-de-pompom te assentas!
sono! – travesseiro branco da virgem completa!
das virgens cem por cento a válvula secreta!
– colchão macio da espinha que se espeta!
saco preto onde o acusado esconde a veneta!
vagabundo de arrabalde! proxeneta!
país no qual o mudo acorda profeta!
cesura do verso longo, e rima do poeta!
sono! – lobisomem cinza! negrura esfumaçada!
sono! – máscara das más caras, de renda embalsamada!
beijo da desconhecida, e beijo da amada!
– sono! larápio noturno! viração revirada!
perfume indo ao céu das tumbas perfumadas!
carruagem que leva a puta ao conto de fadas!
obsceno confessor das devotas abortadas!
tu que vens com a tua lambida canina
consolar o mártir que a morte tortura ainda!
sorriso forçado da crise que finda!
sono! – brisa alísia! bruma matutina!
excesso de existência, nova esponja-de-aço
no café da vida, para cada prato grasso!
grão de tédio que chove do tédio do espaço!
coisa que passou aqui, sem esteira ou traço!
sono! – passagem do impasse! ponte do lapso!
sono! – camaleão lantejoulado de estrelas!
navio-fantasma errando só a toda vela!
mulher do encontro, que ainda mal se desvela!
sono! – aranha triste, tua teia é minha cela!
sono aureolado! apoteose luxuosa
exaltando o catre do sem-classe que posa!
paciente auditor do incompreendido e sua prosa!
refúgio do pecador, da inocência medrosa!
dominó! diabos-azuis! anjo da guarda rosa!
voz fugaz ressoando com eternas ondas!
despertar de ecos mortos e coisas profundas,
– jornal da noite: temps, siècle e revue des deux mondes!
fonte da juventude e fronteira da ousadia!
– tu que atendes a fome não atendida!
tu que vens liberar a alma precavida,
imundando-a de ar puro ao largo desta vida!
tu que, cortinas fechadas, solta o cordão
que controla o gato, o delegado, e o bufão,
também o violonista e o seu violão,
a lira e as musas de boa reputação!
bom deus, deus do amor! amor de minha amante
que me engana contigo – preguiça estimulante –
ó banho de volúpias! carícia fulgurante!
sono! honestidade dos ladrões! luar
dos olhos pregados! – sono! fortuna a sortear
aos desafortunados! varredosr do pesar!
ferradurada do planeta indo para o brejo!
acorde eólico a que o ouvido surdo almeja!
– narrador que dorme em pé: conversa fiado?…
sono! – chave mestra dos que à porta são colocados!
sono! – cara-de-pau do cobrador! porta do cobrado!
lareira dos que têm o lume apagado!
lareira dos que têm apagado o lume!
– contra a esposa-forte marital tapume!
fundos dos profundos! lisura dos papalvos!
o alvo do soldado e o soldador dos alvos!
paz do juíz de paz! onde a polícia está a salvo!
sono! – dama-da-noite entreabrindo o cálice malvo!
larva, noturno cilício, vaga-lume!
respiradouro! sopro de poeira impalpável,
apagando do dia a lanterna implacável!",fr_XX,pt_XX,"sono! escuta-me: falarei bem baixinho:
sono - teto para aqueles que não o têm!
tu que planas com o albatroz das tempestades,
e te sentas sobre os capacetes com pavio honestos!
sono! - travesseiro branco das virgens bastante tolas!
e válvula secreta das virgens bastante feitas!
- colchão macio da espinha dorsal em aresta!
saco negro onde os perseguidos vão esconder a cabeça!
vagabundo do boulevard exterior! cafetão!
país onde o mudo acorda profeta!
cesura do verso longo, e rima do poeta!
sono! - lobisomem cinzento! sono negro de fumaça!
sono! - lobo de veludo, de renda perfumada!
beijo da desconhecida, e beijo da amada!
- sono! ladrão da noite! brisa louca extasiada!
perfume que sobe ao céu das sepulturas perfumadas!
carruagem de Cinderela recolhendo as trilhas!
confessor obsceno das devotas mortas!
tu que vens, como um cão, lamber a velha ferida
do mártir que a morte tortura em sua maca!
ó sorriso forçado da crise morta!
sono! brisa alísia! orvalho auroral!
excesso da existência, e pano novo que se passa
no café da vida, a cada prato farto!
grão de tédio que nos chove do tédio dos espaços!
coisa que corre ainda, sem rasto e sem vestígios!
ponte-levis dos fossos! passagem dos becos sem saída!
sono! - camaleão todo salpicado de estrelas!
navio fantasma errante sozinho a todo pano!
mulher do encontro, envolvendo-se num véu!
sono! - triste aranha, estende sobre mim tua teia!
sono aureolado! apoteose mágica,
exaltando a cama do desclassificado que posa!
ouvinte paciente do incompreendido que fala!
refúgio do pescador, do inocente que não ousa!
dominó! diabos azuis! anjo guardião rosado!
voz mortal que vibra nas ondas imortais!
despertar dos ecos mortos e das coisas profundas,
- jornal da noite: tempo, século e revista dos dois mundos!
fonte da juventude e limite da inveja!
- tu que vens saciar a fome insaciável!
tu que vens libertar a pobre alma extasiada,
para afogá-la em ar puro ao largo da vida!
tu que, com a cortina baixa, vens soltar o fio
do gato, do comissário, e de Polichinelo,
do violoncelista e de seu violoncelo,
e da lira daqueles cuja musa é virgem!
grande deus, mestre de tudo! mestre de minha amante
que me trai contigo - a preguiça amorosa -
ó banho de voluptuosidades! leque de carícias!
sono! honestidade dos ladrões! luz da lua
dos olhos cegos! - sono! roleta da fortuna
de todo infortunado! varredor de ressentimento!
ó corda de enforcado do planeta pesado!
acorde eólico assombrando o ouvido surdo!
- belo contador de histórias para dormir de pé: conta tua tolice?...
sono! - lar de quem a falourde está morta!
sono - lar de quem a falourde está morta!
passe-partout para aqueles que são postos para fora!
cara de pau para os credores e sua espécie!
escudo do marido contra a mulher forte!
superfície dos profundos! profundidade dos bobos!
ama do soldado e soldado das amas!
paz dos juízes de paz! polícia das polícias!
sono! - dama da noite abrindo seu cálice!
larva, vaga-lume e cilício noturno!
poço de verdade do senhor de La Palice!
janela de cima! raios de poeira impalpável,
que vêm riscar a lanterna implacável do dia!",0
"sommeil — écoute-moi, je parlerai bien bas:
crépuscule flottant de l’être ou n’être pas!…
sombre lucidité! clair-obscur! souvenir
de l’inouï! marée! horizon! avenir!
conte des mille-et-une-nuits doux à ouïr!
lampiste d’aladin qui sais nous éblouir!
eunuque noir! muet blanc! derviche! djinn! fakir!
conte de fée où le roi se laisse assoupir!
forêt-vierge où peau-d’âne en pleurs va s’accroupir!
garde-manger où l’ogre encor va s’assouvir!
tourelle où ma sœur anne allait voir rien venir!
tour où dame malbrouck voyait page courir…
où femme barbe-bleue oyait l’heure mourir!…
où belle au-bois-dormant dormait dans un soupir!
cuirasse du petit! camisole du fort!
lampion des éteints! éteignoir du remord!
conscience du juste, et du pochard qui dort!
contre-poids des poids faux de l’épicier de sort!
portrait enluminé de la livide mort!
grand fleuve où cupidon va retremper ses dards
sommeil! — corne de diane, et corne du cornard!
couveur de magistrats et couveur de lézards!
marmite d’arlequin! — bout de cuir, lard, homard —
sommeil! — noce de ceux qui sont dans les beaux-arts.
boulet des forcenés, liberté des captifs!
sabbat du somnambule et relais des poussifs! —
somme! actif du passif et passif de l’actif!
pavillon de la folle et folle du poncif!…
— ô viens changer de patte au cormoran pensif!
ô brun amant de l’ombre! amant honteux du jour!
bal de nuit où psyché veut démasquer l’amour!
grosse nudité du chanoine en jupon court!
panier-à-salade idéal! banal four!
omnibus où, dans l’orbe, on fait pour rien un tour!
sommeil! drame hagard! sommeil, molle langueur!
bouche d’or du silence et bâillon du blagueur!
berceuse des vaincus! perchoir des coqs vainqueurs!
alinéa du livre où dorment les longueurs!
du jeune homme rêveur singulier féminin!
de la femme rêvant pluriel masculin!
sommeil! — râtelier du pégase fringant!
sommeil! — petite pluie abattant l’ouragan!
sommeil! — dédale vague où vient le revenant!
sommeil! — long corridor où plangore le vent!
néant du fainéant! lazzarone infini!
aurore boréale au sein du jour terni!
sommeil! — autant de pris sur notre éternité!
tour du cadran à blanc! clou du mont-de-piété!
héritage en espagne à tout déshérité!
coup de rapière dans l’eau du fleuve léthé!
génie au nimbe d’or des grands hallucinés
nid des petits hiboux! aile des déplumés!
immense vache à lait dont nous sommes les veaux!
arche où le hère et le boa changent de peaux!
arc-en-ciel miroitant! faux du vrai! vrai du faux!
ivresse que la brute appelle le repos!
sorcière de bohême à sayon d’oripeaux!
tityre sous l’ombrage essayant des pipeaux!
temps qui porte un chibouck à la place de faux!
parque qui met un peu d’huile à ses ciseaux!
parque qui met un peu de chanvre à ses fuseaux!
chat qui joue avec le peloton d’atropos!
sommeil! — manne de grâce au cœur disgracié!
. . . . . . . . . . . . . . . . . . . . . . . . . . . . . . . . . . .
le sommeil s’éveillant me dit: tu m’as scié.","sono – falarei baixo: escuta o que vou dizer:
crepúsculo vago do ser ou não ser! …
obscura lucidez! claro-escuro! ressurgir
do inaudito! maré! horizonte! porvir!
conte das mil e uma noites bom de se ouvir!
lampadeiro de aladim que sabe seduzir!
eunuco negro! mudo branco! djim! faquir!
conto de fadas onde o rei se deixa sucumbir!
mata para onde pele de asno pode fugir!
guarda-comida onde pode o ogre se servir!
torre onde a bela adormecida vai dormir!
onde minha irmã anne ia ver ninguém a vir!
de onde dama malbrouck via a pajem sair…
e a esposa barba-azul via a hora se extinguir!
couraça do pequeno! camisa do forte!
mordaça do remorso! do desnorteado o norte!
consciência do justo, e do bebum desmaiado!
contrapeso dos pesos viciados da sorte!
retrato colorido da lívida morte!
rio largo em que cupido retempera os dardos
sono! – corneta de diana e corno do corneado!
cobertura do lagarto, e do magistrado!
angu de arlequim: batata, bife, tomate –
sono! – núpcias dos que estão nas belas artes.
prisão do demente, liberdade do cativo!
farra do sonâmbulo, folga do compusivo! –
soma! ativo do passivo e passivos do ativo!
parágrafo que aloja as digressões do livro!
– ó vem trocar a pata do alcatraz pensativo!
louco amante da sombra! manso amante do alvor!
baile em que psique quer desmascarar o amor!
gorda nudez em saia curta do prior!
tintureiro ideal! imenso furta-cor!
omnibus, na orbe, passeando o visitor!
sono! drama truculento! mole langor!
boca de ouro do mudo! mudez do gozador!
cantiga do vencido! pódio do vencedor!
do moço sonhador singular feminino!
da mulher sonhando plural masculino!
sono! – cocho cheio do pégaso irritado!
sono! – dédalo vago onde pena a alma penada!
sono! – corredor onde o vento plangora uma toada!
sono! – bonança logo após a tempestade!
ócio do ocioso! lazzarone sem idade!
aurora boreal num dia sem claridade!
sono! – tantos extratos de nossa eternidade!
insônia de pedra! monte-da-piedade!
herança na espanha a todo deserdado!
rio letes fazendo água ao ser desafiado!
gênio no nimbo dourado dos alucinados!
ninho do filhote mocho! asa dos depenados!
vaca leiteira com a teta em nossas mãos!
arca onde se troca a sucuri, e o poltrão!
arco-íris cintilante! regra da exceção!
gozo que a ralé confunde com hibernação!
bruxa da boêmia com saio verdemar!
tityre na sombra com flautas a testar!
tempo sem a foice: um chibuque em seu lugar!
sono! – parca com a tesoura a azeitar!
sono! – parca com os fusos para untar!
gato com o novelo de atropos a brincar!
sono! – maná de graça de quem se desgraçou!
. . . . . . . . . . . . . . . . . . . . . . . . . . . . . . . . . . .
eis que o sono acorda e diz: você me cansou",fr_XX,pt_XX,"sono — escuta-me, falarei bem baixinho:
crepúsculo flutuante do ser ou não ser!...
lúcida escuridão! claro-escuro! lembrança
do inaudível! maré! horizonte! futuro!
conto das mil e uma noites doce de ouvir!
iluminador de Aladim que sabe nos deslumbrar!
eunuco negro! mudo branco! dervixe! gênio! fakir!
conto de fadas onde o rei deixa-se adormecer!
floresta virgem onde Pele de Asno em lágrimas vai se agachar!
despensa onde o ogro ainda vai se saciar!
torrezinha onde minha irmã Ana ia ver o nada vir!
torre onde a dama Malbrouck via o pajem correr...
onde a mulher barba-azul via a hora morrer!...
onde a Bela Adormecida dormia em um suspiro!
couraça do pequeno! camisa-de-força do forte!
candelabro dos apagados! apagador do remorso!
consciência do justo, e do bêbado que dorme!
contrapeso dos pesos falsos do mercador de feitiços!
retrato iluminado da morte lívida!
grande rio onde Cupido vai mergulhar suas setas
sono! — corneta de Diana, e corneta do covarde!
chocador de magistrados e chocador de lagartixas!
panela de arlequim! — pedaço de couro, toucinho, lagosta —
sono! — casamento daqueles que estão nas belas-artes.
bala dos enlouquecidos, liberdade dos cativos!
sabbat do sonâmbulo e refúgio dos ofegantes! —
sono! ativo do passivo e passivo do ativo!
abrigo da louca e louca do clichê!...
— oh vem trocar de pata o corvo pensativo!
oh amante moreno da sombra! amante envergonhado do dia!
baile noturno onde Psiquê quer desmascarar o amor!
grosseira nudez do cônego em saia curta!
carrinho de presos ideal! cotidiano forno!
ônibus onde, na esfera, se dá uma volta à toa!
sono! drama alucinante! sono, suave languidez!
boca de ouro do silêncio e mordaça do brincalhão!
canção de ninar dos vencidos! poleiro dos galos vencedores!
alínea do livro onde dormem as prolongações!
do jovem sonhador singular feminino!
da mulher sonhando plural masculino!
sono! — cocheiro do pégaso garboso!
sono! — chuvinha derrubando o furacão!
sono! — labirinto vago onde vem o defunto!
sono! — longo corredor onde lamenta o vento!
nada do preguiçoso! preguiçoso infinito!
aurora boreal no seio do dia turvo!
sono! — tanto de tomado de nossa eternidade!
volta do ponteiro em branco! prego do monte de piedade!
herança na Espanha para todo deserdado!
golpe de espada na água do rio Lete!
gênio com aureola de ouro dos grandes alucinados
ninho dos pequenos corujas! asa dos despenados!
imensa vaca leiteira de que somos os bezerros!
arca onde o miserável e a jiboia trocam de peles!
arco-íris cintilante! falso do verdadeiro! verdadeiro do falso!
embriaguez que a besta chama de repouso!
bruxa boêmia em sayão de farrapos!
tiriteiro à sombra tentando tocar flautas!
tempo que leva um narguilé no lugar da foice!
parca que põe um pouco de óleo em suas tesouras!
parca que põe um pouco de cânhamo em seus fusos!
gato que brinca com o novelo de Átropos!
sono! — maná de graça para o coração desgraçado!
. . . . . . . . . . . . . . . . . . . . . . . . . . . . . . . . . . .
o sono despertando me diz: tu me decepcionaste.",0
"toi qui souffles dessus une épouse enrayée,
ruminant! dilatant ta pupille éraillée;
sais-tu?… ne sais-tu pas ce soupir — le réveil! —
qui baille au ciel, parmi les crins d’or du soleil
et les crins fous de ta déesse ardente et blonde?…
— non?… — sais-tu le réveil du philosophe immonde
— le porc — rognonnant sa prière du matin;
ou le réveil, extrait-d’âge de la catin?…
as-tu jamais sonné le réveil de la meute;
as-tu jamais senti l’éveil sourd de l’émeute,
ou le réveil de plomb du malade fini?…
as-tu vu s’étirer l’œil des lazzaroni?…
sais-tu?… ne sais-tu pas le chant de l’alouette?
— non — gluants sont tes cils, pâteuse est ta luette,
ruminant! tu n’as pas l’insomnie, éveillé;
tu n’as pas le sommeil, ô sac ensommeillé!","tu que ofegas sobre a esposa paralisada,
dilatando tua pupila avermelhada,
ruminante! conheces – ou não? – o despertar! –
que boceja entre as crinas d`ouro do astro solar
e entre as crinas louras da deusa fremebunda?…
– conheces o despertar do filósofo imundo
– o porco – cedo grunhindo uma prece bruta?
e o despertar, certidão de idade da puta?…
– não?… – nunca soaste o despertar da matilha?…
nunca sentiste o motim que se engatilha?…
ou o despertar de chumbo do moribundo?…
viste se espreguiçar o olhar do vagabundo?…
ruminante! ouviste o canto da cotovia?
– não – teus cílios grudam, tua úvula atrofa!
se acordas, da insônia não tens conhecimento;
quando tens sono, dormes, ó saco sonolento!",fr_XX,pt_XX,"tu que sopras sobre uma esposa encravada,
ruminando! dilatando tua pupila arranhada;
sabes?... não sabes desse suspiro — o despertar! —
que boceja no céu, entre as crinas douradas do sol
e as crinas loucas de tua deusa ardente e loira?...
— não?... — sabes do despertar do filósofo imundo
— o porco — resmungando sua prece da manhã;
ou o despertar, envelhecido da prostituta?...
já tocou a alvorada da matilha;
já sentiu o despertar surdo da revolta,
ou o despertar pesado do doente acabado?...
já viu o olhar preguiçoso dos desocupados?...
sabes?... não sabes do canto da cotovia?
— não — pegajosas são tuas pálpebras, pastosa é tua garganta,
ruminando! não tens a insônia, acordado;
não tens o sono, ó saco sonolento!",0
"etna — j’ai monté le vésuve…
le vésuve a beaucoup baissé:
j’étais plus chaud que son effluve,
plus que sa crête hérissé…
— toi que l’on compare à la femme…
— pourquoi? — pour ton âge? ou ton âme
de caillou cuit?… — ça fait rêver…
— et tu t’en fais rire à crever! —
— tu ris jaune et tousses: sans doute,
crachant un vieil amour malsain;
la lave coule sous la croûte
de ton vieux cancer au sein.
— couchons ensemble, camarade!
là — mon flanc sur ton flanc malade:
nous sommes frères, par vénus,
volcan!…
un peu moins… un peu plus…","etna — eu subi no vesúvio…
o vesúvio se rebaixava:
eu ardia mais que seu eflúvio;
mais que sua crista, eriçava…
— quando te comparam à fêmea…
— é pela idade? — pela alma gêmea
do calhau cozido?… — ah, sonhar…
— e tu ris disso até rachar! —
— ris amarelo e escarras, quando
tosses, um velho amor malsão;
o velho câncer vai purulando
a lava em teu seio de vulcão.
— durmamos juntos, camarada!
— nossa carne doente imanada:
nós somos irmãos, por vênus,
vulcão!…
pouco mais… pouco menos…",fr_XX,pt_XX,"etna - subi o Vesúvio...
o Vesúvio diminuiu muito:
eu era mais quente que seu cheiro,
mais que sua crista eriçada...
- você que é comparada à mulher...
- por quê? - pela sua idade? ou sua alma
de pedra cozida?... - isso faz sonhar...
- e você ri até morrer! -
- você ri amarelo e tosse, sem dúvida,
cuspindo um velho amor doentio;
a lava flui sob a crosta
do seu velho câncer no seio.
- deitemos juntos, camarada!
aqui - meu flanco sobre o teu flanco doente:
nós somos irmãos, pela Vênus,
vulcão!...
um pouco menos... um pouco mais...",0
