original_poem,translated_poem,src_lang,tgt_lang,translated_by_TA,topic
"frères humains, qui après nous vivez,
n’ayez les coeurs contre nous endurcis,
car, si pitié de nous pauvres avez,
dieu en aura plus tôt de vous mercis.
vous nous voyez ci attachés, cinq, six:
quant à la chair, que trop avons nourrie,
elle est piéça dévorée et pourrie,
et nous, les os, devenons cendre et poudre.
de notre mal personne ne s’en rie;
mais priez dieu que tous nous veuille absoudre!
se frères vous clamons, pas n’en devez
avoir dédain, quoique fûmes occis
par justice. toutefois, vous savez
que tous hommes n’ont pas bon sens rassis.
excusez-nous, puisque sommes transis,
envers le fils de la vierge marie,
que sa grâce ne soit pour nous tarie,
nous préservant de l’infernale foudre.
nous sommes morts, âme ne nous harie,
mais priez dieu que tous nous veuille absoudre!
la pluie nous a débués et lavés,
et le soleil desséchés et noircis.
pies, corbeaux nous ont les yeux cavés,
et arraché la barbe et les sourcils.
jamais nul temps nous ne sommes assis
puis çà, puis là, comme le vent varie,
a son plaisir sans cesser nous charrie,
plus becquetés d’oiseaux que dés à coudre.
ne soyez donc de notre confrérie;
mais priez dieu que tous nous veuille absoudre!
prince jésus, qui sur tous a maistrie,
garde qu’enfer n’ait de nous seigneurie:
a lui n’ayons que faire ne que soudre.
hommes, ici n’a point de moquerie;
mais priez dieu que tous nous veuille absoudre!","irmãos humanos que ainda viveis,
não sejais corações endurecidos;
tendo pena de nós, pobres, talvez
de deus sereis mais cedo merecidos.
vede os pescoços, cinco ou seis, torcidos;
a carne, que sorveu tanto alimento,
está hoje devorada e em fermento,
e ossos, a cinza e pó vamos volver.
ninguém ria de tal padecimento:
clamai a deus a nos absolver.
se de irmão vos chamarmos, não deveis
tratar-nos com desdém por termos sido
justiçados. contudo, vós sabeis:
nem por todo o senso é conhecido,
desculpai-nos, por sermos falecidos,
junto ao filho da virgem, seu assento.
conserve-nos da graça o acolhimento:
livre-no de no inferno dissolver.
eis-nos mortos, ninguém nos dê tormento:
clamai a deus a nos absolver.
a chuva nos lavou, limpou de vez,
e o sol secou e pôs enegrecidos;
corvos cravam os olhos de avidez,
barba e fios puxando enfurecidos.
não nos firmamos mais, enrijecidos,
balançando de um lado a outro, ao vento,
sempre ao seu bel-prazer em movimento,
mais furos que em dedal, a revolver.
evitai da irmandade o envolvimento:
clamai a deus a nos absolver.
príncipe jesus, guiai-nos o tento,
cuidai que o inferno não esteja atento:
lá, não há o que ver ou resolver.
homens, do riso aqui há banimento:
clamai a deus a nos absolver.",fr_XX,pt_XX,"Irmãos humanos, que depois de nós viveis,
não endureçais os corações contra nós,
pois se tendes piedade de nós pobres,
Deus vos terá mais cedo em misericórdia.
Vede-nos aqui amarrados, cinco, seis:
quanto à carne, que demasiado alimentamos,
há muito tempo está devorada e apodrecida,
e nós, os ossos, tornamo-nos cinza e pó.
De nosso mal ninguém zombe;
mas rogai a Deus que a todos nos queira absolver!
Se vos clamamos irmãos, não deveis
ter desprezo, embora fôssemos mortos
pela justiça. No entanto, sabeis
que nem todos os homens têm bom senso sólido.
Desculpai-nos, pois estamos mortos,
em relação ao filho da virgem Maria,
que sua graça não se esgote para nós,
nos preservando do infernal trovão.
Estamos mortos, a alma não nos atormente,
mas rogai a Deus que a todos nos queira absolver!
A chuva nos encharcou e lavou,
e o sol nos secou e enegreceu.
Pegas, corvos nos cavaram os olhos,
e arrancaram a barba e as sobrancelhas.
Nunca em paz estamos sentados
de um lado para o outro, como o vento varia,
a seu bel-prazer sem cessar nos carrega,
mais bicados por pássaros do que dados de costura.
Não façais parte de nossa confraria;
mas rogai a Deus que a todos nos queira absolver!
Príncipe Jesus, que sobre todos tem domínio,
guarda que o inferno não tenha senhorio sobre nós:
nada temos a ver ou a pagar a ele.
Aqui, homens, não há zombaria;
mas rogai a Deus que a todos nos queira absolver!",0
"ayez pitié, ayez pitié de moi,
a tout le moins, s’il vous plaît, mes amis!
en fosse gis, non pas sous houx ne mai,
en cet exil ouquel je suis transmis
par fortune, comme dieu l’a permis.
filles aimant jeunes gens et nouveaux,
danseurs, sauteurs, faisant les pieds de veaux,
vifs comme dards, aigus comme aiguillon,
gousiers tintant clair comme cascaveaux,
le laisserez là, le pauvre villon ?
chantres chantant à plaisance, sans loi,
galants riant, plaisants en faits et dits,
coureux allant francs de faux or, d’aloi,
gens d’esperit, un petit étourdis,
trop demourez, car il meurt entandis.
faiseurs de lais, de motets et rondeaux,
quand mort sera, vous lui ferez chaudeaux!
où gît, il n’entre éclair ne tourbillon:
de murs épais on lui a fait bandeaux.
le laisserez là, le pauvre villon?
venez le voir en ce piteux arroi,
nobles hommes, francs de quart et de dix,
qui ne tenez d’empereur ne de roi,
mais seulement de dieu de paradis;
jeûner lui faut dimanches et merdis,
dont les dents a plus longues que râteaux;
après pain sec, non pas après gâteaux,
en ses boyaux verse eau à gros bouillon;
bas en terre, table n’a ne tréteaux.
le laisserez là, le pauvre villon?
princes nommés, anciens, jouvenceaux,
lmpétrez-moi grâces et royaux sceaux,
et me montez en quelque corbillon.
ainsi le font, l’un à l’autre, pourceaux,
car, où l’un brait, ils fuient à monceaux.
le laisserez là, le pauvre villon?","tende piedade, ó tende piedade
ao menos vós, amigos mais sentidos!
no fosso estou, e sem amenidades
cá neste exílio ao qual fui remetido
pela sorte, e por deus foi permitido.
moças, amantes, jovens e donzéis,
saltimbancos girando sobre os pés,
gargantas-guizos como cascavéis,
fica o pobre villon sob os grilhões?
cantores livres, soltos, à vontade,
galantes palradores desmedidos,
biltres sem ouro falso ou de verdade,
seres de tanto espírito aturdido,
tardais muito, porque morre estendido!
com rondós e motetos, menestréis,
dai-lhe, ao morrer, um bom caldo, ao invés!
onde está, não vão raios, turbilhões:
muros espessos são vendas cruéis.
fica o pobre villon sob os grilhões?
vinde vê-lo em atroz calamidade,
nobres homens, sem tributos retidos,
que sois livres de império e majestade,
e só a deus no céu sois prometidos.
terça e domingo são jejuns batidos
e tem os dentes mais longos que ancinhos;
após pão seco – e nada de pastéis –
corre nas tripas água aos borbotões.
jaz no solo, sem mesa e sem tripés:
fica o pobre villon sob os grilhões?
príncipes raros, velhos ou donzéis,
dai-me o selo real sobre os papéis
e tirai-me em canastra dos porões;
até os porcos juntos são fiéis:
se um ronca, seguem outros em tropéis.
fica o pobre villon sob os grilhões?",fr_XX,pt_XX,"Tende piedade, tende piedade de mim,
ao menos, por favor, meus amigos!
No fosso estou, não sob azevinho nem espinheiro,
neste exílio ao qual fui enviado
pela fortuna, como Deus permitiu.
Moças amando jovens e novos,
dançarinos, saltitantes, fazendo piruetas,
rápidos como flechas, afiados como esporas,
gargantas soando claras como sinos,
deixarão lá, o pobre Villon?
Cantores cantando com prazer, sem lei,
galantes rindo, agradáveis em atos e palavras,
andantes correndo livres de falsas moedas, adulteradas,
gente espirituosa, um pouco distraída,
muito demorados, pois ele morre entoando.
Criadores de lais, motetes e rondeaux,
quando ele morrer, vocês farão homenagens a ele!
Onde ele repousa, não entra luz nem turbilhão:
com muros espessos fizeram-lhe faixas.
Deixarão lá, o pobre Villon?
Venham vê-lo nesse triste estado,
homens nobres, francos das apostas de dez e cem,
que não são súditos de imperador ou rei,
mas somente de Deus do paraíso;
ele deve jejuar aos domingos e quartas-feiras,
com dentes mais longos do que ancinhos;
após pão seco, não após bolos,
em seus intestinos despeja água fervente;
baixo na terra, não tem mesa nem bancos.
Deixarão lá, o pobre Villon?
Príncipes renomados, velhos e jovens,
concedam-me graças e selos reais,
e me coloquem em alguma carroça.
Assim fazem, um ao outro, como porcos,
pois, onde um grunhe, eles fogem em montões.
Deixarão lá, o pobre Villon?",0
"je meurs de seuf auprès de la fontaine,
chaud comme feu, et tremble dent à dent;
en mon pays suis en terre lointaine;
lez un brasier frissonne tout ardent;
nu comme un ver, vêtu en président,
je ris en pleurs et attends sans espoir;
confort reprends en triste désespoir;
je m’éjouis et n’ai plaisir aucun;
puissant je suis sans force et sans pouvoir,
bien recueilli, débouté de chacun.
rien ne m’est sûr que la chose incertaine;
obscur, fors ce qui est tout évident;
doute ne fais, fors en chose certaine;
science tiens à soudain accident;
je gagne tout et demeure perdant;
au point du jour dis: “dieu vous doint bon soir!”
gisant envers, j’ai grand paour de choir ;
j’ai bien de quoi et si n’en ai pas un;
echoite attends et d’homme ne suis hoir,
bien recueilli, débouté de chacun.
de rien n’ai soin, si mets toute ma peine
d’acquérir biens et n’y suis prétendant;
qui mieux me dit, c’est cil qui plus m’ataine,
et qui plus vrai, lors plus me va bourdant;
mon ami est, qui me fait entendant
d’un cygne blanc que c’est un corbeau noir;
et qui me nuit, crois qu’il m’aide à pourvoir;
bourde, verté, aujourd’hui m’est tout un;
je retiens tout, rien ne sait concevoir,
bien recueilli, débouté de chacun.
prince clément, or vous plaise savoir
que j’entends mout et n’ai sens ne savoir:
partial suis, à toutes lois commun.
que sais-je plus ? quoi? les gages ravoir,
bien recueilli, débouté de chacun.","morro de sede quase ao pé da fonte,
quente qual fogo, mas batendo os dentes;
em meu país vivo além do horizonte;
junto a um braseiro tremo e fico ardente;
nu como um verme. o traje: um presidente;
rio no pranto e espero sem esperança;
conforto acho na desesperança,
e alegro-me sem ter prazer algum;
tenho o poder sem força ou segurança;
e sou bem vindo a todos e a nenhum.
só me é certo algo com que eu não conte;
nada é obscuro, exceto o que é evidente;
e sem dúvidas, fora as que defronte,
tomo a ciência por mero acidente;
conquisto tudo e fico dependente
digo “boa noite” se a aurora avança;
deito-me sem controle em confiança;
tenho alguns bens, mas sem vintém algum;
sou um herdeiro mas serm ter herança,
e sou bem-vindo a todos e a nenhum
descuido-me de tudo e suo a fronte
para ter bens, sem ter um pretendente;
com quem mais me afague, me confronte,
quem mais me é veraz é quem mais mente;
é meu amigo que diz procedente
de um cisne alvo e um corvo a semelhança;
em quem me nega enxergo uma aliança;
a patranha e a verdade acho comum;
recordo tudo sem a menor lembrança
e sou bem-vindo a todos e a nenhum.
príncipe brando: se isso não vos cansa,
de tudo eu sei, e a mente não alcança;
sou faccioso e sigo a lei comum.
que faço? o quê? dos meus bens a cobrança,
e sou bem-vindo a todos e a nenhum.",fr_XX,pt_XX,"Eu morro de suspiro perto da fonte,
quente como fogo, e tremo dente a dente;
em minha terra estou em terra distante;
perto de uma fogueira tremo todo ardente;
nu como uma minhoca, vestido como presidente,
rio em lágrimas e espero sem esperança;
conforto recupero em triste desespero;
eu me alegro e não tenho prazer algum;
poderoso sou sem força e sem poder,
bem recebido, rejeitado por todos.
nada me é certo senão a coisa incerta;
escuro, exceto o que é todo evidente;
não duvido, exceto em coisa certa;
ciência depende de um acidente repentino;
eu ganho tudo e permaneço perdendo;
ao amanhecer digo: ""Deus vos dê boa noite!"";
deitado de lado, tenho grande medo de cair;
tenho muito e ao mesmo tempo não tenho nada;
espero o eco e não sou herdeiro de ninguém,
bem recebido, rejeitado por todos.
não me importo com nada, mas coloco todo o meu esforço
em adquirir bens e não sou pretendente;
quem melhor me diz, é aquele que mais me engana,
e quem é mais verdadeiro, então mais me engana;
meu amigo é aquele que me faz entender
que um cisne branco é um corvo preto;
e quem me prejudica, acredito que me ajuda a providenciar;
mentira, verdade, hoje é tudo a mesma coisa;
eu guardo tudo, nada consigo conceber,
bem recebido, rejeitado por todos.
príncipe clemente, agora por favor saiba
que eu entendo muito e não tenho nem sentido nem conhecimento:
sou parcial, em todas as leis comum.
o que mais sei? o quê? recuperar os salários,
bem recebido, rejeitado por todos.",0
"en rïagar, en alcenic rochier,
en orpiment, en salpestre et chaulx vive,
en plomb boullant pour mieulx les esmorcher,
en suye et poix destrempee de lessive
faicte d’estrons et de pissat de juisve,
en lavailles de jambes a meseaux,
en raclure de piez et vieulx houzeaux,
en sang d’aspic et drocques venimeuses,
en fïel de loups, de regnars et blereaux,
soient frictes ces langues ennuyeuses!
en servelle de chat qui hait peschier,
noir et si viel qu’il n’ait dent en gencyve,
d’un viel matin, qui vault bien aussi chier,
tout enragié, en sa bave et sallive,
en l’escume d’une mulle poussive,
detrenchée menue a bons cyseaulx,
en eaue ou ratz plungent groins et museaux,
regnes, crappaulx et bestes dangereuses,
serpens, laissars et telz nobles oiseaux,
soient frictes ces langues ennuyeuses!
en sublimé, dangereux a toucher
et ou nombril d’une couleuvre vive,
en sang c’on voit es poillectes sechier
sur ces babriers, quant plaine lune arrive,
dont l’un est noir, l’autre plus vert que cyve,
en chancre et fix et en ces ors cuveaulx
ou nourrisses essangent leurs drappeaux,
en petits baings de fïlles amoureuses
— qui ne m’entant n’ay suivy les bordeaux —
soient frictes ces langues ennuyeuses!
prince, passez tous ces frians morceaux,
s’estamine, sacz n’avez ne bluteaux,
parmy le fons d’unes brayes breneuses,
mais paravant en estronc de pourceaux
soient frictes ces langues ennuyeuses!","em rosalgar, em pedra arsenical,
em enxofre, em salitre e em cal viva,
em chumbo que a ferver rói mais brutal,
em sebo e pez junto a lixívia activa
de mijo de judia cagativa,
lavaduras de pernas de gafado,
raspaduras de pés, botim furado,
sangue de cobra e drogas venenosas,
fel de texugo, lobo e zorra dado,
sejam fritas as línguas mais maldosas.
em miolos de gato a pescar mal,
preto, velho e sem dentes na gengiva,
de cão velho que valha por igual,
raivoso pela baba e a saliva,
no espumar da mula ofegativa
que rasoiras bem fino têm talhado,
n’água onde os ratos hão afocinhado,
rãs e sapos e bichas perigosas,
lagarto e serpe e aves de tal costado,
sejam fritas as línguas mais maldosas.
em sublimado ao toque só fatal,
e no umbigo de uma cobra viva,
em sangue seco em malga barbeiral
à lua cheia, vista que é nociva,
que ora é negro, ora verde mais que oliva,
em tumor, pús, e tanque emporcalhado
onde dessanguam amas sujo atado,
em lavagens de fêmeas amorosas
(quem não sabe, em bordéis não é versado)
sejam fritas as línguas mais maldosas.
senhor, passai depois cada bocado,
se tamiz, saco ou filtro haveis falhado
pelo fundo de bragas pegajosas;
mas antes, dos suínos no cagado
sejam fritas as línguas mais maldosas.",fr_XX,pt_XX,"em água-régia, em rocha alcenica,
em orpimento, em salitre e cal viva,
em chumbo fervente para melhor as esmagar,
em fuligem e breu diluído em lixívia
feita de excrementos e urina de judeus,
em lavagens de pernas de mesas,
em raspas de pés e velhos sapatos,
em sangue de áspide e drogas venenosas,
em fel de lobos, raposas e doninhas,
sejam fritas essas línguas enfadonhas!
em miolos de gato que odeia pescar,
preto e tão velho que não tem dente na gengiva,
de uma manhã velha, que também vale a pena cagar,
totalmente enraivecido, em sua baba e saliva,
na espuma de uma mula ofegante,
esquartejada finamente com bons cortes,
em água onde ratos mergulham focinhos e focinhos,
rãs, sapos e bestas perigosas,
serpentes, lagartos e tais aves nobres,
sejam fritas essas línguas enfadonhas!
em sublimado, perigoso de tocar
e no umbigo de uma cobra viva,
em sangue que se vê secar nos penas secas
sobre esses babuínos, quando a lua cheia chega,
um é preto, o outro mais verde que cipreste,
em cancro e fix e nesses ouros álveos
onde as criadas esfregam suas toalhas,
em pequenos banhos de meninas apaixonadas
- que não me envolvi nem segui as bordéus -
sejam fritas essas línguas enfadonhas!
príncipe, deixe de lado esses deliciosos pedaços,
sente-se, você não tem nem bolotas,
no fundo de um pântano encharcado,
mas antes na tronqueira dos porcos
sejam fritas essas línguas enfadonhas!",0
"dites-moi où, n’en quel pays,
est flora la belle romaine,
archipiades, ne thaïs,
qui fut sa cousine germaine,
echo, parlant quant bruit on mène
dessus rivière ou sur étang,
qui beauté eut trop plus qu’humaine?
mais où sont les neiges d’antan?
où est la très sage héloïs,
pour qui fut châtré et puis moine
pierre esbaillart à saint-denis?
pour son amour eut cette essoine.
semblablement, où est la roine
qui commanda que buridan
fût jeté en un sac en seine?
mais où sont les neiges d’antan?
la roine blanche comme un lis
qui chantait à voix de sirène,
berthe au grand pied, bietrix, aliz,
haramburgis qui tint le maine,
et jeanne, la bonne lorraine
qu’anglais brûlèrent à rouen ;
où sont-ils, où, vierge souvraine?
mais où sont les neiges d’antan?
prince, n’enquerrez de semaine
où elles sont, ni de cet an,
que ce refrain ne vous remaine:
mais où sont les neiges d’antan?","ora dizei-me em que país
flora estará, bela romana,
arquipiades ou taís
que sua prima foi germana.
eco a falar, quando um som plana
por rio ou lago, e que já tem o
dom de formosa mais que humana?
mas onde estão neves de antanho?
onde é mui sábia heloís
por quem castrado e monge pena
pedro balerdo em s. dinis?
amor lhe deu provação plena.
e assim também onde é que reina
essa que a buridan por banho
mandou deitar num saco ao sena?
mas onde estão neves de antanho?
rainha branca como um lis,
voz que a sereia em canto irmana,
berta pé-grande, alis, biatriz,
aremburgis que foi menana,
e de lorena a boa joana
qu’ingrês em ruão queimou no lenho.
onde estão, virgem soberana?
mas onde estão neves de antanho?
senhor, cuidar de ano ou semana
onde elas são, não voz traz ganho,
nem meu refrão a vós engana:
mas onde estão as neves de antanho?",fr_XX,pt_XX,"Dize-me onde, em qual país,
está Flora, a bela romana,
Arquipíades, nem Tais,
que foi sua prima-irmã,
Eco, falando quando se faz barulho
sobre o rio ou sobre o lago,
quem teve uma beleza mais do que humana?
Mas onde estão as neves do passado?
Onde está a muito sábia Heloísa,
para quem foi castrado e depois monge
Pedro Abelardo em Saint-Denis?
Por seu amor teve essa dor.
Da mesma forma, onde está a rainha
que ordenou que Buridan
fosse jogado em um saco no Sena?
Mas onde estão as neves do passado?
A rainha branca como um lírio
que cantava com voz de sereia,
Berta de grande pé, Beatriz, Aliz,
Haramburgis que segurava a mão,
e Joana, a boa lorenense
que os ingleses queimaram em Rouen;
onde estão eles, onde, virgem soberana?
Mas onde estão as neves do passado?
Príncipe, não pergunte da semana
onde estão elas, nem deste ano,
que este refrão permaneça com você:
Mas onde estão as neves do passado?",0
"dites-moi où, n’en quel pays,
est flora la belle romaine,
archipiades, ni thais,
qui fut sa cousine germaine,
écho parlant quand bruit on mène
dessus rivière ou sus étang,
qui beauté eut trop plus qu’humaine.
mais où sont les neiges d’antan ?
où est la très sage hélois,
pour qui châtré fut et puis moine
pierre esbaillart à saint denis?
pour son amour eut cette essoyne.
semblablement où est la reine
qui commanda que buridan
fut jeté en un sac en seine?
mais où sont les neiges d’antan?
la reine blanche comme lys
qui chantait à voix de sirène,
berthe au grand pied, bietris, alis,
haremburgis qui tint le maine,
et jeanne la bonne lorraine
qu’anglais brulèrent à rouen ;
où sont-ils, où, vierge souv’raine?
mais où sont les neiges d’antan?
prince, n’enquerrez de semaine
où elles sont, ni de cet an,
qu’à ce refrain ne vous ramène:
mais où sont les neiges d’antan?","dizei-me em que terra ou país
está flora, a bela romana;
onde arquipíada ou taís,
que foi sua prima germana;
eco, a imitar na água que mana
de rio ou lago, a voz que a aflora,
e de beleza sobre-humana?
mas onde estais, neves de outrora?
e heloísa, a mui sábia e infeliz
pela qual foi enclausurado
pedro abelardo em são denis,
por seu amor sacrificado?
onde, igualmente, a soberana
que a buridan mandou pôr fora
num saco ao sena arremessado?
mas onde estais, neves de outrora?
branca, a rainha, mãe de luís
que com voz divina cantava;
berta pé-grande, alix, beatriz
e a que no maine dominava;
e a boa lorena joana,
queimada em ruão? nossa senhora!
onde estão, virgem soberana?
mas onde estais, neves de outrora?
príncipe, vede, o caso é urgente:
onde estão elas, vede-o agora;
que este refrão guardeis em mente:
onde estão as neves de outrora?",fr_XX,pt_XX,"Dizei-me onde, em que país,
está Flora, a bela romana,
Arquipíades, nem Tais,
que foi sua prima-irmã,
Eco falante quando se faz barulho
sobre o rio ou sobre a lagoa,
que beleza tinha mais do que humana.
Mas onde estão as neves do passado?
Onde está a muito sábia Heloísa,
por quem Pedro Abelardo foi castrado e depois monge
em Saint-Denis?
Por seu amor passou por essa provação.
Da mesma forma, onde está a rainha
que ordenou que Buridan
fosse atirado num saco no Sena?
Mas onde estão as neves do passado?
A rainha branca como o lírio
que cantava com voz de sereia,
Berta de grande pé, Beatriz, Alice,
Haremburges que governou a Maine,
e Joana, a boa lorenense
que os ingleses queimaram em Ruão;
onde estão elas, onde, virgem soberana?
Mas onde estão as neves do passado?
Príncipe, não pergunteis a cada semana
onde elas estão, nem deste ano,
até que esse refrão vos traga de volta:
Mas onde estão as neves do passado?",0
"je congnois bien mouches en laict;
je congnois à la robe l’homme;
je congnois le beau temps du lait;
je congnois au pommier la pomme;
je congnois l’arbre à veoir la gomme;
je congnois quant tout est de mesmes;
je congnois qui besoigne ou chomme;
je congnois tout fors que moy mesmes.
je congnois pourpoint au collet;
je congnois le moyne à la gonne;
je congnois le maistre au varlet;
je congnois au voile la nonne;
je congnois quant pipeur jargonne;
je congnois fols nourris de cresmes;
je congnois le vin à la tonne;
je congnois tout fors que moy mesmes.
je congnois cheval et mulet;
je congnois leur charge et leur somme;
je congnois bietrix et bellet;
je congnois get qui nombre et somme;
je congnois visïon et somme;
je congnois la faulte des boesmes;
je congnois le pouoir de romme;
je congnois tout fors que moy mesmes.
envoi
prince, je congnois tout en somme;
je congnois coulores et blesmes;
je congnois mort qui nout consomme;
je congnois tout fors que moy mesmes.","conheço se há moscas no leite,
conheço pela roupa o homem,
conheço o tédio e o deleite,
conheço a fartura e a fome,
conheço a mulher pelo enfeite,
conheço o princípio e o fim,
conheço pela chama o azeite,
conheço tudo, menos a mim.
conheço o gibão pela gola,
conheço o rico pelo anel,
conheço o fiel pela sacola,
conheço a monja pelo véu,
conheço o porco pela tripa,
conheço o irmão pelo latim,
conheço o vinho pela pipa,
conheço tudo, menos a mim.
conheço a mula e o cavalo,
conheço o carro e a carreta,
conheço a galinha e o galo,
conheço o sino e a sineta,
conheço a flor pelo talo,
conheço abel e caim,
conheço o pote e o gargalo,
conheço tudo, menos a mim.
ofertório
príncipe, conheço tudo em suma,
conheço o branco e o carmim,
e a morte que o fim consuma.
conheço tudo, menos a mim.",fr_XX,pt_XX,"Conheço bem moscas em leite;
Conheço pelo traje o homem;
Conheço o belo tempo do leite;
Conheço pela macieira a maçã;
Conheço a árvore ao ver a seiva;
Conheço quando tudo está igual;
Conheço quem trabalha ou descansa;
Conheço tudo, exceto eu mesmo.
Conheço o colete com gola;
Conheço o monge pela saia;
Conheço o mestre pelo criado;
Conheço pela vela a freira;
Conheço quando o tagarela fala;
Conheço loucos alimentados com cremes;
Conheço o vinho no tonel;
Conheço tudo, exceto eu mesmo.
Conheço cavalo e mula;
Conheço sua carga e peso;
Conheço a beterraba e a beterraba amarela;
Conheço quem conta e soma;
Conheço visão e sono;
Conheço o erro dos bosques;
Conheço o poder de Roma;
Conheço tudo, exceto eu mesmo.
envio
príncipe, conheço tudo resumidamente;
Conheço cores e feridas;
Conheço a morte que nos consome;
Conheço tudo, exceto eu mesmo.",0
