original_poem,translated_poem,src_lang,tgt_lang
"Eu canto porque o instante existe
e a minha vida está completa.
Não sou alegre nem sou triste:
sou poeta.

Irmão das coisas fugidias,
não sinto gozo nem tormento.
Atravesso noites e dias
no vento.

Se desmorono ou se edifico,
se permaneço ou me desfaço,
— não sei, não sei. Não sei se fico
ou passo.

Sei que canto. E a canção é tudo.
Tem sangue eterno a asa ritmada.
E um dia sei que estarei mudo:
— mais nada.","I sing because the moment exists
And my life is complete.
I am not gay, I am not sad:
I am a poet.

Brother of fugitive things,
I feel no delight or torment.
I cross nights and days
In the wind.

Whether I destroy or build,
Whether I persist or disperse,
— I don´t know, I don´t know.
I don´t know if I stay or go.

I know that I sing.
The song is everything.
The rhythmic wing has eternal blood,
And I know that one day I shall be dumb:
— Nothing more.",pt_XX,en_XX